title,category,publish_date,author,article_url,content,summary
"Ricuh Usai Sidang Vonis SYL, Ada Wartawan Hampir Kena Tendang",detikNews,2024-07-11,Mulia Budi,https://news.detik.com/berita/d-7434117/ricuh-usai-sidang-vonis-syl-ada-wartawan-hampir-kena-tendang,"Sidang vonis mantan Menteri Pertanian Syahrul Yasin Limpo (SYL) ricuh setelah hakim membacakan putusan. Ricuh terjadi antara wartawan dan ormas pendukung SYL. ""Ada ormas-ormas pro-SYL. Pokoknya mereka sepakat, kalau SYL keluar mereka akan tertib, mereka akan buka jalan. Tapi nyatanya pas mereka keluar, mereka berdesakan. Berdesakan,"" kata salah satu wartawan TV, Bodhiya Vimala, seusai sidang di Pengadilan Tipikor Jakarta, Kamis 11 Juli 2024. Dia mengatakan sempat dikejar ormas pendukung SYL dari lobi hingga pintu lorong samping pengadilan. Dia mengaku terpancing emosi lantaran kameranya juga rusak imbas ricuh tersebut.    ""Iya dikejar-kejar. Gue juga tadi liat lagi, karena gue panas alat gue rusak, ya panaslah maksudnya emosi, terus gue teriak lagi 'koruptor' gitu. Mereka nggak sukalah kayaknya. Ya udah gue dikejar sampai sana. Gue dikejar,"" ujarnya. Lebih lanjut, dia mengatakan hampir terkena tendangan saat pengejaran tersebut. Dia mengatakan ada wartawan lain yang kameranya rusak. ""Gue bertahan, mereka ramai. Sudah ditendang, tapi nggak kena aja sih,"" ujarnya Sebelumnya, mantan Menteri Pertanian Syahrul Yasin Limpo (SYL) divonis 10 tahun penjara di kasus pemerasan anak buah. Pagar pembatas di ruang sidang rusak usai sidang. Pantauan detikcom di lokasi, Kamis 11 Juli 2024, SYL awalnya hendak dibawa ke luar ruang sidang seusai pembacaan vonis selesai. Polisi terlihat bersiap mengawal SYL. Saat SYL dibawa ke luar ruang sidang, ada pengunjung yang berusaha bersalaman dengan SYL. Suasana di luar ruang sidang tidak kondusif. Sejumlah pendukung SYL terlihat saling dorong saat berupaya mendekat ke SYL. SYL pun terlihat tidak bisa dibawa ke luar dari gedung pengadilan. Polisi dan petugas pengawalan KPK kemudian membawa lagi SYL ke dalam ruang sidang. Situasi saling berdesakan tetap terjadi di dalam ruang sidang hingga menyebabkan pagar pembatas rusak.","Sidang vonis mantan Menteri Pertanian Syahrul Yasin Limpo (SYL) ricuh setelah hakim membacakan putusan. Ricuh terjadi antara wartawan dan ormas pendukung SYL. "" Pokoknya mereka sepakat, kalau SYL keluar mereka akan tertib, mereka akan buka jalan. Dia mengaku terpancing emosi lantaran kameranya juga rusak imbas ricuh tersebut. Sudah ditendang, tapi nggak kena aja sih,"" ujarnya Sebelumnya, mantan Menteri Pertanian Syahrul Yasin Limpo (SYL) divonis 10 tahun penjara di kasus pemerasan anak buah. Pantauan detikcom di lokasi, Kamis 11 Juli 2024, SYL awalnya hendak dibawa ke luar ruang sidang seusai pembacaan vonis selesai. Sejumlah pendukung SYL terlihat saling dorong saat berupaya mendekat ke SYL. SYL pun terlihat tidak bisa dibawa ke luar dari gedung pengadilan. Polisi dan petugas pengawalan KPK kemudian membawa lagi SYL ke dalam ruang sidang. Situasi saling berdesakan tetap terjadi di dalam ruang sidang hingga menyebabkan pagar pembatas rusak."
"Ada Sudirman Loop Sabtu 13 Juli, Jalan Sudirman Jakpus Akan Disterilkan",detikNews,2024-07-11,Wildan Noviansah,https://news.detik.com/berita/d-7434041/ada-sudirman-loop-sabtu-13-juli-jalan-sudirman-jakpus-akan-disterilkan,"Polri menggelar balap sepeda atau Sudirman Loop dalam rangka HUT Bhayangkara ke-78 akhir pekan ini. Arus lalu lintas di Jalan Jenderal Sudirman, Jakarta Pusat, bakal disterilkan. ""Jalan Jenderal Sudirman akan disterilkan. Diimbau bagi pengendara yang melintas tetap ikuti arahan petugas di lapangan. Mohon maaf atas ketidaknyamanannya,"" kata Dirlantas Polda Metro Jaya Kombes Latif Usman dalam keterangannya, Kamis 11 Juli 2024. Pihak kepolisian akan mengalihkan arus lalu lintas. Pengalihan lalu lintas dimulai pukul 03.00 WIB hingga 11.00 WIB.    Berikut ini skema rekayasa lalu lintas yang dilakukan: 1. Arus lalu lintas dari arah Jalan MH Thamrin yang menuju Jalan Jenderal Sudirman dialihkan ke Jalan Imam Bonjol2. Arus lalu lintas dari arah Jalan Imam Bonjol yang menuju Jalan Bundaran HI dan Jalan Pamekasan dialihkan ke Jalan Agus Salim dan arus lalu lintas dari arah Jalan Agus Salim yang menuju Jalan Bundaran HI dan Jalan Pamekasan dialihkan ke Jalan Imam Bonjol3. Arus lalu lintas dari arah Jalan Galunggung yang menuju Jalan Jenderal Sudirman dialihkan kembali ke Jalan Galunggung4. Arus lalu lintas dari arah Jalan Prof. Dr. Satrio atau Casablanca yang menuju jalan Jenderal Sudirman dialihkan ke jalan KH Mas Mansyur atau Tanah Abang5. Arus lalu lintas dari arah Jalan KH Mas Mansyur yang menuju Jenderal Sudirman dialihkan kembali ke Jalan KH Mas Mansyur6. Arus lalu lintas dari arah Jalan Benhil yang menuju Jalan Jenderal Sudirman dialihkan kembali ke jalan Benhil7. Arus lalu lintas dari arah arah Barat Gatot Subroto yang menuju Jalan Jenderal Sudirman diluruskan ke Jalan Gatot Subroto arah timur dan Arus lalu lintas dari arah timur Gatot Subroto yang menuju jalan Jenderal Sudirman diluruskan ke Jalan Gatot Subroto Arah Barat 8. Arus lalu lintas dari arah Jalan Pintu 1 Senayan yang menuju Jalan Jenderal Sudirman dialihkan kembali ke Jalan Pintu 1 Senayan9. Arus lalu lintas dari arah Jalan Senopati yang menuju Jalan Jenderal Sudirman dialihkan ke Jalan Sisingamangaraja atau Jalan Hang Lekir10. Arus lalu lintas dari arah Jalan Pattimura yang menuju Jalan Jenderal Sudirman dialihkan ke Jalan Sisingamangaraja atau Jalan Hang Lekir11. Arus lalu lintas dari arah Jalan Sisingamangaraja yang menuju Jalan Jenderal Sudirman dialihkan ke Jalan Hang Lekir12. Arus lalu lintas dari arah Jalan Asia Afrika yang menuju Jalan Jenderal Sudirman dialihkan ke Jalan Hang Lekir.","Polri menggelar balap sepeda atau Sudirman Loop dalam rangka HUT Bhayangkara ke-78 akhir pekan ini. Arus lalu lintas di Jalan Jenderal Sudirman, Jakarta Pusat, bakal disterilkan. "" Diimbau bagi pengendara yang melintas tetap ikuti arahan petugas di lapangan. Mohon maaf atas ketidaknyamanannya,"" kata Dirlantas Polda Metro Jaya Kombes Latif Usman dalam keterangannya, Kamis 11 Juli 2024. Pihak kepolisian akan mengalihkan arus lalu lintas. Pengalihan lalu lintas dimulai pukul 03.00 WIB hingga 11.00 WIB. Berikut ini skema rekayasa lalu lintas yang dilakukan: 1. Arus lalu lintas dari arah Jalan Imam Bonjol yang menuju Jalan Bundaran HI dan Jalan Pamekasan dialihkan ke Jalan Agus Salim dan arus lalu lintas dari arah Jalan Agus Salim yang menuju Jalan Bundaran HI dan Jalan Pamekasan dialihkan ke Jalan Imam Bonjol3. Arus lalu lintas dari arah Jalan Prof. Dr. Satrio atau Casablanca yang menuju jalan Jenderal Sudirman dialihkan ke jalan KH Mas Mansyur atau Tanah Abang5. Arus lalu lintas dari arah Jalan Sisingamangaraja yang menuju Jalan Jenderal Sudirman dialihkan ke Jalan Hang Lekir12."
Polsek yang Dipimpin Nominator Hoegeng Awards 2023 Masuk Kompolnas Awards,detikNews,2024-07-11,Audrey Santoso,https://news.detik.com/berita/d-7434034/polsek-yang-dipimpin-nominator-hoegeng-awards-2023-masuk-kompolnas-awards,"Tim Kompolnas RI mengunjungi Mapolsek Mapanget, yang termasuk dalam wilayah hukum Sulawesi Utara (Sulut). Polsek yang dipimpin nominator 3 besar Hoegeng Awards 2023 Iptu Lesly D Lihawa ini, masuk 10 besar Polsek Tipe A berprestasi dalam Kompolnas Awards 2024. Dipimpin Ketua Harian Kompolnas RI Benny Josua Mamoto dan komisioner Kompolnas Mohammad Dawam, didampingi Djumiyanti Rahayu dan Flamanda Jeine Tampumori, tim mendengarkan paparan terkait capaian program, inovasi serta penanganan kamtibmas di wilayah Mapanget yang disampaikan Iptu Lesly. Dalam kurun waktu 6 bulan, ucap Iptu Lesly, Unit Reserse berhasil mengamankan 8 anak-anak yang sering mengkonsumsi lem ehabon, di mana 5 di antaranya sudah direhabilitasi dengan menggandeng Yayasan Bunga Bakung Manado. ""Berawal dari pengungkapan kasus oleh Unit Reserse Polsek, kemudian kami melakukan pengembangan, rupanya banyak anak-anak remaja mengkonsumsi lem ehabon. Dari sinilah kami terinspirasi untuk merehabilisasi para remaja yang terjaring menghisap lem ehabon bekerja sama dengan Yayasan Bunga Bakung,"" tutur Iptu Lesty, yang merupakan 3 besar Kategori Polisi Pelindung Perempuan dan Anak (PPA) Hoegeng Awards 2023 ini, dikutip dari keterangan tertulis Kompolnas, Kamis 11 Juli 2024.    Iptu Lesly mengaku bersyukur dengan kedatangan tim Kompolnas. Dia optimis inovasi yang dirintisnya ini dapat memperoleh hasil terbaik pada Kompolnas Award 2024. ""Bersyukur acara ini dapat berlangsung dengan baik dan mendapatkan respon baik dari Kompolnas. Dari 360-an, Polsek Mapanget sudah masuk 10 besar. Kita tentunya optimis mewakili Polda Sulut, kita akan mendapatkan yang terbaik,"" ungkap Iptu Lesly. Baca juga: Kompolnas Cek Inovasi Layanan Publik Polsek Perbatasan NTT-Timor LesteSementara itu, Benny Mamoto selaku Ketua Dewan Juri Kompolnas Award 2024, menerangkan Kompolnas Award 2024 merupakan sarana pemilihan untuk pemberian penghargaan kepada satuan wilayah (polda, polres, polsek) dan satuan kerja (satker) Mabes Polri, yang melaksanakan pelayanan publik berdampak yang diharapkan bisa berkelanjutan inovasi-inovasi positif yang sudah berjalan. ""Kompolnas Award merupakan sarana bagi Kompolnas untuk melakukan penilaian kinerja satwil dan satker Mabes Polri, sesuai dengan tujuan Kompolnas untuk mewujudkan polri yang profesional dan mandiri,"" terang Benny. Pada kesempatan yang sama Mohammad Dawam, Benny menilai masuknya Polsek Mapanget ke 10 besar Kompolnas Awards sendiri merupakan prestasi membanggakan. Dawam menyebut kunjungan ini merupakan bagian dari pengecekan langsung atas program-program yang telah dipaparkan pihak polsek. ""Ini menjadi prestasi yang patut dibanggakan, kita melakukan visitasi ini untuk melihat secara langsung apa yang ditulis dan dipaparkan terlaksana secara riil. Dan kami juga mau melihat bagaimana inovasi yang dibuat di sini bisa berkelanjutan dan bermanfaat bagi masyarakat,"" ujarnya. Salah satu dewan juri Kompolnas Awards ini menekankan Program Inovasi Rehabilitasi Bagi Pengonsumsi Lem Ehabon ini patut dikembangkan. Sehingga, lanjut dia, ke depan dapat diteruskan oelh siapapun yang memimpin polsek ini. ""Sebab Polsek Mapanget ini yang mengusulkan kapolresnya, maka kami ingin mendapatkan alasan kuat paling mendasar mengapa Polsek Mapanget ini diusulkan sebagai Polsek terbaik di wilayah Polresta Manado ini,"" lanjut Dawam. Diketahui indikator-indikator penilaian Kompolnas Award di antaranya rasio penyelesaian SKM, indeks transformasi pengawasan, integritas satwil, kinerja operasional satwil, manajemen media, indeks transformasi pelayanan publik, indeks transformasi pelayanan publik dan kemampuan satwil dalam melakukan pemetaan potensi kerawanan pemilu/pilkada. Dalam kunjungan ini, tim Kompolnas yang didampingi Wakapolda Sulut, Brigjen Bahagia Dachi dan Irwasda Polda Sulut Kombes Bayu disambut dengan tradisi pengalungan tanda kehormatan oleh Iptu Lesly. Tradisi ini diiringi musik bambu dan Tarian Maengket. Iptu Lesly kemudian memaparkan program unggulan polseknya di hadapan para tokoh masyarakat, tokoh agama, aparat pemerintah baik lurah, camat, maupun danramil setempat.","Tim Kompolnas RI mengunjungi Mapolsek Mapanget, yang termasuk dalam wilayah hukum Sulawesi Utara (Sulut). Dari sinilah kami terinspirasi untuk merehabilisasi para remaja yang terjaring menghisap lem ehabon bekerja sama dengan Yayasan Bunga Bakung,"" tutur Iptu Lesty, yang merupakan 3 besar Kategori Polisi Pelindung Perempuan dan Anak (PPA) Hoegeng Awards 2023 ini, dikutip dari keterangan tertulis Kompolnas, Kamis 11 Juli 2024. Dia optimis inovasi yang dirintisnya ini dapat memperoleh hasil terbaik pada Kompolnas Award 2024. "" Bersyukur acara ini dapat berlangsung dengan baik dan mendapatkan respon baik dari Kompolnas. Baca juga: Kompolnas Cek Inovasi Layanan Publik Polsek Perbatasan NTT-Timor LesteSementara itu, Benny Mamoto selaku Ketua Dewan Juri Kompolnas Award 2024, menerangkan Kompolnas Award 2024 merupakan sarana pemilihan untuk pemberian penghargaan kepada satuan wilayah (polda, polres, polsek) dan satuan kerja (satker) Mabes Polri, yang melaksanakan pelayanan publik berdampak yang diharapkan bisa berkelanjutan inovasi-inovasi positif yang sudah berjalan. "" Dawam menyebut kunjungan ini merupakan bagian dari pengecekan langsung atas program-program yang telah dipaparkan pihak polsek. "" Ini menjadi prestasi yang patut dibanggakan, kita melakukan visitasi ini untuk melihat secara langsung apa yang ditulis dan dipaparkan terlaksana secara riil. Dan kami juga mau melihat bagaimana inovasi yang dibuat di sini bisa berkelanjutan dan bermanfaat bagi masyarakat,"" ujarnya. Salah satu dewan juri Kompolnas Awards ini menekankan Program Inovasi Rehabilitasi Bagi Pengonsumsi Lem Ehabon ini patut dikembangkan. Sehingga, lanjut dia, ke depan dapat diteruskan oelh siapapun yang memimpin polsek ini. "" Dalam kunjungan ini, tim Kompolnas yang didampingi Wakapolda Sulut, Brigjen Bahagia Dachi dan Irwasda Polda Sulut Kombes Bayu disambut dengan tradisi pengalungan tanda kehormatan oleh Iptu Lesly. Tradisi ini diiringi musik bambu dan Tarian Maengket."
Respons Jusuf Hamka Disodorkan Airlangga Dampingi Kaesang di Pilgub Jakarta,detikNews,2024-07-11,Maulana Ilhami Fawdi,https://news.detik.com/berita/d-7434736/respons-jusuf-hamka-disodorkan-airlangga-dampingi-kaesang-di-pilgub-jakarta,"Ketum Golkar Airlangga Hartarto mengusulkan duet Kaesang Pangarep dengan Jusuf Hamka atau Baba Alun di Pilgub Jakarta. Sosok pengusaha jalan tol itu justru baru mengetahui usulan tersebut. Jusuf Hamka mempersilakan pernyataan Airlangga kepada jajaran pengurus Golkar. Dia mengatakan baru mengetahui namanya diusulkan menjadi calon wakil gubernur di Pilgub Jakarta. ""Tanya beliau, saya juga baru tahu. Iya, wakil gubernur, di Jakarta katanya, nggak tahu ini saya justru baru tahu,"" kata Jusuf Hamka di kantor DPP Partai Golkar, Slipi, Jakarta Barat, Kamis 11 Juli 2024.    Ditanya soal kesiapannya ikut Pilgub Jakarta dan menjadi pendamping Kaesang Pangarep, Jusuf Hamka hanya membalas dengan tawa. Lebih jauh, Jusuf Hamka mengakui dirinya memang kader Partai Golkar sejak dulu. ""Wah saya sudah lama dari tahun '60 sekian,"" katanya. Sebelumnya, Ketum Golkar Airlangga Hartarto menyodorkan kadernya, Jusuf Hamka atau Baba Alun, untuk Ketum PSI Kaesang Pangarep jika maju di Pilkada Jakarta. Menurutnya, Jusuf Hamka mampu mengatasi persoalan di Jakarta, terutama kemacetan. Airlangga mengatakan permasalahan utama Jakarta adalah infrastruktur. Airlangga menyebut Jusuf Hamka sebagai bos jalan tol memahami persoalan infrastruktur di Jakarta. ""Khusus untuk Jakarta Partai Golkar tentu melihat tantangan Jakarta itu besar sekali, Jakarta dengan penduduk 10 juta itu, kita harus bisa mengalahkan Thailand, Bangkok, untuk mengatasi kemacetan, sehingga tantangan utama Jakarta adalah infrastruktur,"" kata Airlangga di DPP Golkar, Slipi, Jakarta Barat, Kamis 11 Juli 2024. Oleh karena itu, Airlangga menyodorkan Jusuf Hamka untuk cawagub, jika Kaesang maju di Pilkada Jakarta. ""Untuk mendukung mas Ketum Mas Kaesang, seandainya beliau memilih Jakarta saya siapkan kader Partai Golkar yang sudah malang melintang di infrastruktur yaitu Baba Alun,"" jelasnya.  Simak Video 'Kalau Kaesang Maju di Pilgub Jakarta, Golkar Siapkan Jusuf Hamka':   ","Ketum Golkar Airlangga Hartarto mengusulkan duet Kaesang Pangarep dengan Jusuf Hamka atau Baba Alun di Pilgub Jakarta. Sosok pengusaha jalan tol itu justru baru mengetahui usulan tersebut. Iya, wakil gubernur, di Jakarta katanya, nggak tahu ini saya justru baru tahu,"" kata Jusuf Hamka di kantor DPP Partai Golkar, Slipi, Jakarta Barat, Kamis 11 Juli 2024. Sebelumnya, Ketum Golkar Airlangga Hartarto menyodorkan kadernya, Jusuf Hamka atau Baba Alun, untuk Ketum PSI Kaesang Pangarep jika maju di Pilkada Jakarta. Menurutnya, Jusuf Hamka mampu mengatasi persoalan di Jakarta, terutama kemacetan. Airlangga mengatakan permasalahan utama Jakarta adalah infrastruktur. Untuk mendukung mas Ketum Mas Kaesang, seandainya beliau memilih Jakarta saya siapkan kader Partai Golkar yang sudah malang melintang di infrastruktur yaitu Baba Alun,"" jelasnya. Simak Video 'Kalau Kaesang Maju di Pilgub Jakarta, Golkar Siapkan Jusuf Hamka':"
"Pansus Haji Izin ke Pimpinan Rapat di Masa Reses, Bakal Investigasi ke Saudi",detikNews,2024-07-11,Dwi Rahmawati,https://news.detik.com/berita/d-7434641/pansus-haji-izin-ke-pimpinan-rapat-di-masa-reses-bakal-investigasi-ke-saudi,"DPR RI menyepakati pembentukan dan susunan nama keanggotaan panitia khusus (pansus) angket pengawasan haji dalam rapat paripurna ke-21. Anggota pansus hak angket pengawasan haji, Marwan Dasopang, mengatakan akan meminta izin kepada pimpinan untuk menggelar rapat di masa reses. ""Belum (struktur pansus), baru keputusan paripurna, kan. Karena belum ada sekretariatnya, tentu nanti dari kesekjenan akan mengundang anggota pansus yang sudah dibacakan di paripurna, dan nanti kita rapat,"" kata Marwan di Kompleks Parlemen, Senayan, Jakarta, Kamis 11 Juli 2024. Marwan menyebut akan menggelar sidang di masa reses. Pihaknya juga akan menyampaikan sejumlah temuan yang diterima oleh pansus haji.    ""Setelah itu, ya mungkin, karena waktunya sempit akan memakai masa reses untuk bersidang. Jadi kita prosedurnya minta izin ke pimpinan memakai masa reses untuk persidangan,"" ujar Marwan. ""Itu nanti akan membuat lingkup ya. Ini kan pansusnya angket, maka daftar pertanyaannya akan kita susun, berdasarkan temuan-temuan yang sudah didapatkan pada saat Timwas bekerja,"" sambungnya. Dia mengatakan pansus bakal memanggil pihak terkait, yakin Menteri Agama (Menag) Yaqut Cholil Qoumas hingga Badan Pengelola Keuangan Haji (BPKH). Pihaknya akan mempertanyakan soal pembagian kuota haji. ""Tentu nanti kita akan panggil Menteri Agama. Menteri Agama mungkin saja akan mengikutsertakan aparaturnya. Kemudian terkait kuota tadi kita akan panggil juga BPKH, kemudian akan kita perdalam juga kuota ini akan dikasih ke siapa?"" ujar Marwan. Dia menyebut pansus haji akan mendalami soal perlindungan jemaah di Tanah Suci. Termasuk unsur dari Kemenlu hingga pihak Imigrasi. ""Tentang perlindungan jemaah, perlindungan rakyat Indonesia di luar negeri, tentu kita panggil Kemenlu. Tentang perlintasan masyarakat Indonesia yang bepergian tentu kita panggil Imigrasi,"" tutur Wakil Ketua Komisi VIII DPR RI itu. ""Karena berhaji ini tidak mungkin diurus Kemenag sendiri, ada unsur-unsur penyelamatan rakyat Indonesia, perlindungan, itu sebagaimana di undang-undang menyebutkan. Jadi harus ada Kemenlu,"" imbuhnya. Marwan mengatakan pihaknya juga akan melakukan investigasi ke Arab Saudi. Dia mengatakan pansus haji tidak menutup kemungkinan akan berkunjung ke Arab Saudi. ""Mungkin juga akan mengunjungi Arab juga. Kalau keterangannya seperti ini nggak dapat tambahan, tentu kita kejar ke sana. Betul nggak seperti itu? Kalau pemerintah tidak kasih dokumen ke kita, tentu kita kejar ke sana,"" imbuhnya. DPR RI menyepakati pembentukan dan susunan nama keanggotaan panitia khusus (pansus) angket pengawasan haji dalam rapat paripurna ke-21. Pansus angket itu berisikan 30 anggota Dewan dari seluruh fraksi DPR RI.Mulanya pengusul hak angket pansus haji, Selly Andriany Gantina, menyampaikan sederet pertimbangan pembentukan Pansus angket ini. Ia mengatakan pembagian kuota haji oleh Kemenag tak seusai dengan penetapan yang sudah dilakukan pemerintah dan DPR dalam hal ini Komisi VII DPR RI. ""Bahwa kuota haji khusus ditetapkan sebesar 8 persen dari kuota haji Indonesia sehingga keputusan Menag No 118 Tahun 2024 tentang petunjuk pelaksanaan pemenuhan kuota haji khusus tambahan dan sisa kuota haji 2024 bertentangan dengan UU dan tak sesuai dengan hasil kesimpulan rapat Panja Komisi VIII dengan Menag terkait penetapan BPIH,"" kata Selly. Ia mengatakan masih ada permasalahan layanan bagi jemaah haji di Arab Saudi. ia menyoroti soal tenda yang tak sesuai dengan kapasitas hingga katering bagi jemaah. ""Perlu kami sampaikan pimpinan bahwa yang telah menandatangani (hak angket) bukan 31, tetapi sudah menjadi 35 anggota dan semua resmi dan akan saya sampaikan, lebih dari dua fraksi,"" kata Selly. Dalam kesempatan itu, Wakil Ketua DPR RI Muhaimin Iskandar atau Cak Imin meminta persetujuan kepada semua anggota DPR. Ia menanyakan apakah pembentukan hak angket Pansus Haji ini dapat disetujui. Anggota DPR menjawab setuju. Pembentukan hak panitia khusus angket pengawasan haji resmi dibentuk.  Simak Video 'Penjelasan Puan soal Pembentukan Pansus Angket Haji':   ","DPR RI menyepakati pembentukan dan susunan nama keanggotaan panitia khusus (pansus) angket pengawasan haji dalam rapat paripurna ke-21. Anggota pansus hak angket pengawasan haji, Marwan Dasopang, mengatakan akan meminta izin kepada pimpinan untuk menggelar rapat di masa reses. "" Belum (struktur pansus), baru keputusan paripurna, kan. Karena belum ada sekretariatnya, tentu nanti dari kesekjenan akan mengundang anggota pansus yang sudah dibacakan di paripurna, dan nanti kita rapat,"" kata Marwan di Kompleks Parlemen, Senayan, Jakarta, Kamis 11 Juli 2024. Jadi kita prosedurnya minta izin ke pimpinan memakai masa reses untuk persidangan,"" ujar Marwan. "" Tentu nanti kita akan panggil Menteri Agama. Menteri Agama mungkin saja akan mengikutsertakan aparaturnya. Dia menyebut pansus haji akan mendalami soal perlindungan jemaah di Tanah Suci. Termasuk unsur dari Kemenlu hingga pihak Imigrasi. "" Tentang perlindungan jemaah, perlindungan rakyat Indonesia di luar negeri, tentu kita panggil Kemenlu. Karena berhaji ini tidak mungkin diurus Kemenag sendiri, ada unsur-unsur penyelamatan rakyat Indonesia, perlindungan, itu sebagaimana di undang-undang menyebutkan. Marwan mengatakan pihaknya juga akan melakukan investigasi ke Arab Saudi. Kalau keterangannya seperti ini nggak dapat tambahan, tentu kita kejar ke sana. Ia mengatakan pembagian kuota haji oleh Kemenag tak seusai dengan penetapan yang sudah dilakukan pemerintah dan DPR dalam hal ini Komisi VII DPR RI. "" ia menyoroti soal tenda yang tak sesuai dengan kapasitas hingga katering bagi jemaah. "" Perlu kami sampaikan pimpinan bahwa yang telah menandatangani (hak angket) bukan 31, tetapi sudah menjadi 35 anggota dan semua resmi dan akan saya sampaikan, lebih dari dua fraksi,"" kata Selly. Ia menanyakan apakah pembentukan hak angket Pansus Haji ini dapat disetujui."
"Syarat KTP Boleh Diganti dengan yang Baru, Cek Penjelasannya!",detikNews,2024-07-11,Kanya Anindita Mutiarasari,https://news.detik.com/berita/d-7434445/syarat-ktp-boleh-diganti-dengan-yang-baru-cek-penjelasannya,"Kartu Tanda Penduduk (KTP) elektronik atau e-KTP atau KTP-el dalam kondisi tertentu diperbolehkan untuk diganti dengan yang baru. Pergantian KTP baru dapat dilakukan di Dinas Dukcapil setempat. Berikut syarat ganti KTP baru menurut pihak Kemendagri. KTP elektronik dapat diganti apabila memenuhi syarat tertentu. Berikut empat syarat KTP lama boleh diganti dengan KTP baru.    Masyarakat yang ingin mengganti KTP dapat mendatangi Dinas Dukcapil setempat sesuai domisili tempat tinggal. Berikut adalah prosedur penggantian KTP baru. Di beberapa wilayah, mengurus KTP baru sudah bisa dilakukan di tingkat kelurahan. Pihak yang bersangkutan diimbau untuk mengurus sendiri di Dinas Dukcapil setempat tanpa perantara calo, sebab, layanan ini gratis tanpa pungutan biaya apapun. Selain itu, pengurusan e-KTP baru juga mudah, karena: Bagi masyarakat yang ingin mengganti foto KTP-el, ada beberapa syarat dan ketentuan yang harus dipenuhi. Simak poin-poin di bawah ini. Pemilik KTP boleh mengganti foto di KTP-el dengan membuat foto terbaru di Dinas Dukcapil terdekat. Ini dokumen yang harus dibawa. Jika foto KTP-el sudah diganti dengan yang baru, usahakan untuk menjaganya baik-baik agar tidak cepat rusak maupun terkelupas.  Simak juga 'Saat Pemerintah Siapkan Aplikasi INA, Permudah Masyarakat Dapatkan KTP Digital':   ","Kartu Tanda Penduduk (KTP) elektronik atau e-KTP atau KTP-el dalam kondisi tertentu diperbolehkan untuk diganti dengan yang baru. KTP elektronik dapat diganti apabila memenuhi syarat tertentu. Berikut empat syarat KTP lama boleh diganti dengan KTP baru. Di beberapa wilayah, mengurus KTP baru sudah bisa dilakukan di tingkat kelurahan. Pihak yang bersangkutan diimbau untuk mengurus sendiri di Dinas Dukcapil setempat tanpa perantara calo, sebab, layanan ini gratis tanpa pungutan biaya apapun. Pemilik KTP boleh mengganti foto di KTP-el dengan membuat foto terbaru di Dinas Dukcapil terdekat. Simak juga 'Saat Pemerintah Siapkan Aplikasi INA, Permudah Masyarakat Dapatkan KTP Digital':"
