title,category,publish_date,author,article_url,content,summary
"Kata Habiburokhman, Hasto Harusnya Malu Usai Ungkit Rekaman Jokowi di 2019",detikNews,2024-08-19,Wilda Hayatun Nufus,https://news.detik.com/berita/d-7496827/kata-habiburokhman-hasto-harusnya-malu-usai-ungkit-rekaman-jokowi-di-2019,"Waketum Partai Gerindra, Habiburokhman, menanggapi tudingan Sekjen PDIP Hasto Kristiyanto yang menyebut Presiden Joko Widodo (Jokowi) membisiki penegak hukum untuk menekan suatu pihak saat berpidato di acara Forkopimda 2019. Habiburokhman menilai semestinya Hasto sebagai sekjen dari partai besar tidak ceroboh dalam berkomunikasi. ""Sekjen partai besar harusnya jangan ceroboh dalam berkomunikasi,"" kata Habiburokhman kepada wartawan, Minggu 18 Agustus 2024. Adapun Hasto membagikan rekaman video kepada wartawan yang berisi sambutan Jokowi saat acara Forkopimda 2019 dan menuding adanya upaya Jokowi membisiki penegak hukum untuk melakukan intimidasi.    Habiburokhman mengaku heran Hasto tidak mengecek terlebih dahulu konteks pernyataan Jokowi itu. Dia menyebut seharusnya, Hasto saat ini malu karena pernyataan Jokowi itu bukan untuk mengintervensi hukum, tapi mengingatkan agar penegak hukum tidak mencari-cari kesalahan. ""Kenapa beliau tidak cek dulu apa konteks pernyataan Pak Jokowi. Sekarang kan dia harusnya malu karena yang dimaksud Pak Jokowi bukanlah mengintervensi hukum, tapi justru mengingatkan agar penegak hukum tidak mencari-cari kesalahan,"" kata Habiburokhman. Habiburokhman juga mengaku kasihan Hasto dibully di media sosial akibat pernyataannya sendiri. Dia menilai gaya komunikasi Hasto kurang baik hingga menimbulkan kesan menjadi beban bagi PDIP. "" Kasihan juga Pak Hasto jadinya dibully di media sosial. Kesannya beliau jadi beban bagi PDIP dan Ibu Megawati karena gaya komunikasinya kurang baik,"" ujarnya. Sebelumnya, Hasto mengungkit rekaman suara yang diduga merupakan suara Presiden Jokowi. Dalam rekaman itu Jokowi berbicara mengenai upaya hukum dengan membisiki KPK, Jaksa Agung, hingga Kapolri. Hasto awalnya menjawab pertanyaan wartawan perihal Ketum Partai NasDem, Surya Paloh, yang menyatakan NasDem tak akan mengusung Anies Baswedan di Pilgub Jakarta 2024. Dia menjawab jika itu bukan kebiasaan Paloh, namun PDIP tak akan ikut campur. Hasto menilai rakyat melihat pencabutan pengusungan Anies oleh NasDem sebagai hal yang tak biasa dan seperti ada yang ditutupi. Setelah itu, Hasto menyinggung tentang adanya upaya menekan. ""Ini merupakan bagian kita lihat dari berbagai upaya-upaya yang mencoba menekan. Tadi kan beredar video kan bagaimana Pak Jokowi mengatakan akan menggunakan hukum dan kemudian melakukan pembisikan kepada Ketua KPK, kepada Jaksa Agung, Kapolri, itu tadi video yang saya terima. Apakah rekan-rekan wartawan sudah mendengar itu atau belum itu harus diklarifikasi oleh Bapak Presiden karena ini berbahaya di dalam demokrasi dan penegakan hukum itu sekiranya hal tersebut benar. Udah pada mendengar belum?"" kata Hasto di Sekolah Partai, Lenteng Agung, Jakarta Selatan, Sabtu 17 Agustus. Saat mengetahui wartawan belum tahu video tersebut, Hasto mengeluarkan handphone-nya lalu memperlihatkan rekaman suara Jokowi itu. Namun Hasto tak menjelaskan perihal apa dan kapan konteks ucapan Jokowi tersebut. Berikut isi rekaman suara Jokowi yang ditunjukkan Hasto: Jangan main-main, yang gigit saya sendiri. Lewat cara saya, bisa lewat KPK, bisa. Bisa lewat Polri, bisa lewat Kejaksaan akan saya bisikin aja, di sana ada yang main-main. Ya masa saya mau ngintip sendiri kan ndak mungkin. Berdasarkan catatan detikcom, ucapan Jokowi tersebut pernah diucapkan pada 2019 saat Rakornas Forkopimda, Sentul, Bogor, Rabu 13 November 2019. Jokowi saat itu mengingatkan pentingnya kepastian hukum bagi pengusaha dan pejabat yang melakukan inovasi. Jokowi meminta aparat penegak hukum tidak mencari-cari kesalahan mereka. Jokowi akan menindak tegas aparat yang menghambat kebijakan atau inovasi yang baik untuk negara. Dia akan bertindak tegas melalui Jaksa Agung, Kapolri, hingga KPK. ""Kalau masih ada, akan saya gigit sendiri, ini ada apa kok nggak jalan. Saya sudah mulai ngerti, saya sudah mulai ngerti kalau masih diteruskan. Kalau masih ada yang main-main. Sekali lagi, yang gigit saya sendiri, lewat cara saya. Lewat KPK bisa, lewat Polri, lewat Kejaksaan bisa. Saya bisikin, di sana ada yang main-main,"" katanya. Simak juga Video 'Saat Hasto Putar Ulang Rekaman Jokowi di Acara Forkopimda 2019':   ","Waketum Partai Gerindra, Habiburokhman, menanggapi tudingan Sekjen PDIP Hasto Kristiyanto yang menyebut Presiden Joko Widodo (Jokowi) membisiki penegak hukum untuk menekan suatu pihak saat berpidato di acara Forkopimda 2019. Habiburokhman menilai semestinya Hasto sebagai sekjen dari partai besar tidak ceroboh dalam berkomunikasi. "" Adapun Hasto membagikan rekaman video kepada wartawan yang berisi sambutan Jokowi saat acara Forkopimda 2019 dan menuding adanya upaya Jokowi membisiki penegak hukum untuk melakukan intimidasi. Sekarang kan dia harusnya malu karena yang dimaksud Pak Jokowi bukanlah mengintervensi hukum, tapi justru mengingatkan agar penegak hukum tidak mencari-cari kesalahan,"" kata Habiburokhman. Habiburokhman juga mengaku kasihan Hasto dibully di media sosial akibat pernyataannya sendiri. Dia menilai gaya komunikasi Hasto kurang baik hingga menimbulkan kesan menjadi beban bagi PDIP. "" Setelah itu, Hasto menyinggung tentang adanya upaya menekan. "" Ini merupakan bagian kita lihat dari berbagai upaya-upaya yang mencoba menekan. Tadi kan beredar video kan bagaimana Pak Jokowi mengatakan akan menggunakan hukum dan kemudian melakukan pembisikan kepada Ketua KPK, kepada Jaksa Agung, Kapolri, itu tadi video yang saya terima. kata Hasto di Sekolah Partai, Lenteng Agung, Jakarta Selatan, Sabtu 17 Agustus. Saat mengetahui wartawan belum tahu video tersebut, Hasto mengeluarkan handphone-nya lalu memperlihatkan rekaman suara Jokowi itu. Namun Hasto tak menjelaskan perihal apa dan kapan konteks ucapan Jokowi tersebut. Bisa lewat Polri, bisa lewat Kejaksaan akan saya bisikin aja, di sana ada yang main-main. Ya masa saya mau ngintip sendiri kan ndak mungkin. Kalau masih ada, akan saya gigit sendiri, ini ada apa kok nggak jalan. Saya sudah mulai ngerti, saya sudah mulai ngerti kalau masih diteruskan. Sekali lagi, yang gigit saya sendiri, lewat cara saya. Saya bisikin, di sana ada yang main-main,"" katanya. Simak juga Video 'Saat Hasto Putar Ulang Rekaman Jokowi di Acara Forkopimda 2019':"
"Truk Gangguan di Tol Japek Arah Jakarta, Lalin Padat",detikNews,2024-08-19,Yulida Medistiara,https://news.detik.com/berita/d-7496818/truk-gangguan-di-tol-japek-arah-jakarta-lalin-padat,"Satu unit truk mengalami gangguan di Tol Japek arah ke Jakarta mengalami kepadatan di sejumlah titik. Saat ini kendaraan itu sedang dalam penanganan petugas. ""Tol Jatiwaringin Km 3+800 padat karena ada kendaraan truk berhenti di bahu luar, petugas sedang ke arah lokasi,"" kata petugas call center Jasa Marga, Cindy, saat dihubungi, Senin 19 Agustus 2024. Saat ini kendaraan yang mengalami gangguan tersebut sedang dalam penanganan. Diinformasikan petugas sedang mengarah ke lokasi.    Sementara lalu lintas selanjutnya terpantau padat di sejumlah titik. ""Dari Jatibening Km 7 sampai Jatiwaringin Km 3+800 terpantau padat, selepasnya lancar,"" katanya  ","Satu unit truk mengalami gangguan di Tol Japek arah ke Jakarta mengalami kepadatan di sejumlah titik. Saat ini kendaraan itu sedang dalam penanganan petugas. "" Diinformasikan petugas sedang mengarah ke lokasi. Dari Jatibening Km 7 sampai Jatiwaringin Km 3+800 terpantau padat, selepasnya lancar,"" katanya"
Istana Sebut Reshuffle Kabinet demi Transisi Pemerintahan Lancar dan Efektif,detikNews,2024-08-19,Isal Mawardi,https://news.detik.com/berita/d-7496764/istana-sebut-reshuffle-kabinet-demi-transisi-pemerintahan-lancar-dan-efektif,"Presiden Joko Widodo (Jokowi) melakukan reshuffle kabinet hari ini. Istana menyebut reshuffle dilakukan demi mendukung transisi pemerintahan berjalan baik dan efektif ""Pengangkatan Menteri, Wakil Menteri dan Kepala Badan diperlukan untuk mempersiapkan dan mendukung transisi pemerintahan agar berjalan dengan baik, lancar dan efektif,"" ujar Koordinator Stafsus Presiden Ari Dwipayana kepada wartawan, Senin 19 Agustus 2024. Adapun Menteri dan Kepala Badan yang akan dilantik Jokowi adalah sebagai berikut: Menkumham, Menteri ESDM, Menteri Investasi, tambahan Wakil Menteri Kominfo.    Selain itu, Jokowi juga akan melantik Kepala Badan Gizi Nasional, Kepala Kantor Komunikasi Kepresidenan dan Kepala Badan Pengawas Obat dan Makanan. Siapa saja nama-nama menteri baru yang akan dilantik Jokowi hari ini? Ari masih merahasiakannya. ""Terkait siapa nama-nama Menteri, Wamen dan Kepala Badan yang akan dilantik, tunggu aja jam 09.30 WIB nanti ya,"" imbuh Ari. Sebelumnya, diketahui Informasi terkait reshuffle kabinet pada Senin 19 Agustus 2024 telah dikonfirmasi oleh sumber detikcom di pemerintahan. Kabar yang beredar ada sejumlah menteri yang direshuffle. Yasonna Laoly sendiri dikabarkan akan kehilangan kursi Menteri Hukum dan HAM. Kursi politikus PDIP itu disebut akan digantikan oleh politikus Gerindra. Nama yang santer adalah Supratman Andi Agtas. Menteri ESDM Arifin Tasrin dikabarkan akan diganti Bahlil Lahadalia yang saat ini menjabat sebagai Menteri Investasi. Sementara posisi Menteri Investasi akan diisi oleh Rosan Roeslani yang sebelumnya adalah Ketua Tim Kampanye Nasional Prabowo-Gibran. Selain itu, Jokowi dikabarkan akan melantik dua orang kepala badan, salah satunya ialah kepala Badan Gizi Nasional. Badan Gizi Nasional baru dibentuk melalui Perpres 82/2024 yang diteken Jokowi pada 15 Agustus 2024. Simak juga Video 'Jokowi Soal Kabar Reshuffle: Kalau Diperlukan, Saya Punya Hak Prerogatif':    ","Presiden Joko Widodo (Jokowi) melakukan reshuffle kabinet hari ini. Selain itu, Jokowi juga akan melantik Kepala Badan Gizi Nasional, Kepala Kantor Komunikasi Kepresidenan dan Kepala Badan Pengawas Obat dan Makanan. Siapa saja nama-nama menteri baru yang akan dilantik Jokowi hari ini? Sebelumnya, diketahui Informasi terkait reshuffle kabinet pada Senin 19 Agustus 2024 telah dikonfirmasi oleh sumber detikcom di pemerintahan. Kursi politikus PDIP itu disebut akan digantikan oleh politikus Gerindra. Nama yang santer adalah Supratman Andi Agtas. Menteri ESDM Arifin Tasrin dikabarkan akan diganti Bahlil Lahadalia yang saat ini menjabat sebagai Menteri Investasi. Badan Gizi Nasional baru dibentuk melalui Perpres 82/2024 yang diteken Jokowi pada 15 Agustus 2024."
"Reshuffle Kabinet, Siapa Menteri Baru yang Akan Dilantik Jokowi Hari Ini?",detikNews,2024-08-19,Isal Mawardi,https://news.detik.com/berita/d-7496761/reshuffle-kabinet-siapa-menteri-baru-yang-akan-dilantik-jokowi-hari-ini,"Menteri Hukum dan HAM dan Menteri Energi dan Sumber Daya Manusia (ESDM) membenarkan dirinya di-reshuffle Presiden Joko Widodo (Jokowi) hari ini. Lantas siapa menteri baru yang akan dilantik? Koordinator Stafsus Presiden Ari Dwipayana angkat bicara. Ia tak mau membeberkan siapa saja menteri baru Jokowi. ""Terkait siapa nama-nama Menteri, Wamen, dan Kepala Badan yang akan dilantik, tunggu aja jam 09.30 WIB nanti ya,"" imbuh Ari kepada wartawan, Senin 19 Agustus 2024.    Adapun Menteri dan Kepala Badan yang akan dilantik Jokowi adalah sebagai berikut: Menkumham, Menteri ESDM, Menteri Investasi, tambahan Wakil Menteri Kominfo. Selain itu, Jokowi juga akan melantik Kepala Badan Gizi Nasional, Kepala Kantor Komunikasi Kepresidenan dan Kepala Badan Pengawas Obat dan Makanan. Ari mengatakan reshuffle kabinet diperlukan demi transisi ke pemerintahan selanjutnya di bawah Presiden terpilih RI Prabowo Subianto. ""Pengangkatan Menteri, Wakil Menteri dan Kepala Badan diperlukan untuk mempersiapkan dan mendukung transisi pemerintahan agar berjalan dengan baik, lancar dan efektif,"" sambungnya. ","Menteri Hukum dan HAM dan Menteri Energi dan Sumber Daya Manusia (ESDM) membenarkan dirinya di-reshuffle Presiden Joko Widodo (Jokowi) hari ini. Lantas siapa menteri baru yang akan dilantik? Ia tak mau membeberkan siapa saja menteri baru Jokowi. "" Selain itu, Jokowi juga akan melantik Kepala Badan Gizi Nasional, Kepala Kantor Komunikasi Kepresidenan dan Kepala Badan Pengawas Obat dan Makanan. Ari mengatakan reshuffle kabinet diperlukan demi transisi ke pemerintahan selanjutnya di bawah Presiden terpilih RI Prabowo Subianto. """
3 Fakta Mayat Pria Misterius dengan Kepala Rusak di Pulau Pramuka,detikNews,2024-08-19,Wildan Noviansah,https://news.detik.com/berita/d-7496735/3-fakta-mayat-pria-misterius-dengan-kepala-rusak-di-pulau-pramuka,"Pria tanpa identitas ditemukan tewas di Pulau Pramuka, Kepulauan Seribu utara. Mayat pria misterius itu ditemukan mengenaskan dengan kondisi kepala rusak. ""Korban laki-laki tanpa identitas, jenis kelamin laki-laki. Kepala dalam keadaan rusak,"" kata Kabid Humas Polda Metro Jaya Kombes Ade Ary Syam Indradi kepada wartawan, Minggu 18 Agustus 2024. Mayat pria ini ditemukan warga pada Sabtu 17 Agustus. Berikut fakta-fakta terkait penemuan mayat dengan kepala rusak di Pulau Pramuka:    Awalnya, mayat korban ditemukan oleh seorang warga pada Sabtu siang kemarin. Saat itu, saksi yang hendak menjemput penumpang dari Pulau Panggang menuju Pulau Pramuka menemukan korban dalam kondisi terapung di peraian Pulau Pramuka. ""Melihat sesosok mayat yang terapung di sekitar TKP. Selanjutnya, saksi 1 menghubungi damkar dan kepolisian. Selanjutnya, saksi dan mayat tersebut dievakuasi dari lokasi untuk dibawa ke Mako Polres Kepulauan Seribu, Pulau Karya,"" ucap Ade Ary. Ade Ary mengatakan korban ditemukan dalam kondisi telanjang. Korban juga memiliki tato bergambar pedang di tangannya. ""Korban tidak menggunakan busana (telanjang), tinggi badan kurang lebih 168 cm, berat badan kurang lebih 65 kg. Terdapat tato di tangan sebelah kanan bergambar pedang silang (X) dan tangan sebelah kiri. Simak selengkapnya di halaman selanjutnya:     Halaman                  1                              2                           Selanjutnya       penemuan mayat mayat pria bertato pulau pramuka polda metro jaya jakarta jabodetabek   ","Pria tanpa identitas ditemukan tewas di Pulau Pramuka, Kepulauan Seribu utara. Mayat pria misterius itu ditemukan mengenaskan dengan kondisi kepala rusak. "" Korban laki-laki tanpa identitas, jenis kelamin laki-laki. Berikut fakta-fakta terkait penemuan mayat dengan kepala rusak di Pulau Pramuka:    Awalnya, mayat korban ditemukan oleh seorang warga pada Sabtu siang kemarin. Selanjutnya, saksi dan mayat tersebut dievakuasi dari lokasi untuk dibawa ke Mako Polres Kepulauan Seribu, Pulau Karya,"" ucap Ade Ary. Ade Ary mengatakan korban ditemukan dalam kondisi telanjang. Terdapat tato di tangan sebelah kanan bergambar pedang silang (X) dan tangan sebelah kiri. Simak selengkapnya di halaman selanjutnya:     Halaman                  1                              2                           Selanjutnya       penemuan mayat mayat pria bertato pulau pramuka polda metro jaya jakarta jabodetabek"
"Gempa Bumi M 3,1 Guncang Sigi Sulteng",detikNews,2024-08-19,Dwi Andayani,https://news.detik.com/berita/d-7496707/gempa-bumi-m-3-1-guncang-sigi-sulteng,"Gempa bumi magnitudo (M) 3,1 terjadi di Sigi, Sulawesi Tengah (Sulteng). Gempa berada pada kedalaman 35 km. Informasi gempa ini disampaikan BMKG melalui akun X resminya, Senin 19 Agustus 2024. Disebutkan, gempa terjadi pada pukul 02.29 WIB. ""6 km Barat Laut Sigi-Sulteng,"" tulis BMKG.    Titik koordinat Gempa berada di 1.15 Lintang Selatan dan 119.82 Bujur Timur. Informasi Gempa ini disebut mengutamakan kecepatan. ""Disclaimer:Informasi ini mengutamakan kecepatan, sehingga hasil pengolahan data belum stabil dan bisa berubah seiring kelengkapan data,"" tulis BMKG.","Gempa bumi magnitudo (M) 3,1 terjadi di Sigi, Sulawesi Tengah (Sulteng). Disebutkan, gempa terjadi pada pukul 02.29 WIB. "" Titik koordinat Gempa berada di 1.15 Lintang Selatan dan 119.82 Bujur Timur. Disclaimer:Informasi ini mengutamakan kecepatan, sehingga hasil pengolahan data belum stabil dan bisa berubah seiring kelengkapan data,"" tulis BMKG."
Puan Minta Pemerintah Ambil Langkah Efektif Lindungi Masyarakat dari Mpox,detikNews,2024-08-20,Matius Alfons Hutajulu,https://news.detik.com/berita/d-7500261/puan-minta-pemerintah-ambil-langkah-efektif-lindungi-masyarakat-dari-mpox,"Ketua DPR RI Puan Maharani meminta Pemerintah waspada dengan penyebaran cacar monyet atau monkeypox (mpox) di Indonesia. Dia meminta Pemerintah segera mengambil langkah efektif untuk melindungi masyarakat dari sebaran penyakit tersebut. ""Angka penyebaran mpox terus meningkat, Pemerintah perlu segera mengambil langkah-langkah efektif dalam mengatasi penyebaran penyakit ini dan menjamin proteksi maksimal bagi masyarakat,"" kata Puan dalam keterangannya, Selasa 20 Agustus 2024. Puan menilai Pemerintah harus menggencarkan edukasi kepada masyarakat tentang wabah mpox mengingat virus tersebut bukanlah penyakit sembarangan. Mpox sendiri adalah salah satu spesies virus cacar, ditandai dengan ruam lalu diikuti dengan benjolan yang muncul di kulit.    ""Harus ada edukasi dan sosialisasi yang masif mengingat penyakit ini dapat menular melalui berbagai jenis kontak erat, termasuk melalui ruam kulit yang terkena,"" tutur perempuan pertama yang menjabat sebagai Ketua DPR RI tersebut. ""Paling tidak edukasi mengenai cara penularan, gejala, dan langkah-langkah pencegahan harus disampaikan secara luas dan jelas,"" sambung Puan. Mantan Menko PMK ini meyakini masih banyak masyarakat yang belum mengetahui perihal wabah mpox. Puan mengingatkan risiko kematian pada mpox lebih tinggi daripada COVID-19. ""Masih banyak masyarakat yang tidak memahami soal cacar monyet ini. Maka penting sekali sosialisasi. Bisa dengan penyuluhan dan memanfaatkan kader-kader kesehatan lingkungan,"" tutur dia. Dia kembali mengingatkan Pemerintah untuk memberikan pengetahuan ke masyarakat terkait wabah penyakit yang mulai masuk ke RI tersebut. Dia juga meminta Pemerintah untuk memastikan seluruh kasus mpox di Indonesia terlaporkan dengan akurat dan tepat waktu. ""Masyarakat harus diberdayakan dengan pengetahuan yang benar sehingga dapat mengambil tindakan preventif yang tepat,"" kata Puan. ""Setiap fasilitas kesehatan, baik di pusat maupun di daerah, harus dilengkapi dengan protokol pelaporan yang jelas dan terstandarisasi. Tak cukup hanya dengan surveilans di fasilitas kesehatan, tapi juga sekaligus pengetatan pemeriksaan di seluruh pintu masuk negara baik darat, laut maupun udara demi mengantisipasi penyebaran virus,"" lanjutnya. Sebagai informasi, WHO tah mengumumkan wabah mpox sebagai keadaan darurat kesehatan global yang harus diwaspadai. Pada 14 Agustus lalu, WHO menetapkan mpox sebagai Kedaruratan Kesehatan Masyarakat yang Menjadi Perhatian Internasional (Public Health Emergency of International Concern/PHEIC) menyusul peningkatan kasus mpox di Republik Demokratik Kongo dan sejumlah negara di Afrika. ""Walaupun kasus di Indonesia belum seperti di Afrika, Pemerintah harus memastikan sudah bersiap dengan segala skenario terburuknya agar penanganan wabah Mpox dapat berjalan maksimal,"" tutup Puan.","Ketua DPR RI Puan Maharani meminta Pemerintah waspada dengan penyebaran cacar monyet atau monkeypox (mpox) di Indonesia. Angka penyebaran mpox terus meningkat, Pemerintah perlu segera mengambil langkah-langkah efektif dalam mengatasi penyebaran penyakit ini dan menjamin proteksi maksimal bagi masyarakat,"" kata Puan dalam keterangannya, Selasa 20 Agustus 2024. Puan menilai Pemerintah harus menggencarkan edukasi kepada masyarakat tentang wabah mpox mengingat virus tersebut bukanlah penyakit sembarangan. Mpox sendiri adalah salah satu spesies virus cacar, ditandai dengan ruam lalu diikuti dengan benjolan yang muncul di kulit. Paling tidak edukasi mengenai cara penularan, gejala, dan langkah-langkah pencegahan harus disampaikan secara luas dan jelas,"" sambung Puan. Mantan Menko PMK ini meyakini masih banyak masyarakat yang belum mengetahui perihal wabah mpox. Bisa dengan penyuluhan dan memanfaatkan kader-kader kesehatan lingkungan,"" tutur dia. Setiap fasilitas kesehatan, baik di pusat maupun di daerah, harus dilengkapi dengan protokol pelaporan yang jelas dan terstandarisasi. Pada 14 Agustus lalu, WHO menetapkan mpox sebagai Kedaruratan Kesehatan Masyarakat yang Menjadi Perhatian Internasional (Public Health Emergency of International Concern/PHEIC) menyusul peningkatan kasus mpox di Republik Demokratik Kongo dan sejumlah negara di Afrika. "" Walaupun kasus di Indonesia belum seperti di Afrika, Pemerintah harus memastikan sudah bersiap dengan segala skenario terburuknya agar penanganan wabah Mpox dapat berjalan maksimal,"" tutup Puan."
"Viral Preman Minta 'Jatah Keamanan' ke Hotel di Ciledug, Pelaku Diamankan",detikNews,2024-08-20,Mei Amelia R,https://news.detik.com/berita/d-7500251/viral-preman-minta-jatah-keamanan-ke-hotel-di-ciledug-pelaku-diamankan,"Aksi premanisme yang dilakukan oleh preman di Ciledug, Kota Tangerang, Banten, viral di media sosial. Pelaku meminta sejumlah uang dengan alasan 'uang keamanan' kepada pengelola hotel. Dalam rekaman video CCTV yang beredar di media sosial, terlihat dua pelaku mendatangi hotel melati di kawasan Parung Serab, Ciledug, Kota Tangerang, pada Sabtu 17 Agustus malam. Dinarasikan kedua pelaku tersebut tiba-tiba datang sambil marah-marah. Kedua pelaku kemudian meminta sejumlah uang dengan dalih 'jatah keamanan' kepada karyawan hotel. Mereka mengancam akan menutup paksa hotel tersebut jika tidak memberikan sejumlah uang.    Salah satu pelaku bahkan menampar korban. Kejadian ini turut disaksikan oleh pengunjung hotel. Kasat Reskrim Polres Metro Tangerang Kota Kompol David Kanitero turun tangan menyelidiki kejadian viral ini. Pihaknya telah mengamankan kedua pelaku. ""Pelaku ada dua orang sudah kami amankan,"" kata David saat dihubungi detikcom, Selasa 20 Agustus 2024. Keduanya diamankan oleh Unit Reskrim Polsek Ciledug di-back up oleh Unit 1 Krimum Satreskrim Polres Metro Tangerang Kota sore tadi. Polisi juga telah mengecek ke lokasi dan menyarankan pihak hotel untuk membuat laporan. ""Korban sudah disarankan untuk buat LP, namun menolak dan tidak bersedia membuat laporan polisi dengan alasan korban tidak mengalami luka-luka,"" imbuhnya. Kedua pihak kemudian menyelesaikan kasus ini secara kekeluargaan. Kedua pelaku membuat surat pernyataan yang intinya berjanji tidak akan mengulangi perbuatannya. Sementara itu, pihak pengelola hotel menyampaikan terima kasih kepada jajaran Kepolisian Resor Metro Tangerang atas gerak cepatnya. ""Terima kasih saya ucapkan kepada Kepolisian Negara Republik Indonesia, khususnya kepada Kapolres Metro Tangerang Kota, Kapolsek Ciledug, dan jajarannya atas respons cepat penanganan aksi premanisme dan gangguan ketertiban umum di wilayah Parung Serab Ciledug, jaya selalu Kepolisian Republik Indonesia,"" ucap pengelola hotel.","Aksi premanisme yang dilakukan oleh preman di Ciledug, Kota Tangerang, Banten, viral di media sosial. Pelaku meminta sejumlah uang dengan alasan 'uang keamanan' kepada pengelola hotel. Dinarasikan kedua pelaku tersebut tiba-tiba datang sambil marah-marah. Salah satu pelaku bahkan menampar korban. Pelaku ada dua orang sudah kami amankan,"" kata David saat dihubungi detikcom, Selasa 20 Agustus 2024. Keduanya diamankan oleh Unit Reskrim Polsek Ciledug di-back up oleh Unit 1 Krimum Satreskrim Polres Metro Tangerang Kota sore tadi. Kedua pihak kemudian menyelesaikan kasus ini secara kekeluargaan. Kedua pelaku membuat surat pernyataan yang intinya berjanji tidak akan mengulangi perbuatannya. Sementara itu, pihak pengelola hotel menyampaikan terima kasih kepada jajaran Kepolisian Resor Metro Tangerang atas gerak cepatnya. """
