title,category,publish_date,author,article_url,content,summary
Poin-poin Pembelaan Eks Dirut JJC di Kasus Korupsi Tol MBZ,detikNews,2024-07-19,Dhani Irawan,https://news.detik.com/berita/d-7446508/poin-poin-pembelaan-eks-dirut-jjc-di-kasus-korupsi-tol-mbz,"Mantan Direktur Utama PT Jasamarga Jalan Layang Cikampek (JJC) Djoko Dwijono menyampaikan pembelaannya usai dituntut 4 tahun penjara dalam kasus proyek pembangunan Tol Jakarta-Cikampek (Japek) II alias Tol Layang MBZ tahun 2016-2017. Djoko Dwijono membantah terlibat dalam kasus korupsi itu. Hal itu diungkapkan Djoko saat penyampaian pledoi atau pembelaaan di sidang PN Tipikor Jakarta Pusat, Kamis 18 Juli 2024. Berikut ini poin-poin pembelaan Djoko Dwijono. Dalam dakwaan sebelumnya jaksa menyebutkan Djoko dengan Yudhi Mahyudin secara sengaja mengarahkan pemenang lelang pekerjaan steel box girder pada merk Perusahaan tertentu yaitu PT. Bukaka Teknik Utama.    Akan tetapi dalam pembelaannya, Djoko mengaku tidak mengetahui adanya pencantuman ketentuan 'steel box girder Bukaka' dalam dokumen lelang cq Spesifikasi Khusus. ""Saya juga tidak pernah menyetujui Spesifikasi Khusus yang mencantumkan ketentuan 'steel box girder Bukaka' sebagai dokumen lelang,"" ungkapnya di persidangan, dalam keterangannya, Jumat 19 Juli 2024. Selain itu Djoko berbicara soal pemberian hak untuk menyamakan penawaran atau right to match (RTM) kepada konsorsium PT Waskita Karya Tbk-PT Acset Indonusa Tbk (Kerja Sama Operasional/KSO Waskita-Acset), dalam lelang proyek jalan tol layang terpanjang di Indonesia itu. Djoko mengatakan, penerapan konsep design and build dan metode right to match karena pada proses sebelumnya, pada lelang investasi, sudah diinformasikan kontraktor pelaksanaannya, dan kontraktor tersebut akan diberikan right to match di dalam proses pelelangan konstruksi. ""Pada kenyataannya hak tersebut juga tidak perlu digunakan karena harga penawar KSO Waskita-Acset sudah paling rendah,"" ujar Djoko. Lebih lanjut, menurut Djoko, ketentuan mengenai pemberian right to match sudah diatur oleh pemerintah untuk proyek kerja sama pemerintah dengan badan usaha (KPBU). Berdasarkan Peraturan Presiden Nomor 38 Tahun 2015, badan usaha pemrakarsa KPBU memperoleh tiga kompensasi. Selain hak untuk menyamakan penawaran alias right to match, pemrakarsa juga mendapat tambahan nilai sebesar 10 persen dan pembelian prakarsa KPBU, antara lain hak kekayaan intelektual, oleh pemerintah. Kemudian Djoko juga membantah dakwaan jaksa yang menyebut bahwa pihaknya bersekongkol bersama ketiga terdakwa lainnya untuk mengubah spesifikasi khusus yang tidak sesuai dengan basic design (design awal) dan menurunkan volume serta mutu steel box girder yaitu dengan cara tidak mencantumkan tinggi girder pada dokumen penawaran. Menurut Djoko dalam persidangan terungkap bahwa pembangunan jalan tol Jakarta-Cikampek II Elevated menggunakan metode pekerjaan Design and Build, sehingga dapat dilakukan pengembangan spesifikasi dari yang telah ditentukan pada basic design. ""Perubahan steel box girder berbentuk V shape menjadi steel box girder bentuk U shape pada pembangunan Jalan Tol Jakarta-Cikampek II Elevated dilakukan sebelum PT JJC didirikan dan saya belum menjadi Direktur Utama PT JJC,"" sambungnya. Selain itu, Djoko menyebut berdasarkan fakta persidangan tidak pernah terungkap adanya persekongkolan antara dirinya dengan Saksi Tony Budianto Sihite dan Waskita-Acset KSO untuk mengurangi volume pekerjaan struktur beton. Apalagi jika dilihat dari sisi kontrak antara PT JJC dengan Waskita-Acset KSO bersifat lump sum fixed price yang tidak mengenal perhitungan volume. ""Perhitungan volume pekerjaan berdasarkan Rencana Teknik Akhir (RTA). Dalam skema desain and build semuanya bersifat lump sum fixed price,"" ujarnya. Terdakwa Djoko Dwijono dan Tony Budianto Sihite sebelumnya didakwa telah bersekongkol dengan pihak KSO Waskita-Acset untuk mengurangi volume pekerjaan struktur beton, dengan cara menyetujui pekerjaan volume beton yang tidak sesuai dengan Rencana Teknik Akhir (RTA), sehingga terdapat kekurangan volume pada pekerjaan. Djoko mengaku sebelum pekerjaan tersebut dilakukan, kontrak Jasa Pemborongan (Design and Build) antara PT JJC dengan Waskita-Acset KSO merupakan kontrak pekerjaan konstruksi terintegrasi rancang dan bangun (Design and Build), sehingga pembuatan RTA merupakan kewajiban dari kontraktor Design and Build in casu Waskita-Acset KSO. Di mana pekerjaan konstruksi jalan tol Jakarta-Cikampek II Elevated didasarkan pada Rencana Teknik Akhir (RTA) yang dibuat secara parsial oleh Kontraktor melalui Konsultan Perencana. Dalam dakwaan lain, JPU menyebut Djoko tidak melakukan evaluasi dan pengendalian terhadap kegiatan pembangunan Jalan Tol Jakarta-Cikampek II Elevated. sehingga hasil pekerjaan tidak dapat dimanfaatkan sesuai dengan feasibility (studi kelayakan) dan Kriteria Design yang sudah ditetapkan. Menurutnya dalam persidangan terungkap laporan yang diterima oleh Djoko Dwijono terkait hasil uji tekan beton pada masa konstruksi yang dilakukan oleh KSO Waskita Acset dengan bantuan labolatarium independen (Laboraturium Universitas Indonesia, Trisakti, Institut Teknologi Bandung dan Balai Uji PUPR) sudah sesuai ketentuan. ""Hal ini turut disaksikan oleh konsultan pengawas PT Virama Karya (Persero) dan Pimpro area I, II, dan III, seluruhnya menyatakan hasil kuat tekan beton telah memenuhi syarat minimum fc' 35 mpa"" tutupnya. Sebelumnya, mantan Direktur Utama PT Jasamarga Jalan Layang Cikampek (JJC) Djoko Dwijono dituntut 4 tahun penjara. Jaksa menyakini Djoko melakukan korupsi dalam kasus proyek pembangunan Tol Jakarta-Cikampek (Japek) II alias Tol Layang MBZ tahun 2016-2017. ""Menjatuhkan pidana terhadap Djoko Dwijono oleh karena itu dengan pidana penjara selama 4 tahun dikurangi selama terdakwa berada dalam tahanan sementara dengan perintah agar terdakwa tetap ditahan dalam rumah tahanan negara,"" kata jaksa saat membacakan surat tuntutan di Pengadilan Tipikor Jakarta Pusat, Rabu 10 Juli 2024. Jaksa juga menuntut Djoko dengan denda Rp 1 miliar. Adapun apabila denda tak dibayar diganti dengan pidana 6 bulan kurungan. ","Mantan Direktur Utama PT Jasamarga Jalan Layang Cikampek (JJC) Djoko Dwijono menyampaikan pembelaannya usai dituntut 4 tahun penjara dalam kasus proyek pembangunan Tol Jakarta-Cikampek (Japek) II alias Tol Layang MBZ tahun 2016-2017. Djoko Dwijono membantah terlibat dalam kasus korupsi itu. Hal itu diungkapkan Djoko saat penyampaian pledoi atau pembelaaan di sidang PN Tipikor Jakarta Pusat, Kamis 18 Juli 2024. Berikut ini poin-poin pembelaan Djoko Dwijono. Akan tetapi dalam pembelaannya, Djoko mengaku tidak mengetahui adanya pencantuman ketentuan 'steel box girder Bukaka' dalam dokumen lelang cq Spesifikasi Khusus. "" Selain itu Djoko berbicara soal pemberian hak untuk menyamakan penawaran atau right to match (RTM) kepada konsorsium PT Waskita Karya Tbk-PT Acset Indonusa Tbk (Kerja Sama Operasional/KSO Waskita-Acset), dalam lelang proyek jalan tol layang terpanjang di Indonesia itu. Djoko mengatakan, penerapan konsep design and build dan metode right to match karena pada proses sebelumnya, pada lelang investasi, sudah diinformasikan kontraktor pelaksanaannya, dan kontraktor tersebut akan diberikan right to match di dalam proses pelelangan konstruksi. "" Pada kenyataannya hak tersebut juga tidak perlu digunakan karena harga penawar KSO Waskita-Acset sudah paling rendah,"" ujar Djoko. Lebih lanjut, menurut Djoko, ketentuan mengenai pemberian right to match sudah diatur oleh pemerintah untuk proyek kerja sama pemerintah dengan badan usaha (KPBU). Berdasarkan Peraturan Presiden Nomor 38 Tahun 2015, badan usaha pemrakarsa KPBU memperoleh tiga kompensasi. Perhitungan volume pekerjaan berdasarkan Rencana Teknik Akhir (RTA). Dalam skema desain and build semuanya bersifat lump sum fixed price,"" ujarnya. Terdakwa Djoko Dwijono dan Tony Budianto Sihite sebelumnya didakwa telah bersekongkol dengan pihak KSO Waskita-Acset untuk mengurangi volume pekerjaan struktur beton, dengan cara menyetujui pekerjaan volume beton yang tidak sesuai dengan Rencana Teknik Akhir (RTA), sehingga terdapat kekurangan volume pada pekerjaan. Menjatuhkan pidana terhadap Djoko Dwijono oleh karena itu dengan pidana penjara selama 4 tahun dikurangi selama terdakwa berada dalam tahanan sementara dengan perintah agar terdakwa tetap ditahan dalam rumah tahanan negara,"" kata jaksa saat membacakan surat tuntutan di Pengadilan Tipikor Jakarta Pusat, Rabu 10 Juli 2024. Jaksa juga menuntut Djoko dengan denda Rp 1 miliar. Adapun apabila denda tak dibayar diganti dengan pidana 6 bulan kurungan."
Duel Tangan Kosong Tewaskan 1 Orang di Jaksel Diawali Cekcok,detikNews,2024-07-19,Mulia Budi,https://news.detik.com/berita/d-7446404/duel-tangan-kosong-tewaskan-1-orang-di-jaksel-diawali-cekcok,"Duel maut dengan tangan kosong di Pondok Pinang, Jakarta Selatan (Jaksel), menewaskan pria berinisial I (45). Polisi mengatakan duel maut itu berawal dari cekcok. ""Dari keterangan saksi awalnya karena ada cekcok mulut, setelah itu mereka berkelahi, seperti itu,"" kata Kapolsek Kebayoran Lama, Kompol Widya Agustiono, kepada wartawan, Jumat 19 Juli 2024. Namun, polisi belum mengetahui apa penyebab cekcok hingga berujung duel maut itu. Widya mengatakan terduga pelaku berinisial HR (45) yang berduel dengan I telah ditangkap.    ""Ini masih didalami dari keterangan dari pelakunya, pelakunya masih di-BAP (berita acara pemeriksaan),"" ujarnya. Dia mengatakan korban dan pelaku saling mengenal. Dia mengatakan keduanya masih memiliki hubungan kekerabatan. ""Saling kenal, mereka masih punya hubungan saudara rupanya, masih ada hubungan kekerabatan,"" kata Widya. ""Kalau diurut-urut yang jelas bukan saudara kandung, tapi ya namanya dari, ya namanya Betawi, ncang-ncangnya atau gimana, bilangnya masih saudara gitu,"" imbuhnya. Widya mengatakan warga di sekitar lokasi menghubungi polisi saat perkelahian terjadi. Dia mengatakan HR tak sempat melarikan diri. ""Waktu ada keributan sudah menghubungi kepolisian, lalu kita ke TKP (tempat kejadian perkara). Ternyata sampai sana sudah ada korban yang meninggal, seperti itu. Lalu, kita amankan pelakunya,"" ujarnya. Duel maut dengan tangan kosong itu terjadi sekitar pukul 14.00 WIB pada Kamis 18 Juli kemarin. Widya mengatakan korban berinisial I mengalami luka lebam di kepala dan sobek di pelipis. ""Untuk korbannya kalau kita lihat ada luka lebam di kepala, ada sobek di pelipis sebelah kiri. Kalau penyebab meninggalnya kita belum tahu karena setelah mereka berkelahi itu, korban mau ngangkat becak motor dia itu yang bawa air galon itu. Tiba-tiba dia terjatuh, meninggal, seperti itu,"" ujarnya.","Duel maut dengan tangan kosong di Pondok Pinang, Jakarta Selatan (Jaksel), menewaskan pria berinisial I (45). Namun, polisi belum mengetahui apa penyebab cekcok hingga berujung duel maut itu. Dia mengatakan korban dan pelaku saling mengenal. Dia mengatakan keduanya masih memiliki hubungan kekerabatan. "" Widya mengatakan warga di sekitar lokasi menghubungi polisi saat perkelahian terjadi. Waktu ada keributan sudah menghubungi kepolisian, lalu kita ke TKP (tempat kejadian perkara). Duel maut dengan tangan kosong itu terjadi sekitar pukul 14.00 WIB pada Kamis 18 Juli kemarin. Untuk korbannya kalau kita lihat ada luka lebam di kepala, ada sobek di pelipis sebelah kiri. Kalau penyebab meninggalnya kita belum tahu karena setelah mereka berkelahi itu, korban mau ngangkat becak motor dia itu yang bawa air galon itu. Tiba-tiba dia terjatuh, meninggal, seperti itu,"" ujarnya."
"Hindari Pikap, Pemotor di Bogor Tabrak Motor hingga Terluka",detikNews,2024-07-19,Rizky Adha Mahendra,https://news.detik.com/berita/d-7446682/hindari-pikap-pemotor-di-bogor-tabrak-motor-hingga-terluka,"Kecelakaan lalu lintas melibatkan 2 sepeda motor dan 1 mobil pikap terjadi di Jalan Raya Rancabungur, Kecamatan Rancabungur, Kabupaten Bogor, Jawa Barat. Satu orang luka-luka akibat kecelakaan itu. Kapolsek Rancabungur Ipda Azis Hidayat mengatakan, peristiwa itu terjadi pada Kamis 18 Juli kemarin. Kecelakaan berawal ketika sebuah mobil pikap berhenti mendadak saat melaju. ""Pengemudi sepeda motor Yamaha Vixion, Enggar Wilardi (26), yang berada di belakang pikap tersebut, berusaha menghindar dengan berbelok ke kanan jalan,"" kata Azis, Jumat 19 Juli 2024.    Namun, sepeda motor yang dikendarainya menabrak sepeda motor Honda X-Ride. Sepeda motor tersebut datang dari arah yang berlawanan. ""Dalam insiden ini, Enggar Wilardi mengalami luka memar pada kaki sebelah kanan, sementara Eman Sulaeman tidak mengalami luka,"" ucapnya. Tidak ada korban jiwa dalam kecelakaan tersebut. Kerugian akibat kecelakaan, lanjut Azis, sekitar Rp 500 ribu. Kecelakaan diselesaikan secara musyawarah oleh pihak yang terlibat. ""Kami dari Polsek Rancabungur bersama Unit Laka Parung telah melakukan penanganan di tempat kejadian perkara (TKP). Kejadian ini diselesaikan melalui musyawarah kekeluargaan antara kedua belah pihak,"" ucapnya.  Simak juga 'Anak Lansia Tewas Membusuk di Bogor Tetap Tak Merespons hingga Pemakaman':   ","Kecelakaan lalu lintas melibatkan 2 sepeda motor dan 1 mobil pikap terjadi di Jalan Raya Rancabungur, Kecamatan Rancabungur, Kabupaten Bogor, Jawa Barat. Namun, sepeda motor yang dikendarainya menabrak sepeda motor Honda X-Ride. Dalam insiden ini, Enggar Wilardi mengalami luka memar pada kaki sebelah kanan, sementara Eman Sulaeman tidak mengalami luka,"" ucapnya. Tidak ada korban jiwa dalam kecelakaan tersebut. Kerugian akibat kecelakaan, lanjut Azis, sekitar Rp 500 ribu. Kecelakaan diselesaikan secara musyawarah oleh pihak yang terlibat. "" Simak juga 'Anak Lansia Tewas Membusuk di Bogor Tetap Tak Merespons hingga Pemakaman':"
Bagaimana Kasus TPPU Panji Gumilang Usai Bebas Penjara Penodaan Agama?,detikNews,2024-07-19,Rumondang Naibaho,https://news.detik.com/berita/d-7446628/bagaimana-kasus-tppu-panji-gumilang-usai-bebas-penjara-penodaan-agama,"Pimpinan Pondok Pesantren Al-Zaytun, Panji Gumilang, telah dinyatakan bebas dari penjara. Hampir selama satu tahun Panji menjalani hukuman gegara kasus penodaan agama di Lapas Kelas IIB Indramayu. Selain kasus penodaan agama, Panji juga berstatus sebagai tersangka dalam kasus Tindak Pidana Pencucian Uang (TPPU). Dugaan TPPU ini berawal saat penyidik menemukan adanya tindak pidana awal berupa penggelapan dan korupsi Dana BOS yang diduga dilakukan Panji Gumilang. Panji Gumilang disebut pernah mengajukan peminjaman sebesar Rp 73 miliar dari atas nama yayasan yang dikelolanya. Namun, uang tersebut malah digunakan Panji untuk kepentingan pribadinya.    Dirtipideksus Bareskrim Polri, Irjen Whisnu Hermawan, memastikan pengusutan kasus TPPU Panji Gumilang masih dilakukan. Kata dia, penyidik telah melimpahkan berkas perkaranya ke Kejaksaan pada Senin 3 Juni lalu. Whisnu menyebutkan saat ini pihaknya tengah menunggu berkas tersebut diperiksa oleh Jaksa. ""(Saat ini) Masih penelitian jaksa,"" kata Whisnu saat dikonfirmasi, Jumat 19 Juli 2024. Lebih jauh, dia menuturkan, jika jaksa menyatakan berkas tersebut lengkap (P-21), maka selanjutnya penyidik akan segera melimpahkan tersangka dan barang buktinya ke Kejaksaan untuk segera disidangkan. Adapun proses pengusutan dugaan TPPU ini sudah satu tahun berjalan, namun Whisnu enggan mengungkap kendala yang dihadapi penyidik. ""Tunggu P-21 saja,"" pungkasnya. Sebelumnya diberitakan, Panji Gumilang dinyatakan bebas murni usai menjalani 1 tahun penjara di kasus penodaan agama. Dilansir detikJabar, Panji Gumilang telah menjalani masa tahanan di Lapas Kelas II-B Indramayu. Panji Gumilang dinyatakan bebas murni per hari Rabu 17 Juli.  Simak juga 'Kala Hakim Tolak Gugatan Praperadilan Panji Gumilang':   ","Pimpinan Pondok Pesantren Al-Zaytun, Panji Gumilang, telah dinyatakan bebas dari penjara. Dugaan TPPU ini berawal saat penyidik menemukan adanya tindak pidana awal berupa penggelapan dan korupsi Dana BOS yang diduga dilakukan Panji Gumilang. Namun, uang tersebut malah digunakan Panji untuk kepentingan pribadinya. Whisnu menyebutkan saat ini pihaknya tengah menunggu berkas tersebut diperiksa oleh Jaksa. ""( Saat ini) Masih penelitian jaksa,"" kata Whisnu saat dikonfirmasi, Jumat 19 Juli 2024. Sebelumnya diberitakan, Panji Gumilang dinyatakan bebas murni usai menjalani 1 tahun penjara di kasus penodaan agama. Panji Gumilang dinyatakan bebas murni per hari Rabu 17 Juli. Simak juga 'Kala Hakim Tolak Gugatan Praperadilan Panji Gumilang':"
Top! Jasa Raharja Raih Penghargaan di ASEAN Risk Awards 2024,detikNews,2024-07-19,Hana Nushratu Uzma,https://news.detik.com/berita/d-7446596/top-jasa-raharja-raih-penghargaan-di-asean-risk-awards-2024,"Jasa Raharja berhasil meraih penghargaan sebagai Runner Up dalam kategori Risk Innovation and Technology pada ajang ASEAN Risk Awards (ARA) 2024. Para pemenang penghargaan dalam kategori ini diakui telah berkontribusi terhadap kemajuan pengetahuan dan praktik manajemen risiko, dengan memanfaatkan atau menemukan teknologi baru sebagai respons terhadap perubahan konteks. Direktur Kepatuhan dan Manajemen Risiko Harwan Muldidarmawan, mengungkapkan bahwa keikutsertaan Jasa Raharja dalam ajang tersebut adalah kesempatan bagi perusahaan untuk membandingkan pencapaian (positioning) dan kontribusi perusahaan, serta menginspirasi perusahaan lain untuk mendorong kemajuan penerapan manajemen risiko di Asia Tenggara. Penghargaan itu menjadi salah satu bukti bahwa Jasa Raharja mampu bersaing di kancah internasional.    ""Ini adalah salah satu capaian yang baik, sebagai hasil kerja keras seluruh jajaran perusahaan, dorongan dari Kementerian BUMN, dan peran serta seluruh mitra kerja terkait,"" ujar Harwan, dalam keterangan tertulis, Jumat 19 Juli 2024. Adapun acara penganugerahan bergengsi di tingkat Asia Tenggara ini digelar di St Regis Bangkok, Thailand, pada Jumat 5 Juli. Keberhasilan Jasa Raharja dalam mendapatkan pengakuan internasional ini, diharapkan dapat menjadi pelecut semangat seluruh Insan Jasa Raharja untuk terus memberikan pelayanan terbaik tanpa mengabaikan aspek manajemen risiko. ARA merupakan penghargaan pertama yang bertujuan untuk memberdayakan kemajuan penerapan manajemen risiko di kawasan Asia Tenggara. Pada ARA tahun 2024 kali ini tercatat sebanyak 400 submission dari berbagai perusahaan dan industri di Asia Tenggara yang telah mengikuti ajang dimaksud.","Jasa Raharja berhasil meraih penghargaan sebagai Runner Up dalam kategori Risk Innovation and Technology pada ajang ASEAN Risk Awards (ARA) 2024. Direktur Kepatuhan dan Manajemen Risiko Harwan Muldidarmawan, mengungkapkan bahwa keikutsertaan Jasa Raharja dalam ajang tersebut adalah kesempatan bagi perusahaan untuk membandingkan pencapaian (positioning) dan kontribusi perusahaan, serta menginspirasi perusahaan lain untuk mendorong kemajuan penerapan manajemen risiko di Asia Tenggara. Penghargaan itu menjadi salah satu bukti bahwa Jasa Raharja mampu bersaing di kancah internasional. Adapun acara penganugerahan bergengsi di tingkat Asia Tenggara ini digelar di St Regis Bangkok, Thailand, pada Jumat 5 Juli. Pada ARA tahun 2024 kali ini tercatat sebanyak 400 submission dari berbagai perusahaan dan industri di Asia Tenggara yang telah mengikuti ajang dimaksud."
Momen Prabowo Pidato Wakili Jokowi: Pak Presiden Sedang Melatih Saya,detikNews,2024-07-19,Tiara Aliya Azzahra,https://news.detik.com/berita/d-7446567/momen-prabowo-pidato-wakili-jokowi-pak-presiden-sedang-melatih-saya,"Menteri Pertahanan sekaligus presiden terpilih Prabowo Subianto mewakili Presiden Joko Widodo menghadiri acara peluncuran Geoportal Kebijakan Satu Peta (KSP). Prabowo mengatakan dirinya sedang 'ditempa' oleh Jokowi supaya tak kaget saat menggantikannya pada Oktober mendatang. Dilihat detikcom, Jumat 19 Juli 2024, Prabowo tampak duduk di sebelah Menko Polhukam Hadi Tjahjanto. Sejumlah pejabat turut hadir dalam acara tersebut, antara lain Kapolri Jenderal Listyo Sigit Prabowo, Panglima TNI Jenderal TNI Agus Subiyanto, Menteri Perdagangan Zulkifli Hasan, Menteri ATR/BPN Agus Harimurti Yudhoyono, Mendagri Tito Karnavian, dan Sekretaris Kabinet Pramono Anung. Prabowo kemudian diminta naik ke atas panggung untuk menerima White Paper One Map Policy (OMP) Beyond 2024, Laporan Capaian PSN dan KEK sekaligus memberikan sambutan dan meluncurkan Geoportal Kebijakan Satu Peta 2.0. Tampak Menko Perekonomian Airlangga Hartarto menyerahkan dokumen tersebut kepada Prabowo.    ""Saya di instruksikan untuk mewakili Bapak Presiden Joko Widodo dan dalam hal ini apa yang saya sampaikan sebetulnya adalah catatan-catatan dan pointers dari beliau,"" kata Prabowo mengawali sambutannya. Prabowo mengatakan saat ini Jokowi tengah melatihnya menjelang pelantikan Oktober mendatang. Ia juga bercerita kerap dilibatkan dalam rapat-rapat kabinet beberapa waktu terakhir. ""Saya kira bapak presiden ternyata sedang melatih saya untuk supaya nanti nggak terlalu kaget begitu setelah saya dilantik insyaallah. Jadi itulah cara beliau,"" ujar Prabowo. ""Jadi saya kira ini yang saya rasakan beliau sekarang hampir semua rapat kabinet saya diikutsertakan, dan duduknya sebelah presiden sekarang. Mohon maaf Menko. Jadi ini yang saya rasakan saya sedang disiapkan,"" imbuhnya. ","Menteri Pertahanan sekaligus presiden terpilih Prabowo Subianto mewakili Presiden Joko Widodo menghadiri acara peluncuran Geoportal Kebijakan Satu Peta (KSP). Prabowo mengatakan dirinya sedang 'ditempa' oleh Jokowi supaya tak kaget saat menggantikannya pada Oktober mendatang. Sejumlah pejabat turut hadir dalam acara tersebut, antara lain Kapolri Jenderal Listyo Sigit Prabowo, Panglima TNI Jenderal TNI Agus Subiyanto, Menteri Perdagangan Zulkifli Hasan, Menteri ATR/BPN Agus Harimurti Yudhoyono, Mendagri Tito Karnavian, dan Sekretaris Kabinet Pramono Anung. Ia juga bercerita kerap dilibatkan dalam rapat-rapat kabinet beberapa waktu terakhir. "" Saya kira bapak presiden ternyata sedang melatih saya untuk supaya nanti nggak terlalu kaget begitu setelah saya dilantik insyaallah. Jadi itulah cara beliau,"" ujar Prabowo. "" Jadi ini yang saya rasakan saya sedang disiapkan,"" imbuhnya."
"Menag Yaqut Menghadap Jokowi di Istana, Bahas Apa?",detikNews,2024-07-19,Eva Safitri,https://news.detik.com/berita/d-7446512/menag-yaqut-menghadap-jokowi-di-istana-bahas-apa,"Menteri Agama (Menag) Yaqut Cholil Qoumas menghadap Presiden Joko Widodo (Jokowi) pagi ini. Apa yang dibahas? Yaqut tiba di Kompleks Istana Kepresidenan sekitar pukul 09.11 WIB dan keluar sekitar pukul 10.00 WIB. Dia mengatakan hanya melaporkan tugas rutinnya sebagai Menag. ""Saya laporkan rutin, laporan rutin ke presiden lah terkait pelaksanaan tugas di Kemenag semua,"" kata Yaqut di Kompleks Istana Kepresidenan, Jakarta, Jumat 19 Juli 2024.    Yaqut enggan menjawab saat ditanya soal permasalahan haji dan Pansus Haji yang dibentuk DPR. Dia mengaku hanya melaporkan tugas-tugasnya ke Presiden. ""Saya laporkan semua tugas-tugas saya di Kemenag kepada Pak Presiden, itu saja,"" ujar Yaqut. Sebelumnya, DPR RI telah menyepakati pembentukan dan susunan nama keanggotaan panitia khusus (pansus) angket pengawasan haji dalam rapat paripurna ke-21. Pansus angket itu berisikan 30 anggota Dewan dari seluruh fraksi DPR RI. Gus Yaqut siap mengikuti proses di pansus tersebut. ""Ya kita ikuti saja. Itu kan proses yang dijamin oleh konstitusi kan. Itu kita ikuti,"" kata Yaqut kepada wartawan di kompleks Istana Kepresidenan, Jakarta, Selasa 9 Juli. Yaqut belum mempersiapkan hal-hal atau keterangan yang akan disampaikan dalam pansus nanti. Yaqut memastikan akan menjelaskan proses pelaksanaan ibadah haji, mulai persiapan hingga pelaksanaan. ""Ya nggak tahu (apa yang disiapkan). Semua proses kita akan laporkan kan, proses mulai persiapan sampai pelaksanaan ibadah haji akan kita sampaikan apa adanya,"" ucapnya.  Simak juga 'Profil 3 Wakil Menteri Baru yang Dilantik Jokowi': ","Menteri Agama (Menag) Yaqut Cholil Qoumas menghadap Presiden Joko Widodo (Jokowi) pagi ini. Saya laporkan rutin, laporan rutin ke presiden lah terkait pelaksanaan tugas di Kemenag semua,"" kata Yaqut di Kompleks Istana Kepresidenan, Jakarta, Jumat 19 Juli 2024. Yaqut enggan menjawab saat ditanya soal permasalahan haji dan Pansus Haji yang dibentuk DPR. Sebelumnya, DPR RI telah menyepakati pembentukan dan susunan nama keanggotaan panitia khusus (pansus) angket pengawasan haji dalam rapat paripurna ke-21. Gus Yaqut siap mengikuti proses di pansus tersebut. "" Itu kan proses yang dijamin oleh konstitusi kan. Yaqut memastikan akan menjelaskan proses pelaksanaan ibadah haji, mulai persiapan hingga pelaksanaan. "" Simak juga 'Profil 3 Wakil Menteri Baru yang Dilantik Jokowi':"
