title,category,publish_date,author,article_url,content,summary
"Menkumham Supratman Agtas Kontak Yasonna Semalam, Ini Isi Obrolannya",detikNews,2024-08-19,Isal Mawardi,https://news.detik.com/berita/d-7496950/menkumham-supratman-agtas-kontak-yasonna-semalam-ini-isi-obrolannya,"Presiden Joko Widodo (Jokowi) melantik politikus Partai Gerindra Supratman Andi Agtas sebagai Menteri Hukum dan HAM (Menkumham) baru menggantikan kader PDIP Yasonna Laoly. Supratman Andi Agtas mengaku berkontak dengan Yasonna semalam sebelum pelantikan. ""Saya berteman baik dengan Pak Yasonna dan semalam kami juga kontak,"" kata Supratman usai pelantikan di Istana Negara, Jakarta Pusat, Senin 19 Agustus 2024. Supratman menyebut dirinya memberi tahu Yasonna soal kebijakan yang tidak akan diubah seketika. Dia menyebut hal baik yang telah dilakukan Yasonna akan dilanjutkan dan disempurnakan.    ""Dan saya sampaikan bahwa tentu tidak mungkin seketika semua kita ubah dan lain-lain, dan sebagainya. Intinya adalah semua program-program yang baik yang telah dilakukan menteri sebelumnya menjadi kewajiban kami untuk menyempurnakan itu dan melanjutkan,"" kata mantan Ketua Badan Legislasi DPR RI itu. Berikut daftar menteri, wakil menteri dan kepala badan yang dilantik Presiden Jokowi hari ini: 1.⁠ ⁠Supratman Andi Agtas jadi Menkumham RI2.⁠ ⁠Bahlil Lahadalia jadi Menteri ESDM3.⁠ ⁠Rosan Roeslani jadi Menteri Investasi4.⁠ ⁠Angga Raka Prabowo Jadi Wamenkominfo5. Prof Dadan Hindayana jadi Kepala Badan Gizi6.⁠ ⁠Hasan Nasbi jadi Kepala Kantor Komunikasi Kepresidenan7.⁠ ⁠Taruna Ikrar jadiKepalaBPOM.  Simak Video 'Prabowo Tak Hadiri Pelantikan Menteri di Istana, Supratman: Ada Kunker':   ","Presiden Joko Widodo (Jokowi) melantik politikus Partai Gerindra Supratman Andi Agtas sebagai Menteri Hukum dan HAM (Menkumham) baru menggantikan kader PDIP Yasonna Laoly. Dia menyebut hal baik yang telah dilakukan Yasonna akan dilanjutkan dan disempurnakan. ""Dan saya sampaikan bahwa tentu tidak mungkin seketika semua kita ubah dan lain-lain, dan sebagainya. Berikut daftar menteri, wakil menteri dan kepala badan yang dilantik Presiden Jokowi hari ini: 1.⁠ ⁠Supratman Andi Agtas jadi Menkumham RI2.⁠ ⁠Bahlil Lahadalia jadi Menteri ESDM3.⁠ ⁠Rosan Roeslani jadi Menteri Investasi4.⁠ ⁠Angga Raka Prabowo Jadi Wamenkominfo5. Simak Video 'Prabowo Tak Hadiri Pelantikan Menteri di Istana, Supratman: Ada Kunker':"
"Profil Bahlil Lahadalia, Resmi Jabat Menteri ESDM Gantikan Arifin Tasrif",detikNews,2024-08-19,Widhia Arum Wibawana,https://news.detik.com/berita/d-7496937/profil-bahlil-lahadalia-resmi-jabat-menteri-esdm-gantikan-arifin-tasrif,"Presiden Joko Widodo (Jokowi) kembali melakukan reshuffle Kabinet Indonesia Maju. Sejumlah menteri, wakil menteri (wamen), dan kepala badan pun resmi dilantik. Salah satunya, Bahlil Lahadalia yang kini menjabat Menteri ESDM (Energi dan Sumber Daya Mineral). Pelantikan dan pengambilan sumpah dilakukan di Istana Kepresidenan, Jakarta, Senin 19 Agustus 2024. Sebanyak tujuh posisi menteri, wamen, dan kepala badan resmi diganti. Mulai dari Menkumham, Menteri ESDM, Menteri Investasi, Wamen Kominfo, Kepala Badan Gizi, Kepala Komunikasi Kepresidenan, dan Kepala BPOM. Bahlil Lahadalia sendiri sebelumnya telah menjabat sebagai Menteri Investasi/Kepala Badan Koordinasi Penanaman Modal (BKPM) dalam Kabinet Indonesia Maju. Kini, Bahlil resmi dilantik menjadi Menteri ESDM menggantikan Arifin Tasrif yang sebelumnya menjabat. Sementara posisi Bahlil sebelumnya diisi oleh Rosan Roeslani yang sebelumnya adalah Ketua Tim Kampanye Nasional Prabowo-Gibran.    Bahlil Lahadalia merupakan pria kelahiran Banda, Maluku, pada 7 Agustus 1976. Mengutip dari situs resmi BKPM, sebelum menjadi anggota kabinet, Bahlil tercatat dalam Himpunan Pengusaha Muda Indonesia (HIPMI) pada tahun 2003. Jabatan tersebut yang mengantarkannya menjadi ketua periode 2015-2019. Bahlil juga pernah memimpin delegasi perdagangan bagi pengusaha muda ke Jepang pada 2016 dan ke Eropa pada 2018 (HIPMI-Europe Trade Mission 2018). Untuk riwayat pendidikannya sendiri, Bahlil lulus dari Sekolah Tinggi Ekonomi, Port Numbay Jayapura, Papua dan Universitas Cendrawasih di Jayapura untuk gelar masternya. Semasa kuliah, Bahlil aktif sebagai pengurus senat mahasiswa hingga bergabung dengan Himpunan Mahasiswa Islam (HMI) dan pernah menjadi Bendahara Umum PB HMI. Menurut catatan redaksi detikcom, kedekatan Bahlil dengan Presiden Jokowi mulai terlihat saat keduanya bertemu pada Musyawarah Nasional HIPMI XVI, Jakarta, pada 2019. Saat itu, Bahlil mendukung mantan Jokowi dan Ma'ruf Amin itu untuk maju ke pemilihan presiden (Pilpres) 2019 putaran kedua. Bahkan, Bahlil tergabung dalam Tim Kampanye Nasional Jokowi-Ma'ruf dan menduduki posisi sebagai Direktur Penggalangan Pemilih Muda. Pada 28 April 2021, Bahlil Lahadalia resmi dilantik sebagai Menteri Investasi/Kepala Badan Koordinasi Penanaman Modal (BKPM) dalam Kabinet Indonesia Maju Jilid II Presiden Joko Widodo dan Wakil Presiden Ma'ruf Amin. Terbaru, pada 19 Agustus 2024, Bahlil resmi dilantik sebagai Menteri Energi dan Sumber Daya Mineral (ESDM). Simak Video 'Jokowi Resmi Lantik 3 Menteri & Wamen: Bahlil, Supratman, Rosan dan Angga':    ","Presiden Joko Widodo (Jokowi) kembali melakukan reshuffle Kabinet Indonesia Maju. Sejumlah menteri, wakil menteri (wamen), dan kepala badan pun resmi dilantik. Pelantikan dan pengambilan sumpah dilakukan di Istana Kepresidenan, Jakarta, Senin 19 Agustus 2024. Bahlil Lahadalia merupakan pria kelahiran Banda, Maluku, pada 7 Agustus 1976. Jabatan tersebut yang mengantarkannya menjadi ketua periode 2015-2019. Untuk riwayat pendidikannya sendiri, Bahlil lulus dari Sekolah Tinggi Ekonomi, Port Numbay Jayapura, Papua dan Universitas Cendrawasih di Jayapura untuk gelar masternya. Semasa kuliah, Bahlil aktif sebagai pengurus senat mahasiswa hingga bergabung dengan Himpunan Mahasiswa Islam (HMI) dan pernah menjadi Bendahara Umum PB HMI. Bahkan, Bahlil tergabung dalam Tim Kampanye Nasional Jokowi-Ma'ruf dan menduduki posisi sebagai Direktur Penggalangan Pemilih Muda. Pada 28 April 2021, Bahlil Lahadalia resmi dilantik sebagai Menteri Investasi/Kepala Badan Koordinasi Penanaman Modal (BKPM) dalam Kabinet Indonesia Maju Jilid II Presiden Joko Widodo dan Wakil Presiden Ma'ruf Amin. Terbaru, pada 19 Agustus 2024, Bahlil resmi dilantik sebagai Menteri Energi dan Sumber Daya Mineral (ESDM). Simak Video 'Jokowi Resmi Lantik 3 Menteri & Wamen: Bahlil, Supratman, Rosan dan Angga':"
Bahlil dan Airlangga Cipika-cipiki Lalu Salam Komando Usai Reshuflle,detikNews,2024-08-19,Isal Mawardi,https://news.detik.com/berita/d-7496922/bahlil-dan-airlangga-cipika-cipiki-lalu-salam-komando-usai-reshuflle,"Presiden Joko Widodo (Jokowi) resmi melantik Bahlil Lahadalia sebagai Menteri ESDM. Usai pelantikan, Bahlil mendapat ucapan selamat dari Menko Perekonomian Airlangga Hartarto. Pantauan detikcom di Istana Kepresidenan, Jakarta Pusat, Senin 19 Agustus 2024, Airlangga terlihat menyalami Bahlil yang baru selesai dilantik. Airlangga, yang mundur dari Ketua Umum Golkar pekan lalu, terlihat cipika-cipiki dengan Bahlil. Setelah itu, Bahlil dan Airlangga terlihat salam komando.    Nama Bahlil sendiri mencuat sebagai calon Ketua Umum Golkar menggantikan Airlangga. Bahlil disebut telah mendapat dukungan dari 37 DPD Provinsi Partai Golkar menjelang Munas yang digelar besok. Berikut daftar menteri, wakil menteri dan kepala badan yang dilantik hari ini: 1.⁠ ⁠Supratman Andi Agtas jadi Menkumham RI2.⁠ ⁠Bahlil Lahadalia jadi Menteri ESDM3.⁠ ⁠Rosan Roeslani jadi Menteri Investasi4.⁠ ⁠Angga Raka Prabowo Jadi Wamenkominfo5. Prof Dadan Hindayana jadi Kepala Badan Gizi6.⁠ ⁠Hasan Nasbi jadi Kepala Kantor Komunikasi Kepresidenan7.⁠ ⁠Taruna Ikrar jadi Kepala BPOM. Simak Video 'Jokowi Resmi Lantik 3 Menteri & Wamen: Bahlil, Supratman, Rosan dan Angga':    ","Presiden Joko Widodo (Jokowi) resmi melantik Bahlil Lahadalia sebagai Menteri ESDM. Airlangga, yang mundur dari Ketua Umum Golkar pekan lalu, terlihat cipika-cipiki dengan Bahlil. Nama Bahlil sendiri mencuat sebagai calon Ketua Umum Golkar menggantikan Airlangga. Prof Dadan Hindayana jadi Kepala Badan Gizi6.⁠ ⁠Hasan Nasbi jadi Kepala Kantor Komunikasi Kepresidenan7.⁠ ⁠Taruna Ikrar jadi Kepala BPOM. Simak Video 'Jokowi Resmi Lantik 3 Menteri & Wamen: Bahlil, Supratman, Rosan dan Angga':"
"Daftar Lengkap Menteri, Wamen, Kepala Badan yang Resmi Dilantik Jokowi",detikNews,2024-08-19,Isal Mawardi,https://news.detik.com/berita/d-7496921/daftar-lengkap-menteri-wamen-kepala-badan-yang-resmi-dilantik-jokowi,"Presiden Joko Widodo (Jokowi) resmi melantik sejumlah pejabat baru hari ini. Ada tujuh pejabat yang dilantik hari ini, kepala badan hingga menteri. Pelantikan itu digelar di Istana Kepresidenan, Jakarta Pusat, Senin 19 Agustus 2024. Selain melantik pejabat baru, Jokowi juga melakukan perombakan di jajaran Kabinet Indonesia Maju. Total, ada tujuh pejabat yang dilantik Jokowi hari ini. Pelantikan tersebut digelar pukul 09.30 WIB hari ini.    Berikut daftar Menteri, Wakil Menteri dan Kepala Badan yang dilantik Jokowi: 1.⁠ ⁠Supratman Andi Agtas jadi Menkumham RI2.⁠ ⁠Bahlil Lahadalia jadi Menteri ESDM3.⁠ ⁠Rosan Roeslani jadi Menteri Investasi4.⁠ ⁠Angga Raka Prabowo Jadi Wamenkominfo5. Prof Dadan Hindayana jadi Kepala Badan Gizi6.⁠ ⁠Hasan Nasbi jadi Kepala Kantor Komunikasi Kepresidenan7.⁠ ⁠Taruna Ikrar jadi Kepala BPOM. Lebih lanjut, Angga Raka akan membantu Menkominfo Budi Arie Setiade melaksanakan tugas di Kominfo. Budi mengatakan Kominfo memiliki tugas yang sangat berat. ""Tugas Kementerian Kominfo sangat berat. Sejumlah hal yang harus dituntaskan dalam waktu singkat,"" kata Budi, Senin 19 Agustus. Menurut Budi, tugas Kominfo yang harus segera selesai adalah: 1. Aturan turunan dan kelembagaan utk pelaksanaan UU Pelindungan Data Pribadi2. Percepatan pemberantasan judi online3. Perbaikan arsitektur dan tata kelola data nasional4. Pemanfaatan AI untuk pelayanan publik Sementara itu, Badan Gizi Nasional merupakan lembaga yang baru dibentuk Presiden Jokowi pada 15 Agustus 2024. Lembaga ini dibentuk Jokowi lewat Peraturan Presiden Nomor 83 Tahun 2024 tentang Badan Gizi Nasional. Badan Gizi Nasional dipimpin oleh seorang Kepala yang kini telah sah dijabat oleh Dadan Hindayana. Dadan akan bertugas memimpin dan bertanggung jawab atas tugas di lembaga ini. Dadan juga akan dibantu banyak deputi untuk melaksanakan tugas-tugas Badan Gizi Nasional. Sementara, Taruna Ikrar dilantik sebagai Kepala BPOM definitif setelah Penny K Lukito mengakhiri tugasnya sebagai Kepala BPOM pada November 2023. Saat ini, jabatan Kepala BPOM diisi oleh pelaksana tugas, yakni Rizka Andalusia. Untuk jabatan Kepala Kantor Komunikasi Kepresidenan diketahui itu jabatan yang baru ditetapkan Presiden Jokowi melalui Perpes. Pembentukan Kantor Komunikasi Kepresidenan dibentuk lewat Peraturan Presiden Nomor 82 Tahun 2024, ditandatangani Jokowi pada 15 Agustus 2024 dan diundangkan pada hari yang sama. Lembaga ini dibentuk dalam rangka mewujudkan efektivitas penyelenggaraan komunikasi dan informasi strategis Presiden secara sinergis dan terpadu. ""Kantor Komunikasi Kepresidenan adalah lembaga nonstruktural yang dibentuk oleh Presiden untuk melaksanakan komunikasi dan informasi kebijakan strategis dan program prioritas Presiden,"" demikian bunyi Pasal 1 poin 1 Perpres ini. ","Presiden Joko Widodo (Jokowi) resmi melantik sejumlah pejabat baru hari ini. Ada tujuh pejabat yang dilantik hari ini, kepala badan hingga menteri. Pelantikan itu digelar di Istana Kepresidenan, Jakarta Pusat, Senin 19 Agustus 2024. Selain melantik pejabat baru, Jokowi juga melakukan perombakan di jajaran Kabinet Indonesia Maju. Berikut daftar Menteri, Wakil Menteri dan Kepala Badan yang dilantik Jokowi: 1.⁠ ⁠Supratman Andi Agtas jadi Menkumham RI2.⁠ ⁠Bahlil Lahadalia jadi Menteri ESDM3.⁠ ⁠Rosan Roeslani jadi Menteri Investasi4.⁠ ⁠Angga Raka Prabowo Jadi Wamenkominfo5. Prof Dadan Hindayana jadi Kepala Badan Gizi6.⁠ ⁠Hasan Nasbi jadi Kepala Kantor Komunikasi Kepresidenan7.⁠ ⁠Taruna Ikrar jadi Kepala BPOM. Sejumlah hal yang harus dituntaskan dalam waktu singkat,"" kata Budi, Senin 19 Agustus. Aturan turunan dan kelembagaan utk pelaksanaan UU Pelindungan Data Pribadi2. Perbaikan arsitektur dan tata kelola data nasional4. Pemanfaatan AI untuk pelayanan publik Sementara itu, Badan Gizi Nasional merupakan lembaga yang baru dibentuk Presiden Jokowi pada 15 Agustus 2024. Lembaga ini dibentuk Jokowi lewat Peraturan Presiden Nomor 83 Tahun 2024 tentang Badan Gizi Nasional. Dadan akan bertugas memimpin dan bertanggung jawab atas tugas di lembaga ini. Kantor Komunikasi Kepresidenan adalah lembaga nonstruktural yang dibentuk oleh Presiden untuk melaksanakan komunikasi dan informasi kebijakan strategis dan program prioritas Presiden,"" demikian bunyi Pasal 1 poin 1 Perpres ini."
"Jokowi Lantik Wamenkominfo Angga Raka Prabowo, Kepala Kantor Komunikasi Hasan Nasbi",detikNews,2024-08-19,Isal Mawardi,https://news.detik.com/berita/d-7496907/jokowi-lantik-wamenkominfo-angga-raka-prabowo-kepala-kantor-komunikasi-hasan-nasbi,"Presiden Joko Widodo (Jokowi) resmi melantik Wakil Menteri Komunikasi dan Informasi (Wamenkominfo). Jokowi juga melantik Kepala Kantor Komunikasi Kepresidenan. Wamenkominfo dijabat oleh Angga Raka Prabowo. Sedangkan Kepala Kantor Komunikasi Kepresidenan dijabat oleh Hasan Nasbi. Angga Raka dilantik bersamaan Rosan Roeslani, Supratman Andi Agtas, dan Bahlil Lahadalia. Sedangkan Hasan Nasbi dilantik bersama dua kepala badan yang juga dilantik hari ini.    ""Bahwa saya akan setia kepada Undang-Undang Dasar Negara Republik Indonesia tahun 1945 serta akan menjalankan segala peraturan perundang-undangan dengan selurus-lurusnya demi darma bakti saya kepada bangsa dan negara. Bahwa saya dalam menjalankan tugas jabatan akan menjunjung tinggi etika jabatan bekerja dengan sebaik-baiknya dengan penuh rasa tanggung jawab,"" ucap sumpah jabatan yang dibacakan Jokowi dan diikuti menteri dan pejabat yang dilantik, Senin 19 Agustus 2024. Angga Raka akan membantu Menkominfo Budi Arie Setiade melaksanakan tugas di Kominfo. Budi mengatakan Kominfo memiliki tugas yang sangat berat. ""Tugas Kementerian Kominfo sangat berat. Sejumlah hal yang harus dituntaskan dalam waktu singkat,"" kata Budi, Senin 19 Agustus. Menurut Budi, tugas Kominfo yang harus segera selesai adalah: 1. Aturan turunan dan kelembagaan utk pelaksanaan UU Pelindungan Data Pribadi2. Percepatan pemberantasan judi online3. Perbaikan arsitektur dan tata kelola data nasional4. Pemanfaatan AI untuk pelayanan publik. Untuk jabatan Kepala Kantor Komunikasi Kepresidenan diketahui itu jabatan yang baru ditetapkan Presiden Jokowi melalui Perpes. Pembentukan Kantor Komunikasi Kepresidenan dibentuk lewat Peraturan Presiden Nomor 82 Tahun 2024, ditandatangani Jokowi pada 15 Agustus 2024 dan diundangkan pada hari yang sama. Lembaga ini dibentuk dalam rangka mewujudkan efektivitas penyelenggaraan komunikasi dan informasi strategis Presiden secara sinergis dan terpadu. ""Kantor Komunikasi Kepresidenan adalah lembaga nonstruktural yang dibentuk oleh Presiden untuk melaksanakan komunikasi dan informasi kebijakan strategis dan program prioritas Presiden,"" demikian bunyi Pasal 1 poin 1 Perpres ini. Simak Video '7 Posisi yang Dilantik Jokowi dari Menteri, Wamen, hingga Kepala Badan':    ","Presiden Joko Widodo (Jokowi) resmi melantik Wakil Menteri Komunikasi dan Informasi (Wamenkominfo). Jokowi juga melantik Kepala Kantor Komunikasi Kepresidenan. Wamenkominfo dijabat oleh Angga Raka Prabowo. Sedangkan Kepala Kantor Komunikasi Kepresidenan dijabat oleh Hasan Nasbi. Angga Raka akan membantu Menkominfo Budi Arie Setiade melaksanakan tugas di Kominfo. Sejumlah hal yang harus dituntaskan dalam waktu singkat,"" kata Budi, Senin 19 Agustus. Menurut Budi, tugas Kominfo yang harus segera selesai adalah: 1. Perbaikan arsitektur dan tata kelola data nasional4. Kantor Komunikasi Kepresidenan adalah lembaga nonstruktural yang dibentuk oleh Presiden untuk melaksanakan komunikasi dan informasi kebijakan strategis dan program prioritas Presiden,"" demikian bunyi Pasal 1 poin 1 Perpres ini. Simak Video '7 Posisi yang Dilantik Jokowi dari Menteri, Wamen, hingga Kepala Badan':"
Hari Orang Utan Sedunia 19 Agustus 2024: Sejarah dan Tujuan,detikNews,2024-08-19,Widhia Arum Wibawana,https://news.detik.com/berita/d-7497115/hari-orang-utan-sedunia-19-agustus-2024-sejarah-dan-tujuan,"Tanggal 19 Agustus memperingati Hari Orang Utan Sedunia (World Orangutan Day). Hari ini diperingati dalam rangka menunjukkan dukungan kepada orang utan, serta untuk mendorong tindakan melindungi dan melestarikan habitatnya. Orang utan adalah kera besar dan kuat yang hanya terdapat di hutan di Sumatra dan Kalimantan. Ciri-ciri hewan ini adalah berambut merah kecokelat-cokelatan dan tidak berekor. Orang utan adalah pemakan buah-buahan hingga dedaunan. Mengutip dari National Day Calendar, Hari Orangutan Sedunia (International Orangutan Day) dicetuskan oleh organisasi World Orangutan Events. Sebuah organisasi nirlaba yang berkomitmen dalam konservasi orang utan liar dan habitat hutan hujan mereka.    World Orangutan Events menetapkan 19 Agustus sebagai Hari Orang Utan dalam rangka mempromosikan konservasi dan kesejahteraan orang utan. Organisasi ini juga mencetuskan Pekan Peduli Orangutan yang dirayakan setiap bulan November. Sejarah Hari Orang Utan Internasional mencakup komitmen global terhadap kampanye pendidikan, acara penggalangan dana, dan inisiatif media sosial yang bertujuan untuk meningkatkan kesadaran dan mendorong tindakan perlindungan bagi spesies ini. Seperti dilansir laman World Orangutan Events, tujuan diperingatinya Hari Orang Utan Sedunia setiap tanggal 19 Agustus adalah bertujuan mendorong masyarakat dunia untuk mengambil tindakan dalam rangka melestarikan spesies orang utan. Selain itu, peringatan Hari Orang Utan Sedunia juga bermaksud untuk meningkatkan kesadaran masyarakat global tentang kesulitan kelangsungan hidup spesies orang utan, yang telah berkembang dari terancam punah menjadi sangat terancam punah. Untuk turut serta merayakan peringatan Hari Orang Utan setiap 19 Agustus, ada banyak cara yang bisa dilakukan dalam rangka meningkatkan kesadaran masyarakat dan bentuk pelestarian spesies orang utan. Berikut beberapa di antaranya: ","Tanggal 19 Agustus memperingati Hari Orang Utan Sedunia (World Orangutan Day). Orang utan adalah kera besar dan kuat yang hanya terdapat di hutan di Sumatra dan Kalimantan. Ciri-ciri hewan ini adalah berambut merah kecokelat-cokelatan dan tidak berekor. Orang utan adalah pemakan buah-buahan hingga dedaunan. Mengutip dari National Day Calendar, Hari Orangutan Sedunia (International Orangutan Day) dicetuskan oleh organisasi World Orangutan Events. Sejarah Hari Orang Utan Internasional mencakup komitmen global terhadap kampanye pendidikan, acara penggalangan dana, dan inisiatif media sosial yang bertujuan untuk meningkatkan kesadaran dan mendorong tindakan perlindungan bagi spesies ini. Seperti dilansir laman World Orangutan Events, tujuan diperingatinya Hari Orang Utan Sedunia setiap tanggal 19 Agustus adalah bertujuan mendorong masyarakat dunia untuk mengambil tindakan dalam rangka melestarikan spesies orang utan."
Lalin Tol Janger Arah Tomang Macet dari Km 16-Km 4 Imbas Mobil Kecelakaan,detikNews,2024-08-19,Yulida Medistiara,https://news.detik.com/berita/d-7496777/lalin-tol-janger-arah-tomang-macet-dari-km-16-km-4-imbas-mobil-kecelakaan,"Satu unit mobil mengalami kecelakaan di Tol Jakarta Tangerang arah Jakarta pagi ini. Imbasnya lalu lintas mengalami kepadatan pagi ini. ""Ada penanganan kecelakaan kendaraan HRV di bahu luar,"" ujar petugas call center Jasa Marga, Cindy, saat dihubungi, Senin 19 Agustus 2024. Saat ini kendaraan tersebut telah ditangani. Adapun lalu lintas di lokasi dilaporkan mengalami kemacetan.    ""Informasi lalin padat arah Tomang, kepadatan dari Km 16 sampai Km 4,"" katanya. ","Satu unit mobil mengalami kecelakaan di Tol Jakarta Tangerang arah Jakarta pagi ini. Imbasnya lalu lintas mengalami kepadatan pagi ini. "" Ada penanganan kecelakaan kendaraan HRV di bahu luar,"" ujar petugas call center Jasa Marga, Cindy, saat dihubungi, Senin 19 Agustus 2024."
Suami di Trenggalek Tewas Saat Tolong Istri yang Pingsan di Banana Boat,detikNews,2024-08-19,Denza Perdana,https://news.detik.com/berita/d-7497027/suami-di-trenggalek-tewas-saat-tolong-istri-yang-pingsan-di-banana-boat,"Pria berinisial MTN (63) tewas saat berusaha menolong istrinya yang pingsan di Pantai Mutiara, Trenggalek, Jawa Timur. Saat itu, istri dari MTN pingsan ketika wahana banana boat digulingkan sesuai kesepakatan. Peristiwa itu terjadi di Pantai Mutiara, Desa Tasikmadu, Kecamatan Watulimo, Trenggalek, Minggu 18 Agustus siang pukul 13.30 WIB. Saat itu korban berinisial MTN bersama rombongannya bersepakat menaiki wahana banana boat. ""Sebelum naik sudah ada kesepakatan minta digulingkan tapi agak di tepi,"" ujar Kepala Desa Tasikmadu, Wignyo Handoyo kepada wartawan, dilansir detikJatim.    Sesuai kesepakatan itu rombongan termasuk MTN menikmati banana boat dengan mengelilingi kawasan pantai. Saat berada di dekat bibir pantai, wahana itu digulingkan sehingga seluruh rombongan tercebur ke pantai. ""Saat itulah istri korban pingsan sehingga langsung dievakuasi oleh pengelola wahana,"" imbuhnya. Melihat istrinya dievakuasi, korban MTN berusaha ke tepian dengan berenang lebih cepat. Namun pada saat sampai di tepi pantai korban justru lemas hingga akhirnya pingsan. ""Akhirnya Bapak MTN itu dibawa ke Puskemas Watulimo untuk mendapatkan pertolongan medis. Namun saat tiba di sana ternyata dinyatakan sudah meninggal. Kalau untuk istrinya sehat,"" jelasnya. Baca selengkapnya di sini  ","Pria berinisial MTN (63) tewas saat berusaha menolong istrinya yang pingsan di Pantai Mutiara, Trenggalek, Jawa Timur. Saat itu korban berinisial MTN bersama rombongannya bersepakat menaiki wahana banana boat. "" Sebelum naik sudah ada kesepakatan minta digulingkan tapi agak di tepi,"" ujar Kepala Desa Tasikmadu, Wignyo Handoyo kepada wartawan, dilansir detikJatim. Melihat istrinya dievakuasi, korban MTN berusaha ke tepian dengan berenang lebih cepat. Namun pada saat sampai di tepi pantai korban justru lemas hingga akhirnya pingsan. "" Namun saat tiba di sana ternyata dinyatakan sudah meninggal."
"Gantikan Arifin Tasrif, Bahlil: Saya dengan Beliau Seperti Abang Adek",detikNews,2024-08-19,Isal Mawardi,https://news.detik.com/berita/d-7496998/gantikan-arifin-tasrif-bahlil-saya-dengan-beliau-seperti-abang-adek,"Bahlil Lahadalia telah dilantik sebagai Menteri Energi Sumber Daya Mineral (ESDM). Bahlil mengatakan akan bersilaturahmi dengan Arifin Tasrif, Menteri ESDM yang menjabat sebelum dirinya. ""Saya pasti habis ini akan komunikasi sama Pak Arifin, karena saya dengan beliau kan seperti abang adek. Komunikasi kami kan sangat baik sekali,"" kata Bahlil di Istana Negara usai pelantikan, Jakarta, Senin 19 Agustus 2024. Dia mengatakan akan tetap bekerja optimal meski masa pemerintahan Presiden Joko Widodo (Jokowi) hanya tersisa sekitar dua bulan. Bahlil mengatakan akan melanjutkan kiprah kinerja yang telah dilakukan Arifin Tasrif.    ""Pasti yang sudah bagus, saya akan lanjutkan. Kemudian saya akan tanyakan apa-apa PR yang harus saya selesaikan. Bukan berarti ada pejabat baru masuk lalu merombak, tidak boleh. Yang sudah bagus kita lanjutkan. Kan pemerintah harus begitu, yang belum bagus ya kita sempurnakan,"" ungkapnya. Bahlil mengaku mendapatkan arahan untuk mengoptimalkan potensi dan produksi sumber daya alam (SDA). Dia mengatakan pemerintahan sejatinya memang harus dilakukan secara berkesinambungan. ""Hari ini kami dilantik sebagai Menteri ESDM, sudah barang tentu Bapak Presiden atas arahannya untuk melakukan beberapa langkah dalam rangka percepatan dalam rangka mengoptimalkan potensi dan produksi SDA kita dalam rangka meningkatkan pendapatan negara dan menciptakan pekerjaan,"" ujar dia. Bahlil mengatakan akan fokus atas jabatan baru yang diembannya. Pengalaman sebagai pengusaha akan dipakainya untuk memperbaiki sejalan dengan kebutuhan dunia usaha. Dia juga mengatakan akan terus berkoordinasi dengan Rosan Roeslani, Menteri Investasi/Kepala Badan Koordinasi Penanaman Modal yang baru. Diketahui, Bahlil sebelumnya juga menjabat sebagai Menteri Investasi. ""Pak Rosan adalah senior saya, sebagian dari pekerjaan ESDM itu hilirnya ada di Kementerian Investiasi, terutama menyangkut dengan IUP, pasti saya komunikasi dengan Pak Rosan,"" katanya.  Simak Video 'Momen AGK Salami-Tunjuk Bahlil Seusai Reshuffle: Ketum Selanjutnya':    ","Bahlil Lahadalia telah dilantik sebagai Menteri Energi Sumber Daya Mineral (ESDM). Bahlil mengatakan akan bersilaturahmi dengan Arifin Tasrif, Menteri ESDM yang menjabat sebelum dirinya. "" Dia mengatakan akan tetap bekerja optimal meski masa pemerintahan Presiden Joko Widodo (Jokowi) hanya tersisa sekitar dua bulan. Bahlil mengatakan akan melanjutkan kiprah kinerja yang telah dilakukan Arifin Tasrif. ""Pasti yang sudah bagus, saya akan lanjutkan. Kemudian saya akan tanyakan apa-apa PR yang harus saya selesaikan. Dia mengatakan pemerintahan sejatinya memang harus dilakukan secara berkesinambungan. "" Pengalaman sebagai pengusaha akan dipakainya untuk memperbaiki sejalan dengan kebutuhan dunia usaha. Pak Rosan adalah senior saya, sebagian dari pekerjaan ESDM itu hilirnya ada di Kementerian Investiasi, terutama menyangkut dengan IUP, pasti saya komunikasi dengan Pak Rosan,"" katanya. Simak Video 'Momen AGK Salami-Tunjuk Bahlil Seusai Reshuffle: Ketum Selanjutnya':"
