title,category,publish_date,author,article_url,content,summary
Awkarin Polisikan Admin soal Dugaan Penggelapan Rp 400 Juta,detikNews,2024-07-19,Wildan Noviansah,https://news.detik.com/berita/d-7447125/awkarin-polisikan-admin-soal-dugaan-penggelapan-rp-400-juta,"Selebgram Karin Novilda atau dikenal sebagai Awkarin membuat laporan dugaan penggelapan ke polisi. Terlapor dalam kasus dugaan penggelapan tersebut adalah admin media sosialnya. ""Iya betul, ada buat laporan. Pelapor Karin Novilda, terlapornya kalau nggak salah adminnya,"" kata Kapolsek Cilandak Kompol Wahid Key, saat dimintai konfirmasi, Jumat 19 Juli 2024. Wahid mengatakan Awkarin melaporkan adminnya terkait dugaan penggelapan dana Rp 400 juta.    ""Dugaan penggelapannya, jadi kita lagi dalami jumlahnya, tapi dia melaporkan sekitar kalau dari Pelapor itu sekitar Rp 300-400 juta,"" ujarnya. Wahid menyebut pihaknya sudah melakukan klarifikasi awal terhadap Awkarin. Polisi juga sudah memeriksa terlapor, dalam hal ini admin Awkarin. ""Sudah dimintai keterangan. Nanti, kalau mungkin ada keterangan yang masih kita perlukan, akan kami panggil lagi. Pokoknya penanganan, betul lagi penanganan dari, betul laporannya ada di Polsek Cilandak,"" jelasnya.  ","Selebgram Karin Novilda atau dikenal sebagai Awkarin membuat laporan dugaan penggelapan ke polisi. Terlapor dalam kasus dugaan penggelapan tersebut adalah admin media sosialnya. "" ""Dugaan penggelapannya, jadi kita lagi dalami jumlahnya, tapi dia melaporkan sekitar kalau dari Pelapor itu sekitar Rp 300-400 juta,"" ujarnya. Wahid menyebut pihaknya sudah melakukan klarifikasi awal terhadap Awkarin. Nanti, kalau mungkin ada keterangan yang masih kita perlukan, akan kami panggil lagi."
"Permudah Akses Kesehatan, Pemkot Surabaya Tempatkan Nakes di 1.177 Balai RW",detikNews,2024-07-19,Erika Dyah,https://news.detik.com/berita/d-7447101/permudah-akses-kesehatan-pemkot-surabaya-tempatkan-nakes-di-1-177-balai-rw,"Pemerintah Kota Surabaya meluncurkan program integrasi layanan primer (ILP) kesehatan melalui inovasi 1 RW 1 tenaga kesehatan (R1N1). Program ini dirancang untuk menyediakan layanan kesehatan di 1.177 Balai RW dengan menempatkan satu tenaga kesehatan (nakes) di setiap Balai RW. Wali Kota Eri Cahyadi berharap program ini mampu mengurangi antrean di Puskesmas dengan memberikan pemeriksaan rutin di Balai RW. ""Kalau warga merasa kurang sehat, bisa segera periksa ke nakes di Balai RW. Sehingga bisa segera ditangani dan mendapatkan obat yang dikirim ke Balai RW,"" kata Eri dalam keterangan tertulis, Jumat 19 Juli 2024.    Dalam peresmian layanan R1N1 di Kelurahan Menur Pumpungan, Kecamatan Sukolilo, pada Rabu 17 Juli, Eri menerangkan Program R1N1 menjadi langkah pencegahan dini terhadap penyakit ringan maupun berisiko tinggi. Ia berharap adanya pemeriksaan rutin dan akses yang mudah membuat warga yang merasakan gejala ringan bisa segera mendapatkan penanganan tanpa harus antre di Puskesmas. ""Jika itu tertangani cepat, maka angka harapan hidup dan kesehatan warga Surabaya menjadi semakin baik,"" imbuhnya. Eri mengatakan pihaknya turut menggandeng Ikatan Bidan Indonesia (IBI) Kota Surabaya dan Persatuan Perawat Nasional Indonesia (PPNI) Kota Surabaya dalam menjalankan Program R1N1 ini. ""Kerja sama ini penting untuk memastikan program berjalan dengan baik,"" tuturnya. Ia menambahkan layanan R1N1 juga dilengkapi dengan peralatan medis ringan, seperti alat pemeriksaan gula darah dan kolesterol. Dinas Kesehatan (Dinkes) Surabaya bahkan berencana menambahkan dokter penanggung jawab di setiap layanan primer pada tahun 2025. ""Maka nanti di 2025 ada dokter penanggung jawabnya, dengan begitu penanganan kesehatannya akan lebih cepat,"" ujar Ketua Asosiasi Pemerintah Kota Seluruh Indonesia (APEKSI) ini. Selain menggandeng nakes, lanjutnya, Pemkot Surabaya juga merangkul perguruan tinggi untuk mendukung program R1N1. Eri berharap mahasiswa kedokteran bisa melakukan praktik di layanan R1N1, serupa dengan program Sinau Bareng yang melibatkan perguruan tinggi. ""Nantinya bisa dijadikan praktik untuk mahasiswa kedokteran. Kita bergeraknya seperti sekarang yang kita lakukan Sinau Bareng di Balai RW juga dari perguruan tinggi,"" jelasnya. Lebih lanjut, Eri berterima kasih kepada seluruh stakeholder yang terlibat dalam program R1N1. Ia berharap program ini dapat meningkatkan penerapan ILP di Kota Surabaya. ""Setiap kelurahan nanti akan memiliki satu layanan primer yang terkoneksi dengan dokter, sehingga penanganan kesehatan bisa lebih cepat,"" harapnya. Dalam kesempatan yang sama, Kepala Dinkes Kota Surabaya Nanik Sukristina mengungkapkan pemkot telah menyediakan berbagai layanan pemeriksaan kesehatan dasar di program R1N1, di antaranya konsultasi kesehatan, skrining kesehatan, dan pengobatan dasar. ""Jadwalnya nanti menyesuaikan masing-masing Balai RW. Kami agendakan Senin sampai Jumat. Nah ini kami adakan di 1.177 Balai RW se-Surabaya,"" ungkap Nanik. Selain R1N1, Pemkot Surabaya juga meluncurkan layanan 1 kelurahan 1 ambulans pada 22 Juli 2024. Program ini bertujuan mempercepat dan mempermudah akses masyarakat ke rumah sakit atau fasilitas pelayanan kesehatan (fasyankes). Diketahui, peningkatan layanan kesehatan melalui program 1 ambulans 1 kelurahan ini didasari pada tingginya permintaan masyarakat. Misalnya, pada bulan Juni 2024, ambulans Dinas Sosial telah melayani sebanyak 142 kali antar jemput jenazah dan 1.065 kali antar jemput pasien. Pelayanan pasien kontrol dan terapi ke rumah sakit ini dilakukan dalam dua shift dengan rata-rata 3 hingga 4 kali dalam sebulan. Kepala Dinas Sosial (Dinsos) Kota Surabaya Anna Fajrihatin menjelaskan layanan 1 kelurahan 1 ambulans merupakan hasil kolaborasi antara pemerintah dan masyarakat. Ambulans yang dikelola pemkot dan swadaya milik masyarakat akan diintegrasikan dengan layanan Command Center (CC) 112. ""Saat ini 153 kelurahan se-Surabaya sudah terpenuhi ambulansnya. Artinya, 1 kelurahan sudah punya 1 ambulans, tinggal sistemnya yang akan terintegrasi,"" kata Anna. Ia menilai integrasi pelayanan tersebut membuat pembagian tugas ambulans menjadi lebih efisien. Anna pun berharap adanya layanan 1 kelurahan 1 ambulans membuat antar-jemput pasien menjadi lebih efisien dan tepat waktu. ""Program ini penting agar tidak ada warga yang menunggu terlalu lama untuk mendapatkan pelayanan kesehatan,"" tegasnya. Dengan semangat gotong royong, kata Anna, Pemkot Surabaya berharap program ini dapat mempercepat dan mempermudah masyarakat dalam mendapatkan layanan kesehatan. ""Ini adalah hasil gotong royong masyarakat dan pemerintah kota,"" pungkasnya. ","Pemerintah Kota Surabaya meluncurkan program integrasi layanan primer (ILP) kesehatan melalui inovasi 1 RW 1 tenaga kesehatan (R1N1). Program ini dirancang untuk menyediakan layanan kesehatan di 1.177 Balai RW dengan menempatkan satu tenaga kesehatan (nakes) di setiap Balai RW. Kalau warga merasa kurang sehat, bisa segera periksa ke nakes di Balai RW. Kerja sama ini penting untuk memastikan program berjalan dengan baik,"" tuturnya. Selain menggandeng nakes, lanjutnya, Pemkot Surabaya juga merangkul perguruan tinggi untuk mendukung program R1N1. Nantinya bisa dijadikan praktik untuk mahasiswa kedokteran. Kita bergeraknya seperti sekarang yang kita lakukan Sinau Bareng di Balai RW juga dari perguruan tinggi,"" jelasnya. Ia berharap program ini dapat meningkatkan penerapan ILP di Kota Surabaya. "" Dalam kesempatan yang sama, Kepala Dinkes Kota Surabaya Nanik Sukristina mengungkapkan pemkot telah menyediakan berbagai layanan pemeriksaan kesehatan dasar di program R1N1, di antaranya konsultasi kesehatan, skrining kesehatan, dan pengobatan dasar. "" Jadwalnya nanti menyesuaikan masing-masing Balai RW. Nah ini kami adakan di 1.177 Balai RW se-Surabaya,"" ungkap Nanik. Selain R1N1, Pemkot Surabaya juga meluncurkan layanan 1 kelurahan 1 ambulans pada 22 Juli 2024. Diketahui, peningkatan layanan kesehatan melalui program 1 ambulans 1 kelurahan ini didasari pada tingginya permintaan masyarakat. Pelayanan pasien kontrol dan terapi ke rumah sakit ini dilakukan dalam dua shift dengan rata-rata 3 hingga 4 kali dalam sebulan. Saat ini 153 kelurahan se-Surabaya sudah terpenuhi ambulansnya. Artinya, 1 kelurahan sudah punya 1 ambulans, tinggal sistemnya yang akan terintegrasi,"" kata Anna. Ia menilai integrasi pelayanan tersebut membuat pembagian tugas ambulans menjadi lebih efisien. Program ini penting agar tidak ada warga yang menunggu terlalu lama untuk mendapatkan pelayanan kesehatan,"" tegasnya. Ini adalah hasil gotong royong masyarakat dan pemerintah kota,"" pungkasnya."
Helikopter Jatuh di Badung Bali!,detikNews,2024-07-19,Hakim Dwi Saputra,https://news.detik.com/berita/d-7447099/helikopter-jatuh-di-badung-bali,"Sebuah helikopter jatuh di kawasan Suluban, Desa Pecatu, Kecamatan Kuta Selatan, Kabupaten Badung, Bali. Petugas terkait meluncur ke lokasi. Polisi membenarkan peristiwa tersebut. Petugas sudah turun ke tempat kejadian perkara (TKP). ""Anggota masih diturunkan ke TKP,"" ujar Kepala Bidang Hubungan Masyarakat (Kabid Humas) Polda Bali Kombes Jansen Avitus Panjaitan saat dimintai konfirmasi, seperti dilansir detikBali, pada Jumat 19 Juli 2024.    Belum diketahui kronologi lengkap peristiwa tersebut. Aparat terkait masih bekerja. Dari video yang diterima detikBali, tampak sebuah helikopter terbalik di bawah tebing. Bagian ekornya hancur menyisakan puing-puing. Sementara itu, badan helikopter tampak masih berbentuk. Bagian bawah helikopter terlihat berwarna putih. Sejumlah orang berlarian ke arah helikopter. Beberapa orang lainnya yang diduga warga sekitar mengelilingi helikopter. Tidak terlihat ada petugas medis maupun penyelamat di lokasi. Baca selengkapnya di sini.","Sebuah helikopter jatuh di kawasan Suluban, Desa Pecatu, Kecamatan Kuta Selatan, Kabupaten Badung, Bali. Anggota masih diturunkan ke TKP,"" ujar Kepala Bidang Hubungan Masyarakat (Kabid Humas) Polda Bali Kombes Jansen Avitus Panjaitan saat dimintai konfirmasi, seperti dilansir detikBali, pada Jumat 19 Juli 2024. Bagian ekornya hancur menyisakan puing-puing. Sementara itu, badan helikopter tampak masih berbentuk. Sejumlah orang berlarian ke arah helikopter. Tidak terlihat ada petugas medis maupun penyelamat di lokasi."
"KPK Lelang Tanah Eks Bupati Mojokerto Mustofa Kamal Pasa Senilai Rp 4,2 M",detikNews,2024-07-19,Yogi Ernes,https://news.detik.com/berita/d-7447088/kpk-lelang-tanah-eks-bupati-mojokerto-mustofa-kamal-pasa-senilai-rp-4-2-m,"KPK melelang barang rampasan dari perkara mantan Bupati Mojokerto Mustofa Kamal Pasa. Barang rampasan yang dilelang itu berupa tanah seluas 1.720 meter persegi di Jawa Tengah. Dilihat dari situs resmi KPK, Jumat 19 Juli 2024, tanah tersebut berada di Desa Pasuruhan, Kecamatan Mertoyudan, Kabupaten Magelang, Jawa Tengah. Nilai dari tanah itu mencapai Rp 4,2 miliar. ""Harga limit Rp 4.289.253.000 (miliar),"" tulis keterangan di situs KPK.    Lelang bakal digelar pada 1 Agustus 2024. Proses lelang dilakukan secara daring di situs lelang.go.id pada KPKNL Semarang. ""Pemenang lelang harus melunasi harga pembelian dan biaya lelang sebesar 2% dari pokok lelang (harga penawaran) melalui VA pemenang lelang paling lambat 5 hari kerja setelah pelaksanaan lelang, jika tidak dipenuhi maka dinyatakan batal dan wanprestasi serta uang jaminan disetorkan ke kas negara sebagai penerimaan lain-lain,"" tulis KPK. Dalam lelang itu ada uang jaminan minimal Rp 857.850.600. KPK mengatakan sertifikat hak milik asli tidak dikuasai. KPK mengatakan tanah tersebut merupakan barang rampasan dari perkara 3/Pid.Sus-TPK/2022/PN Sby. Perkara tersebut terkait kasus gratifikasi dan tindak pidana pencucian uang. Mustofa Kamal Pasa diketahui telah ditetapkan KPK sebagai tersangka dalam kasus suap dan gratifikasi terkait proyek menara telekomunikasi di Mojokerto tahun 2015. Penetapan tersangka dilakukan pada 2018. Dia diadili untuk kasus suap. Mustofa divonis 8 tahun penjara, denda Rp 500 juta, uang pengganti Rp 2,7 miliar dan pencabutan hak politik selama 5 tahun pada pengadilan tingkat pertama. Hukuman penjaranya kemudian dikurangi menjadi 7 tahun pada tingkat banding. Mustofa kembali diadili dalam kasus gratifikasi dan tindak pidana pencucian uang. Mustofa dijatuhi hukuman 6 tahun penjara, denda Rp 5 miliar subsider 1 tahun 4 bulan kurungan, serta uang pengganti Rp 17.012.806.168 (17 miliar).","KPK melelang barang rampasan dari perkara mantan Bupati Mojokerto Mustofa Kamal Pasa. Lelang bakal digelar pada 1 Agustus 2024. Pemenang lelang harus melunasi harga pembelian dan biaya lelang sebesar 2% dari pokok lelang (harga penawaran) melalui VA pemenang lelang paling lambat 5 hari kerja setelah pelaksanaan lelang, jika tidak dipenuhi maka dinyatakan batal dan wanprestasi serta uang jaminan disetorkan ke kas negara sebagai penerimaan lain-lain,"" tulis KPK. Dalam lelang itu ada uang jaminan minimal Rp 857.850.600. KPK mengatakan sertifikat hak milik asli tidak dikuasai. KPK mengatakan tanah tersebut merupakan barang rampasan dari perkara 3/Pid. Hukuman penjaranya kemudian dikurangi menjadi 7 tahun pada tingkat banding. Mustofa kembali diadili dalam kasus gratifikasi dan tindak pidana pencucian uang. Mustofa dijatuhi hukuman 6 tahun penjara, denda Rp 5 miliar subsider 1 tahun 4 bulan kurungan, serta uang pengganti Rp 17.012.806.168 (17 miliar)."
Operator Scam Online Jaringan Internasional Ditangkap Saat Mau Pulang Kampung,detikNews,2024-07-19,Rumondang Naibaho,https://news.detik.com/berita/d-7447082/operator-scam-online-jaringan-internasional-ditangkap-saat-mau-pulang-kampung,"Bareskrim Polri menangkap satu buron kasus scam online jaringan internasional berinisial L (26). Dia ditangkap di Terminal 3 Bandara Soekarno-Hatta, Tangerang. Kasubdit II Dittipisiber Bareskrim Polri, Kombes Alfis Suhaili, menyebut penangkapan dilakukan pada Rabu 17 Juli dini hari. Keberadaan L mulanya diketahui dari manifest perlintasan yang diinformasikan oleh NCB Interpol. ""Bahwa salah satu tersangka yang telah masuk dalam daftar red notice ini telah melintas dari Dubai menuju ke Jakarta sehingga kami dari Dittipidsiber Bareskrim Polri mengecek ke terminal 3 Soekarno-Hatta dan ternyata memang benar bahwa tersangka yang sudah kita publish di red notice pada tanggal 23 November 2023 betul adalah salah satu tersangka yang kita cari,"" kata Alfis dalam jumpa pers di Mabes Polri, Jakarta Selatan, Jumat 19 Juli 2024.    Adapun L merupakan warga negara Indonesia asal Sukabumi, Jawa Barat. Dia berperan sebagai operator dalam sindikat itu sejak Mei hingga Agustus 2023. ""Dia bekerja di Dubai sebagai operator itu sekitar bulan Mei sampai Agustus 2023. Di sana dia mendapatkan gaji sama dengan pemeran operator lainnya yaitu sebesar 3.500 dirham (Rp 15 juta),"" ungkap Alfis. Bergabungnya L pada sindikat scam internasional itu, kata Alfis, bukan melalui rekrutmen yang diorganisir dari Indonesia. Melainkan, dia direkrut saat tengah mencari kerja di Dubai. ""Dia datang awalnya sendiri saja karena sudah ada saudaranya di sana di Dubai. Nah sampai di sana awalnya ingin mencari pekerjaan apa saja tapi ternyata di rekrut oleh kelompok ini, dilatih untuk menjadi operator melakukan social engineering,"" jelas Alfis. ""Melakukan blasting. Mengelola platform media sosial. Melakukan komunikasi dengan korban dan calon-calon korban dan disebutkan juga dalam keterangan yang disampaikan bahwa tersangka L ini menjadi operator dia mendapatkan bonus. Selain gaji juga mendapatkan bonus jika mencapai target tertentu,"" tambah dia. Lebih jauh Alfis menyebut L ditangkap saat hendak pulang kampung ke Indonesia. Usai penangkapan, L langsung dibawa ke Bareskrim untuk dimintai keterangan. ""Tersangka L ini dalam rangka pulang saja ini, ingin pulang kampung. Akhirnya dari bandara kita bawa dan kita lakukan pemeriksaan,"" ucapnya. Atas perbuatannya, L dijerat dengan Pasal 28 Ayat 1 juncto Pasal 45 dan Pasal 36 UU ITE dan/atau Pasal 378 KUHP juncto Pasal 55 ayat 1 ke-1 KUHP dengan ancaman pidana maksimal 6 tahun penjara. Dalam kasus ini, Bareskrim sebelumnya telah lebih dulu menangkap 4 orang tersangka. Mereka adalah seorang WN China berinisial SZ dan tiga orang WNI berinisial NSS, H, dan M. Di Indonesia, berdasarkan laporan yang diterima oleh polisi sejak 2022, ada 823 orang yang jadi korban dengan total nilai kerugian mencapai Rp 59 miliar. Mereka diduga beroperasi dari Dubai dan menyasar korban dari empat negara. Dari bisnis ilegal ini, ZS bersama sindikatnya berhasil meraup untuk kurang lebih Rp 1,5 triliun. Hasil itu berdasarkan bisnis penipuan dari empat negara, yakni Indonesia Rp 59 miliar, India Rp 1,077 triliun, Cina Rp 91 miliar, dan Thailand Rp 288 miliar.  Simak juga Video 'Ini Peran 4 Pelaku Scam Online Jaringan Internasional yang Diusut Polri':    ","Bareskrim Polri menangkap satu buron kasus scam online jaringan internasional berinisial L (26). Dia ditangkap di Terminal 3 Bandara Soekarno-Hatta, Tangerang. Bahwa salah satu tersangka yang telah masuk dalam daftar red notice ini telah melintas dari Dubai menuju ke Jakarta sehingga kami dari Dittipidsiber Bareskrim Polri mengecek ke terminal 3 Soekarno-Hatta dan ternyata memang benar bahwa tersangka yang sudah kita publish di red notice pada tanggal 23 November 2023 betul adalah salah satu tersangka yang kita cari,"" kata Alfis dalam jumpa pers di Mabes Polri, Jakarta Selatan, Jumat 19 Juli 2024. Adapun L merupakan warga negara Indonesia asal Sukabumi, Jawa Barat. Dia bekerja di Dubai sebagai operator itu sekitar bulan Mei sampai Agustus 2023. Dia datang awalnya sendiri saja karena sudah ada saudaranya di sana di Dubai. Nah sampai di sana awalnya ingin mencari pekerjaan apa saja tapi ternyata di rekrut oleh kelompok ini, dilatih untuk menjadi operator melakukan social engineering,"" jelas Alfis. "" Usai penangkapan, L langsung dibawa ke Bareskrim untuk dimintai keterangan. "" Tersangka L ini dalam rangka pulang saja ini, ingin pulang kampung. Atas perbuatannya, L dijerat dengan Pasal 28 Ayat 1 juncto Pasal 45 dan Pasal 36 UU ITE dan/atau Pasal 378 KUHP juncto Pasal 55 ayat 1 ke-1 KUHP dengan ancaman pidana maksimal 6 tahun penjara. Dalam kasus ini, Bareskrim sebelumnya telah lebih dulu menangkap 4 orang tersangka. Mereka diduga beroperasi dari Dubai dan menyasar korban dari empat negara. Hasil itu berdasarkan bisnis penipuan dari empat negara, yakni Indonesia Rp 59 miliar, India Rp 1,077 triliun, Cina Rp 91 miliar, dan Thailand Rp 288 miliar."
IM57 Minta KPK Tidak Tebang Pilih Saat Usut Dugaan OOJ Kasus Harun Masiku,detikNews,2024-07-19,Yogi Ernes,https://news.detik.com/berita/d-7447056/im57-minta-kpk-tidak-tebang-pilih-saat-usut-dugaan-ooj-kasus-harun-masiku,"Peluang adanya obstruction of justice (OOJ) atau perintangan penyidikan dalam kasus korupsi Harun Masiku sedang dipertimbangkan KPK. IM57+Institute meminta pengusutan kasus itu tidak hanya wacana. ""Hentikan segala akrobat politik dan bargain politik. Langsung wujudkan dalam langkah nyata yang tidak tebang pilih dan penuh wacana. Saatnya KPK melakukan perbuatan konkret,"" kata Ketua IM57+Institute M Praswad Nugraha kepada wartawan, Jumat 19 Juli 2024. IM57 mendukung langkah pengusutan dugaan perintangan penyidikan kasus Harun Masiku yang akan ditempuh KPK. Surat perintah dimulainya penyidikan (sprindik) kasus itu diharapkan bisa segera terbit.    ""Sprindik tersebut sangat kami dukung dengan catatan bahwa yang masuk sebagai objek penyidikan jangan hanya tokoh politik yang terlibat, tetapi juga para pihak penegak hukum maupun potensi oknum pimpinan KPK yang menghalangi,"" katanya. Praswad mengatakan sprindik kasus itu juga bisa digunakan untuk mengusut dugaan adanya pihak di internal KPK yang ternyata menghalangi penyidikan Harun. ""Sangat pantas sprindik tersebut misalnya ditujukan juga kepada beberapa nama potensial, seperti pimpinan KPK yang mengumumkan akan menangkap Harun Masiku, padahal seharusnya rahasia, serta yang memecat melalui TWK pada saat akan menangkap,"" ujar Praswad. ""Selain itu, pihak-pihak yang terlibat penghalangan pada saat tanggal 8-9 Januari 2020 di PTIK,"" sambungnya. IM57 meminta dugaan perintangan penyidikan dalam kasus Harun Masiku bisa diusut cepat oleh KPK. Para terduga pelaku harus segera ditetapkan sebagai tersangka. ""Segera tetapkan tersangka baru jika memang memenuhi dua alat bukti. Tapi ingat, jangan coba-coba melakukan akrobat politik,"" ucap Praswad. KPK diketahui membuka peluang mengusut kasus baru dalam perkara Harun Masiku. KPK akan mengusut dugaan adanya perintangan penyidikan dalam kasus tersebut. Jubir KPK Tessa Mahardhika mengatakan peluang membuka penyidikan obstruction of justice (OOJ) di kasus Harun dilakukan setelah KPK memeriksa istri Saeful Bahri bernama Dona Berisa. Saeful diketahui merupakan salah satu terpidana di kasus korupsi yang melibatkan Harun. Dalam pemeriksaan terhadap Dona pada Kamis 18 Juli, penyidik KPK mencecar saksi tersebut terkait keberadaan Harun Masiku. Selain mencecar keberadaan Harun, Tessa mengatakan, penyidik berpeluang membuka penyidikan baru terkait perintangan penyidikan dalam kasus Harun. ""Penyidik mendalami terkait dengan pengetahuan keberadaan HM dan peluang untuk membuka penyidikan baru terkait dengan dugaan obstruction of justice,"" kata Tessa kepada wartawan, Kamis 18 Juli.","Peluang adanya obstruction of justice (OOJ) atau perintangan penyidikan dalam kasus korupsi Harun Masiku sedang dipertimbangkan KPK. Hentikan segala akrobat politik dan bargain politik. Langsung wujudkan dalam langkah nyata yang tidak tebang pilih dan penuh wacana. Sangat pantas sprindik tersebut misalnya ditujukan juga kepada beberapa nama potensial, seperti pimpinan KPK yang mengumumkan akan menangkap Harun Masiku, padahal seharusnya rahasia, serta yang memecat melalui TWK pada saat akan menangkap,"" ujar Praswad. "" Selain itu, pihak-pihak yang terlibat penghalangan pada saat tanggal 8-9 Januari 2020 di PTIK,"" sambungnya. IM57 meminta dugaan perintangan penyidikan dalam kasus Harun Masiku bisa diusut cepat oleh KPK. Para terduga pelaku harus segera ditetapkan sebagai tersangka. "" Segera tetapkan tersangka baru jika memang memenuhi dua alat bukti. Tapi ingat, jangan coba-coba melakukan akrobat politik,"" ucap Praswad. Jubir KPK Tessa Mahardhika mengatakan peluang membuka penyidikan obstruction of justice (OOJ) di kasus Harun dilakukan setelah KPK memeriksa istri Saeful Bahri bernama Dona Berisa. Selain mencecar keberadaan Harun, Tessa mengatakan, penyidik berpeluang membuka penyidikan baru terkait perintangan penyidikan dalam kasus Harun. """
