title,category,publish_date,author,article_url,content,summary
Dirut Jasa Raharja Puji Ajang Zebra Bhayangkara Presisi Sudirman Loop 2024,detikNews,2024-07-19,Inkana Putri,https://news.detik.com/berita/d-7446603/dirut-jasa-raharja-puji-ajang-zebra-bhayangkara-presisi-sudirman-loop-2024,"Direktur Utama Jasa Raharja Rivan A. Purwantono mengapresiasi gelaran Zebra Bhayangkara Presisi Sudirman Loop 2024 yang digelar beberapa waktu lalu. Adapun acara ini merupakan bagian dari perayaan HUT ke-78 Bhayangkara. Rivan menyampaikan Zebra Bhayangkara Presisi Sudirman Loop 2024 sangat penting bagi komunitas sepeda di Indonesia. Pasalnya, hadirnya gelaran ini turut mengembalikan penggunaan Jalan Jenderal Sudirman sebagai lintasan balap setelah 21 tahun. ""Bahkan masyarakat dari berbagai daerah Indonesia sangat antusias untuk hadir dalam perayaan ulang tahun Bhayangkara ke-78 ini,"" ujar Rivan dalam keterangannya, Jumat 19 Juli 2024.    Hal ini disampaikannya usai flag off Zebra Bhayangkara Presisi Sudirman Loop 2024, Sabtu 13 Juli 2024. Pada kegiatan ini, Rivan juga turut serta dalam penyerahan hadiah kepada para pemenang. ""Mudah-mudahan kegiatan ini menjadi referensi bahwa Jakarta adalah tempat yang sangat baik digunakan dalam olahraga sepeda. Sukses Polri dalam ulang tahun ke-78, dan sukses kegiatan Zebra Bhayangkara Presisi Sudirman Loop,"" imbuh Rivan. Sementara itu Kakorlantas Polri Irjen Pol. Aan Suhanan berharap kegiatan tersebut dapat menjadi wadah untuk meningkatkan minat dan partisipasi masyarakat dalam olahraga sepeda. Selain itu, ajang balap sepeda ini juga diharap dapat melahirkan atlet-atlet balap sepeda baru di Indonesia. ""Mudah-mudahan ajang ini bisa menjadi event yang positif dalam mendukung bakat bakat para pesepeda baik yang dalam kelas elite maupun komunitas-komunitas penyuka olahraga sepeda. Harapannya dengan adanya kegiatan kompetisi seperti ini akan meningkatkan minat masyarakat untuk berolahraga yang juga, bahkan mungkin dari sini lahir atlet-atlet nasional yang akan mewakili kita di ajang kompetisi internasional,"" pungkas Aan.","Direktur Utama Jasa Raharja Rivan A. Purwantono mengapresiasi gelaran Zebra Bhayangkara Presisi Sudirman Loop 2024 yang digelar beberapa waktu lalu. Adapun acara ini merupakan bagian dari perayaan HUT ke-78 Bhayangkara. Rivan menyampaikan Zebra Bhayangkara Presisi Sudirman Loop 2024 sangat penting bagi komunitas sepeda di Indonesia. Bahkan masyarakat dari berbagai daerah Indonesia sangat antusias untuk hadir dalam perayaan ulang tahun Bhayangkara ke-78 ini,"" ujar Rivan dalam keterangannya, Jumat 19 Juli 2024. Sementara itu Kakorlantas Polri Irjen Pol. Selain itu, ajang balap sepeda ini juga diharap dapat melahirkan atlet-atlet balap sepeda baru di Indonesia. "" Mudah-mudahan ajang ini bisa menjadi event yang positif dalam mendukung bakat bakat para pesepeda baik yang dalam kelas elite maupun komunitas-komunitas penyuka olahraga sepeda."
Prabowo Cerita Kini Duduk di Samping Jokowi Saat Rapat Kabinet,detikNews,2024-07-19,Tiara Aliya Azzahra,https://news.detik.com/berita/d-7446676/prabowo-cerita-kini-duduk-di-samping-jokowi-saat-rapat-kabinet,"Menteri Pertahanan Prabowo Subianto mengatakan dirinya sedang disiapkan oleh Presiden Joko Widodo menjelang pelantikannya sebagai Presiden terpilih pada Oktober mendatang. Prabowo bercerita dirinya diminta duduk sebelah Jokowi saat menghadiri rapat kabinet. Hal itu disampaikan Prabowo Subianto saat mewakili Presiden Jokowi menerima White Paper One Map Policy (OMP) Beyond 2024, Laporan Capaian PSN dan KEK sekaligus meluncurkan Geoportal Kebijakan Satu Peta 2.0 pada Kamis 18 Juli 2024 di Hotel St Regis, Jakarta Pusat. ""Jadi saya kira ini yang saya rasakan beliau sekarang hampir semua rapat kabinet saya diikutsertakan, dan duduknya sebelah presiden sekarang. Mohon maaf Menko. Jadi ini yang saya rasakan saya sedang disiapkan,"" kata Prabowo dalam sambutannya.    Prabowo mengatakan saat ini Jokowi tengah melatihnya supaya tidak terkejut ketika menempati kursi presiden. Menurutnya, ini merupakan cara seorang pemimpin mempersiapkan penggantinya. ""Saya kira bapak presiden ternyata sedang melatih saya untuk supaya nanti nggak terlalu kaget begitu setelah saya dilantik insyaallah,"" ujar Prabowo. ""Jadi ini cara beliau, salah satu pembelajaran kepemimpinan yang diterima adalah, seorang pemimpin yang baik adalah pertama pemimpin yang logowo. Kedua adalah pemimpin yang menyiapkan penggantinya,"" lanjutnya. Dalam acara tersebut, Prabowo tampak duduk di sebelah Menko Polhukam Hadi Tjahjanto. Sejumlah pejabat turut hadir dalam acara tersebut, antara lain Kapolri Jenderal Listyo Sigit Prabowo, Panglima TNI Jenderal TNI Agus Subiyanto, Menteri Perdagangan Zulkifli Hasan, Menteri ATR/BPN Agus Harimurti Yudhoyono, Mendagri Tito Karnavian hingga Sekretaris Kabinet Pramono Anung. Prabowo kemudian diminta naik ke atas panggung untuk menerima White Paper One Map Policy (OMP) Beyond 2024, Laporan Capaian PSN dan KEK sekaligus memberikan sambutan dan meluncurkan Geoportal Kebijakan Satu Peta 2.0. Tampak Menko Perekonomian Airlangga Hartato menyerahkan dokumen tersebut kepada Prabowo. ""Saya di instruksikan untuk mewakili Bapak Presiden Joko Widodo dan dalam hal ini apa yang saya sampaikan sebetulnya adalah catatan-catatan dan pointers dari beliau,"" kata Prabowo mengawali sambutannya. Prabowo Subianto sebelumnya pernah mengunggah momen rapat terbatas (ratas) dengan Jokowi. Ada sejumlah menteri yang hadir dalam ratas tersebut. Prabowo tampak duduk sebelahan dengan Jokowi. Dalam unggahan Prabowo di Instagram, Sabtu 6 April 2024, dalam foto itu terlihat Presiden Jokowi, lalu di samping kanan ada Prabowo, di samping kirinya Sekretaris Kabinet (Seskab) Pramono Anung. Di sebelah Prabowo ada Menteri Sekretaris Negara (Mensesneg) Pratikno. Kemudian di hadapan Jokowi ada Menteri Koordinator Perekonomian Airlangga Hartarto, Menteri Keuangan Sri Mulyani, Menteri PPN/Kepala Bappenas Suharso Monoarfa. Unggahan itu menampilkan tiga foto yang diambil dari beberapa sisi. ""Rapat terbatas bersama Bapak Presiden RI @jokowi,"" bunyi caption Prabowo dalam Instagram pribadinya. Terlihat di layar belakang Jokowi bertuliskan 'Arah Kebijakan Makro Fiskal dan Pagu Indikatif Tahun 2023'. Diketahui, ratas tersebut terjadi pada Jumat 5 April setelah Airlangga dan Sri Mulyani memberi keterangan di Mahkamah Konstitusi (MK)","Menteri Pertahanan Prabowo Subianto mengatakan dirinya sedang disiapkan oleh Presiden Joko Widodo menjelang pelantikannya sebagai Presiden terpilih pada Oktober mendatang. Prabowo bercerita dirinya diminta duduk sebelah Jokowi saat menghadiri rapat kabinet. Hal itu disampaikan Prabowo Subianto saat mewakili Presiden Jokowi menerima White Paper One Map Policy (OMP) Beyond 2024, Laporan Capaian PSN dan KEK sekaligus meluncurkan Geoportal Kebijakan Satu Peta 2.0 pada Kamis 18 Juli 2024 di Hotel St Regis, Jakarta Pusat. "" Jadi saya kira ini yang saya rasakan beliau sekarang hampir semua rapat kabinet saya diikutsertakan, dan duduknya sebelah presiden sekarang. Menurutnya, ini merupakan cara seorang pemimpin mempersiapkan penggantinya. "" Saya kira bapak presiden ternyata sedang melatih saya untuk supaya nanti nggak terlalu kaget begitu setelah saya dilantik insyaallah,"" ujar Prabowo. "" Jadi ini cara beliau, salah satu pembelajaran kepemimpinan yang diterima adalah, seorang pemimpin yang baik adalah pertama pemimpin yang logowo. Sejumlah pejabat turut hadir dalam acara tersebut, antara lain Kapolri Jenderal Listyo Sigit Prabowo, Panglima TNI Jenderal TNI Agus Subiyanto, Menteri Perdagangan Zulkifli Hasan, Menteri ATR/BPN Agus Harimurti Yudhoyono, Mendagri Tito Karnavian hingga Sekretaris Kabinet Pramono Anung. Ada sejumlah menteri yang hadir dalam ratas tersebut. Prabowo tampak duduk sebelahan dengan Jokowi. Dalam unggahan Prabowo di Instagram, Sabtu 6 April 2024, dalam foto itu terlihat Presiden Jokowi, lalu di samping kanan ada Prabowo, di samping kirinya Sekretaris Kabinet (Seskab) Pramono Anung. Unggahan itu menampilkan tiga foto yang diambil dari beberapa sisi. "" Terlihat di layar belakang Jokowi bertuliskan 'Arah Kebijakan Makro Fiskal dan Pagu Indikatif Tahun 2023'."
Babak Baru Kasus Harun Masiku: Pelaku Perintangan Penyidikan dalam Radar KPK,detikNews,2024-07-19,Yogi Ernes,https://news.detik.com/berita/d-7446648/babak-baru-kasus-harun-masiku-pelaku-perintangan-penyidikan-dalam-radar-kpk,"Keberadaan mantan caleg PDIP, Harun Masiku, masih misterius. Di tengah kasus korupsi yang menjerat Harun masih bergulir di KPK, kini lembaga antirasuah itu telah bersiap membuka penyidikan baru dalam perkara Harun Masiku. Harun telah jadi buron sejak Januari 2020. Dia merupakan salah satu tersangka dalam kasus suap pergantian antarwaktu (PAW) anggota DPR periode 2019-2024. Pengusutan kasus Harun pun terasa timbul-tenggelam di KPK. Meski berulang kali KPK menegaskan bisa menangkap Harun, tapi empat tahun berlalu Harun tidak kunjung tertangkap.    Dalam catatan pemberitaan detikcom yang dirangkum pada Jumat 19 Juli 2024, penyidikan kasus korupsi Harun Masiku kembali mencuat pada akhir Mei 2024. KPK memanggil pengacara bernama Simon Petrus pada Rabu 29 Mei. Sehari berselang giliran seorang mahasiswa bernama Hugo Ganda yang diperiksa pada Kamis 30 Mei. Kedua saksi itu dicecar penyidik soal keberadaan Harun. Maraton pemeriksaan saksi Harun terus berlanjut. Penyidik KPK kemudian memeriksa seorang mahasiswi bernama Melita De Grave pada Jumat 31 Mei. ""Melita De Grave (pelajar/mahasiswa), saksi hadir dan Tim Penyidik masih terus mendalami dugaan adanya pihak-pihak yang diduga mengamankan keberadaan dari Tersangka HM,"" kata Kabag Pemberitaan KPK Ali Fikri dalam keterangannya kepada wartawan, Senin 3 Juni. Setelah pemeriksaan ketiga saksi itu, penyidik KPK lalu memeriksa Sekjen PDIP Hasto Kristiyanto pada Senin 10 Juni di gedung Merah Putih KPK. Dalam proses pemeriksaan itu, penyidik KPK kemudian menyita ponsel dari Hasto. Penyitaan itu diprotes keras oleh Hasto. Sekjen PDIP itu bahkan mengaku ditinggalkan sendirian oleh penyidik KPK di ruang pemeriksaan hingga kedinginan. Hasto berada di ruang pemeriksaan selama 4 jam. Namun ia mengaku berhadapan dengan penyidik KPK di ruangan itu selama 90 menit. ""Saya di dalam ruangan yang sangat dingin hampir sekitar 4 jam dan bersama penyidik face to face, paling lama 1,5 jam,"" kata Hasto di gedung KPK, Jakarta Selatan, Senin 10 Juni. Baca halaman selanjutnya.   Simak Video 'KPK soal Kabar Harun Masiku di Jakarta: Nggak Tahu Ngumpetnya di Mana':       Halaman                  1                              2                              3                           Selanjutnya       harun masiku kpk harun masiku buronan buron harun masiku   ","Keberadaan mantan caleg PDIP, Harun Masiku, masih misterius. Harun telah jadi buron sejak Januari 2020. Pengusutan kasus Harun pun terasa timbul-tenggelam di KPK. Dalam catatan pemberitaan detikcom yang dirangkum pada Jumat 19 Juli 2024, penyidikan kasus korupsi Harun Masiku kembali mencuat pada akhir Mei 2024. Kedua saksi itu dicecar penyidik soal keberadaan Harun. Penyidik KPK kemudian memeriksa seorang mahasiswi bernama Melita De Grave pada Jumat 31 Mei. "" Melita De Grave (pelajar/mahasiswa), saksi hadir dan Tim Penyidik masih terus mendalami dugaan adanya pihak-pihak yang diduga mengamankan keberadaan dari Tersangka HM,"" kata Kabag Pemberitaan KPK Ali Fikri dalam keterangannya kepada wartawan, Senin 3 Juni. Setelah pemeriksaan ketiga saksi itu, penyidik KPK lalu memeriksa Sekjen PDIP Hasto Kristiyanto pada Senin 10 Juni di gedung Merah Putih KPK. Hasto berada di ruang pemeriksaan selama 4 jam. Saya di dalam ruangan yang sangat dingin hampir sekitar 4 jam dan bersama penyidik face to face, paling lama 1,5 jam,"" kata Hasto di gedung KPK, Jakarta Selatan, Senin 10 Juni."
Korban Tewas Duel Tangan Kosong di Jaksel Alami Luka di Kepala dan Pelipis,detikNews,2024-07-19,Mulia Budi,https://news.detik.com/berita/d-7446616/korban-tewas-duel-tangan-kosong-di-jaksel-alami-luka-di-kepala-dan-pelipis,"Perkelahian dua orang pria di Pondok Pinang, Jakarta Selatan menewaskan korban berinisial I (45). Korban tewas dengan luka di bagian kepala dan pelipis. ""Untuk korbannya kalau kita lihat ada luka lebam di kepala, ada sobek di pelipis sebelah kiri,"" kata Kapolsek Kebayoran Lama, Kompol Widya Agustiono kepada wartawan, Jumat 19 Juli 2024. Widya mengatakan korban langsung terjatuh usai perkelahian tersebut. Polisi juga telah mengamankan pria inisial HR (45) yang berduel dengan korban.    ""Kalau penyebab meninggalnya kita belum tahu karena setelah mereka berkelahi itu, korban mau ngangkat becak motor dia itu yang bawa galon air itu. Tiba-tiba dia terjatuh, meninggal, seperti itu,"" ujarnya. Dia mengatakan HR masih diperiksa terkait peristiwa tersebut. Dia menuturkan duel maut itu berawal dari cekcok mulut antara korban dan HR. ""Ini masih didalami dari keterangan dari pelakunya. Pelakunya masih di-BAP (berita acara pemeriksaan),"" ujarnya. Duel maut perkelahian itu terjadi sekitar pukul 14.00 WIB pada Kamis 18 Juli kemarin. Polisi akan melakukan autopsi terhadap jenazah korban di RS Polri Kramat Jati, Jakarta Timur. ""Dari keluarga iya, setuju (dilakukan autopsi), untuk memastikan penyebab kematian,"" ujarnya.   Simak Video 'Heboh Duel Tangan Kosong Berujung Maut di Jaksel':   ","Perkelahian dua orang pria di Pondok Pinang, Jakarta Selatan menewaskan korban berinisial I (45). Korban tewas dengan luka di bagian kepala dan pelipis. "" ""Kalau penyebab meninggalnya kita belum tahu karena setelah mereka berkelahi itu, korban mau ngangkat becak motor dia itu yang bawa galon air itu. Dia mengatakan HR masih diperiksa terkait peristiwa tersebut. Ini masih didalami dari keterangan dari pelakunya. Duel maut perkelahian itu terjadi sekitar pukul 14.00 WIB pada Kamis 18 Juli kemarin. Dari keluarga iya, setuju (dilakukan autopsi), untuk memastikan penyebab kematian,"" ujarnya. Simak Video 'Heboh Duel Tangan Kosong Berujung Maut di Jaksel':"
Kakak Adik Atlet Menembak Berprestasi Asal Sulsel Ini Jadi Catar Akpol 2024,detikNews,2024-07-19,Tiara Aliya Azzahra,https://news.detik.com/berita/d-7446608/kakak-adik-atlet-menembak-berprestasi-asal-sulsel-ini-jadi-catar-akpol-2024,"Kakak beradik bernama Yumaldi Limtizadi dan Salwa Luthfiyyah Limtizadi mengikuti proses seleksi Calon Taruna (Catar) Akademi Kepolisian (Akpol) tingkat pusat tahun 2024 mewakili Polda Sulawesi Selatan. Keduanya adalah atlet menembak yang sama-sama menyabet medali emas pada ajang kejuaraan menembak di Sulsel. ""Saya mengikuti seleksi Catar Akpol ini bersama adik saya. Saya sendiri punya kompetensi bahasa Inggris aktif, menembak dan menyelam, untuk menembak dan menyelam saya punya lisensi dua hal tersebut,"" kata Yumaldi, dalam keterangan tertulis, Kamis 18 Juli 2024. Yumaldi punya berbagai prestasi di bidang menembak, di antaranya Juara 1 Kapolda Sulsel Cup tahun 2021, Juara 1 Tembak Reaksi Porprov Tim dan Individu tahun 2022, Juara 1 Tembak Reaksi HUT Kostrad tahun 2023, Juara 1 Tactical Challenge tahun 2023 dan Juara 2 Shooting Challenge HUT ke-76 Bhayangkara di Sulsel. Sementara sang adik, juga memiliki sertifikasi di bidang menyelam dan menembak. Selain itu, pada tahun 2022 menyabet medali emas kategori ladies di Porprov Sulsel tahun 2022.    ""Untuk menembak, saya mengikuti beberapa perlombaaan dan pertandingan, mendapatkan penghargaan,"" ujar Salwa. ""Saya juga meraih medali emas Kapolda Cup (Kapolda Sulsel Cup),"" sambungnya. Berbekal prestasi-prestasi itu, tambah Yumaldi, dia dan adiknya berharap bisa jadi modal kuat untuk mengikuti seleksi Catar Akpol tingkat pusat. Yumaldi usianya 20 tahun, sementara adiknya Salwa 19 tahun. Yumaldi lulusan SMA Islam Athirah Bukit Baruga, sementara Salwa di SMAN 5 Makassar jurusan MIPA. ""Dengan kompetensi yang kami miliki, kami berharap bisa mendedikasikannya dengan cara bergabung menjadi bagian dari anggota Polri,"" ungkap Yumaldi. Ayah mereka seorang anggota Polri yang sudah perwira, sementara ibunya berprofesi sebagai dosen. Mereka berdua telah mengenal olahraga menembak dari kelas 3 SD dan terinspirasi dari ayahnya untuk menjadi anggota Polri.  Simak juga 'Saat Tangis Haru Seleksi Akpol Sumber Sarjana di Semarang, Dua Difabel Lulus':   ","Kakak beradik bernama Yumaldi Limtizadi dan Salwa Luthfiyyah Limtizadi mengikuti proses seleksi Calon Taruna (Catar) Akademi Kepolisian (Akpol) tingkat pusat tahun 2024 mewakili Polda Sulawesi Selatan. Keduanya adalah atlet menembak yang sama-sama menyabet medali emas pada ajang kejuaraan menembak di Sulsel. "" Saya sendiri punya kompetensi bahasa Inggris aktif, menembak dan menyelam, untuk menembak dan menyelam saya punya lisensi dua hal tersebut,"" kata Yumaldi, dalam keterangan tertulis, Kamis 18 Juli 2024. Selain itu, pada tahun 2022 menyabet medali emas kategori ladies di Porprov Sulsel tahun 2022. Berbekal prestasi-prestasi itu, tambah Yumaldi, dia dan adiknya berharap bisa jadi modal kuat untuk mengikuti seleksi Catar Akpol tingkat pusat. Yumaldi usianya 20 tahun, sementara adiknya Salwa 19 tahun. Ayah mereka seorang anggota Polri yang sudah perwira, sementara ibunya berprofesi sebagai dosen. Mereka berdua telah mengenal olahraga menembak dari kelas 3 SD dan terinspirasi dari ayahnya untuk menjadi anggota Polri."
Warga Keluhkan Klakson Berisik Saat Macet Imbas Proyek LRT: Ada yang Berantem,detikNews,2024-07-19,Maulana Ilhami Fawdi,https://news.detik.com/berita/d-7446607/warga-keluhkan-klakson-berisik-saat-macet-imbas-proyek-lrt-ada-yang-berantem,"Kemacetan akibat proyek pembangunan LRT Jakarta terjadi di Jalan Pramuka, Jakarta Pusat. Warga pun mengeluhkan berisiknya klakson di tengah kemacetan hingga memicu perkelahian. Salah satu tukang ojek di sekitar Jalan Pramuka, Eko, mengatakan kemacetan parah ini kerap membuat orang marah-marah. Dia juga mengatakan ada pengguna jalan yang berkelahi gara-gara macet. ""Macet, macet, kadang juga orang pada marah-marah, berantem,"" kata Eko di Jalan Pramuka, Jakarta Pusat, Jumat 19 Juli 2024.    Eko mengatakan pengguna jalan kerap marah-marah karena adu klakson yang membuat berisik. Dia mengatakan pengendara kerap membunyikan klakson di tengah kemacetan. ""Klakson pada berisik banget dah tuh, kalau klakson tan tin tan tin,"" ujarnya. Tukang ojek online, Iqbal, mengatakan macet di Jalan Pramuka terjadi setiap hari. Dia mengatakan kemacetan di jam-jam sibuk lebih panjang lagi. ""Dari pagi, sore, sampai malam bikin macet. Iya nggak ada jam-jam, dari pagi sampai malam macet,"" kata Iqbal. ""Dari ujung sana dari Rawamangun tuh, semenjak ada ini (proyek) makin parah. Dulu itu macet di sini doang (Pasar Pramuka), paling kalau udah siang gini lancar, kalau ini kan dari pagi lanjut siang sore kadang malam macetnya,"" sambungnya. Iqbal mengeluhkan kemacetan membuat bensin semakin boros. Dia mengaku harus mencari jalan alternatif untuk menghindari macet. ""Paling cari-cari jalan belakang lewat kampung, kalau dari Rawamangun masuk masuk dalam lewat kampung nanti keluar setelah rel,"" katanya. Seorang sopir bajaj di Jalan Pramuka, Nur, mengatakan dirinya kesulitan mendapatkan penumpang semenjak kemacetan bertambah parah akibat proyek LRT Jakarta. Dia mengaku harus menunggu lama di depan Pasar Pramuka demi mendapatkan penumpang. ""Pernah saya bawa pulang 5 ribu perak, nggak ada yang naik dari pagi sampai sore, sekarang mah susah usaha apapun,"" ucapnya. Sebelumnya, proyek LRT Jakarta fase 1B rute Velodrome-Manggarai terus dikebut pengerjaannya. Proyek ini ditargetkan rampung pada Agustus 2026 dan bisa beroperasi mulai 2027, hingga saat ini progres pengerjaan proyek telah 22,4%.  Simak juga 'Heboh Duel Tangan Kosong Berujung Maut di Jaksel':   ","Kemacetan akibat proyek pembangunan LRT Jakarta terjadi di Jalan Pramuka, Jakarta Pusat. Warga pun mengeluhkan berisiknya klakson di tengah kemacetan hingga memicu perkelahian. Macet, macet, kadang juga orang pada marah-marah, berantem,"" kata Eko di Jalan Pramuka, Jakarta Pusat, Jumat 19 Juli 2024. Eko mengatakan pengguna jalan kerap marah-marah karena adu klakson yang membuat berisik. Iya nggak ada jam-jam, dari pagi sampai malam macet,"" kata Iqbal. "" Dari ujung sana dari Rawamangun tuh, semenjak ada ini (proyek) makin parah. Iqbal mengeluhkan kemacetan membuat bensin semakin boros. Dia mengaku harus mencari jalan alternatif untuk menghindari macet. "" Paling cari-cari jalan belakang lewat kampung, kalau dari Rawamangun masuk masuk dalam lewat kampung nanti keluar setelah rel,"" katanya. Seorang sopir bajaj di Jalan Pramuka, Nur, mengatakan dirinya kesulitan mendapatkan penumpang semenjak kemacetan bertambah parah akibat proyek LRT Jakarta. Proyek ini ditargetkan rampung pada Agustus 2026 dan bisa beroperasi mulai 2027, hingga saat ini progres pengerjaan proyek telah 22,4%. Simak juga 'Heboh Duel Tangan Kosong Berujung Maut di Jaksel':"
KPK Panggil Hasto Kristiyanto Jadi Saksi Kasus Korupsi DJKA,detikNews,2024-07-19,Yogi Ernes,https://news.detik.com/berita/d-7446598/kpk-panggil-hasto-kristiyanto-jadi-saksi-kasus-korupsi-djka,"KPK memanggil Sekjen PDIP Hasto Kristiyanto dalam kasus korupsi di PPK Ditjen Perkeretaapian (DJKA) Kementerian Perhubungan. Hasto dipanggil dalam kapasitas sebagai saksi. ""Hari ini Jumat 19 Juli pemeriksaan saksi dugaan TPK di lingkungan Direktorat Jenderal Perkeretaapian/DJKA Kementerian Perhubungan (Wilayah Jawa Timur),"" kata Jubir KPK Tessa Mahardhika Sugiarto di gedung KPK, Jakarta Selatan, Jumat 19 Juli 2024. Dalam keterangan yang disampaikan KPK, Hasto dipanggil dengan atribusi sebagai konsultan. KPK belum memerinci keterkaitan Hasto dalam kasus DJKA.    ""Pemeriksaan dilakukan di Gedung KPK Merah Putih, atas nama Hasto Kristiyanto, konsultan,"" katanya. KPK sebelumnya juga telah menetapkan 13 tersangka dalam kasus kasus suap di Direktorat Jenderal Perkeretaapian Kemenhub terkait pembangunan jalur kereta api di wilayah Sulawesi Selatan, Jawa Tengah, Jawa Barat, dan Jawa-Sumatera tahun anggaran 2018-2022. Satu tersangka lagi identitasnya belum diungkap KPK. Dengan demikian, total tersangka sejauh ini berjumlah 14 orang. Mereka dibagi ke dalam klaster penerima dan pemberi suap. Ke-12 tersangka dalam kasus ini yang dipaparkan sebelumnya ialah: Pihak Pemberi1. DIN (Dion Renato Sugiarto), Direktur PT IPA (Istana Putra Agung)2. MUH (Muchamad Hikmat), Direktur PT DF (Dwifarita Fajarkharisma)3. YOS (Yoseph Ibrahim), Direktur PT KA Manajemen Properti sd. Februari 20234. PAR (Parjono), VP PT KA Manajemen Properti5. Asta Danika (AD), Direktur PT Bhakti Karya Utama (BKU)6. Zulfikar Fahmi (ZF), Direktur PT Putra Kharisma Sejahtera (PKS). Pihak Penerima1. HNO (Harno Trimadi), Direktur Prasarana Perkeretaapian2. BEN (Bernard Hasibuan), PPK BTP Jabagteng3. PTU (Putu Sumarjaya), Kepala BTP Jabagteng4. AFF (Achmad Affandi), PPK BPKA Sulsel5. FAD (Fadliansyah), PPK Perawatan Prasarana Perkeretaapian6. SYN (Syntho Pirjani Hutabarat), PPK BTP Jabagbar.  Simak juga 'Kala KPK Tahan 1 Tersangka Baru Kasus Dugaan Korupsi di DJKA':   ","KPK memanggil Sekjen PDIP Hasto Kristiyanto dalam kasus korupsi di PPK Ditjen Perkeretaapian (DJKA) Kementerian Perhubungan. Hasto dipanggil dalam kapasitas sebagai saksi. "" Hari ini Jumat 19 Juli pemeriksaan saksi dugaan TPK di lingkungan Direktorat Jenderal Perkeretaapian/DJKA Kementerian Perhubungan (Wilayah Jawa Timur),"" kata Jubir KPK Tessa Mahardhika Sugiarto di gedung KPK, Jakarta Selatan, Jumat 19 Juli 2024. Dalam keterangan yang disampaikan KPK, Hasto dipanggil dengan atribusi sebagai konsultan. KPK sebelumnya juga telah menetapkan 13 tersangka dalam kasus kasus suap di Direktorat Jenderal Perkeretaapian Kemenhub terkait pembangunan jalur kereta api di wilayah Sulawesi Selatan, Jawa Tengah, Jawa Barat, dan Jawa-Sumatera tahun anggaran 2018-2022. Satu tersangka lagi identitasnya belum diungkap KPK. Dengan demikian, total tersangka sejauh ini berjumlah 14 orang. Mereka dibagi ke dalam klaster penerima dan pemberi suap. Asta Danika (AD), Direktur PT Bhakti Karya Utama (BKU)6. HNO (Harno Trimadi), Direktur Prasarana Perkeretaapian2. BEN (Bernard Hasibuan), PPK BTP Jabagteng3. Simak juga 'Kala KPK Tahan 1 Tersangka Baru Kasus Dugaan Korupsi di DJKA':"
