title,category,publish_date,author,article_url,content,summary
Ini Lokasi Duel Tangan Kosong Berujung Maut di Pondok Pinang Jaksel,detikNews,2024-07-19,Mulia Budi,https://news.detik.com/berita/d-7446901/ini-lokasi-duel-tangan-kosong-berujung-maut-di-pondok-pinang-jaksel,"Dua orang pria inisial I (45) dan HR (45) berkelahi dengan tangan kosong di pinggir jalan di kawasan Pondok Pinang, Jakarta Selatan. Duel maut perkelahian itu mengakibatkan korban I tewas. Peristiwa itu terjadi tepatnya di Jalan Ciputat Raya RT 003 RW 002 Kelurahan Pondok Pinang, Kecamatan Kebayoran Lama, Jakarta Selatan, pada Kamis 18 Juli siang. Pantauan detikcom di lokasi, lalu lintas cukup ramai. Perkelahian itu sendiri terjadi di depan sebuah toko minuman. Tak ada garis polisi di lokasi kejadian.    Duel maut itu menewaskan korban I. Polisi saat ini mengamankan pelaku berinisial HR (45). Belum jelas apa motif perkelahian maut ini. Namun, polisi menyebutkan bahwa perkelahian diawali cekcok mulut antara korban dan pelaku. ""Dari keterangan saksi awalnya karena ada cekcok mulut, setelah itu mereka berkelahi, seperti itu,"" kata Kapolsek Kebayoran Lama, Kompol Widya Agustiono kepada wartawan, Jumat 19 Juli 2024. Widya mengatakan warga langsung menghubungi Polsek Kebayoran Lama saat perkelahian itu masih berlangsung. Polisi langsung menuju ke lokasi dan mengamankan HR yakni pria yang berduel dengan korban. ""Di sekitar melihat kejadian begitu ada khawatir dan melapor ke polisi, segera. Nggak lama dari itu kita ke sana, kita amankan. Makanya pelaku berhasil kita amankan ke polsek,"" ujarnya. Widya mengatakan korban tiba-tiba ambruk setelah berkelahi. Korban saat itu hendak membalikkan becak motornya yang terguling. ""Dia mau membalikkan becak motornya lah, mungkin karena kesal atau apa mungkin dibalikkan sama dia, tahu-tahu dia malah jatuh sendiri lalu meninggal,"" ujarnya. Dia mengatakan pelaku berinisial HR diamankan di lokasi kejadian. HR saat ini masih diperiksa terkait pemicu cekcok mulut berujung duel maut tersebut. ""Ini masih didalami dari keterangan dari pelakunya, pelakunya masih di-BAP (berita acara pemeriksaan),"" ujarnya. Widya mengatakan korban mengalami luka di bagian kepala dan sobek di pelipis. Korban terjatuh saat akan mengangkat becak motornya usai perkelahian tersebut. ""Untuk korbannya kalau kita lihat ada luka lebam di kepala, ada sobek di pelipis sebelah kiri. Kalau penyebab meninggalnya kita belum tahu karena setelah mereka berkelahi itu, korban mau ngangkat becak motor dia itu yang bawa air galon itu. Tiba-tiba dia terjatuh, meninggal, seperti itu,"" tutur Widya. Polisi mengamankan barang bukti berupa pakaian dan becak motor korban. Sementara jenazah korban dibawa ke RS Polri Kramat Jati, Jakarta Timur untuk diautopsi. Simak Video 'Heboh Duel Tangan Kosong Berujung Maut di Jaksel':   ","Dua orang pria inisial I (45) dan HR (45) berkelahi dengan tangan kosong di pinggir jalan di kawasan Pondok Pinang, Jakarta Selatan. Perkelahian itu sendiri terjadi di depan sebuah toko minuman. Duel maut itu menewaskan korban I. Polisi saat ini mengamankan pelaku berinisial HR (45). Belum jelas apa motif perkelahian maut ini. Namun, polisi menyebutkan bahwa perkelahian diawali cekcok mulut antara korban dan pelaku. "" Dari keterangan saksi awalnya karena ada cekcok mulut, setelah itu mereka berkelahi, seperti itu,"" kata Kapolsek Kebayoran Lama, Kompol Widya Agustiono kepada wartawan, Jumat 19 Juli 2024. Widya mengatakan warga langsung menghubungi Polsek Kebayoran Lama saat perkelahian itu masih berlangsung. Nggak lama dari itu kita ke sana, kita amankan. Widya mengatakan korban tiba-tiba ambruk setelah berkelahi. Korban saat itu hendak membalikkan becak motornya yang terguling. "" Widya mengatakan korban mengalami luka di bagian kepala dan sobek di pelipis. Tiba-tiba dia terjatuh, meninggal, seperti itu,"" tutur Widya. Sementara jenazah korban dibawa ke RS Polri Kramat Jati, Jakarta Timur untuk diautopsi. Simak Video 'Heboh Duel Tangan Kosong Berujung Maut di Jaksel':"
"Diduga Hendak Tawuran, 6 Pelajar di Puncak Bogor Diamankan Polisi",detikNews,2024-07-19,Rizky Adha Mahendra,https://news.detik.com/berita/d-7446907/diduga-hendak-tawuran-6-pelajar-di-puncak-bogor-diamankan-polisi,"Polisi mengamankan 6 pelajar di wilayah Jalan Raya Hankam, Kecamatan Cisarua, Kabupaten Bogor, Jawa Barat. Keenamnya diamankan karena diduga hendak melakukan tawuran. ""Upaya cepat dan tepat dari Polsek Cisarua, berhasil menggagalkan rencana tawuran yang melibatkan sejumlah pelajar di wilayah Puncak. Aksi preventif dilakukan setelah pihak kepolisian menerima informasi terkait rencana tawuran tersebut,"" kata Kapolsek Cisarua Kompol Eddy Santosa, Jumat 19 Juli 2024. Peristiwa itu terjadi pada Kamis 18 Juli sekitar pukul 22.00 WIB malam. Keenam pelajar yang diamankan yaitu A (16), D (16), DF (16), E (17), DM (21), dan S (18).    ""Polsek Cisarua menerima laporan dari Unit Resmob Polres Bogor mengenai rencana aksi tawuran di daerah Puncak. Menindaklanjuti informasi ini, piket Polsek Cisarua patroli ke lokasi-lokasi rawan tawuran,"" jelasnya. Kemudian, petugas patroli menemukan sekelompok anak muda yang berkumpul di lokasi. Petugas kemudian menghampiri sekumpulan pemuda itu. ""Saat dihampiri oleh petugas kepolisian dan warga sekitar, sebagian dari mereka melarikan diri,"" jelasnya. Alhasil, keenamnya kemudian diamankan oleh petugas. Mereka dibawa ke Mako Polsek Cisarua guna pemeriksaan lebih lanjut. ""Barang bukti yang diamankan dari lokasi kejadian meliputi enam unit handphone, satu tas warna hitam, satu dompet warna hitam, satu botol parfum, dan satu batang rokok,"" tuturnya.   ","Polisi mengamankan 6 pelajar di wilayah Jalan Raya Hankam, Kecamatan Cisarua, Kabupaten Bogor, Jawa Barat. Keenamnya diamankan karena diduga hendak melakukan tawuran. "" Aksi preventif dilakukan setelah pihak kepolisian menerima informasi terkait rencana tawuran tersebut,"" kata Kapolsek Cisarua Kompol Eddy Santosa, Jumat 19 Juli 2024. Keenam pelajar yang diamankan yaitu A (16), D (16), DF (16), E (17), DM (21), dan S (18). Petugas kemudian menghampiri sekumpulan pemuda itu. "" Saat dihampiri oleh petugas kepolisian dan warga sekitar, sebagian dari mereka melarikan diri,"" jelasnya. Barang bukti yang diamankan dari lokasi kejadian meliputi enam unit handphone, satu tas warna hitam, satu dompet warna hitam, satu botol parfum, dan satu batang rokok,"" tuturnya."
Saran KPAI dan KemenPPPA Agar Kasus Prostitusi Anak Tak Terus Terulang,detikNews,2024-07-19,Farih Maulana Sidik,https://news.detik.com/berita/d-7446892/saran-kpai-dan-kemenpppa-agar-kasus-prostitusi-anak-tak-terus-terulang,"Kasus prostitusi anak yang masih terus terjadi disorot jelang peringatan Hari Anak Nasional yang jatuh pada 23 Juli mendatang. Lantas bagaimana agar kasus prostitusi anak tak terus menerus terjadi? Komisi Perlindungan Anak Indonesia (KPAI) menyebut program-program pemerintah untuk masyarakat terkait pencegahan agar tak terjerumus prostitusi harus betul-betul sampai ke para orang tua dan anak-anak. Menurutnya, peran orang tua begitu besar dalam upaya pencegahan tersebut. ""Orang tua, lingkungan pengasuh anak (harus) ciptakan kedekatan dengan anak-anak, ciptakan fase pengasuhan golden age 5 tahun, 18 tahun fase menjadi anak tumbuh kembang remaja itu dengan orang tua,"" kata Ai Maryati kepada wartawan, Kamis 18 Juli 2024.    Dia mengatakan orang tua harus membangun kedekatan dengan anak, baik secara emosi secara psikologis secara fisik. Menurut Ai, kehadiran orang tua sangat diperlukan dan dirindukan oleh anak-anak. ""Kadang-kadang ini yang tidak bisa tergantikan oleh pola-pola pengasuhan yang mungkin lebih banyak terganti oleh baik itu ART, media 'ah tenang ada HP kok, mau tanya makan tinggal telepon', tidak seperti itu. Tapi bagaimana supaya ada sisi yang tetap keep ini touch ini tidak betul-betul langsung bisa dirasakan,"" ucapnya. Kemudian, peran sekolah dalam edukasi literasi. Ai mengatakan penting bagi anak-anak di sekolah dapat pengetahuan dan pembekalan terkait seks education. ""Tapi memang secara fokus yang terkait pendidikan harus lebih diberikan mana yang boleh dibuka, mana yang tidak? Lalu bijak bermedia itu seperti apa? Sehingga sekolah itu harus memberikan dukungan tersebut, hingga anak-anak itu bijak bermedsos karena ada pembekalan,"" ujar Ai. ""Bukan soal dia takut sama misalnya pendekatan keagamaan, atau takut orang tua, ketika orang tua nggak ada berarti nggak takut dong, takut sama guru, nggak gitu. Tapi edukasi itu kan kesadaran yang bertumbuh, maka dia pun akan terhindar. Tahu risikonya, tahu bahwa ini dilarang, bahwa ini melewati batas,"" sambungnya. Hal senada juga diungkap Deputi Bidang Perlindungan Khusus Anak Kementerian Pemberdayaan Perempuan dan Perlindungan Anak (KemenPPPA), Nahar. Dia menjelaskan sejumlah aspek untuk upaya pencegahan agar anak tidak menjadi korban prostitusi. ""Agar kasus-kasus prostitusi tidak terulang maka aspek pencegahan melalui pengasuhan layak, penguatan ekonomi keluarga, pendidikan, dan pemanfaatan waktu luang bagi anak harus terus dijamin dan diupayakan oleh setiap keluarga,"" jelasnya. Nahar berharap penegak hukum dapat memberikan pemberatan hukuman terhadap para pelaku kekerasan seksual kepada anak. Terkhusus para pelaku yang menjadikan anak sebagai korban prostitusi. ""Dalam penegakan hukum difokuskan pada pemberatan hukuman bagi para pelaku kekerasan dan eksploitasi seksual terhadap anak. Penegakan hukum juga diharapkan memperhatikan aspek pemulihan terhadap anak yang menjadi korban, termasuk memastikan pemenuhan hak-hak korban antara lain melalui restitusi dan hak-hak lainnya yang diatur dalam berbagai peraturan perundang-undangan,"" pungkasnya.","Kasus prostitusi anak yang masih terus terjadi disorot jelang peringatan Hari Anak Nasional yang jatuh pada 23 Juli mendatang. Lantas bagaimana agar kasus prostitusi anak tak terus menerus terjadi? Orang tua, lingkungan pengasuh anak (harus) ciptakan kedekatan dengan anak-anak, ciptakan fase pengasuhan golden age 5 tahun, 18 tahun fase menjadi anak tumbuh kembang remaja itu dengan orang tua,"" kata Ai Maryati kepada wartawan, Kamis 18 Juli 2024. Kadang-kadang ini yang tidak bisa tergantikan oleh pola-pola pengasuhan yang mungkin lebih banyak terganti oleh baik itu ART, media 'ah tenang ada HP kok, mau tanya makan tinggal telepon', tidak seperti itu. Ai mengatakan penting bagi anak-anak di sekolah dapat pengetahuan dan pembekalan terkait seks education. "" Tapi memang secara fokus yang terkait pendidikan harus lebih diberikan mana yang boleh dibuka, mana yang tidak? Tapi edukasi itu kan kesadaran yang bertumbuh, maka dia pun akan terhindar. Tahu risikonya, tahu bahwa ini dilarang, bahwa ini melewati batas,"" sambungnya. Agar kasus-kasus prostitusi tidak terulang maka aspek pencegahan melalui pengasuhan layak, penguatan ekonomi keluarga, pendidikan, dan pemanfaatan waktu luang bagi anak harus terus dijamin dan diupayakan oleh setiap keluarga,"" jelasnya. Nahar berharap penegak hukum dapat memberikan pemberatan hukuman terhadap para pelaku kekerasan seksual kepada anak. Terkhusus para pelaku yang menjadikan anak sebagai korban prostitusi. "" Penegakan hukum juga diharapkan memperhatikan aspek pemulihan terhadap anak yang menjadi korban, termasuk memastikan pemenuhan hak-hak korban antara lain melalui restitusi dan hak-hak lainnya yang diatur dalam berbagai peraturan perundang-undangan,"" pungkasnya."
Dugaan Awal soal Sebab Oma-Opa Tewas Berdua dalam Kamar Rumah di Bogor,detikNews,2024-07-19,Rizky Adha Mahendra,https://news.detik.com/berita/d-7446853/dugaan-awal-soal-sebab-oma-opa-tewas-berdua-dalam-kamar-rumah-di-bogor,"Polisi masih menyelidiki peristiwa pasangan suami istri (pasutri) lanjut usia (lansia) Hans Tomasoa (83) dan Rita Tomasoa (72) ditemukan tewas membusuk di kamar rumah di Jonggol, Kabupaten Bogor, Jawa Barat. Polisi mengungkap dugaan sementara soal sebab keduanya ditemukan meninggal. ""Jenazah di dalam kamar rumahnya sendiri sudah membusuk diduga karena sakit,"" kata Kapolsek Jonggol Kompol Wagiman, Jumat 19 Juli 2024. Wagiman mengatakan, berdasarkan keterangan para tetangga, Opa Hans dan Oma Rita tak terlihat beberapa hari sebelum ditemukan oleh warga. Maka dari itu, warga bersama-sama mengecek ke rumah Hans dan Rita.    ""Kemudian Pak RT mendatangi rumah tersebut berusaha membuka tapi tidak bisa karena dikunci dari dalam. Kemudian bersama satpam membuka paksa pintu tersebut,"" ungkapnya. ""Setelah terbuka, ditemukan suami istri sudah dalam keadaan meninggal dunia, kemudian Ketua RT menghubungi Polsek Jonggol,"" tambahnya. Sebelumnya, sekuriti perumahan bernama Darwan mengungkap cerita saat warga menemukan pasangan suami istri tersebut. Dia mulanya menerima informasi dari warga. ""Itu laporan dari warga, katanya Opa ke mana seminggu ini nggak kelihatan, coba cekin,"" kata Darwan ditemui di lokasi, Kamis 18 Juli. Kemudian, pihak pengurus RT juga meneleponnya untuk mengecek kondisi rumah Hans dan Rita. Di sanalah, dia mencium aroma busuk. ""Nggak lama, RT nelepon tolong cekin. Saya cek pertama belum ada apa-apa, yang kedua ada bau busuk,"" ucapnya. Dia mengatakan rumahnya dijebol melalui pintu dan jendela. Saat menjebol jendela itulah aroma busuk mencuat ke luar rumah. ""Dari situ langsung ke pintu dobrak, langsung nemuin jenazah di kamar 2 orang berdempetan,"" bebernya.  Simak Video 'Anak Lansia Tewas Membusuk di Bogor Tetap Tak Merespons hingga Pemakaman':   ","Polisi masih menyelidiki peristiwa pasangan suami istri (pasutri) lanjut usia (lansia) Hans Tomasoa (83) dan Rita Tomasoa (72) ditemukan tewas membusuk di kamar rumah di Jonggol, Kabupaten Bogor, Jawa Barat. Polisi mengungkap dugaan sementara soal sebab keduanya ditemukan meninggal. "" Wagiman mengatakan, berdasarkan keterangan para tetangga, Opa Hans dan Oma Rita tak terlihat beberapa hari sebelum ditemukan oleh warga. Setelah terbuka, ditemukan suami istri sudah dalam keadaan meninggal dunia, kemudian Ketua RT menghubungi Polsek Jonggol,"" tambahnya. Dia mulanya menerima informasi dari warga. "" Saya cek pertama belum ada apa-apa, yang kedua ada bau busuk,"" ucapnya. Dia mengatakan rumahnya dijebol melalui pintu dan jendela. Saat menjebol jendela itulah aroma busuk mencuat ke luar rumah. "" Simak Video 'Anak Lansia Tewas Membusuk di Bogor Tetap Tak Merespons hingga Pemakaman':"
"Sebelum Pelajar Tawuran Tertabrak KRL, Penjaga Pelintasan Sempat Teriak",detikNews,2024-07-19,Taufiq Syarifudin,https://news.detik.com/berita/d-7447005/sebelum-pelajar-tawuran-tertabrak-krl-penjaga-pelintasan-sempat-teriak,"Seorang pelajar sekolah menengah atas (SMA) tertabrak kereta rel listrik (KRL) di pelintasan Green Garden, Kedoya Utara, Kebon Jeruk, Jakarta Barat, ketika hendak tawuran. Petugas penjaga jalan lintasan (PJL) sempat menegur korban sebelum tertabrak kereta. Peristiwa itu terjadi pada Kamis 18 Juli sekitar pukul 18.00 WIB. PJL bernama Amarullah Hadi, yang ketika itu bertugas jaga, menyaksikan seluruh rangkaian kejadian sejak awal. Amarullah Hadi bilang ada tiga orang turun dari motor yang terlibat dalam tawuran, salah satunya adalah korban tertabrak. Dia memperingatkan ketiga anak itu ketika sudah menutup palang pintu.    ""Saya juga sudah memperingati ke yang tawuran itu. Saya sudah marah-marahin, temannya mau nyerang itu akhirnya mundur tuh. Tapi ada yang tidak mendengar waktu saya marahin, akhirnya terjadilah tabrakan itu,"" kata Amarullah Hadi kepada detikcom, Jumat 19 Juli 2024. Sebelum insiden terjadi, Amarullah terus berteriak kepada pelajar yang tawuran itu. Sayangnya, hanya dua orang memperhatikan peringatannya. ""Iya, saya bilang, 'Woi... awas kereta, mundur, itu kereta udah deket!'. Akhirnya yang temannya mundur. Tapi yang satu lagi nggak mendengar, akhirnya terjadi tabrakan itu,"" tukasnya. Pria yang biasa dipanggil Amar itu menceritakan, pada saat itu, akan ada dua kereta yang lewat bersilangan. Kereta pertama adalah kereta bandara yang melintas tanpa hambatan, kedua adalah kereta rel listrik (KRL) yang kemudian menabrak pelajar tersebut. ""Awalnya kereta bandara melintas lebih dulu tuh. Kemudian kereta KRL, kan silang dua. Saat KRL ini mau melintas, di situ langsung kejadian tawuran. Nggak tahu, pokoknya tiba-tiba ada tawuran aja di situ,"" lanjut Amar. Kata Amar, korban dan rekan awalnya melintas di kawasan itu pakai motor. Kemudian mereka turun dan mengeluarkan parang sambil lari mondar-mandir di ke arah belakang pos jaga. ""Mereka saling serang di lintasan itu. Jadi dari belakang pos ada yang nyerang. Terus si korban awalnya naik motor, diserang, turun dari motor, lalu terjadilah tawuran itu,"" jelasnya. ""Dari belakang pos mancing-mancing, makanya dia nyerang ke belakang pos, nyusul si korban, saya marahin. Akhirnya si temannya ini selamat, sedangkan yang lagi nyerang di belakang pos ini nggak mendengar imbauan saya. Dia malah nyerang, nyerang, nyerang, akhirnya ketabraklah itu,"" lanjut dia. Selanjutnya, Amar mengatakan, korban terpental sejauh 10 meter. Tubuh korban yang terseret hancur terbagi ke beberapa bagian. ""Bagian badannya kepotong setengah, kakinya pisah juga itu,"" tukasnya.  ","Seorang pelajar sekolah menengah atas (SMA) tertabrak kereta rel listrik (KRL) di pelintasan Green Garden, Kedoya Utara, Kebon Jeruk, Jakarta Barat, ketika hendak tawuran. Petugas penjaga jalan lintasan (PJL) sempat menegur korban sebelum tertabrak kereta. Peristiwa itu terjadi pada Kamis 18 Juli sekitar pukul 18.00 WIB. ""Saya juga sudah memperingati ke yang tawuran itu. Tapi ada yang tidak mendengar waktu saya marahin, akhirnya terjadilah tabrakan itu,"" kata Amarullah Hadi kepada detikcom, Jumat 19 Juli 2024. Sebelum insiden terjadi, Amarullah terus berteriak kepada pelajar yang tawuran itu. Sayangnya, hanya dua orang memperhatikan peringatannya. "" Awalnya kereta bandara melintas lebih dulu tuh. Saat KRL ini mau melintas, di situ langsung kejadian tawuran. Nggak tahu, pokoknya tiba-tiba ada tawuran aja di situ,"" lanjut Amar. Akhirnya si temannya ini selamat, sedangkan yang lagi nyerang di belakang pos ini nggak mendengar imbauan saya. Dia malah nyerang, nyerang, nyerang, akhirnya ketabraklah itu,"" lanjut dia. Tubuh korban yang terseret hancur terbagi ke beberapa bagian. "" Bagian badannya kepotong setengah, kakinya pisah juga itu,"" tukasnya."
27 Saksi Diperiksa soal Pria Tewas Terikat Dimakan Biawak di Bantargebang,detikNews,2024-07-19,Wildan Noviansah,https://news.detik.com/berita/d-7446897/27-saksi-diperiksa-soal-pria-tewas-terikat-dimakan-biawak-di-bantargebang,"Polisi masih mendalami kasus dugaan pembunuhan pria bernama Waryanto (53) yang jasadnya ditemukan dengan kepala terbungkus karung dan kedua kaki serta tangannya terikat di belakang kantor TPST Bantargebang, Kota Bekasi. Hingga kini 27 saksi sudah diperiksa. ""(Sebanyak) 27 saksi sudah diinterogasi,"" kata Kasat Reskrim Polres Metro Bekasi Kota AKBP Muhammad Firdaus saat dihubungi, Jumat 19 Juli 2024. Firdaus merinci saksi yang diperiksa tersebut merupakan rekan kerja korban di TPST Bantargebang. Polisi juga meminta keterangan dari warga sekitar untuk mendapatkan fakta-fakta terkait kasus tersebut.    ""Saksi dari teman kerja korban dan warga di sekitar kontrakan korban,"" ujarnya Korban ditemukan di kali saluran penampungan air pada Rabu 17 Juli. Korban ditemukan dalam kondisi tangan dan kaki terikat dan kepala dibungkus karung. Diduga Waryanto merupakan korban pembunuhan. Pria bernama Waryanto (53) ditemukan tewas dalam kondisi kepala terbungkus karung serta kedua kaki dan tangan terikat di TPST Bantargebang, Kota Bekasi. Jasad korban ditemukan warga sedang dimakan biawak. ""Saksi menemukan korban sedang dimakan biawak,"" kata AKBP M Firdaus, saat dihubungi wartawan, Kamis 18 Juli. Mayat Waryanto ditemukan dua warga yang sedang mancing belut di tepi kali di belakang TPST Bantargebang pada Rabu 17 Juli sore. Keduanya kemudian mendekati dan melihat ternyata yang sedang dimakan biawak itu mayat manusia. ""Saksi melihat lebih dekat yang ternyata yang mengambang di air tersebut mayat manusia dalam keadaan terikat tali rafia pada kedua tangan dan kakinya serta kepala terbungkus karung,"" ujarnya.","Polisi masih mendalami kasus dugaan pembunuhan pria bernama Waryanto (53) yang jasadnya ditemukan dengan kepala terbungkus karung dan kedua kaki serta tangannya terikat di belakang kantor TPST Bantargebang, Kota Bekasi. Firdaus merinci saksi yang diperiksa tersebut merupakan rekan kerja korban di TPST Bantargebang. Polisi juga meminta keterangan dari warga sekitar untuk mendapatkan fakta-fakta terkait kasus tersebut. Pria bernama Waryanto (53) ditemukan tewas dalam kondisi kepala terbungkus karung serta kedua kaki dan tangan terikat di TPST Bantargebang, Kota Bekasi. Jasad korban ditemukan warga sedang dimakan biawak. "" Saksi menemukan korban sedang dimakan biawak,"" kata AKBP M Firdaus, saat dihubungi wartawan, Kamis 18 Juli. Keduanya kemudian mendekati dan melihat ternyata yang sedang dimakan biawak itu mayat manusia. """
Warga Lihat Pelajar Tawuran Acungkan Samurai Sebelum Tewas Tertabrak KRL,detikNews,2024-07-19,Taufiq Syarifudin,https://news.detik.com/berita/d-7446845/warga-lihat-pelajar-tawuran-acungkan-samurai-sebelum-tewas-tertabrak-krl,"Seorang pelajar SMA tewas tertabrak KRL di perlintasan Jalan Panjang, Kedoya Utara, Kebon Jeruk, Jakarta Barat ketika hendak tawuran. Warga sempat melihat korban mengacung-acungkan samurai sebelum tertabrak KRL. ""Dia (korban) udah provokasi-provokasi gitu sama yang di seberang. Bawa samurai gitu panjang, sempat ngacungkan gitu. Mau apa lagi kalau nggak tawuran?"" kata saksi bernama Toro (30) kepada detikcom di lokasi, Jumat 19 Juli 2024. Toro mengatakan korban saat itu sudah diperingatkan bahwa kereta mau lewat. Tak lama kemudian KRL melintas dan korban tertabrak.    ""Udah ditegur (sama penjaga lintasan) tapi yang satu kayaknya gak ngandel (memperhatikan) apa gimana, kena (tertabrak),"" ucap Toro. Ketika insiden terjadi, Kamis 18 Juli petang, Toro sedang berada di warung bakso. Dia sedang mencuci lap kotor untuk membersihkan warungnya. Toro kemudian menyadari ada sekelompok remaja yang hendak tawuran. Niat hati mau merekam tawuran, Toro justru menyaksikan seorang pelajar tertabrak KRL. ""Ceritanya saya lagi di warung sama ibu, lagi nyuci gombal (lap). Ngerti ada tawuran, mau saya rekam, eh malah udah ketabrak duluan. Mak del, muni ngono, keras itu suaranya 'gludak'. Lemes aku,"" ungkap dia. Toro yang sempat tersentak lantas langsung lari ke tempat korban tertabrak untuk melihat kondisinya. Ketika itu KRL sempat berhenti sejenak setelah insiden itu. Di lokasi kejadian, Toro sempat melihat rekan korban. Namun tak berselang lama rekan korban hilang entah kemana. ""Ada dua temannya itu, satu kabur yang satu datang ke TKP. Katanya 'Itu teman saya pak' abis itu ilang, nggak tahu ke mana,"" pungkas dia.  Simak juga 'Saat Pria di Jakpus Dibacok saat Lerai Tawuran Remaja':   ","Seorang pelajar SMA tewas tertabrak KRL di perlintasan Jalan Panjang, Kedoya Utara, Kebon Jeruk, Jakarta Barat ketika hendak tawuran. Warga sempat melihat korban mengacung-acungkan samurai sebelum tertabrak KRL. "" Toro mengatakan korban saat itu sudah diperingatkan bahwa kereta mau lewat. Tak lama kemudian KRL melintas dan korban tertabrak. ""Udah ditegur (sama penjaga lintasan) tapi yang satu kayaknya gak ngandel (memperhatikan) apa gimana, kena (tertabrak),"" ucap Toro. Ketika insiden terjadi, Kamis 18 Juli petang, Toro sedang berada di warung bakso. Toro kemudian menyadari ada sekelompok remaja yang hendak tawuran. Ketika itu KRL sempat berhenti sejenak setelah insiden itu. Namun tak berselang lama rekan korban hilang entah kemana. "" Ada dua temannya itu, satu kabur yang satu datang ke TKP. Simak juga 'Saat Pria di Jakpus Dibacok saat Lerai Tawuran Remaja':"
