title,category,publish_date,author,article_url,content,summary
Eks Menkumham Yasonna Lapor ke Jokowi soal PR yang Belum Selesai,detikNews,2024-08-19,Kurniawan Fadilah,https://news.detik.com/berita/d-7497222/eks-menkumham-yasonna-lapor-ke-jokowi-soal-pr-yang-belum-selesai,"Yasonna H Laoly mengaku dipanggil Presiden Joko Widodo (Jokowi) sebelum di-reshuffle dari jabatan Menteri Hukum dan HAM (Menkumham). Yasonna mengatakan sekaligus melaporkan hal-hal yang belum terselesaikan selama menjabat. ""Ya hanya canda-canda aja, kami ketawa-ketawa aja. Apa namanya, beliau menanyakan pending matters (hal yang tertunda) beberapa adalah saya sampaikan ada yang perlu saya titip nanti ke menteri yang baru,"" terang Yasonna kepada wartawan di kantor Kemenkumham, Jakarta Selatan, Senin 19 Agustus 2024. Dia juga menyebutkan bakal berbagi informasi sekaligus berkoordinasi dengan Supratman selaku Menkumham yang baru. Dia mengaku siap untuk memberikan informasi kepada Supratman.    ""Ya tentunya pastilah beberapa hal ke depan peraturan perundang-undangan yang sedang dibahas di DPR ataupun akan diajukan ke DPR,"" sebut Yasonna. ""Saya sampaikan, saya akan koordinasi dengan yang baru nanti. Kalau beliau memerlukan, bukan nasihat, informasi tentang hal yang barangkali sama seperti saya dulu,"" imbuhnya. Sebelumnya, Yasonna sempat bercerita momen dia dipanggil Presiden Joko Widodo (Jokowi) sebelum reshuffle kabinet. Dia mengatakan dipanggil setelah Jokowi pulang dari Ibu Kota Negara (IKN) Nusantara kemarin malam. ""Kemarin magrib, seusai salat magrib, saya bertemu Presiden RI Joko Widodo. Beliau memanggil saya dan saya sampaikan, baru beliau pulang dari IKN,"" tutur Yasonna saat memimpin upacara Hari Pengayoman di kantor Kemenkumham, Jakarta Selatan, Senin 19 Agustus. Yasonna mengatakan dia telah menyampaikan terima kasih kepada Presiden Jokowi atas kepercayaan sebagai menteri. Yasonna juga mengatakan tak ada yang sempurna selama dia melaksanakan tugas sebagai Menkumham. ""Saya sampaikan kepada beliau 'Bapak Presiden terimakasih atas kepercayaan, kesempatan yang diberikan kepada saya untuk membantu bapak sebagai Menteri Hukum dan HAM. Tentu tidak ada yang sempurna, kesempurnaan itu hanyalah milik Tuhan Yang Maha Kuasa,"" kata Yasonna. Jokowi telah melantik Supratman Andi Agtas sebagai Menkumham yang baru. Supratman merupakan politikus Gerindra. Sebelum menjadi menteri, Supratman merupakan Ketua Badan Legislasi DPR RI.  Simak juga Video 'Yasonna soal Menkumham Penggantinya: Sahabat Saya di Baleg':    ","Yasonna H Laoly mengaku dipanggil Presiden Joko Widodo (Jokowi) sebelum di-reshuffle dari jabatan Menteri Hukum dan HAM (Menkumham). Ya hanya canda-canda aja, kami ketawa-ketawa aja. Apa namanya, beliau menanyakan pending matters (hal yang tertunda) beberapa adalah saya sampaikan ada yang perlu saya titip nanti ke menteri yang baru,"" terang Yasonna kepada wartawan di kantor Kemenkumham, Jakarta Selatan, Senin 19 Agustus 2024. Dia juga menyebutkan bakal berbagi informasi sekaligus berkoordinasi dengan Supratman selaku Menkumham yang baru. Saya sampaikan, saya akan koordinasi dengan yang baru nanti. Kemarin magrib, seusai salat magrib, saya bertemu Presiden RI Joko Widodo. Yasonna mengatakan dia telah menyampaikan terima kasih kepada Presiden Jokowi atas kepercayaan sebagai menteri. Yasonna juga mengatakan tak ada yang sempurna selama dia melaksanakan tugas sebagai Menkumham. "" Saya sampaikan kepada beliau 'Bapak Presiden terimakasih atas kepercayaan, kesempatan yang diberikan kepada saya untuk membantu bapak sebagai Menteri Hukum dan HAM. Jokowi telah melantik Supratman Andi Agtas sebagai Menkumham yang baru."
"Tekan Pengangguran Jakarta, Heru Budi Genjot Pelatihan Kerja Standar Global",detikNews,2024-08-19,Erika Dyah,https://news.detik.com/berita/d-7497219/tekan-pengangguran-jakarta-heru-budi-genjot-pelatihan-kerja-standar-global,"Masalah pengangguran masih terus menjadi momok hingga kini. Tak hanya pada masa pandemi COVID-19, tahun ini gelombang Pemutusan Hubungan Kerja (PHK) masih terus terjadi di dalam negeri. Pemprov DKI Jakarta tidak tinggal diam melihat angka pengangguran di Jakarta. Berbagai upaya terus didorong untuk mengatasi masalah ini, dengan memperluas pasar tenaga kerja dan meningkatkan kompetensi pencari kerja. Di bawah kepemimpinan Penjabat (Pj.) Gubernur DKI Jakarta Heru Budi Hartono, Dinas Tenaga Kerja, Transmigrasi dan Energi Provinsi DKI Jakarta berupaya menciptakan tenaga kerja yang berorientasi dan berstandar global melalui sejumlah program. Dari Pelatihan Berbasis Kompetensi, Kerja Sama dengan Dunia Usaha dan Industri, Peningkatan Keterampilan Bahasa, Pengembangan Infrastruktur Pusat Pelatihan Kerja, hingga Sertifikasi dan Akreditasi Pusat Pelatihan Kerja. Kepala Dinas Tenaga Kerja, Transmigrasi dan Energi Provinsi DKI Jakarta Hari Nugroho mengungkapkan, pelatihan yang diberikan berdampak positif bagi tenaga kerja. Termasuk meningkatkan keterampilan dan kompetensi tenaga kerja, sehingga mereka lebih siap untuk memasuki pasar kerja. ""    Berkat keterampilan yang relevan dengan kebutuhan industri, mereka memiliki peluang lebih besar untuk mendapatkan pekerjaan,"" ucap Hari dalam keterangannya, Senin 19 Agustus 2024. Pelatihan yang diberikan juga berstandar global, demi mendorong tenaga kerja lebih kompetitif. Tidak hanya di pasar kerja lokal, tetapi juga internasional. ""Ini membuka peluang untuk bekerja di perusahaan multinasional atau di luar negeri, yang pada gilirannya mengurangi tekanan pada pasar kerja lokal,"" ujar Hari. Ia pun memastikan, pelatihan yang diberikan sesuai dengan kebutuhan industri. Dengan demikian, pelatihan dari Pemprov DKI Jakarta dapat membantu menciptakan tenaga kerja yang sesuai dengan permintaan pasar. ""Hal ini mengurangi kesenjangan antara keterampilan yang dimiliki oleh pencari kerja dan keterampilan yang dibutuhkan oleh pemberi kerja,"" kata Hari. Tak hanya itu, pelatihan yang digelar juga disesuaikan dengan masing-masing kota administrasi di DKI Jakarta. Sebagai contoh, Kota Administrasi Jakarta Pusat merupakan pusat bisnis dan keuangan, maka pelatihan yang diberikan berfokus pada bidang akuntansi, desain, digital marketing, serta bahasa asing. Lebih lanjut, Hari menjelaskan, selain menyediakan berbagai program pelatihan kerja, pihaknya juga menggelar bursa kerja dan job fair, guna memfasilitasi penempatan tenaga kerja dengan menghubungkan pencari kerja serta perusahaan yang membutuhkan tenaga kerja. Cara ini membantu mempertemukan antara supply dan demand di pasar tenaga kerja. Tak hanya itu, pihaknya juga menjalin kemitraan dengan perusahaan swasta untuk menciptakan program magang, kerja sama pelatihan, serta peluang kerja bagi warga DKI Jakarta. Pemprov DKI Jakarta pun mendorong pengembangan kewirausahaan melalui program pelatihan dan pendampingan, untuk menciptakan wirausaha baru yang dapat menciptakan lapangan kerja. Program ini memberikan bantuan modal, pelatihan manajemen, hingga akses pasar bagi usaha kecil serta menengah. Langkah-langkah yang dilakukan Pemprov DKI Jakarta berhasil menaikkan jumlah angkatan kerja di Jakarta, yakni sebanyak 5,43 juta orang pada Februari 2024. Angka ini naik sebesar 179 ribu orang dibandingkan pada Februari 2023. ""Tingkat Partisipasi Angkatan Kerja (TPAK) juga mengalami peningkatan sebesar 2,1 persen dalam periode yang sama, berdasarkan data BPS (Badan Pusat Statistik) Jakarta,"" tuturnya. Berbagai program Pemprov DKI Jakarta itu senada dengan pandangan Dekan Fakultas Ekonomi dan Bisnis Universitas Indonesia (FEB UI) Teguh Dartanto, mengenai upaya mengatasi masalah pengangguran di tanah air. Menurutnya, pemerintah tak boleh hanya fokus meningkatkan akses ke pendidikan, tapi harus dibarengi pula dengan peningkatan kualitasnya. Ia menilai, peningkatan keterampilan serta kualitas tenaga kerja dapat menjadi solusi jangka menengah dan panjang, untuk mengatasi masalah ini pada masa mendatang. ""Banyak terjadi, perguruan tinggi mencetak banyak lulusan yang tidak dibarengi dengan kompetensi di pasar kerja. Pendidikan berkualitas akan mengurangi masalah tersebut. Harus komprehensif, tidak hanya berlatih atau dilatih saja. Tetapi, setelah dilatih juga ada penyerapan dan penyerapannya itu seperti apa,"" papar Teguh dalam keterangan tertulis. Ia menekankan, link and match dunia pendidikan dengan industri pun perlu diperkuat untuk mereduksi masalah pengangguran. Dengan link and match, tenaga kerja dapat berinteraksi dan terhubung langsung dengan dunia bisnis yang sesuai.","Masalah pengangguran masih terus menjadi momok hingga kini. Pemprov DKI Jakarta tidak tinggal diam melihat angka pengangguran di Jakarta. Gubernur DKI Jakarta Heru Budi Hartono, Dinas Tenaga Kerja, Transmigrasi dan Energi Provinsi DKI Jakarta berupaya menciptakan tenaga kerja yang berorientasi dan berstandar global melalui sejumlah program. Ini membuka peluang untuk bekerja di perusahaan multinasional atau di luar negeri, yang pada gilirannya mengurangi tekanan pada pasar kerja lokal,"" ujar Hari. Ia pun memastikan, pelatihan yang diberikan sesuai dengan kebutuhan industri. Lebih lanjut, Hari menjelaskan, selain menyediakan berbagai program pelatihan kerja, pihaknya juga menggelar bursa kerja dan job fair, guna memfasilitasi penempatan tenaga kerja dengan menghubungkan pencari kerja serta perusahaan yang membutuhkan tenaga kerja. Program ini memberikan bantuan modal, pelatihan manajemen, hingga akses pasar bagi usaha kecil serta menengah. Langkah-langkah yang dilakukan Pemprov DKI Jakarta berhasil menaikkan jumlah angkatan kerja di Jakarta, yakni sebanyak 5,43 juta orang pada Februari 2024. Angka ini naik sebesar 179 ribu orang dibandingkan pada Februari 2023. "" Tingkat Partisipasi Angkatan Kerja (TPAK) juga mengalami peningkatan sebesar 2,1 persen dalam periode yang sama, berdasarkan data BPS (Badan Pusat Statistik) Jakarta,"" tuturnya. Berbagai program Pemprov DKI Jakarta itu senada dengan pandangan Dekan Fakultas Ekonomi dan Bisnis Universitas Indonesia (FEB UI) Teguh Dartanto, mengenai upaya mengatasi masalah pengangguran di tanah air. Menurutnya, pemerintah tak boleh hanya fokus meningkatkan akses ke pendidikan, tapi harus dibarengi pula dengan peningkatan kualitasnya. Banyak terjadi, perguruan tinggi mencetak banyak lulusan yang tidak dibarengi dengan kompetensi di pasar kerja. Pendidikan berkualitas akan mengurangi masalah tersebut. Harus komprehensif, tidak hanya berlatih atau dilatih saja. Tetapi, setelah dilatih juga ada penyerapan dan penyerapannya itu seperti apa,"" papar Teguh dalam keterangan tertulis. Dengan link and match, tenaga kerja dapat berinteraksi dan terhubung langsung dengan dunia bisnis yang sesuai."
Wanita Dalam Koper di Pangkep Ternyata Diperkosa dan Dibunuh Tetangga,detikNews,2024-08-19,Laode Muhammad Mashudi,https://news.detik.com/berita/d-7497214/wanita-dalam-koper-di-pangkep-ternyata-diperkosa-dan-dibunuh-tetangga,"Pembunuh wanita berinisial R (47), yang mayatnya dalam koper di Kabupaten Pangkep, Sulawesi Selatan (Sulsel), ternyata tetangganya sendiri, AR (37). Pelaku juga memerkosa sebelum membunuh korban. Pelaku awalnya baru selesai pesta minuman keras (miras) dan berencana pulang ke rumah, Sabtu 10 Agustus 2024, sekitar pukul 02.00 Wita. Saat itu pelaku rupanya masuk ke rumah korban yang merupakan tetangganya dengan niat mencuri. ""Yang bersangkutan pulang dari minum-minum, mabuk bersama temannya. Kemudian pada saat dia tiba di rumah, dia bukan masuk ke rumahnya, tapi masuk ke rumah tetangga. Masuk rumahnya tetangga cari uang dan cari benda-benda berharga lain,"" ujar Kapolda Sulsel Irjen Andi Rian R Djajadi dalam konferensi pers di Mapolda Sulsel, dilansir detikSulsel, Senin 19 Agustus.    Setelah menemukan barang yang dicari, pelaku kemudian melihat korban sedang tertidur. Pelaku lantas mencoba memerkosa korban. ""Ketemu benda berharga lain, ternyata dia lihat ada korban tidur di situ. Muncullah niat yang lain lagi, untuk melakukan pemerkosaan terhadap korban,"" beber Irjen Rian. Namun, saat melakukan aksi pemerkosaan, korban akhirnya tersadar sehingga pelaku menyekap korban hingga tidak sadarkan diri. Selanjutnya, saat hendak kabur, korban rupanya kembali sadar hingga muncul lagi niat pelaku menghabisi nyawa korban. Baca selengkapnya di sini.","Pembunuh wanita berinisial R (47), yang mayatnya dalam koper di Kabupaten Pangkep, Sulawesi Selatan (Sulsel), ternyata tetangganya sendiri, AR (37). Pelaku juga memerkosa sebelum membunuh korban. Pelaku awalnya baru selesai pesta minuman keras (miras) dan berencana pulang ke rumah, Sabtu 10 Agustus 2024, sekitar pukul 02.00 Wita. Saat itu pelaku rupanya masuk ke rumah korban yang merupakan tetangganya dengan niat mencuri. "" Setelah menemukan barang yang dicari, pelaku kemudian melihat korban sedang tertidur. Pelaku lantas mencoba memerkosa korban. "" Namun, saat melakukan aksi pemerkosaan, korban akhirnya tersadar sehingga pelaku menyekap korban hingga tidak sadarkan diri."
Viral WNA Keruk Tebing-Buang Material ke Laut demi Proyek Vila di Bali,detikNews,2024-08-19,Putu Krista,https://news.detik.com/berita/d-7497146/viral-wna-keruk-tebing-buang-material-ke-laut-demi-proyek-vila-di-bali,"Video pembangunan vila di atas tebing Pulau Lembongan, Kecamatan Nusa Penida, Klungkung, Bali, viral dan menuai kecaman. Pemilik proyek yang diduga warga negara Australia itu membuang material bangunan ke laut. Dilansir detikBali, Senin 19 Agustus 2024, video yang beredar itu menunjukkan debu putih mengepul saat tebing lokasi pembangunan vila dikeruk menggunakan alat berat. Longsoran material kemudian terlihat dijatuhkan ke laut. Video tersebut pertama kali diunggah melalui media sosial oleh Perbekel Lembongan, I Ketut Gede Arjaya. Dia mengaku tahu aktivitas pembangunan oleh warga negara asing (WNA) itu setelah mendapat informasi dari warga.    ""Selain membahayakan penyeberangan lalu lintas laut ada juga aktivitas diving dan snorkeling di bawah. Sangat bahaya jika ada sampai wisatawan yang kena atau warga yang melintas,"" kata Arjaya. Kepala Satuan Polisi Pamong Praja (Satpol PP) Kabupaten Klungkung Dewa Putu Suarbawa mengaku sudah mendapat informasi terkait pembangunan vila oleh WNA di tebing Nusa Lembongan. Menurutnya, pembangunan vila tersebut memang belum mengantongi izin. ""Kami diperintahkan oleh Bapak Pj Bupati untuk melakukan pemeriksaan ke lapangan bersama Dinas Pekerjaan Umum, Perumahan Rakyat, Dinas Lingkungan Hidup dan Pertanahan, Dinas Penanaman Modal Pelayanan Terpadu Satu Pintu, dan Satpol PP turun bersama ke lokasi,"" jelasnya. Simak selengkapnya di sini. Simak Video 'Respons Sandiaga Terkait Viral Video Pembangunan Vila Kikis Tebing di Bali':    ","Video pembangunan vila di atas tebing Pulau Lembongan, Kecamatan Nusa Penida, Klungkung, Bali, viral dan menuai kecaman. Longsoran material kemudian terlihat dijatuhkan ke laut. Sangat bahaya jika ada sampai wisatawan yang kena atau warga yang melintas,"" kata Arjaya. Kepala Satuan Polisi Pamong Praja (Satpol PP) Kabupaten Klungkung Dewa Putu Suarbawa mengaku sudah mendapat informasi terkait pembangunan vila oleh WNA di tebing Nusa Lembongan. Kami diperintahkan oleh Bapak Pj Bupati untuk melakukan pemeriksaan ke lapangan bersama Dinas Pekerjaan Umum, Perumahan Rakyat, Dinas Lingkungan Hidup dan Pertanahan, Dinas Penanaman Modal Pelayanan Terpadu Satu Pintu, dan Satpol PP turun bersama ke lokasi,"" jelasnya. Simak Video 'Respons Sandiaga Terkait Viral Video Pembangunan Vila Kikis Tebing di Bali':"
Maruarar: Bahlil Bakal Buat Gebrakan,detikNews,2024-08-19,Elvan Dany Sutrisno,https://news.detik.com/berita/d-7497113/maruarar-bahlil-bakal-buat-gebrakan,"Politikus Gerindra yang juga pengusaha nasional Maruarar Sirait menghadiri pelantikan Bahlil Lahadalia menjadi Menteri ESDM. Maruarar meyakini Bahlil akan membuat gebrakan positif. ""Saya yakin Pak Bahlil akan membuat gebrakan dan kemajuan positif. Karena selama di Kementerian Investasi banyak membuat terobosan baik aturan maupun eksekusi di lapangan,"" kata Maruarar kepada wartawan, Senin 19 Agustus 2024. Ara meyakini penunjukan Bahlil sebagai menteri ESDM menggantikan Arifin Tasrif atas dasar kapabilitas dan capaian selama menjadi Menteri Investasi.    ""Pak Jokowi pasti punya penilaian positif terhadap terobosan terobosan Pak Bahlil selama di Kementerian Investasi di berbagai bidang seperti hilirisasi dan lainnya,"" kata Maruarar. Bahlil Lahadalia telah resmi dilantik menjadi Menteri ESDM. Dalam serah terima Jabatan dia menegaskan akan melanjutkan program dan membuat terobosan. ""Saya akan melanjutkan apa yang dilakukan oleh Pak Arifin secara baik dengan penuh tanggung jawab,"" kata Bahlil dalam sambutannya. ""Saya ini orang Papua. Kalau saya agak beda kelihatannya, jangan sampai tersinggung kalau suara saya agak keras. Karena bukan berarti marah karena kita orang timur ini suaranya keras tapi hatinya lembut,"" katanya disambut tepuk tangan hadirin. Simak Video 'Baru Jadi Menteri ESDM, Bahlil Sentil Impor Minyak-Gas Bengkak':    ","Politikus Gerindra yang juga pengusaha nasional Maruarar Sirait menghadiri pelantikan Bahlil Lahadalia menjadi Menteri ESDM. Maruarar meyakini Bahlil akan membuat gebrakan positif. "" ""Pak Jokowi pasti punya penilaian positif terhadap terobosan terobosan Pak Bahlil selama di Kementerian Investasi di berbagai bidang seperti hilirisasi dan lainnya,"" kata Maruarar. Dalam serah terima Jabatan dia menegaskan akan melanjutkan program dan membuat terobosan. "" Kalau saya agak beda kelihatannya, jangan sampai tersinggung kalau suara saya agak keras. Simak Video 'Baru Jadi Menteri ESDM, Bahlil Sentil Impor Minyak-Gas Bengkak':"
PDIP Tak Ratapi Pencopotan Yasonna Laoly dari Menkumham,detikNews,2024-08-19,Firda Cynthia Anggrainy,https://news.detik.com/berita/d-7497074/pdip-tak-ratapi-pencopotan-yasonna-laoly-dari-menkumham,"Ketua DPP PDIP Yasonna Hamonangan Laoly di-reshuffle dari jabatan Menkumham digantikan elite Gerindra, Supratman Andi Agtas. PDIP menegaskan tengah fokus mempersiapkan kontestasi pilkada dan tak mempersoalkan reshuffle Yasonna tersebut. ""Kita menganut sistem presidensial. Artinya, presiden memiliki kewenangan mengangkat dan memberhentikan menteri atau pejabat setingkat menteri. Itu hak prerogatif yang diberikan konstitusi kepada presiden. Jadi kalau presiden memberhentikan menteri itu kita hormati sebagai kewenangan beliau,"" kata Ketua DPP PDIP Said Abdullah kepada wartawan, Senin 19 Agustus 2024. Said mengatakan kader-kader PDIP yang menjabat sebagai menteri telah diserahkan untuk berkontribusi di pemerintahan. Dia menuturkan partainya menghormati apapun keputusan Presiden Joko Widodo (Jokowi) apabila melakukan pergantian menteri.    ""Kedua, semua kader PDI Perjuangan yang sekarang menjabat sebagai menteri telah kita wakafkan untuk kebaikan sebesar-besarnya bagi optimalnya jalannya pemerintahan. Jadi kalau Presiden Jokowi memandang perlu ada evaluasi atau kebutuhan lainnya sehingga sejumlah kader PDI Perjuangan diberhentikan, ya kita hormati itu,"" kata Said. ""Sehingga tidak mungkin kami meratapi itu, karena begitulah mekanisme tata negara kita. Apalagi kami akan mengawal pemerintahan ini sampai berakhir di bulan Oktober sesuai amanat kongres dan ini kami junjung tinggi keputusan kongres tersebut karena bagian dari ketaatan kepada konstitusi kami. Lagi pula, per Oktober nanti pemerintahan berganti ke Pak Prabowo,"" ujarnya. Lebih lanjut, Ketua Badan Anggaran (Banggar) DPR itu menegaskan PDIP tengah fokus mempersiapkan pilkada. Menurutnya, partai berlogo banteng moncong putih itu perlu strategi terbaik untuk menyukseskan calon yang diusung di tiap daerah. ""Kami lebih fokus memikirkan tentang pemenangan pilkada. Sebab, pilkada serentak ini memiliki makna penting sebagai bentuk pengabdian kader-kader PDI Perjuangan, untuk mendapatkan kepercayaan rakyat. Sebab, jalannya pemerintahan di daerah akan berdampak maju mundurnya daerah. Apalagi pilkadanya serentak sehingga kami harus memikirkan strategi yang terbaik untuk menyukseskan calon-calon yang kami usung dan dukung,"" ujarnya. Senada dengan Said, jubir PDIP Chico Hakim menyerahkan keputusan soal pergantian menteri kepada presiden. Namun, Chico menyinggung adanya kejanggalan terkait pencopotan Yasonna itu. ""Pergantian menteri, pencopotan, penunjukan itu hak prerogatif presiden, kami tidak mempermasalahkan hal tersebut tapi saya rasa masyarakat bisa menilai ada semacam cukup janggal dan tidak pernah sepertinya terjadi sebelum-sebelumnya pergantian menteri ini dilakukan kurang lebih dari dua bulan di masa presiden akan berakhir,"" kata Chico. ""Namun tentu ada pertimbangan-pertimbangan sendiri yang ini tidak boleh dimasalahkan,"" imbuhnya.  Simak Video 'Yasonna soal Menkumham Penggantinya: Sahabat Saya di Baleg':         Halaman                  1                              2                           Selanjutnya       yasonna laoly yasonna menkumham jokowi presiden jokowi pdip   ","Ketua DPP PDIP Yasonna Hamonangan Laoly di-reshuffle dari jabatan Menkumham digantikan elite Gerindra, Supratman Andi Agtas. PDIP menegaskan tengah fokus mempersiapkan kontestasi pilkada dan tak mempersoalkan reshuffle Yasonna tersebut. "" Itu hak prerogatif yang diberikan konstitusi kepada presiden. Jadi kalau presiden memberhentikan menteri itu kita hormati sebagai kewenangan beliau,"" kata Ketua DPP PDIP Said Abdullah kepada wartawan, Senin 19 Agustus 2024. ""Kedua, semua kader PDI Perjuangan yang sekarang menjabat sebagai menteri telah kita wakafkan untuk kebaikan sebesar-besarnya bagi optimalnya jalannya pemerintahan. Sehingga tidak mungkin kami meratapi itu, karena begitulah mekanisme tata negara kita. Lagi pula, per Oktober nanti pemerintahan berganti ke Pak Prabowo,"" ujarnya. Menurutnya, partai berlogo banteng moncong putih itu perlu strategi terbaik untuk menyukseskan calon yang diusung di tiap daerah. "" Kami lebih fokus memikirkan tentang pemenangan pilkada. Sebab, jalannya pemerintahan di daerah akan berdampak maju mundurnya daerah. Senada dengan Said, jubir PDIP Chico Hakim menyerahkan keputusan soal pergantian menteri kepada presiden. Namun tentu ada pertimbangan-pertimbangan sendiri yang ini tidak boleh dimasalahkan,"" imbuhnya."
"Rumah di Jakbar Kerampokan, Anak dan ART Disekap Pelaku Dalam Kamar",detikNews,2024-08-19,Wildan Noviansah,https://news.detik.com/berita/d-7497057/rumah-di-jakbar-kerampokan-anak-dan-art-disekap-pelaku-dalam-kamar,"Aksi perampokan terjadi sebuah rumah kawasan Kemanggisan, Palmerah, Jakarta Barat. Disebutkan anak dari pemilik rumah dan asisten rumah tangga (ART) sempat disekap di kamar oleh para pelaku. Kabid Humas Polda Metro Jaya Kombes Ade Ary Syam Indradi mengatakan peristiwa perampokan terjadi Sabtu 17 Agustus 2024 dini hari. Mulanya korban berinisial LPI dihubungi oleh anak korban dan mendengar adanya suara teriakan. ""Awal kejadian korban mendapat telepon dari anak korban dan mengabarkan bahwa dari rumah korban (TKP) terdengar suara teriakan, kemudian korban meminta kepada sekuriti untuk mengecek,"" kata Ade Ary kepada wartawan, Senin 19 Agustus 2024.    Setelah dicek, ternyata anak korban dan pembantunya disekap di dalam kamar dan dikunci dari luar. Mulut ART ditutup lakban. ""Anak korban dan pembantu rumah di dalam kamar dan dikunci dari luar sudah dalam keadaan terikat dan mulut pembantu korban ditutup dengan lakban,"" ujarnya. Korban mengatakan kondisi rumah saat itu sudah berantakan dengan kondisi pintu samping rumah sudah rusak. Emas 500 gram dan uang Rp 10 juta dalam lemari raib dicuri pelaku. ""Kamar korban berantakan dan emas Antam sebanyak 500 gram beserta uang tunai Rp 10 juta yang disimpan dalam laci lemari sudah tidak ada. Atas kejadian tersebut korban mengalami kerugian sekitar Rp 690 juta,"" jelasnya. Dari rekaman CCTV rumah tersebut, diketahui pelaku berjumlah lima orang. Saat ini pihak kepolisian masih melakukan serangkaian pendalaman. ""Pada saat dicek melalui CCTV terlihat ada sekitar 5 orang pelaku yang masuk ke dalam rumah korban dari pintu samping kanan dengan cara merusak pintu tersebut,"" pungkasnya. ","Aksi perampokan terjadi sebuah rumah kawasan Kemanggisan, Palmerah, Jakarta Barat. Mulanya korban berinisial LPI dihubungi oleh anak korban dan mendengar adanya suara teriakan. "" Setelah dicek, ternyata anak korban dan pembantunya disekap di dalam kamar dan dikunci dari luar. Kamar korban berantakan dan emas Antam sebanyak 500 gram beserta uang tunai Rp 10 juta yang disimpan dalam laci lemari sudah tidak ada. Dari rekaman CCTV rumah tersebut, diketahui pelaku berjumlah lima orang. Saat ini pihak kepolisian masih melakukan serangkaian pendalaman. "" Pada saat dicek melalui CCTV terlihat ada sekitar 5 orang pelaku yang masuk ke dalam rumah korban dari pintu samping kanan dengan cara merusak pintu tersebut,"" pungkasnya."
