title,category,publish_date,author,article_url,content,summary
"Diundang Hamas, JK Akan ke Timur Tengah Bahas Gencatan Senjata Gaza",detikNews,2024-07-10,Achmad Dwi Afriyadi,https://news.detik.com/berita/d-7431262/diundang-hamas-jk-akan-ke-timur-tengah-bahas-gencatan-senjata-gaza,"Israel masih mengancam nyawa penduduk Jalur Gaza di Palestina. Gencatan senjata belum terwujud, tawar menawar proposal masih terjadi antara Hamas dengan Israel. Wakil Presiden ke-10 dan 12 RI, Jusuf Kalla (JK), akan ke Timur Tengah atas undangan pihak Hamas untuk mendorong gencatan senjata di Gaza. ""Ya saya follow up-nya minggu ini malahan. Saya akan ke sana, diundang mereka (Hamas), minta ketemu, (saya bilang) oke, kita ketemu,"" kata JK di Riau, Selasa 9 Juli 2024. Follow up atau tindak lanjut yang dimaksud JK adalah tindak lanjut atas pertemuan di Malaysia. JK telah bertemu dengan perwakilan Hamas, pertemuan itu digelar di Kuala Lumpur, Malaysia, 5 Mei 2024 lalu.    Selanjutnya, JK akan terbang ke negara Timur Tengah untuk kembali bertemu Hamas. Dia tidak menyebut negara mana persisnya yang akan dia tuju. ""Di Timur Tengah,"" kata JK. Gencatan senjata di Gaza harus cepat diwujudkan. JK mengatakan selain demi melindungi warga di Gaza, gencatan senjata sebenarnya juga berguna untuk keamanan orang-orang di Israel juga. ""Kita berharap perjanjian gencatan senjata di Doha (Qatar) itu bisa sepakat. Karena ini kalau nggak, korbannya bisa banyak sekali dari kedua belah pihak,"" kata dia. Kabar terbaru, Hamas menyebut Perdana Menteri Israel Benjamin Netanyahu menghalangi gencatan senjata di Gaza. Padahal, para mediator sudah mendorong tercapainya kesepakatan. Dilansir AFP, Hamas dalam pernyataan pada Senin 8 Juli waktu setempat, menuduh Netanyahu ""terus memberikan lebih banyak hambatan dan perundingan"". Kelompok militan yang menguasai Jalur Gaza itu menuduh Netanyahu telah meningkatkan ""agresi dan kejahatannya terhadap rakyat kami"" dalam apa yang mereka sebut sebagai ""upaya untuk menggusur secara paksa untuk menggagalkan semua upaya dalam mencapai kesepakatan"".","Israel masih mengancam nyawa penduduk Jalur Gaza di Palestina. Gencatan senjata belum terwujud, tawar menawar proposal masih terjadi antara Hamas dengan Israel. Wakil Presiden ke-10 dan 12 RI, Jusuf Kalla (JK), akan ke Timur Tengah atas undangan pihak Hamas untuk mendorong gencatan senjata di Gaza. "" Ya saya follow up-nya minggu ini malahan. Dia tidak menyebut negara mana persisnya yang akan dia tuju. "" Kita berharap perjanjian gencatan senjata di Doha (Qatar) itu bisa sepakat. Karena ini kalau nggak, korbannya bisa banyak sekali dari kedua belah pihak,"" kata dia. Padahal, para mediator sudah mendorong tercapainya kesepakatan. Dilansir AFP, Hamas dalam pernyataan pada Senin 8 Juli waktu setempat, menuduh Netanyahu ""terus memberikan lebih banyak hambatan dan perundingan""."
"Jalan Kaki dari Hotel, Jokowi Nikmati Malam di Kafe-Sapa Warga Lampung Tengah",detikNews,2024-07-11,Eva Safitri,https://news.detik.com/berita/d-7434901/jalan-kaki-dari-hotel-jokowi-nikmati-malam-di-kafe-sapa-warga-lampung-tengah,"Presiden Joko Widodo (Jokowi) menyempatkan waktu untuk menikmati malam dengan mengunjungi sebuah kafe di Lampung. Jokowi berjalan kaki dari hotel tempatnya bermalam saat menuju kafe. Dikutip Biro Sekretariat Presiden, Jokowi tiba di kafe sekitar pukul 20.15 WIB. Kedatangan Jokowi disambut hangat oleh warga yang sudah menunggu. Setelah memesan makanan, Jokowi tidak segan memberikan kesempatan kepada warga untuk berfoto bersama. Erisne, seorang guru SD yang beruntung dapat bersalaman dengan Jokowi.    ""Senang deh, terus salaman juga kan. Bahagia banget,"" katanya. Sikap ramah Jokowi, kata Erisne, membuat banyak warga lain merasa lebih dekat dengan sosok presiden tersebut. Mardiah, rekan Erisne, juga menyampaikan rasa syukurnya dapat bertemu langsung dengan Jokowi. Kedua guru itu berharap agar masa depan Indonesia di bawah kepemimpinan yang baru nanti masih bisa melanjutkan kebaikan yang dilakukan Jokowi. ""Bisa salaman sama Pak Jokowi, alhamdulillah,"" ujarnya. Senada diungkap, Julizar dan Eni, pasangan suami istri asal Lampung Tengah. Mereka senang mereka dapat bertemu Presiden. Mereka tak lupa mengajak kedua anaknya untuk berfoto bersama Kepala Negara. ""Senang banget deh. Asli senang benar. Makasih Pak Jokowi sudah mampir ke Lampung Tengah, mudah-mudahan sehat terus Pak Jokowi,"" ujar Julizar. Di sisi lain, Yusar Setiawan, seorang pengemudi ojek online berbagi cerita bagaimana dia berusaha mendapatkan foto dengan Jokowi. ""Dari media sosial, terus langsung ke sini meluncur. Dari tadi sore sih, tadi sore enggak kebagian foto. Alhamdulillah malam ini kebagian foto. Tadi ditunjuk Bapak,"" serunya. Kunjungan Presiden Jokowi ke kafe di Lampung Tengah ini menjadi momen berharga bagi warga setempat untuk berinteraksi langsung. Selain itu, kunjungan ini juga menjadi momen santai Kepala Negara di tengah kesibukannya melakukan serangkaian agenda kerja di Provinsi Lampung. Turut mendampingi Jokowi dalam kesempatan tersebut yakni Menteri Perdagangan Zulkifli Hasan, Menteri Pekerjaan Umum dan Perumahan Rakyat Basuki Hadimuljono, Menteri Dalam Negeri Tito Karnavian, Menteri Pertanian Andi Amran Sulaiman, Menteri Kesehatan Budi Gunadi Sadikin, dan Pj Gubernur Lampung Samsudin.  Simak Video 'Penampakan Jalan Rusak di Lampung yang Disorot Jokowi':   ","Presiden Joko Widodo (Jokowi) menyempatkan waktu untuk menikmati malam dengan mengunjungi sebuah kafe di Lampung. Dikutip Biro Sekretariat Presiden, Jokowi tiba di kafe sekitar pukul 20.15 WIB. Kedatangan Jokowi disambut hangat oleh warga yang sudah menunggu. Setelah memesan makanan, Jokowi tidak segan memberikan kesempatan kepada warga untuk berfoto bersama. Mardiah, rekan Erisne, juga menyampaikan rasa syukurnya dapat bertemu langsung dengan Jokowi. Senada diungkap, Julizar dan Eni, pasangan suami istri asal Lampung Tengah. Mereka senang mereka dapat bertemu Presiden. Makasih Pak Jokowi sudah mampir ke Lampung Tengah, mudah-mudahan sehat terus Pak Jokowi,"" ujar Julizar. Dari tadi sore sih, tadi sore enggak kebagian foto. Turut mendampingi Jokowi dalam kesempatan tersebut yakni Menteri Perdagangan Zulkifli Hasan, Menteri Pekerjaan Umum dan Perumahan Rakyat Basuki Hadimuljono, Menteri Dalam Negeri Tito Karnavian, Menteri Pertanian Andi Amran Sulaiman, Menteri Kesehatan Budi Gunadi Sadikin, dan Pj Gubernur Lampung Samsudin. Simak Video 'Penampakan Jalan Rusak di Lampung yang Disorot Jokowi':"
"Pemkot Solo Jelaskan Asal-usul Nama SIMONTOK: Bukan Jorok, agar Mudah Diingat",detikNews,2024-07-11,Tara Wahyu NV,https://news.detik.com/berita/d-7434858/pemkot-solo-jelaskan-asal-usul-nama-simontok-bukan-jorok-agar-mudah-diingat,"Kepala Dinas Ketahanan Pangan dan Perikanan Solo, Eko Nugroho, mengungkapkan nama aplikasi miliki Pemerintah Kota (Pemkot) Solo bernama SIMONTOK atau Sistem Monitoring Stok dan Kebutuhan Pangan Pokok Surakarta dibuat agar mudah diingat. Dia membantah adanya unsur yang mengarah pada hal jorok di balik pembuatan nama yang menuai kritik tersebut. ""Jadi di pikiran saat itu tidak ada sama sekali untuk jorok. Hanya untuk menarik, mudah untuk diingat. Sedang Montok sendiri singkatan dari Monitoring Stok dan Kebutuhan Pangan Pokok Surakarta,"" kata Eko dilansir detikJateng, Kamis 11 Juli 2024. Ia menilai kata tersebut merupakan istilah umum. ""Saya rasa kalau istilah umum montok itu orang yang gemuk dan lucu, atau istilah sekarang gemoy,"" bebernya.    Eko mengungkapkan aplikasi tersebut dibuat sejak 2021 yang merupakan inovasi dari dirinya saat mengikuti diklat pimpinan administrasi untuk eselon 3. Dari aplikasi tersebut, kata Eko, dapat diketahui seberapa besar stok yang ada di pasaran dengan kebutuhan konsumsi masyarakat. Sehingga, diketahui cukup atau tidaknya kebutuhan pangan masyarakat Kota solo. ""Saat itu tujuannya agar menarik dari sisi judul dan mudah diingat. Dan disetujui pembimbing. Dan hasilnya digunakan untuk menunjang kegiatan dinas di bidang ketersediaan, distribusi dan konsumsi pangan,"" bebernya. ""Juga dapat dilihat kapan terjadi tren penurunan pasokan, juga harga pangan, dan dapat digunakan kira-kira kapan akan terjadi inflasi atau deflasi bahan pangan,"" lanjutnya. Hingga saat ini, Eko mengungkap tidak ada teguran atas penamaan aplikasi tersebut. Meski begitu, bila terdapat pro dan kontra, nama aplikasi tersebut akan diganti. ""Belum ada kalau teguran, tapi kalau diganti kami siap dengan nama baru SMS KEPPO dengan singkatan yang sama,"" pungkasnya. Baca selengkapnya di sini.","Kepala Dinas Ketahanan Pangan dan Perikanan Solo, Eko Nugroho, mengungkapkan nama aplikasi miliki Pemerintah Kota (Pemkot) Solo bernama SIMONTOK atau Sistem Monitoring Stok dan Kebutuhan Pangan Pokok Surakarta dibuat agar mudah diingat. Jadi di pikiran saat itu tidak ada sama sekali untuk jorok. Hanya untuk menarik, mudah untuk diingat. Ia menilai kata tersebut merupakan istilah umum. "" Saya rasa kalau istilah umum montok itu orang yang gemuk dan lucu, atau istilah sekarang gemoy,"" bebernya. Saat itu tujuannya agar menarik dari sisi judul dan mudah diingat. Juga dapat dilihat kapan terjadi tren penurunan pasokan, juga harga pangan, dan dapat digunakan kira-kira kapan akan terjadi inflasi atau deflasi bahan pangan,"" lanjutnya. Hingga saat ini, Eko mengungkap tidak ada teguran atas penamaan aplikasi tersebut."
"Ada Proyek Galian, Lalin Mampang Arah Kuningan Macet Pagi Ini",detikNews,2024-07-10,Yulida Medistiara,https://news.detik.com/berita/d-7431594/ada-proyek-galian-lalin-mampang-arah-kuningan-macet-pagi-ini,"Terdapat proyek galian saluran air dan kabel di Jl HR Rasuna Said, Kuningan, Jakarta Selatan, pagi ini. Imbasnya, lalu lintas dari arah Jl Mampang Prapatan Raya ke arah Kuningan macet. ""Memang ada kemacetan karena ada galian kabel, termasuk saluran air setelah Kedubes Hungaria, itu ada alat beratnya, termasuk di Kedubes Singapura di belakang ada perbaikan saluran air, jadi ada penyempitan yang mau menuju Mega Kuningan,"" kata Kapolsek Setiabudi Kompol Firman, saat dihubungi, Rabu 10 Juli 2024. Ia mengatakan lalu lintas dari arah Warung Buncit atau Mampang mengalami kepadatan karena terdapat penyempitan jalan di Kuningan akibat proyek galian saluran air dan kabel optik. Selanjutnya, lalu lintas mulai lancar dari setelah menara Karya menuju Mega Kuningan.    ""Kemacetan itu karena ada perbaikan,"" ujarnya. Lebih lanjut, lalu lintas dari arah Semanggi menuju arah Kuningan juga dilaporkan mengalami kepadatan. Sementara dari arah sebaliknya lalu lintas Kuningan arah Mampang Prapatan dilaporkan lancar. Petugas telah berada di lokasi untuk melakukan pengaturan lalu lintas. Saat ini belum ada informasi pengalihan arus lalin.","Terdapat proyek galian saluran air dan kabel di Jl HR Rasuna Said, Kuningan, Jakarta Selatan, pagi ini. Imbasnya, lalu lintas dari arah Jl Mampang Prapatan Raya ke arah Kuningan macet. "" ""Kemacetan itu karena ada perbaikan,"" ujarnya. Petugas telah berada di lokasi untuk melakukan pengaturan lalu lintas. Saat ini belum ada informasi pengalihan arus lalin."
LPSK-KontraS Kritik Vonis Bebas Eks Bupati Langkat di Kasus Kerangkeng,detikNews,2024-07-10,Nizar Aldi,https://news.detik.com/berita/d-7431580/lpsk-kontras-kritik-vonis-bebas-eks-bupati-langkat-di-kasus-kerangkeng,"Majelis hakim Pengadilan Negeri (PN) Stabat memvonis bebas mantan Bupati Langkat Terbit Rencana Peranginan Angin dalam kasus tindak pidana perdagangan orang (TPPO) atau yang dikenal kasus kerangkeng manusia. Lembaga Perlindungan Saksi dan Korban (LPSK) hingga KontraS Sumut mengkritik putusan itu. ""LPSK menghormati proses hukum yang telah berjalan sejak tahapan penyidikan hingga proses persidangan,"" kata Ketua LPSK Brigjend (Purn) Achmadi dalam keterangannya, dilansir detikSumut, Selasa 9 Juli 2024. Vonis bebas tersebut dinilai belum memenuhi rasa keadilan bagi korban kerangkeng manusia. Padahal para korban sudah mengalami penderitaan fisik hingga psikis.    ""Putusan tersebut dirasakan belum memenuhi rasa keadilan bagi para korban TPPO yang telah mengalami penderitaan fisik, psikis, dan kerugian ekonomi,"" ucapnya. Maka, kata Achmadi, LPSK mendukung kejaksaan untuk melakukan kasasi atas putusan itu. Termasuk dengan permohonan restitusi korban. ""LPSK mendorong dan mendukung upaya hukum kasasi oleh Kejaksaan, termasuk substansi mengenai permohonan restitusi korban sebagai salah satu materi pokok dalam memori kasasinya,"" ujarnya. Selain LPSK, KontraS Sumut menilai putusan itu merupakan bentuk pengangkangan hukum terhadap keadilan korban dan mencederai nilai kemanusiaan. ""Kontras Sumut menilai bahwa putusan bebas terhadap TRP adalah bentuk pengangkangan hukum terhadap keadilan bagi korban dan mencederai nilai kemanusiaan. Putusan ini tentu akan menimbulkan kegundahan bagi publik pada instansi hukum yang amburadul,"" kata Tim Advokasi KontraS Sumut, Ady Yoga Kemit, Rabu 10 Juli. Berdasarkan catatan KontraS Sumut, kerangkeng manusia itu merupakan milik Terbit. Kerangkeng itu merupakan ruang perbudakan modern yang mengakibatkan penderitaan hingga kematian. ""Kerangkeng Langkat milik TRP tidak pernah memanusiakan manusia dan justru menjadi ruang perbudakan modern yang mengakibatkan penderitaan dan bahkan hilangnya nyawa,"" ucapnya. Putusan bebas hakim tersebut dinilai tidak dapat diterima karena Terbit dinilai merupakan pemilik kerangkeng. Vonis bebasnya Terbit berdampak terhadap tidak terpenuhinya pemulihan bagi korban. ""Aktor-aktor lapangan telah divonis hukuman, sedangkan aktor intelektual sekaligus pemilik kerangkeng Langkat divonis bebas. Sungguh mengerikan dan tidak dapat diterima akal sehat, bahwa putusan hakim membebaskan TRP dari segala tuntutan. Artinya bebasnya TRP akan berdampak pada tidak terpenuhinya pemulihan bagi korban,"" ujarnya. Jaksa penuntut umum sebelumnya menuntut mantan Bupati Langkat Terbit Rencana Perangin Angin dengan hukuman 14 tahun penjara. ""Tadi tuntutan 14 tahun penjara, pidana denda Rp 500 juta subsider 6 bulan penjara,"" kata Kasi Intel Kejari Langkat Sabri Fitriansyah Marbun kepada detikSumut, Rabu 5 Juni 2024. Terbit dijerat UU Nomor 21 Tahun 2007 tentang Pemberantasan TPPO. Terbit dijerat dengan Pasal 2 ayat 2 juncto Pasal 11. Selain tuntutan hukuman penjara, Terbit dibebani biaya restitusi untuk korban maupun ahli waris. Terbit dituntut untuk membayar retribusi sebesar Rp 2,3 miliar. Baca selengkapnya di sini, di sini dan di sini.  Tonton juga Video: Tok! Anak Bupati Langkat Divonis 19 Bulan Bui di Kasus Kerangkeng Manusia   ","Majelis hakim Pengadilan Negeri (PN) Stabat memvonis bebas mantan Bupati Langkat Terbit Rencana Peranginan Angin dalam kasus tindak pidana perdagangan orang (TPPO) atau yang dikenal kasus kerangkeng manusia. Padahal para korban sudah mengalami penderitaan fisik hingga psikis. Selain LPSK, KontraS Sumut menilai putusan itu merupakan bentuk pengangkangan hukum terhadap keadilan korban dan mencederai nilai kemanusiaan. "" Putusan ini tentu akan menimbulkan kegundahan bagi publik pada instansi hukum yang amburadul,"" kata Tim Advokasi KontraS Sumut, Ady Yoga Kemit, Rabu 10 Juli. Berdasarkan catatan KontraS Sumut, kerangkeng manusia itu merupakan milik Terbit. Kerangkeng itu merupakan ruang perbudakan modern yang mengakibatkan penderitaan hingga kematian. "" Putusan bebas hakim tersebut dinilai tidak dapat diterima karena Terbit dinilai merupakan pemilik kerangkeng. Aktor-aktor lapangan telah divonis hukuman, sedangkan aktor intelektual sekaligus pemilik kerangkeng Langkat divonis bebas. Artinya bebasnya TRP akan berdampak pada tidak terpenuhinya pemulihan bagi korban,"" ujarnya. Terbit dijerat UU Nomor 21 Tahun 2007 tentang Pemberantasan TPPO. Terbit dijerat dengan Pasal 2 ayat 2 juncto Pasal 11. Selain tuntutan hukuman penjara, Terbit dibebani biaya restitusi untuk korban maupun ahli waris. Baca selengkapnya di sini, di sini dan di sini. Anak Bupati Langkat Divonis 19 Bulan Bui di Kasus Kerangkeng Manusia"
Polisi Restorative Justice Kasus Jambret HP di Depok yang Dibogem Warga,detikNews,2024-07-10,Devi Puspitasari,https://news.detik.com/berita/d-7431553/polisi-restorative-justice-kasus-jambret-hp-di-depok-yang-dibogem-warga,"Aksi jambret mencuri ponsel (HP) milik bocah 14 tahun terjadi di Cimanggis, Depok, hingga menjadi bulan-bulanan warga. Kasus ini pun diselesaikan secara restorative justice (RJ). ""Iya (diselesaikan RJ),"" kata Kapolsek Cimanggis Kompol Judika Siregar saat dihubungi detikcom, Rabu 10 Juli 2024. Judika mengatakan alasan kasus tersebut diselesaikan RJ adalah kerugian korban di bawah Rp 2,5 juta. Polisi wajib melakukan mediasi.    ""Sesuai sama kerugian di bawah Rp 2,5 juta wajib dimediasikan. Ini harga HP-nya Rp 1 juta,"" jelasnya. Sebelumnya, aksi jambret mencuri ponsel (HP) milik bocah 14 tahun terjadi di Cimanggis, Depok. Jambret itu pun menjadi bulan-bulanan warga. Kapolsek Cimanggis Kompol Judika mengatakan peristiwa itu terjadi pada Selasa 9 Juli, pukul 15.00 WIB, di Jalan Bhakti Abri, Cimanggis, Depok. Awalnya, dua pelaku menggunakan sepeda motor menjambret HP milik korban. ""Saya menjelaskan, tadi sekitar jam 15 lewat ada kejadian yang menyebabkan seseorang kehilangan handphone diduga pelakunya 2 orang menggunakan sepeda motor,"" kata Judika kepada wartawan di Polsek Cimanggis, Depok, Selasa 9 Juli. Judika mengatakan pelaku kabur setelah diteriaki warga. Pelaku yang merupakan eksekutor melarikan diri, sedangkan pelaku yang membawa motor dikejar warga. ""Ternyata motor yang digunakan pelaku ini kehabisan bensin sehingga satu teman yang dibonceng yang berhasil mengambil handphone ini melarikan diri,"" jelasnya. Pelaku yang membawa motor itu pun ditangkap warga dan diserahkan ke Polsek Cimanggis. Barang bukti berupa sepeda motor milik pelaku disita polisi. ""Sampai saat ini kan karena pelaku jambret yang berhasil mengambil itu kan melarikan diri. Jadi, yang berhasil diamankan hanya sepeda motor sama jokinya,"" jelasnya. Saat ini kasus tersebut tengah diselidiki pihak kepolisian. Polisi pun tengah mengejar pelaku eksekutor yang kabur melarikan diri. Simak juga Video: Jambret Viral di CFD Pakai Duit Hasil Kejahatan untuk Beli Miras   ","Aksi jambret mencuri ponsel (HP) milik bocah 14 tahun terjadi di Cimanggis, Depok, hingga menjadi bulan-bulanan warga. Kasus ini pun diselesaikan secara restorative justice (RJ). "" Jambret itu pun menjadi bulan-bulanan warga. Saya menjelaskan, tadi sekitar jam 15 lewat ada kejadian yang menyebabkan seseorang kehilangan handphone diduga pelakunya 2 orang menggunakan sepeda motor,"" kata Judika kepada wartawan di Polsek Cimanggis, Depok, Selasa 9 Juli. Judika mengatakan pelaku kabur setelah diteriaki warga. Ternyata motor yang digunakan pelaku ini kehabisan bensin sehingga satu teman yang dibonceng yang berhasil mengambil handphone ini melarikan diri,"" jelasnya. Barang bukti berupa sepeda motor milik pelaku disita polisi. "" Saat ini kasus tersebut tengah diselidiki pihak kepolisian. Polisi pun tengah mengejar pelaku eksekutor yang kabur melarikan diri. Simak juga Video: Jambret Viral di CFD Pakai Duit Hasil Kejahatan untuk Beli Miras"
Jokowi Resmikan Pembukaan Rapat Kerja Nasional XVI Apkasi,detikNews,2024-07-10,Isal Mawardi,https://news.detik.com/berita/d-7431543/jokowi-resmikan-pembukaan-rapat-kerja-nasional-xvi-apkasi,"Presiden Joko Widodo (Jokowi) membuka peresmian pembukaan rapat kerja nasional XVI Asosiasi Pemerintah Kabupaten Seluruh Indonesia (Apkasi) Tahun 2024. Acara digelar di ruang Cendrawasih, Jakarta Convention Center (JCC). Pantauan detikcom, Rabu 10 Juli 2024, Jokowi tiba pukul 09.13. Begitu Jokowi datang, seluruh hadirin berdiri. Jokowi langsung duduk di bangku terdepan. Tampak sejumlah pejabat menemani Jokowi. Antara lain Menteri Dalam Negeri Tito Karnavian dan Ketum Apkasi Sutan Riska Tuanku Kerajaan.    Acara dimulai dengan mengumandangkan lagu kebangsaan Indonesia Raya. Lalu disusul lagu mars Apkasi. ""Dengan mengucap bismillah pada pagi hari ini secara resmi saya buka rapat kerja nasional XVI Asosiasi Pemerintah Kabupaten Seluruh Indonesia (Apkasi) Tahun 2024,"" kata Jokowi. Di hadapan para bupati, Jokowi mewanti-wanti untuk menggunakan produk dalam negeri. ""Perlu saya ingatkan beli produk-produk kita sendiri, mengumpulkan anggaran itu agak sulit sekali, jadi gunakan seratus persen untuk pengadaan barang dan jasa produk dalam negeri,"" lanjutnya.","Presiden Joko Widodo (Jokowi) membuka peresmian pembukaan rapat kerja nasional XVI Asosiasi Pemerintah Kabupaten Seluruh Indonesia (Apkasi) Tahun 2024. Begitu Jokowi datang, seluruh hadirin berdiri. Antara lain Menteri Dalam Negeri Tito Karnavian dan Ketum Apkasi Sutan Riska Tuanku Kerajaan. Acara dimulai dengan mengumandangkan lagu kebangsaan Indonesia Raya. Di hadapan para bupati, Jokowi mewanti-wanti untuk menggunakan produk dalam negeri. """
"Gunung Ibu di Malut 2 Kali Erupsi Pagi Ini, Keluarkan Abu Setinggi 500 Meter",detikNews,2024-07-10,Antara News,https://news.detik.com/berita/d-7431398/gunung-ibu-di-malut-2-kali-erupsi-pagi-ini-keluarkan-abu-setinggi-500-meter,"Gunung Ibu di Halmahera, Maluku Utara, erupsi pagi ini. Terlihat abu setinggi 500 meter keluar dua kali ke udara dari puncak kawah gunung api. Dilansir Antara, Rabu 10 Juli 2024, Kepala Pusat Vulkanologi dan Mitigasi Bencana Geologi (PVMBG) Hendra Gunawan mengatakan embusan erupsi pertama terekam di seismogram dengan amplitudo maksimum 5 mm yang berlangsung 1 menit 17 detik. Erupsi selanjutnya terekam dengan amplitudo maksimum 7 mm yang berlangsung 1 menit 49 detik. Fenomena letusan berlangsung sejak pukul 07.55 WIT dan 08.43 WIT. Petugas posko pemantau Gunung Ibu di Desa Tokuoko mengamati tinggi kolom abu berwarna kelabu hingga hitam dengan intensitas sedang hingga tebal ke arah timur laut, timur, dan tenggara. Sampai saat ini, aktivitas vulkanik Gunung Ibu masih berada pada status level III atau siaga.    PVMBG mengimbau masyarakat di sekitar Gunung Ibu ataupun wisatawan agar tidak beraktivitas di dalam radius 4 kilometer dan perluasan sektoral berjarak 5 kilometer ke arah bukaan kawah di bagian utara dari kawah aktif Gunung Ibu. Begitupun jika terjadi hujan abu, masyarakat diharapkan selalu memakai masker atau penutup hidung-mulut untuk menghindari bahaya gangguan sistem pernafasan. Gunung Ibu merupakan gunung api yang memiliki ketinggian puncak 1.340 meter di atas permukaan laut. Secara administratif, gunung tersebut masuk wilayah Kecamatan Ibu, Kabupaten Halmahera Barat, Provinsi Maluku Utara. Desa Sangaji Nyeku, Desa Goin, Tokuoko, dan Duono, di Kecamatan Tabaru, Halmahera Barat, merupakan sejumlah pemukiman penduduk yang dekat dari arah bukaan kawah Gunung Ibu. Masyarakat desa tersebut sempat dievakuasi pada Mei 2024. Namun beberapa hari lalu mereka sudah diantarkan pulang kembali dari pengungsian oleh pemerintah daerah setempat.","Gunung Ibu di Halmahera, Maluku Utara, erupsi pagi ini. Erupsi selanjutnya terekam dengan amplitudo maksimum 7 mm yang berlangsung 1 menit 49 detik. PVMBG mengimbau masyarakat di sekitar Gunung Ibu ataupun wisatawan agar tidak beraktivitas di dalam radius 4 kilometer dan perluasan sektoral berjarak 5 kilometer ke arah bukaan kawah di bagian utara dari kawah aktif Gunung Ibu. Begitupun jika terjadi hujan abu, masyarakat diharapkan selalu memakai masker atau penutup hidung-mulut untuk menghindari bahaya gangguan sistem pernafasan. Gunung Ibu merupakan gunung api yang memiliki ketinggian puncak 1.340 meter di atas permukaan laut. Secara administratif, gunung tersebut masuk wilayah Kecamatan Ibu, Kabupaten Halmahera Barat, Provinsi Maluku Utara. Namun beberapa hari lalu mereka sudah diantarkan pulang kembali dari pengungsian oleh pemerintah daerah setempat."
"Kasus Penipuan Pinjol, Sosialita Supercars Club di Bali Dituntut 1,5 Tahun Bui",detikNews,2024-07-10,Aryo Mahendro,https://news.detik.com/berita/d-7431388/kasus-penipuan-pinjol-sosialita-supercars-club-di-bali-dituntut-1-5-tahun-bui,"Sosialita komunitas pemilik mobil sport Supercars Club, Jois Apriliyah, dituntut hukuman penjara selama 1,5 tahun. Jois diyakini jaksa terbukti melakukan penipuan investasi pinjaman online (pinjol). ""Menyatakan Terdakwa Jois Apriliyah terbukti bersalah. Meminta hakim menjatuhkan pidana terhadap Terdakwa dengan pidana 1 tahun 6 bulan,"" kata jaksa penuntut umum (JPU) Eddy Arta Wijaya, dilansir detikBali, Rabu 10 Juli 2024. Jois diyakini bersalah melanggar Pasal 378 KUHP juncto Pasal 65 ayat 1 KUHP. Dalam dakwaan, Jois juga dijerat dengan Pasal 372 KUHP dan Pasal 45A UU Nomor 19 Tahun 2016.    ""Hal yang memberatkan bahwa tindakan Terdakwa merugikan orang lain,"" kata JPU Eddy. Jaksa mengatakan Jois melakukan aksi jahatnya sejak 14 April 2023. Dia menipu enam temannya sendiri dengan kedok dana pinjaman (dapin). Korban merugi hingga Rp 270 juta lebih. Modusnya, Jois bercerita kepada korban bahwa dia tahu ada orang atau instansi yang membutuhkan dana. Dia menawari korban untuk meminjamkan uangnya dengan bunga 10 persen. Simak lengkapnya di sini.","Sosialita komunitas pemilik mobil sport Supercars Club, Jois Apriliyah, dituntut hukuman penjara selama 1,5 tahun. Jois diyakini jaksa terbukti melakukan penipuan investasi pinjaman online (pinjol). "" Meminta hakim menjatuhkan pidana terhadap Terdakwa dengan pidana 1 tahun 6 bulan,"" kata jaksa penuntut umum (JPU) Eddy Arta Wijaya, dilansir detikBali, Rabu 10 Juli 2024. Jaksa mengatakan Jois melakukan aksi jahatnya sejak 14 April 2023. Modusnya, Jois bercerita kepada korban bahwa dia tahu ada orang atau instansi yang membutuhkan dana. Dia menawari korban untuk meminjamkan uangnya dengan bunga 10 persen."
