title,category,publish_date,author,article_url,content,summary
Soetikno Soedarjo Minta Divonis Bebas di Kasus Pengadaan Pesawat Garuda,detikNews,2024-07-10,Mulia Budi,https://news.detik.com/berita/d-7431812/soetikno-soedarjo-minta-divonis-bebas-di-kasus-pengadaan-pesawat-garuda,"Pengusaha Soetikno Soedarjo minta divonis bebas dalam kasus dugaan korupsi pengadaan sub 100 seater pesawat CRJ-1000 dan ATR 72-600 di PT Garuda Indonesia (PT GA). Soetikno mengaku harus berbohong kepada empat cucunya bahwa ia tengah menjalani kuliah. Soetikno mengatakan telah menerima dan menjalani hukuman penjara 6 tahun yang dijatuhkan padanya pada perkara korupsi pengadaan pesawat dan mesin pesawat di PT Garuda Indonesia yang sebelumnya diusut KPK. Ia mengaku telah banyak kehilangan kesempatan yang berharga bersama keluarga, khususnya dalam melihat pertumbuhan empat cucunya sejak 7 tahun yang lalu. ""Bahkan saya harus berbohong kepada cucu-cucu saya, Yang Mulia, bahwa kakeknya sedang kuliah dan masuk asrama. Mereka kadang bertanya, 'Kok Opa sekolah tidak selesai-selesai terus dan lama sekali sekolahnya'. Ini membuat saya sangat terpukul, sedih, dan terenyuh mendengar pertanyaan seperti itu dari cucu-cucu saya,"" kata Soetikno Soedarjo saat membacakan pleidoi atau nota pembelaan di PN Tipikor Jakarta, Rabu 10 Juli 2024.    Soetikno berharap tak kembali dihukum. Dia mengaku jera dan sudah berjanji tak mengulangi perbuatannya. ""Cucu-cucu saya telah menjadi korban dari kesalahan saya terdahulu. Saya sangat menyesal atas kesalahan yang telah saya perbuat tersebut sehingga saya berharap tidak dimasukkan lagi dalam pusaran peristiwa yang sama yang hukumannya telah saya jalani,"" ujarnya. ""Karena kesalahan saya yang terdahulu tersebut, saya telah menyakiti dan membuat menderita istri saya, anak-anak saya, menantu saya, keluarga besar saya dan cucu-cucu saya, dan orang-orang yang justru mencintai dan menyayangi saya. Atas penderitaan yang timbul akibat dari perbuatan saya tersebut, saya sudah memohon maaf kepada mereka. Saya jera dan sudah berjanji tidak akan mengulangi lagi penderitaan mereka,"" ujarnya. Dia mengatakan perkara ini sama dengan perkara pengadaan pesawat yang telah ditangani KPK pada 2020. Dia mengatakan sudah menjalani hukuman yang dijatuhkan di kasus tersebut. ""Yang Mulia Majelis Hakim, saya memohon perlindungan dari Majelis Hakim Yang Mulia, karena saya merasa semua rangkaian peristiwa dan perbuatan saya yang diperiksa dalam persidangan perkara ini adalah sama dengan rangkaian peristiwa dan perbuatan-perbuatan saya yang telah diperiksa di KPK terdahulu pada tahun 2020 dan 2021,"" ungkap Soetikno. ""Besar harapan saya dengan kebijaksanaan Yang Mulia Majelis Hakim, dapat melihat bahwa putusan inkrah yang saya terima dan sudah saya jalani hingga selesai agar menjadi pertimbangan Majelis Hakim Yang Mulia untuk membebaskan saya,"" tuturnya. Soetikno juga menyinggung penurunan kondisi kesehatannya dan telah memasuki umur 70 tahun. Dia berharap majelis hakim akan memutus bebas dirinya dalam kasus tersebut. ""Bahwa usia saya yang lanjut di mana hampir memasuki umur 70 tahun ini, membuat kondisi kesehatan saya menurun dan membutuhkan perawatan intensif yang sulit didapatkan di dalam penjara,"" katanya. ""Dengan segala kerendahan hati, saya memohon belas kasihan dan menyerahkan nasib saya kepada Yang Mulia Majelis Hakim sebagai wakil Tuhan di dunia ini agar mempertimbangkan keadaan saya sekarang ini dalam memutus perkara ini, yaitu dengan membebaskan saya dari segala tuntutan jaksa,"" ucapnya. Lebih lanjut, Soetikno mengaku ingin menjalani masa tua bersama anggota keluarganya. Dia memohon belas kasihan majelis hakim agar memberikan putusan bebas untuknya. ""Saya memohon kepada Majelis Hakim Yang Mulia, sekiranya Majelis Hakim mau memberikan belas kasihan dan membuka jendela keadilan bagi saya dan keluarga, agar membuat keputusan yang seadil-adilnya berdasarkan Ketuhanan Yang Maha Esa dan sesuai dengan fakta persidangan yang ada, dan dapat membebaskan saya dari segala tuduhan dan tuntutan dalam perkara ini, sehingga saya dapat segera bebas kembali kepada keluarga saya dalam waktu yang tidak terlalu lama lagi,"" kata Soetikno. Ia kembali meminta kepada hakim memberikan putusan bebas terhadapnya. ""Bagi saya, Majelis Hakim Yang Mulia adalah tempat terakhir di dunia ini untuk saya mencari dan mendapatkan keadilan. Sekali lagi, Majelis Hakim Yang Mulia, saya memohon dengan sangat agar saya bisa diputus bebas dari perkara ini dan saya bisa mengisi waktu di masa tua saya bersama keluarga, sebelum nanti tiba saatnya saya harus kembali kepada Tuhan Yang Maha Esa,"" tambahnya. Sebelumnya, pengusaha Soetikno Soedarjo dituntut hukuman 6 tahun penjara. Jaksa meyakini Soetikno Soedarjo melakukan tindak pidana korupsi terkait pengadaan sub 100 seater pesawat CRJ-1000 dan ATR 72-600 di PT Garuda Indonesia (PT GA). ""Menyatakan Terdakwa Soetikno Soedarjo telah terbukti secara sah dan meyakinkan bersalah melakukan tindak pidana korupsi sebagaimana diatur dan diancam pidana dalam dakwaan primer melanggar Pasal 2 ayat (1) juncto Pasal 18 Undang-Undang Nomor 31 Tahun 1999 tentang Pemberantasan Tindak Pidana Korupsi sebagaimana telah diubah dengan Undang-Undang RI Nomor 20 Tahun 2001 tentang Perubahan atas Undang-Undang RI Nomor 31 Tahun 1999 tentang Pemberantasan Tindak Pidana Korupsi juncto Pasal 55 ayat (1) ke-1 KUHP,"" kata jaksa di Pengadilan Tipikor Jakarta Pusat, Kamis 27 Juni. ""Menjatuhkan pidana terhadap terdakwa Soetikno Soedarjo berupa pidana penjara selama 6 tahun dikurangi selama terdakwa berada dalam tahanan dengan perintah agar terdakwa tetap ditahan di rutan,"" sambung jaksa. Jaksa menuntut Soetikno membayar denda Rp 1 miliar. Apabila denda tak dibayar, diganti dengan pidana kurungan selama 6 bulan penjara. Jaksa juga menuntut Soetikno membayar uang pengganti. Hal memberatkan adalah perbuatan Soetikno bersama mantan Dirut Garuda Indonesia Emirsyah Satar merugikan negara USD 609 juta. Hal meringankan tuntutan adalah Soetikno menyesali perbuatannya dan merupakan tulang punggung keluarga.","Pengusaha Soetikno Soedarjo minta divonis bebas dalam kasus dugaan korupsi pengadaan sub 100 seater pesawat CRJ-1000 dan ATR 72-600 di PT Garuda Indonesia (PT GA). Soetikno mengaku harus berbohong kepada empat cucunya bahwa ia tengah menjalani kuliah. Soetikno mengatakan telah menerima dan menjalani hukuman penjara 6 tahun yang dijatuhkan padanya pada perkara korupsi pengadaan pesawat dan mesin pesawat di PT Garuda Indonesia yang sebelumnya diusut KPK. Ia mengaku telah banyak kehilangan kesempatan yang berharga bersama keluarga, khususnya dalam melihat pertumbuhan empat cucunya sejak 7 tahun yang lalu. "" Mereka kadang bertanya, 'Kok Opa sekolah tidak selesai-selesai terus dan lama sekali sekolahnya'. Ini membuat saya sangat terpukul, sedih, dan terenyuh mendengar pertanyaan seperti itu dari cucu-cucu saya,"" kata Soetikno Soedarjo saat membacakan pleidoi atau nota pembelaan di PN Tipikor Jakarta, Rabu 10 Juli 2024. Dia mengaku jera dan sudah berjanji tak mengulangi perbuatannya. "" Cucu-cucu saya telah menjadi korban dari kesalahan saya terdahulu. Saya sangat menyesal atas kesalahan yang telah saya perbuat tersebut sehingga saya berharap tidak dimasukkan lagi dalam pusaran peristiwa yang sama yang hukumannya telah saya jalani,"" ujarnya. "" Karena kesalahan saya yang terdahulu tersebut, saya telah menyakiti dan membuat menderita istri saya, anak-anak saya, menantu saya, keluarga besar saya dan cucu-cucu saya, dan orang-orang yang justru mencintai dan menyayangi saya. Dia mengatakan sudah menjalani hukuman yang dijatuhkan di kasus tersebut. "" Soetikno juga menyinggung penurunan kondisi kesehatannya dan telah memasuki umur 70 tahun. Lebih lanjut, Soetikno mengaku ingin menjalani masa tua bersama anggota keluarganya. Dia memohon belas kasihan majelis hakim agar memberikan putusan bebas untuknya. "" Saya memohon kepada Majelis Hakim Yang Mulia, sekiranya Majelis Hakim mau memberikan belas kasihan dan membuka jendela keadilan bagi saya dan keluarga, agar membuat keputusan yang seadil-adilnya berdasarkan Ketuhanan Yang Maha Esa dan sesuai dengan fakta persidangan yang ada, dan dapat membebaskan saya dari segala tuduhan dan tuntutan dalam perkara ini, sehingga saya dapat segera bebas kembali kepada keluarga saya dalam waktu yang tidak terlalu lama lagi,"" kata Soetikno. Sebelumnya, pengusaha Soetikno Soedarjo dituntut hukuman 6 tahun penjara. Jaksa menuntut Soetikno membayar denda Rp 1 miliar. Apabila denda tak dibayar, diganti dengan pidana kurungan selama 6 bulan penjara."
TNI AU: IKN Akan Dijaga Radar Bikinan Eropa dan Senjata Pertahanan Udara,detikNews,2024-07-10,Maulana Ilhami Fawdi,https://news.detik.com/berita/d-7431772/tni-au-ikn-akan-dijaga-radar-bikinan-eropa-dan-senjata-pertahanan-udara,"TNI AU mengungkap rencana penguatan pertahanan udara di Ibu Kota Nusantara (IKN). Wakil Kepala Staf Angkatan Udara (Wakasau) Marsdya Andyawan Martono mengatakan radar Thales bikinan Prancis akan ditempatkan di sekitar IKN. Selain itu, ruang udara IKN akan diperkuat dengan senjata pertahanan udara atau air defense weapon hingga penugasan pesawat TNI AU. Andyawan mengatakan hal ini sudah sesuai dengan perspektif pertahanan udara TNI AU. ""Penempatannya sudah kita rapatkan, tentunya nanti tidak di IKN-nya, tapi sekitar IKN, sehingga nanti bisa mem-back up wilayah udara di sekitar IKN,"" kata Marsdya Andyawan di di Griya Ardhya Garini, Halim Perdanakusuma, Jakarta Timur, Rabu 10 Juli 2024.    ""Kita juga sudah punya perspektif pertahanan udara di sekitar IKN, tidak hanya radar, tetapi itu ada penugasan pesawat di sana, air defense weapon ada di sana,"" katanya. Andyawan mengatakan TNI AU juga mulai kedatangan radar-radar canggih dengan teknologi terbaru. Radar itu nantinya ditempatkan di wilayah strategis di Indonesia serta menggantikan radar milik TNI AU yang sudah lama. ""Cukup banyak nanti, Sorong ada, Jayapura juga ada Tambolaka ada, daerah Sumatera ada, lengkap semuanya dan ada beberapa yang nanti menggantikan radar-radar kita yang lama. Radar kita yang lama kan teknologinya dari '70-'80-an kita ganti,"" jelasnya. Terkait proses pemasangan radar, Andyawan mengatakan akan berjalan bertahap. Adapun jenis radar berasal dari Prancis dan juga dari negara Eropa Timur. ""Kita sudah berkontrak dari tahun kemarin ini proses pengadaan kira kira 18 bulan setelah kontrak setelah itu baru datang satu per satu. Kita ada dua pengadaan, dari dua bagian tadi disebutkan Thales, satu lagi dari Eropa Timur sehingga nanti kita bagi semua terkelompok,"" katanya.  ","TNI AU mengungkap rencana penguatan pertahanan udara di Ibu Kota Nusantara (IKN). Selain itu, ruang udara IKN akan diperkuat dengan senjata pertahanan udara atau air defense weapon hingga penugasan pesawat TNI AU. Penempatannya sudah kita rapatkan, tentunya nanti tidak di IKN-nya, tapi sekitar IKN, sehingga nanti bisa mem-back up wilayah udara di sekitar IKN,"" kata Marsdya Andyawan di di Griya Ardhya Garini, Halim Perdanakusuma, Jakarta Timur, Rabu 10 Juli 2024. Terkait proses pemasangan radar, Andyawan mengatakan akan berjalan bertahap. Adapun jenis radar berasal dari Prancis dan juga dari negara Eropa Timur. "" Kita sudah berkontrak dari tahun kemarin ini proses pengadaan kira kira 18 bulan setelah kontrak setelah itu baru datang satu per satu. Kita ada dua pengadaan, dari dua bagian tadi disebutkan Thales, satu lagi dari Eropa Timur sehingga nanti kita bagi semua terkelompok,"" katanya."
Ayah Kadivhubinter Polri Dimakamkan di Al-Azhar Memorial Karawang,detikNews,2024-07-10,Rumondang Naibaho,https://news.detik.com/berita/d-7431743/ayah-kadivhubinter-polri-dimakamkan-di-al-azhar-memorial-karawang,"Kabar duka datang dari keluarga Kadivhubinter Polri Irjen Krishna Murti. Ayahandanya, Brigjen TNI (Purn) Bom Soerjanto, meninggal dunia. Jenazah akan dimakamkan di Al-Azhar Memorial, Karawang, hari ini. Ucapan dukacita turut disampaikan Karo Penmas Divisi Humas Polri Brigjen Trunoyudo Wisnu Andiko. Trunoyudo menyebut Bom Soerjanto meninggal pada Rabu 10 Juli dini hari, pukul 01.35 WIB. ""Innalillahi wa innailaihi rojiuun telah berpulang ke Rahmatullah suami, ayahanda, kakek tercinta kami, Bapak Bom Soerjanto, Rabu 10 Juli pukul 01.35 WIB, mohon dimaafkan apabila ada kesalahan yang disengaja maupun tidak disengaja, semoga Allah SWT mengampuni dosa dosa beliau dan menempatkan ditempat terbaik di sisi-Nya,"" kata Trunoyudo kepada detikcom, Rabu 10 Juli 2024.    ""Almarhum disemayamkan di Pesona Khayangan Blok BQ No 5 Depok dan rencana di makanan di Al-Azhar Memorial, Karawang, bakda Zuhur,"" tambah dia. Sebagai informasi, Bom Soerjanto merupakan Duta Besar Indonesia untuk Papua Nugini periode Oktober 2006, tepatnya pada pemerintahan Presiden ke-6 Susilo Bambang Yudhoyono (SBY). Dia juga merupakan ayahanda dari Pangdam III Siliwangi Mayjen TNI Mohammad Fadjar.","Kabar duka datang dari keluarga Kadivhubinter Polri Irjen Krishna Murti. Jenazah akan dimakamkan di Al-Azhar Memorial, Karawang, hari ini. Innalillahi wa innailaihi rojiuun telah berpulang ke Rahmatullah suami, ayahanda, kakek tercinta kami, Bapak Bom Soerjanto, Rabu 10 Juli pukul 01.35 WIB, mohon dimaafkan apabila ada kesalahan yang disengaja maupun tidak disengaja, semoga Allah SWT mengampuni dosa dosa beliau dan menempatkan ditempat terbaik di sisi-Nya,"" kata Trunoyudo kepada detikcom, Rabu 10 Juli 2024. Sebagai informasi, Bom Soerjanto merupakan Duta Besar Indonesia untuk Papua Nugini periode Oktober 2006, tepatnya pada pemerintahan Presiden ke-6 Susilo Bambang Yudhoyono (SBY). Dia juga merupakan ayahanda dari Pangdam III Siliwangi Mayjen TNI Mohammad Fadjar."
Jejak Perkara Eks Bupati Langkat Divonis Bebas di Kasus Kerangkeng Manusia,detikNews,2024-07-10,Rakhmad Hidayatulloh Permana,https://news.detik.com/berita/d-7431730/jejak-perkara-eks-bupati-langkat-divonis-bebas-di-kasus-kerangkeng-manusia,"Mantan Bupati Langkat Terbit Rencana Perangin Angin divonis bebas dalam kasus tindak pidana perdagangan orang (TPPO) atau yang dikenal kasus kerangkeng manusia. Kasus ini mencuat berawal dari operasi tangkap tangan (OTT) oleh KPK. Dirangkum detikcom, Rabu 10 Juli 2024, awalnya Terbit ditetapkan sebagai tersangka oleh KPK setelah terjaring dalam OTT pada Januari 2022. Ia terjaring OTT karena menerima suap pemberian paket pekerjaan di Dinas Pekerjaan Umum dan Penataan Ruang (PUPR) Kabupaten Langkat dan Dinas Pendidikan Kabupaten Langkat tahun 2021 sebesar Rp 572 juta.    ""Setelah pengumpulan berbagai informasi disertai pengambilan keterangan terkait dugaan tindak korupsi dimaksud, KPK kemudian melakukan penyelidikan dan ditemukan adanya bukti permulaan bukti yang cukup. Maka KPK meningkatkan status perkara ke tahap penyidikan,"" kata Wakil Ketua KPK Nurul Ghufron pada 20 Januari 2022.   Selain Terbit Rencana, KPK menetapkan sejumlah tersangka lain. Termasuk Terbit, totalnya ada enam tersangka. Sepekan penetapan tersangka Terbit Rencana di KPK, publik digegerkan oleh temuan kerangkeng manusia di rumah pribadi mantan Bupati Langkat itu. Polisi sempat menyebut kerangkeng manusia itu sebagai tempat rehabilitasi narkoba. Namun, setelah dilakukan penyelidikan lanjutan, ada temuan kerangkeng manusia milik Terbit Rencana tersebut ilegal dan tak memenuhi syarat rehabilitasi. Polisi akhirnya membongkar ada temuan korban tewas setelah empat hari masuk kerangkeng Bupati Langkat. Kabid Humas Polda Sumut Kombes Hadi Wahyudi mengatakan korban tersebut berinisial S, warga Kecamatan Sei Bingai, Kabupaten Langkat. Pihaknya membongkar kuburan S. Kemudian polisi juga membongkar kuburan korban lainnya berinisial A, warga Sawit Seberang.  Terbit Rencana akhirnya diperiksa intensif terkait kerangkeng manusia miliknya. Polisi kemudian menetapkan delapan tersangka kasus kerangkeng manusia pada 21 Maret 2022. Selain Terbit, ada delapan orang dalam kasus tindak pidana perdagangan orang (TPPO) ini. Kedelapan orang itu adalah HS, IS, TS, RG, JS, DP, HG, dan SP. Adapun penetapan tersangka ini setelah dilakukan pemeriksaan terhadap Terbit Rencana dan mengacu temuan Komnas HAM. Terbit dipersangkakan melanggar Pasal 2, Pasal 7, Pasal 10, UU Nomor 21 Tahun 2007 tentang Pemberantasan Tindak Pidana Perdagangan Orang dan/atau Pasal 333 KUHP, Pasal 351, Pasal 352, dan Pasal 353 penganiayaan mengakibatkan korban meninggal dunia, serta Pasal 170 KUHP. Selain itu, Terbit terjerat kasus kepemilikan satwa langka. Terbit menyandang gelar tersangka di kasus ini setelah BKSDA menemukan tujuh satwa langka di rumahnya. Kasus kerangkeng manusia ini kemudian bergulir di meja sidang. Terbit divonis bebas. Hakim pada Pengadilan Negeri (PN) Stabat menyatakan dakwaan kasus tindak pidana perdagangan orang (TPPO) dengan terdakwa Terbit Rencana Perangin Angin tidak terbukti. ""Mengadili satu, menyatakan Terdakwa Terbit Rencana Perangin Angin alias Pak Terbit alias Cana tersebut di atas tidak terbukti secara sah dan meyakinkan sebagaimana yang dikeluarkan dalam dakwaan satu pertama dan kedua, kedua pertama, kedua, ketiga, keempat, kelima, dan keenam,"" kata ketua majelis hakim Andriansyah saat membacakan putusan, dilansir detikSumut, Senin 8 Juli 2024. Selain itu, hakim meminta agar hak serta harkat martabat Terbit terkait perkara itu dipulihkan. ""Dua bebaskan Terdakwa dari semua dakwaan penuntut umum, ketiga memulihkan hak-hak Terdakwa dalam kemampuan, serta harkat martabatnya,"" ucapnya. Ardiansyah kemudian membacakan putusan bahwa permohonan restitusi tidak dapat diterima. Besaran restitusi adalah Rp 2,3 miliar untuk 14 korban dan ahli waris. Sementara itu, untuk kasus korupsinya, majelis PN Jakpus yang diketuai Djuyamto menjatuhkan hukuman 9 tahun penjara untuk Terbit dan kakak Terbit, Iskandar Perangin Angin, dihukum 7,5 tahun penjara. Terbit kemudian mengajukan banding bersama kakaknya, Iskandar Perangin Angin. Hasilnya, banding itu dikabulkan. Pengadilan Tinggi (PT) Jakarta menjatuhkan pidana kepada Terbit Rencana Perangin Angin dengan penjara selama 7 tahun dan 6 bulan serta denda Rp 300 juta subsider 5 bulan. Hakim banding juga menjatuhkan pidana kepada Iskandar Perangin Angin dengan penjara selama 6 tahun serta denda Rp 300 juta subsider 5 bulan Terbit sempat mengajukan kasasi, namun Mahkamah Agung (MA) menolak kasasi jaksa dan Terbit Rencana Perangin Angin dalam perkara korupsi. Alhasil, Terbit tetap dihukum 7,5 tahun penjara di kasus korupsi pengadaan barang di Kabupaten Langkat.","Mantan Bupati Langkat Terbit Rencana Perangin Angin divonis bebas dalam kasus tindak pidana perdagangan orang (TPPO) atau yang dikenal kasus kerangkeng manusia. Kasus ini mencuat berawal dari operasi tangkap tangan (OTT) oleh KPK. ""Setelah pengumpulan berbagai informasi disertai pengambilan keterangan terkait dugaan tindak korupsi dimaksud, KPK kemudian melakukan penyelidikan dan ditemukan adanya bukti permulaan bukti yang cukup. Selain Terbit Rencana, KPK menetapkan sejumlah tersangka lain. Sepekan penetapan tersangka Terbit Rencana di KPK, publik digegerkan oleh temuan kerangkeng manusia di rumah pribadi mantan Bupati Langkat itu. Polisi sempat menyebut kerangkeng manusia itu sebagai tempat rehabilitasi narkoba. Kabid Humas Polda Sumut Kombes Hadi Wahyudi mengatakan korban tersebut berinisial S, warga Kecamatan Sei Bingai, Kabupaten Langkat. Selain Terbit, ada delapan orang dalam kasus tindak pidana perdagangan orang (TPPO) ini. Kedelapan orang itu adalah HS, IS, TS, RG, JS, DP, HG, dan SP. Adapun penetapan tersangka ini setelah dilakukan pemeriksaan terhadap Terbit Rencana dan mengacu temuan Komnas HAM. Selain itu, Terbit terjerat kasus kepemilikan satwa langka. Kasus kerangkeng manusia ini kemudian bergulir di meja sidang. Mengadili satu, menyatakan Terdakwa Terbit Rencana Perangin Angin alias Pak Terbit alias Cana tersebut di atas tidak terbukti secara sah dan meyakinkan sebagaimana yang dikeluarkan dalam dakwaan satu pertama dan kedua, kedua pertama, kedua, ketiga, keempat, kelima, dan keenam,"" kata ketua majelis hakim Andriansyah saat membacakan putusan, dilansir detikSumut, Senin 8 Juli 2024. Selain itu, hakim meminta agar hak serta harkat martabat Terbit terkait perkara itu dipulihkan. "" Ardiansyah kemudian membacakan putusan bahwa permohonan restitusi tidak dapat diterima. Terbit kemudian mengajukan banding bersama kakaknya, Iskandar Perangin Angin. Hakim banding juga menjatuhkan pidana kepada Iskandar Perangin Angin dengan penjara selama 6 tahun serta denda Rp 300 juta subsider 5 bulan Terbit sempat mengajukan kasasi, namun Mahkamah Agung (MA) menolak kasasi jaksa dan Terbit Rencana Perangin Angin dalam perkara korupsi."
"Terjebak di Longsor, Suleman Bertahan Hidup 8 Jam dengan Setengah Botol Air",detikNews,2024-07-10,Apris Nawu,https://news.detik.com/berita/d-7431657/terjebak-di-longsor-suleman-bertahan-hidup-8-jam-dengan-setengah-botol-air,"Nofrianto Suleman (27) bisa dievakuasi dengan selamat dari longsor tambang emas ilegal di Kabupaten Bone Bolango, Gorontalo. Nofrianto bertahan dengan mengandalkan setengah botol air minum. ""Kami terjebak selama 8 jam di dalam lubang tambang. Alhamdulillah, kami selamat dari musibah,"" ujar Nofrianto Suleman kepada wartawan, dilansir detikSulsel, Selasa 10 Juli 2024. Longsor itu terjadi di Desa Tulabolo, Kecamatan Suwawa Timur, Bone Bolango, pada Sabtu 6 Juli sekitar 23.00 Wita. Awalnya Nofrianto dan rekannya yang juga ditemukan selamat bernama Zulpan Badjalawo (27) mendengar suara tanah bergeser.    ""Kalau tidak salah, Pak, kejadian longsor itu jam 23.00 Wita. Kami itu malam ingin keluar dari lubang tambang di malam hari, tiba-tiba terdengar ada batu tanah bergeser turun ke bawah lubang dan langsung menutup jalan keluar,"" terangnya. Nofrianto mengaku berusaha menenangkan diri saat terjebak di dalam lubang yang tertutup longsor. Namun saat itu tubuhnya sudah merasa lemas. ""Masih bisa bernapas, meskipun oksigen hanya sedikit. Tenaga kami itu sudah lemah,"" kata Nofrianto. Selama 8 jam di dalam lubang, Nofrianto hanya memiliki sedikit air untuk bertahan hidup. Beruntung, tim SAR gabungan berhasil menemukannya. ""Kami hanya punya setengah air botol, ini air cuma sedikit,"" sebut Nofrianto. Diketahui, 122 orang diduga tertimbun longsor tambang emas ilegal di Bone Bolango. Hingga 9 Juli 2024 malam, Badan Nasional Pencarian dan Pertolongan (Basarnas) RI melaporkan korban yang ditemukan meninggal bertambah menjadi 23 orang. ""Total tentunya sampai saat ini terevakuasi sebanyak 23 orang korban meninggal (dunia), sementara kita masih mencari sekitar 39 (orang),"" kata Kusworo kepada wartawan, Selasa 9 Juli. Baca selengkapnya di sini.  Simak Video 'Korban Meninggal Akibat Longsor Tambang Ilegal di Gorontalo Jadi 23 Orang':   ","Nofrianto Suleman (27) bisa dievakuasi dengan selamat dari longsor tambang emas ilegal di Kabupaten Bone Bolango, Gorontalo. Nofrianto bertahan dengan mengandalkan setengah botol air minum. "" Kami terjebak selama 8 jam di dalam lubang tambang. Nofrianto mengaku berusaha menenangkan diri saat terjebak di dalam lubang yang tertutup longsor. Namun saat itu tubuhnya sudah merasa lemas. "" Masih bisa bernapas, meskipun oksigen hanya sedikit. Tenaga kami itu sudah lemah,"" kata Nofrianto. Selama 8 jam di dalam lubang, Nofrianto hanya memiliki sedikit air untuk bertahan hidup. Beruntung, tim SAR gabungan berhasil menemukannya. "" Total tentunya sampai saat ini terevakuasi sebanyak 23 orang korban meninggal (dunia), sementara kita masih mencari sekitar 39 (orang),"" kata Kusworo kepada wartawan, Selasa 9 Juli."
