title,category,publish_date,author,article_url,content,summary
Hakim: SYL Tak Mungkin Tidak Tahu Keluarganya Terima Fasilitas dari Kementan,detikNews,2024-07-11,Mulia Budi,https://news.detik.com/berita/d-7434084/hakim-syl-tak-mungkin-tidak-tahu-keluarganya-terima-fasilitas-dari-kementan,"Majelis hakim Tipikor Jakarta menyatakan mantan Menteri Pertanian Syahrul Yasin Limpo (SYL) terbukti bersalah telah melakukan pemerasan terhadap anak buahnya di Kementerian Pertanian (Kementan). Hakim menyatakan SYL tak mungkin tidak mengetahui keluarganya menerima fasilitas pembayaran dari Kementan. ""Menimbang bahwa selanjutnya terhadap pembelaan terdakwa SYL yang pada pokoknya menyatakan, 'insan Kementan yang melakukan pendekatan, salah satunya dengan melayani keluarga terdakwa seolah-olah memang bagian dari fasilitas seorang Menteri beserta keluarganya dengan harapan jabatannya aman bahkan naik',"" kata hakim ad hoc Tipikor Jakarta, Ida Ayu Mustikawati dalam persidangan di PN Tipikor Jakarta, Kamis 11 Juli 2024. ""Majelis berpendapat bahwa berdasarkan fakta persidangan terdakwa adalah seorang birokrat senior yang berpengalaman karirnya dimulai dari menjadi lurah, camat, sekwilda, bupati 2 periode, wakil gubernur, gubernur 2 periode sebelumnya di wilayah Sulawesi Selatan, dan puncaknya diangkat dan dilantik menjadi Menteri Pertanian RI periode 2019 sampai 2023, dengan pengalaman terdakwa sebagai seorang birokrat tidak mungkin tidak mengetahui dan melakukan pembiaran terhadap pemberian fasilitas dan keluarga yang diberikan oleh insan Kementan,"" imbuh hakim.    Hakim berpendapat SYL mengetahui fasilitas kedinasan dan di luar kedinasan untuk seorang menteri. Dia mengatakan SYL juga dekat dengan anggota keluarganya. ""Karena sejatinya terdakwa mengetahui apa yang semestinya merupakan fasilitas kedinasan atau bukan bagi dirinya sebagai seorang menteri atau di luar kedinasan, apalagi untuk kepentingan keluarga. Jika dilihat dari latar belakang dan riwayat kehidupan keluarga yang mengakui apalagi mengingat kedekatan terdakwa dengan anggota keluarganya,"" imbuhnya. Sebelumnya, Syahrul Yasin Limpo divonis hukuman penjara. Hakim menyatakan SYL terbukti bersalah telah melakukan pemerasan terhadap anak buahnya di Kementerian Pertanian (Kementan). ""Menjatuhkan pidana terhadap terdakwa Syahrul Yasin Limpo berupa pidana penjara selama 10 tahun,"" kata Ketua Majelis Hakim Rianto Adam Pontoh saat membacakan putusan di Pengadilan Tipikor Jakarta Pusat, Jalan Bungur Besar Raya, Jakarta Pusat, Kamis 11 Juli 2024. SYL dinyatakan bersalah melanggar Pasal 12 e juncto Pasal 18 Undang-Undang Pemberantasan Tindak Pidana Korupsi juncto Pasal 55 ayat 1 ke-1 KUHP juncto Pasal 64 ayat 1 KUHP. Hakim menyatakan SYL telah menyalahgunakan kekuasaannya dengan memaksa pemberian uang dan membayarkan keperluannya bersama keluarganya. Total uang yang dinikmati SYL dan keluarganya itu senilai Rp 14,1 miliar dan USD 30 ribu. Hakim pun menghukum SYL membayar denda Rp 300 juta. Apabila denda tak dibayar, maka diganti hukuman kurungan. Hakim juga menghukum SYL membayar uang pengganti sejumlah uang yang diterimanya, yakni Rp 14.147.144.786 (Rp 14,1 miliar) dan USD 30 ribu. Jika harta benda SYL tak mencukupi untuk membayar uang pengganti itu, maka diganti dengan kurungan. Hakim menyatakan tidak ada hal yang dapat menghapus pidana pada diri SYL. Hakim juga menilai SYL seharusnya memahami mana fasilitas resmi dan tidak resmi bagi seorang menteri. Hakim juga menilai berbagai dalih SYL dan tim pengacaranya terkait pemberian mobil untuk anak SYL, perekrutan cucu SYL sebagai honorer Kementan, hingga pembayaran biaya umroh bertentangan dengan fakta dalam persidangan. Hakim menyatakan tidak sependapat dengan pleidoi SYL dan tim pengacaranya. Hal memberatkan SYL ialah berbelit-belit dalam memberikan keterangan, tak memberikan teladan baik sebagai pejabat publik, tidak mendukung pemberantasan korupsi, serta menikmati hasil korupsi. Hal meringankan ialah telah berusia lanjut, berkontribusi positif saat krisis pangan di era pandemi COVID-19 serta banyak mendapat penghargaan dari pemerintah.  Simak Video 'Tok! SYL Divonis 10 Tahun Bui dan Denda Rp 300 Juta':   ","Majelis hakim Tipikor Jakarta menyatakan mantan Menteri Pertanian Syahrul Yasin Limpo (SYL) terbukti bersalah telah melakukan pemerasan terhadap anak buahnya di Kementerian Pertanian (Kementan). Hakim menyatakan SYL tak mungkin tidak mengetahui keluarganya menerima fasilitas pembayaran dari Kementan. "" Hakim berpendapat SYL mengetahui fasilitas kedinasan dan di luar kedinasan untuk seorang menteri. Jika dilihat dari latar belakang dan riwayat kehidupan keluarga yang mengakui apalagi mengingat kedekatan terdakwa dengan anggota keluarganya,"" imbuhnya. Menjatuhkan pidana terhadap terdakwa Syahrul Yasin Limpo berupa pidana penjara selama 10 tahun,"" kata Ketua Majelis Hakim Rianto Adam Pontoh saat membacakan putusan di Pengadilan Tipikor Jakarta Pusat, Jalan Bungur Besar Raya, Jakarta Pusat, Kamis 11 Juli 2024. SYL dinyatakan bersalah melanggar Pasal 12 e juncto Pasal 18 Undang-Undang Pemberantasan Tindak Pidana Korupsi juncto Pasal 55 ayat 1 ke-1 KUHP juncto Pasal 64 ayat 1 KUHP. Apabila denda tak dibayar, maka diganti hukuman kurungan. Hakim juga menghukum SYL membayar uang pengganti sejumlah uang yang diterimanya, yakni Rp 14.147.144.786 (Rp 14,1 miliar) dan USD 30 ribu. Hakim menyatakan tidak ada hal yang dapat menghapus pidana pada diri SYL. Hakim juga menilai SYL seharusnya memahami mana fasilitas resmi dan tidak resmi bagi seorang menteri. Hakim juga menilai berbagai dalih SYL dan tim pengacaranya terkait pemberian mobil untuk anak SYL, perekrutan cucu SYL sebagai honorer Kementan, hingga pembayaran biaya umroh bertentangan dengan fakta dalam persidangan. Hal meringankan ialah telah berusia lanjut, berkontribusi positif saat krisis pangan di era pandemi COVID-19 serta banyak mendapat penghargaan dari pemerintah. SYL Divonis 10 Tahun Bui dan Denda Rp 300 Juta':"
25 Twibbon Hari Anak Nasional 2024 Gratis untuk Dibagikan ke Medsos!,detikNews,2024-07-11,Widhia Arum Wibawana,https://news.detik.com/berita/d-7434080/25-twibbon-hari-anak-nasional-2024-gratis-untuk-dibagikan-ke-medsos,"Hari Anak Nasional (HAN) di Indonesia akan diperingati pada tanggal 23 Juli 2024. Tahun ini merupakan peringatan Hari Anak Nasional yang ke-40 sejak ditetapkannya Keputusan Presiden (Keppres) Nomor 44 Tahun 1984. Tahun ini, peringatan Hari Anak Nasional ke-40 tahun 2024 mengusung tema ""Anak Terlindungi, Indonesia Maju"" dengan enam subtema yang disesuaikan dengan isu-isu anak terkini dan relevan. Sebagaimana dilansir Kementerian Pemberdayaan Perempuan dan Perlindungan Anak (KemenPPPA). Untuk turut menyemarakkan peringatan Hari Anak Nasional ke-40, kamu bisa gunakan twibbon untuk dibagikan ke media sosial saat perayaannya pada tanggal 23 Juli 2024 nantinya.    Bagi kamu yang sedang mencari twibbon lucu dan menarik bertemakan Hari Anak Nasional, detikcom telah menyediakan beberapa rekomendasi twibbon unik dan terbaru. Cek daftar link download twibbonnya di bawah ini: Jika twibbon pilihanmu sudah diunduh, selanjutnya tinggal memasukkan foto yang kamu inginkan ke dalam twibbon tersebut. Berikut langkah-langkahnya: Kamu juga bisa bagikan twibbon Hari Anak Nasional untuk 23 Juli 2024 pilihanmu di media sosial bersama berbagai macam kata-kata dengan ucapan 'Selamat memperingati Hari Anak Nasional ke-40 Tahun 2024!'. ","Hari Anak Nasional (HAN) di Indonesia akan diperingati pada tanggal 23 Juli 2024. Tahun ini merupakan peringatan Hari Anak Nasional yang ke-40 sejak ditetapkannya Keputusan Presiden (Keppres) Nomor 44 Tahun 1984. Cek daftar link download twibbonnya di bawah ini: Jika twibbon pilihanmu sudah diunduh, selanjutnya tinggal memasukkan foto yang kamu inginkan ke dalam twibbon tersebut. Berikut langkah-langkahnya: Kamu juga bisa bagikan twibbon Hari Anak Nasional untuk 23 Juli 2024 pilihanmu di media sosial bersama berbagai macam kata-kata dengan ucapan 'Selamat memperingati Hari Anak Nasional ke-40 Tahun 2024!'."
"AHY Terima Kunjungan Duta Besar Singapura, Ini yang Dibahas",detikNews,2024-07-11,Amatullah Lutfiyah,https://news.detik.com/berita/d-7434078/ahy-terima-kunjungan-duta-besar-singapura-ini-yang-dibahas,"Menteri Agraria dan Tata Ruang/Kepala Badan Pertanahan Nasional (ATR/BPN), Agus Harimurti Yudhoyono (AHY) melakukan pertemuan dengan Duta Besar Singapura untuk Indonesia, Kwok Fook Seng. Dalam pertemuan itu AHY banyak berdiskusi soal berbagai hal, termasuk membahas berbagai potensi peluang kerja sama antara Indonesia dan Singapura. Salah satunya terkait 3D land mapping. Indonesia dan Singapura, menurut AHY, adalah teman lama dan keduanya merupakan salah satu motor penggerak ASEAN. Untuk itu, bagi AHY, menjadi vital bagi kedua negara dalam mempererat dan memperkuat hubungan bilateral ke depan. Di penghujung pertemuan, keduanya berharap hubungan yang terjalin baik ini bisa terus berlanjut, membawa kerja sama yang produktif, dan meningkatkan kesejahteraan bagi kedua negara.    ""Besar harapan Indonesia dan Singapura bisa terus mempererat berbagai kerjasama strategis yang saling menguntungkan,"" ujar AHY dalam keterangannya, dikutip Rabu 10 Juli 2024. Adapun pada pertemuan ini, AHY didampingi oleh Staf Khusus Bidang Manajemen Internal, Agust Jovan Latuconsina dan Tenaga Ahli Bidang Manajemen Internal, Mira Permatasari.","Menteri Agraria dan Tata Ruang/Kepala Badan Pertanahan Nasional (ATR/BPN), Agus Harimurti Yudhoyono (AHY) melakukan pertemuan dengan Duta Besar Singapura untuk Indonesia, Kwok Fook Seng. Indonesia dan Singapura, menurut AHY, adalah teman lama dan keduanya merupakan salah satu motor penggerak ASEAN. ""Besar harapan Indonesia dan Singapura bisa terus mempererat berbagai kerjasama strategis yang saling menguntungkan,"" ujar AHY dalam keterangannya, dikutip Rabu 10 Juli 2024. Adapun pada pertemuan ini, AHY didampingi oleh Staf Khusus Bidang Manajemen Internal, Agust Jovan Latuconsina dan Tenaga Ahli Bidang Manajemen Internal, Mira Permatasari."
"Hari Anak Nasional 2024: Sejarah, Tema, dan Logo Peringatan",detikNews,2024-07-11,Kanya Anindita Mutiarasari,https://news.detik.com/berita/d-7434075/hari-anak-nasional-2024-sejarah-tema-dan-logo-peringatan,"Hari Anak Nasional adalah peringatan tahunan di bawah Kementerian Pemberdayaan Perempuan dan Perlindungan Anak Republik Indonesia (KemenPPPA RI). Peringatan Hari Anak Nasional jatuh pada tanggal 23 Juli setiap tahunnya. Tahun ini merupakan peringatan ke-40 Hari Anak Nasional (HAN). Berikut serba-serbi Hari Anak Nasional ke-40 Tahun 2024. Menurut Buku Panduan Pelaksanaan HAN ke-40 Tahun 2024, sejak disahkannya Undang-Undang tentang Kesejahteraan Anak, pemerintah terus berupaya meningkatkan kesejahteraan anak. Untuk mengoptimalkannya, pemerintah mendorong semua pihak dengan menyelenggarakan Peringatan Hari Anak Nasional.    Berdasarkan hal tersebut, kemudian ditetapkan Keputusan Presiden (Keppres) No. 44/1984 yang menetapkan bahwa Hari Anak Nasional diperingati setiap tanggal 23 Juli, yaitu tanggal pengesahan Undang-Undang tentang Kesejahteraan Anak pada 23 Juli 1979. Memperhatikan Pasal 73A Undang-Undang Nomor 35 Tahun 2014 tentang Perubahan Atas Undang-Undangan Nomor 23 Tahun 2002 tentang Perlindungan Anak, bahwa dalam rangka efektivitas penyelenggaraan Perlindungan Anak, Kementerian PPPA perlu melakukan koordinasi lintas sektoral dengan kementerian/lembaga dan pemangku kepentingan lainnya, diantaranya dalam pelaksanaan peringatan Hari Anak Nasional (HAN). HAN dirayakan sebagai momentum penting untuk mengkampanyekan pemenuhan hak anak atas hak hidup, tumbuh, berkembang, dan berpartisipasi secara wajar sesuai dengan harkat dan martabat kemanusiaan, serta mendapat perlindungan dari kekerasan dan diskriminasi Pada tahun 1984, Presiden Soeharto menggagas Hari Anak Nasional untuk ditetapkan sebagai salah satu hari penting nasional. Soeharto menilai anak-anak adalah aset kemajuan bangsa sehingga perlu diberi peringatan. Sejak saat itu, perayaan anak-anak terus digelar untuk mewujudkan Indonesia sebagai negara yang ramah anak.  Peringatan Hari Anak Nasional ke-40 Tahun 2024 mengusung tema ""Anak Terlindungi, Indonesia Maju"". HAN ke-40 Tahun 2204 memiliki enam sub-tema, yaitu: Berikut ini adalah makna logo peringatan Hari Anak Nasional ke-40 Tahun 2024.  ","Hari Anak Nasional adalah peringatan tahunan di bawah Kementerian Pemberdayaan Perempuan dan Perlindungan Anak Republik Indonesia (KemenPPPA RI). Peringatan Hari Anak Nasional jatuh pada tanggal 23 Juli setiap tahunnya. Tahun ini merupakan peringatan ke-40 Hari Anak Nasional (HAN). Berikut serba-serbi Hari Anak Nasional ke-40 Tahun 2024. Menurut Buku Panduan Pelaksanaan HAN ke-40 Tahun 2024, sejak disahkannya Undang-Undang tentang Kesejahteraan Anak, pemerintah terus berupaya meningkatkan kesejahteraan anak. Untuk mengoptimalkannya, pemerintah mendorong semua pihak dengan menyelenggarakan Peringatan Hari Anak Nasional. Soeharto menilai anak-anak adalah aset kemajuan bangsa sehingga perlu diberi peringatan."
Jaksa KPK Pikir-pikir Banding Vonis 10 Tahun Penjara SYL,detikNews,2024-07-11,Mulia Budi,https://news.detik.com/berita/d-7434071/jaksa-kpk-pikir-pikir-banding-vonis-10-tahun-penjara-syl,"Mantan Menteri Pertanian (Mentan) Syahrul Yasin Limpo (SYL) divonis hukuman 10 tahun penjara terkait kasus pemerasan anak buah. Jaksa KPK menyatakan pikir-pikir untuk melakukan upaya hukum banding atas vonis tersebut. ""Selanjutnya setelah kami berdiskusi, kami pun mengambil sikap untuk berpikir-pikir dalam rangka mempelajari putusan yang telah dijatuhi Yang Mulia untuk kemudian kami mengambil langkah atau sikap selanjutnya,"" ujar jaksa KPK, Meyer Simanjuntak dalam persidangan di PN Tipikor Jakarta, Kamis 11 Juli 2024. Tak hanya jaksa, pihak SYL juga menyatakan pikir-pikir atas vonis terhadap kliennya itu. Nantinya, pihak SYL akan segera menentukan sikap akan melakukan upaya hukum banding atau tidak.    ""Kami dari penasihat hukum Pak SYL tadi telah berembuk bersama, berdiskusi, dan akhirnya ada pada satu kesimpulan bahwa untuk saat ini kami diberi kesempatan untuk pikir-pikir terlebih dahulu, baru kemudian kami akan menentukan sikap,"" kata kuasa hukum SYL, Djamaludin Koedoeboen. Terdakwa Sekjen Kementan nonaktif Kasdi Subagyono serta mantan Direktur Kementan Muhammad Hatta divonis 4 tahun penjara dan denda Rp 200 juta. Kasdi dan Hatta juga menyatakan pikir-pikir atas vonis tersebut. SYL divonis hukuman penjara. Hakim menyatakan SYL terbukti bersalah telah melakukan pemerasan terhadap anak buahnya di Kementerian Pertanian (Kementan). ""Menjatuhkan pidana terhadap terdakwa Syahrul Yasin Limpo berupa pidana penjara selama 10 tahun,"" kata Ketua Majelis Hakim Rianto Adam Pontoh saat membacakan putusan di Pengadilan Tipikor Jakarta Pusat, Jalan Bungur Besar Raya, Jakarta Pusat, Kamis 11 Juli. SYL dinyatakan bersalah melanggar Pasal 12 e juncto Pasal 18 Undang-Undang Pemberantasan Tindak Pidana Korupsi juncto Pasal 55 ayat 1 ke-1 KUHP juncto Pasal 64 ayat 1 KUHP. Hakim menyatakan SYL telah menyalahgunakan kekuasaannya dengan memaksa pemberian uang dan membayarkan keperluannya bersama keluarganya. Total uang yang dinikmati SYL dan keluarganya itu senilai Rp 14,1 miliar dan USD 30 ribu. Hakim pun menghukum SYL membayar denda Rp 300 juta. Apabila denda tak dibayar, maka diganti hukuman kurungan. Hakim juga menghukum SYL membayar uang pengganti sejumlah uang yang diterimanya, yakni Rp 14.147.144.786 (Rp 14,1 miliar) dan USD 30 ribu. Jika harta benda SYL tak mencukupi untuk membayar uang pengganti itu, maka diganti dengan kurungan. Hakim menyatakan tidak ada hal yang dapat menghapus pidana pada diri SYL. Hakim juga menilai SYL harusnya memahami mana fasilitas resmi dan tidak resmi bagi seorang menteri. Hakim juga menilai berbagai dalih SYL dan tim pengacaranya terkait pemberian mobil untuk anak SYL, perekrutan cucu SYL sebagai honorer Kementan, hingga pembayaran biaya umroh bertentangan dengan fakta dalam persidangan. Hakim menyatakan tidak sependapat dengan pleidoi SYL dan tim pengacaranya. Hal memberatkan SYL ialah berbelit-belit dalam memberikan keterangan, tak memberikan teladan baik sebagai pejabat publik, tidak mendukung pemberantasan korupsi, serta menikmati hasil korupsi. Hal meringankan ialah telah berusia lanjut, berkontribusi positif saat krisis pangan di era pandemi COVID-19 serta banyak mendapat penghargaan dari pemerintah.  Simak Video 'Tok! SYL Divonis 10 Tahun Bui dan Denda Rp 300 Juta':   ","Mantan Menteri Pertanian (Mentan) Syahrul Yasin Limpo (SYL) divonis hukuman 10 tahun penjara terkait kasus pemerasan anak buah. Selanjutnya setelah kami berdiskusi, kami pun mengambil sikap untuk berpikir-pikir dalam rangka mempelajari putusan yang telah dijatuhi Yang Mulia untuk kemudian kami mengambil langkah atau sikap selanjutnya,"" ujar jaksa KPK, Meyer Simanjuntak dalam persidangan di PN Tipikor Jakarta, Kamis 11 Juli 2024. Tak hanya jaksa, pihak SYL juga menyatakan pikir-pikir atas vonis terhadap kliennya itu. Menjatuhkan pidana terhadap terdakwa Syahrul Yasin Limpo berupa pidana penjara selama 10 tahun,"" kata Ketua Majelis Hakim Rianto Adam Pontoh saat membacakan putusan di Pengadilan Tipikor Jakarta Pusat, Jalan Bungur Besar Raya, Jakarta Pusat, Kamis 11 Juli. Hakim menyatakan SYL telah menyalahgunakan kekuasaannya dengan memaksa pemberian uang dan membayarkan keperluannya bersama keluarganya. Total uang yang dinikmati SYL dan keluarganya itu senilai Rp 14,1 miliar dan USD 30 ribu. Hakim pun menghukum SYL membayar denda Rp 300 juta. Apabila denda tak dibayar, maka diganti hukuman kurungan. Hakim menyatakan tidak ada hal yang dapat menghapus pidana pada diri SYL. Hakim juga menilai SYL harusnya memahami mana fasilitas resmi dan tidak resmi bagi seorang menteri. Hakim juga menilai berbagai dalih SYL dan tim pengacaranya terkait pemberian mobil untuk anak SYL, perekrutan cucu SYL sebagai honorer Kementan, hingga pembayaran biaya umroh bertentangan dengan fakta dalam persidangan. Hal meringankan ialah telah berusia lanjut, berkontribusi positif saat krisis pangan di era pandemi COVID-19 serta banyak mendapat penghargaan dari pemerintah."
