title,category,publish_date,author,article_url,content,summary
Balita Dianiaya Pemilik Daycare Alami Skoliosis dan Bercak di Paru-paru,detikNews,2024-08-20,Devi Puspitasari,https://news.detik.com/berita/d-7499775/balita-dianiaya-pemilik-daycare-alami-skoliosis-dan-bercak-di-paru-paru,"Pihak bayi dan balita korban penganiayaan tersangka pemilik daycare Wensen School, Meita Irianty (37) alias Tata Irianty, mengungkapkan kondisi terkini korban. Korban, MK (2), mengalami radang paru-paru dan skoliosis. ""Jadi, berdasarkan hasil rontgen itu, kami sudah mendapatkan informasi bahwa anak korban, khususnya yang berusia 2 tahun, mengalami pneumonia dan skoliosis. Jadi ada tulang belakang di punggungnya ini luka melekung, dan pneumonia itu ada radang paru-paru di anak korban ini,"" kata kuasa hukum saksi dan korban, Irfan Maulana, kepada wartawan di Kejari Depok, Selasa 20 Agustus 2024. Pada kesempatan yang sama, ibu MK, Kidu, menjelaskan hasil rontgen anaknya menunjukkan bahwa MK memiliki bercak di paru-paru. Dia mengatakan korban mengalami batuk-batuk yang tak sembuh.    ""Jadi kemarin itu dokter menjelaskan bahwa hasil rontgennya itu anak saya di paru-parunya ada bercak-bercak, seperti pneumonia. Nah tapi karena memang 2 bulan berturut-turut batuk nggak sembuh-sembuh, akhirnya dokter menyarankan tes TBC, gitu kan,"" kata dia. Dia mengatakan hasil pemeriksaan tes TBC terhadap anaknya akan keluar pada Kamis 22 Agustus. Dia mengatakan dokter sempat menanyakan kondisi daycare Wensen School. ""Sekarang ini masih proses observasi, nanti hari Kamis bisa diketahui bahwa hasilnya positif atau nggak. Memang dokter juga menanyakan kondisi di daycare itu seperti apa apakah ruangannya tertutup, ada ventilasi apa gimana,"" jelasnya. Kidu mengatakan guru-guru mengakui AC di daycare tersebut jarang dicuci dan ruangan tidak memiliki ventilasi. ""Dan memang saksi-saksi juga menyatakan, guru-guru juga menyatakan di daycare itu AC-nya jarang dicuci dan tidak ada ventilasi. Pokoknya sirkulasi udara di sana buruk, jendela nggak pernah dibuka,"" ucapnya. Dia mengatakan kondisi daycare membuat anaknya dan anak lainnya batuk-batuk yang tak sembuh. Hasil rontgen korban juga menunjukkan korban mengalami skoliosis ringan. ""Makanya anak saya dan anak lain sering batuk-batuk. Bahkan saya 2 bulan tuh nggak sembuh-sembuh. Nah, hasil rontgen itu ada skoliosis ringan di badan anak saya. Saya masih nanya sih ke dokter apakah ini karena benturan atau karena apa,"" tuturnya. ""Dokter bilang ada kemungkinan karena benturan, tapi ini harus dikonsultasikan lebih lanjut ke dokter ortopedi. Jadi kami pun belum mendapatkan hasil jelasnya skoliosisnya itu karena apa, kita masih tahap observasi saja sih,"" tutupnya. Serahkan Bukti Baru Sebelumnya, pihak bayi dan balita korban penganiayaan tersangka pemilik daycare Wensen School, Meita Irianty (37) alias Tata Irianty, mendatangi Kejaksaan Negeri (Kejari) Depok. Pihak korban menyerahkan bukti baru. Kuasa hukum saksi dan korban, Irfan Maulana, mengatakan pihaknya sudah melakukan monitoring atas proses penanganan perkara. Pengacara ingin memastikan apakah berkas tahap I di Kejari sudah dilakukan penelitian oleh tim kejaksaan. ""Agenda hari ini kami sudah melakukan monitoring atas proses penanganan perkara di tingkat kejaksaan. Karena sebagaimana kami informasikan yang lalu, berkas sudah dilimpahkan tahap I ke kejaksaan. Untuk itu, kedatangan kami ke sini untuk memastikan apakah berkas itu sudah dilakukan penelitian oleh tim kejaksaan atau tidak,"" kata Irfan kepada wartawan di Kejari Depok, Selasa 20 Agustus. Dia mengatakan pihaknya menyerahkan bukti baru. Bukti awal hanya ditemukan luka dan memar di tubuh korban. Namun korban mengalami batuk-batuk, hingga dilakukan pemeriksaan kembali untuk luka dalam. ""Dan yang kedua, kami ada menambahkan bukti tambahan terhadap anak korban ini. Karena dari bukti awal itu hanya didapat bukti-bukti, luka-luka memar dan dikarenakan anak korban ini mengalami batuk-batuk di akhir itu kami memutuskan orang tua untuk melakukan rontgen untuk pemeriksaan luka dalam,"" jelasnya.","Pihak bayi dan balita korban penganiayaan tersangka pemilik daycare Wensen School, Meita Irianty (37) alias Tata Irianty, mengungkapkan kondisi terkini korban. Dia mengatakan korban mengalami batuk-batuk yang tak sembuh. Dia mengatakan hasil pemeriksaan tes TBC terhadap anaknya akan keluar pada Kamis 22 Agustus. Memang dokter juga menanyakan kondisi di daycare itu seperti apa apakah ruangannya tertutup, ada ventilasi apa gimana,"" jelasnya. Kidu mengatakan guru-guru mengakui AC di daycare tersebut jarang dicuci dan ruangan tidak memiliki ventilasi. "" Pokoknya sirkulasi udara di sana buruk, jendela nggak pernah dibuka,"" ucapnya. Hasil rontgen korban juga menunjukkan korban mengalami skoliosis ringan. "" Bahkan saya 2 bulan tuh nggak sembuh-sembuh. Nah, hasil rontgen itu ada skoliosis ringan di badan anak saya. Jadi kami pun belum mendapatkan hasil jelasnya skoliosisnya itu karena apa, kita masih tahap observasi saja sih,"" tutupnya. Serahkan Bukti Baru Sebelumnya, pihak bayi dan balita korban penganiayaan tersangka pemilik daycare Wensen School, Meita Irianty (37) alias Tata Irianty, mendatangi Kejaksaan Negeri (Kejari) Depok. Kuasa hukum saksi dan korban, Irfan Maulana, mengatakan pihaknya sudah melakukan monitoring atas proses penanganan perkara. Untuk itu, kedatangan kami ke sini untuk memastikan apakah berkas itu sudah dilakukan penelitian oleh tim kejaksaan atau tidak,"" kata Irfan kepada wartawan di Kejari Depok, Selasa 20 Agustus. Dia mengatakan pihaknya menyerahkan bukti baru. Bukti awal hanya ditemukan luka dan memar di tubuh korban. Namun korban mengalami batuk-batuk, hingga dilakukan pemeriksaan kembali untuk luka dalam. "" Dan yang kedua, kami ada menambahkan bukti tambahan terhadap anak korban ini."
Pelindo Terminal Petikemas Tanam 632 Bibit Terumbu Karang di Pulau Pahawang,detikNews,2024-08-20,Fitrya Anugrah Kusumah,https://news.detik.com/berita/d-7499674/pelindo-terminal-petikemas-tanam-632-bibit-terumbu-karang-di-pulau-pahawang,"PT Pelindo Terminal Petikemas (SPTP) bersama PT IPC Terminal Petikemas (IPC TPK) merayakan HUT ke-79 Kemerdekaan RI dengan penanaman 632 bibit terumbu karang. Kegiatan ini dilakukan di Pulau Pahawang, Kabupaten Pesawaran, Provinsi Lampung. Penanaman 632 bibit terumbu karang dilakukan di area yang rusak akibat aktivitas yang berlebihan oleh manusia di sekitar habitat terumbu karang. Konservasi terumbu karang yang dilakukan oleh SPTP dan IPC TPK menjadi wujud nyata dari tanggung jawab sosial dan lingkungan (TJSL) Pelindo Group sebagai bentuk kepedulian lingkungan di sekitar perusahaan. Corporate Secretary PT Pelindo Terminal Petikemas Widyaswendra mengatakan konservasi terumbu karang di Lampung dilakukan untuk mengurangi dampak aktivitas hilir mudik kapal di pelabuhan.     Ia menjelaskan alasannya memilih Provinsi Lampung sebagai penanaman terumbu karang tersebut lantaran adanya area kerja perusahaannya yakni IPC Terminal Petikemas Area Panjang. ""Kami menanam sebanyak 632 bibit terumbu karang dikemas dalam 79 rak ditanam di area seluas 158 M2, jumlah rak kami sesuaikan dengan perayaan HUT ke-79 Kemerdekaan RI,"" ujar Widyaswendra dalam keterangan tertulis pada Selasa 20 Agustus 2024. Dalam pelaksanaannya, SPTP bekerjasama dengan komunitas pecinta alam Lampung Underwater Community (LUC) dan Kelompok Sadar Wisata (Pokdarwis) Pulau Pahawang. Kegiatan konservasi ini sekaligus menjadi penanaman terumbu karang terbanyak di Pulau Pahawang.  Pulau Pahawang merupakan salah satu destinasi wisata di Provinsi Lampung dengan luas wilayah sebesar 1.020 hektar yang dihuni oleh 1.837 jiwa dan 447 kepala keluarga. Sebagian besar warganya menggantungkan pendapatan dari sektor pariwisata. Sederet potensi bahari Pulau Pahawang menjadi daya tarik bagi wisatawan untuk kegiatan snorkeling dan diving. Lebih lanjut, Widyaswendra menjelaskan sebelumnya SPTP juga telah melakukan konservasi terumbu karang pada tahun 2023 lalu. Ia mengaku telah melakukan konservasi 1.400 bibit terumbu karang di Taman Nasional Kepulauan Seribu. ""Konservasi terumbu karang bukan pertama kali dilakukan oleh SPTP, pada tahun 2023 lalu kami melakukan konservasi 1.400 bibit terumbu karang yang ditanam dengan metode rocklife di perairan Pulau Pramuka, Taman Nasional Kepulauan Seribu,"" jelasnya. Bibit terumbu karang yang telah melalui proses uji coba yang paling sesuai dengan kondisi laut di Pulau Pahawang kemudian akan ditanam menggunakan rangka pipa atau paralon. Rencananya akan dilakukan kegiatan pemeliharaan rutin dalam 1 hingga 2 bulan setelah penanaman.  Hal ini menunjukkan Pelindo Lestari Konservasi Terumbu Karang sejalan dengan Tujuan Pembangunan Berkelanjutan (SDGs) nomor 14.5.1 tentang Jumlah luas kawasan konservasi perairan laut. Ketua Lampung Underwater Community Kusbiyanti menjelaskan terdapat empat jenis terumbu karang yang ditanam di area Pulau Pahawang, yakni Acropora Cervicornis, Acropora Carduus, Acropora Formosa dan Psammocora (jahe hijau).  Pihaknya memberikan apresiasi kepada SPTP atas komitmen dalam mendorong pelestarian laut. Program konservasi terumbu karang di Pulau Pahawang adalah program konservasi terumbu karang ke-8 kolaborasi Pelindo Group dan LUC sejak tahun 2017. Lebih lanjut, Kepala Desa Pulau Pahawang Salim berharap konservasi yang dilakukan dapat memberikan manfaat untuk lingkungan dan masyarakat Pulau Pahawang. Menurutnya, terumbu karang menjadi daya tarik bagi wisatawan yang diharapkan mampu memberikan dampak ekonomi bagi warga setempat. ""Wisatawan datang ke daerah kami karena daya tarik keindahan alam bawah laut, sehingga terumbu karang menjadi hal penting bagi kelangsungan pariwisata yang perlu kita jaga bersama,"" tutupnya. ","PT Pelindo Terminal Petikemas (SPTP) bersama PT IPC Terminal Petikemas (IPC TPK) merayakan HUT ke-79 Kemerdekaan RI dengan penanaman 632 bibit terumbu karang. Kegiatan ini dilakukan di Pulau Pahawang, Kabupaten Pesawaran, Provinsi Lampung. Corporate Secretary PT Pelindo Terminal Petikemas Widyaswendra mengatakan konservasi terumbu karang di Lampung dilakukan untuk mengurangi dampak aktivitas hilir mudik kapal di pelabuhan. Dalam pelaksanaannya, SPTP bekerjasama dengan komunitas pecinta alam Lampung Underwater Community (LUC) dan Kelompok Sadar Wisata (Pokdarwis) Pulau Pahawang. Sebagian besar warganya menggantungkan pendapatan dari sektor pariwisata. Sederet potensi bahari Pulau Pahawang menjadi daya tarik bagi wisatawan untuk kegiatan snorkeling dan diving. Konservasi terumbu karang bukan pertama kali dilakukan oleh SPTP, pada tahun 2023 lalu kami melakukan konservasi 1.400 bibit terumbu karang yang ditanam dengan metode rocklife di perairan Pulau Pramuka, Taman Nasional Kepulauan Seribu,"" jelasnya. Bibit terumbu karang yang telah melalui proses uji coba yang paling sesuai dengan kondisi laut di Pulau Pahawang kemudian akan ditanam menggunakan rangka pipa atau paralon. Rencananya akan dilakukan kegiatan pemeliharaan rutin dalam 1 hingga 2 bulan setelah penanaman. Pihaknya memberikan apresiasi kepada SPTP atas komitmen dalam mendorong pelestarian laut. Lebih lanjut, Kepala Desa Pulau Pahawang Salim berharap konservasi yang dilakukan dapat memberikan manfaat untuk lingkungan dan masyarakat Pulau Pahawang. Menurutnya, terumbu karang menjadi daya tarik bagi wisatawan yang diharapkan mampu memberikan dampak ekonomi bagi warga setempat. """
Hasan Nasbi Ingin Kantor Komunikasi Kepresidenan Dikenal dengan Nama PCO,detikNews,2024-08-20,Isal Mawardi,https://news.detik.com/berita/d-7499672/hasan-nasbi-ingin-kantor-komunikasi-kepresidenan-dikenal-dengan-nama-pco,"Kepala Kantor Komunikasi Kepresidenan Hasan Nasbi menghadap Presiden Joko Widodo (Jokowi) di Istana Presiden, Jakarta. Kepada Jokowi, Hasan Nasbi menyampaikan ingin Kantor Komunikasi Kepresidenan dikenal dengan sebutan Presidential Communication Office atau PCO. ""Tadi saya minta izin kepada bapak presiden, untuk menggunakan nama presidential communication office (PCO), jadi tidak dipanggil Kepala Kompres tapi Kepala PCO,"" kata Hasan Nasbi di kompleks Istana Kepresidenan Jakarta, Selasa 20 Agustus 2024. Jokowi lalu memberikan arahan kepada Hasan agar segera membentuk struktur organisasi. Termasuk juga berkoordinasi dengan Kementerian Sekretariat Negara.    ""Kami mendapatkan arahan dari presiden untuk segera menyelesaikan pembentukan organisasi, penyusunan organisasi, termasuk juga supaya dukungan kesekretariatan dari Setneg juga segera diselesaikan,"" jelasnya. Ia berharap Kantor Komunikasi Kepresidenan bisa segera menempati ruangan agar lebih efektif dalam bekerja. ""Kita juga sedang secepat mungkin untuk bisa menempati ruangan agar bisa bekerja dan menyelesaikan susunan organisasi,"" imbuhnya.","Kepala Kantor Komunikasi Kepresidenan Hasan Nasbi menghadap Presiden Joko Widodo (Jokowi) di Istana Presiden, Jakarta. Tadi saya minta izin kepada bapak presiden, untuk menggunakan nama presidential communication office (PCO), jadi tidak dipanggil Kepala Kompres tapi Kepala PCO,"" kata Hasan Nasbi di kompleks Istana Kepresidenan Jakarta, Selasa 20 Agustus 2024. Termasuk juga berkoordinasi dengan Kementerian Sekretariat Negara. Ia berharap Kantor Komunikasi Kepresidenan bisa segera menempati ruangan agar lebih efektif dalam bekerja. """
Bupati Ungkap Dukcapil Pandeglang Sudah Bisa Cetak e-KTP Lagi,detikNews,2024-08-20,Aris Rivaldo,https://news.detik.com/berita/d-7499894/bupati-ungkap-dukcapil-pandeglang-sudah-bisa-cetak-e-ktp-lagi,"Pemerintah Kabupaten (Pemkab) Pandeglang mengatakan sudah mengatasi polemik pencetakan e-KTP yang sempat terhenti karena masalah utang dengan perusahaan penyedia bahan baku. Kini proses pencetakan e-KTP di Disdukcapil Pandeglang sudah bisa dilakukan. ""Kemarin sempat terganggu selama dua minggu, udah dirapikan sama Ibu,"" kata Bupati Pandeglang Irna Narulita di Kota Serang, Selasa 20 Agustus 2024. Irna mengungkapkan penyebab terjadinya pemberhentian percetakan e-KTP. Menurutnya, hal itu disebabkan perencanaan anggaran yang diajukan oleh Disdukcapil Pandeglang asal-asalan.    ""Perencanaannya, penganggarannya ternyata ngasal, di ujung (tinta) ribbon (habis). Makanya harus efisien, efektif, penggunaannya, masyarakat juga kalau punya KTP jangan baru dipegang tiga bulan hilang, kan kita tidak boleh bilang tidak ke masyarakat, harus melayani, sehingga kebutuhan dasar harus ditangani,"" katanya. Irna juga mengaku heran Disdukcapil memiliki utang kepada pihak perusahaan penyedia bahan untuk mencetak e-KTP. Menurutnya, utang tersebut seharusnya tidak ada. ""Ngutang ke mana itu bocah, kadisnya... kadisnya,"" pungkasnya. Diketahui sebelumnya, proses pencetakan e-KTP di Dinas Kependudukan dan Pencatatan Sipil (Disdukcapil) Pandeglang terhenti. Disdukcapil Pandeglang menyebut hal itu karena mereka memiliki utang ke perusahaan sebesar Rp 200 juta. ""Proses pembuatan e-KTP terhenti karena kita punya utang ke perusahaan sekitar Rp 200 juta,"" kata Administrator Database Disdukcapil Pandeglang Samsudin Rais kepada wartawan, Rabu 14 Agustus. Samsudin menjelaskan utang itu karena Disdukcapil Pandeglang tidak bisa membayar bahan baku pembuatan e-KTP, seperti tinta, cleaning kit, dan film. Ia mengatakan pihaknya tidak bisa mendapatkan bahan itu, karena belum melunasi utang ke pihak perusahaan penyedia bahan. ""Kita sementara tidak bisa cetak e-KTP karena kekurangan bahan tinta ribbon, cleaning kit, dan filmnya habis,"" ungkapnya.","Pemerintah Kabupaten (Pemkab) Pandeglang mengatakan sudah mengatasi polemik pencetakan e-KTP yang sempat terhenti karena masalah utang dengan perusahaan penyedia bahan baku. Kini proses pencetakan e-KTP di Disdukcapil Pandeglang sudah bisa dilakukan. "" Makanya harus efisien, efektif, penggunaannya, masyarakat juga kalau punya KTP jangan baru dipegang tiga bulan hilang, kan kita tidak boleh bilang tidak ke masyarakat, harus melayani, sehingga kebutuhan dasar harus ditangani,"" katanya. Irna juga mengaku heran Disdukcapil memiliki utang kepada pihak perusahaan penyedia bahan untuk mencetak e-KTP. Menurutnya, utang tersebut seharusnya tidak ada. "" Ngutang ke mana itu bocah, kadisnya... kadisnya,"" pungkasnya. Proses pembuatan e-KTP terhenti karena kita punya utang ke perusahaan sekitar Rp 200 juta,"" kata Administrator Database Disdukcapil Pandeglang Samsudin Rais kepada wartawan, Rabu 14 Agustus. Ia mengatakan pihaknya tidak bisa mendapatkan bahan itu, karena belum melunasi utang ke pihak perusahaan penyedia bahan. """
AQUA Dukung Ekonomi Sirkular-Kelestarian Lingkungan di Destinasi Wisata,detikNews,2024-08-20,Erika Dyah,https://news.detik.com/berita/d-7499762/aqua-dukung-ekonomi-sirkular-kelestarian-lingkungan-di-destinasi-wisata,"Perusahaan Air Minum Dalam Kemasan (AMDK) AQUA meluncurkan kampanye '100% Murni, 100% Petualangan Indonesia'. Melalui kampanye ini, AQUA mempromosikan destinasi wisata prioritas sekaligus meningkatkan kesadaran masyarakat akan pentingnya menjaga kebersihan selama perjalanan wisata. Kampanye AQUA ini bekerja sama dengan Wonderful Indonesia. AQUA juga menggandeng Pandawara Group, Najwa Shihab, Kole Project, perwakilan dari Kementerian Pariwisata dan Ekonomi Kreatif, serta masyarakat setempat untuk melakukan aksi bersih-bersih Pantai Binongko, Labuan Bajo, Nusa Tenggara Timur. Aksi bersih-bersih pantai tersebut bertujuan mengedukasi dan menginspirasi konsumen dalam menjaga kelestarian lingkungan di destinasi wisata. Apalagi, masalah sampah menjadi tantangan utama dalam meningkatkan kualitas destinasi wisata.    Berdasarkan data World Population Review, terdapat 4,8 juta hingga 12,7 juta ton sampah plastik yang dibuang ke laut setiap tahun di dunia. Di Labuan Bajo, jumlah timbulan sampahnya bahkan mencapai 16 ton per hari dengan 33% di antaranya merupakan sampah daur ulang. Tak hanya menyelesaikan masalah sampah dengan aksi bersih-bersih, AQUA juga mendukung gerakan ekonomi sirkular sejak 1993 melalui program PEDULI dan #BijakBerplastik pada 2018. Gerakan #BijakBerplastik memiliki tiga fokus utama, yaitu pengembangan infrastruktur pengumpulan sampah, edukasi kepada konsumen dan masyarakat, serta inovasi kemasan produk. Sustainable Packaging Circularity Senior Manager AQUA Jeffri Ricardo mengungkapkan AQUA berkomitmen mengambil kembali lebih banyak plastik dari yang telah dihasilkan pada 2025. ""Untuk itu, kami terus bekerja sama dengan pemangku kepentingan untuk membangun infrastruktur dan meningkatkan kapasitas pengelolaan sampah melalui unit bisnis daur ulang, Tempat Pengolahan Sampah Terpadu (TPST), Tempat Pengelolaan Sampah Reuse, Reduce dan Recycle (TPS3R), dan bank sampah. Ini bertujuan memaksimalkan manfaat ekonomi sirkular bagi lingkungan, masyarakat dan juga kelangsungan usaha AQUA,"" kata Jeffri dalam keterangan tertulis. Ia menambahkan AQUA saat ini mengembangkan dan mendampingi hingga enam unit bisnis daur ulang (RBU) dan 10 collection center di Likupang, Danau Toba, Mandalika, Candi Borobudur, dan Labuan Bajo. Selain itu, AQUA juga melakukan pendampingan kepada 26 TPS3R serta lebih dari 60 unit bank sampah. Melalui berbagai inisiatif tersebut, AQUA mengumpulkan lebih dari 22.000 ton sampah plastik per tahunnya. Plastik ini didaur ulang kembali menjadi bahan baku kemasan botol baru ataupun produk lain yang memiliki nilai ekonomi. Sementara itu, Deputi Bidang Pemasaran Kementerian Pariwisata dan Ekonomi Kreatif Ni Made Ayu Marthini yang hadir dalam aksi bersih-bersih pantai menekankan pentingnya kolaborasi dalam mengurangi sampah. Baik antara pemerintah, industri, sektor swasta, maupun masyarakat. Ia pun berharap masyarakat Indonesia sebagai salah satu negara dengan luas laut terbesar di dunia dapat meningkatkan kesadaran terhadap kelestarian lingkungan. ""Indonesia dianugerahi keindahan alam oleh Tuhan yang harus dijaga, jangan menunggu hingga krisis terjadi. Mari kita jaga alam Indonesia bersama,"" pesannya. Lebih lanjut, Pendiri Kole Project Putra Hawan, menjelaskan sampah-sampah yang telah dikumpulkan selama aksi bersih-bersih dibawa ke Recycling Business Unit (RBU) untuk dipilah sesuai jenisnya dan dibersihkan. ""Setelah itu, sampah ini di-press dengan mesin khusus hingga berbentuk kotak kemudian dibawa ke Jawa Timur untuk didaur ulang menjadi bahan baku baru,"" ungkap Putra. Ia menjelaskan gerakan ekonomi sirkular di Labuan Bajo ini melibatkan lebih dari 50 orang, termasuk kalangan difabel. ""Sekarang 70 persen sampah berasal dari pengumpulan masyarakat. Dan sudah ada 200 titik pengumpulan sampah termasuk di gereja-gereja melalui gerakan kolekte sampah,"" terangnya.  Ia mengatakan gerakan ekonomi sirkular ini memiliki dampak positif bagi masyarakat. ""Sebagian besar pekerja RBU adalah ibu-ibu yang tinggal di dekat RBU. Mereka mendapatkan penghasilan dari per kilogram sampah yang dipilah pada waktu senggang mereka,"" tambah Putra. Adapun kerja sama antara AQUA dengan Kole Project di Labuan Bajo telah berlangsung sejak 2019 dengan didirikannya RBU. RBU ini mampu mengelola sekitar 20 ton sampah per bulan. Dengan semangat collection, education, dan collaboration, kerja sama ini berhasil memberikan edukasi mengenai pengelolaan sampah berkelanjutan kepada lebih dari 300 pelajar dan 1.000 orang, serta melibatkan lebih dari 100 hotel, restoran, warung, dan lebih dari 50 orang petugas kebersihan. ","Perusahaan Air Minum Dalam Kemasan (AMDK) AQUA meluncurkan kampanye '100% Murni, 100% Petualangan Indonesia'. Kampanye AQUA ini bekerja sama dengan Wonderful Indonesia. AQUA juga menggandeng Pandawara Group, Najwa Shihab, Kole Project, perwakilan dari Kementerian Pariwisata dan Ekonomi Kreatif, serta masyarakat setempat untuk melakukan aksi bersih-bersih Pantai Binongko, Labuan Bajo, Nusa Tenggara Timur. Apalagi, masalah sampah menjadi tantangan utama dalam meningkatkan kualitas destinasi wisata. Gerakan #BijakBerplastik memiliki tiga fokus utama, yaitu pengembangan infrastruktur pengumpulan sampah, edukasi kepada konsumen dan masyarakat, serta inovasi kemasan produk. Ini bertujuan memaksimalkan manfaat ekonomi sirkular bagi lingkungan, masyarakat dan juga kelangsungan usaha AQUA,"" kata Jeffri dalam keterangan tertulis. Melalui berbagai inisiatif tersebut, AQUA mengumpulkan lebih dari 22.000 ton sampah plastik per tahunnya. Plastik ini didaur ulang kembali menjadi bahan baku kemasan botol baru ataupun produk lain yang memiliki nilai ekonomi. Baik antara pemerintah, industri, sektor swasta, maupun masyarakat. Indonesia dianugerahi keindahan alam oleh Tuhan yang harus dijaga, jangan menunggu hingga krisis terjadi. Mari kita jaga alam Indonesia bersama,"" pesannya. Lebih lanjut, Pendiri Kole Project Putra Hawan, menjelaskan sampah-sampah yang telah dikumpulkan selama aksi bersih-bersih dibawa ke Recycling Business Unit (RBU) untuk dipilah sesuai jenisnya dan dibersihkan. "" Ia menjelaskan gerakan ekonomi sirkular di Labuan Bajo ini melibatkan lebih dari 50 orang, termasuk kalangan difabel. "" Sekarang 70 persen sampah berasal dari pengumpulan masyarakat. Dan sudah ada 200 titik pengumpulan sampah termasuk di gereja-gereja melalui gerakan kolekte sampah,"" terangnya. Sebagian besar pekerja RBU adalah ibu-ibu yang tinggal di dekat RBU. RBU ini mampu mengelola sekitar 20 ton sampah per bulan."
