title,category,publish_date,author,article_url,content,summary
"Penerima Program Pendidikan Dokter Spesialis Bakal Dapat Gaji 7,5 Juta",Nasional,2024-07-03,"Tatang Guritno, Krisiandi",https://nasional.kompas.com/read/2024/07/03/15463271/penerima-program-pendidikan-dokter-spesialis-bakal-dapat-gaji-75-juta,"Menteri Kesehatan Menkes Budi Gunadi Sadikin mengatakan penerima Program Pendidikan Dokter Spesialis PPDS bakal menerima gaji selama menjalankan studinya di rumah sakit pendidikan. Sebab, selain mengemban studi, para dokter PPDS juga bakal diminta untuk bekerja. Karena mereka bekerja di rumah sakit, statusnya adalah status kontrak, umumnya mungkin juga ASN dari daerahdaerah yang kita kontrak di rumah sakit pendidikan, mereka akan kita bayar gaji. Gajinya sekitar 7,5 juta per bulan, ujar Budi dalam rapat kerja dengan Komisi IX DPR RI di Kompleks Parlemen, Senayan, Jakarta, Rabu 3 Juli 2024.  Ia menyatakan, para dokter PPDS menerima gaji karena mereka juga sudah siap bekerja. Sebab, para calon dokter spesialis biasanya sudah bekerja selama 45 tahun sebagai dokter umum. Jadi mereka bukan hanya sebagai murid, tapi mereka sebagai orang yang bekerja membantu seniornya bekerja dan di luar ini bisa dapat jasa pelayanan juga, ucap dia.  Terakhir, Budi menuturkan bahwa sistem ini dibuat sama seperti banyak negara lain di dunia. Jadi, pendidikan dokter spesialis tidak hanya belajar teori, tetapi juga bekerja dan terjun langsung mengurus pasien. Memang konsepnya kita kembalikan seperti apa yang ada di seluruh negara di luar negeri, bahwa pendidikan dokter spesialis seperti magang, seperti interenship, seperti training, sehingga dia bisa bekerja dan bisa mendapatkan gaji, imbuh dia.","Menteri Kesehatan Menkes Budi Gunadi Sadikin mengatakan penerima Program Pendidikan Dokter Spesialis PPDS bakal menerima gaji selama menjalankan studinya di rumah sakit pendidikan. Sebab, selain mengemban studi, para dokter PPDS juga bakal diminta untuk bekerja. Gajinya sekitar 7,5 juta per bulan, ujar Budi dalam rapat kerja dengan Komisi IX DPR RI di Kompleks Parlemen, Senayan, Jakarta, Rabu 3 Juli 2024. Jadi, pendidikan dokter spesialis tidak hanya belajar teori, tetapi juga bekerja dan terjun langsung mengurus pasien. Memang konsepnya kita kembalikan seperti apa yang ada di seluruh negara di luar negeri, bahwa pendidikan dokter spesialis seperti magang, seperti interenship, seperti training, sehingga dia bisa bekerja dan bisa mendapatkan gaji, imbuh dia."
DKPP Pecat Ketua KPU Hasyim Asy'ari karena Lakukan Tindakan Asusila,Nasional,2024-07-03,"Tria Sutrisna, Ihsanuddin",https://nasional.kompas.com/read/2024/07/03/15405511/dkpp-pecat-ketua-kpu-hasyim-asyari-karena-lakukan-tindakan-asusila,"Dewan Kehormatan Penyelenggara Pemilu DKPP memutuskan untuk menjatuhkan sanksi pemberhentian tetap terhadap Ketua Komisi Pemilihan Umum KPU Hasyim Asy'ari, Rabu 3 Juli 2024. Sanksi tersebut diberikan karena Hasyim terbukti melakukan pelanggaran kode etik penyelenggara pemilu KEPP karena melakukan tindakan asusila terhadap seorang perempuan anggota Panitia Pemilihan Luar Negeri PPLN Den Haag, Belanda. Ketua DKPP Heddy Lugito menegaskan bahwa seluruh dalil aduan yang disampaikan oleh pengadu atau korban dikabulkan untuk seluruhnya. Menjatuhkan sanksi pemberhentian tetap kepada teradu Hasyim Asy'ari selaku ketua merangkap anggota komisioner KPU terhitung sejak putusan ini dibacakan, ujar Heddy dalam sidang, Rabu 3 Juli 2024.  Dalam putusannya, Heddy juga meminta Presiden Joko Widodo Jokowi untuk melaksanakan putusan DKPP paling lambat tujuh hari sejak putusan dibacakan. Adapun dalam kasus pelanggaran etik ini, Hasyim dituduh menggunakan relasi kuasa untuk mendekati, membina hubungan romantis, dan berbuat asusila terhadap Pengadu, termasuk di dalamnya menggunakan fasilitas jabatan sebagai Ketua KPU RI. Cerita pertama kali ketemu itu di Agustus 2023, itu sebenarnya juga dalam konteks kunjungan dinas. Itu pertama kali bertemu, hingga terakhir kali peristiwa terjadi di bulan Maret 2024,"" kata kuasa hukum korban sekaligus pengadu, Maria Dianita Prosperiani, saat mengadu ke DKPP, 18 April 2024. Keduanya disebut beberapa kali bertemu, baik saat Hasyim melakukan kunjungan dinas ke Eropa maupun sebaliknya saat korban kunjungan dinas ke Indonesia.  Kuasa hukum lainnya, Aristo Pangaribuan, menyebut bahwa dalam keadaan keduanya terpisah jarak, terdapat upaya aktif dari Hasyim ""secara terusmenerus"" untuk menjangkau korban. ""Hubungan romantis, merayu, mendekati untuk nafsu pribadinya,"" kata Aristo. Namun, menurut dia, tidak ada intimidasi ataupun ancaman dalam dugaan pemanfaatan relasi kuasa yang disebut dilakukan oleh Hasyim. Pengacara juga enggan menjawab secara tegas apakah ""perbuatan asusila"" yang dimaksud juga mencakup pelecehan seksual atau tidak.","Dewan Kehormatan Penyelenggara Pemilu DKPP memutuskan untuk menjatuhkan sanksi pemberhentian tetap terhadap Ketua Komisi Pemilihan Umum KPU Hasyim Asy'ari, Rabu 3 Juli 2024. Menjatuhkan sanksi pemberhentian tetap kepada teradu Hasyim Asy'ari selaku ketua merangkap anggota komisioner KPU terhitung sejak putusan ini dibacakan, ujar Heddy dalam sidang, Rabu 3 Juli 2024. Adapun dalam kasus pelanggaran etik ini, Hasyim dituduh menggunakan relasi kuasa untuk mendekati, membina hubungan romantis, dan berbuat asusila terhadap Pengadu, termasuk di dalamnya menggunakan fasilitas jabatan sebagai Ketua KPU RI. Cerita pertama kali ketemu itu di Agustus 2023, itu sebenarnya juga dalam konteks kunjungan dinas. Keduanya disebut beberapa kali bertemu, baik saat Hasyim melakukan kunjungan dinas ke Eropa maupun sebaliknya saat korban kunjungan dinas ke Indonesia. Hubungan romantis, merayu, mendekati untuk nafsu pribadinya,"" kata Aristo. Pengacara juga enggan menjawab secara tegas apakah ""perbuatan asusila"" yang dimaksud juga mencakup pelecehan seksual atau tidak."
"Kunker ke Surabaya, Wapres Resmikan Pembukaan Asian-Pacific Aquaculture 2024",Nasional,2024-07-03,"Irfan Kamil, Krisiandi",https://nasional.kompas.com/read/2024/07/03/15200551/kunker-ke-surabaya-wapres-resmikan-pembukaan-asian-pacific-aquaculture-2024,"Wakil Presiden Wapres RI Maruf Amin beserta Ibu Hj. Wury Maruf Amin melakukan kunjungan kerja Kunker ke Surabaya, Jawa Timur, Kamis 3 Juli 2024. Wapres dan rombongan lepas landas dari Pangkalan Udara TNI AU Halim Perdanakusuma menuju Bandara Internasional Juanda, Surabaya pukul 14.00 WIB dengan menggunakan Pesawat Khusus Kepresidenan Boeing 737400 TNI AU. Menempuh perjalanan udara sekitar 1 jam 20 menit, Wapres dan rombongan diperkirakan tiba di Surabaya sekitar pukul 15.20 WIB.  Kedatangan Wapres bakal disambut oleh Pj. Gubernur Jatim Adhy Karyono, Pangdam V/Brawijaya Mayjen TNI Rafael Granada Baay, Kapolda Jatim Irjen Pol Imam Sugianto, Danpuspenerbal, serta Danlanud Muljono, beserta pendamping masingmasing. Keesokan harinya, Kamis 4 Juli 2024, Wapres dan rombongan dijadwalkan menuju Grand City Hall Convention, Genteng, Surabaya pukul 09.35 WIB. Di lokasi tersebut, Wapres akan meresmikan Pembukaan AsianPacific Aquaculture 2024 yang diselenggarakan oleh Kementerian Kelauatan dan Perikanan Kementeran KKP. Pada hari yang sama, Wapres dijadwalkan menuju Bandara Internasional Juanda Surabaya, untuk kembali ke Jakarta pada pukul 13.00 WIB,  Wapres beserta rombongan lepas landas menuju Jakarta dan tiba di Pangkalan Udara TNI AU Halim Perdanakusuma pukul 14.20 WIB. Selain Wury Maruf Amin, kunjungan kerja ini turut didampingi oleh Kepala Sekretariat Wakil Presiden Ahmad Erani Yustika, Deputi Bidang Administrasi Sapto Harjono W.S dan Staf Khusus Wapres Bidang Komunikasi dan Informasi Masduki Baidlowi. Kemudian, Staf Khusus Wapres Bidang Umum Masykuri Abdillah, Staf Khusus Wapres Bidang Penanggulangan Kemiskinan dan Otonomi Daerah, serta Tim Ahli Wapres Farhat Brachma dan Johan Tedja Surya.","Wakil Presiden Wapres RI Maruf Amin beserta Ibu Hj. Wury Maruf Amin melakukan kunjungan kerja Kunker ke Surabaya, Jawa Timur, Kamis 3 Juli 2024. Wapres dan rombongan lepas landas dari Pangkalan Udara TNI AU Halim Perdanakusuma menuju Bandara Internasional Juanda, Surabaya pukul 14.00 WIB dengan menggunakan Pesawat Khusus Kepresidenan Boeing 737400 TNI AU. Gubernur Jatim Adhy Karyono, Pangdam V/Brawijaya Mayjen TNI Rafael Granada Baay, Kapolda Jatim Irjen Pol Imam Sugianto, Danpuspenerbal, serta Danlanud Muljono, beserta pendamping masingmasing. Keesokan harinya, Kamis 4 Juli 2024, Wapres dan rombongan dijadwalkan menuju Grand City Hall Convention, Genteng, Surabaya pukul 09.35 WIB. Di lokasi tersebut, Wapres akan meresmikan Pembukaan AsianPacific Aquaculture 2024 yang diselenggarakan oleh Kementerian Kelauatan dan Perikanan Kementeran KKP."
"Bertemu MPR, Zulhas Minta Presiden Tetap Dipilih Rakyat",Nasional,2024-07-03,"Fika Nurul Ulya, Ardito Ramadhan",https://nasional.kompas.com/read/2024/07/03/14595461/bertemu-mpr-zulhas-minta-presiden-tetap-dipilih-rakyat,"Ketua Umum Partai Amanat Nasional PAN Zulkifli Hasan berpesan kepada Majelis Permusyawaratan Rakyat MPR agar presiden tetap dipilih oleh rakyat meski MPR ingin mengamendemen UndangUndang Dasar 1945. Zulhas, sapaan akrab Zulkifli, menegaskan bahwa pemilihan presiden secara langsung adalah amanat reformasi yang harus dipertahankan. ""Jadi kalau saya pemilihan harus langsung rakyat, tidak boleh diubahubah karena itulah hasil reformas,"" kata Zulhas seusai menerima pimpinan MPR di kantor DPP PAN, Jakarta, Rabu. Zulhas juga menekankan bahwa proses perubahan konstitusi itu harus dilakukan secara bertahap dan hatihati. ""Tidak langsung, minimal kalau ada perubahan harus dilakukan secara hatihati dan kita kaji secara bertahap,"" ujar mantan ketua MPR itu.  Sementara itu, Ketua MPR Bambang Soesatyo mengatakan, pertemuannya dengan Zulhas merupaka silaturahmi kebangsaan untuk memperoleh berbagai pandangan dan saran yang akan diberikan kepada pimpinan MPR berikutnya. Bamsoet mengakui, dalam pertemuan itu Zulhas berpandangan bahwa pemilihan presiden harus diserahkan kepada rakyat. ""Tadi disampaikan dalam diskusi yang cukup hangat, memang dalam situasi hari ini kita samasama prihatin bahwa demokrasi kita hari ini ternyata memang mahal sekali. Tapi bukan berarti kita mengubah pilpres menjadi kembali ke MPR, itu pandangan dari Pak Zul,"" ucap dia. Politikus Partai Golkar juga mengakui bahwa amendemen UUD 1945 harus gradual dan bertahap untuk mengembalikan sistem demokrasi dan jati diri bangsa Indonesia.  Selain itu, Bamsoet memandnag perlu ada formulasi agar pemilihan presiden tidak menggelontorkan sumber daya yang begitu banyak ketika amendemen dilakukan secara bertahap. ""Sekarang terjebak dalam demokrasi angkaangka, ini yang kita bicarakan kepada Pak zul,"" ujar dia. Sebelumnya Wakil Ketua MPR Yandri Susanto memastikan amendemen UUD 1945 tidak dilakukan di periode saat ini. Pasalnya, masa bakti anggota MPR RI periode 20192024 akan berakhir, sedangkan masa minimun amandemen UUD 1945 adalah 6 bulan sebelum berakhirnya masa jabatan. ""Pasti enggak mungkin di periode ini, sudah pasti. Tidak akan ada sama sekali amendemen UUD di periode ini,"" kata Yandri di Kompleks Istana Kepresidenan, Jakarta Pusat, Jumat 28 Juni 2024.  Sementara itu, Wakil Ketua MPR Ahmad Basarah memastikan, pihaknya tidak mengoper carry over rencana amendemen UUD 1945 ini kepada MPR periode berikutnya. Basarah mengatakan, MPR periode saat ini hanya akan memberi rekomendasi. MPR selanjutnya yang memiliki kewenangan penuh untuk melakukan amendemen atau sebaliknya. ""Sudah pasti tidak mungkin amendemen sekarang karna kami dilarang melakukan amendemen kalau masa jabatan kami itu sudah kurang dari 6 bulan. Sekarang kita sudah tinggal 3 bulan lagi, syaratnya harus di atas 6 bulan,"" ujar Basarah.","Ketua Umum Partai Amanat Nasional PAN Zulkifli Hasan berpesan kepada Majelis Permusyawaratan Rakyat MPR agar presiden tetap dipilih oleh rakyat meski MPR ingin mengamendemen UndangUndang Dasar 1945. Zulhas juga menekankan bahwa proses perubahan konstitusi itu harus dilakukan secara bertahap dan hatihati. "" Bamsoet mengakui, dalam pertemuan itu Zulhas berpandangan bahwa pemilihan presiden harus diserahkan kepada rakyat. "" Tadi disampaikan dalam diskusi yang cukup hangat, memang dalam situasi hari ini kita samasama prihatin bahwa demokrasi kita hari ini ternyata memang mahal sekali. Tapi bukan berarti kita mengubah pilpres menjadi kembali ke MPR, itu pandangan dari Pak Zul,"" ucap dia. Politikus Partai Golkar juga mengakui bahwa amendemen UUD 1945 harus gradual dan bertahap untuk mengembalikan sistem demokrasi dan jati diri bangsa Indonesia. Pasti enggak mungkin di periode ini, sudah pasti. Tidak akan ada sama sekali amendemen UUD di periode ini,"" kata Yandri di Kompleks Istana Kepresidenan, Jakarta Pusat, Jumat 28 Juni 2024. Sementara itu, Wakil Ketua MPR Ahmad Basarah memastikan, pihaknya tidak mengoper carry over rencana amendemen UUD 1945 ini kepada MPR periode berikutnya. Sudah pasti tidak mungkin amendemen sekarang karna kami dilarang melakukan amendemen kalau masa jabatan kami itu sudah kurang dari 6 bulan. Sekarang kita sudah tinggal 3 bulan lagi, syaratnya harus di atas 6 bulan,"" ujar Basarah."
"Ibu Afif Maulana: Pak Kapolri dan Kapolda, Tolong Cari Penganiaya Anak Saya, Bukan yang Memviralkan",Nasional,2024-07-03,"Nicholas Ryan Aditya, Ihsanuddin",https://nasional.kompas.com/read/2024/07/03/14510281/ibu-afif-maulana-pak-kapolri-dan-kapolda-tolong-cari-penganiaya-anak-saya,"Ibu Afif Maulana 13, Anggun Andriani memohon kepada Kapolri Jenderal Listyo Sigit Prabowo dan Kapolda Sumatera Barat Irjen Suharyono untuk mengungkap kematian anaknya. Anggun meminta Kapolri dan Kapolda fokus mencari siapa pelaku yang diduga menganiaya Afif hingga tewas, bukan justru mencari pihak yang memviralkan kasus ini. ""Bapak Kapolri, Bapak Kapolda, tolong bantu kami untuk mencari yang menganiaya anak saya, Afif Maulana, Pak. Bukan yang memviralkan yang bapak cari,"" kata Anggun ditemui di kawasan Gatot Subroto, Jakarta Selatan, Rabu 3 Juli 2024.  Hal itu disampaikan usai ditanya apa harapan dari orangtua Afif setelah datang ke Jakarta dari Padang, Sumatera Barat. Anggun meminta bantuan Kapolda hingga Kapolri untuk turun tangan menangani tewasnya sang anak secara tidak wajar. Sementara itu, ayah Afif, Afrinaldi meminta tolong kepada media massa untuk terus memberitakan kasus Afif. Hal itu dinilai sebagai bentuk bantuan terhadap keluarga Afif. ""Saya mau minta tolong sama media dan semua pihak yang bisa membantu kami, benarbenar membantu kami agar kami mendapatkan keadilan untuk anak kami,"" mohon Afrinaldi.  Paman Afif yang bernama Riki Lesmana juga meminta tolong agar kasus kematian Afif diungkap dengan sebenarnya. Sebab, dia melihat ada kejanggalan atas kematian Afif. Kejanggalan itu dinilai ditutupi oleh pihak Polda Sumatera Barat. ""Pak Kapolri aku minta tolong, Pak ya tolong ungkap kasus keponakanku yang di bawah umur ini, Pak, minta tolong, Pak,"" ucap Riki. ""Soal Kapolda Sumbar sudah banyak tutuptutupin, Pak kasus ini, Pak. Aku minta tolong sama Pak Kapolri ya, Pak ya,"" sambungnya.  Sebelumnya diberitakan, Kapolda Sumbar Inspektur Jenderal Suharyono di Padang mengatakan, pihaknya bakal mencari dan memeriksa orang yang memviralkan kasus Afif di media sosial. Alasannya, Suharyono berkata, narasi tersebut merupakan tuduhan yang berpotensi merusak citra institusi polisi. Pihaknya merasa menjadi korban trial by the press atau pengadilan oleh pers terkait dengan berita viral kematian Afif. ""Dia orang yang memviralkan harus memberi testimoni, Apakah kamu benar melihat kejadian, kamu kok ngomong begitu? Kamu, kan, sudah trial by the press, menyampaikan ke pers sebelum fakta yang sebenarnya cukup bukti atau tidak. Atau kamu hanya asumsi dan ngarangngarang, kata dia.","Ibu Afif Maulana 13, Anggun Andriani memohon kepada Kapolri Jenderal Listyo Sigit Prabowo dan Kapolda Sumatera Barat Irjen Suharyono untuk mengungkap kematian anaknya. Bapak Kapolri, Bapak Kapolda, tolong bantu kami untuk mencari yang menganiaya anak saya, Afif Maulana, Pak. Anggun meminta bantuan Kapolda hingga Kapolri untuk turun tangan menangani tewasnya sang anak secara tidak wajar. Hal itu dinilai sebagai bentuk bantuan terhadap keluarga Afif. "" Sebab, dia melihat ada kejanggalan atas kematian Afif. Soal Kapolda Sumbar sudah banyak tutuptutupin, Pak kasus ini, Pak. Aku minta tolong sama Pak Kapolri ya, Pak ya,"" sambungnya. Sebelumnya diberitakan, Kapolda Sumbar Inspektur Jenderal Suharyono di Padang mengatakan, pihaknya bakal mencari dan memeriksa orang yang memviralkan kasus Afif di media sosial. Pihaknya merasa menjadi korban trial by the press atau pengadilan oleh pers terkait dengan berita viral kematian Afif. "" Dia orang yang memviralkan harus memberi testimoni, Apakah kamu benar melihat kejadian, kamu kok ngomong begitu? Atau kamu hanya asumsi dan ngarangngarang, kata dia."
"Data Bais Diretas, TNI: Sudah Ditangani Kemenko Polhukam dan BSSN",Nasional,2024-07-03,"Nirmala Maulana Achmad, Ardito Ramadhan",https://nasional.kompas.com/read/2024/07/03/14104791/data-bais-diretas-tni-sudah-ditangani-kemenko-polhukam-dan-bssn,"TNI mengatakan bahwa datadata Badan Intelijen Strategis Bais TNI yang diretas sedang ditangani oleh Kementerian Koordinator Bidang Politik, Hukum, dan Keamanan Kemenko Polhukam dan Badan Siber dan Sandi Negara BSSN. Sudah ditangani oleh Kemenko Polhukam, oleh BSSN. Kami menunggu dari sana saja bagaimana tindak lanjutnya, kata Kepala Pusat Penerangan Kapuspen TNI Mayjen R Nugraha Gumilar di Markas Puspen TNI, Jakarta Timur, Rabu 3 Juli 2024. Gumilar mengatakan bahwa Tim Siber TNI telah bekerja sesuai dengan bidangnya soal peretasan datadata Bais itu. Ia menyebutkan, TNI juga telah berkoordinasi dengan Menteri Koordinator Bidang Politik, Hukum, dan Keamanan Menko Polhukam Hadi Tjahjanto usai datadata Bais TNI diretas. Sudah dirapatkan di atas. Jadi kami menunggu, ujar Gumilar.  Komandan Satuan Siber Dansatsiber TNI Brigjen Ari Yulianto mengatakan, TNI telah melapor peretasan itu saat rapat koordinasi rakor yang membahas penggantian Pusat Data Nasional PDN yang diserang ransomware di Kemenko Polhukam, Jakarta Pusat, Senin 1 Juli 2024. Ari mengatakan, secara umum juga telah disampaikan langkahlangkah untuk memperketat pengamanan. Pasti sudah, Pak Menko Polhukam kan sudah menyampaikan, ujar Ari. Hal sama diungkapkan Kepala Staf Umum Kasum TNI Letjen Bambang Ismawan yang juga ikut dalam rakor tersebut. Adapun datadata Bais TNI dibobol oleh peretas. Dugaan peretasan itu diunggah akun X Twitter, FalconFeedsio, Senin 24 Juni 2024.  Unggahan FalconFeedsio tersebut disertai entitas dari peretas, yakni MoonzHaxor. Badan Intelijen Strategis Indonesia Military Strategic Intelligence Agency LEAKED! tulis unggahan tersebut yang disertai foto. Unggahan itu juga menyebutkan bahwa data Bais TNI dibocorkan MoonzHaxor di situs atau forum jual beli data, BreachForums. MoonzHaxor, salah satu anggota terkemuka BreachForums telah mengunggah file dari Badan Intelijen Strategis. Kebocoran tersebut mencakup file sampel dengan data lengkap tersedia untuk dijual, tulis cuitan FalconFeedsio. Dalam unggahan di BreachForums, MoonzHaxor ingin menjual data Bais TNI berukuran 773 kilobyte kB dengan harga 1.000 dollar AS, sedangkan file berukuran 33,7 gigabyte GB dengan harga 7.000 dollar AS. Penelusuran Kompas.com melalui laman BreachForums, Rabu 26 Juni 2024 petang, menunjukkan data yang diretas berupa namanama prajurit, pangkat, asal satuan, email, nomor telepon, nomor registrasi pokok NRP, hingga data aksiaksi unjuk rasa.","TNI mengatakan bahwa datadata Badan Intelijen Strategis Bais TNI yang diretas sedang ditangani oleh Kementerian Koordinator Bidang Politik, Hukum, dan Keamanan Kemenko Polhukam dan Badan Siber dan Sandi Negara BSSN. Sudah ditangani oleh Kemenko Polhukam, oleh BSSN. Komandan Satuan Siber Dansatsiber TNI Brigjen Ari Yulianto mengatakan, TNI telah melapor peretasan itu saat rapat koordinasi rakor yang membahas penggantian Pusat Data Nasional PDN yang diserang ransomware di Kemenko Polhukam, Jakarta Pusat, Senin 1 Juli 2024. Ari mengatakan, secara umum juga telah disampaikan langkahlangkah untuk memperketat pengamanan. Adapun datadata Bais TNI dibobol oleh peretas. Dugaan peretasan itu diunggah akun X Twitter, FalconFeedsio, Senin 24 Juni 2024. Badan Intelijen Strategis Indonesia Military Strategic Intelligence Agency LEAKED! tulis unggahan tersebut yang disertai foto. Unggahan itu juga menyebutkan bahwa data Bais TNI dibocorkan MoonzHaxor di situs atau forum jual beli data, BreachForums. Dalam unggahan di BreachForums, MoonzHaxor ingin menjual data Bais TNI berukuran 773 kilobyte kB dengan harga 1.000 dollar AS, sedangkan file berukuran 33,7 gigabyte GB dengan harga 7.000 dollar AS."
Luhut: Beruntung Jokowi Larang Ekspor Nikel...,Nasional,2024-07-03,"Fika Nurul Ulya, Ihsanuddin",https://nasional.kompas.com/read/2024/07/03/14104151/luhut-beruntung-jokowi-larang-ekspor-nikel,"Menteri Koordinator Bidang Kemaritiman dan Investasi Luhut Binsar Pandjaitan menyinggung kebijakan Presiden Joko Widodo yang melarang ekspor bijih nikel nikel ore beberapa waktu lalu. Pasalnya lewat kebijakan itu, Indonesia makin siap menjadi pemain kunci dalam rantai pasokan global untuk kendaraan listrik dari hulu sampai hilir. Nikel merupakan salah satu bahan baku yang digunakan untuk produksi baterai mobil listrik. Hal ini dikatakan Luhut dalam peresmian pabrik ekosistem baterai dan kendaraan listrik PT Hyundai LG Indonesia HLI Green Power di Karawang, Jawa Barat, Rabu 3 Juli 2024. ""Kita beruntung Bapak Presiden Jokowi yang telah berani waktu itu. Saya masih ingat melarang untuk ekspor nikel ore kita, dan hari ini kita melihat nikel ore itu sudah menjadi satu bagian ekosistem kendaraan listrik di Indonesia,"" kata Luhut, Rabu.  Luhut menuturkan, kesiapan Indonesia yakin bisa menjadi pemimpin di kawasan, menyusul diresmikannya PT HLI Green Power di Karawang, Jawa Barat hari ini. Pasalnya, pabrik ini menjadi yang terbesar di Asia Tenggara. Peresmian pabrik baterai lithium dan industri kendaraan listrik ini menandai langkah penting menuju transisi energi hijau. Di sisi lain, adanya ekosistem ini akan meningkatkan perekonomian. ""Langkah strategis ini tidak hanya meningkatkan perekonomian kita, tetapi menciptakan ribuan lapangan kerja, mendorong inovasi, dan pengembangan keterampilan diantara tenaga kerja kita,"" ucap dia. Lebih lanjut Luhut mengungkapkan, penggunaan baterai produksi dalam negeri ini dapat meningkatkan nilai TKDN Kendaraan Bermotor Listrik Berbasis Baterai KBLBB, dari 40 persen menjadi 80 persen. Produksi di pabrik tersebut diperkirakan dapat mengurangi emisi CO2 sekitar 160.000 ton per tahun. Hal itu berpengaruh menekan impor BBM. Indonesia, kata Luhut, akan mampu mengurangi import BBM 45 juta liter per tahun, serta menghemat subsidi BBM yang mencapai Rp 131 miliar per tahun. ""Dan akan bertambah seiring jumlah kendaraan yang beredar,"" jelasnya.  Sebelumnya diberitakan, Presiden Joko Widodo meresmikan pabrik dan ekosistem baterai dan kendaraan listrik PT Hyundai LG Indonesia HLI Green Power yang berada di Karawang, Jawa Barat pada Rabu 3 Juli 2024. Menurut Kepala Negara, Indonesia telah memulai babak baru dalam meletakkan sebuah tonggak komitmen kita untuk menjadi pemain global di ekosistem electric vehicle EV cell baterai dan electric vehicle. ""Dengan dibangunnya smelter, dibangunnya pabrik baterai kendaraan listrik. Kita akan menjadi pemain global yang penting dalam global supply chain kendaraan listrik,"" tegas Jokowi.","Menteri Koordinator Bidang Kemaritiman dan Investasi Luhut Binsar Pandjaitan menyinggung kebijakan Presiden Joko Widodo yang melarang ekspor bijih nikel nikel ore beberapa waktu lalu. Pasalnya lewat kebijakan itu, Indonesia makin siap menjadi pemain kunci dalam rantai pasokan global untuk kendaraan listrik dari hulu sampai hilir. Nikel merupakan salah satu bahan baku yang digunakan untuk produksi baterai mobil listrik. Hal ini dikatakan Luhut dalam peresmian pabrik ekosistem baterai dan kendaraan listrik PT Hyundai LG Indonesia HLI Green Power di Karawang, Jawa Barat, Rabu 3 Juli 2024. "" Kita beruntung Bapak Presiden Jokowi yang telah berani waktu itu. Pasalnya, pabrik ini menjadi yang terbesar di Asia Tenggara. Peresmian pabrik baterai lithium dan industri kendaraan listrik ini menandai langkah penting menuju transisi energi hijau. Indonesia, kata Luhut, akan mampu mengurangi import BBM 45 juta liter per tahun, serta menghemat subsidi BBM yang mencapai Rp 131 miliar per tahun. "" Dan akan bertambah seiring jumlah kendaraan yang beredar,"" jelasnya. Dengan dibangunnya smelter, dibangunnya pabrik baterai kendaraan listrik."
