title,category,publish_date,author,article_url,content,summary
"Loyalitas Pegawai KPK Dikeluhkan, Rekrutmen Independen Patut Dipertimbangkan",Nasional,2024-07-02,Aryo Putranto Saptohutomo,https://nasional.kompas.com/read/2024/07/02/14303771/loyalitas-pegawai-kpk-dikeluhkan-rekrutmen-independen-patut-dipertimbangkan,"Keluhan pimpinan Komisi Pemberantasan Korupsi KPK soal loyalitas penyidik dan penyelidik dianggap terjadi akibat 2 faktor. Peneliti Indonesia Corruption Watch ICW Diky Anandya mengatakan, cara buat mencegah hal itu terulang adalah KPK mengangkat penyidik dan penyelidik secara mandiri atau independen, sehingga tidak bergantung pada lembaga penegak hukum lain. Masalah klasik mengenai loyalitas ganda penyelidik dan penyidik sejatinya dapat diatasi jika pimpinan KPK dapat mengambil kebijakan untuk merekrut penyidik sendiri atau independen, sebagaimana diatur dalam Pasal 43 dan Pasal 45 UU KPK, kata Diky dalam keterangannya seperti dikutip pada Selasa 2 Juli 2024. Jadi, dengan menjalankan ketentuan ini secara maksimal, ke depan KPK tidak lagi bergantung pada pegawai dari lembaga penegak hukum lain, sambung Diky.  Diky menilai loyalitas ganda penyelidik, penyidik, maupun penuntut umum di KPK adalah masalah yang berulang. ""Kondisi ini sebenarnya bukan masalah baru di KPK, ucap Diky. Sebelumnya dalam rapat kerja dengan Komisi III pada Senin 1 Juli 2024 kemarin, Wakil Ketua KPK Alexander Marwata mengeluhkan loyalitas ganda pegawai lembaga antirasuah itu. ""Sedikit saja. Saya hanya menekankan ini. Sulitnya menjadi pimpinan KPK. Karena apa? Itu tadi, saya nggak tau, penyelidik, penyidik, pegawai KPK itu loyalnya ke siapa?"" kata Alexander dalam rapat.  ""Kami, pak, di KPK, tentu kami enggak punya kewenangan ketika pegawai yang bersangkutan kembali ke instansiinstansi asalnya itu ingin menjabat apa. Enggak bisa. Kami hanya berwenang di KPK,"" sambung Alexander. Alexander menilai wajar jika pegawaipegawai KPK yang berasal dari instansiinstansi lain mengharapkan promosi ketika kembali ke tempat kerja asalnya. ""So, kalau mereka lebih loyal ke pimpinan di instansi asalnya, itu sangat manusiawi. Sangat manusiawi,"" ucap Alexander. Dia mengatakan pihaknya berharap pegawaipegawai yang bekerja di KPK, pindah status menjadi pegawai lembaga antirasuah.  ""Kami sih berharap kalau ada revisi atau apa pun, pegawai KPK atau pegawai dari mana pun asalnya, ketika mereka bertugas di KPK, ya sudah, pindah status menjadi pegawai KPK,"" papar Alexander.","Keluhan pimpinan Komisi Pemberantasan Korupsi KPK soal loyalitas penyidik dan penyelidik dianggap terjadi akibat 2 faktor. Masalah klasik mengenai loyalitas ganda penyelidik dan penyidik sejatinya dapat diatasi jika pimpinan KPK dapat mengambil kebijakan untuk merekrut penyidik sendiri atau independen, sebagaimana diatur dalam Pasal 43 dan Pasal 45 UU KPK, kata Diky dalam keterangannya seperti dikutip pada Selasa 2 Juli 2024. Jadi, dengan menjalankan ketentuan ini secara maksimal, ke depan KPK tidak lagi bergantung pada pegawai dari lembaga penegak hukum lain, sambung Diky. Kondisi ini sebenarnya bukan masalah baru di KPK, ucap Diky. ""Kami, pak, di KPK, tentu kami enggak punya kewenangan ketika pegawai yang bersangkutan kembali ke instansiinstansi asalnya itu ingin menjabat apa. Kami hanya berwenang di KPK,"" sambung Alexander. Alexander menilai wajar jika pegawaipegawai KPK yang berasal dari instansiinstansi lain mengharapkan promosi ketika kembali ke tempat kerja asalnya. """
KPK Mesti Lakukan Terobosan supaya Pegawai Independen dan Loyal,Nasional,2024-07-02,Aryo Putranto Saptohutomo,https://nasional.kompas.com/read/2024/07/02/14301001/kpk-mesti-lakukan-terobosan-supaya-pegawai-independen-dan-loyal,"Persoalan loyalitas penyidik, penyelidik, sampai penuntut umum di Komisi Pemberantasan Korupsi KPK dinilai harus segera dicari solusinya supaya lembaga antirasuah itu tidak terusmenerus tersandera dengan hal itu sampai menghambat penegakan hukum. Menurut Peneliti Indonesia Corruption Watch ICW, Diky Anandya, penyelidik dan penyidik KPK berasal dari instansi penegak hukum lain tidak bisa dimungkiri rentan mengalami persoalan terkait independensi dalam penegakan hukum. Hal ini dapat dilihat dari sejumlah proses penanganan perkara, misalnya mandeknya proses hukum terhadap mantan Wakil Menteri Hukum dan HAM. Kami mencurigai bahwa terdapat pejabat struktural di kedeputian penindakan yang sengaja menghambat penanganan perkara tersebut, kata Diky dalam keterangannya seperti dikutip pada Selasa 2 Juli 2024. Loyalitas ganda penyidik, penyelidik, sampai penuntut umum KPK mesti dipecahkan karena bisa membuat lembaga antirasuah itu kesulitan dan semakin kehilangan independensi.  Selain penanganan perkara, kondisi eksternal juga mengakibatkan hilangnya independensi KPK dalam mengurus sumber daya manusianya sendiri, ujar Diky. Diky menilai loyalitas ganda penyelidik, penyidik, ataupun penuntut umum di KPK adalah masalah yang berulang. ""Kondisi ini sebenarnya bukan masalah baru di KPK, ucap Diky. Sebelumnya, dalam rapat kerja dengan Komisi III pada Senin 1 Juli 2024, Wakil Ketua KPK Alexander Marwata mengeluhkan loyalitas ganda pegawai lembaga antirasuah itu. ""Sedikit saja. Saya hanya menekankan ini. Sulitnya menjadi pimpinan KPK. Karena apa? Itu tadi, saya nggak tau, penyelidik, penyidik, pegawai KPK itu loyalnya ke siapa?"" kata Alexander dalam rapat.  ""Kami, Pak, di KPK, tentu kami enggak punya kewenangan ketika pegawai yang bersangkutan kembali ke instansiinstansi asalnya itu ingin menjabat apa. Enggak bisa. Kami hanya berwenang di KPK,"" sambung Alexander. Alexander menilai wajar jika pegawaipegawai KPK yang berasal dari instansiinstansi lain mengharapkan promosi ketika kembali ke tempat kerja asalnya. ""So, kalau mereka lebih loyal ke pimpinan di instansi asalnya, itu sangat manusiawi. Sangat manusiawi,"" ucap Alexander. Dia mengatakan, pihaknya berharap pegawaipegawai yang bekerja di KPK pindah status menjadi pegawai lembaga antirasuah.  ""Kami sih berharap kalau ada revisi atau apa pun, pegawai KPK atau pegawai dari mana pun asalnya, ketika mereka bertugas di KPK, ya sudah, pindah status menjadi pegawai KPK,"" papar Alexander.","Persoalan loyalitas penyidik, penyelidik, sampai penuntut umum di Komisi Pemberantasan Korupsi KPK dinilai harus segera dicari solusinya supaya lembaga antirasuah itu tidak terusmenerus tersandera dengan hal itu sampai menghambat penegakan hukum. Menurut Peneliti Indonesia Corruption Watch ICW, Diky Anandya, penyelidik dan penyidik KPK berasal dari instansi penegak hukum lain tidak bisa dimungkiri rentan mengalami persoalan terkait independensi dalam penegakan hukum. Hal ini dapat dilihat dari sejumlah proses penanganan perkara, misalnya mandeknya proses hukum terhadap mantan Wakil Menteri Hukum dan HAM. Loyalitas ganda penyidik, penyelidik, sampai penuntut umum KPK mesti dipecahkan karena bisa membuat lembaga antirasuah itu kesulitan dan semakin kehilangan independensi. ""Kami, Pak, di KPK, tentu kami enggak punya kewenangan ketika pegawai yang bersangkutan kembali ke instansiinstansi asalnya itu ingin menjabat apa. Kami hanya berwenang di KPK,"" sambung Alexander. Alexander menilai wajar jika pegawaipegawai KPK yang berasal dari instansiinstansi lain mengharapkan promosi ketika kembali ke tempat kerja asalnya. "" So, kalau mereka lebih loyal ke pimpinan di instansi asalnya, itu sangat manusiawi."
"Berkaca Perang Rusia-Ukraina, Indonesia Kembangkan Alat Tangkal Serangan Siber lewat Udara",Nasional,2024-07-02,"Nirmala Maulana Achmad, Ihsanuddin",https://nasional.kompas.com/read/2024/07/02/13104001/berkaca-perang-rusia-ukraina-indonesia-kembangkan-alat-tangkal-serangan,"Holding industri pertahanan dalam negeri, Defend ID sedang mengembangkan alat untuk menangkal atau melakukan counter serangan siber lewat udara. Direktur Utama Defend ID Bobby Rasyidin mengatakan, alat yang sedang dikembangkan adalah electronic support measures ESM dan electronic counter measure ECM. Hal ini berkaca dari perang RusiaUkraina. Bobby mengatakan, Rusia melakukan jamming radarradar Ukraina menggunakan ESM. Apa yang dilakukan pertama kali oleh Rusia adalah jamming. Dia menjamming semua matanya Ukraina. Nah, itu ada antinya, kata Bobby dalam konferensi pers di Senayan, Jakarta Pusat, Selasa 1 Juli 2024 petang.  Defend ID pun mengembangkan alat yang bisa menangkal serangan tersebut, yakni ECM. Nah, kami ini mengembangkan antinya. Jadi, selain kami mengembangkan yang namanya electronic warfarenya, kami juga mengembangkan counternya, ujar Bobby. Defend ID mengembangkan alat penangkap secara komplit. Artinya selain ECM, juga mengembangkan ESM. Kami kembangkan. Dan dalam satu tahun ke depan, sudah ada beberapa platform, baik platform udara, darat, ataupun laut, yang kita nanti akan punya sistem itu, kata Bobby.  Sebelumnya, mantan Gubernur Lembaga Ketahanan Nasional Lemhannas Andi Widjajanto pernah memprediksi peperangan masa depan yang didominasi serangan siber. Serangan pertama mereka di era seperti ini pasti serangan siber. Kalau mereka ingin melakukan mengokupasi suatu titik di Indonesia, serangan pertama mereka pasti serangan udara, kata Andi dalam konferensi pers di Kantor Lemhannas, Jakarta Pusat, 18 September 2023. Andi mengungkapkan, setelah serangan siber, barulah pendaratan melalui laut atau operasi amfibi.","Holding industri pertahanan dalam negeri, Defend ID sedang mengembangkan alat untuk menangkal atau melakukan counter serangan siber lewat udara. Hal ini berkaca dari perang RusiaUkraina. Bobby mengatakan, Rusia melakukan jamming radarradar Ukraina menggunakan ESM. Jadi, selain kami mengembangkan yang namanya electronic warfarenya, kami juga mengembangkan counternya, ujar Bobby. Artinya selain ECM, juga mengembangkan ESM. Serangan pertama mereka di era seperti ini pasti serangan siber. Kalau mereka ingin melakukan mengokupasi suatu titik di Indonesia, serangan pertama mereka pasti serangan udara, kata Andi dalam konferensi pers di Kantor Lemhannas, Jakarta Pusat, 18 September 2023. Andi mengungkapkan, setelah serangan siber, barulah pendaratan melalui laut atau operasi amfibi."
"Jokowi Minta Menkes Cari Formulasi Harga Obat dan Alkes Murah, Ditunggu 2 Minggu",Nasional,2024-07-02,"Fika Nurul Ulya, Ihsanuddin",https://nasional.kompas.com/read/2024/07/02/12372421/jokowi-minta-menkes-cari-formulasi-harga-obat-dan-alkes-murah-ditunggu-2,"Presiden Joko Widodo meminta Menteri Kesehatan Budi Gunadi Sadikin mencari formulasi agar harga obat dan alat kesehatan di Indonesia lebih murah seperti di luar negeri. Presiden meminta Menkes kembali menemuinya dalam dua minggu ke depan untuk menjelaskan formulasi tersebut. Hal ini dikatakan Budi usai rapat bersama Presiden Jokowi dan menteri terkait di Kompleks Istana Kepresidenan, Jakarta Pusat, Selasa 2 Juli 2024. ""Dia ingin agar harga alat kesehatan dan obatobatan itu bisa sama dong dengan negaranegara tetangga. Kan kita harga alat kesehatan dan obatobatan mahal. Dua minggu saya balik ke Istana,"" kata Budi, Selasa.  Budi menuturkan, Kepala Negara sempat bertanya kenapa harga obat di dalam negeri mahal, namun industri farmasinya tidak majumaju. Ia mengeklaim, salah satu masalahnya karena inefisiensi jalur perdagangan dan tata kelola. Oleh karena itu, tata kelola perdagangan komoditas obatobatan harus lebih transparan supaya tidak ada peningkatan harga yang tidak beralasan. ""Tidak ada peningkatan harga yang unreasonable tidak beralasan deh atau unnecessary tidak perlu dalam proses pembelian alat kesehatan obatobatan. Itu kan lebih masalah tata kelola dan desain proses pembelian kita itu seperti apa,"" ucap Budi.  Di sisi lain, Budi berpendapat mahalnya harga obat dan alat kesehatan di dalam negeri tidak terlepas dari kebijakan perpajakan tax policy. Budi lantas mencontohkan sejumlah kebijakan pajak yang tidak berpihak pada industri di dalam negeri. Pemerintah tidak mengenakan bea masuk untuk impor barang jadi alat kesehatan seperti USG, namun mengenakan bea masuk 15 persen jika mengimpor bahan baku untuk dirakit di dalam negeri. Kebijakan pajak, lanjutnya, harus dibuat lebih efisien dan lebih sederhana namun tidak mengganggu pendapatan pemerintah. ""Ini kan ada inkonsistensi. Di satu sisi kita ingin dorong industri ini supaya produksi dalam negeri, tapi di sisi lain supporting insentifnya atau insentifnya enggak line satu garis lurus,"" jelas Budi.  Kendati begitu, ia tidak memungkiri, masalah pajak tidak mampu menjelaskan alasan harga obat yang jauh lebih mahal 300 persen dibandingkan negara tetangga. Adanya relaksasi, kemungkinan hanya akan menekan harga hingga 2030 persen. Tak heran, Presiden meminta Budi beserta Menteri Perindustrian Agus Gumiwang Kartasasmita dan Menteri Keuangan Sri Mulyani Indrawati menggodok formulasi. ""Itu sebabnya kita harus mencari kombinasi yang semurah mungkin, tapi isunya bukan hanya di pajak saja. Nah ini memang butuh kerja sama karena yang tahu kan sebenarnya kementerian teknis kayak saya,"" jelasnya.","Presiden Joko Widodo meminta Menteri Kesehatan Budi Gunadi Sadikin mencari formulasi agar harga obat dan alat kesehatan di Indonesia lebih murah seperti di luar negeri. Presiden meminta Menkes kembali menemuinya dalam dua minggu ke depan untuk menjelaskan formulasi tersebut. Hal ini dikatakan Budi usai rapat bersama Presiden Jokowi dan menteri terkait di Kompleks Istana Kepresidenan, Jakarta Pusat, Selasa 2 Juli 2024. "" Dia ingin agar harga alat kesehatan dan obatobatan itu bisa sama dong dengan negaranegara tetangga. Dua minggu saya balik ke Istana,"" kata Budi, Selasa. Oleh karena itu, tata kelola perdagangan komoditas obatobatan harus lebih transparan supaya tidak ada peningkatan harga yang tidak beralasan. "" Tidak ada peningkatan harga yang unreasonable tidak beralasan deh atau unnecessary tidak perlu dalam proses pembelian alat kesehatan obatobatan. Itu kan lebih masalah tata kelola dan desain proses pembelian kita itu seperti apa,"" ucap Budi. Di sisi lain, Budi berpendapat mahalnya harga obat dan alat kesehatan di dalam negeri tidak terlepas dari kebijakan perpajakan tax policy. Di satu sisi kita ingin dorong industri ini supaya produksi dalam negeri, tapi di sisi lain supporting insentifnya atau insentifnya enggak line satu garis lurus,"" jelas Budi. Adanya relaksasi, kemungkinan hanya akan menekan harga hingga 2030 persen."
Kapolri Pastikan Tak Ada yang Ditutupi dalam Penyelidikan Kematian Siswa SMP di Padang,Nasional,2024-07-02,"Rahel Narda Chaterine, Dani Prabowo",https://nasional.kompas.com/read/2024/07/02/12314791/kapolri-pastikan-tak-ada-yang-ditutupi-dalam-penyelidikan-kematian-siswa-smp,"Kapolri Jenderal Listyo Sigit Prabowo mengatakan, pihaknya tidak akan menutupi apa pun dalam penyelidikan kasus kematian Afif Maulana 12, siswa sekolah menengah pertama SMP di Padang, Sumatera Barat, yang diduga meninggal dunia karena dianiaya polisi. Kapolri menegaskan setiap pelanggaran, baik etik maupun pidana, akan ditindaklanjuti. ""Kasus proses etik menunjukkan kita tidak ada yang ditutupi dan bila ada kasus pidana juga akan ditindaklanjuti,"" ujar Sigit saat dikonfirmasi Kompas.com, Selasa 2 Juli 2024. Dalam pengusutan kasus ini, Polri juga menurunkan tim dari Mabes Polri di antaranya Divisi Profesi dan Pengamanan Propam hingga Inspektorat Pengawasan Umum Itwasum. Bahkan, Bareskrim hingga pihak eksternal seperti Kompolnas juga turut dilibatkan dalam mengusut kasus ini.  ""Tim Bareskrim juga sudah kita minta untuk supervisi,"" ujar dia. Lebih lanjut, Kapolri menyebut Kapolda Sumatera Barat Sumbar Irjen Suharyo sudah mengumumkan soal tahapan dan setiap temuan dalam pengusutan kasus ini. ""Kapolda saya lihat mengumumkan tahapan proses yang sudah dilaksanakan dalam setiap temuan yang didapat,"" ujar dia. Seperti diketahui, Minggu 9 Juni 2024, polisi menemukan jenazah remaja lakilaki tanpa identitas sekitar pukul 12.00 WIB. Jenazah tersebut kemudian dibawa ke RS Bhayangkara Padang, kemudian dijemput pihak keluarga yang sebelumnya kehilangan salah seorang anggota keluarganya. Sebelum ditemukan tewas, AM berada di jembatan Kuranji yang saat itu diduga sedang terjadi aksi tawuran.  Berdasarkan hasil investigasi LBH Padang, AM diduga dianiaya sebelum tewas dengan bukti lukaluka lebam di tubuh korban. Sementara itu, Kapolda Sumbar Irjen Suharyo menyebutkan, kasus kematian AM 12 di sungai Batang Kuranji Padang dianggap sudah selesai. Kasus tersebut bisa dibuka kembali jika ada bukti baru. Hasil otopsi memperlihatkan adanya patah tulang iga belakang bagian kiri sebanyak 6 ruas dan patahannya merobek paruparu. ""Penyebab kematiannya adalah karena patah tulang iga dan merobek paruparu itu,"" kata Suharyono kepada wartawan di Mapolda Sumbar, Minggu 30 Juni 2024.","Kapolri Jenderal Listyo Sigit Prabowo mengatakan, pihaknya tidak akan menutupi apa pun dalam penyelidikan kasus kematian Afif Maulana 12, siswa sekolah menengah pertama SMP di Padang, Sumatera Barat, yang diduga meninggal dunia karena dianiaya polisi. Kapolri menegaskan setiap pelanggaran, baik etik maupun pidana, akan ditindaklanjuti. "" Kasus proses etik menunjukkan kita tidak ada yang ditutupi dan bila ada kasus pidana juga akan ditindaklanjuti,"" ujar Sigit saat dikonfirmasi Kompas.com, Selasa 2 Juli 2024. Bahkan, Bareskrim hingga pihak eksternal seperti Kompolnas juga turut dilibatkan dalam mengusut kasus ini. Jenazah tersebut kemudian dibawa ke RS Bhayangkara Padang, kemudian dijemput pihak keluarga yang sebelumnya kehilangan salah seorang anggota keluarganya. Sebelum ditemukan tewas, AM berada di jembatan Kuranji yang saat itu diduga sedang terjadi aksi tawuran. Kasus tersebut bisa dibuka kembali jika ada bukti baru. Hasil otopsi memperlihatkan adanya patah tulang iga belakang bagian kiri sebanyak 6 ruas dan patahannya merobek paruparu. """
"Tingkat Kemiskinan Hanya Turun 2,22 Persen Selama Jokowi Menjabat, Menkeu Enggan Beri Tanggapan",Nasional,2024-07-02,"Dian Erika Nugraheny, Ihsanuddin",https://nasional.kompas.com/read/2024/07/02/11574631/tingkat-kemiskinan-hanya-turun-222-persen-selama-jokowi-menjabat-menkeu,"Menteri Keuangan Menkeu Sri Mulyani Indrawati enggan memberikan tanggapan soal angka kemiskinan yang hanya menurun sebanyak 2 persen dalam dua periode kepemimpinan Presiden Joko Widodo. Padahal, pemerintah diketahui kerap menggelontorkan bantuan sosial bansos kepada masyarakat miskin. Saat ditanya soal hal tersebut, Sri Mulyani tersenyum. Kemudian, ia menyatakan enggan memberi tanggapan dulu soal hal itu. Sebab menurutnya masih banyak faktor yang perlu dikaji. ""Itu enggak ada komentar dulu ya,"" ujar Sri Mulyani di Kompleks Istana Kepresidenan, Jakarta, Selasa 2 Juli 2024. ""Karena, banyak sekali yang mesti dikaji,"" lanjutnya sambil memperagakan banyaknya faktor yang mesti diperhatikan.  Diberitakan sebelumnya, Badan Pusat Statistik BPS mencatat, tingkat kemiskinan di Indonesia mengalami penurunan. Menurut BPS, tingkat kemiskinan pada Maret 2024 mencapai level terendah dalam kurun waktu 10 tahun terakhir. Plt. Sekretaris Utama BPS Imam Machdi mengatakan, tingkat kemiskinan pada Maret sebesar 9,03 persen dari total penduduk. Kemudian tercatat jumlah penduduk miskin sebanyak 25,22 juta orang. ""Tingkat kemiskinan yang terendah dalam 1 dekade ini,"" kata dia, dalam konferensi pers, Kantor BPS, Jakarta, Senin 1 Juli 2024. Lebih lanjut Imam bilang, dalam kurun waktu satu dekade terakhir jumlah penduduk miskin berkurang sekitar 3,06 juta orang dari 28,28 juta orang pada Maret 2014. Sementara itu, tingkat kemiskinan berkurang sebesar 2,22 persen poin dari Maret 2014 sebesar 11,25 persen.","Menteri Keuangan Menkeu Sri Mulyani Indrawati enggan memberikan tanggapan soal angka kemiskinan yang hanya menurun sebanyak 2 persen dalam dua periode kepemimpinan Presiden Joko Widodo. Padahal, pemerintah diketahui kerap menggelontorkan bantuan sosial bansos kepada masyarakat miskin. Saat ditanya soal hal tersebut, Sri Mulyani tersenyum. Kemudian, ia menyatakan enggan memberi tanggapan dulu soal hal itu. Sebab menurutnya masih banyak faktor yang perlu dikaji. "" Sekretaris Utama BPS Imam Machdi mengatakan, tingkat kemiskinan pada Maret sebesar 9,03 persen dari total penduduk. Lebih lanjut Imam bilang, dalam kurun waktu satu dekade terakhir jumlah penduduk miskin berkurang sekitar 3,06 juta orang dari 28,28 juta orang pada Maret 2014."
"Pendanaan Kunjungan Paus ke Indonesia Ditanggung Bersama, Bukan Hanya Satu Dua Orang",Nasional,2024-07-02,"Fabian Januarius Kuwado, Ihsanuddin",https://nasional.kompas.com/read/2024/07/02/11254641/pendanaan-kunjungan-paus-ke-indonesia-ditanggung-bersama-bukan-hanya-satu,"Kunjungan Paus Fransiskus ke Indonesia, awal September 2024 mendatang, disambut gembira berbagai kelompok di Indonesia. Mereka mendukung kunjungan Paus kali ini dengan memberikan berbagai macam sumbangsih. Melalui Konferensi Waligereja Indonesia KWI sebagai bagian dari panitia, berbagai individu dan kelompok bahu membahu memberikan kontribusi materi hingga spiritual demi kelancaran kunjungan Paus kali ini. ""Jadi kalau ada berita yang mengatakan bahwa pendanaan kunjungan Paus Fransiskus ditanggung satu, dua, atau tiga orang, itu tidak benar,"" ungkap juru bicara perjalanan Paus Fransiskus di Indonesia, Romo Thomas Ulun Ismoyo kepada Kompas.com, Selasa 2 Juli 2024. ""Banyak pihak, kelompok, dan pribadi, yang secara sukarela memberi bantuan berapapun nominalnya,"" lanjut dia.  Bahkan, ada umat agama di luar Katolik yang turut memberikan sumbangsih materialnya. Hal ini menunjukkan semangat solidaritas dan gotong royong antarkelompok bangsa demi membantu terlaksananya kunjungan Paus Fransiskus. Semangat itu pula yang membuat karya kemanusiaan Paus di Indonesia semakin menyala. Romo Thomas menekankan, pemerintah juga berperan penting dalam kunjungan Paus Fransiskus kali ini. Negara memberikan sumbangsih dalam hal penyediaan fasilitas serta keamanan selama Paus beraktivitas di Indonesia. ""Kontribusi negara sangat besar dalam hal ini. Sehingga proses persiapan sampai saat ini dapat berlangsung dengan baik,"" ujar dia.  Kontribusi dan dukungan yang paling penting dari kacamata gereja adalah doa kelancaran karya Paus di Indonesia dari umat Katolik. Pada 29 Juli 2024 lalu, panitia kunjungan Paus bekerja sama dengan KWI dan Kedutaan Besar Vatikan untuk RI telah merilis doa apostolik perjalanan Paus Fransiskus di Indonesia. ""Kami mengajak dan sudah dilaksanakan oleh setiap gereja, oleh komunitas ziarah, untuk mendoakan ini. Ini sumbangan tidak terlihat, tetapi sangat luar biasa untuk memberikan kekuatan spiritual bagi perjalanan Paus,"" ujar Romo Thomas. Paus Fransiskus akan datang ke Indonesia 3 September 2024. Sejumlah kegiatan akan dilaksanakan Paus Fransiskus. Mulai dari kunjungan kenegaraan di Istana Kepresidenan Jakarta bersama Presiden Joko Widodo, bersilaturahmi dengan tokoh lintas agama di Masjid Istiqlal Jakarta, pertemuan dengan biarawan dan biarawati di Gereja Katedral Jakarta, hingga misa akbar di Stadion Utama Gelora Bung Karno GBK Senayan.","Kunjungan Paus Fransiskus ke Indonesia, awal September 2024 mendatang, disambut gembira berbagai kelompok di Indonesia. Banyak pihak, kelompok, dan pribadi, yang secara sukarela memberi bantuan berapapun nominalnya,"" lanjut dia. Bahkan, ada umat agama di luar Katolik yang turut memberikan sumbangsih materialnya. Hal ini menunjukkan semangat solidaritas dan gotong royong antarkelompok bangsa demi membantu terlaksananya kunjungan Paus Fransiskus. Negara memberikan sumbangsih dalam hal penyediaan fasilitas serta keamanan selama Paus beraktivitas di Indonesia. "" Kontribusi negara sangat besar dalam hal ini. Sehingga proses persiapan sampai saat ini dapat berlangsung dengan baik,"" ujar dia. Pada 29 Juli 2024 lalu, panitia kunjungan Paus bekerja sama dengan KWI dan Kedutaan Besar Vatikan untuk RI telah merilis doa apostolik perjalanan Paus Fransiskus di Indonesia. "" Kami mengajak dan sudah dilaksanakan oleh setiap gereja, oleh komunitas ziarah, untuk mendoakan ini. Sejumlah kegiatan akan dilaksanakan Paus Fransiskus."
