title,category,publish_date,author,article_url,content,summary
"60 Orang yang Bekerja di DPR Terindikasi Main Judi Online, 2 di Antaranya Anggota DPR",Nasional,2024-07-02,"Nicholas Ryan Aditya, Dani Prabowo",https://nasional.kompas.com/read/2024/07/02/13104831/60-orang-yang-bekerja-di-dpr-terindikasi-main-judi-online-2-di-antaranya,"Sebanyak 60 orang yang bekerja di lingkungan Dewan Perwakilan Rakyat DPR terindikasi bermain judi online. Dai jumlah tersebut, dua di antaranya merupakan anggota DPR. Hal ini diketahui berdasarkan surat yang disampaikan Menteri Koordinator Bidang Politik, Hukum dan Keamanan Menko Polhukam sekaligus Ketua Satgas Pemberantasan Judi Online, Hadi Tjahjanto kepada Mahkamah Kehormatan Dewan MKD DPR, Selasa 2 Juli 2024 siang. ""Yang pasti hanya ada dua anggota DPR dan statusnya terduga. Kita akan klarifikasi lalu anggota dalam arti bukan anggota DPR ya, orang yang bekerja di lingkungan DPR sebanyak 58,"" kata Ketua MKD Adang Daradjatun di ruang MKD, Selasa.  Adang melanjutkan, berdasarkan surat tersebut, perputaran dana yang ditaksir dalam dugaan judi online di lingkungan DPR mencapai Rp 1,92 miliar. Adapun dua anggota DPR tersebut akan segera ditindaklanjuti oleh MKD dengan pemanggilan untuk mendengarkan keterangan. Namun Adang belum menyebutkan siapa dua anggota DPR yang dimaksud. ""Karena ketentuannya baik itu anggota DPR maupun juga karyawan pasti kita melakukan seluruh proses klarifikasi,"" ujar politikus Partai Keadilan Sejahtera PKS ini. Sebelumnya diberitakan, Wakil Ketua Komisi III DPR Pangeran Khairul Saleh menyebutkan, ada 82 anggota DPR RI yang terlibat judi online.  Pangeran mengatakan, pengumuman lebih lanjut akan disampaikan oleh Pusat Pelaporan dan Analisis Transaksi Keuangan PPATK. Ada 82 orang anggota DPR RI yang terlibat judi online. Mereka itu nanti, oleh PPATK, mungkin beberapa hari ini akan disampaikan, kata Pangeran kepada awak media di Kantor DPP Partai Amanat Nasional PAN, Jakarta Selatan, Kamis 27 Juni 2024.","Sebanyak 60 orang yang bekerja di lingkungan Dewan Perwakilan Rakyat DPR terindikasi bermain judi online. Dai jumlah tersebut, dua di antaranya merupakan anggota DPR. Hal ini diketahui berdasarkan surat yang disampaikan Menteri Koordinator Bidang Politik, Hukum dan Keamanan Menko Polhukam sekaligus Ketua Satgas Pemberantasan Judi Online, Hadi Tjahjanto kepada Mahkamah Kehormatan Dewan MKD DPR, Selasa 2 Juli 2024 siang. "" Yang pasti hanya ada dua anggota DPR dan statusnya terduga. Adang melanjutkan, berdasarkan surat tersebut, perputaran dana yang ditaksir dalam dugaan judi online di lingkungan DPR mencapai Rp 1,92 miliar. Namun Adang belum menyebutkan siapa dua anggota DPR yang dimaksud. "" Ada 82 orang anggota DPR RI yang terlibat judi online."
"""Polri Harus Kembali ke Jati Diri sebagai Alat Negara yang Menjaga Jarak dengan Kepentingan Politik""",Nasional,2024-07-02,Novianti Setuningsih,https://nasional.kompas.com/read/2024/07/02/13080061/-polri-harus-kembali-ke-jati-diri-sebagai-alat-negara-yang-menjaga-jarak,"Pengamat Kepolisian dari Institute for Security and Strategic Studies ISESS Bambang Rukminto mengajak Polri kembali pada jati dirinya yakni melindungi, mengayomi, dan melayani masyarakat. Kemudian, menjaga jarak dari kepentingan politik kekuasaan, kelompok, korporasi hingga kepentingan personal tertentu. Pesan itu disampaikan Bambang dalam momen Hari Ulang Tahun HUT ke78 Polri atau Hari Bhayangkara ""Polri juga harus kembali ke jati dirinya sebagai alat negara yang bisa menjaga jarak dengan kepentingan politik kekuasaan, kelompok, korporasi maupun kepentingankepentingan personal di dalamnya, tegak lurus pada peraturan perundangan, kata Bambang kepada Kompas.com, Senin 1 Juli 2024.  Sebelumnya, dia menyebut bahwa Polri semakin menjauh dari visi reformasi 1998. Pasalnya, Polri yang lahir dari gerakan reformasi melalui pencabutan Dwifungsi ABRI, saat ini kerap dikooptasi kepentingankepentingan politik kekuasaan dan kelompok tertentu termasuk korporasi swasta. ""Seiring perkembangannya saat ini, alihalih menjadi lembaga kepolisian negara yang profesional seperti harapan masyarakat, Polri malah menjauh dari visi reformasi 1998, ujar Bambang. Dia lantas mengaitkan masalah yang terjadi di tubuh Polri dengan kepemimpinan yang tidak tegas hingga terlalu toleran dengan pelanggaran yang dilakukan oleh jajarannya. ""Problem yang terjadi di tubuh organisasi Polri saat ini, diantaranya dipicu karena kepemimpinan yang tidak tegas, slow respons terkait isuisu yang berkembang di masyarakat, permisif atau toleran pada pelanggaran personelnya, kata Bambang Dan banyak melakukan pelanggaran Pasal 28 UU UndangUndang 2 tahun 2002 dengan menempatkan jenderal aktif di luar struktur yang mengingatkan publik pada praktek Dwifungsi di era sebelum reformasi 1998, ujarnya melanjutkan.  Kemudian, Bambang menyebut, kondisinya semakin diperparah karena pemerintah hingga lembaga legislatif sebagai pengawas justru membiarkan pelanggaran terhadap UU Polri tersebut. Sebagaimana diketahui, revisi UndangUndang UU Nomor 2 Tahun 2002 tentang Kepolisian Negara Republik Indonesia Polri menjadi sorotan. Sebab, dalam draft Rancangan UndangUndang RUU beredar kewenangan institusi penegak hukum itu diperluas. Polri diberikan kewenangan lebih luas seperti masuk dalam bidang intelijen dan mengatur jaringan internet, hingga kewenangan penyadapan. RUU Polri tersebut diketahui telah disetujui menjadi usul inisiatif DPR dalam Sidang Paripurna Ke18 yang dipimpin oleh Wakil Ketua DPR RI dari Fraksi Partai Gerindra, Sufmi Dasco Ahmad pada 28 Mei 2024. ","Pengamat Kepolisian dari Institute for Security and Strategic Studies ISESS Bambang Rukminto mengajak Polri kembali pada jati dirinya yakni melindungi, mengayomi, dan melayani masyarakat. Kemudian, menjaga jarak dari kepentingan politik kekuasaan, kelompok, korporasi hingga kepentingan personal tertentu. Pesan itu disampaikan Bambang dalam momen Hari Ulang Tahun HUT ke78 Polri atau Hari Bhayangkara ""Polri juga harus kembali ke jati dirinya sebagai alat negara yang bisa menjaga jarak dengan kepentingan politik kekuasaan, kelompok, korporasi maupun kepentingankepentingan personal di dalamnya, tegak lurus pada peraturan perundangan, kata Bambang kepada Kompas.com, Senin 1 Juli 2024. Problem yang terjadi di tubuh organisasi Polri saat ini, diantaranya dipicu karena kepemimpinan yang tidak tegas, slow respons terkait isuisu yang berkembang di masyarakat, permisif atau toleran pada pelanggaran personelnya, kata Bambang Dan banyak melakukan pelanggaran Pasal 28 UU UndangUndang 2 tahun 2002 dengan menempatkan jenderal aktif di luar struktur yang mengingatkan publik pada praktek Dwifungsi di era sebelum reformasi 1998, ujarnya melanjutkan. Sebagaimana diketahui, revisi UndangUndang UU Nomor 2 Tahun 2002 tentang Kepolisian Negara Republik Indonesia Polri menjadi sorotan. Sebab, dalam draft Rancangan UndangUndang RUU beredar kewenangan institusi penegak hukum itu diperluas. RUU Polri tersebut diketahui telah disetujui menjadi usul inisiatif DPR dalam Sidang Paripurna Ke18 yang dipimpin oleh Wakil Ketua DPR RI dari Fraksi Partai Gerindra, Sufmi Dasco Ahmad pada 28 Mei 2024."
Bappenas Siapkan PDN di Empat Lokasi,Nasional,2024-07-02,Dani Prabowo,https://nasional.kompas.com/read/2024/07/02/11424751/bappenas-siapkan-pdn-di-empat-lokasi,"Kepala Bappenas/Menteri Perencanaan Pembangunan Nasional Suharso Monoarfa mengatakan pihaknya tengah menyiapkan Pusat Data Nasional PDN di empat lokasi dengan standarisasi data center yang berada di bawah Bappenas. ""PDN yang kita siapkan ada di empat tempat sebenarnya, pertama di Cikarang mudahmudahan Oktober selesai,"" kata Suharso di Istana Kepresidenan Jakarta, Senin 1 Juli 2024, melansir Antara. Selain Cikarang, tiga lokasi PDN yang disiapkan yaitu Batam, Ibu Kota Nusantara IKN, dan Labuan Bajo.  Bappenas juga mengusulkan pusat data milik PT Telkom yang berlokasi di Serpong juga dapat dimanfaatkan karena memenuhi syarat untuk dijadikan PDN. ""Kedua, PDN di Batam ada penundaan sedikit tapi di sana Telkom punya yang kuncinya ada di sana, kemudian ketiga di IKN dan keempat di Labuan Bajo. Jadi itu sedang persiapan,"" katanya. Suharso menambahkan bahwa kewenangan PDN berada di Kementerian Komunikasi dan Informatika. Namun, Bappenas mengatur standarisasi data yang dikelola PDN. ""Kami hanya memberikan misalnya data referensinya seperti apa, metadata standarisasi seperti apa, itu yang tugas kami,"" tambah Suharso.  Sebagai informasi, PDN Cikarang didirikan dengan skema GtoG financing, dengan bantuan dari Pemerintah Prancis dengan pendanaan sebesar 164.679.680 Euro atau setara Rp 2,7 triliun.","Kepala Bappenas/Menteri Perencanaan Pembangunan Nasional Suharso Monoarfa mengatakan pihaknya tengah menyiapkan Pusat Data Nasional PDN di empat lokasi dengan standarisasi data center yang berada di bawah Bappenas. "" Selain Cikarang, tiga lokasi PDN yang disiapkan yaitu Batam, Ibu Kota Nusantara IKN, dan Labuan Bajo. Suharso menambahkan bahwa kewenangan PDN berada di Kementerian Komunikasi dan Informatika. Namun, Bappenas mengatur standarisasi data yang dikelola PDN. "" Sebagai informasi, PDN Cikarang didirikan dengan skema GtoG financing, dengan bantuan dari Pemerintah Prancis dengan pendanaan sebesar 164.679.680 Euro atau setara Rp 2,7 triliun."
ICW Sebut Orang-Orang Kompeten Trauma dengan Pelemahan KPK 2019,Nasional,2024-07-02,"Syakirun Ni'am, Ihsanuddin",https://nasional.kompas.com/read/2024/07/02/09190851/icw-sebut-orang-orang-kompeten-trauma-dengan-pelemahan-kpk-2019,"Indonesia Corruption Watch ICW menyebut sosoksosok yang mumpuni untuk menjadi calon pimpinan Komisi Pemberantasan Korupsi Capim KPK masih merasa trauma atas peristiwa 2019. Akibatnya, jumlah pendaftar capim KPK 20242029 masih minim. Peneliti ICW Kurnia Ramadhana mengatakan, saat itu KPK dilemahkan dan masyarakat dikelabui janji manis DPR RI dengan klaim akan memperkuat UndangUndang KPK. ""Ternyata berujung pada penggembosan lembaga tersebut, baik melalui Revisi UU KPK maupun pemilihan Pimpinan KPK,"" kata Kurnia dalam keterangannya kepada Kompas.com, Selasa 2 Juli 2024.  Tidak hanya itu, sosok yang dinilai kompeten itu juga tidak lagi percaya terhadap komitmen Presiden Joko Widodo Jokowi dalam memberantas korupsi. Terlebih nasib KPK dinilai tidak pasti pada pemerintahan Prabowo SubiantoGibran Rakabuming Raka mendatang. Karena itu, ICW meminta Panitia Seleksi Pansel Capim KPK gencar meminta figurfigur yang kompeten untuk mendaftar menjadi capim atau Dewan Pengawas KPK. ""Kami juga berharap Presiden Jokowi berbicara untuk menjamin serta menggaransi bahwa proses seleksi kali ini tidak akan lagi mengulangi kesalahan periode 2019 lalu,"" tutur Kurnia.  Sebelumnya, Wakil Ketua Pansel Capim KPK Arief Satria menyebut terdapat 10 orang yang mendaftar sebagai calon pimpinan lembaga antirasuah. Selain itu, terdapat 16 orang yang mendaftar sebagai calon anggota Dewan Pengawas KPK. Data tersebut berdasar pada rekap per 1 Juli 2024. ""Rekapitulasi pendaftaran per 1 Juli 2024, hingga pukul 10.00 WIB, ada 10 orang yang mendaftar sebagai Capim KPK,"" ujar Arief dalam keterangan tertulisnya kepada wartawan pada Senin 1 Juli 2024. Adapun masa jabatan pimpinan KPK saat ini akan berakhir pada Desember 2024 mendatang.","Indonesia Corruption Watch ICW menyebut sosoksosok yang mumpuni untuk menjadi calon pimpinan Komisi Pemberantasan Korupsi Capim KPK masih merasa trauma atas peristiwa 2019. Ternyata berujung pada penggembosan lembaga tersebut, baik melalui Revisi UU KPK maupun pemilihan Pimpinan KPK,"" kata Kurnia dalam keterangannya kepada Kompas.com, Selasa 2 Juli 2024. Tidak hanya itu, sosok yang dinilai kompeten itu juga tidak lagi percaya terhadap komitmen Presiden Joko Widodo Jokowi dalam memberantas korupsi. Terlebih nasib KPK dinilai tidak pasti pada pemerintahan Prabowo SubiantoGibran Rakabuming Raka mendatang. Sebelumnya, Wakil Ketua Pansel Capim KPK Arief Satria menyebut terdapat 10 orang yang mendaftar sebagai calon pimpinan lembaga antirasuah. Data tersebut berdasar pada rekap per 1 Juli 2024. "" Adapun masa jabatan pimpinan KPK saat ini akan berakhir pada Desember 2024 mendatang."
Masyarakat yang Dirugikan Peretasan PDN Diimbau Lapor ke Posko Daring,Nasional,2024-07-02,Aryo Putranto Saptohutomo,https://nasional.kompas.com/read/2024/07/02/07000091/masyarakat-yang-dirugikan-peretasan-pdn-diimbau-lapor-ke-posko-daring,"Masyarakat yang terdampak langsung dan dirugikan akibat aksi peretasan terhadap Pusat Data Nasional PDN Sementara disarankan melapor ke posko pengaduan daring online. Posko pengaduan daring itu dibuat oleh Southeast Asia Freedom of Expression Network SAFEnet. Posko pengaduan daring buat masyarakat bisa diakses melalui tautan disiapkan SAFEnet. Menurut keterangan SAFEnet, posko aduan dibuat bersama koalisi masyarakat sipil buat mendokumentasikan dampak peretasan PDN Sementara terhadap warga. Dampak dialami masyarakat akibat peretasan itu termasuk tidak bisa diaksesnya layanan publik dan situs kementerian/lembaga atau instansi menggunakan data dari PDN Sementara.  SAFEnet menjamin data masyarakat dihimpun melalui posko daring itu tidak akan digunakan buat hal lain tanpa persetujuan pemilik data. ""Semua data yang diberikan akan digunakan sebagai bahan advokasi. Data tidak akan digunakan untuk hal lain tanpa persetujuan pemilik data dan akan dihapus setelah selesai digunakan,"" tulis SAFEnet di laman posko aduan daring, Senin 1 Juli 2024. SAFEnet juga yang menggagas petisi supaya pemerintah mencopot Menteri Komunikasi dan Informatika Menkominfo Budi Arie Setiadi, lantaran dianggap tidak cermat dalam mengantisipasi peretasan PDN Sementara. Untuk diketahui, Pusat Data Nasional PDN mengalami serangan siber sejak Kamis 20 Juni 2024 dan belum pulih sepenuhnya.  Tim dari Kementerian Komunikasi dan Informatika Kemenkominfo, BSSN, Polri dan juga Telkom selaku pihak pengelola PDN, sudah berupaya mengembalikan datadata tersebut, tetapi tak berhasil. Pemerintah akhirnya mengaku gagal memulihkan datadata yang tersimpan di PDN. Kita berupaya keras melakukan recovery resource yang kita miliki. Yang jelas data yang sudah kena ransomware sudah tidak bisa kita recovery. Jadi sekarang menggunakan sumber daya yang masih kita miliki, ujar Direktur Network dan IT Solution Telkom Herlan Wijanarko, Rabu 26 Juni 2024.","Masyarakat yang terdampak langsung dan dirugikan akibat aksi peretasan terhadap Pusat Data Nasional PDN Sementara disarankan melapor ke posko pengaduan daring online. Posko pengaduan daring itu dibuat oleh Southeast Asia Freedom of Expression Network SAFEnet. Dampak dialami masyarakat akibat peretasan itu termasuk tidak bisa diaksesnya layanan publik dan situs kementerian/lembaga atau instansi menggunakan data dari PDN Sementara. Semua data yang diberikan akan digunakan sebagai bahan advokasi. Untuk diketahui, Pusat Data Nasional PDN mengalami serangan siber sejak Kamis 20 Juni 2024 dan belum pulih sepenuhnya. Pemerintah akhirnya mengaku gagal memulihkan datadata yang tersimpan di PDN. Kita berupaya keras melakukan recovery resource yang kita miliki. Yang jelas data yang sudah kena ransomware sudah tidak bisa kita recovery."
Pimpinan KPK Pertanyakan Otoritas Pengelola SDM Pegawai dari Instansi Lain,Nasional,2024-07-03,"Syakirun Ni'am, Krisiandi",https://nasional.kompas.com/read/2024/07/03/23053821/pimpinan-kpk-pertanyakan-otoritas-pengelola-sdm-pegawai-dari-instansi-lain,"Wakil Ketua Komisi Pemberantasan Korupsi KPK Nurul Ghufron mempertanyakan siapa pihak yang memiliki otoritas dalam memperpanjang atau memulangkan pegawai dari luar. Pernyataan tersebut Ghufron sampaikan saat dikonfirmasi terkait informasi KPK gagal memulangkan pejabat di Kedeputian Penindakan dan Eksekusi ke instansi asal. Indonesia Corruption Watch ICW menyebut, pejabat itu disinyalir menghambat banyak kasus korupsi di KPK.  Sebenarnya ini menjadi titik tolaknya kemudian siapa sih yang paling berotoritas untuk kemudian mengelola SDM sumber daya manusia tersebut, kata Ghufron saat ditemui awak media di KPK, Jakarta, Rabu 3 Juni 2024. Menurut Ghufron, pimpinan dan pejabat struktural KPK perlu membicarakan persoalan tata kelola SDM. Terutama menyangkut siapakah yang berhak memulangkan atau memperpanjang pegawai dari luar. Meski demikian, Ghufron menyebut dugaan bahwa pejabat tersebut menghambat kasus belum pasti. Di sisi lain, kata Ghufron, naik atau tidaknya suatu kasus menjadi penyidikan di KPK bergantung pada kecukupan alat bukti.  Tapi kalau kemudian ada yang begitu tetapi tidak, baru itu kemudian kami anggap ada masalah. Kami masih belum memiliki bukti untuk menyatakan seperti itu, ujar Ghufron, Sebelumnya, ICW menyebut KPK berencana memulangkan pejabat di Kedeputian Penindakan dan Eksekusi ke instansi asal. Namun, mereka gagal karena surat perpanjangan penugasan dari instansi tersebut sudah datang lebih dulu. ""Pejabat tersebut disinyalir memiliki permasalahan serius, khususnya berkenaan dengan upaya menghambat banyak perkara,"" kata Peneliti ICW, Diky Anandya dalam keterangannya kepada Kompas.com, Selasa 2 Juli 2024.  Belakangan, keberadaan pegawai KPK dari instansi luar menjadi sorotan setelah Wakil Ketua KPK Alexander Marwata mengungkapkan loyalitas ganda penyidik atau penyelidik. Persoalan itu tidak terlepas karena para pegawai tersebut masih berstatus pegawai di instansi asal mereka. Saya hanya menekankan ini sulitnya menjadi pimpinan KPK karena apa? Yaitu tadi saya enggak tahu penyelidik, penyidik, pegawai KPK itu loyal ke siapa, kata Alex saat rapat kerja dengan Komisi III DPR, Senin 1 Juli 2024","Wakil Ketua Komisi Pemberantasan Korupsi KPK Nurul Ghufron mempertanyakan siapa pihak yang memiliki otoritas dalam memperpanjang atau memulangkan pegawai dari luar. Sebenarnya ini menjadi titik tolaknya kemudian siapa sih yang paling berotoritas untuk kemudian mengelola SDM sumber daya manusia tersebut, kata Ghufron saat ditemui awak media di KPK, Jakarta, Rabu 3 Juni 2024. Tapi kalau kemudian ada yang begitu tetapi tidak, baru itu kemudian kami anggap ada masalah. Kami masih belum memiliki bukti untuk menyatakan seperti itu, ujar Ghufron, Sebelumnya, ICW menyebut KPK berencana memulangkan pejabat di Kedeputian Penindakan dan Eksekusi ke instansi asal. Namun, mereka gagal karena surat perpanjangan penugasan dari instansi tersebut sudah datang lebih dulu. "" Belakangan, keberadaan pegawai KPK dari instansi luar menjadi sorotan setelah Wakil Ketua KPK Alexander Marwata mengungkapkan loyalitas ganda penyidik atau penyelidik. Persoalan itu tidak terlepas karena para pegawai tersebut masih berstatus pegawai di instansi asal mereka. Saya hanya menekankan ini sulitnya menjadi pimpinan KPK karena apa?"
Kapuspen TNI Akan Minta Izin ke Panglima untuk Ubah Puspen Jadi Puskominfo,Nasional,2024-07-03,"Nirmala Maulana Achmad, Ardito Ramadhan",https://nasional.kompas.com/read/2024/07/03/20361391/kapuspen-tni-akan-minta-izin-ke-panglima-untuk-ubah-puspen-jadi-puskominfo,"Kepala Pusat Penerangan Kapuspen TNI Mayjen R Nugraha Gumilar akan meminta izin kepada Panglima TNI Jenderal Agus Subiyanto untuk mengubah nomenklatur Pusat Penerangan TNI menjadi Pusat Komunikasi dan Informasi Puskominfo TNI. Gumilar mengatakan, kajian perubahan nama yang dilakukan sejak tahun lalu itu telah rampung dan siap dilaporkan kepada Panglima Agus. Ini yang kami kaji semua sudah selesai, mudahmudahan ada waktu, kami akan sampaikan kepada pimpinan dan ini bisa direalisasikan, ujar Gumilar di Kompleks Puspen TNI, Rabu 3 Juli 2024. Gumilar menuturkan, staf Puspen TNI saat ini sedang menyempurnakan kajian perubahan nomenklatur tersebut.  Ia mengatakan, nomenklatur itu diubah untuk menunjukkan bahwa Puspen TNI juga mendengarkan informasi, bukan hanya memberikan informasi. Karena selama ini kan penerangan itu hanya sifatnya memberikan informasi ke bawah, tanpa kami mendengar informasi dari bawah ke kami, kata Gumilar. Ia berharap, perubahan itu turut mengubah arah komunikasi di Puspen menjadi dua arah. Dengan komunikasi dua arah ini kan seyogianya memang namanya menjadi Puskominfo, sehingga kami membuka diri apa yang menjadi kelemahan kami, tolong informasikan, ujar Gumilar.  Ia melanjutkan, perubahan nama tersebut tidak akan banyak mengubah struktur yang ada saat ini. Hanya saja, struktur Puskominfo nantinya akan disamakan selayaknya media massa. Apple to apple jabatan yang ada di kami sama dengan jabatan di pemimpin redaksi pemred atau media, sehingga hubungan di bawahnya lebih smooth, kata Kapuspen TNI.","Kepala Pusat Penerangan Kapuspen TNI Mayjen R Nugraha Gumilar akan meminta izin kepada Panglima TNI Jenderal Agus Subiyanto untuk mengubah nomenklatur Pusat Penerangan TNI menjadi Pusat Komunikasi dan Informasi Puskominfo TNI. Gumilar menuturkan, staf Puspen TNI saat ini sedang menyempurnakan kajian perubahan nomenklatur tersebut. Ia berharap, perubahan itu turut mengubah arah komunikasi di Puspen menjadi dua arah. Dengan komunikasi dua arah ini kan seyogianya memang namanya menjadi Puskominfo, sehingga kami membuka diri apa yang menjadi kelemahan kami, tolong informasikan, ujar Gumilar. Ia melanjutkan, perubahan nama tersebut tidak akan banyak mengubah struktur yang ada saat ini. Hanya saja, struktur Puskominfo nantinya akan disamakan selayaknya media massa."
"PDI-P Lirik Kaesang untuk Pilkada Jateng, PSI: Puan Tidak Baperan, Kami Siap Kerja Sama",Nasional,2024-07-03,"Adhyasta Dirgantara, Krisiandi",https://nasional.kompas.com/read/2024/07/03/20123431/pdi-p-lirik-kaesang-untuk-pilkada-jateng-psi-puan-tidak-baperan-kami-siap,"Juru Bicara Jubir Partai Solidaritas Indonesia PSI Sigit Widodo berterima kasih kepada Ketua DPP PDIP Puan Maharani yang melirik Ketua Umum PSI Kaesang Pangarep untuk maju di Pilkada Jawa Tengah Jateng 2024. Puan melirik Kaesang setelah putra Presiden Joko Widodo itu teratas pada survei Lembaga Survei Indonesia LSI. Menurutnya, Puan adalah politisi yang matang dan tidak baperan. Adapun Jateng merupakan wilayah yang selama ini dikenal sebagai 'kandang Banteng'. ""Tentu kami berterima kasih kepada Mbak Puan atas masuknya nama Mas Kaesang ke dalam daftar calon kepala daerah PDIP di Jawa Tengah. Ini menunjukkan Mbak Puan memang seorang politisi yang matang. Beliau mampu melihat persoalan secara komprehensif dan tidak baperan,"" ujar Sigit saat dimintai konfirmasi Kompas.com, Rabu 3 Juli 2024.  Sigit menjelaskan, pada prinsipnya, PSI siap bekerja sama dengan siapa pun di Pilkada Serentak 2024. Dia menegaskan PSI tidak menutup pintu untuk partai politik mana pun. ""Pada prinsipnya, PSI selalu siap bekerja sama dengan siapa pun di Pilkada 2024 dan tidak pernah menutup pintu kerja sama dengan partai manapun,"" tuturnya. Dihubungi terpisah, Jubir PSI Ariyo Bimmo mengatakan survei LSI memperlihatkan adanya keinginan masyarakat Jateng akan adanya figur muda politik seperti Kaesang.  Ariyo menyebutkan, PSI terbuka untuk melakukan komunikasi politik sambil terus berkoordinasi dengan rekanrekan di Koalisi Indonesia Maju KIM. ""Pada saat ini, para pimpinan partai politik tentu mempertimbangkan berbagai faktor dalam menentukan dukungan calon kepala daerah. Elektabilitas dan popularitas calon, pastinya merupakan pertimbangan penting,"" jelas Ariyo. ""Mbak Puan sebagai pimpinan parpol nasionalis pastinya juga melihat kepentingan dan konsolidasi politik nasional, sesuatu yang dibutuhkan untuk akselerasi pembangunan menuju Indonesia Emas. Doakan yang terbaik untuk Indonesia,"" imbuhnya. Sebelumnya, Ketua DPP PDIP Puan Maharani menyebutkan, Kaesang menjadi salah satu yang dipertimbangkan untuk Pemilihan Kepala Daerah Pilkada Jawa Tengah 2024.  Hal ini disampaikan Puan usai ditanya tentang hasil survei Lembaga Survei Indonesia LSI yang menempatkan Kaesang unggul sementara di Pilkada Jateng. Kaesang unggul dibandingkan Ketua DPD PDIP Jawa Tengah, Bambang Wuryanto alias Bambang Pacul. ""Enggak apaapa, bagus Kaesang,"" ujar Puan ditemui di Kompleks Parlemen Senayan, Jakarta, Selasa 2 Juli 2024. ""Apakah mungkin dipertimbangkan enggak sih Mas Kaesang?"" tanya wartawan ke Puan. ""Iya dong, jadi salah satu pertimbangan juga,"" jawabnya.","Juru Bicara Jubir Partai Solidaritas Indonesia PSI Sigit Widodo berterima kasih kepada Ketua DPP PDIP Puan Maharani yang melirik Ketua Umum PSI Kaesang Pangarep untuk maju di Pilkada Jawa Tengah Jateng 2024. Menurutnya, Puan adalah politisi yang matang dan tidak baperan. Beliau mampu melihat persoalan secara komprehensif dan tidak baperan,"" ujar Sigit saat dimintai konfirmasi Kompas.com, Rabu 3 Juli 2024. Dia menegaskan PSI tidak menutup pintu untuk partai politik mana pun. "" Ariyo menyebutkan, PSI terbuka untuk melakukan komunikasi politik sambil terus berkoordinasi dengan rekanrekan di Koalisi Indonesia Maju KIM. "" Elektabilitas dan popularitas calon, pastinya merupakan pertimbangan penting,"" jelas Ariyo. "" Doakan yang terbaik untuk Indonesia,"" imbuhnya. Sebelumnya, Ketua DPP PDIP Puan Maharani menyebutkan, Kaesang menjadi salah satu yang dipertimbangkan untuk Pemilihan Kepala Daerah Pilkada Jawa Tengah 2024. Hal ini disampaikan Puan usai ditanya tentang hasil survei Lembaga Survei Indonesia LSI yang menempatkan Kaesang unggul sementara di Pilkada Jateng. Apakah mungkin dipertimbangkan enggak sih Mas Kaesang?"" Iya dong, jadi salah satu pertimbangan juga,"" jawabnya."
