title,category,publish_date,author,article_url,content,summary
"Pasca-Peretasan, Aktivitas PDN Diawasi Langsung BSSN",Nasional,2024-07-02,Aryo Putranto Saptohutomo,https://nasional.kompas.com/read/2024/07/02/06450041/pasca-peretasan-aktivitas-pdn-diawasi-langsung-bssn,"Pemerintah menyatakan Badan Siber dan Sandi Negara BSSN semakin memperketat pengawasan terhadap Pusat Data Nasional PDN Sementara pascaperetasan ransomware. Menurut Menteri Koordinator Bidang Politik, Hukum, dan Keamanan Menko Polhukam Hadi Tjahjanto, BSSN bakal diberi jalur khusus buat mengawasi lalu lintas data pada PDN Sementara 2 terletak di Surabaya, Jawa Timur. Dengan cara menyambungkan ke komando kendali BSSN yang ada di Ragunan Jakarta Selatan, termasuk juga mengaktifkan CSIRT, Computer Security Incident Response Team, kata Hadi dalam rapat koordinasi di Kantor Kemenko Polhukam Jakarta, Senin 1 Juli 2024. Hadi menyampaikan, pemerintah juga mewajibkan kementerian/lembaga sampai instansi pemerintahan daerah menyediakan data cadangan sebanyak 3 sampai 4 lapis guna menghindari risiko data hilang jika terjadi peretasan.  Menurut Hadi, datadata kementerian/lembaga sampai instansi pemerintahan daerah yang sifatnya umum, seperti statistik dan sebagainya, bakal disimpan dalam fasilitas komputasi awan itu cloud. Back up tersebut kemudian juga akan kita back up dengan cloud cadangan. Cloud cadangan ini secara zonasi. Sehingga tidak penuh data yang ada di PDN,"" ujar Hadi. Hadi menyampaikan, PDN Sementara 2 di Surabaya, Jawa Timur, yang diretas diharapkan sudah bisa beroperasi kembali pada bulan ini. Layanan PDN Sementara juga akan dibantu melalui situs pendukung di Batam, Kepulauan Riau, sebagai antisipasi jika terjadi gangguan atau upaya peretasan.  Rapat koordinasi itu dilakukan bersama dengan Menteri Komunikasi dan Informatika Menkominfo Budi Arie Setiadi, Kepala Badan Sandi dan Siber Negara BSSN Hinsa Siburian, Kepala Staf Umum Kasum TNI Letjen Bambang Ismawan, serta Wakil Menteri Badan Usaha Milik Negara BUMN Kartika Wirjoatmodjo. Untuk diketahui, Pusat Data Nasional PDN mengalami serangan siber sejak Kamis 20 Juni 2024 dan belum pulih sepenuhnya. Tim dari Kementerian Komunikasi dan Informatika Kemenkominfo, BSSN, Polri, dan Telkom selaku pihak pengelola PDN sudah berupaya mengembalikan datadata tersebut, tetapi tak berhasil. Pemerintah akhirnya mengaku gagal memulihkan datadata yang tersimpan di PDN.  Kita berupaya keras melakukan recovery resource yang kita miliki. Yang jelas data yang sudah kena ransomware sudah tidak bisa kita recovery. Jadi sekarang menggunakan sumber daya yang masih kita miliki, ujar Direktur Network dan IT Solution Telkom Herlan Wijanarko, Rabu 26 Juni 2024.","Pemerintah menyatakan Badan Siber dan Sandi Negara BSSN semakin memperketat pengawasan terhadap Pusat Data Nasional PDN Sementara pascaperetasan ransomware. Dengan cara menyambungkan ke komando kendali BSSN yang ada di Ragunan Jakarta Selatan, termasuk juga mengaktifkan CSIRT, Computer Security Incident Response Team, kata Hadi dalam rapat koordinasi di Kantor Kemenko Polhukam Jakarta, Senin 1 Juli 2024. Hadi menyampaikan, pemerintah juga mewajibkan kementerian/lembaga sampai instansi pemerintahan daerah menyediakan data cadangan sebanyak 3 sampai 4 lapis guna menghindari risiko data hilang jika terjadi peretasan. Back up tersebut kemudian juga akan kita back up dengan cloud cadangan. Hadi menyampaikan, PDN Sementara 2 di Surabaya, Jawa Timur, yang diretas diharapkan sudah bisa beroperasi kembali pada bulan ini. Pemerintah akhirnya mengaku gagal memulihkan datadata yang tersimpan di PDN. Kita berupaya keras melakukan recovery resource yang kita miliki. Yang jelas data yang sudah kena ransomware sudah tidak bisa kita recovery."
"DPR Anggap Menag Salahi Aturan, Komisi VIII Dorong Pembentukan Pansus",Nasional,2024-07-02,"Adhyasta Dirgantara, Dani Prabowo",https://nasional.kompas.com/read/2024/07/02/06171071/dpr-anggap-menag-salahi-aturan-komisi-viii-dorong-pembentukan-pansus,"Wakil Ketua Komisi VII DPR sekaligus anggota Tim Pengawas Haji DPR 2024 Ace Hasan Syadzily mengatakan Kementerian Agama Kemenag telah melakukan perbuatan yang bertentangan dengan undangundang UU dan keputusan presiden Keppres terkait kebijakan alokasi tambahan kuota haji khusus. Melalui panitia khusus pansus yang akan segera dibentuk, Ace menyebut kebijakan ini akan didalami secara bersama. Pasalnya, pada 27 November 2023 silam, Komisi VIII DPR bersama Menteri Agama Menag Yaqut Cholil Qoumas menggelar rapat untuk membahas biaya penyelenggaraan ibadah haji tahun 2024.  Kala itu, kuota haji untuk Indonesia di tahun 2024 mencapai 221.000 orang. Lalu, Indonesia mendapat kuota tambahan 20.000, sehingga total kuota haji untuk jemaah Indonesia 2024 mencapai 241.000. Kemudian, jumlah kuota haji ini dibagi untuk haji reguler dan haji khusus. ""Di mana kuota diberikan 92 persen untuk jemaah reguler, dan 8 persen untuk jemaah khusus. Maka dengan demikian, maka kuota haji Indonesia tahun 2024 sebanyak 241 ribu ini untuk haji reguler 221.720 dan untuk haji khusus 19.280,"" ujar Ace dalam jumpa pers evaluasi ibadah haji 2024 di Gedung DPR, Senayan, Jakarta, Senin 1 Juli 2024. Beberapa bulan kemudian, atau tepatnya pada Februari 2024, Kemenag mengeluarkan kebijakan baru yang membagi kuota tambahan 20.000 menjadi dua bagian, yakni 10.000 untuk haji reguler dan 10.000 untuk haji khusus.  Ace menekankan kebijakan Kemenag itu tidak sesuai dengan kesepakatan yang pernah dicapai dalam rapat kerja Komisi VIII DPR dengan Menag, yang juga telah dituangkan dalam Keppres Nomor 06 Tahun 2024 tentang Biaya Penyelenggaraan Ibadah Haji Tahun 2024 yang terbit pada Januari 2024. Maka dari itu, kata Ace, keputusan Kemenag tersebut dinilai bertentangan dengan undangundang dan keputusan presiden. Ace menyebut pihaknya mempertanyakan kebijakan yang Kemenag buat, di mana kementerian pimpinan Yaqut Cholil Qoumas itu malah menambah kuota untuk jemaah haji khusus. ""Maka dengan demikian, langkah Kementerian Agama yang mengeluarkan kebijakan kuota tambahan tidak sesuai dengan keputusan rapat kerja Komisi VIII dengan Menteri Agama. Tentu ini menjadi sesuatu yang bertentangan dengan raker tersebut. Dan tentu ini bertentangan dengan undangundang dan keputusan presiden. Karena itu tentu kami timwas mempertanyakan tentang kebijakan tersebut,"" tuturnya.  Menurut Ace, pembagian kuota 50 persen untuk haji reguler dan 50 persen untuk haji khusus ini mencederai tujuan dari penambahan kuota tersebut. Dia menegaskan belum pernah ada penjelasan tegas mengenai pembagian tambahan kuota ini, meski Kemenag sudah mengklaim kebijakan itu dibuat atas permintaan pemerintah Arab Saudi. ""Namun yang perlu kami sampaikan bahwa hingga sejauh ini kami belum mendapatkan penjelasan yang tegas terkait dengan kebijakan tersebut. Nah, oleh karena itu, kami memandang bahwa persoalan pembagian kuota ini tentu harus kami dalami karena menyangkut dengan kepentingan jemaah, terutama jemaah haji yang reguler,"" kata Ace. Sementara itu, Ace mengatakan, Timwas Haji DPR berpandangan bahwa persoalan pembagian kuota ini harus didalami karena menyangkut kepentingan jemaah, terutama jamaah haji reguler yang telah menunggu puluhan tahun. Dia memberi contoh di Sulawesi Selatan, terdapat jemaah yang harus menunggu hingga 4548 tahun untuk ibadah haji. Ace berharap, kebijakan penambahan kuota untuk jemaah haji khusus bisa menjadi terang di pansus. ""Karena itu maka soal kuota non haji entah itu kuota ziarah maupun kuota multiple atau kuota umal atau kuotakuota lain di luar kuota haji yang kemudian dipersoalkan dalam proses penyelenggaraan ibadah haji, kami perlu dalami dan perlu diselesaikan,"" jelasnya. ""Karena bagaimanapun, hal tersebut menyangkut dengan perlindungan terhadap warga negara Indonesia di luar negeri,"" imbuh Ace.","Wakil Ketua Komisi VII DPR sekaligus anggota Tim Pengawas Haji DPR 2024 Ace Hasan Syadzily mengatakan Kementerian Agama Kemenag telah melakukan perbuatan yang bertentangan dengan undangundang UU dan keputusan presiden Keppres terkait kebijakan alokasi tambahan kuota haji khusus. Pasalnya, pada 27 November 2023 silam, Komisi VIII DPR bersama Menteri Agama Menag Yaqut Cholil Qoumas menggelar rapat untuk membahas biaya penyelenggaraan ibadah haji tahun 2024. Kala itu, kuota haji untuk Indonesia di tahun 2024 mencapai 221.000 orang. Maka dari itu, kata Ace, keputusan Kemenag tersebut dinilai bertentangan dengan undangundang dan keputusan presiden. Ace menyebut pihaknya mempertanyakan kebijakan yang Kemenag buat, di mana kementerian pimpinan Yaqut Cholil Qoumas itu malah menambah kuota untuk jemaah haji khusus. "" Maka dengan demikian, langkah Kementerian Agama yang mengeluarkan kebijakan kuota tambahan tidak sesuai dengan keputusan rapat kerja Komisi VIII dengan Menteri Agama. Dan tentu ini bertentangan dengan undangundang dan keputusan presiden. Karena itu tentu kami timwas mempertanyakan tentang kebijakan tersebut,"" tuturnya. Menurut Ace, pembagian kuota 50 persen untuk haji reguler dan 50 persen untuk haji khusus ini mencederai tujuan dari penambahan kuota tersebut. Namun yang perlu kami sampaikan bahwa hingga sejauh ini kami belum mendapatkan penjelasan yang tegas terkait dengan kebijakan tersebut. Sementara itu, Ace mengatakan, Timwas Haji DPR berpandangan bahwa persoalan pembagian kuota ini harus didalami karena menyangkut kepentingan jemaah, terutama jamaah haji reguler yang telah menunggu puluhan tahun. Dia memberi contoh di Sulawesi Selatan, terdapat jemaah yang harus menunggu hingga 4548 tahun untuk ibadah haji. Karena itu maka soal kuota non haji entah itu kuota ziarah maupun kuota multiple atau kuota umal atau kuotakuota lain di luar kuota haji yang kemudian dipersoalkan dalam proses penyelenggaraan ibadah haji, kami perlu dalami dan perlu diselesaikan,"" jelasnya. """
Kontras Sebut 7 Polisi Tewas dalam Konflik OPM di Papua Setahun Terakhir,Nasional,2024-07-02,"Singgih Wiryono, Dani Prabowo",https://nasional.kompas.com/read/2024/07/02/05341981/kontras-sebut-7-polisi-tewas-dalam-konflik-opm-di-papua-setahun-terakhir,"Komisi untuk Orang Hilang dan Korban Tindak Kekerasan Kontras menyebut ada tujuh anggota Polri yang menjadi korban eskalasi konflik dengan Organisasi Papua Merdeka OPM di Papua selama setahun terakhir. Kontras mencatat, dalam periode Juli 2023Juni 2024, terdapat 35 peristiwa konflik antara aparat dengan OPM, 10 di antaranya melibatkan anggota Polri. ""Peristiwa konflik tersebut mengakibatkan 13 korban luka dan 46 korban tewas, tujuh di antaranya merupakan anggota kepolisian,"" ujar Koordinator Kontras Dimas Bagus Arya dalam konferensi pers laporan Bhayangkara 2024, di Kantor Kontras, Kwitang, Jakarta Pusat, Senin 1 Juli 2024.  Jatuhnya korban baik dari kubu OPM, sipil dan aparat dinilai sebagai bentuk kebijakan pendekatan keamanan bersenjata yang kurang tepat. Pendekatan ini dinilai Dimas tidak menjadi solusi, atas keberulangan konflik bersenjata di Papua. Hal itu terlihat dari anggota Polri yang terlibat konflik berasal dari Korps Brigade Mobil Brimob yang dikenal sebagai satuan paramiliter kepolisian. ""Kepolisian seharusnya mengedepankan proses penegakkan hukum sesuai dengan aturan yang berlaku dalam menghadapi situasi di tanah Papua dibandingkan pendekatan paramiliter bersenjata,"" tuturnya.  Selain itu, terlihat juga dualisme antara TNI dan Polri dalam menangani gerakan insurgensi yang terjadi di Papua. Panglima TNI telah menetapkan nama OPM pada gerakan separatisme di Papua, namun Polri masih menggunakan terminologi lama yakni Kelompok Kriminal Bersenjata KKB. ""Fenomena ini pun terlihat semacam perebutan klaim entitas mana yang paling bertanggungjawab dalam mengatasi konflik di Papua,"" ucapnya. Dimas menilai, perbedaan pendekatan antara Polri dan TNI ini justru akan membuat konflik internal baru yang menyebabkan Tanah Papua semakin karut.","Komisi untuk Orang Hilang dan Korban Tindak Kekerasan Kontras menyebut ada tujuh anggota Polri yang menjadi korban eskalasi konflik dengan Organisasi Papua Merdeka OPM di Papua selama setahun terakhir. Kontras mencatat, dalam periode Juli 2023Juni 2024, terdapat 35 peristiwa konflik antara aparat dengan OPM, 10 di antaranya melibatkan anggota Polri. "" Jatuhnya korban baik dari kubu OPM, sipil dan aparat dinilai sebagai bentuk kebijakan pendekatan keamanan bersenjata yang kurang tepat. Pendekatan ini dinilai Dimas tidak menjadi solusi, atas keberulangan konflik bersenjata di Papua. Kepolisian seharusnya mengedepankan proses penegakkan hukum sesuai dengan aturan yang berlaku dalam menghadapi situasi di tanah Papua dibandingkan pendekatan paramiliter bersenjata,"" tuturnya. Selain itu, terlihat juga dualisme antara TNI dan Polri dalam menangani gerakan insurgensi yang terjadi di Papua."
Anggota DPR Harap Pemecatan Hasyim Asy'ari Jadi Pelajaran bagi Anggota KPU di Daerah,Nasional,2024-07-03,Novianti Setuningsih,https://nasional.kompas.com/read/2024/07/03/23210431/anggota-dpr-harap-pemecatan-hasyim-asyari-jadi-pelajaran-bagi-anggota-kpu-di,"Pemberhentian Hasyim Asyari dari jabatannya sebagai Ketua Komisi Pemilihan Umum KPU disebut harus menjadi pelajaran bagi komisioner KPU di provinsi hingga kabupaten/kota. Diketahui, Dewan Kehormatan Penyelenggara Pemilu DKPP menjatuhkan sanksi pemberhentian tetap karena Hasyim Asyari terbukti melakukan perbuatan asusila terhadap seorang perempuan anggota Panitia Pemilihan Luar Negeri PPLN Den Haag, Belanda. Anggota Komisi II DPR RI Guspardi Gaus menegaskan bahwa posisi atau jabatan sebagai anggota KPU di pusat maupun daerah, merupakan posisi figur publik sehingga setiap perilakunya bakal disorot oleh masyarakat luas. Oleh karena itu, semua anggota KPU harus menjaga perilakunya dengan baik. Apalagi, Hasyim Asyari dipecat karena terbukti melakukan perbuatan asusila. ""Bagi KPU Kabupaten, Kota, Provinsi, agar hatihati dalam bertindak, bertutur kata, dan lain sebagainya, kata Guspardi dikutip dari Antaranews, Rabu 3 Juli 2024.  Lebih lanjut, dia mengatakan, pemberhentian Ketua KPU RI itu tidak akan berdampak bagi pelaksanaan Pemilihan Kepala Daerah Pilkada 2024. Sebab, KPU pusat hanya bertindak sebagai koordinator dalam pelaksanaan pilkada. ""Pilkada kabupaten atau provinsi itu kan tanggung jawabnya di KPU daerah, kemudian bahwa kerja dari komisioner ini kan kolektif kolegial, ujar Guspardi. Selain itu, menurut dia, anggaran pelaksanaan pilkada di suatu daerah, salah satunya bersumber dari hibah pemerintah daerah. Dengan begitu, dia berharap, pemberhentian Hasyim Asyari sebagai Ketua KPU RI jangan sampai mengganggu kinerja KPU di seluruh daerah di Indonesia. Guspardi lantas menyebut, Komisi II DPR RI bakal mendorong agar Presiden Joko Widodo Jokowi bisa secepatnya menanggapi keputusan DKPP tersebut.  Sebagaimana diberitakan, DKPP menjatuhkan sanksi pemberhentian tetap terhadap Hasyim Asyari dari jabatannya sebagai Ketua KPU RI. Sebab, Hasyim Asyari dinyatakan terbukti melakukan pelanggaran kode etik penyelenggara pemilu KEPP karena melakukan tindakan asusila terhadap seorang perempuan anggota PPLN Den Haag, Belanda. ""Menjatuhkan sanksi pemberhentian tetap kepada teradu Hasyim Asy'ari selaku ketua merangkap anggota komisioner KPU terhitung sejak putusan ini dibacakan, kata Ketua DKPP Heddy Lugito dalam sidang, Rabu, 3 Juli 2024. Dalam putusan itu juga, DKPP meminta Presiden Joko Widodo Jokowi untuk melaksanakan putusan DKPP paling lambat 7 hari sejak putusan dibacakan. Dalam pertimbangannya, DKPP menilai Hasyim Asyari menggunakan relasi kuasa dalam melakukan perbuatan asusila tersebut. ","Pemberhentian Hasyim Asyari dari jabatannya sebagai Ketua Komisi Pemilihan Umum KPU disebut harus menjadi pelajaran bagi komisioner KPU di provinsi hingga kabupaten/kota. Oleh karena itu, semua anggota KPU harus menjaga perilakunya dengan baik. Sebab, KPU pusat hanya bertindak sebagai koordinator dalam pelaksanaan pilkada. "" Pilkada kabupaten atau provinsi itu kan tanggung jawabnya di KPU daerah, kemudian bahwa kerja dari komisioner ini kan kolektif kolegial, ujar Guspardi. Selain itu, menurut dia, anggaran pelaksanaan pilkada di suatu daerah, salah satunya bersumber dari hibah pemerintah daerah. Dengan begitu, dia berharap, pemberhentian Hasyim Asyari sebagai Ketua KPU RI jangan sampai mengganggu kinerja KPU di seluruh daerah di Indonesia. Guspardi lantas menyebut, Komisi II DPR RI bakal mendorong agar Presiden Joko Widodo Jokowi bisa secepatnya menanggapi keputusan DKPP tersebut. Sebab, Hasyim Asyari dinyatakan terbukti melakukan pelanggaran kode etik penyelenggara pemilu KEPP karena melakukan tindakan asusila terhadap seorang perempuan anggota PPLN Den Haag, Belanda. "" Dalam putusan itu juga, DKPP meminta Presiden Joko Widodo Jokowi untuk melaksanakan putusan DKPP paling lambat 7 hari sejak putusan dibacakan."
Menakar Nasib PKS jika Duet Anies-Sohibul Iman Tak Bisa Berlayar pada Pilkada Jakarta,Nasional,2024-07-03,Novianti Setuningsih,https://nasional.kompas.com/read/2024/07/03/20164051/menakar-nasib-pks-jika-duet-anies-sohibul-iman-tak-bisa-berlayar-pada,"Pengamat politik Universitas Al Azhar Indonesia, Ujang Komarudin menyebut bahwa Partai Keadilan Sejahtera blunder karena secara sepihak mendeklarasikan Anies Baswedan berpasangan dengan kader mereka Sohibul Iman untuk diusung pada Pemilihan Kepala Daerah Pilkada Jakarta 2024. Oleh karena itu, dia menilai wajar bahwa duet AniesSohibul Iman mendapatkan resistensi dari partai politik parpol lain yang sebelumnya juga melirik Anies, seperti Partai Kebangkitan Bangsa PKB dan Partai Demokrasi Indonesia Perjuangan PDIP. Sehingga, muncul wacana memasangan Anies Baswedan dengan kader PDIP Andika Perkasa pada Pilkada Jakarta. Duet tersebut bahkan diakui sudah dibahas PKB bersama PDIP. Menurut Ujang, PKS pada akhirnya harus legawa jika duet AniesSohibul Iman tidak berlayar karena tidak mendapatkan dukungan dari parpol lain. Mengingat, perolehan kursi PKS di DPRD Jakarta pada Pemilihan Legislatif Pileg 2024 belum memenuhi syarat untuk bisa mengajukan calon gubernur dan wakil gubernur sendiri.  Di sisi lain, dia mengatakan, muncul wacana dari PKB dan PDIP untuk menduetkan Anies Baswedan dengan Andika Perkasa pada Pilkada Jakarta 2024. Terpaksa kalau PKS tidak ada koalisinya, ya tidak bisa berlayar AniesSohibul Iman, suka tidak suka senang tidak senang harus mendukung pasangan AniesAndika, kata Ujang kepada Kompas.com, Selasa 2 Juli 2024. Dia mengatakan, itu adalah konsekuensi dari keputusan politik yang terburuburu dari PKS. Padahal, belum memiliki koalisi tetapi sudah mendeklarasikan pasangan AniesSohibul Iman. Itu konsekuensi dari politik yang terlalu terburuburu, menyerobot memasangkan paket AniesSohibul Iman. Koalisinya belum cukup, kekuatannya belum terpenuhi tahutahu sudah mempaketkan, ujar Ujang. Oleh karena itu, Ujang sekali lagi menyebut bahwa PKS tidak memiliki pilihan selain mendukung pasangan calon gubernur dan wakil gubernur yang mungkin bakal diusung oleh PKB dan PDIP. Kalau PKB dan PDIP setuju AniesAndika berlayar, ya nasib PKS akan ditinggalkan. Suka tidak suka musti mendukung AniesAndika kan begitu, katanya.  Namun, selain mengajak PKB berkoalisi pada Pilkada Jakarta, PKS juga mengaku sudah berkomunikasi dengan Partai Nasdem saat mendeklarasikan pasangan AniesSohibul Iman pada 25 Juni 2024. Presiden PKS Ahmad Syaikhu menyebut, komunikasi dengan Partai Nasdem sudah dilakukan sebelum deklarasi pengusungan AniesSohibul Iman. Sejumlah elite PKS diketahui memang bertemu dengan Ketua Umum Partai Nasdem Surya Paloh dua hari sebelum mengusung Sohibul Iman di Pilkada Jakarta 2024. ""Iya, sangat mungkin berkoalisi. Kalau kita tadi akan mengajak berbagai partai, juga yang lain untuk mengusung pasangan ini,"" kata Ahmad Syaikhu di Grand Sahid Jaya, Jakarta Pusat pada 25 Juni 2024. Syaikhu menyebut, PKS perlu koalisi dengan partai lain untuk mengusung calon gubernur dan wakil gubernur di Jakarta, karena partainya masih kekurangan kursi. ","Pengamat politik Universitas Al Azhar Indonesia, Ujang Komarudin menyebut bahwa Partai Keadilan Sejahtera blunder karena secara sepihak mendeklarasikan Anies Baswedan berpasangan dengan kader mereka Sohibul Iman untuk diusung pada Pemilihan Kepala Daerah Pilkada Jakarta 2024. Sehingga, muncul wacana memasangan Anies Baswedan dengan kader PDIP Andika Perkasa pada Pilkada Jakarta. Duet tersebut bahkan diakui sudah dibahas PKB bersama PDIP. Menurut Ujang, PKS pada akhirnya harus legawa jika duet AniesSohibul Iman tidak berlayar karena tidak mendapatkan dukungan dari parpol lain. Dia mengatakan, itu adalah konsekuensi dari keputusan politik yang terburuburu dari PKS. Koalisinya belum cukup, kekuatannya belum terpenuhi tahutahu sudah mempaketkan, ujar Ujang. Oleh karena itu, Ujang sekali lagi menyebut bahwa PKS tidak memiliki pilihan selain mendukung pasangan calon gubernur dan wakil gubernur yang mungkin bakal diusung oleh PKB dan PDIP. Suka tidak suka musti mendukung AniesAndika kan begitu, katanya. Namun, selain mengajak PKB berkoalisi pada Pilkada Jakarta, PKS juga mengaku sudah berkomunikasi dengan Partai Nasdem saat mendeklarasikan pasangan AniesSohibul Iman pada 25 Juni 2024. Kalau kita tadi akan mengajak berbagai partai, juga yang lain untuk mengusung pasangan ini,"" kata Ahmad Syaikhu di Grand Sahid Jaya, Jakarta Pusat pada 25 Juni 2024."
KPAI Desak Kapolri Ungkap Kasus Kematian Afif Maulana Secara Transparan,Nasional,2024-07-03,"Singgih Wiryono, Ardito Ramadhan",https://nasional.kompas.com/read/2024/07/03/19240971/kpai-desak-kapolri-ungkap-kasus-kematian-afif-maulana-secara-transparan,"Komisi Perlindungan Anak Indonesia KPAI mendesak Kapolri Jenderal Listyo Sigit Prabowo untuk mengungkap kasus kematian Afif Maulana yang diduga dianiaya polisi secara transparan. Komisioner KPAI Dian Sasmita mengatakan, ada belasan anak termasuk Afif yang diduga ikut disiksa oleh anggota Polsek Kuranji, Kota Padang. ""KPAI mendesak Kepala Kepolisian RI untuk mengedepankan penghormatan dan perlindungan hak asasi anak, dengan bersikap tegas dan profesional dalam mengungkap kasus 11 anak dan meninggalnya AM Afif Maulana,"" ujar Dian dalam keterangan pers, Rabu 3 Juli 2024. Dian menyebutkan, ada beberapa cara yang bisa dilakukan untuk membuat titik terang kasus penyiksaan Afif terswebut.  Menurut dia, polisi bisa menggunakan buktibukti ilmiah saat melakukan ekshumasi pada jasad Afif dan digital forensik dari CCTV sekitar tempat kejadian perkara. ""Sehingga penegakan hukum pidana dapat dilakukan terhadap pelaku penyiksaan anak,"" kata Dian. Di sisi lain, KPAI juga mendorong dan mendukung Lembaga Perlindungan Saksi Korban LPSK dan Kementerian Perlindungan Perempuan dan Anak KPPPA untuk memberikan perlindungan 11 anak yang ikut jadi korban penyiksaan. Selain itu, KPAI juga meminta Polri unutk membenahi tata kelola penanganan kasus yang melibatkan anak di semua direktorat di bawah Polri. ""Tidak hanya Reskrim, namun juga Sabhara dan lainnya. Hentikan penyiksaan hari ini. Ungkap dan hukum pelaku,"" ujar dia.  Sebelumnya, Kapolda Sumbar Irjen Pol Suharyono menyebutkan kasus kematian siswa SMP berinisial AM 12 di sungai Batang Kuranji Padang dianggap sudah selesai. Kasus tersebut bisa dibuka kembali jika ada bukti baru. Suharyono mengatakan pihaknya menduga AM tewas jatuh ke sungai dan berbenturan dengan benda keras yang menyebabkan tulang iganya patah. Hasil otopsi memperlihatkan adanya patah tulang iga belakang bagian kiri sebanyak 6 ruas dan patahannya merobek paruparu. ""Penyebab kematiannya adalah karena patah tulang iga dan merobek paruparu itu,"" kata Suharyono kepada wartawan di Mapolda Sumbar, Minggu 30 Juni 2024. Sementara itu, hasil investigasi LBH Padang menduga Afif dianiaya sebelum tewas dengan bukti lukaluka lebam di tubuh korban.","Komisi Perlindungan Anak Indonesia KPAI mendesak Kapolri Jenderal Listyo Sigit Prabowo untuk mengungkap kasus kematian Afif Maulana yang diduga dianiaya polisi secara transparan. KPAI mendesak Kepala Kepolisian RI untuk mengedepankan penghormatan dan perlindungan hak asasi anak, dengan bersikap tegas dan profesional dalam mengungkap kasus 11 anak dan meninggalnya AM Afif Maulana,"" ujar Dian dalam keterangan pers, Rabu 3 Juli 2024. Dian menyebutkan, ada beberapa cara yang bisa dilakukan untuk membuat titik terang kasus penyiksaan Afif terswebut. Tidak hanya Reskrim, namun juga Sabhara dan lainnya. Kasus tersebut bisa dibuka kembali jika ada bukti baru. Suharyono mengatakan pihaknya menduga AM tewas jatuh ke sungai dan berbenturan dengan benda keras yang menyebabkan tulang iganya patah. Penyebab kematiannya adalah karena patah tulang iga dan merobek paruparu itu,"" kata Suharyono kepada wartawan di Mapolda Sumbar, Minggu 30 Juni 2024. Sementara itu, hasil investigasi LBH Padang menduga Afif dianiaya sebelum tewas dengan bukti lukaluka lebam di tubuh korban."
