title,category,publish_date,author,article_url,content,summary
"Siap Dilangkahi Aaliyah Massaid, Zahwa Ternyata Pernah Bicara Soal Jodoh ke Reza Artamevia",Entertainment,2024-07-23,Yohanes Endra,https://www.suara.com/entertainment/2024/07/23/163316/siap-dilangkahi-aaliyah-massaid-zahwa-ternyata-pernah-bicara-soal-jodoh-ke-reza-artamevia,"Reza Artamevia buka suara mengenai Zahwa Massaid yang bakal dilangkahi menikah oleh adiknya, Aaliyah Massaid. Menurutnya itu bukan menjadi perkara besar untuk seorang Zahwa bila adiknya, Aaliyah Massaid menikah terlebih dahulu. “Aaliyah happy dengan rencana mau menikah. Insya Allah kita doain. Dan Zahwa juga happy dengan rencana dia, dengan kehidupan dia,"" ujar Reza. Pelantun lagu ""Keabadian"" itu mengaku Zahwa pernah berucap dirinya tidak mau menikah di usianya yang masih muda.""Dari dulu dia (Zahwa) udah bilang 'Kayaknya aku nggak mau nikah cepat-cepat kayaknya Aaliyah duluan',"" terang Reza. Reza pun memastikan seluruh keluarga besarnya mengaku bahagia menyambut acara pernikahan Aaliyah Massaid dan Thariq Halilintar. ""Jadi gitu. So it’s not a big deal. Kita semua happy,” tutur Reza Artamevia. Seperti diketahui Aaliyah Massaid dan Thariq Halilintar dalam waktu bakal menggelar pernikahan. Kabarnya acara pernikahan mereka bakal digelar di akhir bulan Juli. Namun belum lama ini Ketua MPR, Bambang Soesatyo mengungkap bila pernikahan Thariq dan Aaliyah digelar di bulan Agustus.Bahkan lelaki 61 tahun itu sudah ditunjuk Thariq Halilintar sebagai saksi pernikahan.","Reza Artamevia buka suara mengenai Zahwa Massaid yang bakal dilangkahi menikah oleh adiknya, Aaliyah Massaid. Dan Zahwa juga happy dengan rencana dia, dengan kehidupan dia,"" ujar Reza. ""Dari dulu dia (Zahwa) udah bilang 'Kayaknya aku nggak mau nikah cepat-cepat kayaknya Aaliyah duluan',"" terang Reza. Reza pun memastikan seluruh keluarga besarnya mengaku bahagia menyambut acara pernikahan Aaliyah Massaid dan Thariq Halilintar. "" Kabarnya acara pernikahan mereka bakal digelar di akhir bulan Juli. Bahkan lelaki 61 tahun itu sudah ditunjuk Thariq Halilintar sebagai saksi pernikahan."
"9 Artis yang Gelar Pernikahan di Bulan Agustus Seperti Thariq Halilintar, Ada yang Nyaris Cerai Dua Kali",Entertainment,2024-07-23,Galih Priatmojo,https://www.suara.com/entertainment/2024/07/23/153801/9-artis-yang-gelar-pernikahan-di-bulan-agustus-seperti-thariq-halilintar-ada-yang-nyaris-cerai-dua-kali,"Setelah menggelar lamaran pada 23 Juni 2024 lalu, Thariq Halilintar dan Aaliyah Massaid menggelar serangkaian prosesi adat jelang pernikahan yang sedianya akan digelar pada bulan Agustus mendatang. Diketahui sebulan sebelum melangsungkan pernikahan, Thariq Halilintar dan Aaliyah Massaid menggelar acara pengajian dan siraman yang dihelat di Hotel Tentrem, Jakarta. Thariq dan Aaliyah diketahui bakal melangsungkan pernikahan di bulan Agustus. Kepastian jadwal tersebut sempat dibocorkan Ketua MPR Bambang Soesatyo yang didapuk sebagai saksi di pernikahan mereka. Selain sakral sebagai bulan kelahiran Indonesia, nyatanya bulan Agustus juga banyak dipilih oleh sejumlah artis dan selebriti untuk melangsungkan pernikahan.Berikut deretan artis dan selebritis yang menikah di bulan Agustus selain Thariq Halilintar 1. Tya Ariestya Artis yang sempat menghiasi di sejumlah FTV ini resmi menikah dengan Irfan Ratingga tepat pada hari Kemerdekaan Indonesia yakni 17 Agustus 2014 silam. Mereka melangsungkan pernikahan di Jalan Gunung Indah V Kampung Gunung Residence C/6 Ciputat, Tangerang Selatan. 2. Melissa KarimPenyiar radio yang juga artis Melissa Karim mengakhiri masa lajangnya usai dinikahi seorang rapper Edry March Sukardi. Melissa diketahui dilamar sang kekasih pada Mei 2018 silam di Barcelona. Tiga bulan berselang tepatnya pada 19 Agustus, keduanya melangsungkan pernikahan. 3. Asta Handoko Gitaris dari band RAN, Asta Handoko resmi menikahi kekasihnya Nurul Aziza pada Agustus 2019. Keduanya resmi naik pelaminan setelah menjalin asmara selama 10 tahun lamanya. Kabar bahagia itu sempat dibagikan sahabatnya yang juga rekan satu band, Nino melalui instagram @ranforyourlife. 4. Glenn Fredly Penyanyi RnB, Glenn Fredly mengakhiri masa dudanya dengan menikahi Mutia Ayu setelah sempat menjalin asmara dengan Aura Kasih. Glenn dan Mutia Ayu melangsungkan pernikahan secara tertutup pada Agustus 2019 silam. Mereka kemudian menggelar resepsi di Taman Kajoe, Ampera, Jakarta Selatan pada Senin 19 Agustus. 5. Rio Dewanto Aktor bertalenta Rio Dewanto akhirnya resmi menikah dengan Atiqah Hasiholan setelah sempat menjalin asmara selama 3,5 tahun. Keduanya menikah pada 24 Agustus 2013 di Benteng Martello, Kepulaua Seribu, Jakarta. Selama 11 tahun menikah, keduanya telah dikarunia seorang anak. 6. Judika Penyanyi Judika diketahui juga melangsungkan pernikahan pada bulan Agustus. Judika menikahi Puteri Indonesia 2007 Duma Riris pada 31 Agustus 2013 yang dilangsungkan di dua tempat yakni di Medan dan Jakarta. Momen itu makin spesial lantaran pernikahan digelar tepat di hari ulang tahun Judika. 7. Lulu Tobing Artis senior Lulu Tobing yang pernah kondang lewat sinetron Tersanjung diketahui menikah dengan pengusaha bernama Bani M Mulia. Pernikahan yang digelar pada bulan Agustus 2019 silam tersebut berlangsung secara tertutup. Beberapa waktu kemudian, Lulu sempat membagikan kabar bahagia tersebut melalui unggahan di akun Instagramnya dan meminta doa untuk kelanggengan pernikahannya. Yang mengejutkan, dua tahun setelah menikah, Lulu dan Bani Mulia nyaris cerai. Tak hanya sekali, Lulu sempat dua kali mengajukan gugatan cerai namun akhirnya batal dan biduk rumah tangganya tetap bertahan hingga sekarang. 8. Kartika Putri Artis yang sempat mendapat imej seksi ini diketahui telah menikah dengan Habib Usman bin Yahya. Kartika Putri yang telah menjalani hijrah menikah dengan Habib Usman bin Yahya di tanah suci Mekkah pada 26 Agustus 2018 silam. 9. Roger Danuarta Setelah menjalani lika-liku hubungan, Roger Danuarta akhirnya resmi menikahi Cut Meyriska. Pernikahan mereka berlangsung di Masjid Nurul Huda, Medan, Sumatera utara pada 17 Agustus 2019. Sepekan setelah menggelar akad nikah di Medan, Cut Meyriska dan Roger Danuarta menggelar resepsi di Ritz Carlton, SCBD, Jakarta Selatan pada 25 Agustus 2019.","Setelah menggelar lamaran pada 23 Juni 2024 lalu, Thariq Halilintar dan Aaliyah Massaid menggelar serangkaian prosesi adat jelang pernikahan yang sedianya akan digelar pada bulan Agustus mendatang. Diketahui sebulan sebelum melangsungkan pernikahan, Thariq Halilintar dan Aaliyah Massaid menggelar acara pengajian dan siraman yang dihelat di Hotel Tentrem, Jakarta. Selain sakral sebagai bulan kelahiran Indonesia, nyatanya bulan Agustus juga banyak dipilih oleh sejumlah artis dan selebriti untuk melangsungkan pernikahan. Tya Ariestya Artis yang sempat menghiasi di sejumlah FTV ini resmi menikah dengan Irfan Ratingga tepat pada hari Kemerdekaan Indonesia yakni 17 Agustus 2014 silam. Melissa KarimPenyiar radio yang juga artis Melissa Karim mengakhiri masa lajangnya usai dinikahi seorang rapper Edry March Sukardi. Melissa diketahui dilamar sang kekasih pada Mei 2018 silam di Barcelona. Tiga bulan berselang tepatnya pada 19 Agustus, keduanya melangsungkan pernikahan. Keduanya resmi naik pelaminan setelah menjalin asmara selama 10 tahun lamanya. Kabar bahagia itu sempat dibagikan sahabatnya yang juga rekan satu band, Nino melalui instagram @ranforyourlife. Mereka kemudian menggelar resepsi di Taman Kajoe, Ampera, Jakarta Selatan pada Senin 19 Agustus. Selama 11 tahun menikah, keduanya telah dikarunia seorang anak. Momen itu makin spesial lantaran pernikahan digelar tepat di hari ulang tahun Judika. Pernikahan yang digelar pada bulan Agustus 2019 silam tersebut berlangsung secara tertutup. Beberapa waktu kemudian, Lulu sempat membagikan kabar bahagia tersebut melalui unggahan di akun Instagramnya dan meminta doa untuk kelanggengan pernikahannya. Yang mengejutkan, dua tahun setelah menikah, Lulu dan Bani Mulia nyaris cerai. Kartika Putri Artis yang sempat mendapat imej seksi ini diketahui telah menikah dengan Habib Usman bin Yahya. Roger Danuarta Setelah menjalani lika-liku hubungan, Roger Danuarta akhirnya resmi menikahi Cut Meyriska."
"Pakai Baju Sopan saat Nge-DJ, Bagian Tubuh Nathalie Holscher Bikin Khawatir",Entertainment,2024-07-23,Ferry Noviandi,https://www.suara.com/entertainment/2024/07/23/150500/pakai-baju-sopan-saat-nge-dj-bagian-tubuh-nathalie-holscher-bikin-khawatir,"Nathalie Holscher belum lama ini manggung sebagai DJ di salah satu klub malam di Lampung. Penampilan janda komedian Sule itu menjadi omongan publik karena baju yang dipakainya. Female DJ yang identik dengan baju seksi dan terbuka, tetapi Nathalie Holscher berbeda. Nathalie tampak tetap mengenakan kaos putih pendek sebelum memakai jumpsuit. Bahkan celananya juga panjang dan tak ketat. Ibu satu anak itu pun menuai sanjungan warganet karena meski kini kembali ke dunia malam, tetapi dia tetap sopan dalam berpakaian. ""Tetap pakai baju yang elegan-elegan ya Bunn, anggun sekali,"" kata seorang warganet menyanjung.""Senang lihatnya, biarpun jadi DJ tapi pakaiannya masih sopan,"" komentar warganet lain. ""Cuma dia doang DJ pakaiannya patut dicontoh dj lain,"" imbuh warganet yang lain. ""Memang boleh DJ sesopan ini berpakaian? Salut euyy sama Kak Natalie dalam menjaga marwah diri,"" kata yang lain memeuji. Namun dari banyak komentar positif, ada juga yang penasaran dengan bagian lengan Nathalie Holscher. ""Salfok sama lengannya, kayak lebam enggak sih? Apa gimana ya?"" komentar warganet. ""Tanganya kok memar gitu?"" warganet yang lain khawatir.Seperti diketahui, Nathalie Holscher kembali menggeluti dunia DJ setelah cerai dengan Sule 10 Agustus 2023. Hal ini dengan alasan, dirinya tetap harus mencari uang sendiri untuk membesarkan putranya meski juga mendapatkan uang bulanan dari mantan suami. Dia yang dulunya sudah berhijab pun akhirnya memutuskan untuk melepasnya. Kontributor : Tinwarotul Fatonah","Nathalie Holscher belum lama ini manggung sebagai DJ di salah satu klub malam di Lampung. Penampilan janda komedian Sule itu menjadi omongan publik karena baju yang dipakainya. Female DJ yang identik dengan baju seksi dan terbuka, tetapi Nathalie Holscher berbeda. Nathalie tampak tetap mengenakan kaos putih pendek sebelum memakai jumpsuit. Bahkan celananya juga panjang dan tak ketat. ""Senang lihatnya, biarpun jadi DJ tapi pakaiannya masih sopan,"" komentar warganet lain. "" Hal ini dengan alasan, dirinya tetap harus mencari uang sendiri untuk membesarkan putranya meski juga mendapatkan uang bulanan dari mantan suami. Dia yang dulunya sudah berhijab pun akhirnya memutuskan untuk melepasnya."
"Diundang Acara TV, Cara Duduk Saaih Halilintar Digunjing Gak Ada Adab: Serasa di Rumah",Entertainment,2024-07-23,Yazir Farouk,https://www.suara.com/entertainment/2024/07/23/144401/diundang-acara-tv-cara-duduk-saaih-halilintar-digunjing-gak-ada-adab-serasa-di-rumah,"Saaih Halilintar kembali menjadi omongan publik karena tingkahnya. Kali ini hanya gara-gara cara duduk, adik Thariq Halilintar ini dicibir netizen. Cowok 22 tahun ini diundang ke sebuah acara talkshow di TV. Dia diminta klarifikasi tentang beberapa konten-kontennya yang menuai kontroversi. Sekilas tak ada masalah saat dia menjelaskan soal beberapa videonya yang di-stitch orang lain dan berhasil mendulang viewer jutaan. ""Aku sangat happy, apapun yang bikin konten Saaih Halilintar view 10/20/30 juta. Aku tahu susahnya jadi konten kreator kan,"" ucapnya.Namun beberapa netizen justru salah fokus dan mengomentari cara duduk Saaih Halilintar. Apalagi dirinya tak duduk sendiri melainkan berdampingan dengan Ustaz Syam dan host yang usianya lebih tua darinya. Netizen sampai tak ragu menyebutnya kurang beradab hingga tak punya adab yang baik. ""@saaihalilintar cara duduknya tolong diperhatiin lagi yang di sekitar kita itu lebih kecil apa lebih tua. Adab tolong dikedepankan..@genifaruk @halilintarasmid @genhalilintar tolong diperbaiki lagi untuk adab nya,"" kritik netizen. ""Nggak tau adab. Tapi kedua orang tuanya sok alim, hadeh, sok-sokan tau agama, tapi nggak diajarkan adab..unggah ungguh dan sopan santun ..miris deh,"" komentar netizen.""Di sampingnya ada ustadz duduknya gitu bro,"" kata netizen lain. ""Manner kurang.. Sok asik dan sok ganteng,"" tambah lainnya. Sebelumnya, Saaih Halilintar kerap mengundang pro kontra dengan konten-konten yang diupload di media sosial. Misalnya memakai barang KW, mencuri video orang lain sampai yang terakhir adalah melepas burung lovebird yang seharusnya tidak boleh dilepas di alam bebas. Kontributor : Tinwarotul Fatonah","Saaih Halilintar kembali menjadi omongan publik karena tingkahnya. Cowok 22 tahun ini diundang ke sebuah acara talkshow di TV. Aku tahu susahnya jadi konten kreator kan,"" ucapnya. Apalagi dirinya tak duduk sendiri melainkan berdampingan dengan Ustaz Syam dan host yang usianya lebih tua darinya. Adab tolong dikedepankan..@genifaruk @halilintarasmid @genhalilintar tolong diperbaiki lagi untuk adab nya,"" kritik netizen. "" Tapi kedua orang tuanya sok alim, hadeh, sok-sokan tau agama, tapi nggak diajarkan adab..unggah ungguh dan sopan santun ..miris deh,"" komentar netizen. ""Di sampingnya ada ustadz duduknya gitu bro,"" kata netizen lain. "" Sebelumnya, Saaih Halilintar kerap mengundang pro kontra dengan konten-konten yang diupload di media sosial. Misalnya memakai barang KW, mencuri video orang lain sampai yang terakhir adalah melepas burung lovebird yang seharusnya tidak boleh dilepas di alam bebas."
Klarifikasi Ivan Gunawan Usai Dikabarkan Tolak Tawaran Desain Baju Pengantin Aaliyah Massaid Demi Jaga Hati Fuji,Entertainment,2024-07-23,Sumarni,https://www.suara.com/entertainment/2024/07/23/131408/klarifikasi-ivan-gunawan-usai-dikabarkan-tolak-tawaran-desain-baju-pengantin-aaliyah-massaid-demi-jaga-hati-fuji,"Artis sekaligus desainer kondang Ivan Gunawan buka suara soal kabar menolak tawaran bikin gaun pengantin Aaliyah Massaid. Isunya, dia menolak hal tersebut demi menjaga perasaan mantan Thariq Halilintar, Fujianti Utami alias Fuji. Terkait ini alih-alih membenarkan, Ivan Gunawan membantah dengan tegas. Dia mengaku tidak mendapat tawaran untuk mendesain baju pernikahan Aaliyah Massaid. ""Gue ditawarin juga nggak, diminta tolong juga nggak. Saya sama Fuji telepon-an tiap hari juga nggak,"" kata Ivan Gunawan di program Pagi Pagi Ambyar yang tayang baru-baru ini.""Yang saya tahu Thariq haji dari umur dua bulan, yang lain saya nggak tahu,"" sambungnya lagi. Igun sapaannya menuturkan kalau ibu Aaliyah Massaid, Reza Artamevia memang kerap memakai pakaian rancangannya. Tapi bukan berarti sang anak harus mengikuti jejak ibunya. Ivan Gunawan menyebut bisa jadi Aaliyah Massaid sudah punya baju pengantin impiannya sendiri. ""Aku sama Reza Artamevia, klien aku dari 20 tahun lalu. Menikah, bikin baju itu ada konsep masing-masing. Kadang netizen semuanya digabung-gabungin. Padahal ditawarin juga kagak gue,"" ucapnya. Terlepas dari itu, Ivan Gunawan menjelaskan bahwa dirinya masuk daftar tamu undangan pernikahan Aaliyah Massaid.""Kalau diundang iya. Kalau ditawarin (bikin baju pengantin) itu nggak,"" ucap Ivan Gunawan. Seperti diketahui, pernikahan Aaliyah Massaid dan Thariq Halilintar rencananya akan diadakan dalam waktu dekat.","Artis sekaligus desainer kondang Ivan Gunawan buka suara soal kabar menolak tawaran bikin gaun pengantin Aaliyah Massaid. Isunya, dia menolak hal tersebut demi menjaga perasaan mantan Thariq Halilintar, Fujianti Utami alias Fuji. Gue ditawarin juga nggak, diminta tolong juga nggak. Saya sama Fuji telepon-an tiap hari juga nggak,"" kata Ivan Gunawan di program Pagi Pagi Ambyar yang tayang baru-baru ini. Tapi bukan berarti sang anak harus mengikuti jejak ibunya. Aku sama Reza Artamevia, klien aku dari 20 tahun lalu. Menikah, bikin baju itu ada konsep masing-masing. Kadang netizen semuanya digabung-gabungin. Terlepas dari itu, Ivan Gunawan menjelaskan bahwa dirinya masuk daftar tamu undangan pernikahan Aaliyah Massaid."
"Nikita Mirzani Kasihani Ayu Ting Ting, Tidak Salah Tapi Dihujat Usai Putuskan Muhammad Fardana",Entertainment,2024-07-23,Yohanes Endra,https://www.suara.com/entertainment/2024/07/23/112731/nikita-mirzani-kasihani-ayu-ting-ting-tidak-salah-tapi-dihujat-usai-putuskan-muhammad-fardana,"Ayu Ting Ting sempat menjadi objek hujatan publik usai putus dari tunangannya, Muhammad Fardana, pada 22 Juni 2024 lalu. Bahkan, kontroversinya di masa lalu berkali-kali di bahas di media sosial. Hal itu membuat Nikita Mirzani tidak tega terhadap sang pedangdut. Terlebih ia tahu penyebab berakhirnya hubungan Ayu Ting Ting dengan Muhammad Fardhana. ""Gua cukup sedih dengan perjalanan hidup dia. Apalagi sekarang setelah dia gagal menikah, berita yang zaman-zaman dulu di TikTok kan sekarang lagi ramai,"" tutur perempuan yang akrab disapa Nikmir itu. Nikita Mirzani juga kesal ketika melihat konten berisi berita-berita lawas Ayu Ting Ting yang dikorek lagi oleh warganet di media sosial. Padahal, mantan istri Enji Baskoro itu juga ingin memperbaiki masa lalunya.""Maksud gue, jangan lah. Semua orang kan punya masa lalu, ya. Tapi kan bagaimana orang tersebut pengin memperbaiki masa lalunya,"" lanjutnya dalam podcast Fadi Iskandar pada Selasa 23 Juli 2024. ""Makanya sekarang gua tuh kalau mau buka TikTok agak-agak takut gitu ya. Soalnya yang dikeluarin tuh teman-teman gue. Kayak 'nyes' di hati,"" sambungnya. Perempuan yang akrab disapa Nikmir itu sangat prihatin dengan apa yang dialami Ayu Ting Ting. Terlebih, putri dari Ayah Rozak itu tidak salah sama sekali. ""Gua cukup prihatin. Sedih juga apa yang dialami sama Ayu Ting Ting. Tapi untuk yang sekarang sih, sama yang kemarin, dia enggak salah sebetulnya,"" paparnya lagi. ""Tapi kan orang melihat dia tuh udah buruk aja. Apa-apa yang dilakukan itu buruk, kasihan sih gue,"" ujarnya bersimpati.Karenanya, Nikita Mirzani menasihati Ayu Ting Ting untuk tidak membuka media sosial terlalu sering dan menjalani hidup dengan lebih santai.","Ayu Ting Ting sempat menjadi objek hujatan publik usai putus dari tunangannya, Muhammad Fardana, pada 22 Juni 2024 lalu. Gua cukup sedih dengan perjalanan hidup dia. Apalagi sekarang setelah dia gagal menikah, berita yang zaman-zaman dulu di TikTok kan sekarang lagi ramai,"" tutur perempuan yang akrab disapa Nikmir itu. Nikita Mirzani juga kesal ketika melihat konten berisi berita-berita lawas Ayu Ting Ting yang dikorek lagi oleh warganet di media sosial. Tapi kan bagaimana orang tersebut pengin memperbaiki masa lalunya,"" lanjutnya dalam podcast Fadi Iskandar pada Selasa 23 Juli 2024. "" Soalnya yang dikeluarin tuh teman-teman gue. Perempuan yang akrab disapa Nikmir itu sangat prihatin dengan apa yang dialami Ayu Ting Ting. Tapi kan orang melihat dia tuh udah buruk aja. Apa-apa yang dilakukan itu buruk, kasihan sih gue,"" ujarnya bersimpati."
"Digaet Jadi Brand Ambassador, Thariq Halilintar Apresiasi Perjuangan Bisnis Sahabat di Umur 17 Tahun",Entertainment,2024-07-23,Sumarni,https://www.suara.com/entertainment/2024/07/23/094934/digaet-jadi-brand-ambassador-thariq-halilintar-apresiasi-perjuangan-bisnis-sahabat-di-umur-17-tahun,"Thariq Halilintar, YouTuber sekaligus pebisnis, mengapresiasi apa yang dilakukan sahabatnya, Muhammad Hakim. Sebab di usia muda lelaki tersebut sudah memulai usahanya. Thariq menuturkan, bukan hal mudah untuk tekun dalam sebuah bisnis. Apalagi, umur Muhammad Hakim yang terbilang muda yakni 17 tahun. ""Ini sesuatu yang luar biasa banget, karena Kim memulainya di usia yang sangat muda, 17 tahun,"" kata Thariq Halilintar ditemui di kawasan Petogogan, Jakarta Selatan belum lama ini. ""Dia anak muda yang aktif banget, nggak bisa diem, selalu punya ide positif di kepala dia,"" imbuh calon suami Aaliyah Massaid ini.Menyambung ucapan Thariq Halilintar, Muhammad Hakim dalam kesempatan tersebut, menuturkan, telah merilis produk untuk laki-laki. ""Selama setahun ini, aku sudah memikirkan something big. Jadi kalau sesuatu ini terjadi, bakal benar-benar gila banget,"" ucap lelaki yang akrab disapa Hakim tersebut. Ia kemudian menambahkan, ""Aku mau kenalin produk skincare baru bernama Keem. Dibantu juga sama ka Thariq."" Thariq Halilintar yang sudah mengenal Hakim selama bertahun-tahun pun bersedia. Maka untuk mengapresiasi sang sahabat, ia bersedia menjadi brand ambassador. ""Nanti ada beberapa produk yaitu facial wash, moisturizer dan ini khusus laki-laki,"" kata Thariq Halilintar.Thariq Halilintar sekaligus meminta doa kepada masyarakat untuk usaha baru sahabatnya. Sebab dari sini pula, ia berharap banyak lapangan pekerjaan tercipta untuk orang-orang. ""Didoakan ya teman-teman semoga bisa menjadi luar biasa dan membuka lapangan pekerjaan dan menggebrak beauty industry di Indonesia,"" ucap Thariq Halilintar. Adik Atta Halilintar ini juga mendoakan Hakim agar bisa sukses lewat segala ide cemerlangnya. ""Pokoknya all the best for Hakim dan semoga tahun ini makin menyala,"" pungkas YouTuber yang merambah bisnis fesyen ini.","Thariq Halilintar, YouTuber sekaligus pebisnis, mengapresiasi apa yang dilakukan sahabatnya, Muhammad Hakim. Sebab di usia muda lelaki tersebut sudah memulai usahanya. Dia anak muda yang aktif banget, nggak bisa diem, selalu punya ide positif di kepala dia,"" imbuh calon suami Aaliyah Massaid ini. Selama setahun ini, aku sudah memikirkan something big. Thariq Halilintar yang sudah mengenal Hakim selama bertahun-tahun pun bersedia. Maka untuk mengapresiasi sang sahabat, ia bersedia menjadi brand ambassador. "" Nanti ada beberapa produk yaitu facial wash, moisturizer dan ini khusus laki-laki,"" kata Thariq Halilintar. Thariq Halilintar sekaligus meminta doa kepada masyarakat untuk usaha baru sahabatnya. Didoakan ya teman-teman semoga bisa menjadi luar biasa dan membuka lapangan pekerjaan dan menggebrak beauty industry di Indonesia,"" ucap Thariq Halilintar."
"Ayu Ting Ting Tak Salah, Nikita Mirzani Sebut Perlakuan Muhammad Fardhana ke Sang Mantan Tunangan Jahat",Entertainment,2024-07-23,Sumarni,https://www.suara.com/entertainment/2024/07/23/093220/ayu-ting-ting-tak-salah-nikita-mirzani-sebut-perlakuan-muhammad-fardhana-ke-mantan-tunangan-dinilai-jahat,"Nikita Mirzani merupakan salah satu artis yang tahu penyebab Ayu Ting Ting memutuskan berpisah dari mantan tunangannya, Muhammad Fardhana, pada 22 Juni 2024 lalu. Aktris kontroversial itu menyebutkan bahwa Ayu Ting Ting bukan pihak yang bersalah dalam gagalnya pertunangan tersebut. Justru sebaliknya. Bahkan, perempuan yang akrab disapa Nikmir itu menganggap apa yang dilakukan anggota TNI AD itu terhadap sang pedangdut jahat. Sayangnya, ia tidak dapat mengungkapkannya karena tidak memiliki hak. ""Tapi jahat sih, menurut gue jahat sih. Gue tuh pengin banget ngomong masalahnya tuh ini, gara-gara dia nggak jadi nikah tuh ini loh, tapi kan ini bukan kapasitas gue, ya,"" tuturnya dalam podcast Fadi Iskandar, dikutip pada Selasa 23 Juli 2024.Nikita Mirzani sampai memberi nasihat kepada Ayu Ting Ting untuk sabar dalam menghadapinya, terlebih dengan banyaknya hujatan-hujatan yang diterima dari publik. Karenanya, Nikita Mirzani meminta ibu satu anak itu untuk tidak banyak membuka media sosial. ""Kemarin gua udah ngasih tahu Ayu. Ya sabar, segala macam. Jangan terlalu into banget ke social media. Ya lo santai aja, jalanin hidup karena hidup itu kan masih panjang,"" lanjutnya. ""Kalau lu mikirin yang kayak gitu-gitu aja, ngapain. Buang-buang waktu,"" sambungnya, mencontohkan ucapannya kepada pelantun 'Alamat Palsu' melalui pesan di WhatsApp. Sebelumnya, Nikita Mirzani sebenarnya sudah pernah memberi sedikit clue alasan Ayu Ting Ting putus dari Muhammad Fardhana saat melakukan siaran langsung Instagram.""Sebabnya kenapa Ayu Ting Ting memutuskan sebelah pihak pertunangan itu karena, 'Minuman keras apapun namamu, tak akan kusentuh lagi, dan tak akan kuminum lagi walau hanya setetes',"" ujar Nikita sambil menyanyikan lagu 'Mirasantika' milik Rhoma Irama. Masih sambil bernyanyi, Nikita Mirzani menambahkan, 'Dan judi online, apa lagi, judol apapun.""","Nikita Mirzani merupakan salah satu artis yang tahu penyebab Ayu Ting Ting memutuskan berpisah dari mantan tunangannya, Muhammad Fardhana, pada 22 Juni 2024 lalu. Jangan terlalu into banget ke social media. Ya lo santai aja, jalanin hidup karena hidup itu kan masih panjang,"" lanjutnya. "" Kalau lu mikirin yang kayak gitu-gitu aja, ngapain. Sebelumnya, Nikita Mirzani sebenarnya sudah pernah memberi sedikit clue alasan Ayu Ting Ting putus dari Muhammad Fardhana saat melakukan siaran langsung Instagram. ""Sebabnya kenapa Ayu Ting Ting memutuskan sebelah pihak pertunangan itu karena, 'Minuman keras apapun namamu, tak akan kusentuh lagi, dan tak akan kuminum lagi walau hanya setetes',"" ujar Nikita sambil menyanyikan lagu 'Mirasantika' milik Rhoma Irama. Masih sambil bernyanyi, Nikita Mirzani menambahkan, 'Dan judi online, apa lagi, judol apapun."""
