title,category,publish_date,author,article_url,content,summary
"Perjalanan Cinta Thariq Halilintar dan Aaliyah Massaid, Resmi Jadi Suami Istri",Entertainment,2024-07-27,Yohanes Endra,https://www.suara.com/entertainment/2024/07/27/090000/perjalanan-cinta-thariq-halilintar-dan-aaliyah-massaid-resmi-jadi-suami-istri,"Kabar bahagia datang dari pasangan Thariq Halilintar dan Aaliyah Massaid. Thariq Halilintar dan Aaliyah Massaid resmi menikah pada hari ini, Jumat 26 Juli 2024. Akad nikah dua sejoli ini digelar di Dian Ballroom, Raffles Hotel, Jakarta. Presiden Joko Widodo dan Ketua MPR RI, Bambang Soesatyo menjadi saksi di pernikahan adik Atta Halilintar itu. Sejak awal, hubungan Thariq Halilintar dan Aaliyah Massaid memang sudah mencuri perhatian publik. Kisah cinta mereka penuh warna dan kerap bikin warganet baper. Apalagi hubungan mereka kabarnya tak lepas dari campur tangan Aurel Hermansyah yang menjodohkan keduanya. Aurel diketahui adalah sahabat karib Aaliyah dan juga istri dari kakak Thariq yakni Atta Halilintar.Apa kamu penasaran dengan kisah cinta keduanya? Yuk kita intip sama-sama beberapa momen perjalanan cinta Thariq Halilintar dan Aaliyah Massaid yang so sweet abis di bawah ini! Simak fakta-fakta menariknya melansir dari berbagai sumber dan akun sosial media masing-masing. Check this out dan awas baper ya! 1. Bermula dari DM Thariq Halilintar dan Aaliyah Massaid kabarnya pernah bertemu di sebuah acara. Dari situ, Thariq merasa tertarik dengan putri Reza Artamevia tersebut. Apalagi saat itu, status Thariq sudah jomblo 8 bulan setelah putus dari Fuji. Pertemuan mereka lalu berlanjut lewat komunikasi via DM Instagram dan WhatsApp.2. Momen Go Public Setelah pendekatan lewat DM, WhatsApp, dan juga nonton konser bareng, hubungan Thariq Halilintar dan Aaliyah Massaid semakin dekat. Tidak diketahui secara pasti kapan tepatnya mereka mulai resmi pacaran, tetapi itu sekitar akhir tahun 2023. Karena sejak itu, mereka mulai sering pamer potret dan momen romantis di media sosial. Usaha Thariq untuk membuktikan perasaannya pada Aaliyah bisa dibilang tak main-main. YouTuber hits tersebut bahkan sampai menyewa Billboard di Times Square, New York untuk ucapan ulang tahun Aaliyah Massaid. Romantis, bukan? 3. Lamaran Romantis Thariq Halilintar akhirnya melamar Aaliyah Massaid pada 15 Mei 2024 lalu. Momen lamaran yang berlangsung di Thailand itu begitu romantis hingga bikin warganet baper. Di tengah hamparan kebun lavender yang indah, Thariq Halilintar berlutut untuk melamar Aaliyah Massaid. Aaliyah terkejut dan menangis saat Thariq memberikan cincin, tetapi tawa bahagia langsung terpancar dari wajahnya. 4. Resmi Bertunangan Momen pertunangan Thariq Halilintar dan Aaliyah Massaid secara resmi digelar pada 23 Juni 2024 lalu. Dalam acara istimewa yang berlangsung di The Manor Andara, Cinere, Depok, Jawa Barat itu, seluruh keluarga Gen Halilintar hadir. Keluarga besar kompak mengenakan busana warna biru yang senada. Acara itu berlangsung penuh haru dan banjir air mata. 5. Akhirnya Menikah Thariq Halilintar dan Aaliyah Massaid akhirnya resmi menjadi pasangan suami istri pada hari ini, Jumat 26 Juli 2024. Acara akad nikah yang digelar di Dian Ballroom, Raffles Hotel, Jakarta itu menggunakan adat Jawa. Thariq Halilintar memberikan mas kawin pada Aaliyah Massaid berupa uang tunai senilai Rp26.072.024. Ada dua tokoh penting yang menjadi saksi di pernikahan adik Atta Halilintar ini yaitu Presiden Joko Widodo dan Bambang Soesatyo selaku Ketua MPR RI. Itu dia beberapa momen perjalanan cinta Thariq Halilintar dan Aaliyah Massaid yang resmi menjadi suami istri pada hari ini, Jumat 26 Juli 2024. Semoga pernikahan mereka selalu langgeng dan bahagia selamanya ya! Kontributor : Yoeni Syafitri Sekar","Kabar bahagia datang dari pasangan Thariq Halilintar dan Aaliyah Massaid. Presiden Joko Widodo dan Ketua MPR RI, Bambang Soesatyo menjadi saksi di pernikahan adik Atta Halilintar itu. Kisah cinta mereka penuh warna dan kerap bikin warganet baper. Apalagi hubungan mereka kabarnya tak lepas dari campur tangan Aurel Hermansyah yang menjodohkan keduanya. Apa kamu penasaran dengan kisah cinta keduanya? Bermula dari DM Thariq Halilintar dan Aaliyah Massaid kabarnya pernah bertemu di sebuah acara. Dari situ, Thariq merasa tertarik dengan putri Reza Artamevia tersebut. Pertemuan mereka lalu berlanjut lewat komunikasi via DM Instagram dan WhatsApp.2. Momen Go Public Setelah pendekatan lewat DM, WhatsApp, dan juga nonton konser bareng, hubungan Thariq Halilintar dan Aaliyah Massaid semakin dekat. Tidak diketahui secara pasti kapan tepatnya mereka mulai resmi pacaran, tetapi itu sekitar akhir tahun 2023. Momen lamaran yang berlangsung di Thailand itu begitu romantis hingga bikin warganet baper. Di tengah hamparan kebun lavender yang indah, Thariq Halilintar berlutut untuk melamar Aaliyah Massaid. Keluarga besar kompak mengenakan busana warna biru yang senada. Acara itu berlangsung penuh haru dan banjir air mata. Akhirnya Menikah Thariq Halilintar dan Aaliyah Massaid akhirnya resmi menjadi pasangan suami istri pada hari ini, Jumat 26 Juli 2024. Acara akad nikah yang digelar di Dian Ballroom, Raffles Hotel, Jakarta itu menggunakan adat Jawa. Semoga pernikahan mereka selalu langgeng dan bahagia selamanya ya!"
"Cerminan Kebahagiaan, Kid Ani Merilis Singel Bertajuk TYC",Entertainment,2024-07-27,Yohanes Endra,https://www.suara.com/entertainment/2024/07/27/070000/cerminan-kebahagiaan-kid-ani-merilis-singel-bertajuk-tyc,"Rapper underground, penulis lagu, dan produser dari Bali bernama Anakin Anagata Utamaatau yang lebih dikenal dengan nama Kid Ani kembali merilis single terbarunya yang bertajuk ‘TYC’. Ini semakin memantapkan karier sang musisi yang memulai segalanya di dunia musik sebagai seorang DJ di usia 13 tahun serta mulai belajar produksi musik dengan Ableton Live 9 di usia 15 tahun. Single ini sebenarnya merupakan project yang dia mulai sejak tahun 2022 sebagai sebuah tugas sekolah. “Saat itu aku sedang belajar cara melakukan mixing dan mastering musik. Butuh waktu hingga sekarang untuk menyelesaikan karena aku juga tidak sabar mengenai perilisan single ini,” ungkap Kid Ani. Diambil dari singkatan The Yellow Card, ‘TYC’ merujuk pada kartu tarot Matahari yang biasanya dianggap sebagai kartu terbaik dalam tarot dan melambangkan hal-hal baik dan positif dari perjuangan saat ini. Lagu ini digarap Kid Ani sebagai cerminan kebahagiaan, kepuasan, vitalitas, kepercayaan diri, dan kesuksesan dirinya di kancah musik. Sekaligus merupakan kisah yang memang tengah dia alami sekarang ini dalam kehidupannya.“Untuk lagu ini, semua proses aku lakukan sendiri mulai dari menulis lagu sampai memproduksi, menyelesaikan mixing dan proses mastering,” kisahnya. Itulah mengapa, Kid Ani merasa ‘TYC’ berbeda dari karya yang dia buat. Menurut Kid Ani, di lagu ini dia ingin menciptakan sesuatu yang cocok untuk berbagai situasi. Dan karena ini merupakan hasil pembelajarannya untuk memproduksi sebuah lagu yang dia lakukan dalam waktu yang lama, dia benar-benar ingin bereksperimen dengan berbagai genre. “Intinya, lagu ini adalah perpaduan dari Jersey Beats dan musik house,” kata Kid Ani. Lewat lagu ini, Kid Ani berharap para pendengarnya dapat memiliki energi batin yang terus mereka jaga agar dapat mereka manfaatkan untuk mencapai tujuan yang ingin diraih. Kid Ani juga percaya bahwa segala sesuatu terjadi atas alasan tertentu dan seluruh kehidupan manusia selalu sejalan dengan jalur takdirnya. Selepas single ‘TYC’, Kid Ani telah mempersiapkan rencana yang dia ingin lakukan dalam beberapa waktu ke depan. Walau belum bisa memberitahukan secara detail, namun dia memastikan bahwa sesuatu yang dia telah persiapkan tersebut, adalah sesuatu yang besar. Kita tunggu saja.'TYC’, single terbaru dari Kid Ani sudah dapat didengarkan di seluruh digital streaming platform di Indonesia.","Rapper underground, penulis lagu, dan produser dari Bali bernama Anakin Anagata Utamaatau yang lebih dikenal dengan nama Kid Ani kembali merilis single terbarunya yang bertajuk ‘TYC’. Butuh waktu hingga sekarang untuk menyelesaikan karena aku juga tidak sabar mengenai perilisan single ini,” ungkap Kid Ani. Sekaligus merupakan kisah yang memang tengah dia alami sekarang ini dalam kehidupannya. Itulah mengapa, Kid Ani merasa ‘TYC’ berbeda dari karya yang dia buat. Dan karena ini merupakan hasil pembelajarannya untuk memproduksi sebuah lagu yang dia lakukan dalam waktu yang lama, dia benar-benar ingin bereksperimen dengan berbagai genre. “ Intinya, lagu ini adalah perpaduan dari Jersey Beats dan musik house,” kata Kid Ani. Kid Ani juga percaya bahwa segala sesuatu terjadi atas alasan tertentu dan seluruh kehidupan manusia selalu sejalan dengan jalur takdirnya. Selepas single ‘TYC’, Kid Ani telah mempersiapkan rencana yang dia ingin lakukan dalam beberapa waktu ke depan. Walau belum bisa memberitahukan secara detail, namun dia memastikan bahwa sesuatu yang dia telah persiapkan tersebut, adalah sesuatu yang besar."
Cerita Toni Cu Sukses Jadi Konten Kreator Gara-Gara Bikin Games Bareng Warga,Entertainment,2024-07-27,Sumarni,https://www.suara.com/entertainment/2024/07/27/065210/cerita-toni-cu-sukses-jadi-konten-kreator-gara-gara-bikin-games-bareng-warga,"Konten kreator, Toni Cu menuai atensi lantaran aksinya yang suka bagi-bagi hadiah lewat sebuah games. Menariknya lagi, dia sampai keliling ke sejumlah daerah untuk melakukan hal tersebut. Terbaru, dia melakukannya di Karawang, Jawa Barat. “Games ini sengaja saya adakan keliling daerah. Beberapa kota di Indonesia yang sudah disinggahi,” kata Toni Cu di kawasan Jakarta belum lama ini. “Seperti Jakarta, Tangerang, Bogor, Bekasi, Semarang, Labuan Bajo, Tegal, Garut, Bali, Brebes dan terakhir di Karawang,” sambungnya lagiSelanjutnya, dia pun membeberkan alasannya bikin konten main games bareng warga sekitar dengan hadiah yang cukup unik. Selama ini, Toni Cu menyiapkan hadiah dari mulai sembako hingga uang tunai. “Tujuan saya sederhana. Ingin membuat warga Indonesia lebih bahagia dengan bermain games,” tuturnya. Sedari dulu, Toni Cu pribadi mengaku suka bermain games sederhana. Karena selain bikin senang, games ini juga bisa melatih kekompakan. “Sejak kecil saya memang suka mengikuti lomba 17-an dan bermain games. Saya adalah orang yang kompetitif. Orang Indonesia itu sangat suka main games, terutama saat perayaan kemerdekaan,” ungkapnya.“Kenapa? Karena games melatih kekompakan, menyenangkan, membuat orang bahagia, tertawa bersama, mencairkan suasana dan membantu kita lebih mengenal satu sama lain,” lanjutnya. Atas dasar itu jugalah, Toni Cu mulai konsisten buat bikin konten games bareng warga. “Tujuannya sederhana menghibur orang, seperti saya terhibur saat bermain dan menonton orang bermain games. Dan bersyukur baru mulai 10 bulan lalu, di TikTok sudah mencapai 5 juta followers, Instagram 2 juta dan YouTube 1 juta,” bebernya. Dia juga menambahkan kalau hadiah yang disiapkan dari uang pribadinya. Dia memang dikenal sebagai salah satu pengusaha di bidang fesyen yang cukup terkenal. Tak heran, Toni Cu berharap bisa menjangkau lebih luas, wilayah yang dikunjungi untuk bermain games sekaligus berbagi. “Rencananya saya ingin main di 38 provinsi di Indonesia. Semoga terlaksana,” tandasnya.","Konten kreator, Toni Cu menuai atensi lantaran aksinya yang suka bagi-bagi hadiah lewat sebuah games. Terbaru, dia melakukannya di Karawang, Jawa Barat. “ Games ini sengaja saya adakan keliling daerah. Ingin membuat warga Indonesia lebih bahagia dengan bermain games,” tuturnya. Karena games melatih kekompakan, menyenangkan, membuat orang bahagia, tertawa bersama, mencairkan suasana dan membantu kita lebih mengenal satu sama lain,” lanjutnya. Dan bersyukur baru mulai 10 bulan lalu, di TikTok sudah mencapai 5 juta followers, Instagram 2 juta dan YouTube 1 juta,” bebernya. Dia juga menambahkan kalau hadiah yang disiapkan dari uang pribadinya. Dia memang dikenal sebagai salah satu pengusaha di bidang fesyen yang cukup terkenal. Tak heran, Toni Cu berharap bisa menjangkau lebih luas, wilayah yang dikunjungi untuk bermain games sekaligus berbagi. “ Rencananya saya ingin main di 38 provinsi di Indonesia."
Apa Saja Souvenir Resepsi Thariq Halilintar dan Aaliyah Massaid? Diungkap Bima Arya,Entertainment,2024-07-26,Yazir Farouk,https://www.suara.com/entertainment/2024/07/26/220000/apa-saja-souvenir-resepsi-thariq-halilintar-dan-aaliyah-massaid-diungkap-bima-arya,"Thariq Halilintar dan Aaliyah Massaid tengah menggelar resepsi pernikahan. Acara yang berlangsung di hotel mewah ini bertabur tamu dari berbagai kalangan. Seperti yang terlihat, ada mantan Wali Kota Bogor Bima Arya yang datang bersama sang istri, Yane Ardian Rachman. Politisi 51 tahun ini kagum dengan lingkungan pertemanan keluarga Halilintar. ""Saya rasa ini karena pergaulan yang luas dari Thariq Halilintar dan keluarga, menembus sekat-sekat politik,"" kata Bima Arya. Dalam kesempatan itu, Bima Arya dan istri juga menunjukkan souvernir pernikahan Aaliyah Massaid dan Thariq Halilintar.Cinderamata tersebut dibungkus dengan kain berwarna hijau berbentuk kotak besar. ""Souvenir ada figura, tas dan juga parfum,"" kata istri Bima Arya, Yane Ardian Rachman. Selain Bima Arya, hadir pula beberapa tamu dari kalangan politisi seperti Puan Maharani. Lainnya, sederet artis pun ikut tampil. Ada Cinta Laura, Tissa Biani, Shireen Sungkar, Fadil Jadi, Verrell Bramasta hingga kakak Fuji, Fadly Faisal. Verrell Bramasta menerangkan, suasana pernikahan Thariq Halilintar dan Aaliyah Massaid juga dipenuhi dengan suasana adat.""Suasananya mengharukan, tadi juga pakai adat Padang ya,"" kata Verrell Bramasta. Keterangan foto: Bima Arya dan istrinya, Yane Ardian Rachman ditemui di Hotel Raffles, Jakarta Selatan pada Jumat 26 Juli 2024.","Thariq Halilintar dan Aaliyah Massaid tengah menggelar resepsi pernikahan. Acara yang berlangsung di hotel mewah ini bertabur tamu dari berbagai kalangan. Saya rasa ini karena pergaulan yang luas dari Thariq Halilintar dan keluarga, menembus sekat-sekat politik,"" kata Bima Arya. Dalam kesempatan itu, Bima Arya dan istri juga menunjukkan souvernir pernikahan Aaliyah Massaid dan Thariq Halilintar. Souvenir ada figura, tas dan juga parfum,"" kata istri Bima Arya, Yane Ardian Rachman. Selain Bima Arya, hadir pula beberapa tamu dari kalangan politisi seperti Puan Maharani. Keterangan foto: Bima Arya dan istrinya, Yane Ardian Rachman ditemui di Hotel Raffles, Jakarta Selatan pada Jumat 26 Juli 2024."
"Dari Paris ke Tangerang: DRP Jakarta Hadirkan Kemeriahan Street Culture, Apa Saja?",Entertainment,2024-07-26,Ferry Noviandi,https://www.suara.com/entertainment/2024/07/26/215500/dari-paris-ke-tangerang-drp-jakarta-hadirkan-kemeriahan-street-culture-apa-saja,"Jakarta Food and Festival (JF3) yang merupakan Festival mode terbesar dan paling berpengaruh di Indonesia, tengah berlangsung. Penyelenggaraan JF3 2024, berkolaborasi dengan DRP Paris yang menghadirkan DRP Jakarta. Sebuah festival budaya urban dan street culture dari Prancis. Acara tersebut diselenggarakan di Summarecon Mall Serpong, selama 10 hari. Dimulai dari 26 Juli hingga 4 Agustus 2024. ""Sejak lama JF3 bercita-cita membawa brand lokal Indonesia untuk bisa menembus pasar global,"" kata Chairman JF3, Soegianto Nagaria dalam rilis yang diterima , Jumat 26 Juli 2024.Soegianto Nagaria menyadari banyak UMKM lokal yang kesulitan untuk memasarkan produk, terlebih ke luar negeri. ""Maka kali ini JF3 berinisiatif mendatangkan event berskala global ke Indonesia. Harapannya, bisa membuka kesempatan bagi lebih banyak brand lokal berpartisipasi dalam pentas internasional,"" tuturnya. Sebagai informasi, DRP Paris telah dikenal luas pecinta trend streetwear internasional. Acara ini hadir di Paris Fashion Week, yang tahun lalu bertempat di Jardin des Tuileries, Paris. DRP Paris juga menjadi titik kumpul komunitas dan pelaku utama budaya urban dan street culture di Prancis. Menampilkan busana streetwear, sneakers, live music, pertunjukan skateboard, dan street food. Tak berbeda jauh dari DRP Paris, DRP Jakarta membawa brand streetwear Prancis. Di antaranya Pablo T-Shirt Factory, Barriers Worldwide, Please Paulo Stop Cappin, dan A1 Denim.Tidak kurang dari 70 brand lokal dan internasional yang berpartisipasi dalam acara ini. Bersiaplah untuk berdecak kagum dengan berbagai pertunjukan dan aktivitas memacu adrenalin. Seperti demo freestyle streetball yang diisi oleh profesional dan skill 1 on 1 atau 2 on 2 bersama para selebriti. Hadir pula penampilan live DJ juga musisi hip hop ternama. Sebut saja Tuan Tiga Belas, Basboi dan Ramen Girl. Informasi lengkap mengenai kegiatan DRP Jakarta dapat diikuti dengan mengikuti akun instagram @DRP_Jakarta dan @JF3_info.","Jakarta Food and Festival (JF3) yang merupakan Festival mode terbesar dan paling berpengaruh di Indonesia, tengah berlangsung. Sebuah festival budaya urban dan street culture dari Prancis. Dimulai dari 26 Juli hingga 4 Agustus 2024. "" Sejak lama JF3 bercita-cita membawa brand lokal Indonesia untuk bisa menembus pasar global,"" kata Chairman JF3, Soegianto Nagaria dalam rilis yang diterima , Jumat 26 Juli 2024.Soegianto Nagaria menyadari banyak UMKM lokal yang kesulitan untuk memasarkan produk, terlebih ke luar negeri. "" Maka kali ini JF3 berinisiatif mendatangkan event berskala global ke Indonesia. Tak berbeda jauh dari DRP Paris, DRP Jakarta membawa brand streetwear Prancis. Tidak kurang dari 70 brand lokal dan internasional yang berpartisipasi dalam acara ini. Bersiaplah untuk berdecak kagum dengan berbagai pertunjukan dan aktivitas memacu adrenalin. Hadir pula penampilan live DJ juga musisi hip hop ternama. Sebut saja Tuan Tiga Belas, Basboi dan Ramen Girl."
"Ajukan Gelar Perkara Laporan Penggelapan, Upaya Tiko Aryawardhana Suami BCL Pulihkan Nama Baik",Entertainment,2024-07-26,Yazir Farouk,https://www.suara.com/entertainment/2024/07/26/202459/ajukan-gelar-perkara-laporan-penggelapan-upaya-tiko-aryawardhana-suami-bcl-pulihkan-nama-baik,"Suami penyanyi Bunga Citra Lestari alias BCL, Tiko Aryawardhana tak terima atas laporan yang dilayangkan mantan istrinya, Arina Winarto. Tiko dilaporkan kasus dugaan penggelapan uang senilai Rp6,9 miliar. Tiko Aryawardhana bersama kuasa hukumnya, Irfan Aghasar lalu mengajukan gelar perkara khusus ke Polda Metro Jaya. Upaya ini untuk mematahkan laporan Arina. ""Hari ini prosedur gelar perkara khusus dimana permintaannya dari pihak kita sebagai pengadu dumas (pengaduan masyarakat). Kita menjelaskan secara rinci konstruksi laporan mereka dan kita patahkan satu persatu,"" kata Irfan Aghasar usai gelar perkara di Polda Metro Jaya, Jumat 26 Juli 2024. ""Dan menurut kami ini bukan suatu tindak pidana. Karena akuntan publik yang ditunjuk pun hitungannya itu tidak kredibel, kemudian tidak masuk akal tuduhan-tuduhannya. Itu yang semua kita sampaikan,"" ujarnya lagi.Irfan Aghasar menjelaskan kliennya merasa difitnah dan nama baiknya tercoreng karena laporan tersebut. Pasalnya Tiko Aryawardhana merasa tidak melakukan penggelapan dana sebagaimana yang dituduhkan. ""Poin-poin yang dituduhkan itu tidak benar. Tidak ada penggelapan, terus keuangannya itu adalah keuangan restoran. Kemudian ada pembiayaan-pembiayaan yang muncul dari sisi pelapor itu yang tidak dihitung. Sehingga muncul angka-angka yang fantastis padahal sebenarnya itu angka-angka yang tidak relevan dimunculkan,"" kata Irfan menjelaskan. ""Tetapi kan efek beritanya luar biasa merugikan buat klien kami. Orang sudah kena fitnah, orang sudah kena tuduhan-tuduhan yang tidak berdasar,"" ucapnya menyambung. Karenanya, Irfan Aghasar berharap bahwa dengan bukti yang pihaknya jabarkan dapat membuat perkara ini berakhir dengan SP3 atau dihentikan dan nama baik Tiko Aryawardhana bisa dipulihkan. ""Kami sudah menyampaikan bukti-bukti. ya saya pikir ini suatu hal babak baru yang bagus bahwa sebenarnya perkara ini sebaiknya di SP3 aja. Dan harapan kami semoga Mas Tiko mendapatkan keadilan dan nama baiknya bisa dipulihkan,"" katanya.Sebagaimana diketahui, beberapa waktu lalu Tiko Aryawardhana sempat membuat heboh usai dilaporkan mantan istri soal dugaan penggelapan dana. Suami BCL tersebut dituduh menggelapkan uang perusahaan senilai Rp6,9 miliar selama masih menjalankan perusahaan minuman milik bersama pada 2015 hingga 2021. Laporan tersebut dilayangkan Arina Winarto ke Polres Metro Jakarta Selatan sejak 2022 dan masuk tahap penyidikan beberapa bulan lalu. Tiko sendiri juga sudah menjalani pemeriksaan polisi sebanyak dua kali. Tiko Aryawardhana dan Arina Winarto menikah pada Juni 2014 lalu. Keduanya lalu memutuskan bercerai pada 2021 karena terlibat cekcok sejak tahun 2019. Tiko Aryawardhana lalu menikah dengan Bunga Citra Lestari pada Desember 2023 lalu.","Suami penyanyi Bunga Citra Lestari alias BCL, Tiko Aryawardhana tak terima atas laporan yang dilayangkan mantan istrinya, Arina Winarto. Tiko dilaporkan kasus dugaan penggelapan uang senilai Rp6,9 miliar. Kita menjelaskan secara rinci konstruksi laporan mereka dan kita patahkan satu persatu,"" kata Irfan Aghasar usai gelar perkara di Polda Metro Jaya, Jumat 26 Juli 2024. "" Dan menurut kami ini bukan suatu tindak pidana. Karena akuntan publik yang ditunjuk pun hitungannya itu tidak kredibel, kemudian tidak masuk akal tuduhan-tuduhannya. Poin-poin yang dituduhkan itu tidak benar. Kemudian ada pembiayaan-pembiayaan yang muncul dari sisi pelapor itu yang tidak dihitung. Sehingga muncul angka-angka yang fantastis padahal sebenarnya itu angka-angka yang tidak relevan dimunculkan,"" kata Irfan menjelaskan. "" Tetapi kan efek beritanya luar biasa merugikan buat klien kami. Karenanya, Irfan Aghasar berharap bahwa dengan bukti yang pihaknya jabarkan dapat membuat perkara ini berakhir dengan SP3 atau dihentikan dan nama baik Tiko Aryawardhana bisa dipulihkan. "" ya saya pikir ini suatu hal babak baru yang bagus bahwa sebenarnya perkara ini sebaiknya di SP3 aja. Tiko sendiri juga sudah menjalani pemeriksaan polisi sebanyak dua kali. Tiko Aryawardhana dan Arina Winarto menikah pada Juni 2014 lalu. Keduanya lalu memutuskan bercerai pada 2021 karena terlibat cekcok sejak tahun 2019."
"Susan Sameh Resmi Menikah, Ini Sosok Suaminya",Entertainment,2024-07-27,Ferry Noviandi,https://www.suara.com/entertainment/2024/07/27/204000/susan-sameh-resmi-menikah-ini-sosok-suaminya,"Susan Sameh membagikan kabar bahagia. Artis 27 tahun ini telah resmi dipersunting oleh sang kekasih yang diketahui bernama Khalid Atamimi hari ini, Sabtu 27 Juli 2024. Lewat akun Instagram-nya, Susan Sameh mengunggah potret dari momen akad nikah mereka. Tampak Susan dan suami memamerkan buku nikah dengan senyum paling bahagia. ""Alhamdulillah SAH!!"" tulis aktris kelahiran 1997 tersebut. Hanya sedikit informasi tentang pernikahan Susan Sameh yang terungkap di media sosial. Selain sosok suaminya, tampak beberapa wajah familiar di jajaran bridesmaid.Natasha Wilona membagikan potret dirinya sebagai bridesmaid bersama nama-nama seperti Indah Permatasari, Jihane Almira, hingga Elina Joerg. Sederet artis terlihat mengucapkan selamat kepada Susan Sameh atas pernikahannya. Mereka adalah Syifa Hadju, Fadil Jaidi, Dimas Anggara, Pamela Bowie, Sarah Keihl dan banyak lagi. Sebelumnya Susan Sameh beberapa kali membocorkan tentang hari bahagianya lewat unggahan media sosial. Kembali pada 18 Juni 2024, Susan mengabarkan bahwa dirinya dilamar oleh sosok misterius. Hanya buket bunga dengan kartu bertuliskan ajakan menikah saja yang dipamerkan. Kemudian beberapa hari yang lalu, bintang serial Wedding Agreement: The Series tersebut membagikan potret pre-wedding di mana calon suaminya terlihat dari belakang.Setelah membuat warganet penasaran, akhirnya terungkap juga siapa lelaki beruntung yang kini sah menjadi suami Susan Sameh. Khalid Atamimi merupakan lelaki keturunan Indonesia-Belanda yang lahir di Hamburg, Jerman pada 19 April 1991. Meski memiliki darah Indonesia, Khalid berkewarganegaraan Belanda. Lelaki berusia 33 tahun tersebut kini berprofesi sebagai pelatih klub sepak bola Jerman, Eimsbutteler TV. Klub yang bermarkas di Hamburg itu berlaga di liga kasta IV. Khalid Atamimi memiliki akun Instagram bernama @atamimikhalid yang diikuti sejumlah artis tanah air, seperti Fadly Faisal kakak Fujianti Utami alias Fuji. Kontributor : Chusnul Chotimah","Artis 27 tahun ini telah resmi dipersunting oleh sang kekasih yang diketahui bernama Khalid Atamimi hari ini, Sabtu 27 Juli 2024. Hanya sedikit informasi tentang pernikahan Susan Sameh yang terungkap di media sosial. Natasha Wilona membagikan potret dirinya sebagai bridesmaid bersama nama-nama seperti Indah Permatasari, Jihane Almira, hingga Elina Joerg. Sederet artis terlihat mengucapkan selamat kepada Susan Sameh atas pernikahannya. Hanya buket bunga dengan kartu bertuliskan ajakan menikah saja yang dipamerkan. Kemudian beberapa hari yang lalu, bintang serial Wedding Agreement: The Series tersebut membagikan potret pre-wedding di mana calon suaminya terlihat dari belakang. Khalid Atamimi merupakan lelaki keturunan Indonesia-Belanda yang lahir di Hamburg, Jerman pada 19 April 1991. Meski memiliki darah Indonesia, Khalid berkewarganegaraan Belanda. Klub yang bermarkas di Hamburg itu berlaga di liga kasta IV."
