title,category,publish_date,author,article_url,content,summary
"Niat Bela Pegi Setiawan dari Sindiran Nikita Mirzani, Tessa Mariska Diledek Pansos",Entertainment,2024-07-26,Yazir Farouk,https://www.suara.com/entertainment/2024/07/26/081500/niat-bela-pegi-setiawan-dari-sindiran-nikita-mirzani-tessa-mariska-diledek-pansos,"Kabar Nikita Mirzani menyindir Pegi Setiawan miskin dan sombong turut terdengar ke telinga artis senior Tessa Mariska. Pegi adalah pria yang sempat jadi tersangka kasus pembunuhan Vina Cirebon, namun dibebaskan usai gugatan praperadilan dimenangkan hakim. Seperti diketahui, Nikita Mirzani melontarkan sindiran kepada Pegi Setiawan karena banyak bersuara soal pengalaman mendekam di penjara dan menolak pertemuan dengan Dedi Mulyadi. ""Taruhan ama gue, nggak bakal jadi apa-apa tuh Pegi. Jadi kang kuli bangunan lagi, attitudenya nggak bagus. Orang kulonuwun dulu sama yang bantu dulu, sombong, nggak ada otaknya itu,"" ucap Nikita Mirzani. Sementara itu, Tessa Mariska pasang badan membela Pegi Setiawan seraya menyindir balik Nikita Mirzani. Hal tersebut diutarakan Tessa Mariska dalam sebuah sesi interview.""Biasa ya Nikmir suka nyentil-nyentil. Gue pikir ini pinter nih Nikmir, udah tenggelam ambil kasus terus viral lagi. Dia pinter mencari momen, ada kasihan ke Pegi,"" tutur Tessa Mariska. Tessa Mariska menilai, Nikita Mirzani tidak bijak menggunakan sosial media. Di samping itu, dia juga menyinggung ibunda Laura Meizani itu berbicara tidak sesuai kapasitasnya sebagai publik figur soal kasus Pegi Setiawan. ""Etikanya seorang publik figur di (sesi) live itu menceritakan kegiatan kita dan tentang kita, bukan untuk menyentil orang,"" sambung Tessa Mariska, dikutip pada Kamis 25 Juli 2024. Meski begitu, Tessa Mariska menilai Nikita Mirzani telah melakukan blunder karena sejumlah warganet masih bersimpati kepada Pegi Setiawan. ""Cuma untungnya masyarakat nggak tergiring untuk membenci Pegi. Justru gue lihat sebaliknya, masyarakat mengelu-elukan Pegi. Jadi gue lihat Nikmir agak blunder nih,"" kata Tessa Mariska.Pada kesempatan itu pula, Tessa Mariska membeberkan sifat asli Pegi Setiawan yang berbanding terbalik dengan asumsi Nikita Mirzani. ""Kalau menurut aku, Pegi pada dasarnya anak baik, gak sombong, anaknya benar-benar pekerja (keras), gak neko-neko,"" pungkas Tessa Mariska. Perihal itu, sejumlah netizen turut memberikan respons dan komentar yang beragam. Sebagian netizen mengkritik Tessa Mariska panjat sosial isu Pegi Setiawan. ""Pansos terus bu,"" tulis seorang netizen. ""Wah banyak bermunculan yang pansos biar ngetop. Ini mbak mau ngetop lagi,"" ucap netizen lain. ""Mundur, bu. Yang kemarin belum kelar masalah ucapan duka, eh malah nyentul orang lain,"" ujar netizen yang lainnya.","Kabar Nikita Mirzani menyindir Pegi Setiawan miskin dan sombong turut terdengar ke telinga artis senior Tessa Mariska. Seperti diketahui, Nikita Mirzani melontarkan sindiran kepada Pegi Setiawan karena banyak bersuara soal pengalaman mendekam di penjara dan menolak pertemuan dengan Dedi Mulyadi. "" Jadi kang kuli bangunan lagi, attitudenya nggak bagus. Orang kulonuwun dulu sama yang bantu dulu, sombong, nggak ada otaknya itu,"" ucap Nikita Mirzani. Gue pikir ini pinter nih Nikmir, udah tenggelam ambil kasus terus viral lagi. Dia pinter mencari momen, ada kasihan ke Pegi,"" tutur Tessa Mariska. Meski begitu, Tessa Mariska menilai Nikita Mirzani telah melakukan blunder karena sejumlah warganet masih bersimpati kepada Pegi Setiawan. "" Cuma untungnya masyarakat nggak tergiring untuk membenci Pegi. Justru gue lihat sebaliknya, masyarakat mengelu-elukan Pegi. Pada kesempatan itu pula, Tessa Mariska membeberkan sifat asli Pegi Setiawan yang berbanding terbalik dengan asumsi Nikita Mirzani. "" Perihal itu, sejumlah netizen turut memberikan respons dan komentar yang beragam. Wah banyak bermunculan yang pansos biar ngetop. Ini mbak mau ngetop lagi,"" ucap netizen lain. """
"Gak Tahu Uang Pelangkah, Zahwa Pasrah Dapat Apa Saja dari Aaliyah Massaid Saat Dilangkah Nikah",Entertainment,2024-07-26,Yazir Farouk,https://www.suara.com/entertainment/2024/07/26/193751/gak-tahu-uang-pelangkah-zahwa-pasrah-dapat-apa-saja-dari-aaliyah-massaid-saat-dilangkah-nikah,"Pernikahan Aaliyah Massaid dan Thariq Halilintar disambut baik sang kakak, Zahwa Massaid. Ia begitu bahagia sampai tidak bisa menggambarkannya dengan kata-kata. ""Yang pasti sangat bahagia. Bahagia yang sejujurnya saya tidak bisa mengungkapkan dengan kata-kata,"" ungkap Zahwa Massaid usai akad nikah Aaliyah Massaid di Raffles Jakarta, Jumat 26 Juli 2024. Sebelum mengumumkan niat meminang Aaliyah Massaid, Zahwa Massaid sudah sempat bertukar pikiran dengan Thariq Halilintar. Sejak awal, ia sudah yakin bahwa Thariq adalah sosok yang tepat untuk membahagiakan Aaliyah. ""Aaliyah itu adik saya, dan she's my baby. Aaliyah telah menemukan seseorang yang dapat mencintai dia dengan setulusnya. I mean, Thariq is a great guy. Jadi saya sangat amat terharu dan I'm just really happy dan bahagia,"" papar Zahwa Massaid.Zahwa Massaid bahkan menegaskan dirinya tidak butuh mengikuti tradisi seperti uang pelangkah dari Aaliyah Massaid karena menikah lebih dulu. Kebahagiaan Aaliyah jadi prioritas Zahwa, dan dirinya sudah yakin bahwa Thariq Halilintar bisa membahagiakan sang adik. ""Kalau hadiah tuh ya, saya nggak pernah minta. Awalnya juga saya nggak tahu malah, harus dikasih apa. Tapi mereka yang ngomong ke aku, 'Kamu mau apa?'. Aku bilang terserah,"" jelas Zahwa Massaid. ""Ya nanti kita lihat aja. Sebenernya untuk dilangkahin itu aku nggak peduli selama adik aku bahagia,"" imbuh perempuan 23 tahun. Ditambah lagi, Zahwa Massaid sudah lama punya firasat kalau Aaliyah Massaid akan lebih dulu menikah saat keduanya sama-sama dewasa. ""Aku dari dulu udah ada feeling bakal dilangkahin juga. Jadi aku nggak kaget,"" ucap Zahwa Massaid.Akad nikah Thariq Halilintar dan Aaliyah Massaid sendiri berlangsung khidmat dan sarat nuansa haru pagi tadi. Disaksikan langsung oleh Presiden Joko Widodo dan Ketua MPR RI, Bambang Soesatyo, Thariq meminang Aaliyah dengan maskawin uang tunai Rp26.072.024, yang menggambarkan tanggal pernikahan mereka. ""Disesuaikan dengan tanggal hari ini aja. Bikin sesuatu yang bisa mengingatkan sama hari ini,"" terang Thariq Halilintar.","Pernikahan Aaliyah Massaid dan Thariq Halilintar disambut baik sang kakak, Zahwa Massaid. Bahagia yang sejujurnya saya tidak bisa mengungkapkan dengan kata-kata,"" ungkap Zahwa Massaid usai akad nikah Aaliyah Massaid di Raffles Jakarta, Jumat 26 Juli 2024. Sejak awal, ia sudah yakin bahwa Thariq adalah sosok yang tepat untuk membahagiakan Aaliyah. "" Aaliyah telah menemukan seseorang yang dapat mencintai dia dengan setulusnya. Kalau hadiah tuh ya, saya nggak pernah minta. Awalnya juga saya nggak tahu malah, harus dikasih apa. Tapi mereka yang ngomong ke aku, 'Kamu mau apa?'. Aku bilang terserah,"" jelas Zahwa Massaid. "" Sebenernya untuk dilangkahin itu aku nggak peduli selama adik aku bahagia,"" imbuh perempuan 23 tahun. Aku dari dulu udah ada feeling bakal dilangkahin juga. Disaksikan langsung oleh Presiden Joko Widodo dan Ketua MPR RI, Bambang Soesatyo, Thariq meminang Aaliyah dengan maskawin uang tunai Rp26.072.024, yang menggambarkan tanggal pernikahan mereka. """
"Syahrini Bakal Melahirkan di Minggu Ini, Artis India Ini Menebak Bayinya Kembar",Entertainment,2024-07-26,Ferry Noviandi,https://www.suara.com/entertainment/2024/07/26/192757/syahrini-bakal-melahirkan-di-minggu-ini-artis-india-ini-menebak-bayinya-kembar,"Syahrini kembali membagikan foto dengan perutnya yang semakin terlihat besar. Dari caption fotonya dia mengaku usia kehamilannya sudah memasuki 38 minggu. Tinggal menunggu hari janin yang ada di dalam perut Syahrini bakal melahirkan. ""Menangkap momen kehamilan saya,"" tulis Syahrini. Unggahan itu pun direspon oleh beberapa warganet. Bahkan beberapa rekan artis terlihat turut memberi komentar. Tak terkecuali artis India Tina Datta. Komentarnya pun langsung mencuri perhatian. Pasalnya dia menebak bila Syahrini sedang hamil bayi kembar. ""Pasti kembar,"" tulis Tina Datta dalam bahasa Inggris.Komentar tersebut langsung ditanggapi Syahrini. Namun dia tidak menjawab komentar soal dugaan bayi kembar yang ada diperutnya. ""Hi my dear,"" jawab Syahrini. Selain artis India tersebut, beberapa rekan artis lain turut menanggapi unggahan Syahrini. Mereka mendoakan kelancaran penyanyi asal Bogor tersebut. ""Sehat-sehat yaa neng,"" komen penyanyi senior Vina Panduwinata. Sampai saat ini tidak diketahui kapan Syahrini bakal melahirkan. Namun dari status yang ditulis, dia bakal melahirkan pada pekan ini di Singapura.","Syahrini kembali membagikan foto dengan perutnya yang semakin terlihat besar. Menangkap momen kehamilan saya,"" tulis Syahrini. Bahkan beberapa rekan artis terlihat turut memberi komentar. Pasalnya dia menebak bila Syahrini sedang hamil bayi kembar. "" Komentar tersebut langsung ditanggapi Syahrini. Namun dia tidak menjawab komentar soal dugaan bayi kembar yang ada diperutnya. "" Mereka mendoakan kelancaran penyanyi asal Bogor tersebut. "" Sehat-sehat yaa neng,"" komen penyanyi senior Vina Panduwinata."
"Pernah Merasa Takut Jadi Janda, Dea Mirella Menyesal Sempat Pertahankan Rumah Tangganya",Entertainment,2024-07-26,Ferry Noviandi,https://www.suara.com/entertainment/2024/07/26/184256/pernah-merasa-takut-jadi-janda-dea-mirella-menyesal-sempat-pertahankan-rumah-tangganya,"Pernah menikah dengan Eel Ritonga, mantan drummer ADA Band, penyanyi Dea Mirella sesali keputusannya dulu mempertahankan rumah tangga karena takut dengan pandangan negatif orang. Dea yang akhirnya resmi bercerai dengan Eel pada 2008, mengaku empat tahun bertahan walaupun suami saat itu ingin menceraikannya. ""Jadi sebenarnya tiga tahun itu aku menikah normal, itu pun sudah mau cerai, cuma proses cerainya empat tahun, (karena) aku enggak mau,"" kata Dea dikutip dari YouTube Ferdy Element. ""Banyak banget kekhawatiran aku, sampai selama empat tahun enggak mau cerai,"" kata Dea menyambung.Kehadiran orang ketiga dalam rumah tangganya saat itu bahkan dianggap Dea bukan jadi alasan untuk bercerai. ""Aku tuh sebenarnya orang yang pada saat itu aku takut jadi janda. Zaman dulu kan orang kalau janda konotasinya kayaknya, enggak tahu aku yang kolot atau pada masa itu seperti itu,"" ucapnya. Bahkan demi mempertahankan rumah tangganya, pelantun lagu ""Menanti"" itu memilih keluar dari grup vokal Warna karena suaminya saat itu memberi pilihan antara Warna atau bercerai. Keinginan Dea untuk mempertahankan rumah tangga juga didukung oleh mertuanya. Bertahun-tahun bertahan sendiri, pernikahan Dea berakhir dengan perceraian setelah mertuanya meninggal dunia. ""Itu bisa cerai gara-gara mertuaku meninggal. Jadi enggak ada yang melarang. Akhirnya saat orangtuanya meninggal, ya sudah diceraiin. Berjalan lah perceraian itu,"" imbuhnya.Kini saat mengingat lagi perjuangannya dulu dan pengorbanan hingga harus melepas Warna, Dea menyesali dirinya yang tidak bisa tegas mengambil keputusan. ""Mungkin bodoh juga, sekarang aku suka mikir 'kenapa aku kayak gitu. Cerai, cerai aja, kenapa enggak dari dulu,' setelah sekarang ya,"" imbuh Dea Mirella. ""Pada masa itu kenapa aku enggak tegas, kenapa aku takut. Dulu aku takut banget, takut gimana ngebesarin anak sendirian, gimana nanti dia enggak punya banyak,"" ucapnya. Semua ketakutannya menyandang status janda saat itu ternyata hanya ketakutan tak beralasan. ""Ternyata jadi janda juga enggak masalah kok, sampai detik ini aku masih bisa berjalan hidup,"" ucap Dea. ""Orang juga enggak melihat aku dengan pandangan negatif,"" tutur Dea yang masih memilih sendiri hingga hari ini.","Pernah menikah dengan Eel Ritonga, mantan drummer ADA Band, penyanyi Dea Mirella sesali keputusannya dulu mempertahankan rumah tangga karena takut dengan pandangan negatif orang. Dea yang akhirnya resmi bercerai dengan Eel pada 2008, mengaku empat tahun bertahan walaupun suami saat itu ingin menceraikannya. "" Banyak banget kekhawatiran aku, sampai selama empat tahun enggak mau cerai,"" kata Dea menyambung. Bahkan demi mempertahankan rumah tangganya, pelantun lagu ""Menanti"" itu memilih keluar dari grup vokal Warna karena suaminya saat itu memberi pilihan antara Warna atau bercerai. Keinginan Dea untuk mempertahankan rumah tangga juga didukung oleh mertuanya. Akhirnya saat orangtuanya meninggal, ya sudah diceraiin. Kini saat mengingat lagi perjuangannya dulu dan pengorbanan hingga harus melepas Warna, Dea menyesali dirinya yang tidak bisa tegas mengambil keputusan. "" Mungkin bodoh juga, sekarang aku suka mikir 'kenapa aku kayak gitu. Semua ketakutannya menyandang status janda saat itu ternyata hanya ketakutan tak beralasan. "" Ternyata jadi janda juga enggak masalah kok, sampai detik ini aku masih bisa berjalan hidup,"" ucap Dea. """
"Belum Sehari Menikah, Thariq Halilintar Bongkar Urusan Ranjang dengan Aaliyah Massaid",Entertainment,2024-07-26,Yohanes Endra,https://www.suara.com/entertainment/2024/07/26/161325/belum-sehari-menikah-thariq-halilintar-bongkar-urusan-ranjang-dengan-aaliyah-massaid,"Thariq Halilintar semakin memamerkan kemesraannya usai menikahi Aaliyah Massaid. Pasangan ini resmi menjadi pasangan suami istri pada Jumat 26 Juli 2024. Usai menjalani akad pernikahan di pagi hari, Thariq membongkar aktivitas-aktivitasnya sebagai suami Aaliyah pada hari yang sama. Bahkan beragam aktivitas tersebut dibagikan melalui Instagram. Unggahan pertama memperlihatkan genggaman tangan Thariq dan tangan Aaliyah Massaid usai dinyatakan sah menikah secara agama. Tanpa kedua tangan mereka kontras, dengan kuku Aaliyah yang dihias begitu cantik. ""Cie,"" tulis Thariq dalam unggahannya.Kemudian ada aktivitas lainnya yang tidak kalah menangis. Melalui aktivitas kedua ini, Thariq akhirnya menyebut Aaliyah dengan sebutan istri. ""Makan siang bareng istri,"" tambah Thariq. Pada unggahan tersebut, tidak diketahui apa menu makanan yang dinikmati oleh Thariq dan Aaliyah. Hanya ada dua piring dengan alat makan yang menyertai yang digunakan oleh pasangan ini. Selain kedua aktivitas tersebut, Thariq buka-bukaan soal urusan ranjangnya. Pasalnya, adik Atta ini mengaku tidur siang bersama istrinya. Thariq memang tidak menampakkan wajah bahagianya sebagai pengantin. Hanya ada wajah Aaliyah yang tertidur manis di tangannya.""Bobo siang bareng istri,"" semat Thariq Halilintar Meski menunjukkan kebahagiaan, sikap dan unggahan dari Thariq usai menikahi Aaliyah ini menjadi bahan omongan warganet. Salah satunya dalam unggahan akun Instagram @lambe_gosiip. ""Alay banget,"" ujar warganet. ""Belum tahu kerasnya kehidupan,"" tambah yang lain. ""Nah itu yang gak perlu diumbar, stop over exposing,"" kritik warganet lainnya.","Thariq Halilintar semakin memamerkan kemesraannya usai menikahi Aaliyah Massaid. Pasangan ini resmi menjadi pasangan suami istri pada Jumat 26 Juli 2024. Bahkan beragam aktivitas tersebut dibagikan melalui Instagram. Tanpa kedua tangan mereka kontras, dengan kuku Aaliyah yang dihias begitu cantik. "" Kemudian ada aktivitas lainnya yang tidak kalah menangis. Selain kedua aktivitas tersebut, Thariq buka-bukaan soal urusan ranjangnya. Pasalnya, adik Atta ini mengaku tidur siang bersama istrinya. Thariq memang tidak menampakkan wajah bahagianya sebagai pengantin. ""Bobo siang bareng istri,"" semat Thariq Halilintar Meski menunjukkan kebahagiaan, sikap dan unggahan dari Thariq usai menikahi Aaliyah ini menjadi bahan omongan warganet. Belum tahu kerasnya kehidupan,"" tambah yang lain. """
"Tips Sehat dan Murah Ala Igor Saykoji, Rutin Jalan Kaki 2 KM Sehari",Entertainment,2024-07-26,Yazir Farouk,https://www.suara.com/entertainment/2024/07/26/160814/tips-sehat-dan-murah-ala-igor-saykoji-rutin-jalan-kaki-2-km-sehari,"Igor Saykoji belakangan menerapkan pola hidup sehat. Salah satu yang dilakukan adalah rutin berjalan kaki. Igor menjelaskan, kebiasaan berjalan kaki telah menjadi bagian dari rutinitas sehari-hari yang tak terpisahkan. Seperti saat tim tidak sengaja bertemu di kawasan Kuningan, Jakarta Selatan. Igor Saykoji terlihat berjalan santai di trotoar dekat Hotel Raffles. ""Tadi parkir di Satrio One, mau ke Lotte. Biar diselipkan jalan kaki aja, nanti balik lagi ke sini,"" kata Igor Saykoji di kawasan Kuningan, Jakarta Selatan pada Jumat 19 Juli 2024.Igor Saykoji mengatakan, jalan kaki sudah menjadi rutinitas sehari-hari. Kebiasaan tersebut sudah dilakukan dua tahun lamanya. ""Di rumah juga ada jalur, 2 KM. Saya nggak terlalu pusing berapa langkah, banyak gerak aja,"" kata pelantun Online ini. Tak hanya sekadar jalan kaki, Igor Saykoji juga fokus olahraga lain. ""Kalau sehari-hari di rumah, ada angkat beban juga,"" ucapnya. Terbukti, dari pola olahraga yang dilakukan, Igor Saykoji sukses menurunkan berat badan. Namun apa yang dilakukan butuh konsistensi. ""Sebulan, orang lain nggak lihat, dua bulan, kita baru ngerasa, tiga bulan, orang lain baru lihat, enam bulan orang mulai nanya 'gimana caranya?' setahun baru orang mikir, 'kayaknya gue pengin kayak dia',"" kata Igor Saykoji.Maka, Igor Saykoji pun memberikan semangat kepada mereka yang mau memulai olahraga. ""Kalau cuma ngejar beberapa bulan mau kurus, lebih kecil, bukannya nggak mungkin, tapi itu akan jadi jangka pendek,"" kata Igor Saykoji. ""Tapi kalau menjadikan ini sebagai kebiasaan baru, nggak mikirin, jalanin aja. Lama-kelamaan hasilnya pasti kelihatan,"" imbuhnya mengakhiri.","Igor Saykoji belakangan menerapkan pola hidup sehat. Salah satu yang dilakukan adalah rutin berjalan kaki. Biar diselipkan jalan kaki aja, nanti balik lagi ke sini,"" kata Igor Saykoji di kawasan Kuningan, Jakarta Selatan pada Jumat 19 Juli 2024.Igor Saykoji mengatakan, jalan kaki sudah menjadi rutinitas sehari-hari. Kebiasaan tersebut sudah dilakukan dua tahun lamanya. "" Terbukti, dari pola olahraga yang dilakukan, Igor Saykoji sukses menurunkan berat badan. Namun apa yang dilakukan butuh konsistensi. "" Sebulan, orang lain nggak lihat, dua bulan, kita baru ngerasa, tiga bulan, orang lain baru lihat, enam bulan orang mulai nanya 'gimana caranya?' Tapi kalau menjadikan ini sebagai kebiasaan baru, nggak mikirin, jalanin aja. Lama-kelamaan hasilnya pasti kelihatan,"" imbuhnya mengakhiri."
"Kini Akhirnya Go Public, Indah Permatasari Ungkap Alasan Rahasiakan Wajah sang Anak",Entertainment,2024-07-26,Ferry Noviandi,https://www.suara.com/entertainment/2024/07/26/160000/kini-akhirnya-go-public-indah-permatasari-ungkap-alasan-rahasiakan-wajah-sang-anak,"Indah Permatasari menjadi satu dari deretan artis yang sempat menyembunyikan wajah anak. Setidaknya, lebih dari setahun istri Arie Kriting ini tak memperlihatkan sisi gemas Naka sang putra. Indah Permatasari menerangkan, alasannya dulu tak mempublikasikan wajah Naka. Hal ini berkaitan dengan mental bintang film Sakaratul Maut tersebut. ""Awal-awal aku melahirkan kenapa enggak aku ekspose, karena kesiapan mental aja sih,"" kata Indah Permatasari saat berkunjung ke kantor , baru-baru ini. Indah Permatasari tidak mau komentar tak sedap menganggu dirinya yang baru menjadi ibu baru.""Aku merasa, enggak mau menambah pikiran, yang di mana orang lain bisa komentar apa saja tentang keluarga kita, apalagi anak. Itu membuat aku kepikiran,"" ucap bintang film Agak Laen ini. Indah Permatasari berharap, dengan cara ini ia bisa mencurahkan pikiran untuk membesarkan Naka.  ""Aku mau fokus membesarkan anak dengan happy dan baik,"" ujar artis 27 tahun ini. Sebenarnya kata Indah, ia tidak terlalu ketat dalam menyembunyikan wajah anak. Namun memang khusus di media sosial, ia menutupi dengan stiker. ""Karena kita juga bukan yang harus menjadikan ini private banget,"" imbuh putri Nursyah ini. Tapi kini, seiring berjalannya waktu, Indah Permatasari sudah siap mental. Beban artis kelahiran Makasaar untuk mengurus anak pun tak lagi seberat saat lahir.""Sebenernya sih bisa dibilang sudah siap. Karena pr-nya enggak terlalu banyak,"" tutur Indah Permatasari. ""Dulu kan harus ASI, pikirin asupan makanan dan lain-lain. Itu yang bikin, ntar dulu deh. Tapi sekarang nggak apa-apa,"" imbuhnya mengakhiri.","Indah Permatasari menjadi satu dari deretan artis yang sempat menyembunyikan wajah anak. Indah Permatasari menerangkan, alasannya dulu tak mempublikasikan wajah Naka. Hal ini berkaitan dengan mental bintang film Sakaratul Maut tersebut. "" Awal-awal aku melahirkan kenapa enggak aku ekspose, karena kesiapan mental aja sih,"" kata Indah Permatasari saat berkunjung ke kantor , baru-baru ini. Itu membuat aku kepikiran,"" ucap bintang film Agak Laen ini. Namun memang khusus di media sosial, ia menutupi dengan stiker. "" Beban artis kelahiran Makasaar untuk mengurus anak pun tak lagi seberat saat lahir. ""Sebenernya sih bisa dibilang sudah siap. Dulu kan harus ASI, pikirin asupan makanan dan lain-lain. Tapi sekarang nggak apa-apa,"" imbuhnya mengakhiri."
"Tak Sembarangan, 7 Cunduk Mentul di Rambut Aaliyah Massaid Punya Makna Filosofis",Entertainment,2024-07-26,Yohanes Endra,https://www.suara.com/entertainment/2024/07/26/141558/tak-sembarangan-7-cunduk-mentul-di-rambut-aaliyah-massaid-punya-makna-filosofis,"Usai dinantikan cukup lama, Thariq Halilintar dan Aaliyah Massaid akhirnya menggelar akad pernikahan pada Jumat 29 Juli 2024. Akad pernikahan ini digelar di Dian Ballroom, Raffles Hotel, Jakarta. Untuk akad pernikahan, pasangan ini memilih menggunakan adat Jawa. Tepatnya adalah adat Jawa Solo seperti yang diutarakan oleh Thariq Halilintar melalui channel YouTube miliknya. ""Acara hari ini itu adat Solo, bisa dilihat dari batiknya. Alhamdulillah acara kita bisa nunjukin budaya-budaya yang keren,"" kata Thariq Halilintar. Adat Jawa Solo ternyata tidak hanya diperlihatkan oleh batik yang dikenakan oleh Aaliyah dan Thariq sebagai bawahan. Namun juga dari riasan yang menghiasi wajah cantik Aaliyah Massaid.Salah satunya tampak jelas dari aksesoris rambut yang dikenakan Aaliyah selama akad pernikahan. Istri Thariq Halilintar itu mengenakan aksesoris rambut bernama Cunduk Mentul. Cunduk Mentul menjadi riasan adat Jawa yang biasanya dikenakan oleh para pengantin. Berbentuk seperti tusuk konde yang dipasang menjulang ke atas di bagian rambut pengantin wanita. Jumlah dati Cunduk Mentul yang dipakai pun beragam, asalkan ganjil. Ada yang memilih Cunduk Mentul berjumlah tiga, lima, tujuh, hingga sembilan. Aaliyah Massaid sendiri memilih mengenakan Cunduk Mentul berjumlah tujuh. Hal yang sama juga dilakukan oleh Aurel Hermansyah ketika dinikahi oleh Atta Halilintar pada tahun 2021 lalu. Jumlah dari Cunduk Mentul yang digunakan oleh pengantin Jawa ini memiliki makna yang filosofis. Biasanya Cunduk Mentul yang berjumlah tujuh digunakan oleh mereka yang menikah menggunakan adat Jawa Solo.Jumlah tujuh merupakan simbol dari pitulungan, pemekaran dari kata pitu yang berarti tujuh dalam bahasa Jawa. Pitulungan bisa diartikan sebagai pertolongan dalam bahasa Indonesia. Makna dari tujuh Cunduk Mentul yang dikenakan pengantin perempuan adalah harapan bahwa nantinya bisa mengarungi bahtera rumah tangga dengan mudah, dengan selalu berada dalam arahan Tuhan Yang Maha Kuasa. Beda lagi jika Cunduk Mentul yang dipakai berjumlah sembilan. Angka sembilan sendiri merupakan simbol dari Wali Songo, tokoh-tokoh yang menyebarkan agama Islam di Pulau Jawa. Jika Cunduk Mentul yang digunakan berjumlah lima, biasanya mewakili adat Jawa Yogya yang dipilih oleh pengantin. Simbol dari angka lima adalah Rukun Islam yang berjumlah lima, mulai dari syahadat hingga haji.","Usai dinantikan cukup lama, Thariq Halilintar dan Aaliyah Massaid akhirnya menggelar akad pernikahan pada Jumat 29 Juli 2024. Akad pernikahan ini digelar di Dian Ballroom, Raffles Hotel, Jakarta. Untuk akad pernikahan, pasangan ini memilih menggunakan adat Jawa. Tepatnya adalah adat Jawa Solo seperti yang diutarakan oleh Thariq Halilintar melalui channel YouTube miliknya. "" Acara hari ini itu adat Solo, bisa dilihat dari batiknya. Alhamdulillah acara kita bisa nunjukin budaya-budaya yang keren,"" kata Thariq Halilintar. Namun juga dari riasan yang menghiasi wajah cantik Aaliyah Massaid. Istri Thariq Halilintar itu mengenakan aksesoris rambut bernama Cunduk Mentul. Berbentuk seperti tusuk konde yang dipasang menjulang ke atas di bagian rambut pengantin wanita. Jumlah tujuh merupakan simbol dari pitulungan, pemekaran dari kata pitu yang berarti tujuh dalam bahasa Jawa. Angka sembilan sendiri merupakan simbol dari Wali Songo, tokoh-tokoh yang menyebarkan agama Islam di Pulau Jawa. Jika Cunduk Mentul yang digunakan berjumlah lima, biasanya mewakili adat Jawa Yogya yang dipilih oleh pengantin. Simbol dari angka lima adalah Rukun Islam yang berjumlah lima, mulai dari syahadat hingga haji."
