title,category,publish_date,author,article_url,content,summary
"Edward Akbar Lesu dan Lebih Kurus di Sidang Cerai, Gara-gara Digugat Kimberly Ryder?",Entertainment,2024-07-24,Yohanes Endra,https://www.suara.com/entertainment/2024/07/24/141116/edward-akbar-lesu-dan-lebih-kurus-di-sidang-cerai-gara-gara-digugat-kimberly-ryder,"Edward Akbar menunjukkan penampilan yang berbeda saat menghadiri sidang cerai perdana dengan Kimberly Ryder di Pengadilan Agama Jakarta Pusat, Rabu 24 Juli 2024. Aktor yang biasa dikenal dengan pembawaan ceria itu terlihat lesu. Bahkan, Edward Akbar juga tampak lebih kurus dari biasanya. Diduga, perubahan fisik Edward Akbar berkaitan dengan masalah rumah tangga yang kini dihadapi dengan Kimberly Ryder. Sebab, aktor 38 tahun sempat mengaku kaget dengan gugatan sang istri. Sempat tidak ada jawaban tentang hal itu, penyebab perubahan fisik Edward Akbar dijawab kuasa hukumnya, Justiartha Hadiwinata.""Memang terlihat lebih kurus, tapi tidak ada kaitannya dengan masalah psikis karena digugat,"" ujar Justiartha Hadiwinata kepada lewat sambungan telepon. Penampilan kurus Edward Akbar lebih disebabkan oleh tuntutan dari salah satu proyek film terbarunya. ""Itu karena Mas Edward sedang terlibat dalam proyek film, jadi lebih ke tuntutan dari peran yang dimainkan,"" imbuh Justiartha Hadiwinata. Dengan demikian, tim kuasa hukum Edward Akbar memastikan gugatan cerai Kimberly Ryder tidak berdampak sehebat itu ke kliennya. Mengingat untuk saat ini, Edward Akbar juga masih optimis bisa mempertahankan rumah tangga dengan Kimberly Ryder.""Ya mungkin kalau agak pucat dan lesu itu karena agak kaget aja dengan adanya masalah ini, seperti yang tadi Mas Edward sampaikan,"" ungkap Justiartha Hadiwinata. Kimberly Ryder menggugat cerai Edward Akbar pada Jumat 12 Juli 2024. Gugatan didaftarkan tim kuasa hukum Kimberly lewat sistem e-court pengadilan. Belum ada penjelasan detail soal alasan perceraian mereka. Hanya terdapat informasi dari Kimberly Ryder bahwa dirinya sempat ditalak tiga lebih dulu oleh Edward Akbar.","Edward Akbar menunjukkan penampilan yang berbeda saat menghadiri sidang cerai perdana dengan Kimberly Ryder di Pengadilan Agama Jakarta Pusat, Rabu 24 Juli 2024. Aktor yang biasa dikenal dengan pembawaan ceria itu terlihat lesu. Bahkan, Edward Akbar juga tampak lebih kurus dari biasanya. Diduga, perubahan fisik Edward Akbar berkaitan dengan masalah rumah tangga yang kini dihadapi dengan Kimberly Ryder. ""Memang terlihat lebih kurus, tapi tidak ada kaitannya dengan masalah psikis karena digugat,"" ujar Justiartha Hadiwinata kepada lewat sambungan telepon. Dengan demikian, tim kuasa hukum Edward Akbar memastikan gugatan cerai Kimberly Ryder tidak berdampak sehebat itu ke kliennya. Gugatan didaftarkan tim kuasa hukum Kimberly lewat sistem e-court pengadilan. Belum ada penjelasan detail soal alasan perceraian mereka."
"Dipanggil Polisi Lagi Soal Kasus Penggelapan Rp 6,9 Miliar, Tiko Aryawardhana Minta Pemeriksaan Ditunda",Entertainment,2024-07-24,Sumarni,https://www.suara.com/entertainment/2024/07/24/132612/dipanggil-polisi-lagi-soal-kasus-penggelapan-rp-69-miliar-tiko-aryawardhana-minta-pemeriksaan-ditunda,"Polres Metro Jakarta Selatan kembali memanggil suami Bunga Citra Lestari, Tiko Aryawardhana atas laporan penggelapan Rp 6,9 miliar dari mantan istrinya, Arina Winarto. Pemeriksaan dijadwalkan hari ini, Rabu 24 Juli 2024 untuk melanjutkan agenda sebelumnya yang belum  selesai. ""Iya, dijadwalkan hari ini. Masih ada yang kurang atau belum ditanyakan dari pemeriksaan sebelumnya,"" ujar Plt. Kasi Humas Polres Metro Jakarta Selatan, AKP Nurma Dewi kepada lewat sambungan telepon. Namun, Tiko Aryawardhana belum bisa hadir memenuhi panggilan penyidik karena alasan kesibukan. Lewat tim kuasa hukumnya, Tiko meminta penjadwalan ulang pemeriksaan.""Tadi mereka menghubungi penyidik, meminta penjadwalan ulang. Hari ini ada kegiatan yang tidak bisa ditinggalkan,"" jelas AKP Nurma Dewi. Penyidik Polres Jakarta Selatan pun sudah menyiapkan rencana agenda pemeriksaan baru untuk Tiko Aryawardhana. ""Kemungkinan pekan depan,"" ucap AKP Nurma Dewi. Laporan Arina Winarto atas dugaan penggelapan yang dilakukan Tiko Aryawardhana terdaftar di Polres Metro Jakarta Selatan sejak 2022. Dugaan penggelapan terjadi sekitar tahun 2015 hingga 2021, saat Tiko dan Arina masih menjalankan bisnis bersama sebagai suami istri. “Didapatkan adanya temuan perihal penggunaan dana sebesar Rp 6,9 miliar yang tidak jelas peruntukkannya,” papar kuasa hukum Arina Winarto, Leo Siregar dalam keterangan tertulis, Senin 3 Juni 2024.Namun, laporan Arina Winarto baru ditetapkan naik ke tahap penyidikan oleh Polres Metro Jakarta Selatan pada Februari 2024. Hingga akhirnya, penyidik mengagendakan pemanggilan untuk Tiko Aryawardhana pada Kamis 11 Juli 2024. Dalam pemeriksaan saat itu, Tiko Aryawardhana membantah tudingan menggelapkan uang Arina Winarto. ""Kami bahas satu per satu, kami jawab satu per satu aliran dananya ke mana. Semua kebutuhan untuk modal usaha dan kami satu per satu membuktikan aliran dananya dalam rekening koran,"" terang kuasa hukum Tiko Aryawardhana, Irfan Aghasar. Untuk menguatkan bantahannya, Tiko Aryawardhana sempat menyerahkan bukti tambahan berupa salinan rekening koran hingga laporan audit bulanan dari bisnis yang sebelumnya dijalankan bersama Arina Winarto.","Polres Metro Jakarta Selatan kembali memanggil suami Bunga Citra Lestari, Tiko Aryawardhana atas laporan penggelapan Rp 6,9 miliar dari mantan istrinya, Arina Winarto. Pemeriksaan dijadwalkan hari ini, Rabu 24 Juli 2024 untuk melanjutkan agenda sebelumnya yang belum  selesai. "" Kasi Humas Polres Metro Jakarta Selatan, AKP Nurma Dewi kepada lewat sambungan telepon. Lewat tim kuasa hukumnya, Tiko meminta penjadwalan ulang pemeriksaan. Hari ini ada kegiatan yang tidak bisa ditinggalkan,"" jelas AKP Nurma Dewi. Dugaan penggelapan terjadi sekitar tahun 2015 hingga 2021, saat Tiko dan Arina masih menjalankan bisnis bersama sebagai suami istri. “ Didapatkan adanya temuan perihal penggunaan dana sebesar Rp 6,9 miliar yang tidak jelas peruntukkannya,” papar kuasa hukum Arina Winarto, Leo Siregar dalam keterangan tertulis, Senin 3 Juni 2024.Namun, laporan Arina Winarto baru ditetapkan naik ke tahap penyidikan oleh Polres Metro Jakarta Selatan pada Februari 2024. Kami bahas satu per satu, kami jawab satu per satu aliran dananya ke mana. Semua kebutuhan untuk modal usaha dan kami satu per satu membuktikan aliran dananya dalam rekening koran,"" terang kuasa hukum Tiko Aryawardhana, Irfan Aghasar."
Ayu Ting Ting Tegaskan Suami Syifa Punya Pekerjaan dan Bertanggung Jawab Pada Keluarga,Entertainment,2024-07-24,Sumarni,https://www.suara.com/entertainment/2024/07/24/130318/ayu-ting-ting-tegaskan-suami-syifa-punya-pekerjaan-dan-bertanggung-jawab-pada-keluarga,"Ayu Ting Ting akhirnya mengklarifikasi pernyataanya beberapa waktu lalu soal tanggung jawabnya membesarkan dan membiayai hidup anak-anak dari adiknya, Assyifa Nuraini. ""Enak dia (Syifa) mah tinggal ngelahirin doang, yang ngebesarin kan gue,"" kata Ayu Ting Ting saat jadi host acara Brownis pekan lalu. Saat itu, Ivan Gunawan selaku host pun menegurnya, ""Pakai perhitungan."" Celetukan Ayu Ting Ting itu sampai viral di media sosial hingga banyak warganet menyerang dirinya serta suami Syifa, Nanda Fachrizal.Adik ipar sang pedangdut itu disebut numpang hidup lantaran dikira tidak memiliki pekerjaan sampai-sampai anak-anaknya harus dibesarkan oleh Ayu Ting Ting, bukan dirinya maupun istrinya. Kini, Ayu Ting Ting menegaskan bahwa apa yang dilontarkan tersebut hanya bercanda dan para host sudah memahaminya tanpa harus dijelaskan. ""Sebenarnya mereka tuh tahu aku bercanda,"" tegas Ayu Ting Ting, dikutip dari unggahan akun Instagram @rumpi_gosip pada Rabu 24 Juli 2024. Sahabat Ruben Onsu ini mengungkap bahwa Nanda Fachrizal merupakan sosok suami dan ayah yang bertanggung jawab. ""Nanda itu alhamdulillah ada pekerjaan, bukan orang pengangguran. Alhamdulillah dia sangat bertanggung jawab kepada istri dan anak-anaknya. Apa itu perlu harus kalian tahu? Enggak kan,"" sambungnya sambil makan.Ayu Ting Ting pun membalas hujatan warganet dengan kata-kata menohok. ""Ya, yang berkomentar buruk silakan teruskan lah dosa-dosa kalian, ya. Aku terima semua pahala dari kalian,"" pungkasnya. Ibunya, Umi Kalsum, turut menimpali sindiran sang anak, ""Bercanda, kalian kan tahu ini orang pelawak.""","Ayu Ting Ting akhirnya mengklarifikasi pernyataanya beberapa waktu lalu soal tanggung jawabnya membesarkan dan membiayai hidup anak-anak dari adiknya, Assyifa Nuraini. "" Celetukan Ayu Ting Ting itu sampai viral di media sosial hingga banyak warganet menyerang dirinya serta suami Syifa, Nanda Fachrizal. Sahabat Ruben Onsu ini mengungkap bahwa Nanda Fachrizal merupakan sosok suami dan ayah yang bertanggung jawab. "" Nanda itu alhamdulillah ada pekerjaan, bukan orang pengangguran. Alhamdulillah dia sangat bertanggung jawab kepada istri dan anak-anaknya. Ya, yang berkomentar buruk silakan teruskan lah dosa-dosa kalian, ya. Ibunya, Umi Kalsum, turut menimpali sindiran sang anak, ""Bercanda, kalian kan tahu ini orang pelawak."""
Edward Akbar Kaget Digugat Cerai Kimberly Ryder: Saya Tidak Pernah Selingkuh,Entertainment,2024-07-24,Yohanes Endra,https://www.suara.com/entertainment/2024/07/24/114537/edward-akbar-kaget-digugat-cerai-kimberly-ryder-saya-tidak-pernah-selingkuh,"Edward Akbar akhirnya buka suara perihal gugatan cerai Kimberly Ryder. Ia mengaku kaget saat surat panggilan sidang datang ke kediamannya. “Saya kaget, jujur. Tiba-tiba ada laporan dan gugatan, kaget dengan apa yang terjadi,” ungkap Edward Akbar di Pengadilan Agama Jakarta Pusat, Rabu 24 Juli 2024. Edward Akbar merasa tidak pernah berbuat salah atau menyakiti hati Kimberly Ryder. “Semenjak menunggu Kim kuliah di Inggris selama pernikahan, saya tidak pernah mendua atau berselingkuh. Saya hanya mendedikasikan diri saya untuk keluarga dan anak-anak,” kata Edward Akbar.Edward Akbar berharap, masalah rumah tangga dengan Kimberly Ryder masih bisa diselesaikan lewat proses mediasi hari ini. Ia memikirkan nasib anak-anak kalau kedua orang tuanya bercerai. “Saya berharap semua bisa baik-baik. Kasihan anak-anak. Yang paling penting adalah anak-anak, untuk tumbuh kembang anak,” jelas Edward Akbar. “Saya kan juga sudah tidak ada kedua orang tua. Saya tahu rasanya,” lanjut sang aktor. Namun di sisi lain, Edward Akbar juga tidak mau berharap banyak. Ia memilih menyerahkan segala keputusan terbaik kepada Sang Khalik. “Semua saya serahkan kepada Yang Kuasa,” ucap Edward Akbar.Kimberly Ryder menggugat cerai Edward Akbar pada Jumat 12 Juli 2024. Gugatan didaftarkan tim kuasa hukum Kimberly lewat sistem e-court pengadilan.","Edward Akbar akhirnya buka suara perihal gugatan cerai Kimberly Ryder. Ia mengaku kaget saat surat panggilan sidang datang ke kediamannya. “ Edward Akbar berharap, masalah rumah tangga dengan Kimberly Ryder masih bisa diselesaikan lewat proses mediasi hari ini. Yang paling penting adalah anak-anak, untuk tumbuh kembang anak,” jelas Edward Akbar. “ Saya kan juga sudah tidak ada kedua orang tua. Namun di sisi lain, Edward Akbar juga tidak mau berharap banyak. Ia memilih menyerahkan segala keputusan terbaik kepada Sang Khalik. “ Gugatan didaftarkan tim kuasa hukum Kimberly lewat sistem e-court pengadilan."
"Diburu Abidzar Al Ghifari, Kini Netizen yang Hina Ustaz Jefri Al Buchori Minta Pengampunan",Entertainment,2024-07-24,Sumarni,https://www.suara.com/entertainment/2024/07/24/101006/diburu-abidzar-al-ghifari-kini-netizen-yang-hina-ustaz-jefri-al-buchori-minta-pengampunan,"Akun X @/ProjectHunterA yang telah menyinggung kematian Ustaz Jefri Al Buchori alias Uje hingga membuat mental anak bungsu Umi Pipik down meminta pengampunan melalui cuitan terbarunya. Pemilik akun tersebut mengatakan bahwa negosiasi dirinya dengan putra kedua mendiang Uje, Abidzar Al Ghifari, tidak menemukan titik terang. ""Sepertinya negosiasi saya dengan Abidzar gagal, karena pesan saya belum sampai ke beliau. Dan kesalahan yang telah saya perbuat ternyata telah menimbulkan kerusakan yang besar, sekali lagi maaf untuk Abidzar dan Umi Pipik, karena telah membuat adik & putri kalian jadi tersiksa,"" tulisnya pada Rabu 24 Juli 2024. Pemilik akun juga tahu bahwa Abidzar sudah membawa kasus ini ke pihak kepolisian dan memburunya. Ia meminta pengampunan terakhir kepada publik.""Karena sudah melibatkan kepolisian, cepat atau lambat saya yakin Abidzar akan menemukan saya. Saya sudah titip pesan terakhir kepada beliau,"" sambungnya. ""Dan pesan saya untuk semua yang membaca ini, saya mohon pengampunan kalian atas dosa besar yang telah saya perbuat,"" imbuhnya lagi. Warganet ini pun berencana menonaktifkan akun X-nya tersebut. ""Saya pamit, sebentar lagi saya akan deact akun ini. Tenang, cepat atau lambat Abidzar akan menemukan saya bagaimana pun kondisi saya saat itu. Mohon pengampunan kalian,"" imbuhnya. Pemilik akun juga memohon kepada warganet yang lain untuk tidak menyerang keluarganya, terutama ayahnya.""Keluarga saya tidak bersalah sedikit pun, termasuk ayah yang saya anggap buruk. Jadi sepeninggal saya, tolong jangan libatkan mereka,"" harapnya. Namun, pemilik akun juga sempat mengancam warganet lain yang menyebarkan komentarnya di dalam ruang komunitas ke ranah luar. ""Pesan saya untuk anda, yang menyebarkan komentar saya kemarin ke luar komunitas, saya tidak tahu siapa anda dan apa tujuan anda menyebarkan hal tersebut. Yang jelas, cepat atau lambat anda akan menyusul saya. Silakan anda artikan sendiri maksud saya tentang menyusul,"" peringatnya. Diketahui, permasalahan ini bermula dari komentar akun @ProjectHunterA tentang kematian Ustaz Jefri Al Buchori pada 2013 silam. Menurut akun tersebut, mendiang Uje bodoh karena keegoisannya dalam mengendarai motor berdampak buruk terhadap keluarga, terutama anak-anak yang tumbuh tanpa sosok ayah. ""Kalo saya jadi anaknya si bakal dendam kesumat sampe gede, gara-gara ayah yang tolol nurutin ego bodohnya, anak jadi tumbuh fatherless dan mendem beban seumur hidup,"" komentar @ProjectHunterA. ""Lihat aja itu anak Uje, mentalnya jadi rada-rada karena tumbuh fatherless,"" ejeknya dalam sebuah komentar di postingan Komunitas Marah Marah.","Akun X @/ProjectHunterA yang telah menyinggung kematian Ustaz Jefri Al Buchori alias Uje hingga membuat mental anak bungsu Umi Pipik down meminta pengampunan melalui cuitan terbarunya. Pemilik akun tersebut mengatakan bahwa negosiasi dirinya dengan putra kedua mendiang Uje, Abidzar Al Ghifari, tidak menemukan titik terang. "" Dan kesalahan yang telah saya perbuat ternyata telah menimbulkan kerusakan yang besar, sekali lagi maaf untuk Abidzar dan Umi Pipik, karena telah membuat adik & putri kalian jadi tersiksa,"" tulisnya pada Rabu 24 Juli 2024. ""Karena sudah melibatkan kepolisian, cepat atau lambat saya yakin Abidzar akan menemukan saya. Saya sudah titip pesan terakhir kepada beliau,"" sambungnya. "" Saya pamit, sebentar lagi saya akan deact akun ini. Pemilik akun juga memohon kepada warganet yang lain untuk tidak menyerang keluarganya, terutama ayahnya. Jadi sepeninggal saya, tolong jangan libatkan mereka,"" harapnya. Pesan saya untuk anda, yang menyebarkan komentar saya kemarin ke luar komunitas, saya tidak tahu siapa anda dan apa tujuan anda menyebarkan hal tersebut. Yang jelas, cepat atau lambat anda akan menyusul saya. Menurut akun tersebut, mendiang Uje bodoh karena keegoisannya dalam mengendarai motor berdampak buruk terhadap keluarga, terutama anak-anak yang tumbuh tanpa sosok ayah. """
"Pasha Ungu Unggah Foto Anak-Anaknya Berangkat ke Sekolah, Baju Seragam Bikin Salfok",Entertainment,2024-07-24,Sumarni,https://www.suara.com/entertainment/2024/07/24/095238/pasha-ungu-unggah-foto-anak-anaknya-berangkat-ke-sekolah-baju-seragam-bikin-salfok,"Unggahan terbaru Pasha Ungu di Instagram mencuri perhatian netizen. Di situ, Pasha Ungu mengunggah beberapa momen anak-anaknya berangkat ke sekolah. Tampak keempat anak Pasha Ungu begitu gembira akan masuk sekolah hari pertama. Tidak hanya berpose bersama, mereka juga kompak bernyanyi bareng dalam perjalanan menuju ke sekolah. Foto dan video keempat anak Pasha Ungu berangkat ke sekolah itu diunggah di Instagram pribadi suami Adelia Pasha itu. Tampak Dewa Hikari Zaidan Ibrahim dan Sakha Dyandra Sultan Yusuf memakai seragam putih yang sama.Begitu juga dengan Aliyan Akhtar Raja Sulaiman dan si cantik Princess Kayla Mutiara Pasha juga memakai seragam yang senada dengan kakak mereka. Keempat anak Pasha Ungu yang selisih usianya tidak terlalu jauh ini terlihat begitu kompak. ""Hari pertama sekolah senengnya,"" tulis Pasha Ungu di Instagram pada captionnya belum lama ini. Momen anak-anak Pasha Ungu dan Adelia Pasha berangkat ke sekolah ini mencuri atensi netizen. Mereka ikut senang melihat betapa kompak dan lucunya kakak beradik ini saat berangkat ke sekolah bersama-sama. Namun, tak sedikit juga warganet yang salah fokus dengan baju seragam anak-anak Pasha Ungu yang dinilai kusut.Netizen juga mengomentari soal mereka yang tidak memakai ikat pinggang. ""Kok pada kusut sih pakaiannya, mana nggak pakai ikat pinggang,"" kata netizen salfok. ""Kok bajunya kusut, maaf,"" ucap lainnya. ""Kenapa pakaiannya kusut-kusut banget, nggak disetrika ya,"" celetuk warganet. ""Kenapa gak pada pakai ikat pinggang sayang?"" tanya yang lain. Namun, banyak juga warganet yang membela. Mereka bilang namanya juga anak-anak, yang penting mereka semangat ke sekolah. ""Baju anak saya juga begitu biarpun sudah disetrika,"" kata warganet. ""Ya ampun sampai baju sempetnya diperhatiin, namanya anak-anak, kalau orang dewasa pakai baju pasti tetap rapi, kalau anak kecil mau rapi gimanapun pasti nggak lama kusut juga,"" bela lainnya. Kontributor : Yoeni Syafitri Sekar","Unggahan terbaru Pasha Ungu di Instagram mencuri perhatian netizen. Di situ, Pasha Ungu mengunggah beberapa momen anak-anaknya berangkat ke sekolah. Tampak keempat anak Pasha Ungu begitu gembira akan masuk sekolah hari pertama. Tidak hanya berpose bersama, mereka juga kompak bernyanyi bareng dalam perjalanan menuju ke sekolah. Tampak Dewa Hikari Zaidan Ibrahim dan Sakha Dyandra Sultan Yusuf memakai seragam putih yang sama. Keempat anak Pasha Ungu yang selisih usianya tidak terlalu jauh ini terlihat begitu kompak. "" Kok pada kusut sih pakaiannya, mana nggak pakai ikat pinggang,"" kata netizen salfok. "" Kenapa gak pada pakai ikat pinggang sayang?"" Namun, banyak juga warganet yang membela. Mereka bilang namanya juga anak-anak, yang penting mereka semangat ke sekolah. "" Baju anak saya juga begitu biarpun sudah disetrika,"" kata warganet. """
"Video Call dari Thailand, Orangtua Setuju Jirayut Pacaran dengan Halda Rianta",Entertainment,2024-07-24,Yazir Farouk,https://www.suara.com/entertainment/2024/07/24/092000/video-call-dari-thailand-orangtua-setuju-jirayut-pacaran-dengan-halda-rianta,"Jirayut dan Halda Rianta menanggapi serius perjodohan mereka yang awalnya hanya untuk lucu-lucuan saja. Bahkan mereka sudah mengantongi restu dari orangtua masing-masing. Perjodohan Halda dan Jirayut bermula saat mereka menjadi bintang tamu dalam salah satu episode PodHub yang dibawakan Deddy Corbuzier dan Vidi Aldiano. Meski hanya guyonan, Halda dan Jirayut terus membicarakan perjodohan mereka di setiap kesempatan, seolah-olah keduanya benar-benar akan menikah. Dalam podcast Close the Door Deddy Corbuzier baru-baru ini, Halda mengaku sempat berkomunikasi dengan ibu Jirayut melalui video call.""Tapi serius ini katanya udah ketemu sama nyokapnya?"" tanya Deddy Corbuzier dikutip pada Selasa 23 Juli 2024. ""Ini, video call,"" ungkap Halda. Jirayut menambahkan bahwa Halda memang sempat mengobrol dengan ibunya melalui video call. ""Terus kata emaknya, 'Tak kesah lah,'"" kata adik Arafah Rianti tersebut. ""Apa artinya tak kesah,"" tanya Deddy Corbuzier penasaran.Jirayut lantas menjelaskan apa yang disampaikan sang ibunda saat melakukan video call dengan Halda. ""Tak kesah tu nggak papa. Nggak papa kalau anaknya cocok, seneng, mama restuin gitu,"" jelas presenter asal Thailand tersebut. Jirayut sendiri belum sempat menemui orangtua Halda karena jadwalnya yang sangat padat. Namun dia mengaku ingin menjalin silaturahmi dengan mereka. Meski belum bertemu secara langsung, Halda mengatakan bahwa ibunya mengaku senang melihat kedekatannya dengan Jirayut. ""Tau nggak, SW (story WhatsApp) emak gue muka kita berdua katanya gini, 'Seneng lihatnya,'"" tuturnya girang. ""Emak aku aja uda oke. Sekarang banyak fans-fans aku kirim ke emak, kata emak aku, 'Lucu banget,'"" pungkas Jirayut. Apakah perjodohan Jirayut dan Halda Rianta akan berlabuh ke pelaminan? Kita tunggu saja! Kontributor : Chusnul Chotimah","Jirayut dan Halda Rianta menanggapi serius perjodohan mereka yang awalnya hanya untuk lucu-lucuan saja. Bahkan mereka sudah mengantongi restu dari orangtua masing-masing. Meski hanya guyonan, Halda dan Jirayut terus membicarakan perjodohan mereka di setiap kesempatan, seolah-olah keduanya benar-benar akan menikah. Dalam podcast Close the Door Deddy Corbuzier baru-baru ini, Halda mengaku sempat berkomunikasi dengan ibu Jirayut melalui video call. tanya Deddy Corbuzier dikutip pada Selasa 23 Juli 2024. "" Jirayut menambahkan bahwa Halda memang sempat mengobrol dengan ibunya melalui video call. "" Namun dia mengaku ingin menjalin silaturahmi dengan mereka. Sekarang banyak fans-fans aku kirim ke emak, kata emak aku, 'Lucu banget,'"" pungkas Jirayut. Apakah perjodohan Jirayut dan Halda Rianta akan berlabuh ke pelaminan?"
"Nobar Deadpool and Wolverine Bareng Aaliyah Massaid, Thariq Halilintar Penasaran Soal Karakter Ini",Entertainment,2024-07-24,Sumarni,https://www.suara.com/entertainment/2024/07/24/090755/nobar-deadpool-and-wolverine-bareng-aaliyah-massaid-thariq-halilintar-penasaran-soal-karakter-ini,"Thariq Halilintar dan Aaliyah Massaid terlihat menghadiri premiere film Deadpool and Wolverine. Keduanya bahkan tampil serasi dengan balutan busana bertema film Marvel ini. Thariq Halilintar menuturkan, dirinya memang mengidolakan film Deadpool and Wolverine. Terutama dari sisi pahlawan dari X-Men tersebut. ""Aku suka banget, udah nungguin dari pas trailernya keluar,"" kata Thariq Halilintar ditemui di Gandaria City, Jakarta Selatan pada Selasa 23 Juli 2024. Soal dari apa yang ditunggu dari film ini, Thariq Halilintar cukup penasaran dengan tokoh Wolverine. Sebab di salah satu seri film X-Men, karakter yang diperankan Hugh Jackman ini meninggal dunia.""Apa ya... dari film ini...? Yang pas... Wolverinenya sih nggak ada lagi. Soalnya kemarin di Logan kan dia meninggal ya...,"" ucap adik Atta Halilintar ini. Tak jauh berbeda dengan Thariq Halilintar, Aaliyah Massaid juga penasaran dengan pemeran Wolverine tersebut. ""Aku suka Hugh Jackman,"" ucapnya singkat. Hadirnya Wolverine dalam trailer film Deadpool 3 tersebut memang memancing rasa penasaran. Sebab seperti yang dibilang Thariq Halilintar, karakter Logan alias Wolverine telah meninggal dunia di filmnya tersebut.Sebagai bocoran, ini merupakan satu dari sekian banyak kejutan yang hadir dalam Deadpool and Wolverine. Lantas, bagaimana bisa sosoknya hidup kembali? Serta hal apa saja yang membuat penonton bertepuk tangan? Simak kisah selengkapnya film Deadpool and Wolverine yang sudah tayang hari ini di bioskop.","Thariq Halilintar dan Aaliyah Massaid terlihat menghadiri premiere film Deadpool and Wolverine. Keduanya bahkan tampil serasi dengan balutan busana bertema film Marvel ini. Terutama dari sisi pahlawan dari X-Men tersebut. "" Aku suka banget, udah nungguin dari pas trailernya keluar,"" kata Thariq Halilintar ditemui di Gandaria City, Jakarta Selatan pada Selasa 23 Juli 2024. Hadirnya Wolverine dalam trailer film Deadpool 3 tersebut memang memancing rasa penasaran. Sebab seperti yang dibilang Thariq Halilintar, karakter Logan alias Wolverine telah meninggal dunia di filmnya tersebut. Lantas, bagaimana bisa sosoknya hidup kembali? Serta hal apa saja yang membuat penonton bertepuk tangan?"
