title,category,publish_date,author,article_url,content,summary
"Azriel Hermansyah Datangi Restoran Pacar, Aura Sarah Menzel Dipuji Berkelas",Entertainment,2024-07-23,Yohanes Endra,https://www.suara.com/entertainment/2024/07/23/151547/azriel-hermansyah-datangi-restoran-pacar-aura-sarah-menzel-dipuji-berkelas,"Gaya pacaran Azriel Hermansyah dan Sarah Menzel kembali menjadi perhatian sejumlah netizen. Kali ini, anak kandung Anang Hermansyah dan Krisdayanti itu pamer kemesraan dengan cara mengunjungi restoran sang kekasih yang berada di Bali. Kompak memakai busana putih, Azriel langsung memperkenalkan restoran milik Sarah Menzel kepada para pengikutnya di media sosial. ""Kita udah sampai di The Kelan. Restorannya Sarah keren banget,"" ujar Azriel dalam video yang diunggah tanggal 20 Juli 2024. Bila menilik videonya, sekilas restoran Sarah Menzel itu berada di tepi pantai. Interiornya cukup mewah karena memiliki sejumlah meja, kursi, dan beragam aksesori yang mentereng dan bernuansa tropis. Berbagai olahan makanan laut menjadi menu andalan di restoran seafood yang berada di kasawan Kuta, Bali.Sarah Menzel lantas menunjukkan lokasi favorit restorannya yang berada di pusat Bali, tepatnya menghadap GWK dan airport I Gusti Ngurah Rai. Sederet netizen lantas memuji pesona Sarah Menzel. Perempuan asal Bali itu disebut tidak hanya memiliki paras yang rupawan, tapi juga cerdas dan mandiri. ""Sarah nih auranya wanita berkelas banget... Cantik, smart, dan mandiri,"" komentar netizen. ""Sarah udah cantik paripurna, tidak sombong walaupun udah jadi pengusaha muda yang sukses, semoga dilancarkan sampai ke jenjang pernikahan ya sama Ziel,"" imbuh netizen yang lain. Selain itu, banyak juga netizen yang tak menyangka dengan kedewasaan Sarah Menzel dan Azriel Hermansyah.""Kalau ngeliatin mereka tuh kaya masih bocah, padahal mah umurnya udah cukup dewasa yah,"" ujar netizen. Sebagai informasi, Sarah Menzel yang lahir dan besar di Bali kini menekuni dunia kuliner lewat restoran barunya di pesisir Pantai Kelan, Kuta, Bali. Tak sendirian, Sarah Menzel mengelola restoran bersama keluarganya, tak terkecuali Kevin Menzel.","Gaya pacaran Azriel Hermansyah dan Sarah Menzel kembali menjadi perhatian sejumlah netizen. Restorannya Sarah keren banget,"" ujar Azriel dalam video yang diunggah tanggal 20 Juli 2024. Interiornya cukup mewah karena memiliki sejumlah meja, kursi, dan beragam aksesori yang mentereng dan bernuansa tropis. Sederet netizen lantas memuji pesona Sarah Menzel. Perempuan asal Bali itu disebut tidak hanya memiliki paras yang rupawan, tapi juga cerdas dan mandiri. "" Sarah nih auranya wanita berkelas banget... Cantik, smart, dan mandiri,"" komentar netizen. "" Sebagai informasi, Sarah Menzel yang lahir dan besar di Bali kini menekuni dunia kuliner lewat restoran barunya di pesisir Pantai Kelan, Kuta, Bali. Tak sendirian, Sarah Menzel mengelola restoran bersama keluarganya, tak terkecuali Kevin Menzel."
"Imbas Kontroversi Wanda Hara, Image Circle Pertemanan Nagita Slavina Disebut Buruk",Entertainment,2024-07-23,Sumarni,https://www.suara.com/entertainment/2024/07/23/125845/imbas-kontroversi-wanda-hara-image-circle-pertemanan-nagita-slavina-disebut-buruk,"Kontroversi Wanda Hara ternyata berimbas pada nama baik circle pertemanannya, yang terdiri dari Nagita Slavina, Nissya Ahmad, Shandy Purnamasari, serta Syahnaz Sadiqah. Beragam hujatan dilayangkan untuk circle pertemanan Wanda Hara, seperti yang dapat dilihat pada postingan Nagita Slavina yang diunggah ulang oleh akun @lambe_turah pada Selasa 23 Juli 2024. Dalam unggahan tersebut, tampak Wanda Hara sedang bersimpuh sambil menangis di hadapan teman-temannya. Di belakangnya, tampak istri Raffi Ahmad sedang menenangkan sang fashion stylist. ""Pembelajaran hidup yang sangat berharga,"" tulis Nagita Slavina sambil menambahkan emoji tangan meminta maaf.Perempuan yang akrab disapa Gigi itu juga berharap Wanda Hara mendapat hidayah dari Tuhan. ""InsyaAllah SWT akan membukakan mata hati untuk ke jalan yang lebih baik @wanda_hara,"" tandasnya. Melihat postingan tersebut, warganet mengaku menjadi tidak respect kepada circle pertemanan Wanda Hara. ""Lebih nggak respect ke circle dia sih. Masa iya nggak ada yang ngasih tahu,"" heran mayvhina***. ""Yang saya heran di awal, pasti temen-temannya itu salah. Kenapa ngebiarin?"" imbuh @cnn***.""Sorry, tapi lebih aneh teman-temannya yang memvalidasi dirinya di Hara itu perempuan. Kalau mereka waras dan emang beneran care sama di Hara, kasih tahu, 'lo itu masih laki, kita wudhu kesentuh lo aja bisa batal',"" kata @rara***. Kasus Wanda Hara bermula dari pria 38 tahun itu memakai cadar dan hijab ketika hadir di acara kajian Ustaz Hanan Attaki pada Sabtu 20 Juli 2024 kemarin. Tidak hanya gaya berpakaian yang mirip perempuan, Wanda Hara juga bergerombol di kelompok perempuan. Padahal, seharusnya ia berada di barisan laki-laki.","Kontroversi Wanda Hara ternyata berimbas pada nama baik circle pertemanannya, yang terdiri dari Nagita Slavina, Nissya Ahmad, Shandy Purnamasari, serta Syahnaz Sadiqah. Beragam hujatan dilayangkan untuk circle pertemanan Wanda Hara, seperti yang dapat dilihat pada postingan Nagita Slavina yang diunggah ulang oleh akun @lambe_turah pada Selasa 23 Juli 2024. Di belakangnya, tampak istri Raffi Ahmad sedang menenangkan sang fashion stylist. "" Perempuan yang akrab disapa Gigi itu juga berharap Wanda Hara mendapat hidayah dari Tuhan. "" Yang saya heran di awal, pasti temen-temannya itu salah. Kalau mereka waras dan emang beneran care sama di Hara, kasih tahu, 'lo itu masih laki, kita wudhu kesentuh lo aja bisa batal',"" kata @rara***. Tidak hanya gaya berpakaian yang mirip perempuan, Wanda Hara juga bergerombol di kelompok perempuan. Padahal, seharusnya ia berada di barisan laki-laki."
"Cantik dan Menawan, Ini 7 Detail Penampilan Salshabilla Adriani di Resepsi Pernikahan",Entertainment,2024-07-23,Sumarni,https://www.suara.com/entertainment/2024/07/23/122048/cantik-dan-menawan-ini-7-detail-penampilan-salshabilla-adriani-di-resepsi-pernikahan,"Salshabilla Adriani dan Ibrahim Risyad telah menggelar resepsi pernikahan mereka di Bali belum lama ini. Acara yang mengusung konsep International wedding itu digelar outdoor dengan pemandangan laut yang indah. Walau sudah lewat, tapi detail penampilan Salshabilla Adriani di resepsi pernikahannya masih jadi perbincangan. Sebab, artis yang akrab disapa Salsha itu tampil sempurna di hari istimewa tersebut. Penasaran sesempurna apa penampilannya? Intip lewat deretan potret berikut. 1. Salshabilla Adriani tampil anggun saat melangsungkan resepsi di Villa Anugrah Uluwatu, Bali. Wedding dress warna putih dengan veil panjang yang sangat indah itu adalah rancangan Maison Baaz Couture.2. Dilihat dari depan, gaun pengantin Salshabilla Adriani memiliki model cut off shoulder. Detail bordir dan payet yang menghiasi dressnya sangat indah dan menampilkan kesan mewah serta elegan. 3. Penampilan menawan Salshabilla Adriani semakin sempurna dengan riasan soft glam kreasi Rhay Hatta. Riasan Salsha yang cukup tegas di bagian mata membuat banyak orang terpana dengan wajah cantiknya yang manglingi. 4. Perpaduan riasan soft dengan rambut ditata low bun yang dikreasikan oleh Fie Wulan menjadikan Salsha semakin menawan. Saat dipotret dari samping dengan mata terpejam seperti ini saja auranya yang mahal tetap terpancar dan menuai banyak pujian. 5. Nah, kalau ini adalah detail payet yang membuat gaun pengantinnya terlihat indah dan mewah. Kemewahan gaunnya dilengkapi dengan set perhiasan dari Frank & Co menjadikan Salshabilla cantik paripurna 6. Untuk menyempurnakan outfit di hari istimewanya, Salshabilla Adriani memilih high heels warna putih. Heelsnya memang memiliki model sederhana namun dengan desainnya itu malah membawa kesan classy.7. Mulai dari wedding dress, make up menawan, hingga venue acara pernikahan Salshabilla Adriani sangat sempurna. Nggak heran kalau Salsha menyebut pernikahannya ini salah satu adalah mimpinya yang menjadi nyata. Itulah tadi detail penampilan Salshabilla Adriani yang begitu sempurna di resepsi pernikahannya. Setiap detail mulai dari gaun pengantin sampai make up menjadi bagian penting yang menyempurnakan hari bahagianya dengan Ibrahim Risyad. Kontributor : Safitri Yulikhah","Salshabilla Adriani dan Ibrahim Risyad telah menggelar resepsi pernikahan mereka di Bali belum lama ini. Acara yang mengusung konsep International wedding itu digelar outdoor dengan pemandangan laut yang indah. Sebab, artis yang akrab disapa Salsha itu tampil sempurna di hari istimewa tersebut. Dilihat dari depan, gaun pengantin Salshabilla Adriani memiliki model cut off shoulder. Detail bordir dan payet yang menghiasi dressnya sangat indah dan menampilkan kesan mewah serta elegan. Riasan Salsha yang cukup tegas di bagian mata membuat banyak orang terpana dengan wajah cantiknya yang manglingi. Heelsnya memang memiliki model sederhana namun dengan desainnya itu malah membawa kesan classy.7. Nggak heran kalau Salsha menyebut pernikahannya ini salah satu adalah mimpinya yang menjadi nyata. Itulah tadi detail penampilan Salshabilla Adriani yang begitu sempurna di resepsi pernikahannya. Setiap detail mulai dari gaun pengantin sampai make up menjadi bagian penting yang menyempurnakan hari bahagianya dengan Ibrahim Risyad."
"Bulan Madu di Vietnam, Romantisnya Chand Kelvin Beri Kejutan Ulang Tahun ke Istri",Entertainment,2024-07-23,Sumarni,https://www.suara.com/entertainment/2024/07/23/110626/bulan-madu-di-vietnam-romantisnya-chand-kelvin-beri-kejutan-ulang-tahun-ke-istri,"Pasangan pengantin baru yakni Chand Kelvin dan Dea Sahirah tengah menikmati masa-masa manis berbulan madu. Resmi menikah pada 7 Juli 2024 lalu, Chand Kelvin baru-baru ini sedang honeymoon ke Vietnam. Chand Kelvin membagikan momen bulan madunya di Instagram pribadinya belum lama ini. Aktor tampan berusia 39 tahun ini mengunggah mini vlog yang merekam perjalanannya dari Jakarta ke Vietnam. Kebahagiaan begitu terpancar dari pasangan pengantin baru ini. Chand Kelvin langsung mengajak sang istri makan bareng begitu sampai di Hanoi, Vietnam. Tidak hanya mencicipi aneka kuliner, Chand Kelvin dan Dea Sahirah juga jalan-jalan keliling Kota Hanoi dengan naik becak. Pasangan ini begitu romantis saat menikmati pemandangan malam Kota Hanoi berdua.""Honeymoon ke Vietnam. Makan-makan dan naik becak keliling kota,"" kata Chand Kelvin di Instagram pribadinya belum lama ini. Terbaru Chand Kelvin juga mengunggah potret-potret romantisnya bareng Dea Sahirah di Kota Sa Pa, Vietnam. Tak lupa di momen tersebut, Chand juga memberi kejutan pada Dea Sahirah yang baru berulang tahun ke-27. Pemain FTV itu memberikan kue ulang tahun cantik berhias strawberry pada sang istri. Chand Kelvin juga mengucapkan doa yang tulus di momen pertambahan usia Dea Sahirah. ""Maasya Allah 2 Minggu berlalu setelah ijab qobul. Dan hari ini adalah ulang tahun pertamamu sebagai seorang istri.. Barakallah Fii Umrik Belahan Hatiku,"" ucap Chand Kelvin. ""Semoga Allah SWT selalu membimbing dan melindungi kita berdua. Semoga kita selalu diberkahi dengan kebahagiaan dan keberkahan dalam menjalani rumah tangga ini. Aamiin YRA,"" lanjutnya.Dea Sahirah juga sempat memposting momen saat Chand Kelvin memberikan kejutan ulang tahun. ""Kemarin di-surprisein terus. Makasih ya Chand Kelvin,"" ujar Dea Sahirah di Instagram Story-nya pada Minggu 21 Juli 2024. Postingan Chand Kelvin bulan madu ini bikin netizen terbawa perasaan alias baper. Banyak netizen yang mengucapkan selamat ultah buat Dea, tetapi juga tak sedikit yang salfok dengan kemiripan wajah keduanya. ""Dunia serasa milik berdua baangeett,"" kata warganet. ""Selamat Ulang Tahun Kak Dea @deasahirah semoga panjang umur, selalu sehat, semakin harmonis langgeng dengan Kak Chand @chand_kelvin . Aamiin YRA,"" doa warganet. ""Emang jodoh. Muka aja sampai mirip,"" kata yang lain salfok. Sebagai informasi, Chand Kelvin dan Dea Sahirah resmi menikah pada 7 Juli 2024 di Hotel Kempinski, Jakarta. Saat akad nikah, Chand Kelvin meminang Dea Sahirah dengan mas kawin logam mulia 77 gram dan uang tunai Rp2.024.000. Kontributor : Yoeni Syafitri Sekar","Pasangan pengantin baru yakni Chand Kelvin dan Dea Sahirah tengah menikmati masa-masa manis berbulan madu. Aktor tampan berusia 39 tahun ini mengunggah mini vlog yang merekam perjalanannya dari Jakarta ke Vietnam. Kebahagiaan begitu terpancar dari pasangan pengantin baru ini. Pasangan ini begitu romantis saat menikmati pemandangan malam Kota Hanoi berdua. Pemain FTV itu memberikan kue ulang tahun cantik berhias strawberry pada sang istri. Maasya Allah 2 Minggu berlalu setelah ijab qobul. Semoga Allah SWT selalu membimbing dan melindungi kita berdua. Semoga kita selalu diberkahi dengan kebahagiaan dan keberkahan dalam menjalani rumah tangga ini. Dea Sahirah juga sempat memposting momen saat Chand Kelvin memberikan kejutan ulang tahun. "" Makasih ya Chand Kelvin,"" ujar Dea Sahirah di Instagram Story-nya pada Minggu 21 Juli 2024. Dunia serasa milik berdua baangeett,"" kata warganet. "" Muka aja sampai mirip,"" kata yang lain salfok. Sebagai informasi, Chand Kelvin dan Dea Sahirah resmi menikah pada 7 Juli 2024 di Hotel Kempinski, Jakarta."
"Sponsori Pernikahan Thariq Halilintar dan Aaliyah Massaid, Putra Siregar Gelontorkan Dana Sampai Miliaran Rupiah?",Entertainment,2024-07-23,Sumarni,https://www.suara.com/entertainment/2024/07/23/104029/sponsori-pernikahan-thariq-halilintar-dan-aaliyah-massaid-putra-siregar-gelontorkan-dana-sampai-miliaran-rupiah,"Thariq Halilintar dan Aaliyah Massaid baru saja melangsungkan pengajian dan siraman. Ini menjadi rangkaian jelang pernikahan pasangan muda tersebut. Menariknya dalam prosesi tersebut, sahabat Thariq Halilintar, Putra Siregar memberikan dukungan yang tak main-main. Pengusaha di bidang elektronik ini bahkan sampai mensponsori pernikahan Thariq Halilintar dan Aaliyah Massaid. ""Iya. Bismillah Allah permudah,"" kata Putra Siregar saat ditemui di kawasan Ampera, Jakarta Selatan pada Senin 22 Juli 2024.Saat disinggung apakah jumlahnya sampai miliaran rupiah, Putra Siregar melempar tawa. Ia menolak untuk membeberkan secara detail. ""Nah itu dirahasiakan. (Sampai Rp 1 miliar?) Ya... Bisa jadi, hehehehe.. bahaya kalau bahas uang,"" ucap Putra Siregar terkekeh. Rencananya, Putra Siregar tak hanya memberikan support berupa sponsor pengajian, siraman dan pernikahan. Ia juga akan memberikan kado buat Thariq Halilintar. ""Aku nih sebenarnya janjian, dia bahkan mau nyamperin. Karena mikirin mau kasih kado apa itu, repot ya. Mengingat, semua udah ada,"" kata Putra Siregar. Karena ingin kadonya menjadi sesuatu yang diperlukan Thariq Halilintar, Putra Siregar pun akan menunggu jawaban dari YouTuber 25 tahun.""Nanti kita tanya bang Thariq lagi pengin apa kira-kira,"" terang Putra Siregar. Pernikahan Thariq Halilintar dan Aaliyah Massaid memang masih dirahasiakan kepada publik. Tapi orang-orang terdekat seperti Putra Siregar telah menerima undangan. Ia pun akan menyempatkan hadir untuk memberikan doa secara langsung buat Thariq Halilintar dan Aaliyah Massaid. ""Saya akan menjadi tamu yang mendoakan hal-hal terbaik buat bang Thariq,"" pungkas pengusaha 29 tahun ini.","Thariq Halilintar dan Aaliyah Massaid baru saja melangsungkan pengajian dan siraman. Ia menolak untuk membeberkan secara detail. "" Ya... Bisa jadi, hehehehe.. bahaya kalau bahas uang,"" ucap Putra Siregar terkekeh. Rencananya, Putra Siregar tak hanya memberikan support berupa sponsor pengajian, siraman dan pernikahan. Karena mikirin mau kasih kado apa itu, repot ya. Mengingat, semua udah ada,"" kata Putra Siregar. Karena ingin kadonya menjadi sesuatu yang diperlukan Thariq Halilintar, Putra Siregar pun akan menunggu jawaban dari YouTuber 25 tahun. Tapi orang-orang terdekat seperti Putra Siregar telah menerima undangan. Ia pun akan menyempatkan hadir untuk memberikan doa secara langsung buat Thariq Halilintar dan Aaliyah Massaid. """
"Perkara Ketahuan Bantu Karyawan Goreng Telur, Titiek Soeharto Tuai Pujian",Entertainment,2024-07-23,Yazir Farouk,https://www.suara.com/entertainment/2024/07/23/204824/perkara-ketahuan-bantu-karyawan-goreng-telur-titiek-soeharto-tuai-pujian,"Pada Jumat 12 Juli 2024 kemarin, Titiek Soeharto resmi membuka bisnis kulinernya, Kopi Klotok, di Bali. Bisnis tersebut merupakan cabang ketiga setelah di Yogyakarta dan Cisarua. Lewat akun Instagram pribadinya, Titiek Soeharto mengabadikan momen pembukaan bisnis kuliner Kopi Klotok yang terletak di kawasan Seminyak. ""Peresmian Waroeng Kopi Klotok Seminyak Bali. Bismillah, semoga berkah untuk semua,"" ucap Titiek Soeharto. Peresmian bisnis kuliner mantan istri Prabowo Subianto tersebut dihadiri oleh beberapa artis Tanah Air. Mereka antara lain Deddy Corbuzier, Sabrina Chairunnisa, dan Anggun C Sasmi.Selang lima hari usai pembukaan, bisnis kuliner ibunda Didit Hediprasetyo tersebut tampaknya mengalami peningkatan jumlah pengunjung. ""Alhamdulillah. Tamu di warung Kopi Klotok Seminyak ramai banget,"" kata Titiek Soeharto. Akibat jumlah pelanggan yang meningkat drastis, Titiek Soeharto pun sampai turun tangan membantu kru yang bertugas di bagian dapur. Dari unggahan yang beredar, anak keempat Presiden ke-2 RI Soeharto tersebut ikut menggoreng telur krispi sebagaimana pesanan pelanggan. ""Jadi bantuin anak-anak dapur goreng telur krispi,"" tutur Titiek Soeharto.Cuplikan unggahan video Titiek Soeharto turun tangan membantu karyawan menggoreng telur saat grand opening Kopi Klotok Seminyak ini viral di media sosial dengan atensi sebanyak 1,1 juta jumlah tayangan. ""Bali 17 Juli 2024"" tulis akun Instagram @titieksoeharto, ditilik pada Selasa 23 Juli 2024. Perihal itu, sejumlah netizen turut memberikan respons dan komentar yang beragam. ""Vibe orang kaya lama. Humble gak flexing,"" tulis seorang netizen. ""Aura old money-nya sangat kuat,"" ucap netizen lain. ""Kapan lagi lihat first lady masak,"" ujar netizen yang lainnya.","Pada Jumat 12 Juli 2024 kemarin, Titiek Soeharto resmi membuka bisnis kulinernya, Kopi Klotok, di Bali. Bisnis tersebut merupakan cabang ketiga setelah di Yogyakarta dan Cisarua. Peresmian Waroeng Kopi Klotok Seminyak Bali. Mereka antara lain Deddy Corbuzier, Sabrina Chairunnisa, dan Anggun C Sasmi. Akibat jumlah pelanggan yang meningkat drastis, Titiek Soeharto pun sampai turun tangan membantu kru yang bertugas di bagian dapur. Jadi bantuin anak-anak dapur goreng telur krispi,"" tutur Titiek Soeharto. Cuplikan unggahan video Titiek Soeharto turun tangan membantu karyawan menggoreng telur saat grand opening Kopi Klotok Seminyak ini viral di media sosial dengan atensi sebanyak 1,1 juta jumlah tayangan. "" Perihal itu, sejumlah netizen turut memberikan respons dan komentar yang beragam. "" Aura old money-nya sangat kuat,"" ucap netizen lain. """
"Sarwendah Masih Berharap Rujuk, Detail Masalah Rumah Tangga Diungkap Setelah Putusan Cerai",Entertainment,2024-07-23,Ferry Noviandi,https://www.suara.com/entertainment/2024/07/23/204500/sarwendah-masih-berharap-rujuk-detail-masalah-rumah-tangga-diungkap-setelah-putusan-cerai,"Sarwendah memberikan sedikit bocoran mengenai masalah dalam rumah tangganya dengan Ruben Onsu, yang kini berujung pada proses perceraian. Lewat tim kuasa hukumnya, Chris Sam Siwu, Sarwendah mengakui bahwa ada pertengkaran yang terjadi di antara dirinya dengan Ruben Onsu. ""Pertengkaran itu memang terjadi. Jadi ya bukan tidak ada pertengkaran. Kalau tidak ada pertengkaran, tidak mungkin ada alasan perceraian. Jadi, pertengkaran memang betul terjadi,"" kata Chris Sam Siwu, ditemui di kawasan Kasablanka, Jakarta Selatan, Selasa 23 Juli 2024. Cekcok antara Ruben Onsu dan Sarwendah dipicu perbedaan prinsip. Namun, masalah itu tidak sampai membuat mereka ribut besar.""Bukan pertengkaran yang hebat, hanya perbedaan prinsip. Jadi ya berseteru, berantem-berantem kecil,"" ujar Chris Sam Siwu. Penjelasan detail soal masalah rumah tangga dengan Ruben Onsu akan Sarwendah sampaikan setelah resmi diputus cerai oleh pengadilan. Untuk saat ini, Sarwendah memilih diam karena masih menjaga peluang rujuk dengan Ruben Onsu. ""Nanti akan dijelaskan secara detail oleh klien kami pada saat setelah putusan. Kenapa setelah putusan? Karena kemungkinan rujuk masih mungkin,"" imbuh Chris Sam Siwu. Hanya saja, tim kuasa hukum Sarwendah tidak berani berandai-andai lebih jauh soal peluang rujuk dengan Ruben Onsu. ""Ya kita doakan saja yang terbaik,"" ucap Chris Sam Siwu.Ruben Onsu menggugat cerai Sarwendah di Pengadilan Negeri Jakarta Selatan. Gugatan didaftarkan Minola Sebayang selaku kuasa hukum Ruben pada 9 Juni 2024. Namun sampai saat ini, sidang belum dapat dilaksanakan karena terhambat dalam proses pemanggilan Sarwendah selaku tergugat.","Sarwendah memberikan sedikit bocoran mengenai masalah dalam rumah tangganya dengan Ruben Onsu, yang kini berujung pada proses perceraian. Kalau tidak ada pertengkaran, tidak mungkin ada alasan perceraian. Jadi, pertengkaran memang betul terjadi,"" kata Chris Sam Siwu, ditemui di kawasan Kasablanka, Jakarta Selatan, Selasa 23 Juli 2024. ""Bukan pertengkaran yang hebat, hanya perbedaan prinsip. Nanti akan dijelaskan secara detail oleh klien kami pada saat setelah putusan. Karena kemungkinan rujuk masih mungkin,"" imbuh Chris Sam Siwu. Hanya saja, tim kuasa hukum Sarwendah tidak berani berandai-andai lebih jauh soal peluang rujuk dengan Ruben Onsu. "" Gugatan didaftarkan Minola Sebayang selaku kuasa hukum Ruben pada 9 Juni 2024. Namun sampai saat ini, sidang belum dapat dilaksanakan karena terhambat dalam proses pemanggilan Sarwendah selaku tergugat."
"Berusia 59 Tahun, Keanu Reeves Mulai Sering Memikirkan Kematian",Entertainment,2024-07-23,Yazir Farouk,https://www.suara.com/entertainment/2024/07/23/203000/berusia-59-tahun-keanu-reeves-mulai-sering-memikirkan-kematian,"Usia aktor Hollywood Keanu Reeves tak muda lagi. Karenanya, belakangan dia mengaku sering memikirkan tentang kematian. ""Saya sudah 59 tahun, jadi saya sering memikirkan tentang kematian,"" kata Keanu Reeves kepada Keanu Reeves kepada BBC baru-baru ini dilansir dari laman NME. Namun, Reeves menekankan bahwa pemikiran tersebut bukanlah sesuatu yang negatif, melainkan sebaliknya. Justru dengan mengingat kematian, lanjut Reeves, dia jadi lebih menghargai hidup. Aktor The Matrix ini juga jadi lebih peka dengan potensi yang dipunya.""Semoga dengan memikirkan kematian nggak membuat kita diam saja,"" ujarnya. Reeves kini sedang sibuk mempromosikan novel grafis barunya, The Book of Elsewhere, yang didasarkan pada seri buku suksesnya, BRZRKR. Berbicara tentang komik dan media novel grafis, ia mengatakan, ""Saya menyukai gambar-gambar ini… Saya menyukai kata-kata dan penceritaan, dan saya menyukai cara keterlibatan ini saling berlapis. Jadi, Anda bisa melihat seni dan kemudian mengikuti ceritanya."" Reeves menulis novel tersebut bersama dengan penulis fiksi ilmiah Inggris, China Miéville. Ceritanya mengikuti seorang pejuang abadi yang ingin bisa mati. ""Saya nggak menulis novel. China yang menulis novel,"" ujar Reeves.Namun, China dalam wawancara yang sama menimpali bahwa pernyataan itu terlalu jauh, ""Novel ini nggak akan ada dalam bentuknya tanpa peran yang sangat bijaksana dan hati-hati dengan Keanu,"" katanya. Keanu Reeves memiliki nama lengkap Keanu Charles Reeves dan lahir di Beirut, Lebanon pada 2 September 1964. Keanu Reeves memulai karier aktingnya di teater dan televisi sebelum mendapatkan peran film pertamanya dalam film Youngblood (1986). Nama Keanu mulai dikenal luas melalui film Bill & Ted's Excellent Adventure (1989) dan sekuelnya. Namanya kian melambung tinggi berkat perannya sebagai Neo di film The Matrix. Selain akting, Keanu juga merupakan seorang musisi. Ia adalah bassist dari band Dogstar dan juga terlibat dalam band Becky.","Usia aktor Hollywood Keanu Reeves tak muda lagi. Justru dengan mengingat kematian, lanjut Reeves, dia jadi lebih menghargai hidup. Reeves kini sedang sibuk mempromosikan novel grafis barunya, The Book of Elsewhere, yang didasarkan pada seri buku suksesnya, BRZRKR. Jadi, Anda bisa melihat seni dan kemudian mengikuti ceritanya."" Ceritanya mengikuti seorang pejuang abadi yang ingin bisa mati. "" Namun, China dalam wawancara yang sama menimpali bahwa pernyataan itu terlalu jauh, ""Novel ini nggak akan ada dalam bentuknya tanpa peran yang sangat bijaksana dan hati-hati dengan Keanu,"" katanya. Keanu Reeves memulai karier aktingnya di teater dan televisi sebelum mendapatkan peran film pertamanya dalam film Youngblood (1986). Namanya kian melambung tinggi berkat perannya sebagai Neo di film The Matrix. Selain akting, Keanu juga merupakan seorang musisi. Ia adalah bassist dari band Dogstar dan juga terlibat dalam band Becky."
