title,category,publish_date,author,article_url,content,summary
"Silsilah Keluarga Clara Wirianda, Selebgram Yang Diisukan Punya Hubungan dengan Bobby Nasution",Entertainment,2024-09-27,Yohanes Endra,https://www.suara.com/entertainment/2024/09/27/082000/silsilah-keluarga-clara-wirianda-selebgram-yang-diisukan-punya-hubungan-dengan-bobby-nasution,"Clara Wirianda sedang menjadi topik hangat di media sosial Twitter buntut namanya menggema saat proses pengundian nomor urut Bobby Nasution di Pilgub Sumut 2024. Seperti diketahui, Bobby Nasution disoraki nama Clara oleh pendukung lawan politiknya dalam acara rapat pleno KPU di Grand Mercure Medan pada Senin 23 September 2024. ""Lanjutkan, lanjutkan. Clara, Clara, Clara, Fufufafa,"" teriak tim pendukung Cagubsu nomor urut 2 dari sisi kanan meja rapat KPU Sumut. Lantas, siapakah sosok Clara Wirianda? Berikut adalah biodata sang selebgram yang dikabarkan memiliki hubungan dengan Bobby Nasution.Profesi ClaraClara Wirianda dikenal sebagai seorang selebgram asal Medan yang memiliki jumlah followers sebanyak 132 ribu pengguna Instagram. Dalam akun Instagram pribadinya yang bernama @clarawiriianda, Clara Wirianda kerap membagikan aktivitas terbarunya. Pendidikan ClaraClara Wirianda tercatat pernah berkuliah di Universitas Muhammadiyah Sumatera Utara (UMSU) dengan program studi Ilmu Komunikasi. Dia meraih gelar sarjananya dari kampus itu pada 2021 lalu. Selama berkuliah, Clara Wirianda aktif dalam organisasi kemahasiswaan sebagai Sekretaris Umum periode 2020/2021, UKM LPM Teropong UMSU. Silsilah ClaraAdapun soal orang tua, Clara Wirianda dikabarkan bernama Slamet Wicaksana dan Uwonya Ismayanti. Akan tetapi, informasi lebih lanjut soal kedua orang tuanya masih belum diketahui.Hubungan dengan BobbyMenantu Presiden Jokowi, Bobby Nasution, pernah diterpa isu perselingkuhan dengan Clara Wirianda beberapa waktu lalu. Meski begitu, Clara Wirianda dan Bobby Nasution hingga kini tak kunjung memberikan klarifikasi ihwal isu miring tersebut.","Clara Wirianda sedang menjadi topik hangat di media sosial Twitter buntut namanya menggema saat proses pengundian nomor urut Bobby Nasution di Pilgub Sumut 2024. Seperti diketahui, Bobby Nasution disoraki nama Clara oleh pendukung lawan politiknya dalam acara rapat pleno KPU di Grand Mercure Medan pada Senin 23 September 2024. "" Profesi ClaraClara Wirianda dikenal sebagai seorang selebgram asal Medan yang memiliki jumlah followers sebanyak 132 ribu pengguna Instagram. Pendidikan ClaraClara Wirianda tercatat pernah berkuliah di Universitas Muhammadiyah Sumatera Utara (UMSU) dengan program studi Ilmu Komunikasi. Dia meraih gelar sarjananya dari kampus itu pada 2021 lalu. Silsilah ClaraAdapun soal orang tua, Clara Wirianda dikabarkan bernama Slamet Wicaksana dan Uwonya Ismayanti. Meski begitu, Clara Wirianda dan Bobby Nasution hingga kini tak kunjung memberikan klarifikasi ihwal isu miring tersebut."
Beda Souvenir Acara Tedak Siten Anak Denny Caknan dengan Atta Halilintar,Entertainment,2024-09-27,Yohanes Endra,https://www.suara.com/entertainment/2024/09/27/073000/beda-souvenir-acara-tedak-siten-anak-denny-caknan-dengan-atta-halilintar,"Denny Caknan menambah panjang daftar artis Tanah Air yang menggelar acara Tedak Siten 7 bulan kelahiran anaknya. Jauh sebelum Denny Caknan, artis lain yang santer disorot karena acara menggelar Tedak Siten 7 bulan kelahiran anak adalah Atta Halilintar. Di samping busana dan prosesi upacara adat, souvenir acara Tedak Siten anak Denny Caknan dan Atta Halilintar juga tak kalah menarik untuk dibicarakan. Dilansir pada Kamis 26 September 2024, berikut adalah perbandingan souvenir acara Tedak Siten 7 bulanan anak Denny Caknan dan Atta Halilintar.Anak Denny Caknan Acara Tedak Siten anak pertama Denny Caknan dan Bella Bonita, Sabil Maturangga Cundamani, berlangsung pada Selasa 24 September 2024. Acara itu digelar di Ngawi, Jawa Timur. Menurut unggahan akun TikTok @metalklenik, bingkisan Tedak Siten Cundamani terdiri dari dua kantong besar dengan isi berbeda. Salah satu kantong dihiasi dengan karakter animasi serta tulisan nama lengkap Cundamani. Kantong pertama berisi makanan yang dibungkus menggunakan kardus cantik, sedangkan kantong kedua berupa botol minum berukuran kecil. Anak Atta HalilintarSementara itu, Atta Halilintar menggelar acara Tedak Siten anak pertamanya dengan Aurel Hermansyah, Ameena Hana Nur Atta, pada Minggu 25 September 2024 di kawasan Jakarta. Dalam unggahan Thariq Halilintar dan Fuji, souvenir acara Tedak Siten Ameena berupa tas berwarna putih dengan motif bunga. Di bagian tengah tas tersebut, terdapat foto Ameena yang didampingi oleh kedua orang tuanya, yakni Atta Halilintar dan Aurel Hermansyah. Demikian adalah perbandingan souvenir acara Tedak Siten 7 bulanan anak Atta Halilintar dengan Denny Caknan.","Denny Caknan menambah panjang daftar artis Tanah Air yang menggelar acara Tedak Siten 7 bulan kelahiran anaknya. Dilansir pada Kamis 26 September 2024, berikut adalah perbandingan souvenir acara Tedak Siten 7 bulanan anak Denny Caknan dan Atta Halilintar. Anak Denny Caknan Acara Tedak Siten anak pertama Denny Caknan dan Bella Bonita, Sabil Maturangga Cundamani, berlangsung pada Selasa 24 September 2024. Menurut unggahan akun TikTok @metalklenik, bingkisan Tedak Siten Cundamani terdiri dari dua kantong besar dengan isi berbeda. Salah satu kantong dihiasi dengan karakter animasi serta tulisan nama lengkap Cundamani. Kantong pertama berisi makanan yang dibungkus menggunakan kardus cantik, sedangkan kantong kedua berupa botol minum berukuran kecil."
"7 Momen Dian Sastro Hadiri Seoul Drama Awards 2024, Menyala di Red Carpet",Entertainment,2024-09-27,Yazir Farouk,https://www.suara.com/entertainment/2024/09/27/063000/7-momen-dian-sastro-hadiri-seoul-drama-awards-2024-menyala-di-red-carpet,"Dian Sastrowardoyo atau Dian Sastro turut menghadiri Seoul International Drama Awards (SIDA) 2024 yang digelar pada Rabu 25 September 2024 di KBS Hall, Seoul, Korea Selatan. Tak sendirian, Dian hadir bersama tim produksi Gadis Kretek. Serial Netflix yang dibintanginya berhasil meraih penghargaan Best Miniseries di ajang tersebut. Untuk penampilannya kali ini, Dian Sastro begitu memukau dalam balutan gaun merah menyala. Berikut adalah sederet momen sang aktris selama menghadiri Seoul International Drama Awards 2024. Dian Sastro membuat banyak pasang mata tertuju padanya dengan tampil memakai gaun merah menawan rancangan desainer kenamaan Indonesia, Hian Tjen. Rambut pendek sebahunya digerai dalam tatanan bergelombang.Gadis Kretek yang disutradarai oleh Kamila Andini dan Ifa Isfansyah berhasil meraih penghargaan kategori Best Miniseries. Bersama Kamila Andini, Dian Sastro naik ke atas panggung menerima piala penghargaan sekaligus memberikan pidato kemenangan. Melalui unggahan story di Instagram, istri Maulana Indraguna Sutowo itu memamerkan pencapaian Gadis Kretek di ajang penghargaan internasional. Dian Sastro membagikan potretnya dan Kamila Andini bersama Best Miniseries yang berhasil mereka raih. Dian Sastro terlihat mengabadikan momen kebersamaan dengan Kim Hye Yoon, bintang drama Lovely Runner. Aktris Korea tersebut tampil manis mengenakan off-the-shoulder dress berwarna kuning cerah dengan rambut panjang bergelombang. Selain Kim Hye Yoon, Dian Sastro juga mengambil foto bersama Park Chan Wook. Sutradara kondang yang dikaguminya itu berhasil penyabet penghargaan Golden Bird Prize untuk serial HBO-nya, The Sympathizer. Dian Sastro tampaknya tak menyia-nyiaka momen langka di mana dia bisa bertemu rekan sejawat dari negara lain. Aktris berusia 42 tahun itu berfoto selfie dengan Ahn Jae Hong dan Yeom Hye Ran dari serial Netflix Mask Girl.Dian Sastro dan tim Gadis Kretek mengajak Song Kang Ho untuk mengabadikan momen bersama mereka. Bintang film Parasite itu membawa pulang piala Aktor Terbaik untuk perannya dalam Uncle Samsik. Itu dia beberapa momen Dian Sastro saat menghadiri Seoul International Drama Awards 2024. Penampilannya tak kalah menawan dari para bintang Korea Selatan. Setuju? Kontributor : Chusnul Chotimah","Dian Sastrowardoyo atau Dian Sastro turut menghadiri Seoul International Drama Awards (SIDA) 2024 yang digelar pada Rabu 25 September 2024 di KBS Hall, Seoul, Korea Selatan. Tak sendirian, Dian hadir bersama tim produksi Gadis Kretek. Serial Netflix yang dibintanginya berhasil meraih penghargaan Best Miniseries di ajang tersebut. Untuk penampilannya kali ini, Dian Sastro begitu memukau dalam balutan gaun merah menyala. Berikut adalah sederet momen sang aktris selama menghadiri Seoul International Drama Awards 2024. Rambut pendek sebahunya digerai dalam tatanan bergelombang. Dian Sastro terlihat mengabadikan momen kebersamaan dengan Kim Hye Yoon, bintang drama Lovely Runner. Aktris Korea tersebut tampil manis mengenakan off-the-shoulder dress berwarna kuning cerah dengan rambut panjang bergelombang. Dian Sastro tampaknya tak menyia-nyiaka momen langka di mana dia bisa bertemu rekan sejawat dari negara lain. Bintang film Parasite itu membawa pulang piala Aktor Terbaik untuk perannya dalam Uncle Samsik. Penampilannya tak kalah menawan dari para bintang Korea Selatan."
"Bikin Fans Terkejut, Jaehyun NCT Umumkan Segera Berangkat Wajib Militer",Entertainment,2024-09-27,Sumarni,https://www.suara.com/entertainment/2024/09/27/060000/bikin-fans-terkejut-jaehyun-nct-umumkan-segera-berangkat-wajib-militer,"Member NCT, Jung Jaehyun membuat fans terkejut setelah diumumkan bakal segera berangkat wajib militer. Jaehyun menjadi member kedua NCT yang menjalani wajib militer. Sebelumnya sudah ada Taeyong. Menurut SM Entertainment selaku pihak agensi, Jaehyun NCT akan memulai wajib militernya pada 4 November 2024. Jaehyun NCT bakal bergabug dengan Army Band. ""Jaehyun NCT melamar ke Army Band dan menerima pemberitahuan penerimaan dari Administrasi Tenaga Kerja Militer hari ini,"" kata SM Entertainment melansir dari Soompi pada Kamis 26 September 2024.""Oleh karena itu, ia dijadwalkan untuk mendaftar sebagai tentara aktif pada tanggal 4 November untuk memenuhi layanan wajibnya,"" sambungnya lagi. SM Entertainment mengingatkan para penggemar untuk tidak mengunjungi lokasi militer Jaehyun NCT. Hal ini demi keselamatan bersama. ""Pada hari dia masuk ke pusat pelatihan rekrutmen, tidak akan ada acara resmi untuk mencegah kecelakaan keselamatan akibat kemacetan akibat kehadiran banyak tentara dan keluarganya,"" tuturnya. Terakhir, SM Entertainment meminta fans tetap memberikan dukungan terhadap Jaehyun NCT meskipun akan hiatus cukup lama. ""Kami meminta dukungan dan cinta kalian yang tak tergoyahkan hingga Jaehyun menyelesaikan wajib militernya dan kembali dalam keadaan sehat. Terima kasih,"" tandasnya.","Member NCT, Jung Jaehyun membuat fans terkejut setelah diumumkan bakal segera berangkat wajib militer. Menurut SM Entertainment selaku pihak agensi, Jaehyun NCT akan memulai wajib militernya pada 4 November 2024. SM Entertainment mengingatkan para penggemar untuk tidak mengunjungi lokasi militer Jaehyun NCT. Pada hari dia masuk ke pusat pelatihan rekrutmen, tidak akan ada acara resmi untuk mencegah kecelakaan keselamatan akibat kemacetan akibat kehadiran banyak tentara dan keluarganya,"" tuturnya. Kami meminta dukungan dan cinta kalian yang tak tergoyahkan hingga Jaehyun menyelesaikan wajib militernya dan kembali dalam keadaan sehat."
"Agnez Mo Disebut-sebut di Tengah Kasus P. Diddy, Momen Penolakan Klub Striptis Diulas Lagi",Entertainment,2024-09-26,Yohanes Endra,https://www.suara.com/entertainment/2024/09/26/220000/agnez-mo-disebut-sebut-di-tengah-kasus-p-diddy-momen-penolakan-klub-striptis-diulas-lagi,"Di tengah maraknya kabar terkait kasus rapper Sean John Combs alias P Diddy, sosok Agnes Monica, atau Agnez Mo, mendadak ikut menjadi bahan perbincangan warganet. Bukan karena Agnez Mo terlibat secara langsung dengan kasus tersebut, melainkan karena ucapannya beberapa tahun lalu tentang 'gelapnya' industri musik Hollywood saat hadir di podcast Daniel Mananta. Dalam podcast yang tayang tahun 2021 itu, Agnes menceritakan bagaimana para musisi atau penyanyi Hollywood mempromosikan lagu mereka. ""Mereka itu kalo promosi di klub striptis (tari telanjang). Menurut mereka itu tidak apa-apa, itu bagian dari promosi. Aku nggak mau menghakimi mereka, karena itu tanggung jawab mereka ke Tuhan,"" kata Agnes, dikutip pada Kamis 26 September 2204.Sebagai penyanyi yang kala itu sedang meniti karier di Hollywood, Agnes juga pernah mendapat tawaran tersebut. Kebetulan saat itu Agnes sedang mempromosikan lagu Overdose melalui radio-radio di Amerika Serikat. ""Gilanya, pada saat itu gue ditelepon oleh label gue dan manajemen gue saat itu, gue dibilang, 'Eh, ini ada 3 klub striptis yang mau lo datang cuma 30 menit', itu namanya walk through,"" kisahnya. ""Jadi lu cuma datang, DJ-nya mainin lagu lo, lo di sana kayak hosting, terus lo pulang. Lo cuma perlu ada di sana. 1 klub striptis 25 ribu USD (Rp 377 juta). 25 ribu, 3 klub striptis dalam 1 malam, cuma 30 menit,"" sambungnya. Namun, Agnes secara tegas menolak ajakan menggiurkan tersebut.""Lo tahu gak mukanya orang-orang pas gue ngomong, 'Maaf, gue nggak bisa lakuin itu'. Mukanya mereka kayak, 'bentar, apa?'. Karena buat mereka kayak, 'apa? Ag, ini 75 ribu dollar dan lu bilang enggak?' Karena buat mereka itu kan kayak kerjaan,"" imbuhnya. ""Tapi gue memilih untuk tidak melakukan karena mungkin terlalu buat gue. Untukku, hidupku bukan hanya tentang musikku (karirku),"" pungkasnya. Perkataan Agnes itu pun mendapat pujian dari warganet, seperti yang terlihat dalam unggahan akun @lambegosiip. ""Gimana pun gue bangga sama Agnes. dia bisa jadi dirinya sendiri,"" kata seorang warganet. ""Makanya dia susah terkenal di barat sana, karena Agnes punya prinsip,"" imbuh warganet lain. ""Tetap bangga sama Agnez Mo, sangat berprinsip,"" dukung warganet lainnya.","Di tengah maraknya kabar terkait kasus rapper Sean John Combs alias P Diddy, sosok Agnes Monica, atau Agnez Mo, mendadak ikut menjadi bahan perbincangan warganet. Dalam podcast yang tayang tahun 2021 itu, Agnes menceritakan bagaimana para musisi atau penyanyi Hollywood mempromosikan lagu mereka. "" Mereka itu kalo promosi di klub striptis (tari telanjang). Menurut mereka itu tidak apa-apa, itu bagian dari promosi. Gilanya, pada saat itu gue ditelepon oleh label gue dan manajemen gue saat itu, gue dibilang, 'Eh, ini ada 3 klub striptis yang mau lo datang cuma 30 menit', itu namanya walk through,"" kisahnya. "" Namun, Agnes secara tegas menolak ajakan menggiurkan tersebut. Karena buat mereka itu kan kayak kerjaan,"" imbuhnya. "" Tapi gue memilih untuk tidak melakukan karena mungkin terlalu buat gue. Untukku, hidupku bukan hanya tentang musikku (karirku),"" pungkasnya. Perkataan Agnes itu pun mendapat pujian dari warganet, seperti yang terlihat dalam unggahan akun @lambegosiip. "" Makanya dia susah terkenal di barat sana, karena Agnes punya prinsip,"" imbuh warganet lain. """
"Biasa Bercanda, Detik-detik Komeng Serius saat Rapat DPD Bikin Kaget Warganet",Entertainment,2024-09-26,Yohanes Endra,https://www.suara.com/entertainment/2024/09/26/181500/biasa-bercanda-detik-detik-komeng-serius-saat-rapat-dpd-bikin-kaget-warganet,"Momen Komeng unjuk gigi dalam rapat DPD baru-baru ini sukses mencuri perhatian publik. Pasalnya, sang komedian yang biasa bercanda, kini membawakan ekspresi dan gestur yang serius. Kendati belum resmi dilantik, Komeng diduga sudah memulai kegiatannya sebagai anggota DPD Jawa Barat. Dalam rapat tersebut, dia tampil mengenakan busana formal berupa kemeja putih, jas, dan dasi. Menurut pemilik nama asli Alfiansyah Bustami itu, senator seharusnya ikut terlibat dalam perumusan APBD di daerah pemilihan masing-masing. ""Kalau bisa ditambahkan setiap yang merancang APBD, harusnya DPD dapilnya ada di situ dan ikut merancang,"" kata Komeng.Pasalnya, ungkap komedian yang lekat dengan slogan 'Uhuy' tersebut, kinerja DPD kerap dipertanyakan oleh masyarakat. ""Saya, orang baru, dari dulu hanya mendengar BPD gak punya gigi, ini gimana gigitnya kalau ompong?"" sambung Komeng. Oleh karena itu, Komeng berharap usulannya dapat diterima sehingga DPD dapat menunjukan kinerja yang nyata untuk masyarakat. ""Saya juga (sempat) tersinggung, katanya di sini orang-orang daripada nganggur akhirnya masuk DPD. Makanya supaya DPD ini kuat, jangan dibicarakan caranya melulu tapi kapan bergeraknya,"" tutur Komeng. Cuplikan unggahan video Komeng dalam rapat DPD ini viral di media sosial Twitter dengan atensi sebanyak 182 ribu jumlah tayangan.""Keseriusan Komeng ketika membicarakan anggaran,"" tulis akun @maman1965, dilansir pada Kamis 26 September 2024. Perihal itu, sejumlah netizen turut memberikan respons dan komentar yang beragam. Sebagian netizen mengutarakan ekspresi kagum melihat Komeng mode serius. ""Gak sia-sia pemilu yang lalu, saya coblos foto Bang Komeng yang agak lain itu. Demi Indonesia yang semakin uhuy,"" tulis seorang netizen. ""Komeng bisa lucu, tapi bisa waras juga. Beda dengan Mulyono, gak lucu juga gak waras,"" ucap netizen lain. ""Untuk pertama kali dapat melihat Komeng serius. Selamat bekerja,"" ujar netizen yang lainnya.","Momen Komeng unjuk gigi dalam rapat DPD baru-baru ini sukses mencuri perhatian publik. Kendati belum resmi dilantik, Komeng diduga sudah memulai kegiatannya sebagai anggota DPD Jawa Barat. Kalau bisa ditambahkan setiap yang merancang APBD, harusnya DPD dapilnya ada di situ dan ikut merancang,"" kata Komeng. Pasalnya, ungkap komedian yang lekat dengan slogan 'Uhuy' tersebut, kinerja DPD kerap dipertanyakan oleh masyarakat. "" ""Keseriusan Komeng ketika membicarakan anggaran,"" tulis akun @maman1965, dilansir pada Kamis 26 September 2024. Perihal itu, sejumlah netizen turut memberikan respons dan komentar yang beragam. Sebagian netizen mengutarakan ekspresi kagum melihat Komeng mode serius. "" Gak sia-sia pemilu yang lalu, saya coblos foto Bang Komeng yang agak lain itu. Untuk pertama kali dapat melihat Komeng serius. Selamat bekerja,"" ujar netizen yang lainnya."
"Bangkit dari Keterpurukan Ekonomi usai Gagal Nyaleg, Dede Sunandar Sekarang Kerja Ini, Gajinya Menjanjikan",Entertainment,2024-09-26,Ferry Noviandi,https://www.suara.com/entertainment/2024/09/26/173000/bangkit-dari-keterpurukan-ekonomi-usai-gagal-nyaleg-dede-sunandar-sekarang-kerja-ini-gajinya-menjanjikan,"Lama tak terdengar kabarnya usai kalah dalam pencalonan anggota legislatif di Pemili 2024 lalu, Dede Sunandar ternyata kini punya profesi baru. Sudah jarang muncul di layar kaca, Dede Sunandar rupanya tengah menggeluti profesi barunya sebagai karyawan di suatu pabrik alat kesehatan di daerah Yogyakarta dan Tegal. ""Saya itu sebenarnya memang ada (bekerja) di salah satu PT, di bagian alat kesehatan dan bekerja di bagian media sosialnya. Jadi sempat vakum di TV,"" kata Dede Sunandar saat ditemui di kawasan Pondok Gede, Bekasi, Kamis 26 September 2024. ""Kadang-kadang TV manggil, cuma sayanya lagi ada di Yogya atau di Tegal. Jadi memang lagi ngurus alat kesehatan di daerah situ,"" ucapnya menyambung.Dede lalu mengungkap pekerjaannya cukup menjanjikan dengan gaji Rp10 hingga Rp15 juta perbulan. Belum lagi dia diberi fasilitas rumah dan kendaraan dari kantornya. Hal ini yang membuat Dede Sunandar memilih untuk menggeluti profesi ini dibanding menetap di dunia entertainment. ""Kalau sekarang kan ibaratnya di 10 atau 15, itu sudah alhamdulillah bersyukur banget lah intinya. Sudah bisa nabung juga, terus ada jenjang kariernya,"" ucap Dede. ""Terus difasilitasi dengan ada kendaraan, dengan ada rumah. Ya itu menurut Dede yang sangat luar biasa lah untuk seorang Dede,"" imbuhnya. Meski harus jauh dari keluarga, namun pekerjaan ini harus dilakukan Dede Sunandar untuk membangkitkan ekonomi keluarganya. Dede sendiri sudah mendapat restu sang istri, Karen Hertatum untuk bekerja di luar kota.""Betul, jauh. Pulang cuma sebulan sekali. Kadang-kadang mereka nyusul ke Yogya, kan di sana dikasih rumah juga. Karena memang buat ke depannya,"" tutur mantan bintang komedi OVJ ini. ""Saya bekerja begini, saya bilang (sama istri) 'buat membangkitkan ekonomi kita lagi sayang'. 'Oh ya sudah pa, kita percaya'. Sudah akhirnya kita jalan,"" imbuh Dede Sunandar. Sebagai informasi, Dede Sunandar sebelumnya kalah menduduki kursi DPRD Kota Bekasi pada Pemilu 2024 lalu. Saat itu Dede hanya memperoleh 20 suara. Dede juga mengaku demi modal nyaleg, dia sampai menjual dua unit mobilnya. Sang pelawak lalu disebut-sebut bangkrut karena kekalahannya di ajang pencalonan politik tersebut.","Lama tak terdengar kabarnya usai kalah dalam pencalonan anggota legislatif di Pemili 2024 lalu, Dede Sunandar ternyata kini punya profesi baru. Sudah jarang muncul di layar kaca, Dede Sunandar rupanya tengah menggeluti profesi barunya sebagai karyawan di suatu pabrik alat kesehatan di daerah Yogyakarta dan Tegal. "" Kadang-kadang TV manggil, cuma sayanya lagi ada di Yogya atau di Tegal. Jadi memang lagi ngurus alat kesehatan di daerah situ,"" ucapnya menyambung. Belum lagi dia diberi fasilitas rumah dan kendaraan dari kantornya. Kalau sekarang kan ibaratnya di 10 atau 15, itu sudah alhamdulillah bersyukur banget lah intinya. Terus difasilitasi dengan ada kendaraan, dengan ada rumah. Meski harus jauh dari keluarga, namun pekerjaan ini harus dilakukan Dede Sunandar untuk membangkitkan ekonomi keluarganya. Karena memang buat ke depannya,"" tutur mantan bintang komedi OVJ ini. "" Saya bekerja begini, saya bilang (sama istri) 'buat membangkitkan ekonomi kita lagi sayang'. ' Sudah akhirnya kita jalan,"" imbuh Dede Sunandar."
Uya Kuya Kena Tegur Gara-Gara Ikut Angkat Kasus Ustaz Cabuli Anak Tiri di Cirebon,Entertainment,2024-09-26,Sumarni,https://www.suara.com/entertainment/2024/09/26/162855/uya-kuya-kena-tegur-gara-gara-ikut-angkat-kasus-ustaz-cabuli-anak-tiri-di-cirebon,"Uya Kuya sempat ikut mengangkat kasus ustaz mencabuli anak tirinya di Cirebon, Jawa Barat lewat sebuah podcast pada April 2024. Kala itu, Uya mengundang istri sang pemuka agama, selaku pihak yang membuat laporan ke Polres Cirebon Kota. Kini, pihak lelaki bernama Sutriyono Arifin itu buka suara. Agus Prayoga selaku kuasa hukum memberikan teguran terhadap Uya Kuya atas keberadaan konten podcast dengan istri kliennya. ""Ini tuh sebenarnya masalah internal keluarga, tapi sama Uya Kuya digorengnya berlebihan,"" ujar Agus Prayoga kepada lewat sambungan telepon, Kamis 26 September 2024. Dalam podcast, Uya Kuya disebut Agus Prayoga melebih-lebihkan cerita tentang tindak asusila yang dialami anak tiri kliennya.""Seolah-olah jadi ada pemerkosaan, lalu muncul juga anggapan no viral no justice. Padahal sebenarnya tidak seperti itu,"" kata Agus Prayoga. Anak tiri Sutriyono Arifin sendiri, menurut versi Agus Prayoga, tidak pernah membenarkan tudingan pencabulan yang dialamatkan kepada sang ayah. ""Korbannya pun bilang, tidak pernah ada perkosaan,"" tutur Agus Prayoga. Tim kuasa hukum Sutriyono Arifin sudah berusaha meminta hak jawab dari Uya Kuya, agar kliennya bisa memberikan penjelasan atas tuduhan pencabulan terhadap sang anak tiri. Namun sampai hari ini, permintaan itu belum direspons oleh sang artis. ""Uya Kuya itu saat ke Cirebon, saat ke rumah Vina, di situ sudah kami tegur. Kami minta hak jawab lah, minta klarifikasi. Tapi itu tidak pernah dilakukan,"" jelas Agus Prayoga.Besar harapan kuasa hukum Sutriyono Arifin untuk Uya Kuya bersedia memberikan kesempatan bersuara bagi kliennya. Agus Prayoga menyebut podcast Uya Kuya ikut memberikan dampak negatif terhadap lelaki yang biasa disapa Kang Nono itu. ""Ya kami minta hak jawab lah. Kan klien kami jadi dituduh paedofilia dan macem-macem. Padahal sebenernya tidak,"" ucap Agus Prayoga. Kalau tetap tidak ada itikad baik dari Uya Kuya, kuasa hukum Sutriyono Arifin mengancam bakal membuat laporan polisi atas tuduhan menyebar berita hoaks. ""Bisa kami kenakan penyebaran berita hoaks nanti kalau kami laporkan,"" tandas Agus Prayoga.","Uya Kuya sempat ikut mengangkat kasus ustaz mencabuli anak tirinya di Cirebon, Jawa Barat lewat sebuah podcast pada April 2024. Kala itu, Uya mengundang istri sang pemuka agama, selaku pihak yang membuat laporan ke Polres Cirebon Kota. Kini, pihak lelaki bernama Sutriyono Arifin itu buka suara. ""Seolah-olah jadi ada pemerkosaan, lalu muncul juga anggapan no viral no justice. Padahal sebenarnya tidak seperti itu,"" kata Agus Prayoga. Namun sampai hari ini, permintaan itu belum direspons oleh sang artis. "" Uya Kuya itu saat ke Cirebon, saat ke rumah Vina, di situ sudah kami tegur. Kami minta hak jawab lah, minta klarifikasi. Besar harapan kuasa hukum Sutriyono Arifin untuk Uya Kuya bersedia memberikan kesempatan bersuara bagi kliennya. Kan klien kami jadi dituduh paedofilia dan macem-macem. Kalau tetap tidak ada itikad baik dari Uya Kuya, kuasa hukum Sutriyono Arifin mengancam bakal membuat laporan polisi atas tuduhan menyebar berita hoaks. """
