title,category,publish_date,author,article_url,content,summary
"Jebolan Kontes Swara Bintang, Ongky Muntazar Hadirkan Single Terbaru 'Mampu Tanpamu'",Entertainment,2024-09-29,Sumarni,https://www.suara.com/entertainment/2024/09/29/100000/jebolan-kontes-swara-bintang-ongky-muntazar-hadirkan-single-terbaru-mampu-tanpamu,"Jebolan Kontes Swara Bintang, Ongky Muntazar baru saja merilis single ke-4. Lagu berjudul Mampu Tanpamu tersebut diciptakan sendiri olehnya. Ongky Muntazar bercerita, lagu ini berkisah tentang penyembuhan diri dan penerimaan setelah kehilangan orang yang dicintai. Melalui lagu ini, Ongky Muntazar mau menekankan pentingnya bangkit dari keterpurukan. Sebagai pribadi, seseorang harus melanjutkan hidup meskipun harus melangkah sendiri. ""Banyak dari kita yang pernah mengalami kehilangan atau perpisahan, dan lagu ini adalah bentuk ekspresi dari proses menemukan kedamaian batin,"" kata Ongky Muntazar dalam konferensi pers di Senayan, Jakarta Pusat pada Sabtu 28 September 2024.Lirik yang kuat ini, disempurnakan dengan melodi yang membuat orang mendengarnya ikut hanyut. Sebagai informasi, Ongky Muntazar atau kerap dipanggil Ongky adalah juara ajang pencarian bakat yang diadakan MNCTV, Kontes Swara Bintang. Dengan kemenangan yang diraih, Ongky Muntazar berharap dapat konsisten berkarya di Industri Musik. Sebelum merilis Mampu Tanpamu, Ongky Muntazar telah merilis 3 single yaitu. Lagu tersebut diantaranya 'Sajak Hati', 'Khianat Terbesar' dan 'Melukis Bahagia'.","Jebolan Kontes Swara Bintang, Ongky Muntazar baru saja merilis single ke-4. Melalui lagu ini, Ongky Muntazar mau menekankan pentingnya bangkit dari keterpurukan. Banyak dari kita yang pernah mengalami kehilangan atau perpisahan, dan lagu ini adalah bentuk ekspresi dari proses menemukan kedamaian batin,"" kata Ongky Muntazar dalam konferensi pers di Senayan, Jakarta Pusat pada Sabtu 28 September 2024.Lirik yang kuat ini, disempurnakan dengan melodi yang membuat orang mendengarnya ikut hanyut. Sebagai informasi, Ongky Muntazar atau kerap dipanggil Ongky adalah juara ajang pencarian bakat yang diadakan MNCTV, Kontes Swara Bintang. Lagu tersebut diantaranya 'Sajak Hati', 'Khianat Terbesar' dan 'Melukis Bahagia'."
"Akui Sering Berkata Kasar ke Moa Aeim, Lee Jeong Hoon Berkaca-kaca Berjanji Bakal Berubah",Entertainment,2024-09-29,Sumarni,https://www.suara.com/entertainment/2024/09/29/070000/akui-sering-berkata-kasar-ke-moa-aeim-lee-jeong-hoon-berkaca-kaca-berjanji-bakal-berubah,"Lee Jeong Hoon dengan jujur mengakui kelemahan dirinya dalam berkomunikasi dengan sang istri, Moa Aeim. Dia mengatakan bahwa ia kerap menggunakan kata-kata kasar ketika sedang marah. Hal tersebut diungkap lelaki asal Korea itu saat menjadi bintang tamu Pagi Pagi Ambyar belum lama ini. ""Mungkin cara bahasa ku yang kasar, jadi aku akan belajar lebih baik biar ngomongnya lebih sopan,"" ungkap Lee. Lee mengakui menyesali hal tersebut. Dengan mata yang berkaca-kaca, dia ingin berubah.""Pasti (ingin berubah), pokoknya I love you,"" tambah Lee. Sebagai bentuk permintaan maafnya kepada sang istri, Lee berencana pergi ke Amerika menyusul istrinya. ""Nanti tinggal 2 hari lagi aku akan kesana kita ketemuan,"" terangnya. Seperti diketahui Lee Jeong Hoon dan istrinya, Moa Aeim sedang menjalani LDM atau yang lebih dikenal dengan long distance marriage. Moa Aeim saat ini sedang berada di Amerika menemani buah hatinya yang sekolah. Namun kabarnya, dia menyusul ke Amerika karena ada pertengkaran kecil dengan sang suami.","Lee Jeong Hoon dengan jujur mengakui kelemahan dirinya dalam berkomunikasi dengan sang istri, Moa Aeim. Dia mengatakan bahwa ia kerap menggunakan kata-kata kasar ketika sedang marah. Dengan mata yang berkaca-kaca, dia ingin berubah. Sebagai bentuk permintaan maafnya kepada sang istri, Lee berencana pergi ke Amerika menyusul istrinya. "" Nanti tinggal 2 hari lagi aku akan kesana kita ketemuan,"" terangnya. Seperti diketahui Lee Jeong Hoon dan istrinya, Moa Aeim sedang menjalani LDM atau yang lebih dikenal dengan long distance marriage."
"Akun Instagram Kakak Dibajak, Maia Estianty Geram Sampai Sumpahi Pelaku Buat Tobat",Entertainment,2024-09-28,Sumarni,https://www.suara.com/entertainment/2024/09/28/214500/akun-instagram-kakak-dibajak-maia-estianty-geram-sampai-sumpahi-pelaku-buat-tobat,"Maia Estianty baru-baru ini mengumumkan bahwa akun Instagram milik kakaknya, Pinky Eviaty, telah dibajak oleh seorang hacker. Kabar tersebut disampaikan Maia melalui media sosial pribadinya. Ibu dari Al Ghazali, El Rumi, dan Dul Jaelani itu mengungkapkan bahwa akun yang diretas kini digunakan untuk melakukan penipuan berupa giveaway palsu. ""Akun kakak saya Pinky Eviaty lagi di-hack! Terus bikin GIVE AWAY, jangan tertipu!"" tulis Maia Estianty dalam unggahannya. Pentolan grup musik Duo Ratu itu pun tampak geram atas insiden tersebut. Mantan istri Ahmad Dhani itu bahkan menyumpahi pelaku agar segera bertobat dan berhenti melakukan aksi serupa di masa depan.""Hackers, gua sumpahin lu tobat! Berbuat baik! Dan nggak ngulangin lagi,"" ungkapnya penuh emosi. Hingga saat ini, belum diketahui apakah akun tersebut sudah berhasil dipulihkan atau belum. Namun, banyak warganet yang ikut memberikan berbagai respons dan saran. Salah satu warganet memberikan tips mengenai cara mengembalikan akun Instagram yang diretas. ""Coba masuk pakai emailnya. Kalau emailnya sudah kena hack juga, bisa pakai pemulihan nomor HP, lalu disetting ulang masuk IG, login IG pakai nomor HP jika di-hack kembali nanti ada notice masuk via SMS,"" tulis akun @aqi***. Ada juga yang menyarankan Maia agar segera melaporkan insiden tersebut.""Wih parah, auto report, Bun,"" tulis seorang warganet. Tak sedikit juga warganet yang menawarkan jasa pemulihan akun. ""Bunda Maia, kalau boleh saya mau coba pulihkan akun kakak Bunda. Saya jasa pemulihan akun, Bun. Pembayaran setelah akun dipulihkan,"" ungkap warganet lainnya.","Maia Estianty baru-baru ini mengumumkan bahwa akun Instagram milik kakaknya, Pinky Eviaty, telah dibajak oleh seorang hacker. Kabar tersebut disampaikan Maia melalui media sosial pribadinya. Dan nggak ngulangin lagi,"" ungkapnya penuh emosi. Kalau emailnya sudah kena hack juga, bisa pakai pemulihan nomor HP, lalu disetting ulang masuk IG, login IG pakai nomor HP jika di-hack kembali nanti ada notice masuk via SMS,"" tulis akun @aqi***. Ada juga yang menyarankan Maia agar segera melaporkan insiden tersebut. Tak sedikit juga warganet yang menawarkan jasa pemulihan akun. "" Bunda Maia, kalau boleh saya mau coba pulihkan akun kakak Bunda. Pembayaran setelah akun dipulihkan,"" ungkap warganet lainnya."
"Jejak Digital Terkuak, Agnez Mo Miliki Hubungan Dekat dengan Keluarga P Diddy",Entertainment,2024-09-28,Sumarni,https://www.suara.com/entertainment/2024/09/28/204000/jejak-digital-terkuak-agnez-mo-miliki-hubungan-dekat-dengan-keluarga-p-diddy,"Imbas viralnya skandal perdagangan seks yang diduga dilakukan oleh P Diddy, nama Agnez Mo muncul dan viral di X. Dilansir oleh pada Sabtu 28 September 2024, Agnez Mo dikaitkan dengan seorang anggota keluarga dari P Diddy. Tepatnya adalah pria bernama Quincy Brown. Mungkin publik Indonesia dibuat asing dengan nama Quincy Brown ini. Beda halnya dengan dunia Hollywood yang mengenal Quincy sebagai anak dari model ternama Kim Porter. Menariknya, Kim Porter pernah menjalin hubungan asmara dengan P Diddy. Hubungan tersebut yang kemudian membuat Quincy Brown dianggap sebagai anak dari P Diddy.""Circle-nya ga kaleng-kaleng. @agnezmo juga berteman dgn Quincy Brown, putra angkat P Diddy,"" bunyi keterangan yang disertakan dalam unggahan di X oleh akun @LiaaRevalia. Pada unggahan tersebut, terkuak pula seperti apa kedekatan dari Agnez Mo dengan anak dari P Diddy. Kedekatan itu dijelaskan melalui kehadiran Quincy dalam acara milik Agnez Mo. ""Quincy pernah hadir di acara song release party-nya Agnez Mo. Kalau mau pake cara dark, Agnez bisa taklukkan Hollywood dari dulu,"" tambah pemilik akun. ""Tapi dia pilih jalan berbeda. Gapapa, Nez. jangan jual jiwa dan imanmu. Tuhan memberkatimu,"" sambungnya. Sayang sekali, terkuaknya jejak digital ini tidak serta merta mendatangkan dukungan untuk Agnez Mo. Ada pula yang melayangkan kritikan untuknya.""Niki gak pakai cara dark jauh lebih maju,"" kata warganet. ""Tapi tetap nggak membenarkan gara-gara ini dia gak bisa tembus Industri Holywood, banyak yang gka sangkut paut sama dia tetap bisa kok,"" tambah yang lain. ""Ya meski gini juga coba lo objektif dah lagu lagu dia downgrade banget, segitu pengennya jadi singer yang ga sesuai warnanya,"" kritik warganet.","Imbas viralnya skandal perdagangan seks yang diduga dilakukan oleh P Diddy, nama Agnez Mo muncul dan viral di X. Dilansir oleh pada Sabtu 28 September 2024, Agnez Mo dikaitkan dengan seorang anggota keluarga dari P Diddy. Tepatnya adalah pria bernama Quincy Brown. Mungkin publik Indonesia dibuat asing dengan nama Quincy Brown ini. Beda halnya dengan dunia Hollywood yang mengenal Quincy sebagai anak dari model ternama Kim Porter. Pada unggahan tersebut, terkuak pula seperti apa kedekatan dari Agnez Mo dengan anak dari P Diddy. Kedekatan itu dijelaskan melalui kehadiran Quincy dalam acara milik Agnez Mo. ""Quincy pernah hadir di acara song release party-nya Agnez Mo. Kalau mau pake cara dark, Agnez bisa taklukkan Hollywood dari dulu,"" tambah pemilik akun. "" Ya meski gini juga coba lo objektif dah lagu lagu dia downgrade banget, segitu pengennya jadi singer yang ga sesuai warnanya,"" kritik warganet."
"Rayakan Anniversary Pacaran 4 Tahun, Tissa Biani Unggah Foto-Foto Tak Biasa dengan Dul Jaelani",Entertainment,2024-09-28,Sumarni,https://www.suara.com/entertainment/2024/09/28/200500/rayakan-anniversary-pacaran-4-tahun-tissa-biani-unggah-foto-foto-tak-biasa-dengan-dul-jaelani,"Tissa Biani mengunggah beberapa potret yang tersimpan dan belum pernah diunggahnya. Foto-foto itu tak biasa karena mereka bukannya bermesraan justru beberapa adalah potret tak jaim keduanya. Ada foto romantis saat Dul menyuapi kue ulang tahun, namun ekspresi Tissa justru menyeramkan karena tak siap difoto. Berikutnya foto nyeleneh Tissa dan Dul yang tak siap difoto atau memang sengaja bergaya seperti itu. Lalu potret Tissa tampak jijik saat dipandang Dul. Baru kemudian foto-foto mereka yang suka naik gunung dipamerkan. Memang bukan foto romantis dan lebih ke seru-seruan mereka.Namun ada juga potret keduanya sedang gandengan tangan saat mendaki gunung bersama, serta potret Dul yang selalu berada di belakang Tissa ketika berjalan selama mendaki. Terkesan biasa namun hal itu justru membuat mereka dinilai sebagai pasangan yang apa adanya dan tak dibuat-buat. Terbaru, ada foto selfie Tissa dan Dul yang juga anti jaim-jaim club. Baru di slide terakhir, Tissa mengunggah chat keduanya saat pertama kali mulai dekat. Di situ, Dul meminta Tissa menyimpan nomor WA-ya. Tak tunggu waktu lama, Dul juga langsung menelpon Tissa untuk sekadar ngobrol. Di caption postingannya, Tissa menuliskan sebuah pengharapan untuk hubungan mereka ke depannya.Dia juga meminta doa pada netizen untuk hubungannya dengan Dul agar langgeng. ""Potret 4 tahun pacaran hehehe. Happy Anniversary! semoga kamu selalu aman dan nyaman bersamaku. semoga perjalanan cinta aku dan kamu berlabuh di keindahan. mohon doanya,"" tulisnya pada Jumat 27 September 2024. Maia Estianty terlihat meninggalkan komentar di postingan tersebut. ""Unyu,"" tulisnya. Ada juga yang suka dengan pasangan satu ini karena sederhana dan tak jaim dalam menjalani hubungan. ""Emang pasangan yang gak ada jaim-jaimnya kalo posting foto,"" komentar netizen. Beberapa menyoroti chat Dul Jaelani dan Tissa Biani di awal mereka dekat. Dul begitu sopan dengan wanita pilihannya. ""Aaaa gemes bgt DUL! Boleh aku telf? Aaa bahagia selalu Tissa dan Dul,"" komentar netizen. ""Nanya dulu sibuk apa enggak, ""boleh ku telvon gak"","" kata netizen lain menyoroti isi chat Dul ke Tissa. ""Oh awal mulai nya begitu. Kaya ftv ya,"" tambah netizen semakin gemas. Kontributor : Tinwarotul Fatonah","Tissa Biani mengunggah beberapa potret yang tersimpan dan belum pernah diunggahnya. Foto-foto itu tak biasa karena mereka bukannya bermesraan justru beberapa adalah potret tak jaim keduanya. Ada foto romantis saat Dul menyuapi kue ulang tahun, namun ekspresi Tissa justru menyeramkan karena tak siap difoto. Lalu potret Tissa tampak jijik saat dipandang Dul. Baru kemudian foto-foto mereka yang suka naik gunung dipamerkan. Terkesan biasa namun hal itu justru membuat mereka dinilai sebagai pasangan yang apa adanya dan tak dibuat-buat. Di caption postingannya, Tissa menuliskan sebuah pengharapan untuk hubungan mereka ke depannya. semoga kamu selalu aman dan nyaman bersamaku. semoga perjalanan cinta aku dan kamu berlabuh di keindahan. Maia Estianty terlihat meninggalkan komentar di postingan tersebut. "" Beberapa menyoroti chat Dul Jaelani dan Tissa Biani di awal mereka dekat. Dul begitu sopan dengan wanita pilihannya. "" Nanya dulu sibuk apa enggak, ""boleh ku telvon gak"","" kata netizen lain menyoroti isi chat Dul ke Tissa. """
"Tanggapi Penangkapan Andrew Andika, Tengku Dewi: Syukur-syukur Ini Jadi 'Tamparan'",Entertainment,2024-09-29,Yohanes Endra,https://www.suara.com/entertainment/2024/09/29/170000/tanggapi-penangkapan-andrew-andika-tengku-dewi-syukur-syukur-ini-jadi-tamparan,"Model Tengku Dewi turut menanggapi penangkapan mantan suaminya, Andrew Andika, atas dugaan penyalahgunaan narkoba jenis sabu pada Kamis 26 September 2024. Dalam postingan Instagram Story pada Sabtu 28 September 2024, Tengku Dewi tidak mau ikut campur dan membiarkan Andrew Andika bertanggung jawab atas perbuatannya sendiri. Tengku Dewi berharap penangkapan ini dapat menjadi teguran keras dalam hidup Andrew Andika. ""Cuma bisa bilang, dia sudah dewasa dan ini pilihan hidupnya. Biarkan dia bertanggung jawab atas perbuatannya,"" tulis ibu dua anak itu.""Syukur-syukur ini benar-benar menjadi tamparan buat pelajaran di hidupnya agar dia bisa jadi manusia yang lebih baik lagi ke depannya,"" sambungnya. Meski begitu, Tengku Dewi berharap mantan suaminya dapat melalui kasus ini dengan baik serta kooperatif. ""Semoga dia bisa melalui semua ini dengan baik dan bisa mengikuti proses hukum dengan sebaik-baiknya,"" harapnya. Tengku Dewi pun berterima kasih kepada orang-orang yang telah mendukungnya serta menanyakan kondisi anak-anaknya. ""Makasih support-nya ya teman-teman. Aku baik-baik aja dan aku bisa jamin anak-anak juga akan aman dengan mommy-nya. Aku kuat dan aku tahu itu berkat doa kalian,"" ucapnya.Pada kalimat akhir, Tengku Dewi yakin apa yang terjadi pada Andrew Andika merupakan karma atas perlakuan sang mantan suami terhadap dirinya selama ini. ""Semoga hal-hal yang aku alami bisa jadi hikmah dan pelajaran buat kita semua. Hukum tabur tuai itu nyata,"" pungkasnya. Sebelumnya, Tengku Dewi juga sempat mengunggah ulang sebuah kutipan yang menyinggung pembalasan dendam. ""Tidak perlu balas dendam. Hanya perlu duduk dan tunggu. Mereka yang menyakitimu lambat laun akan menghancurkan diri mereka sendiri dan jika kamu beruntung, Tuhan akan membiarkanmu menyaksikannya,"" bunyi kutipan tersebut.","Model Tengku Dewi turut menanggapi penangkapan mantan suaminya, Andrew Andika, atas dugaan penyalahgunaan narkoba jenis sabu pada Kamis 26 September 2024. Dalam postingan Instagram Story pada Sabtu 28 September 2024, Tengku Dewi tidak mau ikut campur dan membiarkan Andrew Andika bertanggung jawab atas perbuatannya sendiri. ""Syukur-syukur ini benar-benar menjadi tamparan buat pelajaran di hidupnya agar dia bisa jadi manusia yang lebih baik lagi ke depannya,"" sambungnya. Meski begitu, Tengku Dewi berharap mantan suaminya dapat melalui kasus ini dengan baik serta kooperatif. "" Aku baik-baik aja dan aku bisa jamin anak-anak juga akan aman dengan mommy-nya. Aku kuat dan aku tahu itu berkat doa kalian,"" ucapnya. Semoga hal-hal yang aku alami bisa jadi hikmah dan pelajaran buat kita semua. Sebelumnya, Tengku Dewi juga sempat mengunggah ulang sebuah kutipan yang menyinggung pembalasan dendam. """
"Aksesnya Gak Kaleng-Kaleng, Maia Estianty Didapuk Kibarkan Bendera Finis MotoGP Mandalika",Entertainment,2024-09-29,Yazir Farouk,https://www.suara.com/entertainment/2024/09/29/161746/aksesnya-gak-kaleng-kaleng-maia-estianty-didapuk-kibarkan-bendera-finis-motogp-mandalika,"Kehadiran Maia Estianty dalam pertandingan balap MotoGP di Sirkuit Mandalika, Lombok, Nusa Tenggara Barat (NTB) pada Minggu 29 September 2024 sukses mencuri perhatian publik. Pasalnya, Maia Estianty tak hanya sekadar menyaksikan menonton. Istri Irwan Mussry ini juga didapuk sebagai pengibar bendera finis. Dari unggahan yang beredar, mantan istri Ahmad Dhani itu mengibarkan bendera finis ketika pembalap MotoGP asal Spanyol Jorge Martin melintasi garis akhir. Tidak hanya itu, Maia juga mengibarkan bendera finis MotoGP seorang diri tanpa dibantu oleh Marshall.""Halo MotoGP fans aku sekarang berada di Mandalika untuk nonton MotoGP,"" kata Maia Estianty, dilansir dari akun @watch.corner.id pada Minggu 29 September 2024.. Sementara itu, Irwan Mussry mendapat kesempatan untuk mengalungi medali kepada para jawara pembalap MotoGP di Mandalika. Selain Jorge Martin, Pedro Acosta dan Francesco Bagnaia juga dikalungi medali oleh ayah sambung El Rumi tersebut. Momen penganugerahan medali tersebut diakhiri jabatan tangan Irwan Mussry dengan ketiga juara pembalap MotoGP di Mandalika. ""Bangga sama suami@ Didokumentasikan dari sekian banyak wartawan di area penyerahan medali Sprint MotoGP, ada penyusup satu, Maia Estianty,"" kata Maia Estianty.Perihal itu, sejumlah netizen turut memberikan respons dan komentar beragam. Sebagian netizen memuji aksi Maia Estianty mengibarkan bendera finis. ""Wow Bunda Maia di stasiun TV pegang bendera waktu finish. Menyala,"" tulis seorang netizen. ""Aku lihat Bunda yang finis lambaikan bendera, cantik banget,"" ucap netizen lain. ""Pengibar bendera finish Moto GP, keren,"" ujar netizen yang lainnya.","Kehadiran Maia Estianty dalam pertandingan balap MotoGP di Sirkuit Mandalika, Lombok, Nusa Tenggara Barat (NTB) pada Minggu 29 September 2024 sukses mencuri perhatian publik. Pasalnya, Maia Estianty tak hanya sekadar menyaksikan menonton. Istri Irwan Mussry ini juga didapuk sebagai pengibar bendera finis. Dari unggahan yang beredar, mantan istri Ahmad Dhani itu mengibarkan bendera finis ketika pembalap MotoGP asal Spanyol Jorge Martin melintasi garis akhir. ""Halo MotoGP fans aku sekarang berada di Mandalika untuk nonton MotoGP,"" kata Maia Estianty, dilansir dari akun @watch.corner.id pada Minggu 29 September 2024.. Sementara itu, Irwan Mussry mendapat kesempatan untuk mengalungi medali kepada para jawara pembalap MotoGP di Mandalika. Perihal itu, sejumlah netizen turut memberikan respons dan komentar beragam. Aku lihat Bunda yang finis lambaikan bendera, cantik banget,"" ucap netizen lain. """
"Meski Masih Pakai Penyangga Leher, Sonny Septian Turun ke Liang Lahad Makam Ibu",Entertainment,2024-09-29,Yazir Farouk,https://www.suara.com/entertainment/2024/09/29/154752/meski-masih-pakai-penyangga-leher-sonny-septian-turun-ke-liang-lahad-makam-ibu,"Pemakaman aktris senior Omas Tjahjawati atau Waty Siregar telah dilangsungkan di TPU Karet Bivak, Jakarta, Minggu siang 29 September 2024. Prosesi pemakaman disaksikan langsung oleh keluarga dan kerabat, termasuk anak-anak Waty seperti Sonny Septian, Elma Theana hingga Rency Milano. Pantauan jurnalis , Sonny Septian yang masih dalam tahap pemulihan usai mengalami penyempitan pembuluh darah kepala tetap ikut membopong keranda jenazah Waty Siregar. Teriknya cuaca Jakarta siang tadi tak menyurutkan niat Sonny untuk mengantar jenazah sang ibu ke tempat peristirahatan terakhir. Tak cuma ikut membopong keranda, Sonny Septian yang masih memakai penyangga leher bahkan turun langsung ke liang lahad untuk membantu menurunkan jenazah Waty Siregar. Meski sempat diingatkan Fairuz A. Rafiq untuk tidak ikut turun, Sonny merasa masih cukup kuat. Sesaat setelah turun ke liang lahad, Sonny Septian sempat menangis lagi. Ia seperti belum percaya kalau Waty Siregar sudah tiada.Namun setelah seluruh anggota keluarga berkumpul dan jenazah Waty Siregar mulai diturunkan, Sonny Septian sudah bisa mengontrol emosi. Ia dengan telaten membuka tali kain kafan dari tubuh sang ibu, sambil mengatur posisi jenazah untuk kemudian diazankan. Sonny Septian juga berhasil melantunkan azan tanpa tangis, meski suaranya bergetar. Tangis Sonny baru pecah setelah melihat makam Waty Siregar mulai ditutup tanah. Berbeda dari Sonny Septian, Elma Theana dan Rency Milano tak kuasa membendung tangis mereka sejak tiba di area pemakaman. Tubuh Rency bahkan sempat terkulai lesu di pelukan Elma, karena tak kuasa menahan kesedihan atas berpulangnya Waty Siregar. Prosesi pemakaman Waty Siregar ditutup dengan sesi tabur bunga serta doa bersama dari keluarga, kerabat dan para pelayat.Waty Siregar meninggal dunia pukul 05.07 pagi tadi di RS Citra Arafiq, Kelapa Dua, Depok. Kabar duka tersebut disampaikan anak-anak Waty melalui media sosial. Sudah sejak beberapa waktu lalu Waty Siregar berjuang melawan sakit. Namun, belum ada penjelasan detail mengenai penyebab meninggalnya.","Pemakaman aktris senior Omas Tjahjawati atau Waty Siregar telah dilangsungkan di TPU Karet Bivak, Jakarta, Minggu siang 29 September 2024. Pantauan jurnalis , Sonny Septian yang masih dalam tahap pemulihan usai mengalami penyempitan pembuluh darah kepala tetap ikut membopong keranda jenazah Waty Siregar. Teriknya cuaca Jakarta siang tadi tak menyurutkan niat Sonny untuk mengantar jenazah sang ibu ke tempat peristirahatan terakhir. Tak cuma ikut membopong keranda, Sonny Septian yang masih memakai penyangga leher bahkan turun langsung ke liang lahad untuk membantu menurunkan jenazah Waty Siregar. Ia seperti belum percaya kalau Waty Siregar sudah tiada. Berbeda dari Sonny Septian, Elma Theana dan Rency Milano tak kuasa membendung tangis mereka sejak tiba di area pemakaman. Prosesi pemakaman Waty Siregar ditutup dengan sesi tabur bunga serta doa bersama dari keluarga, kerabat dan para pelayat. Kabar duka tersebut disampaikan anak-anak Waty melalui media sosial. Sudah sejak beberapa waktu lalu Waty Siregar berjuang melawan sakit. Namun, belum ada penjelasan detail mengenai penyebab meninggalnya."
"Dave Grohl Berani Umumkan Perselingkuhannya, Corey Taylor: Rocker Juga Manusia yang Gak Sempurna",Entertainment,2024-09-29,Yazir Farouk,https://www.suara.com/entertainment/2024/09/29/150000/dave-grohl-berani-umumkan-perselingkuhannya-corey-taylor-rocker-juga-manusia-yang-gak-sempurna,"Perselingkuhan pentolan Foo Fighters, Dave Grohl, yang telah diakuinya, juga tak luput dari perhatian vokalis Slipknot, Core Taylor. Dalam wawancaranya di podcast Your Mom's House, yang dipandu oleh komedian Tom Segura dan Christina Pazsitzky, Taylor membahas berbagai topik, termasuk peringatan 25 tahun Slipknot dan drama seputar Jane's Addiction. Namun, topik yang menarik perhatian adalah saat Taylor memberikan pandangannya tentang Grohl yang baru-baru ini memiliki anak di luar pernikahannya dengan Jordyn Blum. Saat ditanya oleh Pazsitzky, Taylor memilih kata-kata dengan hati-hati. Ia mengakui bahwa situasi yang dihadapi Grohl sangat rumit tetapi menegaskan bahwa Grohl tetap salah satu orang paling baik yang pernah ia temui.Taylor juga menjelaskan alasan di balik keputusan Grohl mengumumkan secara resmi ihwal perselingkuhannya di media sosial. ""Gue tahu kenapa dia mengeluarkan pernyataan pers... dia ingin mendahului semua itu. Dia tahu bahwa jika dia nggak mengatakan sesuatu, orang lain akan melakukannya,"" ungkap Taylor dikutip dari laman Loudwire, Minggu 29 September 2024. Banyak penggemar yang merasa kecewa dengan pengumuman Grohl, terutama mengingat reputasinya sebagai ""orang paling baik di dunia rock."" Taylor pun menyebut tindakan perselingkuhan itu sebagai hal yang tidak bertanggung jawab dan memahami mengapa para penggemar merasa marah. Namun, Taylor menekankan bahwa musisi atau rocker juga manusia biasa. ""Saya harus mengingatkan orang-orang bahwa kami tidak sempurna,"" ujar Taylor.Menurut Taylor, meski berselingkuh, Grohl tak serta merta jadi orang yang buruk. Sebab, masih banyak kebaikan pria berambut gondrong tersebut yang bisa dipuji. ""Ini tidak berarti dia bukan orang baik, karena gue tahu banget dia sebagai individu,"" katanya. ""Ini berarti dia punya masalah dan dia melakukan kesalahan, dia nggak sempurna. Ini akan sangat sulit untuk keluarganya,"" lanjut Taylor. Vokalis Slipknot ini juga berbagi pengalaman pribadinya, mengakui bahwa ia juga pernah menghadapi masalah dalam hidupn. Ketika Segura menyebutkan bahwa batas antara orang baik dan buruk tidak selalu jelas, Taylor setuju sepenuhnya.","Perselingkuhan pentolan Foo Fighters, Dave Grohl, yang telah diakuinya, juga tak luput dari perhatian vokalis Slipknot, Core Taylor. Dalam wawancaranya di podcast Your Mom's House, yang dipandu oleh komedian Tom Segura dan Christina Pazsitzky, Taylor membahas berbagai topik, termasuk peringatan 25 tahun Slipknot dan drama seputar Jane's Addiction. Ia mengakui bahwa situasi yang dihadapi Grohl sangat rumit tetapi menegaskan bahwa Grohl tetap salah satu orang paling baik yang pernah ia temui. Dia tahu bahwa jika dia nggak mengatakan sesuatu, orang lain akan melakukannya,"" ungkap Taylor dikutip dari laman Loudwire, Minggu 29 September 2024. Namun, Taylor menekankan bahwa musisi atau rocker juga manusia biasa. "" Saya harus mengingatkan orang-orang bahwa kami tidak sempurna,"" ujar Taylor. Menurut Taylor, meski berselingkuh, Grohl tak serta merta jadi orang yang buruk. Sebab, masih banyak kebaikan pria berambut gondrong tersebut yang bisa dipuji. "" Ini berarti dia punya masalah dan dia melakukan kesalahan, dia nggak sempurna. Ini akan sangat sulit untuk keluarganya,"" lanjut Taylor."
