title,category,publish_date,author,article_url,content,summary
"Celine Evangelista Banjir Pujian, Awet Muda Bak ABG Saat Joget Bareng Anak",Entertainment,2024-09-29,Sumarni,https://www.suara.com/entertainment/2024/09/29/080000/celine-evangelista-banjir-pujian-awet-muda-bak-abg-saat-joget-bareng-anak,"Penampilan Celine Evangelista kembali mencuri perhatian publik saat ia membuat konten bersama kedua putrinya, Jemima dan Eleeya. Dalam video yang dibagikan, terlihat mantan istri Stefan William ini mampu mengikuti irama dan gerakan putrinya yang berjoget, menunjukkan keakraban yang unik di antara mereka. Diduga, konten tersebut dibuat ketika Celine hendak mengambil raport untuk anak-anaknya. Menariknya, interaksi mereka lebih menyerupai hubungan kakak-adik daripada ibu dan anak. ""Kelakuan yang katanya ambil rapot anak,"" tulis Celine di keterangan video tersebut.Tak hanya di TikTok, video ini juga diunggah di Instagram pribadinya. Banyak warganet memuji Celine yang tetap terlihat awet muda meski sudah menjadi ibu dari tiga anak. Bahkan, kesan seperti kakak kelas lebih terasa dibandingkan sebagai seorang ibu. ""Lho ini kan kakak kelasnya kan? @celine_evangelista,"" tulis artis Chacha Frederica berkomentar. ""Masya Allah, akrab banget sama 'adik-adik'-nya,"" tulis seorang warganet. ""Ini lebih kayak adik kakak, bukan mama dengan dua anak,"" sambung warganet lain. ""Sepertinya lebih mirip adik kakak daripada ibu dan anak. Seumuran banget, Masya Allah Mami Celine,"" puji warganet lainnya.Seperti diketahui Celine Evangelista punya 4 orang anak. Dari pernikahan dengan Dirly Idol, Celine Evangelista mengangkat seorang anak perempuan yang bernama Jemima Guri Clementine Sompie. Lalu dia melahirkan anak perempuan kandung yang bernama Eleeya Xaviera Sompie. Setelah bercerai dengan Dirly pada 2013, Celine kembali menikah dengan Stefan William pada tahun 2016. Dari pernikahan tersebut, Celine melahirkan dua orang anak laki-laki yang bernama Lucio Otthild William yang disapa Cio dan Eadred Koa Lewis Miguel yang dipanggil Koa. Sayang pernikahan Celine kembali kandas. Dia resmi bercerai dengan Stefan di tahun 2021.","Penampilan Celine Evangelista kembali mencuri perhatian publik saat ia membuat konten bersama kedua putrinya, Jemima dan Eleeya. Dalam video yang dibagikan, terlihat mantan istri Stefan William ini mampu mengikuti irama dan gerakan putrinya yang berjoget, menunjukkan keakraban yang unik di antara mereka. Menariknya, interaksi mereka lebih menyerupai hubungan kakak-adik daripada ibu dan anak. "" Kelakuan yang katanya ambil rapot anak,"" tulis Celine di keterangan video tersebut. Ini lebih kayak adik kakak, bukan mama dengan dua anak,"" sambung warganet lain. "" Sepertinya lebih mirip adik kakak daripada ibu dan anak. Seumuran banget, Masya Allah Mami Celine,"" puji warganet lainnya. Seperti diketahui Celine Evangelista punya 4 orang anak. Dari pernikahan dengan Dirly Idol, Celine Evangelista mengangkat seorang anak perempuan yang bernama Jemima Guri Clementine Sompie. Setelah bercerai dengan Dirly pada 2013, Celine kembali menikah dengan Stefan William pada tahun 2016."
"Olla Ramlan Kaget Sifat Lolly Sekarang Berubah, Curiga Dicuci Otak Vadel Badjideh",Entertainment,2024-09-29,Sumarni,https://www.suara.com/entertainment/2024/09/29/071500/olla-ramlan-kaget-sifat-lolly-sekarang-berubah-curiga-dicuci-otak-vadel-badjideh,"Olla Ramlan terkejut dengan perubahan sikap anak sulung Nikita Mirzani, Laura Meizani alias Lolly. Pasalnya, Lolly yang ia kenal dahulu tampak sopan dan tenang. Sementara kini Lolly tampak lebih menggebu-gebu dan frontal dalam menyampaikan pendapatnya di media sosial. Bahkan, ia tidak ragu untuk memaki Nikita Mirzani. Olla mengenal putri Nikita Mirzani karena Lolly pernah menjalin hubungan asmara dengan anak Olla Ramlan, Sean Alexander, sebelum bersekolah di Inggris. ""Dengan adanya kasus ini, ya, aku sebagai yang pernah kenal Lolly, aku menyayangkan, kenapa sih Lolly jadi seperti ini. Kenapa sih dia harus teriak-teriak,"" tuturnya, dikutip dari TikTok @cilikayune pada Sabtu 28 September 2024.Nikita Mirzani juga memperlakukan anaknya dengan baik. Sangat jauh berbeda dengan sikapnya terhadap pacar Lolly sekarang, yakni Vadel Badjideh. Olla Ramlan menduga sikapnya Nikita Mirzani baik karena Sean juga berperilaku sopan. ""Jadi pada saat itu Nikita pun sangat menghargai Sean. Sean benar-benar kalau datang ke rumah Lolly, ke rumah Nikita, itu bener-bener dia samperin,"" sambungnya. ""Dan so far aku dan Nikita nggak ada masalah. Lolly pun nggak ada masalah,"" lanjutnya lagi. Mantan istri Aufar Hutapea itu merasa perubahan sifat Lolly ada kaitannya dengan Vadel Badjideh.""Kadang-kadang kita sebagai perempuan, apalagi kalau kita cinta, kadang-kadang ke-brain wash (kecuci otak), kita kebawa-bawa nih. Jadi cinta itu membutakan,"" ujarnya, secara tidak langsung mengacu pada hubungan Lolly dengan Vadel. Olla Ramlan secara tegas mendukung Nikita Mirzani yang ingin menyelamatkan putrinya walau dengan cara keras. ""Ya tentu aja aku ngebelain Nikita dan jangan macam-macam ya Vadel,"" pungkasnya.","Olla Ramlan terkejut dengan perubahan sikap anak sulung Nikita Mirzani, Laura Meizani alias Lolly. Pasalnya, Lolly yang ia kenal dahulu tampak sopan dan tenang. Bahkan, ia tidak ragu untuk memaki Nikita Mirzani. Kenapa sih dia harus teriak-teriak,"" tuturnya, dikutip dari TikTok @cilikayune pada Sabtu 28 September 2024.Nikita Mirzani juga memperlakukan anaknya dengan baik. Sangat jauh berbeda dengan sikapnya terhadap pacar Lolly sekarang, yakni Vadel Badjideh. Olla Ramlan menduga sikapnya Nikita Mirzani baik karena Sean juga berperilaku sopan. "" Dan so far aku dan Nikita nggak ada masalah. Lolly pun nggak ada masalah,"" lanjutnya lagi. Ya tentu aja aku ngebelain Nikita dan jangan macam-macam ya Vadel,"" pungkasnya."
"Jennifer Coppen Tanggapi Kritik Belum Berhijab Sepulang Umrah, Janji Kurangi Pakai Baju Seksi",Entertainment,2024-09-29,Sumarni,https://www.suara.com/entertainment/2024/09/29/064500/jennifer-coppen-tanggapi-kritik-belum-berhijab-sepulang-umrah-janji-kurangi-pakai-baju-seksi,"Jennifer Coppen menanggapi kritik terkait penampilannya yang tak berhijab, padahal baru saja menunaikan ibadah umrah. Ibu satu anak itu mengaku tak ingin mempermainkan agama dengan buru-buru memakai hijab. ""I see banyak yang mengkritik aku di TikTok karena aku belum berhijab dan lain-lain. I understand mungkin kalian berharap besar sama aku atau kecewa kok aku belum berhijab,"" tulisnya di grup chat Instagram, Sabtu 28 September 2024. Lahir dari keluarga multikultural, Jennifer Coppen menjelaskan bahwa sejak kecil dirinya kurang mendapat pendidikan agama Islam. ""Guys jujur ya, aku tuh dari dulu memeluk agama Islam, tapi aku tuh nggak ada yang ngajarin. Satu-satunya yang agama Islam itu mamah aku, tapi mamah aku udah almarhum,"" ungkapnya.""Dari dulu nggak ada yang ngajarin salat, baca Al-Quran dll. Jadi aku mandiri sendiri, cari guru ngaji sama ngajarin salat,"" lanjut istri mendiang Dali Wassink tersebut. Jennifer Coppen terang-terangan mengaku kurang bisa membaca Al-Quran, tetapi tidak dengan salat. Jennifer bersyukur dirinya paham tentang ibadah wajib umat Islam tersebut. Terkait hijab, artis kelahiran 2001 itu tidak ingin terburu-buru karena takut tak bisa istiqomah. Dia masih belajar dan sudah berniat mengurangi pakaian seksi. ""Aku tahu pasti jauh lebih mendingan aku berhijab, tapi aku benar-benar nggak mau berhijab, taipi nanti aku lepas pasang. Kalau berhijab maunya seterusnya,"" ujarnya. ""Doain aku aja ya, semoga bisa cepat berhijab. Aku juga nggak pernah janji kalau pulang umrah bakal berhijab. Aku pun udah mau mulai dari berhenti pakai baju-baju seksi,"" kata ibunda Kamari itu.Jennifer Coppen berterima kasih pada semua orang yang telah mengingatkan dirinya. Soal penampilan seksinya di gurun pasir, Jennifer meluruskan bahwa tempat tersebut bukan Tanah Suci. ""Walaupun gini, aku tetap menjalankan salatku, tapi kan nggak perlu posting-posting. Cuman mau meluruskan itu saja,"" tegasnya. ""Dan ada yang salah paham di TikTok. Guys aku udah nggak di Tanah Suci. Aku lagi di Dubai. Dubai nggak termasuk tanah haram setahu aku,"" pungkas Jennifer. Kontributor : Chusnul Chotimah","Jennifer Coppen menanggapi kritik terkait penampilannya yang tak berhijab, padahal baru saja menunaikan ibadah umrah. Ibu satu anak itu mengaku tak ingin mempermainkan agama dengan buru-buru memakai hijab. "" Guys jujur ya, aku tuh dari dulu memeluk agama Islam, tapi aku tuh nggak ada yang ngajarin. Jennifer Coppen terang-terangan mengaku kurang bisa membaca Al-Quran, tetapi tidak dengan salat. Jennifer bersyukur dirinya paham tentang ibadah wajib umat Islam tersebut. Aku tahu pasti jauh lebih mendingan aku berhijab, tapi aku benar-benar nggak mau berhijab, taipi nanti aku lepas pasang. Kalau berhijab maunya seterusnya,"" ujarnya. "" Doain aku aja ya, semoga bisa cepat berhijab. Aku juga nggak pernah janji kalau pulang umrah bakal berhijab. Aku pun udah mau mulai dari berhenti pakai baju-baju seksi,"" kata ibunda Kamari itu. Jennifer Coppen berterima kasih pada semua orang yang telah mengingatkan dirinya. Soal penampilan seksinya di gurun pasir, Jennifer meluruskan bahwa tempat tersebut bukan Tanah Suci. """
"Review Film Operation Undead, Tentara Zombie yang Bikin Takut Jirayut Sekaligus Mengharukan",Entertainment,2024-09-28,Sumarni,https://www.suara.com/entertainment/2024/09/28/220000/review-film-operation-undead-tentara-zombie-yang-bikin-takut-jirayut-sekaligus-mengharukan,"Film Operation Undead yang berlatar zombie, siap disuguhkan negeri Thailand. Kisahnya bukan cuma menyeramkan tapi juga membuat haru penonton. Tim berkesempatan menyaksikan film Operation Undead lebih dulu, sebelum jadwal tayangnya, 2 Oktober 2024. Kisahnya mengenai tentara Kopral Thailand bernama Mek (Nonkul). Dia adalah sosok gigih, cinta pada tentara dan negara serta siap mengorbankan diri untuk bangsa. Lainnya, hadir Mok (Awat Natarapintha) yang merupakan adik Mek. Sebaliknya dari sang kakak, dia memiliki sifat pembuat onar dan selalu kritis mempertanyakan segala hal.Mereka merupakan bagian dari tentara di Perang Dunia II. Berada di Thailand Selatan selama invasi yang tak banyak diketahui pasukan Jepang. Seperti pada film-film Thailand kebanyakan, Operation Undead juga menyuguhkan genre komedi di awal. Penonton akan dibuat tertawa dengan tingkah para tentara. Namun ketegangan kemudian hadir saat sekelompok tentara Thailand berada di suatu pulau. Mok digigit salah satu tentara Jepang dan menjadikannya sebagai zombie. Akhirnya, satu per satu tentara menjadi zombie. Aksi saling bunuh, memakan daging teman satu sama lain, hadir. Ya, plot kemudian berubah menjadi kengerian dan tontonan menjijikan.Tapi selain itu, film ini juga menghadirkan sisi haru. Bagaimana salah satu diantara mereka bertarung dengan perasaan. Sebab di salah satu scene, ada seorang tentara yang bertemu dengan istri dan anaknya. Apakah ia akan memangsa orang-orang terkasih tersebut? Saya tidak akan membocorkan ending yang mencengangkan ini. Tapi, selain saya yang menyaksikan film tersebut, ada Jirayut yang juga tampaknya sepakat dengan pandangan terhadap film ini yang menyeramkan tapi juga membuat sedih. ""Keren banget. Ada sedihnya, horor, seram dan sadis,"" kata Jirayut ditemui di FX Sudirman, Jakarta Pusat pada Jumat 27 September 2024. Sebagai informasi, film Operation Undead lebih dulu tayang di New York Asian Film Festival. Sehingga karena sudah mampir di festival, maka film ini tak salah menjadi rekomendasi tontonan.","Film Operation Undead yang berlatar zombie, siap disuguhkan negeri Thailand. Tim berkesempatan menyaksikan film Operation Undead lebih dulu, sebelum jadwal tayangnya, 2 Oktober 2024. Dia adalah sosok gigih, cinta pada tentara dan negara serta siap mengorbankan diri untuk bangsa. Lainnya, hadir Mok (Awat Natarapintha) yang merupakan adik Mek. Berada di Thailand Selatan selama invasi yang tak banyak diketahui pasukan Jepang. Penonton akan dibuat tertawa dengan tingkah para tentara. Mok digigit salah satu tentara Jepang dan menjadikannya sebagai zombie. Akhirnya, satu per satu tentara menjadi zombie. Aksi saling bunuh, memakan daging teman satu sama lain, hadir. Tapi selain itu, film ini juga menghadirkan sisi haru. Bagaimana salah satu diantara mereka bertarung dengan perasaan. Sebab di salah satu scene, ada seorang tentara yang bertemu dengan istri dan anaknya. Saya tidak akan membocorkan ending yang mencengangkan ini."
"Buka Konser Secret Number di Jakarta, Tiara Andini Spill Single Terbaru",Entertainment,2024-09-28,Sumarni,https://www.suara.com/entertainment/2024/09/28/213339/buka-konser-secret-number-di-jakarta-tiara-andini-spill-single-terbaru,"Tiara Andini menjadi opening act di konser Secret Number. Acara bertajuk 'PasSworLd Concert' tersebut di Tennis Indoor, Senayan, Jakarta Pusat pada Sabtu 28 September 2024. Aksi panggung Tiara Andini dimulai pukul 19.30 WIB. Penyanyi yang akrab disapa Titi ini tampil cetar dengan dress silver. 'Flip It Up' menjadi lagu pembuka Tiara Andini di konser Secret Number. Berlanjut ke 'Janji Setia', 'Kupu-Kupu', 'Masih Hatiku'. ""Selamat malam Lockey (nama fans Secret Number) gimana perasaan kalian?"" tanya Tiara Andini di panggung.""Gimana perasaan kalian hari ini? Seneng banget ya? Udah ditunggu sejak lama,"" imbuhnya menyapa. Tak hanya menyapa penonton yang memenuhi Tennis Indoor, Tiara Andini sekaligus memberikan kejutan. ""Sebentar lagi aku akan merilis lagu baru,"" ucap Tiara Andini sambil tersenyum. Tiara Andini lalu memberikan sedikit bocoran, lagu apa yang akan menjadi karya terbaru. Ternyata itu adalah hits milik Rio Febrian berjudul Bukan Untukku. Tiara Andini sekaligus menyanyikan lagu tersebut beberapa bait. Penyanyi yang dikabarkan masih berpacaran dengan Alshad Ahmad ini mengaku gugup jelang perilisan.""Ya ampun deg-degan. Semoga bisa enjoy sama lagu aku ya,"" kata Tiara Andini. Tiara Andini boleh jadi menjadi pembuka konser Secret Number. Namun, penampilan selama 45 menit tersebut, seolah menjadi mini concert. Sebab Tiara Andini tampil all out dengan tujuh lagu. Di mana Gemintang yang menjadi single penutup. Tiara Andini juga sempat turun panggung dan menyapa penggemar Secret Number saat menyanyikan lagu Cantik milik Kahitna.","Tiara Andini menjadi opening act di konser Secret Number. Acara bertajuk 'PasSworLd Concert' tersebut di Tennis Indoor, Senayan, Jakarta Pusat pada Sabtu 28 September 2024. Penyanyi yang akrab disapa Titi ini tampil cetar dengan dress silver. ' Flip It Up' menjadi lagu pembuka Tiara Andini di konser Secret Number. Berlanjut ke 'Janji Setia', 'Kupu-Kupu', 'Masih Hatiku'. "" Udah ditunggu sejak lama,"" imbuhnya menyapa. Sebentar lagi aku akan merilis lagu baru,"" ucap Tiara Andini sambil tersenyum. Namun, penampilan selama 45 menit tersebut, seolah menjadi mini concert. Di mana Gemintang yang menjadi single penutup. Tiara Andini juga sempat turun panggung dan menyapa penggemar Secret Number saat menyanyikan lagu Cantik milik Kahitna."
"Kondisi Kesehatan Gibran Rakabuming Kini Mengkhawatirkan, Rocky Gerung Pernah Singgung Penyakit Ini",Entertainment,2024-09-28,Sumarni,https://www.suara.com/entertainment/2024/09/28/211500/kondisi-kesehatan-gibran-rakabuming-kini-mengkhawatirkan-rocky-gerung-pernah-singgung-penyakit-ini,"Kondisi kesehatan Gibran Rakabuming mendadak menjadi bahan perbincangan. Terutama di platform X usai momen dirinya rapat bersam Bahlil menjadi viral. Saat itu, kondisi Gibran yang tampak tidak fokus dengan kondisi mata lelah dikomentari. Hingga ada yang menuding dirinya mengidap penyakit kremian (infeksi cacing kremi). ""Pentingnya minum obat cacing sebelum meeting,"" tulis salah satu pemilik akun X, dikutip pada Sabtu 28 September 2024. Unggahan tersebut sempat mendatangkan beragam komentar dari warganet.""Kirain pentingnya minum obat cacing saat masa pertumbuhan,"" sindir warganet. ""Gue kira minum asam sulfat,"" tambah yang lain. Sementara itu, tudingan pedas berkaitan dengan alkohol hingga narkoba juga menjadi bagian dari komentar warganet. ""Pengaruh alkohol apa narkoba ya?"" tanya warganet penasaran. Hingga saat ini, belum ada jawaban yang tepat nan valid di balik kondisi Gibran Rakabuming tersebut. Namun jika berbicara soal penyakit atau kelainan, pernyataan Rocky Gerung di masa lalu cukup menarik.Pernyataan tersebut merespons mangkirnya Gibran dari debat cawapres yang digelar oleh salah satu stasiun televisi. Alhasil, Rocky Gerung menyinggung soal kelainan fobia di ruang terbuka yang dimaksudkan berkaitan dengan debat. ""Aa orang yang takut pada kegelapan, namanya Claustrophobia, artinya takut pada Claus pada ruang tertutup dia panik,"" kata Rocky Gerung. ""Tapi ada orang yang panik pada ruang terbuka itu namanya Debatofobia,” sambungnya lagi. Lebih lanjut, Rocky menilai soal Debatofobia ini seharusnya tidak diidap oleh mereka yang menjadi pejabat publik, diduga seperti Gibran Rakabuming. ""Sebetulnya istilah Debatofobia itu bertentangan dalam secara istilah, itu nggak mungkin seorang pejabat publik nggak bisa masuk dalam situasi debat. Seorang pejabat publik justru harus berdebat dengan wartawan, berdebat dengan kandidat saing,"" tegas Rocky Gerung.","Kondisi kesehatan Gibran Rakabuming mendadak menjadi bahan perbincangan. Pentingnya minum obat cacing sebelum meeting,"" tulis salah satu pemilik akun X, dikutip pada Sabtu 28 September 2024. Unggahan tersebut sempat mendatangkan beragam komentar dari warganet. Gue kira minum asam sulfat,"" tambah yang lain. Namun jika berbicara soal penyakit atau kelainan, pernyataan Rocky Gerung di masa lalu cukup menarik. Pernyataan tersebut merespons mangkirnya Gibran dari debat cawapres yang digelar oleh salah satu stasiun televisi. Aa orang yang takut pada kegelapan, namanya Claustrophobia, artinya takut pada Claus pada ruang tertutup dia panik,"" kata Rocky Gerung. "" Lebih lanjut, Rocky menilai soal Debatofobia ini seharusnya tidak diidap oleh mereka yang menjadi pejabat publik, diduga seperti Gibran Rakabuming. "" Sebetulnya istilah Debatofobia itu bertentangan dalam secara istilah, itu nggak mungkin seorang pejabat publik nggak bisa masuk dalam situasi debat."
"Sosok Ayah Alyssa Daguise Richard Daguise, Ternyata Bukan Bos Hotel Lagi",Entertainment,2024-09-29,Yohanes Endra,https://www.suara.com/entertainment/2024/09/29/163000/sosok-ayah-alyssa-daguise-richard-daguise-ternyata-bukan-bos-hotel-lagi,"Alyssa Daguise akan segera menjadi istri Al Ghazali sekaligus menantu dari Ahmad Dhani. Sosok ayah Alyssa Daguise yang akan menjadi besan pentolan Dewa19 tersebut lantas dicari tahu. Seperti diketahui, Al Ghazali telah melamar Alyssa Daguise di Danau Como, Italia, pada 21 September 2024 lalu. Rencana Al dan Alyssa menikah pun telah dibocorkan Maia Estianty, yaitu tahun 2025 mendatang. Baru-baru ini, viral Richard Daguise ayah Alyssa Daguise diungkap sebagai seorang CEO beberapa hotel, vila, dan resort ternama di Indonesia. Benarkah? Ketahui sosok ayah Alyssa Daguise selengkapnya berikut ini. Richard Daguise merupakan pria asal Prancis yang menikahi wanita Indonesia bernama Risa Dewi. Dari pernikahan tersebut, Richard dikaruniai tiga anak salah satunya Alyssa Daguise.Alyssa Daguise merupakan anak kedua dari tiga bersaudara. Kakak Alyssa bernama Alexandra Daguise, sementara adiknya bernama Andhika Daguise. Richard Daguise meyelesaikan pendidikan SMA di Lycee Joachim Du Bellay, Angers, dan lanjut sekolah Bahasa dan Sastra Asing di Université d'Angers. Keduanya sama-sama berlokasi di Prancis. Barulah saat S2, Richard Daguise merantau ke Australia karena mengenyam pendidikan di Bond University. Ia menamatkan pendidikan S2 Business Administration and Management tahun 1996. Sejak 1988, Richard Daguise bekerja di berbagai hotel. Pekerjaan pertamanya adalah sebagai Shift Leader (London), kemudian naik jabatan ke Night Manager (Paris) di Hilton Hotels & Resorts berdasarkan profil LinkedIn miliknya. Richard Daguise juga pernah bekerja sebagai Assistant Manager di The Ritz London. Tahun 1993, Richard mulai bekerja di Indonesia sebagai Executive Housekeeper di Sheraton Hotels & Resorts area Bandung, Jawa Barat.Selama 6 tahun bekerja di Sheraton Hotels & Resorts, Richard Daguise pernah dipindahkan ke Lombok sebagai Rooms Division Manager, lalu jadi Director of Rooms di Liaoning, China. Selanjutnya Richard Daguise pindah ke Nusa Lembongan Resort & Cruise sebagai Cluster General Manager area Denpasar, Bali selama 2 tahun, jadi General Manager di Alila Hotels area Jakarta selama 3 tahun dan Grand Aston Bali Beach Resort selama 2 tahun. Pengalaman Richard Daguise sebagai Managing Director di Grandkemang Hotel Jakarta selama 11 tahun membuatnya dipercaya menjadi Direktur di Ninh Van Bay Holiday Club Co. Ltd., Vietnam selama 6 tahun. Definisi meniti karier dari jenjang paling rendah, Richard Daguise mengawalinya dengan jabatan Shift Leader di sebuah hotel di London hingga akhirnya dipercaya menjadi President & CEO Mesa Hotels & Resorts sejak Januari 2008. Richard Daguise ternyata juga President Mesa Europe / RCapital Luxembourg / SAS Château de Bonaban di Paris & Luxembourg sejak 2013. Dua jabatan tersebut sama-sama berakhir pada November 2019. Sejak November 2019 pula, Richard Daguise menjadi Chief Operating Officer (COO) PT Pangansari Utama. Dengan keahliannya dalam manajemen operasional, Richard memimpin PT Pangansari Utama hampir 5 tahun sampai sekarang. PT Pangansari Utama (PSU) adalah perusahaan yang mendukung manajemen fasilitas, logistik ritel, dan makanan di Indonesia. PSU mengklaim sebagai perusahaan katering industri dan distribusi makanan terbesar di Indonesia. Bukan cuma di kota-kota besar, PSU menyediakan pelayanan dan distribusi makanan ke lokasi pertambangan hingga daerah terpencil. PSU juga menangani kebutuhan minyak dan gas di daerah terpencil di luar Indonesia seperti Afrika, Mongolia, dan Singapura. Itu dia sosok ayah Alyssa Daguise yang bernama Richard Daguise. Ternyata bukan orang sembarangan ya! Kontributor : Neressa Prahastiwi","Alyssa Daguise akan segera menjadi istri Al Ghazali sekaligus menantu dari Ahmad Dhani. Sosok ayah Alyssa Daguise yang akan menjadi besan pentolan Dewa19 tersebut lantas dicari tahu. Seperti diketahui, Al Ghazali telah melamar Alyssa Daguise di Danau Como, Italia, pada 21 September 2024 lalu. Ketahui sosok ayah Alyssa Daguise selengkapnya berikut ini. Richard Daguise merupakan pria asal Prancis yang menikahi wanita Indonesia bernama Risa Dewi. Dari pernikahan tersebut, Richard dikaruniai tiga anak salah satunya Alyssa Daguise. Alyssa Daguise merupakan anak kedua dari tiga bersaudara. Kakak Alyssa bernama Alexandra Daguise, sementara adiknya bernama Andhika Daguise. Ia menamatkan pendidikan S2 Business Administration and Management tahun 1996. Pengalaman Richard Daguise sebagai Managing Director di Grandkemang Hotel Jakarta selama 11 tahun membuatnya dipercaya menjadi Direktur di Ninh Van Bay Holiday Club Co. Ltd., Vietnam selama 6 tahun. Definisi meniti karier dari jenjang paling rendah, Richard Daguise mengawalinya dengan jabatan Shift Leader di sebuah hotel di London hingga akhirnya dipercaya menjadi President & CEO Mesa Hotels & Resorts sejak Januari 2008. Dua jabatan tersebut sama-sama berakhir pada November 2019. PT Pangansari Utama (PSU) adalah perusahaan yang mendukung manajemen fasilitas, logistik ritel, dan makanan di Indonesia. Bukan cuma di kota-kota besar, PSU menyediakan pelayanan dan distribusi makanan ke lokasi pertambangan hingga daerah terpencil. PSU juga menangani kebutuhan minyak dan gas di daerah terpencil di luar Indonesia seperti Afrika, Mongolia, dan Singapura."
