title,category,publish_date,author,article_url,content,summary
"Maia Estianty Bahas Rencana Pernikahan Al Ghazali, Alyssa Daguise Panik: Jangan Spoiler!",Entertainment,2024-09-02,Sumarni,https://www.suara.com/entertainment/2024/09/02/125704/maia-estianty-bahas-rencana-pernikahan-al-ghazali-alyssa-daguise-panik-jangan-spoiler,"Putra sulung mantan pasangan Maia Estianty dan Ahmad Dhani, Al Ghazali belum lama ini merayakan ulang tahunnya yang ke-27 tahun pada Minggu 1 September 2024. Dalam momen perayaan ulang tahunnya itu, Al Ghazali di kelilingi orang-orang tersayang. Maia Estianty bersama suaminya, Irwan Mussry hadir untuk merayakan hari spesial putranya tersebut. Selain itu, ada El Rumi dan Dul Jaelani yang turut hadir masing-masing dengan membawa kekasihnya. Alyssa Daguise juga tak melewatkan hari spesial kekasihnya itu yang digelar dalam sebuah acara dinner yang bertempat di sebuah restoran mewah di kawasan Jakarta.Dilihat dari kanal YouTube Maia Al El Dul TV, Maia Estianty terlihat menghampiri Al dan Alyssa untuk menanyakan apa harapannya di hari ulang tahun anak sulungnya itu. “Doanya Alyssa buat Al?” tanya istri Irwan Mussry itu dikutip pada Senin 2 September 2024. Alyssa lalu mengungkapkan banyak sekali doa dan harapan yang dipanjatkan untuk Al Ghazali. “Banyak banget (doa), semoga selalu bahagia dunia akhirat, semoga selalu sukses, semoga rezekinya terus mengalir, selalu mencintai keluarga kamu dan orang-orang yang kamu sayangi, dan semoga kamu diberi kesehatan dan panjang umur, amin,” tutur Alyssa Daguise.Pada harapan terakhir dalam doa yang dipanjatkan, dengan malu-malu Alyssa juga berharap agar kekasihnya itu segera menikahinya. “Dan semoga nikah sama aku, thank you,” ucap perempuan blasteran Prancis itu. Mendengar penuturan calon menantunya itu, Maia Estianty lalu mengiyakan harapan Alyssa yang memang sepertinya sudah direncanakan. “Loh kan emang iya (nikah), insya Allah,” kata mantan personel Duo Maia itu. Mendengar jawaban calon mertua, Alyssa lalu buru-buru memotong percakapan Maia estianty. “Jangan spoiler, jangan spoiler,” sahut Alyssa lagi. Al Ghazali yang melihat percakapan sang ibu dan kekasihnya itu lantas ikut menimbrung dan mengatakan bahwa ia telah mempersiapkan cincin untuk kekasihnya itu. “Entar tunggu cincinnya dia,” ucap Al Ghazali. Mendengar Al yang telah mempersiapkan cincin untuk kekasihnya itu, Maia lalu memastikan lagi ke anaknya itu apa benar ia sudah mempersiapkan cincin untuk Alyssa. Namun Al justru terlihat mengalihkan pembicaraan. “Belum, belum. Surprise,” pungkas Al Ghazali. Kontributor : Rizka Utami","Putra sulung mantan pasangan Maia Estianty dan Ahmad Dhani, Al Ghazali belum lama ini merayakan ulang tahunnya yang ke-27 tahun pada Minggu 1 September 2024. Dalam momen perayaan ulang tahunnya itu, Al Ghazali di kelilingi orang-orang tersayang. Dilihat dari kanal YouTube Maia Al El Dul TV, Maia Estianty terlihat menghampiri Al dan Alyssa untuk menanyakan apa harapannya di hari ulang tahun anak sulungnya itu. “ tanya istri Irwan Mussry itu dikutip pada Senin 2 September 2024. Alyssa lalu mengungkapkan banyak sekali doa dan harapan yang dipanjatkan untuk Al Ghazali. “ Banyak banget (doa), semoga selalu bahagia dunia akhirat, semoga selalu sukses, semoga rezekinya terus mengalir, selalu mencintai keluarga kamu dan orang-orang yang kamu sayangi, dan semoga kamu diberi kesehatan dan panjang umur, amin,” tutur Alyssa Daguise. Loh kan emang iya (nikah), insya Allah,” kata mantan personel Duo Maia itu. Al Ghazali yang melihat percakapan sang ibu dan kekasihnya itu lantas ikut menimbrung dan mengatakan bahwa ia telah mempersiapkan cincin untuk kekasihnya itu. “ Entar tunggu cincinnya dia,” ucap Al Ghazali. Namun Al justru terlihat mengalihkan pembicaraan. “"
"7 Potret Dinar Candy Wisuda, Kasus Bikini Jadi Alasan Melanjutkan Kuliah",Entertainment,2024-09-02,Yohanes Endra,https://www.suara.com/entertainment/2024/09/02/125637/7-potret-dinar-candy-wisuda-kasus-bikini-jadi-alasan-melanjutkan-kuliah,"Diam-diam Dinar Candy telah merampungkan kuliahnya di salah satu perguruan tinggi yang ada di Surabaya. Hal itu terungkap setelah sejumlah potret wisuda Dinar Candy diunggah di akun Instagram milik sang DJ. Tak sedikit netizen yang terkejut, karena selama ini tidak tahu jika Dinar Candy sedang menempuh kuliah. Selain membuat netizen kagum karena mementingkan pendidikan, kecantikan Dinar Candy saat wisuda juga bikin salah fokus. Yuk, intip secantik apa penampilan Dinar Candy saat wisuda lewat deretan potret berikut ini. Dinar Candy membuat netizen dan penggemarnya terkejut dengan salah satu unggahan terbarunya. Lewat potret yang dibagikan, Dinar Candy terlihat memakai toga dan tengah mengikuti prosesi wisuda.Usut punya usut, Dinar Candy ternyata Dinar Candy telah menjadi mahasiswa Sekolah Tinggi Ilmu Ekonomi IBMT (STIE IBMT) Surabaya sejak 2020 silam. Setelah kurang lebih empat tahun menimba ilmu dan bolak-balik ke Surabaya, Dinar Candy akhirnya lulus dan diwisuda. Pada momen spesial tersebut, Dinar Candy didampingi oleh ayah tercintanya. Bahkan ayah Dinar Candy ikut menemani naik ke podium untuk menerima ijazah serta prosesi pemindahan tali toga. Usia Dinar Candy saat wisuda bisa dibilang tidak lagi muda yaitu 31 tahun. Tetapi, dalam menuntut ilmu usia bukanlah halangan. Pencapaian Dinar Candy yang kini meraih gelar Sarjana Manajemen tentunya menjadi inspirasi bagi generasi muda agar tetap semangat menyelesaikan pendidikan. Dinar Candy menyebut ada alasan khusus mengapa dirinya memutuskan melanjutkan kuliah. Rupanya alasan tersebut adalah kasus bikini yang pernah menjeratnya beberapa tahun silam. Kala itu, Dinar melakukan aksi protes atas kebijakan perpanjangan PPKM dengan mengenakan bikini di pinggir jalan. Pada hari wisudanya, Dinar Candy tampil sangat cantik dan anggun dalam balutan kebaya berwarna biru. Rambutnya yang disanggul membuat paras DJ ini semakin rupawan. Berkat penampilannya yang menawan, netizen sampai menyebut Dinar sebagai sarjana paling seksi.“Fokus dengan cita-cita dan karir, ketika kita bekerja keras tidak ada yang tidak mungkin semua keinginan yang positif dikabul Allah SWT, be positive be independent,” tulis Dinar Candy pada keterangan unggahannya. Itu tadi deretan potret wisuda Dinar Candy yang membuat publik terpana pada kecantikan dan keseriusannya dalam pendidikan. Selamat Dinar Candy atas wisuda dan gelar barunya! Kontributor : Safitri Yulikhah","Diam-diam Dinar Candy telah merampungkan kuliahnya di salah satu perguruan tinggi yang ada di Surabaya. Hal itu terungkap setelah sejumlah potret wisuda Dinar Candy diunggah di akun Instagram milik sang DJ. Lewat potret yang dibagikan, Dinar Candy terlihat memakai toga dan tengah mengikuti prosesi wisuda. Usut punya usut, Dinar Candy ternyata Dinar Candy telah menjadi mahasiswa Sekolah Tinggi Ilmu Ekonomi IBMT (STIE IBMT) Surabaya sejak 2020 silam. Pada momen spesial tersebut, Dinar Candy didampingi oleh ayah tercintanya. Tetapi, dalam menuntut ilmu usia bukanlah halangan. Pencapaian Dinar Candy yang kini meraih gelar Sarjana Manajemen tentunya menjadi inspirasi bagi generasi muda agar tetap semangat menyelesaikan pendidikan. Dinar Candy menyebut ada alasan khusus mengapa dirinya memutuskan melanjutkan kuliah. Rupanya alasan tersebut adalah kasus bikini yang pernah menjeratnya beberapa tahun silam. Rambutnya yang disanggul membuat paras DJ ini semakin rupawan. Itu tadi deretan potret wisuda Dinar Candy yang membuat publik terpana pada kecantikan dan keseriusannya dalam pendidikan. Selamat Dinar Candy atas wisuda dan gelar barunya!"
"Produk Skincarenya Dituduh Berbahaya Sampai Disita BPOM, Richard Lee: Ini Sudah Kelewatan!",Entertainment,2024-09-02,Sumarni,https://www.suara.com/entertainment/2024/09/02/121614/produk-skincarenya-dituduh-berbahaya-sampai-disita-bpom-richard-lee-ini-sudah-kelewatan,"Selebgram sekaligus dokter kecantikan Richard Lee menjawab tudingan menjual skincare mengandung produk berbahaya. Ia tegas menyatakan hal itu tidak benar. ""Itu hoaks,"" ujar Richard Lee dalam sebuah video yang diunggah di akun Instagram pribadinya, Minggu 1 September 2024. Richard Lee juga merespon kabar yang menyebut produk skincare buatannya disita BPOM karena mengandung zat berbahaya. ""Produk saya tidak pernah disita BPOM. Saya tegaskan lagi ya, produk saya tidak pernah disita BPOM,"" kata Richard Lee.Alih-alih bermasalah dengan BPOM, Richard Lee justru dipercaya oleh lembaga tersebut untuk memberikan edukasi soal produk kecantikan yang aman dipakai. ""Tahun ini, saya banyak kerja sama dengan BPOM. Aku juga diundang langsung oleh BPOM, untuk kasih edukasi,"" jelas Richard Lee. Richard Lee pun mengecam keras orang-orang yang menyerangnya lewat hoaks penjualan produk kecantikan berbahaya. ""Ini sudah kelewatan. Kenapa sih, setiap aku memberikan edukasi tentang skincare abal-abal atau BPA, pasti beberapa hari kemudian ada kejadian seperti ini. Kayak udah template,"" tutur Richard Lee. Anehnya lagi, mereka yang menyebar rumor malah bukan dari pihak-pihak yang produknya mendapat ulasan negatif dari Richard Lee.""Ketika ada skincare abal-abal yang ada etiket biru, yang pernah saya viralkan sampai viral banget, pernah nggak mereka lapor polisi? Ada nggak, yang jelas-jelas ada BPA-nya, mereka lapor polisi? Nggak ada kan?"" kata Richard Lee. Richard Lee tak lupa menyatakan bakal menempuh jalur hukum terhadap para penyebar hoaks tentang dirinya. ""Kali ini, aku nggak akan diam. Aku akan laporkan semuanya ke polisi,"" tegas Richard Lee. Sebagaimana diketahui, klinik kecantikan Athena milik Richard Lee diadukan ke BPOM oleh Badan Peneliti Independen Kekayaan Penyelenggara Negara dan Pengawas Anggaran (BPI KPNPA) RI. Mereka menyoroti salah satu produk kecantikan keluaran Athena yang memiliki kandungan DNA Salmon. Produk itu dianggap berbahaya karena pengaplikasiannya memakai jarum suntik dan berpotensi disalahgunakan.","Selebgram sekaligus dokter kecantikan Richard Lee menjawab tudingan menjual skincare mengandung produk berbahaya. Ia tegas menyatakan hal itu tidak benar. "" Richard Lee juga merespon kabar yang menyebut produk skincare buatannya disita BPOM karena mengandung zat berbahaya. "" Tahun ini, saya banyak kerja sama dengan BPOM. Aku juga diundang langsung oleh BPOM, untuk kasih edukasi,"" jelas Richard Lee. Anehnya lagi, mereka yang menyebar rumor malah bukan dari pihak-pihak yang produknya mendapat ulasan negatif dari Richard Lee. ""Ketika ada skincare abal-abal yang ada etiket biru, yang pernah saya viralkan sampai viral banget, pernah nggak mereka lapor polisi? Sebagaimana diketahui, klinik kecantikan Athena milik Richard Lee diadukan ke BPOM oleh Badan Peneliti Independen Kekayaan Penyelenggara Negara dan Pengawas Anggaran (BPI KPNPA) RI. Mereka menyoroti salah satu produk kecantikan keluaran Athena yang memiliki kandungan DNA Salmon."
"Sambil Menimang Baby Zoltan, Umi Kalsum Lantunkan Sholawat dan Menahan Isak Tangis",Entertainment,2024-09-02,Yohanes Endra,https://www.suara.com/entertainment/2024/09/02/114456/sambil-menimang-baby-zoltan-umi-kalsum-lantunkan-sholawat-dan-menahan-isak-tangis,"Ibu dari Ayu Ting Ting, Umi Kalsum, mengunggah detik-detik terakhir bersama cucunya, Rayaz Zoltan Fachrizal, sebelum meninggal dunia pada Sabtu, 31 Agustus 2024 kemarin. Dalam postingannya pada Minggu 1 September 2024, terlihat Umi Kalsum sedang menimang cucunya yang tengah tertidur. Di sampingnya, tampak sang suami, Abdul Rozak alias Ayah Ojak, sudah menangis. Sambil menahan isak tangis, Umi Kalsum memeluk sang cucu erat ke dadanya sembari melantunkan bacaan sholawat. ""Bobok ya, cucu ya, bobok. Anak pinter. Bobok ya cucunya ayah. Sayang. Sembuh ya, nak,"" ucap Ayah Ojak sambil memegangi tangan sang cucu.Ayah sang pedangdut itu juga sesekali mencium pipi cucunya yang tengah memejamkan mata. Momen mengharukan tersebut jelas direkam ketika Zoltan sudah dilarikan ke rumah sakit. Diketahui, Zoltan merupakan anak bungsu dari adik Ayu Ting Ting, Assyifa Nuraini. Bayi tersebut masih berusia 2 bulan 7 hari kala mengembuskan napas terakhir di rumah sakit. Zoltan meninggal dunia karena dehidrasi. Sebelum dilarikan ke rumah sakit, ia sering muntah-muntah dan buang air. ""Muntah sampai berkali-kali. Buang air juga berkali-kali,"" ujar Ayu Ting Ting di kediamannya kawasan Mekar Jaya, Depok, Jawa Barat.Keponakannya itu mulai menunjukkan gejala setelah imunisasi polio di rumah sakit pada Jumat, 23 Agustus 2024. Ketika diperiksa keesokan harinya, dokter menyebut apa yang dialami Zoltan hal biasa. Gejala tersebut masih berlangsung hingga beberapa hari. Ketika diperiksakan lagi ke rumah sakit, Zoltan sudah kekurangan cairan. ""Hari Rabu dibawa ke rumah sakit deket sini (rumah), Kamis dirujuk ke RS Bunda yang di Margonda, ya sampai Sabtu kemarin itu,"" tandasnya.","Ibu dari Ayu Ting Ting, Umi Kalsum, mengunggah detik-detik terakhir bersama cucunya, Rayaz Zoltan Fachrizal, sebelum meninggal dunia pada Sabtu, 31 Agustus 2024 kemarin. Di sampingnya, tampak sang suami, Abdul Rozak alias Ayah Ojak, sudah menangis. Sambil menahan isak tangis, Umi Kalsum memeluk sang cucu erat ke dadanya sembari melantunkan bacaan sholawat. "" Buang air juga berkali-kali,"" ujar Ayu Ting Ting di kediamannya kawasan Mekar Jaya, Depok, Jawa Barat. Keponakannya itu mulai menunjukkan gejala setelah imunisasi polio di rumah sakit pada Jumat, 23 Agustus 2024. Gejala tersebut masih berlangsung hingga beberapa hari. Ketika diperiksakan lagi ke rumah sakit, Zoltan sudah kekurangan cairan. "" Hari Rabu dibawa ke rumah sakit deket sini (rumah), Kamis dirujuk ke RS Bunda yang di Margonda, ya sampai Sabtu kemarin itu,"" tandasnya."
"Rizky Billar Sindir Dewi Perssik: Sudah Kerja Puluhan Tahun, Belum Bisa Beli Mobil",Entertainment,2024-09-02,Yohanes Endra,https://www.suara.com/entertainment/2024/09/02/061500/rizky-billar-sindir-dewi-perssik-sudah-kerja-puluhan-tahun-belum-bisa-beli-mobil,"Rizky Billar kembali membahas soal gosip dirinya menyicil mobil Alphard. Gosip itu muncul dalam situasi Billar dituding melakukan KDRT terhadap Lesti Kejora pada 2022. Melalui unggahan video, Rizky Billar lantas menjelaskan apabila konten yang membuatnya dinarasikan seperti itu adalah prank. Semua berawal dari niat Billar memberikan kejutan untuk sang istri. ""Jadi waktu itu, saya mau ngasih hadiah ini buat istri saya,"" ujar Rizky Billar sambil menunjuk sebuah mobil warna hitam di halaman rumahnya.Rizky Billar juga membantah mobil yang ditunjuknya itu adalah sewaan. Pasalnya seseorang pernah menuding Billar demikian. ""Ini mobil beneran ya, bukan mobil sewaan seperti kata orang yang udah kerja puluhan tahun tapi belum mampu beli,"" sindir pria yang akan segera dikaruniai anak kedua tersebut. Pernyataan Rizky Billar soal orang yang tak mampu beli mobil padahal sudah kerja puluhan tahun rupanya menyinggung warganet. Namun Billar menegaskan hanya menyindir satu orang. Dalam balasannya terhadap warganet yang tersinggung itu, Rizky Billar bahkan menandai akun Dewi Perssik. Secara otomatis yang dimaksud Billar belum bisa beli mobil padahal sudah kerja puluhan tahun adalah Dewi alias Depe. ""Kesindir aku bang Bi, aku kerja puluhan tahun belum bisa kebeli mobil-mobilan. Tapi syukuri aja,"" komentar akun @mi***.""Enggak kak. Ini bukan buat Kakak kok. Ini buah Teh @Dewi Perssik Real,"" balas Rizky Billar yang dibagikan ulang akun @madamesuperstar.id pada Minggu 1 September 2024. Gosip soal mobil sewaan Rizky Billar sebenarnya bermula dari pernyataan Satria Mulia. Menanggapi gosip tersebut, Daniel Eddy ayah Billar sampai menunjukkan BPKB-BPKB milik sang putra. Bahkan Rizky Billar sempat menggelar sayembara berhadiah Rp100 juta apabila ada yang bisa membuktikan mobilnya sewaan. Rizky Billar dan Dewi Perssik pun sampai saat ini belum memperlihatkan perdamaian. Billar agaknya masih menyimpan dendam karena Depe pernah ikut menyindirnya soal KDRT. Ketika Dewi Perssik ribut dengan Pak RT kawasan tempat tinggalnya soal hewan kurban, Rizky Billar balas menyindirnya. Kini Billar kembali menyindir Depe yang diduga pernah menyinggung soal Billar menyewa mobil. ""Semenjak KDRT ini laki mulutnya suka lemes sampai ke Kaesang juga ikutan,"" komentar akun @siff***. ""Udah bener kontennya lucu-lucuan aja bang bareng keluarga. Jangan kayak dulu terkesan pamer. Taunya ikut kebawa-bawa gara-gara kasus orang,"" balas akun @ayoucah***. Kontributor : Neressa Prahastiwi","Rizky Billar kembali membahas soal gosip dirinya menyicil mobil Alphard. Semua berawal dari niat Billar memberikan kejutan untuk sang istri. "" Rizky Billar juga membantah mobil yang ditunjuknya itu adalah sewaan. Pasalnya seseorang pernah menuding Billar demikian. "" Ini mobil beneran ya, bukan mobil sewaan seperti kata orang yang udah kerja puluhan tahun tapi belum mampu beli,"" sindir pria yang akan segera dikaruniai anak kedua tersebut. Kesindir aku bang Bi, aku kerja puluhan tahun belum bisa kebeli mobil-mobilan. Ini buah Teh @Dewi Perssik Real,"" balas Rizky Billar yang dibagikan ulang akun @madamesuperstar.id pada Minggu 1 September 2024. Bahkan Rizky Billar sempat menggelar sayembara berhadiah Rp100 juta apabila ada yang bisa membuktikan mobilnya sewaan. Rizky Billar dan Dewi Perssik pun sampai saat ini belum memperlihatkan perdamaian. Ketika Dewi Perssik ribut dengan Pak RT kawasan tempat tinggalnya soal hewan kurban, Rizky Billar balas menyindirnya. Kini Billar kembali menyindir Depe yang diduga pernah menyinggung soal Billar menyewa mobil. "" Semenjak KDRT ini laki mulutnya suka lemes sampai ke Kaesang juga ikutan,"" komentar akun @siff***. "" Udah bener kontennya lucu-lucuan aja bang bareng keluarga."
Raissa Ramadhani Persembahkan Lagu LAURA Untuk Original Soundtrack Film LAURA,Entertainment,2024-09-01,Yohanes Endra,https://www.suara.com/entertainment/2024/09/01/214000/raissa-ramadhani-persembahkan-lagu-laura-untuk-original-soundtrack-film-laura,"Setelah sukses dengan beberapa single yang telah dirilisnya, kini Raissa Ramadhani kembali hadir dengan karya terbaru. Mengawali kariernya di dunia tarik suara pada tahun 2022, Raissa Ramadhani bahkan sudah mencapai 300K ++ monthly listeners di digital streaming platform. Mewarnai perjalanannya dalam bermusik, akhirnya Raissa Ramadhani debut untuk mengisi original soundtrack film produksi MD Pictures, “LAURA”. Bersama MD Musik Indonesia dan Sony Music Indonesia, lagu yang berjudul ‘LAURA’ ini mempersembahkan kisah tentang Laura, seorang influencer. Lagu ini juga merupakan bentuk untuk mengenang Laura, yang dikenal dengan sosok periang hingga perjuangannya dalam mendapatkan keadilan bagi dirinya. Lagu ‘LAURA’ ditulis oleh deretan pencipta lagu yang karyanya begitu dikenal di kalangan pendengar musik yaitu TINTIN dan Clara Riva. Menyajikan nuansa pop ballad, lagu ini dinyanyikan oleh Raissa Ramadhani dengan penuh rasa yang mendalam untuk menyampaikan pesan dalam lagu “LAURA”.Raissa Ramadhani mengaku sangat gembira dipercaya untuk mengisi original soundtrack film layar lebar ""Laura"". “Sudah tentu aku sangat senang dipercaya bekerjasama dengan MD Pictures untuk menyanyikan Original Soundtrack filmnya. Prosesnya pun berlangsung cukup cepat dan lancar, hingga tiba-tiba kita sudah harus mengatur jadwal workshop dan persiapan rekaman,” ujar Raissa. Raissa juga menambahkan kisah Laura ini benar-benar memprihatinkan, ia berharap dapat bertemu dengan keluarga Laura dan berharap mereka puas dengan hasil karyanya sebagai pengisi lagu soundtracknya. ""Aku berharap bisa bertemu dengan keluarganya dan semoga pihak keluarganya juga puas dengan aku sebagai pengisi lagu OST-nya,"" tutupnya. Laura, seorang influencer berbakat dan sosok yang dicintai banyak orang, menghadapi perjuangan besar setelah kecelakaan tragis yang membuatnya lumpuh - kecelakaan yang ternyata disebabkan oleh kekasihnya, Jojo.Menyedihkannya, Laura Anna baru mengetahui sifat asli Jojo setelah dirinya menjadi tidak berdaya. Pada akhirnya, Laura menyadari hanya keluarga yang akan terus berada disisinya dalam keadaan susah ataupun senang. Berdasarkan kisah nyata Edelenyi Laura Anna, Film ""LAURA"" tayang mulai 12 September 2024 di bioskop. Selain itu, lagu ‘LAURA’ juga sudah bisa dinikmati di berbagai macam platform musik mulai tanggal 30 Agustus 2024. Serta official video ‘LAURA’ yang akan tayang SEGERA hanya di YouTube channel MD Music dan Raissa Ramadhani.","Setelah sukses dengan beberapa single yang telah dirilisnya, kini Raissa Ramadhani kembali hadir dengan karya terbaru. Mewarnai perjalanannya dalam bermusik, akhirnya Raissa Ramadhani debut untuk mengisi original soundtrack film produksi MD Pictures, “LAURA”. Sudah tentu aku sangat senang dipercaya bekerjasama dengan MD Pictures untuk menyanyikan Original Soundtrack filmnya. Prosesnya pun berlangsung cukup cepat dan lancar, hingga tiba-tiba kita sudah harus mengatur jadwal workshop dan persiapan rekaman,” ujar Raissa. Raissa juga menambahkan kisah Laura ini benar-benar memprihatinkan, ia berharap dapat bertemu dengan keluarga Laura dan berharap mereka puas dengan hasil karyanya sebagai pengisi lagu soundtracknya. "" Laura, seorang influencer berbakat dan sosok yang dicintai banyak orang, menghadapi perjuangan besar setelah kecelakaan tragis yang membuatnya lumpuh - kecelakaan yang ternyata disebabkan oleh kekasihnya, Jojo. Menyedihkannya, Laura Anna baru mengetahui sifat asli Jojo setelah dirinya menjadi tidak berdaya. Pada akhirnya, Laura menyadari hanya keluarga yang akan terus berada disisinya dalam keadaan susah ataupun senang. Selain itu, lagu ‘LAURA’ juga sudah bisa dinikmati di berbagai macam platform musik mulai tanggal 30 Agustus 2024."
Kapan Baskara Mahendra dan Sherina Menikah? Rumah Tangganya Sedang Disorot,Entertainment,2024-09-01,Baehaqi Almutoif,https://www.suara.com/entertainment/2024/09/01/193712/kapan-baskara-mahendra-dan-sherina-menikah-rumah-tangganya-sedang-disorot,"Rumah tangga Sherina Munaf dengan Baskara Mahendra sedang disorot. Publik khawatir setelah di akun Instagram perempuan 34 tahun tersebut tak lagi ada foto sang suami. Kabar rumah tangga keduanya retak pun mencuat. Sherina juga tidak mengikuti satu orang pun di akun media sosialnya tersebut. Spekulasi semakin liar muncuk ketika Sherina membagikan foto-foto seksinya di Instagram. Padahal sebelumnya dia hampir tak pernah mengumbar keseksian di media sosial. Baskara Munaf dan Sherina Munaf menikah pada 3 November 2020. Keduanya mengikat janji suci setelah setahun berpacaran.Keduanya melangsungkan pernikahan secara tertutup, karena saat itu sedang pandemi Covid-19. Acara hanya dihadiri oleh keluarga terdekat, seperti orang tua, mempelai, saksi nikah, dan penghulu. Sherina dan Baskara pertama kali bertemu di acara gala premier film Bebas yang dirilis pada 2019. Baskara menjadi salah satu pemain di film tersebut. Pemeran film Petualangan Sherina yang datang di acara premier film tersebut terpesona di pandangan pertamanya. Keduanya kemudian mulai berkenalan dan akhirnya berpacaran. Baskara Mahendra merupakan seorang aktor. Banyak film yang telah diperankan oleh pria kelahiran Jakarta pada 1 Januari 1993 tersebut. Debut Baskara Mahendra di dunia seni peran ditandai dengan perannya film pendek Cita dan Cinta pada 2017. Di tahun yang sama, dia membintangi film layar lebar perdananya yang berjudul My Generation.Nama Baskara semakin dikenal luas oleh pemirsa lewat peran-perannya dalam sederet film seperti Lima (2018), Bebas (2019), Sebelum Iblis Menjemput Ayat 2 (2020), Losmen Bu Broto (2021) hingga 200 Pounds Beauty (2023). Selain film, Baskara Mahendra membintangi beberapa judul serial web, seperti Assalamualaikum Calon Imam (2019), Gossip Girl Indonesia (2020), serta Indonesia Biner (2022).","Rumah tangga Sherina Munaf dengan Baskara Mahendra sedang disorot. Publik khawatir setelah di akun Instagram perempuan 34 tahun tersebut tak lagi ada foto sang suami. Kabar rumah tangga keduanya retak pun mencuat. Keduanya mengikat janji suci setelah setahun berpacaran. Acara hanya dihadiri oleh keluarga terdekat, seperti orang tua, mempelai, saksi nikah, dan penghulu. Pemeran film Petualangan Sherina yang datang di acara premier film tersebut terpesona di pandangan pertamanya. Keduanya kemudian mulai berkenalan dan akhirnya berpacaran. Baskara Mahendra merupakan seorang aktor. Di tahun yang sama, dia membintangi film layar lebar perdananya yang berjudul My Generation. Selain film, Baskara Mahendra membintangi beberapa judul serial web, seperti Assalamualaikum Calon Imam (2019), Gossip Girl Indonesia (2020), serta Indonesia Biner (2022)."
