title,category,publish_date,author,article_url,content,summary
"Biasanya Dihujat, Nikita Mirzani Tuai Simpati karena Ucapan Ini untuk Almarhumah Ibu",Entertainment,2024-08-29,Yazir Farouk,https://www.suara.com/entertainment/2024/08/29/203000/biasanya-dihujat-nikita-mirzani-tuai-simpati-karena-ucapan-ini-untuk-almarhumah-ibu,"Nikita Mirzani kerap dihujat warganet karena perkataannya yang dianggap memancing emosi. Artis kontroversial ini juga sering menyinggung artis lain yang sedang ramai dibahas publik. Tapi kali ini, Nikita Mirzani justru mendapat simpati.  Ini karena pesan Niki, sapaan akrabya, untuk almarhum ibunya. Pesan tersebut disampaikan Nikita Mirzani saat hadir di talkshow Pagi-Pagi Ambyar TransTV hari ini, Kamis 29 Agustus 2024. ""Sekangen apa sama mamah?"" tanya sang host, Ryan Ibram kepada Nikita Mirzani.""Kangen banget aku. Ya, kayaknya kalau masih ada orangtua tuh, kayaknya masalah-masalah kayak gini nggak mungkin ada karena pasti orangtuaku bakal jaga anak-anakku ketika aku bekerja,"" jawabnya. Nikita Mirzani sampai tak sanggup menahan tangisnya saat membahas sang bunda. Napasnya juga tersengal-sengal ketika mengungkap perasaannya. ""Mama ulang tahun 11 November, meninggalnya 12 November, hanya berselang satu hari. Niki, kita punya sesuatu untuk seorang Nikita Mirzani,"" kata Ryan Ibram, dikutip dari unggahan TikTok @pagipagiambyarttv. Setelahnya, muncul editan foto Nikita Mirzani memeluk mendiang ibunya. Sontak editan yang menggunakan teknologi AI itu membuat mantan pacar sekretaris pribadi Prabowo Subianto itu menangis lebih kencang. ""Seandainya Niki bisa menyampaikan sesuatu untuk mama, keluh kesah, apapun, Niki mau bilang apa sama mama?"" tanya Ryan Ibram lagi.Sambil menenangkan diri, Nikita Mirzani menjawab, ""Aku sudah mengusahakan yang terbaik, ma. Capek, ma."" Usai mengungkap keluhannya, ibu tiga anak itu kembali menangis sesenggukan sampai menutupi wajahnya dengan bantal kursi. Melihat kesedihan yang ditunjukkan Nikita Mirzani, publik turut bersimpati kepada ibu dari Laura Meizani alias Lolly itu. ""Baru kali ini nangisin Nikita Mirzani,"" kata akun @siswa***. ""Baru kali ini lihat Niki benar-benar sedih dan hancur,"" imbuh akun @racun***. ""Baru kali ini lihat seorang Nikita Mirzani sesedih ini. Ikut nangis pas bilang 'capek ma'. Ya Allah Lolly, kamu harus lihat ini lho sumpah,"" sambung akun @sweet***.","Nikita Mirzani kerap dihujat warganet karena perkataannya yang dianggap memancing emosi. Artis kontroversial ini juga sering menyinggung artis lain yang sedang ramai dibahas publik. Tapi kali ini, Nikita Mirzani justru mendapat simpati. Pesan tersebut disampaikan Nikita Mirzani saat hadir di talkshow Pagi-Pagi Ambyar TransTV hari ini, Kamis 29 Agustus 2024. "" Nikita Mirzani sampai tak sanggup menahan tangisnya saat membahas sang bunda. Mama ulang tahun 11 November, meninggalnya 12 November, hanya berselang satu hari. Niki, kita punya sesuatu untuk seorang Nikita Mirzani,"" kata Ryan Ibram, dikutip dari unggahan TikTok @pagipagiambyarttv. Sontak editan yang menggunakan teknologi AI itu membuat mantan pacar sekretaris pribadi Prabowo Subianto itu menangis lebih kencang. "" Usai mengungkap keluhannya, ibu tiga anak itu kembali menangis sesenggukan sampai menutupi wajahnya dengan bantal kursi. Baru kali ini nangisin Nikita Mirzani,"" kata akun @siswa***. "" Baru kali ini lihat seorang Nikita Mirzani sesedih ini."
"Kimberly Ryder Akhirnya Punya Mobil Baru, Anaknya Tak Naik Bajaj Lagi",Entertainment,2024-08-29,Yohanes Endra,https://www.suara.com/entertainment/2024/08/29/201500/kimberly-ryder-akhirnya-punya-mobil-baru-anaknya-tak-naik-bajaj-lagi,"Kimberly Ryder akhirnya punya mobil untuk kendaraan dua anaknya pergi ke sekolah. Mobil baru Kimberly rupanya hasil kerjanya sebagai Brand Ambassador (BA) perusahaan milik Jhon LBF sejak 24 Juli 2024 lalu. Melalui akun Instagram pribadinya, Jhon LBF membagikan momen penyerahan satu unit mobil untuk Kimberly Ryder sebagai BA Hive Five. Rayden dan Aisyah anak-anak Kimberly juga terlihat ikut serta dalam momen spesial tersebut. ""Alhamdulillah lancar penyerahan satu unit mobil baru untuk @kimbrlyryder sebagai Brand Ambassador @hivefive.co.id,"" tulis Jhon LBF pada Kamis 29 Agustus 2024.""Terima kasih kerja samanya. Sukses dan sehat selalu untuk @kimbrlyryder,"" sambung pengusaha yang punya 1,3 juta followers Instagram tersebut. Kimberly Ryder mengomentari postingan Jhon LBF dengan ucapan syukur. Begitu pun warganet yang ikut lega karena anak-anak Kimberly Ryder tak naik bajaj lagi apabila pergi ke sekolah. ""Alhamdulillah… semoga berkah, sehat, sukses selalu bang @jhonlbf @sabartobing_hf @hivefive.co.id thank you,"" komentar Kimberly Ryder. ""Sekarang anak-anak Kimberly udah gak sekolah pakai bajaj lagi... Alhamdulillah,"" sahut akun @mahesa_alt***. ""Rejeki anaknya biar gak naik bajaj lagi,"" balas akun @nidakan***. Seperti diketahui, Kimberly Ryder tengah menjalani proses cerai dengan Edward Akbar. Selain cerai, Kimberly juga menggugat Edward atas dugaan penggelapan dua mobil.Edward Akbar tak merasa menggelapkan mobil yang menurutnya dibeli setelah menikah dengan Kimberly Ryder sehingga masuk dalam harta gono-gini. Ketika ditanya nasib anak-anaknya yang tak bisa naik mobil saat sekolah, Edward Akbar merasa bukan masalah besar karena telah mendidik mereka hidup sederhana. Tamara Bleszynski yang merupakan adik dari almarhum Teresa ibu Edward Akbar sampai ikut berkomentar. Tamara menawarkan diri untuk mengantarkan anak-anak Edward apabila mobil adalah masalahnya. Hingga saat ini, gugatan cerai maupun kasus dugaan penggelapan mobil yang diajukan Kimberly Ryder masih diproses pengadilan. Di sisi lain, harga mobil untuk Kimberly dari Jhon LBF juga bikin warganet penasaran. Dari potret yang dibagikan Jhon LBF, mobil baru Kimberly Ryder dipastikan dari brand Toyota berdasarkan logonya. Sementara untuk tipenya, mobil Kimberly mirip Toyota Avanza yang tahun 2024 ini bernilai Rp270 jutaan menurut website oto.com. Kontributor : Neressa Prahastiwi","Kimberly Ryder akhirnya punya mobil untuk kendaraan dua anaknya pergi ke sekolah. Mobil baru Kimberly rupanya hasil kerjanya sebagai Brand Ambassador (BA) perusahaan milik Jhon LBF sejak 24 Juli 2024 lalu. Melalui akun Instagram pribadinya, Jhon LBF membagikan momen penyerahan satu unit mobil untuk Kimberly Ryder sebagai BA Hive Five. Rayden dan Aisyah anak-anak Kimberly juga terlihat ikut serta dalam momen spesial tersebut. "" Alhamdulillah lancar penyerahan satu unit mobil baru untuk @kimbrlyryder sebagai Brand Ambassador @hivefive.co.id,"" tulis Jhon LBF pada Kamis 29 Agustus 2024.""Terima kasih kerja samanya. Begitu pun warganet yang ikut lega karena anak-anak Kimberly Ryder tak naik bajaj lagi apabila pergi ke sekolah. "" Sekarang anak-anak Kimberly udah gak sekolah pakai bajaj lagi... Alhamdulillah,"" sahut akun @mahesa_alt***. "" Selain cerai, Kimberly juga menggugat Edward atas dugaan penggelapan dua mobil. Tamara Bleszynski yang merupakan adik dari almarhum Teresa ibu Edward Akbar sampai ikut berkomentar. Tamara menawarkan diri untuk mengantarkan anak-anak Edward apabila mobil adalah masalahnya. Dari potret yang dibagikan Jhon LBF, mobil baru Kimberly Ryder dipastikan dari brand Toyota berdasarkan logonya."
"Nagita Slavina Kebanting, Interaksi Aurel Hermansyah dengan Fans Tuai Pujian",Entertainment,2024-08-29,Yohanes Endra,https://www.suara.com/entertainment/2024/08/29/200000/nagita-slavina-kebanting-interaksi-aurel-hermansyah-dengan-fans-tuai-pujian,"Berbanding terbalik dari Nagita Slavina, interaksi Aurel Hermansyah dengan penggemarnya ramai menuai pujian dari sejumlah kalangan warganet. Dari unggahan yang beredar, interaksi Aurel Hermansyah dan penggemarnya tersebut terjadi menjelang final ajang kompetisi 'Bintang Dari Timur' pada Jumat 23 Agustus 2024. Seperti diketahui, Aurel Hermansyah menjadi juri dalam ajang kompetisi tersebut. Dia juga didampingi oleh Ashanty dan Aurel Hermansyah sebagai juri. Dalam video tersebut, Aurel Hermansyah dan Ashanty selaku juri tampaknya sedang mengecek sound yang berlangsung di kawasan Gedung Modiv, Hotel Ternate.Berdasarkan pantauan, sesi cek sound tersebut terbuka secara umum sehingga beberapa penggemar ikut menyaksikan Aurel Hermansyah dan Ashanty unjuk gigi. Di tengah-tengah sesi check sound, Aurel Hermansyah dan Ashanty disapa oleh beberapa penggemar yang berada di sekitar lokasi. ""Bunda, Bunda,"" kata beberapa fans. Alih-alih cuek maupun fokus cek sound, Aurel Hermansyah dan Ashanty menyempatkan diri untuk membalas sapaan para penggemarnya. Aurel Hermansyah dan Ashanty terlihat melambai-lambaikan tangannya kepada beberapa penggemar yang ikut menyaksikan sesi cek sound.""Bunda dan Mama Nur, aku senang banget loh di-notice,"" bunyi keterangan yang disertakan. Cuplikan unggahan video interaksi Aurel Hermansyah dan penggemarnya ini viral di media sosial TikTok dengan atensi sebanyak 210,7 ribu jumlah tayangan. ""Check sound grand final Bintang dari Timur,"" tulis akun TikTok @tokanenvi, dikutip pada Kamis 29 Agustus 2024. Perihal itu, sejumlah netizen turut memberikan respons dan komentar yang beragam. Sebagian netizen memuji adab Aurel Hermansyah. ""Mereka humble banget, Atta Aurel anak baik,"" tulis seorang netizen. ""Keren Mama Nur langsung kasih senyum,"" ucap netizen lain. ""Top, keren Bunda dan Aurel selalu dalam lindungan Yang Maha Kuasa bersama tim semua,"" ujar netizen yang lainnya. Untuk informasi tambahan, Nagita Slavina memiliki riwayat kurang baik berinteraksi dengan penggemarnya. Dia dianggap kurang terbuka hingga kelewat dingin kepada pengemarnya. Dalam acara 'Serunya Rans 17-an' yang berlangsung di Qbig BSD City Tangerang pada Kamis 17 Agustus 2023 lalu, Nagita Slavina tampak sibuk menelepon alih-alih menyambut sapaan penggemarnya.","Berbanding terbalik dari Nagita Slavina, interaksi Aurel Hermansyah dengan penggemarnya ramai menuai pujian dari sejumlah kalangan warganet. Dari unggahan yang beredar, interaksi Aurel Hermansyah dan penggemarnya tersebut terjadi menjelang final ajang kompetisi 'Bintang Dari Timur' pada Jumat 23 Agustus 2024. Berdasarkan pantauan, sesi cek sound tersebut terbuka secara umum sehingga beberapa penggemar ikut menyaksikan Aurel Hermansyah dan Ashanty unjuk gigi. Di tengah-tengah sesi check sound, Aurel Hermansyah dan Ashanty disapa oleh beberapa penggemar yang berada di sekitar lokasi. "" Perihal itu, sejumlah netizen turut memberikan respons dan komentar yang beragam. Sebagian netizen memuji adab Aurel Hermansyah. "" Mereka humble banget, Atta Aurel anak baik,"" tulis seorang netizen. "" Top, keren Bunda dan Aurel selalu dalam lindungan Yang Maha Kuasa bersama tim semua,"" ujar netizen yang lainnya. Untuk informasi tambahan, Nagita Slavina memiliki riwayat kurang baik berinteraksi dengan penggemarnya. Dia dianggap kurang terbuka hingga kelewat dingin kepada pengemarnya."
"Dianggap Kena Karma, Ingat Lagi Omongan Nikita Mirzani Tuduh Dewi Perssik Sering Aborsi",Entertainment,2024-08-29,Yohanes Endra,https://www.suara.com/entertainment/2024/08/29/181500/dianggap-kena-karma-ingat-lagi-omongan-nikita-mirzani-tuduh-dewi-perssik-sering-aborsi,"Nikita Mirzani ramai dituding terkena karma seiring santernya kabar anak sulungnya, Laura Meizani alias Lolly, hamil di luar pernikahan hingga melakukan aborsi. Seperti diketahui, isu Lolly hamil di luar pernikahan hingga melakukan aborsi pertama kali disebarkan oleh asisten Nikita Mirzani, Mail Syahputra. Pasca kabar tersebut viral, Nikita Mirzani pun angkat bicara dalam sesi live TikTok. Dalam klarifikasinya, dia membenarkan jika Lolly pernah hamil. ""Berita itu, anak hamil di luar nikah, saya sudah tutup-tutupin dari 2 bulan lalu. Saya sudah tahu,"" kata Nikita Mirzani.Tidak hanya itu, mantan pujaan hati Antonio Dedola tersebut secara mencurigai jika Lolly telah melakukan aborsi. ""Anak itu tiba-tiba berhijab karena menutupi kehamilannya. Mungkin sekarang sudah diaborsi,"" sambung Nikita Mirzani. Di samping dalam sesi live, Nikita Mirzani juga menyampaikan kabar Lolly hamil hingga aborsi dalam acara televisi 'Pagi Pagi Ambyar'. ""Sampai dua bulan lalu terjadi sesuatu yang besar, aku gak bisa makan,"" tutur Nikita Mirzani, dilansir dari akun @rumpi_gosip pada Kamis 29 Agustus 2024. Perihal itu, sejumlah netizen turut memberikan respons dan komentar yang beragam. Sebagian netizen menilai kehamilan Lolly merupakan bentuk karma Nikita Mirzani kepada Dewi Perssik.""Dewi Perssik lagi nonton sambil makan, lihatin dulu difitnah aborsi kena karma ke anaknya aborsi,"" tulis seorang netizen. ""Ngatain Rachel Vennya biayain Salim, eh anaknya juga biayain sampai bunting,"" ucap netizen lain. ""Dia sedang menuai, kak. Sambil metik hasilnya,"" ujar netizen yang lainnya. Untuk informasi tambahan, Nikita Mirzani sebelumnya pernah menuding Dewi Perssik melakukan aborsi. Tudingan tersebut diutarakan ibunda Laura Meizani pada 2022 lalu. ""Burik yang suka gugurin kandungan, 5 kali gugurin kandungan. Suka main dukun sampe dukunnya dibelikan rumah,"" ujar Nikita Mirzani. Di lain pihak, Dewi Persssik telah buka suara ihwal tudingan melakukan aborsi sebagaimana yang dilontarkan Nikita Mirzani. ""Mengenai aborsi, kalau aku keguguran mungkin dulu teman-teman punya jejak digital zaman aku sama Mas Saipul Jamil. Aku pernah keguguran tapi bukan aborsi,"" ucap Dewi Perssik.","Nikita Mirzani ramai dituding terkena karma seiring santernya kabar anak sulungnya, Laura Meizani alias Lolly, hamil di luar pernikahan hingga melakukan aborsi. Dalam klarifikasinya, dia membenarkan jika Lolly pernah hamil. "" Berita itu, anak hamil di luar nikah, saya sudah tutup-tutupin dari 2 bulan lalu. Anak itu tiba-tiba berhijab karena menutupi kehamilannya. Di samping dalam sesi live, Nikita Mirzani juga menyampaikan kabar Lolly hamil hingga aborsi dalam acara televisi 'Pagi Pagi Ambyar'. "" Perihal itu, sejumlah netizen turut memberikan respons dan komentar yang beragam. ""Dewi Perssik lagi nonton sambil makan, lihatin dulu difitnah aborsi kena karma ke anaknya aborsi,"" tulis seorang netizen. "" Sambil metik hasilnya,"" ujar netizen yang lainnya. Untuk informasi tambahan, Nikita Mirzani sebelumnya pernah menuding Dewi Perssik melakukan aborsi. Tudingan tersebut diutarakan ibunda Laura Meizani pada 2022 lalu. "" Burik yang suka gugurin kandungan, 5 kali gugurin kandungan."
"Pandji Pragiwaksono Lantang Sebut Dirinya Atasan Presiden, Berawal dari Sindiran Prabowo",Entertainment,2024-08-29,Yazir Farouk,https://www.suara.com/entertainment/2024/08/29/181000/pandji-pragiwaksono-lantang-sebut-dirinya-atasan-presiden-berawal-dari-sindiran-prabowo,"Pandji Pragiwaksono menegaskan apabila dirinya atasan Presiden Republik Indonesia (RI). Semua berawal dari ketersinggungan Pandji terhadap pernyataan Presiden Terpilih, Prabowo Subianto. Dalam Kongres VI PAN di Jakarta pada Sabtu 24 Agustus 2024, Prabowo Subianto menyinggung orang-orang pintar yang sedikit-sedikit bicara di podcast. Ketimbang podcast dengan duduk di bawah AC untuk 'omon-omon', Prabowo Subianto yang saat ini masih menjabat sebagai Menteri Pertahanan lebih memilih untuk membantu rakyat yang kesusahan. Prabowo Subianto juga heran melihat orang-orang yang podcast untuk mengomentari dirinya. Komentar orang-orang yang podcast itu dinilai Prabowo merasa lebih tahu dari dirinya sendiri.Menanggapi pernyataan Prabowo Subianto, Pandji Pragiwaksono agaknya tersinggung. Pandji lantas mengajak Prabowo main catur yang merupakan konsep podcast miliknya. ""Siang Pak @prabowo, bisa main catur kah?"" tanya Pandji Pragiwaksono pada Rabu 28 Agustus 2024. Ajakan Pandji Pragiwaksono yang menggunakan link berita salah satu media online dirasa tidak sopan oleh salah satu warganet. Namun menurut Pandji, pidato Prabowo Subianto lebih tidak sopan. ""Lebih nggak sopan mana dengan pidato nyindir-nyindir tanpa nyebut nama. Saya sih mengajak langsung. Menyebut nama. Nggak sekadar omon-omon,"" balas Pandji.Jawaban Pandji Pragiwaksono kembali di-counter warganet. Pandji dirasa tidak layak membandingkan dirinya dengan Prabowo Subianto yang seorang Presiden Terpilih, menteri, ketua umum partai, pengusaha, serta mantan jenderal TNI. Sedangkan Pandji Pragiwaksono justru merasa punya jabatan lebih tinggi dari Prabowo Subianto, yaitu sebagai rakyat Indonesia yang merupakan atasan Presiden Republik Indonesia. ""Kita semua rakyat. Kita semua atasannya Presiden Republik Indonesia. Pasang di bio-mu: Atasan Presiden Republik Indonesia,"" tegas Pandji yang membagikan ulang ciutannya melalui Instagram pada Kamis 29 Agustus 2024. Bio akun Instagram maupun X milik Pandji Pragiwaksono pun telah diganti dengan statusnya sebagai ""Atasan Presiden Republik Indonesia"". Warganet di Instagram setuju dengan pendapat serta ajakan Pandji tersebut. ""Kekuasaan pemerintahan tertinggi ya ada di rakyat lah, bukan di Presiden apalagi Raja Jawa,"" komentar akun @yuay***. ""Presiden itu kita yang kasih mandat. Jangan sepele sama rakyat!"" sahut akun @pak_ipunk_sai***. ""Di negara yang demokrasi, rakyatlah tuan yang sesungguhnya,"" kata akun @leo.ch***. ""Tuanku ya rakyat, jabatan hanya mandat,"" timpal akun @firmantan***. Kontributor : Neressa Prahastiwi","Pandji Pragiwaksono menegaskan apabila dirinya atasan Presiden Republik Indonesia (RI). Semua berawal dari ketersinggungan Pandji terhadap pernyataan Presiden Terpilih, Prabowo Subianto. Komentar orang-orang yang podcast itu dinilai Prabowo merasa lebih tahu dari dirinya sendiri. Menanggapi pernyataan Prabowo Subianto, Pandji Pragiwaksono agaknya tersinggung. Siang Pak @prabowo, bisa main catur kah?"" Lebih nggak sopan mana dengan pidato nyindir-nyindir tanpa nyebut nama. Sedangkan Pandji Pragiwaksono justru merasa punya jabatan lebih tinggi dari Prabowo Subianto, yaitu sebagai rakyat Indonesia yang merupakan atasan Presiden Republik Indonesia. "" Kita semua atasannya Presiden Republik Indonesia. Pasang di bio-mu: Atasan Presiden Republik Indonesia,"" tegas Pandji yang membagikan ulang ciutannya melalui Instagram pada Kamis 29 Agustus 2024. Bio akun Instagram maupun X milik Pandji Pragiwaksono pun telah diganti dengan statusnya sebagai ""Atasan Presiden Republik Indonesia"". Warganet di Instagram setuju dengan pendapat serta ajakan Pandji tersebut. "" Tuanku ya rakyat, jabatan hanya mandat,"" timpal akun @firmantan***."
Polisi Dalami Laporan Bunga Zainal Terkait Penggelapan Rp15 Miliar,Entertainment,2024-08-29,Yazir Farouk,https://www.suara.com/entertainment/2024/08/29/175019/polisi-dalami-laporan-bunga-zainal-terkait-penggelapan-rp15-miliar,"Bunga Zainal mengalami kerugian kurang lebih Rp 15 miliar. Ini karena artis 37 tahun tersebut diduga mengalami penipuan dari rekan bisnis di Bali. Saat ini, Bunga Zainal telah melaporkan kasus dugaan penipuan dan atau penggelapan ke Polda Metro Jaya, Kamis 22 Agustus 2024. ""Pelapor, melaporkan peristiwa dugaan terjadinya penipuan dan penggelapan, yang dilaporkan adalah saudari AA, ACD dan saudara SF, SS,"" kata Kabid Humas Polda Metro Jaya, Kombespol Ade Ary Syam Indradi di kantornya, Kamis 28 Agustus 2024.Atas laporan tersebut, polisi akan menggunakan pasal 372 dan 378 KUHP terkait dengan dugaan tindak penipuan dan atau penggelapan. Meski sudah mendapat nama terlapor, polisi masih melakukan penyelidikan terhadap kasus yang dialami Bunga Zainal. ""Saat ini, kasus sedang didalami oleh rekan-rekan dari penyelidik subdit Harda Ditreskrimum Polda Metro Jaya,"" kata Ade Ary Syam Indradi. ""Penyelidikan ini adalah upaya pendalaman, apakah peristiwa yang dilaporkan pelapor ada dugaan pidana atau tidak,"" imbuhnya. Sebagai penguat atas laporan ini, polisi sudah menerima sejumlah bukti yang diserahkan Bunga Zainal.""Ada kuitansi, PO, perjanjian kerjasama hingga somasi,"" kata Ade. Bunga Zainal juga akan diperiksa terlebih dulu. Ini sebagai awal dari penyelidikan polisi mengusut kasus sang artis. ""Jadi mohon waktu, ini sedang pendalaman,"" kata Ade Ary Syam Indradi.","Bunga Zainal mengalami kerugian kurang lebih Rp 15 miliar. Saat ini, Bunga Zainal telah melaporkan kasus dugaan penipuan dan atau penggelapan ke Polda Metro Jaya, Kamis 22 Agustus 2024. "" ""Ada kuitansi, PO, perjanjian kerjasama hingga somasi,"" kata Ade. Bunga Zainal juga akan diperiksa terlebih dulu. Ini sebagai awal dari penyelidikan polisi mengusut kasus sang artis. "" Jadi mohon waktu, ini sedang pendalaman,"" kata Ade Ary Syam Indradi."
"Cuek Ko Apex Ditahan di Lapas, Dinar Candy Malah Dituding Cari Mangsa Baru",Entertainment,2024-08-29,Yohanes Endra,https://www.suara.com/entertainment/2024/08/29/173411/cuek-ko-apex-ditahan-di-lapas-dinar-candy-malah-dituding-cari-mangsa-baru,"Pasangan disjoki (DJ) Dinar Candy, Ko Apex, akhirnya ditahan di Lapas Kelas IIA Jambi selama 20 hari atas kasus dugaan pemalsuan dokumen serta penggelapan jabatan. Dalam foto yang diunggah akun @lambe_danu pada Kamis 29 Agustus 2024, terlihat pria bernama asli Affandi Susilo itu sudah memakai rompi tahanan saat mengurus berkasnya. ""Sempat menghirup udara bebas, kini Ko Apex kembali ditahan. Saat ini dirinya dititipkan pihak Kejari Jambi ke Lapas Kelas IIA Jambi,"" bunyi keterangan di dalam foto. Diketahui penyerahan Ko Apex ke pihak berwajib sudah dilakukan sejak Senin, 26 Agustus 2024, kemarin.Tepat dihari penahanan Ko Apex, ternyata Dinar Candy membuat konten yang menyinggung kepergian seseorang. Namun alih-alih bersedih, Dinar Candy justru terlihat senang. Bahkan, ia tidak terlihat raut sendu di wajahnya dalam konten tersebut. Dalam video tersebut, perempuan 31 tahun itu tampil berlenggak- lenggok di depan kamera mengikuti backsound. ""Jangan takut dia pergi, stock Tuhan masih banyak,"" bunyi keterangan yang ditulisnya. Dari caption yang ditulis Dinar Candy, warganet menduga mantan pacar Ridho Ilahi itu sendang mencari 'mangsa' baru untuk menggantikan Ko Apex.""Bangun gaes, dia lagi cari mangsa baru, hati-hati,"" ujar @Army***. ""Asal jangan suami orang yang lu incer lagi Dinar,"" tegur @octavia***. ""Stock suami masih banyak,"" sindir @rara***. Dinar Candy dituding sebagai perebut lelaki orang atau pelakor, karena menjalin hubungan dengan Ko Apex ketika sang tersangka masih beristri dan memiliki dua anak. Setelah hubungan asmara mereka diketahui, mantan istri Ko Apex, Ayu Soraya, memilih bercerai daripada dimadu.","Pasangan disjoki (DJ) Dinar Candy, Ko Apex, akhirnya ditahan di Lapas Kelas IIA Jambi selama 20 hari atas kasus dugaan pemalsuan dokumen serta penggelapan jabatan. Dalam foto yang diunggah akun @lambe_danu pada Kamis 29 Agustus 2024, terlihat pria bernama asli Affandi Susilo itu sudah memakai rompi tahanan saat mengurus berkasnya. "" Sempat menghirup udara bebas, kini Ko Apex kembali ditahan. Saat ini dirinya dititipkan pihak Kejari Jambi ke Lapas Kelas IIA Jambi,"" bunyi keterangan di dalam foto. Jangan takut dia pergi, stock Tuhan masih banyak,"" bunyi keterangan yang ditulisnya. ""Bangun gaes, dia lagi cari mangsa baru, hati-hati,"" ujar @Army***. "" Stock suami masih banyak,"" sindir @rara***. Dinar Candy dituding sebagai perebut lelaki orang atau pelakor, karena menjalin hubungan dengan Ko Apex ketika sang tersangka masih beristri dan memiliki dua anak."
"Laporkan Beberapa Akun, Aaliyah Massaid Klarifikasi Tuduhan Hamil Duluan",Entertainment,2024-08-29,Yohanes Endra,https://www.suara.com/entertainment/2024/08/29/172525/laporkan-beberapa-akun-aaliyah-massaid-klarifikasi-tuduhan-hamil-duluan,"Aaliyah Massaid telah melaporkan sejumlah akun ke Polda Metro Jaya pada Kamis 22 Agustus 2024. Laporannya terkait sejumlah akun yang menudingnya hamil di luar nikah. Kepada polisi, Aaliyah Massaid memberikan klarifikasi. Ia membantah tuduhan soal hamil di luar nikah. ""Pelapor di laporannya menyatakan tidak hamil duluan. Bahkan saat itu, sedang mengalami period (menstruasi),"" kata Kabid Humas Polda Metro Jaya, Kombespol Ade Ary Syam Indradi di kantornya, Kamis 28 Agustus 2024. Karena merasa tuduhan itu adalah fitnah, Aaliyah Massaid mengambil tindakan pelaporan. Pasal yang kemudian disangkakan terkait dugaan pencemaran nama baik.""Sebagaimana diatur dalam pasal 27 a juncto 45 ayat 4 Undang-undang ITE nomor 1 tahun 2024. Dan juga pasal pencemaran nama baik yang diatur di KUHAP Pasal 310 KUHP, 311, dan 315 KUHP,"" jelas Ade Ary. Seharusnya Aaliyah Massaid menjalani pemeriksaan sebagai pelapor hari ini. Hanya saja karena istri Thariq Halilintar berhalangan hadir, maka jadwalnya diundur. ""Rencana akan dilakukan besok, hari Jumat,"" kata Ade Ary Syam. Untuk saat ini, penyidik Polda Metro Jaya belum menetapkan berapa akun yang disangkakan dalam pasal pencemaran nama baik. Meski begitu, mereka telah mengantongi tiga nama akun awal yang menjadi akar masalah laporan Aaliyah Massaid.Nama akun tersebut adalah @esmeralda_9999 dan @medialestar untuk di TikTok dan @infomedia3180, yang merupakan kanal YouTube. ""Apakah benar ada unggahan di tiga akun medsos ini, kemudian siapa yang mengunggah informasinya, kemudian motifnya apa dan lain sebagainya, masih akan dikroscek dengan peristiwa yang dilaporkan oleh pelapor,"" ucap Ade Ary mengakhiri.","Aaliyah Massaid telah melaporkan sejumlah akun ke Polda Metro Jaya pada Kamis 22 Agustus 2024. Laporannya terkait sejumlah akun yang menudingnya hamil di luar nikah. Bahkan saat itu, sedang mengalami period (menstruasi),"" kata Kabid Humas Polda Metro Jaya, Kombespol Ade Ary Syam Indradi di kantornya, Kamis 28 Agustus 2024. Karena merasa tuduhan itu adalah fitnah, Aaliyah Massaid mengambil tindakan pelaporan. Pasal yang kemudian disangkakan terkait dugaan pencemaran nama baik. ""Sebagaimana diatur dalam pasal 27 a juncto 45 ayat 4 Undang-undang ITE nomor 1 tahun 2024. Seharusnya Aaliyah Massaid menjalani pemeriksaan sebagai pelapor hari ini. Hanya saja karena istri Thariq Halilintar berhalangan hadir, maka jadwalnya diundur. "" Nama akun tersebut adalah @esmeralda_9999 dan @medialestar untuk di TikTok dan @infomedia3180, yang merupakan kanal YouTube. """
