title,category,publish_date,author,article_url,content,summary
"10 Potret Adu Gaya Syifa Hadju, Alyssa Daguise dan Tissa Biani di Resepsi Nikah Aaliyah-Thariq",Entertainment,2024-07-27,Ferry Noviandi,https://www.suara.com/entertainment/2024/07/27/214500/10-potret-adu-gaya-syifa-hadju-alyssa-daguise-dan-tissa-biani-di-resepsi-nikah-aaliyah-thariq,"Resepsi pernikahan Aaliyah Massaid dan Thariq Halilintar pada Jumat 26 Juli 2024 malam dihadiri oleh sederet artis ternama. Beberapa nama yang mencuri perhatian adalah Syifa Hadju, Alyssa Daguise, dan Tissa Biani. Tiga artis cantik tersebut bisa dibilang merupakan calon mantu Maia Estianty, meski Syifa Hadju belum terang-terangan mengaku sedang memiliki hubungan spesial dengan El Rumi. Sebagaimana diketahui, Alyssa Daguise kembali menjalin asmara dengan Al Ghazali. Sedangkan Dul Jaelani mungkin mendahului kakak-kakaknya naik ke pelaminan bersama Tissa Biani. Hadir di resepsi Aaliyah Massaid dan Thariq Halilintar, kebanyakan warganet menaruh perhatian lebih pada tiga artis cantik tersebut. Apalagi mereka terlihat berbagi momen kebersamaan.Lantas seperti apa sih penampilan cantik Syifa Hadju, Alyssa Daguise dan Tissa Biani di resepsi pernikahan Aaliyah Massaid? Intip deretan potret mereka berikut ini. 1. Tissa Biani datang ke resepsi pernikahan dua artis terviral saat ini tanpa Dul Jaelani yang tampaknya berhalangan hadir. 2. Tampil anggun dalam balutan dress abu-abu transparan, bintang film Agak Laen itu mengambil foto bersama sejumlah artis yang juga hadir di acara tersebut. 3. Sayangnya tak terlihat dalam sejumlah momen kebersamaan Al Ghazali dan El Rumi dengan pasangan masing-masing. 4. Makin mesra usai balikan, Al Ghazali dan Alyssa Daguise tampil serasi mengenakan busana sebagai groomsmen dan bridesmaid.5. Alyssa Daguise begitu memesona dalam balutan kebaya off-shoulder berwarna hijau serta gaya rambut elegan menyamping. 6. Jadi sosok paling dicari sepanjang acara, penampilan Syifa Hadju juga tak kalah memukau dari Tissa Biani dan Alyssa Daguise. 7. Diduga datang sebagai pasangan El Rumi, mantan kekasih Rizky Nazar itu memakai dress abu-abu dengan tali tipis. 8. Meski belum terang-terangan mengaku pacaran, Syifa Hadju selalu terlihat bersama dengan El Rumi di sepanjang acara resepsi. 9. Syifa bahkan ikut berfoto dengan sepupu El Rumi, yakni Diandra Marsha, serta Al Ghazali dan Alyssa Daguise. 10. Banyak yang menantikan konfirmasi Syifa Hadju bahwa dirinya memang tengah menjalin hubungan spesial dengan anak kedua Maia Estianty tersebut. Itulah potret adu gaya Syifa Hadju, Alyssa Daguise dan Tissa Biani di resepsi pernikahan Aaliyah Massaid. Kecantikan siapa paling menonjol? Kontributor : Chusnul Chotimah","Resepsi pernikahan Aaliyah Massaid dan Thariq Halilintar pada Jumat 26 Juli 2024 malam dihadiri oleh sederet artis ternama. Tiga artis cantik tersebut bisa dibilang merupakan calon mantu Maia Estianty, meski Syifa Hadju belum terang-terangan mengaku sedang memiliki hubungan spesial dengan El Rumi. Sebagaimana diketahui, Alyssa Daguise kembali menjalin asmara dengan Al Ghazali. Sedangkan Dul Jaelani mungkin mendahului kakak-kakaknya naik ke pelaminan bersama Tissa Biani. Hadir di resepsi Aaliyah Massaid dan Thariq Halilintar, kebanyakan warganet menaruh perhatian lebih pada tiga artis cantik tersebut. Apalagi mereka terlihat berbagi momen kebersamaan. Lantas seperti apa sih penampilan cantik Syifa Hadju, Alyssa Daguise dan Tissa Biani di resepsi pernikahan Aaliyah Massaid? Jadi sosok paling dicari sepanjang acara, penampilan Syifa Hadju juga tak kalah memukau dari Tissa Biani dan Alyssa Daguise. Diduga datang sebagai pasangan El Rumi, mantan kekasih Rizky Nazar itu memakai dress abu-abu dengan tali tipis. Meski belum terang-terangan mengaku pacaran, Syifa Hadju selalu terlihat bersama dengan El Rumi di sepanjang acara resepsi."
10 Momen Fadly Faisal di Resepsi Pernikahan Thariq Halilintar dan Aaliyah Massaid,Entertainment,2024-07-27,Ferry Noviandi,https://www.suara.com/entertainment/2024/07/27/213000/10-momen-fadly-faisal-di-resepsi-pernikahan-thariq-halilintar-dan-aaliyah-massaid,"Kehadiran Fadly Faisal di resepsi pernikahan Thariq Halilintar dan Aaliyah Massaid yang dilangsungkan pada Jumat 26 Juli 2024 malam menarik cukup banyak perhatian. Bagaimana tidak, Fadly nyaris menjadi kakak ipar Thariq, mengingat anak keempat dari keluarga Gen Halilintar tersebut sempat berpacaran dengan Fujianti Utami alias Fuji. Resepsi pernikahan Thariq Halilintar dan Aaliyah Massaid digelar di Hotel Raffles, Jakarta Selatan. Acara tersebut dihadiri oleh banyak artis populer, termasuk Fadly Faisal. Meski hubungan asmara Thariq Halilintar dan adiknya sudah berakhir, Fadly jelas masih berhubungan baik dengan lelaki kelahiran 1999 tersebut. Bisa dilihat dari interaksi mereka di atas pelaminan.Sukses jadi pusat perhatian, berikut ini deretan momen Fadly Faisal di resepsi pernikahan Thariq Halilintar dan Aaliyah Massaid. 1. Kondangan ke resepsi nikah Thariq dan Aaliyah, Fadly Faisal mengaku tak menggandeng pasangan. 2. Meski sendirian, kakak Fujianti Utami tersebut tampak menikmati hari bahagia kedua mempelai bersama Keanu Agl. 3. Inilah momen ketika Fadly Faisal menunggu giliran untuk mengucapkan selamat pada Thariq dan Aaliyah di pelaminan. 4. Tampak Thariq Halilintar tak sabar menyambut lelaki yang bisa dibilang hampir menjadi kakak iparnya tersebut.5. Bikin adem, Fadly dan Thariq berbagi pelukan kebahagiaan sambil sesekali melompat saking girangnya. 6. Bintang film Sri Asih tersebut juga mengucapkan selamat pada Aaliyah Massaid sembari berpelukan hangat. 7. Sebelum turun dari pelaminan, Fadly Faisal lebih dulu mengambil potret selfie bersama kedua mempelai. 8. Momen kebersamaan kakak Fuji dengan Thariq dan Aaliyah tentu saja mengundang beragam komentar dari warganet. 9. Banyak yang mengaku kagum pada Fadly karena masih berhubungan baik dengan mantan kekasih sang adik, bahkan hadir ke pernikahannya. 10. Tidak sedikit yang berharap para penggemar Fuji dan Aaliyah berhenti saling menyerang idola satu sama lain. Itu dia momen Fadly Faisal di resepsi pernikahan Thariq Halilintar dan Aaliyah Massaid. Bagaimana pendapat kalian? Kontributor : Chusnul Chotimah","Kehadiran Fadly Faisal di resepsi pernikahan Thariq Halilintar dan Aaliyah Massaid yang dilangsungkan pada Jumat 26 Juli 2024 malam menarik cukup banyak perhatian. Bagaimana tidak, Fadly nyaris menjadi kakak ipar Thariq, mengingat anak keempat dari keluarga Gen Halilintar tersebut sempat berpacaran dengan Fujianti Utami alias Fuji. Acara tersebut dihadiri oleh banyak artis populer, termasuk Fadly Faisal. Bisa dilihat dari interaksi mereka di atas pelaminan. Sukses jadi pusat perhatian, berikut ini deretan momen Fadly Faisal di resepsi pernikahan Thariq Halilintar dan Aaliyah Massaid. Inilah momen ketika Fadly Faisal menunggu giliran untuk mengucapkan selamat pada Thariq dan Aaliyah di pelaminan. Tampak Thariq Halilintar tak sabar menyambut lelaki yang bisa dibilang hampir menjadi kakak iparnya tersebut.5. Sebelum turun dari pelaminan, Fadly Faisal lebih dulu mengambil potret selfie bersama kedua mempelai. Tidak sedikit yang berharap para penggemar Fuji dan Aaliyah berhenti saling menyerang idola satu sama lain."
"Hempas Masalah dengan Leon Dozan, Rinoa Aurora Debut di Film Lokananta soal Cinta Beda Agama",Entertainment,2024-07-27,Ferry Noviandi,https://www.suara.com/entertainment/2024/07/27/210000/hempas-masalah-dengan-leon-dozan-rinoa-aurora-debut-di-film-lokananta-soal-cinta-beda-agama,"Rinoa Aurora mencoba melupakan masa lalu dengan mantan kekasihnya, Leon Dozan. Hampir setahun tak terdengar kabar, ia comeback dengan sebuah karya. Rinoa Aurora tampil dalam film Lokananta. Ini menjadi debut akting perempuan kelahiran Sulawesi Utara tersebut di layar lebar. ""Casting dan syuting film ini sebenarnya sudah dua tahun yang lalu. Jadi, jauh sebelum aku dan masa lalu sama orang itu,"" kata Rinoa Aurora kepada ditemui di kawasan Kuningan, Jakarta Selatan pada Sabtu 27 Juli 2024. Rinoa melalui proses casting bersama ratusan orang. Sampai akhirnya, mahasiswi jurusan hukum tersebut terpilih menjadi salah satu pemain.Rinoa Aurora memang tidak tampil sebagai pemeran utama. Ia menjadi Channel, second lead dalam film produksi Phicos Production ini. ""Aku dapat info casting, ya sudah aku mau,"" kata Rinoa Aurora. ""Ini kan awal mula banget aku casting, jadi masih kagok, banyak latihan karena belum tau apa-apa,"" imbuhnya. Meski begitu, Rinoa Aurora mau banyak belajar. Ia juga bertanya kepada orang-orang yang sudah berkecimpung di dunia film. ""Kalau kita niat, kemauan, ada jalan. Jadi aku banyak latihan, bergaul sama teman-teman yang sudah sering syuting, diajarin juga berakting,"" ucapnya. Seperti yang sudah disebutkan di atas, Rinoa Aurora akan berperan sebagai Channel. Ia menjadi pacar dari lelaki bernama Loka (Brian Andrew).Cinta mereka memang berada dalam satu keyakinan agama. Tapi kemudian, Loka bertemu dengan Ananta (Fierda Azalia) yang merupakan seorang muslimah. Di sinilah kemudian cinta segitiga antar beda agama tersebut terjadi. Selain mengusung drama percintaan, film Lokananta juga menawarkan keindahan alam di Sulawesi, khususnya Likupang. Lalu, seperti apa kisah selengkapnya? Nantikan film Lokananta yang tayang di bioskop mulai 8 Agustus 2024.","Rinoa Aurora mencoba melupakan masa lalu dengan mantan kekasihnya, Leon Dozan. Hampir setahun tak terdengar kabar, ia comeback dengan sebuah karya. Jadi, jauh sebelum aku dan masa lalu sama orang itu,"" kata Rinoa Aurora kepada ditemui di kawasan Kuningan, Jakarta Selatan pada Sabtu 27 Juli 2024. Rinoa melalui proses casting bersama ratusan orang. Sampai akhirnya, mahasiswi jurusan hukum tersebut terpilih menjadi salah satu pemain. Ini kan awal mula banget aku casting, jadi masih kagok, banyak latihan karena belum tau apa-apa,"" imbuhnya. Ia juga bertanya kepada orang-orang yang sudah berkecimpung di dunia film. "" Seperti yang sudah disebutkan di atas, Rinoa Aurora akan berperan sebagai Channel. Tapi kemudian, Loka bertemu dengan Ananta (Fierda Azalia) yang merupakan seorang muslimah. Di sinilah kemudian cinta segitiga antar beda agama tersebut terjadi. Nantikan film Lokananta yang tayang di bioskop mulai 8 Agustus 2024."
Marshel Widianto Nyalon di Pilkada Tangsel Jadi Bahan Lawakan Para Komika,Entertainment,2024-07-27,Ferry Noviandi,https://www.suara.com/entertainment/2024/07/27/204000/marshel-widianto-nyalon-di-pilkada-tangsel-jadi-bahan-lawakan-para-komika,"Komika Indra Frimawan ikut mengomentari keputusan Marshel Widianto maju di Pilkada Tangsel sebagai calon wakil wali kota. Lantaran tidak tinggal di Tangsel, Indra merasa tidak perlu memusingkan hal itu. ""Gue kan enggak tinggal di Tangsel ya, jadi apa pun yang terjadi di sana sebenernya enggak terlalu berefek gimana banget sama gue,"" ujar Indra Frimawan, ditemui di kawasan Kuningan, Jakarta, Sabtu 27 Juli 2024. Indra Frimawan juga merasa tidak berhak melarang Marshel Widianto untuk melakukan hal-hal yang membuatnya bahagia. ""Ya itu urusan dia aja sih. Gue sebagai teman kayaknya enggak berhak mengintervensi keputusan dia,"" kata Indra Frimawan.""Jadi, apa pun yang dia pikir bakal baik buat dia, lakuin aja. Gue sebagai teman juga cuma bisa, lakuin aja apa yang bikin lo bahagia,"" imbuh Indra. Di komunitas stand up comedy sekalipun, Indra Frimawan menyebut teman-teman Marshel Widianto juga tidak terlalu mempermasalahkan langkah politiknya. Hanya saja, banyak dari mereka yang menjadikan hal itu sebagai materi lawakan di atas panggung. ""Teman-teman stand up itu udah terbiasa melihat sesuatu dengan kaca mata komedi. Jadi, ya teman-teman melihat itu jadi kayak komedi aja. Malah jadi bahan materi anak-anak,"" ucap komika 33 tahun ini. Sejauh ini, aksi para komika membuat lelucon terhadap Marshel Widianto belum menimbulkan masalah. Indra Frimawan pun berharap tidak ada yang sampai terbawa perasaan gara-gara hal itu. ""Marshel kayaknya juga enggak akan sakit hati sih. Kan sama teman-teman sendiri,"" tutur Indra Frimawan.Sebagaimana diketahui, Marshel Widianto diusung Partai Gerindra untuk meramaikan Pilkada Tangsel sebagai calon wakil wali kota. Ia dipasangkan dengan Ahmad Riza Patria sebagai calon wali kota. Marshel Widianto sendiri sebelumnya sudah menjawab keraguan publik atas pencalonan dirinya sebagai wakil wali kota di Pilkada Tangsel. Ia mengklaim punya pengalaman berpolitik yang cukup untuk jadi calon kepala daerah.","Komika Indra Frimawan ikut mengomentari keputusan Marshel Widianto maju di Pilkada Tangsel sebagai calon wakil wali kota. Lantaran tidak tinggal di Tangsel, Indra merasa tidak perlu memusingkan hal itu. "" Gue sebagai teman kayaknya enggak berhak mengintervensi keputusan dia,"" kata Indra Frimawan. Gue sebagai teman juga cuma bisa, lakuin aja apa yang bikin lo bahagia,"" imbuh Indra. Hanya saja, banyak dari mereka yang menjadikan hal itu sebagai materi lawakan di atas panggung. "" Teman-teman stand up itu udah terbiasa melihat sesuatu dengan kaca mata komedi. Malah jadi bahan materi anak-anak,"" ucap komika 33 tahun ini. Marshel kayaknya juga enggak akan sakit hati sih. Sebagaimana diketahui, Marshel Widianto diusung Partai Gerindra untuk meramaikan Pilkada Tangsel sebagai calon wakil wali kota. Ia mengklaim punya pengalaman berpolitik yang cukup untuk jadi calon kepala daerah."
"Tak Butuh Pelangkah saat Thariq Halilintar Nikah Duluan, Sohwa Halilintar: Jodoh di Tangan Allah",Entertainment,2024-07-27,Ferry Noviandi,https://www.suara.com/entertainment/2024/07/27/202000/tak-butuh-pelangkah-saat-thariq-halilintar-nikah-duluan-sohwa-halilintar-jodoh-di-tangan-allah,"Thariq Halilintar juga melangkahi kakaknya, Sohwa dan Sajidah Halilintar saat meminang Aaliyah Massaid. Sama seperti Aaliyah, Thariq pun tidak memberi pelangkah nikah ke Sohwa atau Sajidah. ""Setahu aku sih enggak kasih apa-apa ya,"" kata Atta Halilintar saat memberi keterangan pers usai akad nikah Thariq-Aaliyah di Raffles Hotel, Kuningan, Jakarta Selatan, Jumat 26 Juli 2024. Dari keluarga Thariq Halilintar, mereka merasa tidak ada yang salah kalau lelaki 25 tahun tidak memberi pelangkah nikah ke kakak-kakaknya. ""Aku pribadi sih dalam agama kan boleh aja ya, kalau adik nikah duluan. Selama ada jodohnya, ya menikah aja gitu, kenapa enggak dipercepat,"" ujar Atta Halilintar.Ditambah lagi, kedua kakak Thariq Halilintar juga tidak pernah meminta pelangkah nikah. Salah satu kakak Thariq, Sohwa, bahkan terang-terangan menyatakan sama sekali tidak keberatan kalau adik-adiknya lebih dulu dipertemukan dengan jodoh masing-masing. ""Justru kata-kata yang paling menyentuh di aku dari Kak Sohwa, kakakku yang kedua. Dia ngomongnya jodoh itu bukan di tangan aku, tapi di tangan Allah,"" imbuh Thariq Halilintar usai akad nikah. Sohwa Halilintar juga mendukung penuh niat baik Thariq Halilintar untuk segera meminang Aaliyah Massaid kalau merasa sudah cocok. ""Kalau kamu dapat duluan, ya harus disegerakan,"" ucap Thariq Halilintar, menirukan pesan Sohwa untuknya. Sebagaimana diketahui, Thariq Halilintar meminang Aaliyah Massaid dengan mas kawin uang tunai Rp26.072.024 dalam prosesi akad nikah kemarin. Mahar itu menggambarkan tanggal pernikahan mereka berdua.Akad nikah Thariq Halilintar dan Aaliyah Massaid juga melibatkan dua tokoh penting bangsa sebagai saksi. Mereka adalah Presiden Republik Indonesia, Joko Widodo serta Ketua MPR RI, Bambang Soesatyo.","Thariq Halilintar juga melangkahi kakaknya, Sohwa dan Sajidah Halilintar saat meminang Aaliyah Massaid. Sama seperti Aaliyah, Thariq pun tidak memberi pelangkah nikah ke Sohwa atau Sajidah. "" Setahu aku sih enggak kasih apa-apa ya,"" kata Atta Halilintar saat memberi keterangan pers usai akad nikah Thariq-Aaliyah di Raffles Hotel, Kuningan, Jakarta Selatan, Jumat 26 Juli 2024. Dari keluarga Thariq Halilintar, mereka merasa tidak ada yang salah kalau lelaki 25 tahun tidak memberi pelangkah nikah ke kakak-kakaknya. "" Aku pribadi sih dalam agama kan boleh aja ya, kalau adik nikah duluan. Sebagaimana diketahui, Thariq Halilintar meminang Aaliyah Massaid dengan mas kawin uang tunai Rp26.072.024 dalam prosesi akad nikah kemarin. Mahar itu menggambarkan tanggal pernikahan mereka berdua. Mereka adalah Presiden Republik Indonesia, Joko Widodo serta Ketua MPR RI, Bambang Soesatyo."
"Marissya Icha Diundang Thariq Halilintar ke Pernikahan, Nama Fuji Diungkit",Entertainment,2024-07-27,Ferry Noviandi,https://www.suara.com/entertainment/2024/07/27/195000/marissya-icha-diundang-thariq-halilintar-ke-pernikahan-nama-fuji-diungkit,"Satu per satu tamu undangan di pernikahan Aaliyah Massaid dan Thariq Halilintar terkuak ke publik. Terkini, ada Marissya Icha. Kehadiran Marissya Icha ini dibagikan oleh sang pengusaha di Instagram. Melalui unggahan tersebut, Icha menyampaikan ucapan selamat. ""Happy Wedding @thariqhalilintar & @aaliyah.massaid,"" tulis Marissya Icha, Jumat 26 Juli 2024. Melalui unggahan yang sama, Marissya Icha juga menyematkan doa untuk Thariq dan Aaliyah. Sahabat dekat Thariq ini berharap pernikahan adik Atta dengan Aliyah itu sakinah, mawaddah, dan warahmah.""Samawa, aamin,"" ujar Marissya Icha. Kehadiran dari Marissya Icha ini semakin ramai diperbincangkan dalam unggahan ulang di akun Instagram @lambe_danu. Nama mantan Thariq, Fuji pun ikut disenggol. Ada yang membahas soal Fuji yang tidak hadir padahal Fadly Faisal turut memeriahkan pernikahan Thariq. Keterkaitan hubungan Fuji dengan Marissya Icha yang diduga tidak baik pun diduga menjadi alasannya. ""Fuji pasti minta saran Mamah Bapak abang-abangnya buat hadir apa enggak, menurutku pilihan yang tepat kok buat enggak hadir,"" komentar seorang warganet. Namun ada pula yang memberikan pembelaan untuk Marissya Icha. Pasalnya Icha dan Thariq tetap berhubungan baik.""Wajar diundang, kan dulu pernah deket main bareng,"" kata warganet lain. ""Enggak semua orang bermusuhan sama orang, terus kita sebagai temannya ikut musuhin dia juga,"" imbuh yang lain. Seperti diketahui, Marissya Icha yang sebelumnya memiliki hubungan baik dengan keluarga Haji Faisal, kini berbalik bak musuh. Entah apa penyebabnya, Icha merasa sudah tak lagi dipandang oleh keluarga Haji Faisal.","Satu per satu tamu undangan di pernikahan Aaliyah Massaid dan Thariq Halilintar terkuak ke publik. Kehadiran Marissya Icha ini dibagikan oleh sang pengusaha di Instagram. Melalui unggahan tersebut, Icha menyampaikan ucapan selamat. "" Melalui unggahan yang sama, Marissya Icha juga menyematkan doa untuk Thariq dan Aaliyah. Nama mantan Thariq, Fuji pun ikut disenggol. Fuji pasti minta saran Mamah Bapak abang-abangnya buat hadir apa enggak, menurutku pilihan yang tepat kok buat enggak hadir,"" komentar seorang warganet. Pasalnya Icha dan Thariq tetap berhubungan baik. Enggak semua orang bermusuhan sama orang, terus kita sebagai temannya ikut musuhin dia juga,"" imbuh yang lain. Seperti diketahui, Marissya Icha yang sebelumnya memiliki hubungan baik dengan keluarga Haji Faisal, kini berbalik bak musuh."
Bongkar Rahasia! Anak-Anak Virgoun Akhirnya Tahu Sang Ayah Direhab Karena Narkoba,Entertainment,2024-07-27,Ferry Noviandi,https://www.suara.com/entertainment/2024/07/27/175638/bongkar-rahasia-anak-anak-virgoun-akhirnya-tahu-sang-ayah-direhab-karena-narkoba,"Kasus penyalahgunaan narkoba yang menjerat Virgoun disebut sang ibu, Eva Manurung tidak diketahui Starla dan adik-adiknya. Kepada mereka, Eva cuma berkata bahwa Virgoun sedang berada di suatu tempat untuk belajar ilmu agama. ""Saya kan sering video call sama cucu saya. Saya bilang, 'Daddy lagi sekolah agama. Kemarin-kemarin kan Daddy jarang salat, jadi harus belajar salat lagi',"" ujar Eva Manurung beberapa waktu lalu. Keputusan menutupi aib Virgoun dari anak-anak pun disebut Eva Manurung mendapat dukungan penuh dari Inara Rusli. ""Ina juga cukup bijak lah dalam menyikapi hal itu,"" kata Eva Manurung. Namun hari ini, Sabtu 27 Juli 2024, Inara Rusli membawa cerita berbeda. Ia menyebut anak-anak sudah tahu kalau Virgoun sedang menjalani rehabilitasi narkoba.""Starla sudah tahu bapaknya di rumah sakit,"" ucap Inara Rusli di kawasan Kuningan, Jakarta Selatan. Inara Rusli juga menceritakan bahwa Virgoun diizinkan keluar dari tempat rehabilitasi untuk menemui anak-anak. ""Virgoun sudah ketemu anaknya, tapi tidak di rumah sakit. Nanti mau ketemu lagi di Bintaro,” imbuh Inara Rusli. Hanya saja, Inara Rusli tidak bisa memastikan apakah saat ini Virgoun masih menjalani rehabilitasi narkoba atau sudah diperkenankan pulang. ""Kayaknya sih dia masih bolak-balik, kayaknya ya,"" tutur Inara Rusli. Virgoun ditangkap di sebuah kos-kosan di kawasan Ampera, Jakarta pada Kamis dini hari 20 Juni 2024. Ia diamankan penyidik Polres Metro Jakarta Barat bersama perempuan berinisial PA lengkap dengan barang bukti narkotika jenis sabu.Virgoun dan PA tidak bisa mengelak saat ditangkap. Selain ditemukan barang bukti, keduanya juga mengaku ke polisi bahwa baru selesai mengonsumsi sabu. Ada juga kru band berinisial BH yang ikut diamankan setelah penangkapan Virgoun dan PA. Ia adalah orang yang dimintai tolong oleh Virgoun untuk membeli sabu. Atas perbuatan tersebut, ketiganya dikenakan Pasal 127 ayat (1) huruf a UU Narkotika dengan ancaman pidana penjara sampai 4 tahun. Namun di tengah proses hukum, Virgoun diberi kesempatan untuk menjalani rehabilitasi medis.","Kasus penyalahgunaan narkoba yang menjerat Virgoun disebut sang ibu, Eva Manurung tidak diketahui Starla dan adik-adiknya. Kepada mereka, Eva cuma berkata bahwa Virgoun sedang berada di suatu tempat untuk belajar ilmu agama. "" Saya kan sering video call sama cucu saya. Kemarin-kemarin kan Daddy jarang salat, jadi harus belajar salat lagi',"" ujar Eva Manurung beberapa waktu lalu. Keputusan menutupi aib Virgoun dari anak-anak pun disebut Eva Manurung mendapat dukungan penuh dari Inara Rusli. "" Virgoun sudah ketemu anaknya, tapi tidak di rumah sakit. Nanti mau ketemu lagi di Bintaro,” imbuh Inara Rusli. Virgoun ditangkap di sebuah kos-kosan di kawasan Ampera, Jakarta pada Kamis dini hari 20 Juni 2024. Ia diamankan penyidik Polres Metro Jakarta Barat bersama perempuan berinisial PA lengkap dengan barang bukti narkotika jenis sabu. Atas perbuatan tersebut, ketiganya dikenakan Pasal 127 ayat (1) huruf a UU Narkotika dengan ancaman pidana penjara sampai 4 tahun. Namun di tengah proses hukum, Virgoun diberi kesempatan untuk menjalani rehabilitasi medis."
"Aaliyah Massaid Belum Kemasi Barang di Rumah, Lupa Kalau Bakal Tinggal Bareng Thariq Halilintar",Entertainment,2024-07-27,Ferry Noviandi,https://www.suara.com/entertainment/2024/07/27/172500/aaliyah-massaid-belum-kemasi-barang-di-rumah-lupa-kalau-bakal-tinggal-bareng-thariq-halilintar,"Thariq Halilintar dan Aaliyah Massaid sudah merencanakan perjalanan bulan madu selepas menikah. Ada satu negara yang sudah ditetapkan sebagai destinasi. ""Destinasi yang aku pilih itu negara yang pengin dia kunjungin juga. Ada beberapa kota di sana yang pengin didatengin,"" kata Aaliyah Massaid saat memberi keterangan pers usai akad nikah di Raffles Hotel, Jakarta Selatan, Jumat 26 Juli 2024. Namun, Thariq Halilintar dan Aaliyah Massaid belum mau berbicara banyak soal rencana bulan madu mereka. Pasalnya, Aaliyah masih mau berkemas-kemas untuk mengurus pemindahan barang ke rumah Thariq. ""Aku belum packing buat pindahan,"" ujar Aaliyah Massaid.Aaliyah Massaid terang-terangan mengaku lupa kalau setelah menikah bakal ikut tinggal di rumah Thariq Halilintar. Sampai menjelang hari pernikahan, Aaliyah belum mulai mencicil untuk mengemas barang-barang yang akan dibawa ke rumah Thariq. ""Lucu banget. Dia tuh sempet tanya, 'sayang, kamu sudah packing belum?’ Aku jawab, 'memang mau ke mana?' Terus, 'loh, kan mau pindah rumah'. Aku jawab lagi, 'oh iya, lupa',"" ucap Aaliyah Massaid sambil tertawa. Thariq Halilintar sendiri awalnya kaget saat mendengar pengakuan Aaliyah Massaid soal belum mengemas barang-barangnya. Namun pada akhirnya, Thariq memilih bersikap bijak dengan meminta Aaliyah untuk tidak buru-buru mengurus keperluan pindah rumah. ""Enggak apa-apa, kan pelan-pelan. Rumah juga lagi dikerjain sama interior, buat kamar pengantin,"" imbuh Thariq Halilintar. Sebagaimana diketahui, Thariq Halilintar meminang Aaliyah Massaid dengan mas kawin uang tunai Rp26.072.024. Mahar itu menggambarkan tanggal pernikahan mereka berdua.Akad nikah Thariq Halilintar dan Aaliyah Massaid juga melibatkan dua tokoh penting bangsa sebagai saksi. Mereka adalah Presiden Republik Indonesia, Joko Widodo serta Ketua MPR RI, Bambang Soesatyo.","Thariq Halilintar dan Aaliyah Massaid sudah merencanakan perjalanan bulan madu selepas menikah. Ada satu negara yang sudah ditetapkan sebagai destinasi. "" Ada beberapa kota di sana yang pengin didatengin,"" kata Aaliyah Massaid saat memberi keterangan pers usai akad nikah di Raffles Hotel, Jakarta Selatan, Jumat 26 Juli 2024. Pasalnya, Aaliyah masih mau berkemas-kemas untuk mengurus pemindahan barang ke rumah Thariq. "" Dia tuh sempet tanya, 'sayang, kamu sudah packing belum?’ Thariq Halilintar sendiri awalnya kaget saat mendengar pengakuan Aaliyah Massaid soal belum mengemas barang-barangnya. Sebagaimana diketahui, Thariq Halilintar meminang Aaliyah Massaid dengan mas kawin uang tunai Rp26.072.024. Mahar itu menggambarkan tanggal pernikahan mereka berdua. Mereka adalah Presiden Republik Indonesia, Joko Widodo serta Ketua MPR RI, Bambang Soesatyo."
