title,category,publish_date,author,article_url,content,summary
"Chemistry Ari Wibowo dan Wulan Guritno di Lokasi Syuting Bikin Heboh, Berharap Jadian?",Entertainment,2024-09-29,Sumarni,https://www.suara.com/entertainment/2024/09/29/090000/chemistry-ari-wibowo-dan-wulan-guritno-di-lokasi-syuting-bikin-heboh-berharap-jadian,"Ari Wibowo baru-baru ini membagikan momen spesial di Instagram. Dia memperlihatkan bersama Wulan Guritno. Keduanya terlihat tengah bekerja sama dalam proyek web series terbaru, yang langsung mencuri perhatian warganet. Dalam foto yang diunggah, Ari Wibowo dan Wulan Guritno tampak begitu antusias. Mereka terlihat kompak, dengan senyum yang menunjukkan kebahagiaan di hari pertama syuting. ""Shoot Day 1 buat webseries baru,"" tulis Ari Wibowo dalam keterangan foto tersebut pada Sabtu 28 September 2024.Sayangnya, mantan suami Inge Anugrah itu masih belum mengungkapkan judul dari proyek ini. ""Judul masih tentative ya guys,"" sambungnya, membuat para penggemar penasaran. Unggahan ini mendapat sambutan hangat dari warganet. Banyak yang mengungkap kegembiraannya melihat Ari Wibowo dan Wulan Guritno beradu peran dalam satu proyek. Keharmonisan dan aura yang terpancar dari keduanya pun membuat para netizen berkomentar positif. ""Cocok banget. Ini baru pasangan cantik dan ganteng,"" tulis akun @rai***.""Wah keren banget! Btw boleh titip salam buat Mbak Wulan Guritno, cantik banget seperti filmnya Angelina Jolie,"" tulis akun @ria**** mengungkapkan kekagumannya pada sosok Wulan. Tak sedikit juga warganet yang mencoba menggoda dan mendukung Ari Wibowo dan Wulan Guritno untuk benar-benar menjalin hubungan serius. ""Cocok, udah serius aja!"" pinta akun @nin****. ""Kalau jadian cocok, Mas,"" sambung akun @ign**** dengan nada menggoda. Ada juga yang bahkan memberi ide untuk judul series mereka. ""Judulnya Berlabuh di Hatimu, gimana Bang @ariwibowo_official?"" tulis akun @thed*** mencoba menyarankan.","Ari Wibowo baru-baru ini membagikan momen spesial di Instagram. Dia memperlihatkan bersama Wulan Guritno. Keduanya terlihat tengah bekerja sama dalam proyek web series terbaru, yang langsung mencuri perhatian warganet. Shoot Day 1 buat webseries baru,"" tulis Ari Wibowo dalam keterangan foto tersebut pada Sabtu 28 September 2024.Sayangnya, mantan suami Inge Anugrah itu masih belum mengungkapkan judul dari proyek ini. "" Keharmonisan dan aura yang terpancar dari keduanya pun membuat para netizen berkomentar positif. "" Tak sedikit juga warganet yang mencoba menggoda dan mendukung Ari Wibowo dan Wulan Guritno untuk benar-benar menjalin hubungan serius. "" Kalau jadian cocok, Mas,"" sambung akun @ign**** dengan nada menggoda. Ada juga yang bahkan memberi ide untuk judul series mereka. """
"Kisah di Balik Mitha Gabung ke The Virgin, Diajak Ahmad Dhani Hingga Gemetar",Entertainment,2024-09-29,Sumarni,https://www.suara.com/entertainment/2024/09/29/083000/kisah-di-balik-mitha-gabung-ke-the-virgin-diajak-ahmad-dhani-hingga-gemetar,"Cameria Happy Pramita alias Mitha mengenang awal mula diajak Ahmad Dhani membentuk The Virgin. Kejadian yang berlangsung belasan tahun lalu. Peristiwa ini bermula di 2006, saat Mitha pernah satu projek dengan orang kepercayaan Ahmad Dhani, Wawan. ""Waktu itu mas Dhani bilang ke mas Wawan, cari gitaris cewek,"" kenang Mitha The Virgin kepada di Menteng, Jakarta Pusat pada Kamis 26 September 2024. Wawan kemudian menghubungi Mitha untuk datang ke studio Dewa 19.""Awalnya aku pikir nama studio. Bukan band Dewa 19,"" tuturnya. Masuk ke studio, Mitha melihat Ahmad Dhani. Ia masih mengingat betul apa yang dilakukan pentolan Dewa 19 ini. ""Waktu itu lagi mixing lagu Munajat Cinta. Al, El dan Dul masih kecil-kecil,"" ucapnya. Mitha kemudian diminta membawakan lagu. Di sana, ia yang gugup karena berhadapan dengan seorang Ahmad Dhani. ""Mas Dhani ngeliatin doang, terus pergi. Aku gemetar,"" kenangnya.Meski Ahmad Dhani tak bersuara, namun toh seminggu kemudian ia dihubungi untuk menjadi gitaris The Rock. Sampai akhirnya beberapa tahun kemudian, dipertemukan dengan Dara, jebolan ajang pencarian bakat Mamamia. Setelahnya, Mitha dan Dara debut sebagai duo The Virgin pada 2009.","Cameria Happy Pramita alias Mitha mengenang awal mula diajak Ahmad Dhani membentuk The Virgin. Kejadian yang berlangsung belasan tahun lalu. Peristiwa ini bermula di 2006, saat Mitha pernah satu projek dengan orang kepercayaan Ahmad Dhani, Wawan. "" Masuk ke studio, Mitha melihat Ahmad Dhani. Waktu itu lagi mixing lagu Munajat Cinta. Al, El dan Dul masih kecil-kecil,"" ucapnya. Setelahnya, Mitha dan Dara debut sebagai duo The Virgin pada 2009."
"Kebelet Punya Menantu Lagi, Ibu Ayu Ting Ting Tanya Boy William: Kapan Nikahin Ayu?",Entertainment,2024-09-29,Sumarni,https://www.suara.com/entertainment/2024/09/29/074500/kebelet-punya-menantu-lagi-ibu-ayu-ting-ting-tanya-boy-william-kapan-nikahin-ayu,"Ayu Ting Ting kembali menunjukkan kedekatannya dengan Boy William. Kedua artis itu belum lama ini terlihat sudah mulai ngonten bareng. Setelah gagal menikah dengan Muhammad Fardhana atau Lettu Fardhana, Ayu Ting Ting akhirnya memberanikan diri untuk kembali menghubungi laki-laki yang sempat diisukan dekat dengannya itu. Penyanyi dangdut asal Depok itu juga sempat malu saat menghubungi Boy untuk pertama kalinya usai berita kandasnya hubungan dengan Lettu Fardhana viral di pemberitaan. Namun akhirnya Ayu memberanikan diri menghubungi Boy William untuk meminta maaf karena baru memberitahu dirinya saat hubungannya dengan Lettu Fardhana telah berakhir.Dalam program Nebeng Boy, Ayu Ting Ting dan Boy William kembali mengenang persahabatannya itu. Rupanya kedekatan Ayu Ting Ting dan Boy William itu ditanggapi positif oleh Umi Kalsum, Ibu Ayu Ting Ting. Saat sedang mengobrol dengan mantan kekasih Karen Vendela itu, Ayu sejenak terlihat menelepon sang ibu untuk menyuruhnya menjemput Bilqis di sekolah. Saat menelepon ibunya, pelantun lagu Alamat Palsu itu menyuruh Boy untuk ngobrol dengan ibunya. Boy yang excited langsung menanyakan kabar ibu Ayu Ting Ting.“Bu sehat ya bu?” tanya Boy William dikutip pada Sabtu 28 September 2024. Ibu Ayu Ting Ting yang mendengar suara mantan VJ itu terdengar langsung bersemangat. “Alhamdulillah, mana?” kata Umi Kalsum. Boy yang kebingungan dengan pertanyaan ibu Ayu Ting Ting itu menanyakan kembali pertanyaan tersebut. “Mana apa bu?” tanya pria yang mengawali karir sebagai model itu. “Kapan nikahin Ayu?” tanya istri Abdul Rozak tersebut. Ayu yang mendengar pertanyaan sang ibu kepada Boy William langsung tersipu malu dan buru-buru mengalihkan pertanyaan ibunya tersebut. Tak lama berselang, mantan istri Enji Baskoro yang merasa kepo itu lantas bertanya perihal jodoh kepada Boy William. “Kamu enggak kepikiran buat nyari jodoh?” tanya Ayu Ting Ting. Pria keturunan Tionghoa itu mengatakan jika saat ini dirinya belum kepikiran soal jodoh. Menurutnya, dia ingin menikah ketika usianya telah matang. “Ideal bagusnya 35 tahun, cowok-cowok tuh 35 atau mungkin 36 lah,” kata pemilik nama asli William Hartanto itu. Kontributor : Rizka Utami","Ayu Ting Ting kembali menunjukkan kedekatannya dengan Boy William. Kedua artis itu belum lama ini terlihat sudah mulai ngonten bareng. Setelah gagal menikah dengan Muhammad Fardhana atau Lettu Fardhana, Ayu Ting Ting akhirnya memberanikan diri untuk kembali menghubungi laki-laki yang sempat diisukan dekat dengannya itu. Rupanya kedekatan Ayu Ting Ting dan Boy William itu ditanggapi positif oleh Umi Kalsum, Ibu Ayu Ting Ting. Saat menelepon ibunya, pelantun lagu Alamat Palsu itu menyuruh Boy untuk ngobrol dengan ibunya. Boy yang kebingungan dengan pertanyaan ibu Ayu Ting Ting itu menanyakan kembali pertanyaan tersebut. “ tanya pria yang mengawali karir sebagai model itu. “ Tak lama berselang, mantan istri Enji Baskoro yang merasa kepo itu lantas bertanya perihal jodoh kepada Boy William. “ Menurutnya, dia ingin menikah ketika usianya telah matang. “ Ideal bagusnya 35 tahun, cowok-cowok tuh 35 atau mungkin 36 lah,” kata pemilik nama asli William Hartanto itu."
"Selain di Indonesia, Film Kutukan Calon Arang Juga Bakal Tayang di Luar Negeri",Entertainment,2024-09-29,Sumarni,https://www.suara.com/entertainment/2024/09/29/063000/selain-di-indonesia-film-kutukan-calon-arang-juga-bakal-tayang-di-luar-negeri,"Film Kutukan Calon Arang bersiap tayang di bioskop pada 3 Oktober 2024. Sebelum itu, Lingkar Pictures selaku pihak produksi mengadakan special screening pada Sabtu 28 September 2024. Sang sutradara, Girry Pratama membeberkan alasannya mengadakan penayangan lebih awal. ""Saya berharap lewat special screening ini bisa mendapatkan respons positif dari masyarakat, terutama pecinta horor,"" kata Girry Pratama kepada awak media. ""Terlebih saat penayangan hari perdana di seluruh bioskop Tanah Air tanggal 3 Oktober nanti, kami bisa mendapatkan hasil yang terbaik,” sambungnya lagi.Girry Pratama mengaku mengundang banyak public figure di momen kali ini. ""Dalam special screening malam ini, kami mengundang para public figure untuk dapat menyaksikan lebih dahulu. Semoga bisa mendapat respon positif dari mereka,"" terangnya. ""Kehadiran hantu Calon Arang di tengah-tengah kita juga diharapkan menarik perhatian para undangan, menciptakan pengalaman unik yang tak bisa dilewatkan,"" tambahnya. Di samping itu, Justin Adiwinata turut memberikan komentarnya. Sebagai salah satu pemain di film tersebut, dia berkeinginan Kutukan Calon Arang bisa diterima oleh semua kalangan. ""Saya sangat senang dan berharap film ini bisa diterima dan dinikmati oleh semua penonton,"" ujar Justin Adiwinata.Seperti diketahui, Kutukan Calon Arang menjanjikan alur yang mendebarkan serta karakter yang kuat. Namun begitu, ada juga budaya Indonesia yang disisipkan. Tentunya, film ini disebut bisa memberikan pengalaman horor yang tak terlupakan. Selain Indonesia, film Kutukan Calon Arang juga akan tayang di luar negeri. Tepatnya di Malaysia, Brunei Darussalam dan Singapura pada 26 Oktober mendatang.","Film Kutukan Calon Arang bersiap tayang di bioskop pada 3 Oktober 2024. Saya berharap lewat special screening ini bisa mendapatkan respons positif dari masyarakat, terutama pecinta horor,"" kata Girry Pratama kepada awak media. "" Semoga bisa mendapat respon positif dari mereka,"" terangnya. "" Di samping itu, Justin Adiwinata turut memberikan komentarnya. Seperti diketahui, Kutukan Calon Arang menjanjikan alur yang mendebarkan serta karakter yang kuat. Namun begitu, ada juga budaya Indonesia yang disisipkan. Tentunya, film ini disebut bisa memberikan pengalaman horor yang tak terlupakan. Selain Indonesia, film Kutukan Calon Arang juga akan tayang di luar negeri. Tepatnya di Malaysia, Brunei Darussalam dan Singapura pada 26 Oktober mendatang."
"Penampilan Baru Aliando Syarief Jadi Omongan, Fans Ramai-Ramai Singgung Prilly Latuconsina",Entertainment,2024-09-29,Sumarni,https://www.suara.com/entertainment/2024/09/29/060000/penampilan-baru-aliando-syarief-jadi-omongan-fans-ramai-ramai-singgung-prilly-latuconsina,"Aliando Syarief mencuri perhatian para fans mereka dengan penampilan barunya. Hal ini terlihat saat dia muncul untuk mempromosikan film terbarunya bertajuk 'Laut Tengah"". Kini badan Aliando sudah mulai kurus daripada sebelumnya. Wajahnya jadi lebih fresh dengan badan yang nyaris seperti zaman awal-awal dia terjun ke dunia entertainment. Banyak netizen yang senang karena Aliando kembali kurus sehingga tampak lebih ganteng. ""Gawat nambah lagi saingannya. Ali balik ke setelan pabrik,"" komentar netizen.""Setelan pabriknya emang udah maasya allah,"" sanjung netizen lain. ""Ganteng banget Ali kurusin lagi wah mirip artis-artis hollywood,"" pinta penggemarnya. Sementara itu, beberapa netizen malah menyinggung bahkan berani mention akun Prilly di postingan sebuah akun gosip yang menunjukkan perubahan penampilan Aliando yang baru. Banyak fans mereka berdua yang masih berharap idola mereka ini berjodoh. ""Jangan-jangan dia nih jodohnya Prilly,"" celetuk netizen.""Tag kak @prillylatuconsina96 ah, nih kak Diego udah kembali setelah merantau beberapa tahun, nggak kangenkah,"" goda netizen lain. ""Prilly,  awas lu yeee balikan,"" timpal lainnya. Ada juga yang sampai menduga jika penampilan baru Aliando ada hubungannya dengan Prilly. ""Ngikutin Prilly nggak sih jadi terharu kisah cinta mereka berasa akan timbul lagi,"" komentar netizen lain. Tambahan informasi, Aliando Syarief dan Prilly Latuconsina pernah terlibat cinta lokasi di sinetron Ganteng Ganteng Serigala. Banyak yang senang dengan pasangan ini jika benar berjodoh di dunia nyata. Namun berjalannya waktu hubungan mereka kandas dan punya jalan masing-masing. Dulu tak ada yang tahu kalau mereka benar-benar menjalin asmara, namun belakangan diakui kalau mereka dulu pernah punya hubungan spesial. Makanya kini banyak yang berharap jika Aliando dan Prilly bisa bersatu lagi dan berjodoh. Kontributor : Tinwarotul Fatonah","Aliando Syarief mencuri perhatian para fans mereka dengan penampilan barunya. Hal ini terlihat saat dia muncul untuk mempromosikan film terbarunya bertajuk 'Laut Tengah"". Kini badan Aliando sudah mulai kurus daripada sebelumnya. Wajahnya jadi lebih fresh dengan badan yang nyaris seperti zaman awal-awal dia terjun ke dunia entertainment. ""Setelan pabriknya emang udah maasya allah,"" sanjung netizen lain. "" Banyak fans mereka berdua yang masih berharap idola mereka ini berjodoh. "" Jangan-jangan dia nih jodohnya Prilly,"" celetuk netizen. Ada juga yang sampai menduga jika penampilan baru Aliando ada hubungannya dengan Prilly. "" Namun berjalannya waktu hubungan mereka kandas dan punya jalan masing-masing. Dulu tak ada yang tahu kalau mereka benar-benar menjalin asmara, namun belakangan diakui kalau mereka dulu pernah punya hubungan spesial."
Muncul Video Penampakan Belakang IKN yang Masih Gundukan Tanah: Pantes Mulyono Nggak Betah,Entertainment,2024-09-28,Sumarni,https://www.suara.com/entertainment/2024/09/28/210000/muncul-video-penampakan-belakang-ikn-yang-masih-gundukan-tanah-pantes-mulyono-nggak-betah,"Gedung Istana Garuda dan Istana Negara di Ibu Kota Nusantara (IKN) hingga kini masih dalam tahap pembangunan menjelang peresmian pada Oktober 2024 mendatang. Bersamaan dengan Kantor Kementerian Koordinator (Kemenko), dua gedung yang menjadi ikon negara itu dibangun di Kawasan Inti Pusat Pemerintah (KIPP). Di tengah kabar tersebut, beredar video yang menampakkan bagian belakang gedung Istana. Video itu diunggah ulang oleh akun X @NenkMonica pada Jumat 27 September 2024. Terlihat gundukan tanah tersebar luas di belakang gedung Istana di IKN, menandakan pembangunan yang jauh dari selesai. Terdapat pula sebuah truk pasir beroperasi di sekitarnya.Selain gundukan tanah, ada pula gedung pencakar langit yang sedang dibangun. Gedung ini masih dalam tahap pengerjaan struktur bangunan. ""Belakang Istana,"" bunyi keterangan di dalam video tersebut. Melihat kondisi IKN yang belum 100 persen rampung, padahal sudah akan diresmikan membuat pemilik akun @NenkMonica mencibir Presiden Joko Widodo atau Jokowi. ""Pantesan Mulyonno gak betah di IKN,"" sindirnya, mengacu pada pernyataan Pit Kepala Otorita IKN, Basuki Hadimuljono pada Juli 2024 lalu. Kala itu, Basuki menyampaikan bahwa Jokowi tidak bisa tidur nyenyak ketika bermalam di Istana Garuda. Namun, bukan karena belum rampungnya pembangunan, melainkan karena pendingin udara di kamarnya.""Iya (tidur Jokowi tidak nyenyak), karena AC-nya,"" tutur Basuki. Cuitan tersebut seketika menarik perhatian ratusan warganet untuk berkomentar. ""Yang bagus cuma bagian depannya aja kah? Untuk kebutuhan kamera?"" cibir seorang warganet. ""Emm, 'belum siap itu', paling gitu katanya,"" imbuh warganet lain. ""Hutan Kaltim dirusak, hanya untuk sesuatu yang gak jelas begini,"" ujar warganet lainnya.","Gedung Istana Garuda dan Istana Negara di Ibu Kota Nusantara (IKN) hingga kini masih dalam tahap pembangunan menjelang peresmian pada Oktober 2024 mendatang. Terlihat gundukan tanah tersebar luas di belakang gedung Istana di IKN, menandakan pembangunan yang jauh dari selesai. Terdapat pula sebuah truk pasir beroperasi di sekitarnya. Gedung ini masih dalam tahap pengerjaan struktur bangunan. "" Melihat kondisi IKN yang belum 100 persen rampung, padahal sudah akan diresmikan membuat pemilik akun @NenkMonica mencibir Presiden Joko Widodo atau Jokowi. "" Kala itu, Basuki menyampaikan bahwa Jokowi tidak bisa tidur nyenyak ketika bermalam di Istana Garuda. Namun, bukan karena belum rampungnya pembangunan, melainkan karena pendingin udara di kamarnya. Cuitan tersebut seketika menarik perhatian ratusan warganet untuk berkomentar. "" Hutan Kaltim dirusak, hanya untuk sesuatu yang gak jelas begini,"" ujar warganet lainnya."
Bedanya Kualitas Suara Aaliyah Maassaid dan Syifa Hadju Dikomentari: Lebih Cakep ...,Entertainment,2024-09-28,Sumarni,https://www.suara.com/entertainment/2024/09/28/202500/bedanya-kualitas-suara-aaliyah-maassaid-dan-syifa-hadju-dikomentari-lebih-cakep,"Aksi menarik ditunjukkan oleh Aaliyah Massaid bersama Syifa Hadju baru-baru ini. Kedua perempuan cantik ini tampil dengan mengenakan busana yang senada dalam acara penghargaan Infotainment Awards 2024 pada Selasa 24 September 2024 lalu. Bukan tanpa alasan, busana yang serasi tersebut adalah bagian dari penampilan duet mereka yang langsung disorot dan menjadi perbincangan. Sembari tampil di atas panggung, baik Syifa maupun Aaliyah unjuk diri dengan suara khas mereka masing-masing. Namun ternyata, persoalan suara pun turut dinilai oleh publik. Penilaian tersebut dibubuhkan oleh warganet dalam unggahan akun TikTok milik salah satu stasiun televisi.Dimulai dari kualitas suara Syifa Hadju yang dikomentari oleh warganet. Ternyata, banyak pujian yang diberikan untuk kekasih baru dari El Rumi tersebut. ""Suara Syifa Hadju, cantik merdu,"" ujar warganet. ""Ternyata suaranya Syifa bagus,"" tambah warganet yang terkejut. Namun ada pula yang menyebut jika hanya suara Syifa Hadju yang candu meski duet bersama Aaliyah Massaid. ""Suara Syifa doang yang candu,"" komentr warganet.""Tapi cakep suara Syifa di sini,"" timpal warganet. Masih dalam unggahan yang sama, kualitas suara dari istri Thariq Halilintar juga turut diperbincangkan. Apalagi mengingat Aaliyah adalah putri dari seorang penyanyi. ""Suara Aal enak banget masuk telinga,"" puji warganet. ""Suara Aal menggelegar banget,"" bunyi komentar lainnya. ""Tim Aaliyah,"" kata warganet. ""Aal suara terbaik,"" timpal warganet lainnya.","Aksi menarik ditunjukkan oleh Aaliyah Massaid bersama Syifa Hadju baru-baru ini. Kedua perempuan cantik ini tampil dengan mengenakan busana yang senada dalam acara penghargaan Infotainment Awards 2024 pada Selasa 24 September 2024 lalu. Namun ternyata, persoalan suara pun turut dinilai oleh publik. Suara Syifa Hadju, cantik merdu,"" ujar warganet. "" Namun ada pula yang menyebut jika hanya suara Syifa Hadju yang candu meski duet bersama Aaliyah Massaid. "" Suara Syifa doang yang candu,"" komentr warganet. Masih dalam unggahan yang sama, kualitas suara dari istri Thariq Halilintar juga turut diperbincangkan. Suara Aal menggelegar banget,"" bunyi komentar lainnya. "" Aal suara terbaik,"" timpal warganet lainnya."
"Andrew Andika Tak Ditangkap Sendiri, Ada 5 Lainnya Termasuk Influencer Ternama",Entertainment,2024-09-28,Sumarni,https://www.suara.com/entertainment/2024/09/28/210000/andrew-andika-tak-ditangkap-sendiri-ada-5-lainnya-termasuk-influencer-ternama,"Andrew Andika ditangkap atas kasus narkoba. Ia diamankan Satresnarkoba Polres Metro Jakarta Barat pada Kamis 26 September 2024 malam. Kasat Reserse Narkoba Polres Metro Jakarta Barat AKBP Chandra Mata Rohansyah menyampaikan, Andrew Andika tidak ditangkap sendiri. Ada beberapa lain yang ikut diciduk. ""Untuk temannya 5 orang, 3 orang laki-laki dan 2 orang perempuan,"" kata Chandra Mata Rohansyah di Polres Jakarta Barat pada Sabtu 28 September 2024. Menariknya, salah satu teman Andrew Andika yang ditangkap adalah pesohor.""Diantaranya ada juga influencer,"" jelas Chandra Mata Rohansyah. Sayangnya belum ada bocoran lebih lanjut mengenai influencer yang turut diamankan bersama Andrew Andika dalam kasus penyalahgunaan narkotika tersebut. Polisi belum berbicara lebih mendetail. Hanya saja, polisi menyebut lokasi penangkapannya. Dia bilang Andrew Andika dan teman-temannya diamankan di dua lokasi berbeda yakni di Bogor dan Jakarta Selatan. Sebelum memberikan keterangan tersebut, Kapolres Metro Jakarta Barat, Kombes Pol M Syahduddi telah lebih dulu membenarkan kabar penangkapan Andrew Andika. ""Iya benar (Andrew Andika) (barang bukti) sabu,"" kata Syahduddi saat dihubungi awak media, Sabtu 28 September 2024.","Andrew Andika ditangkap atas kasus narkoba. Kasat Reserse Narkoba Polres Metro Jakarta Barat AKBP Chandra Mata Rohansyah menyampaikan, Andrew Andika tidak ditangkap sendiri. Menariknya, salah satu teman Andrew Andika yang ditangkap adalah pesohor. Hanya saja, polisi menyebut lokasi penangkapannya. Dia bilang Andrew Andika dan teman-temannya diamankan di dua lokasi berbeda yakni di Bogor dan Jakarta Selatan. Iya benar (Andrew Andika) (barang bukti) sabu,"" kata Syahduddi saat dihubungi awak media, Sabtu 28 September 2024."
"Raup Royalti Ratusan Juta Rupiah, Berapa Honor Pertama The Virgin?",Entertainment,2024-09-28,Sumarni,https://www.suara.com/entertainment/2024/09/28/185500/raup-royalti-ratusan-juta-rupiah-berapa-honor-pertama-the-virgin,"The Virgin menjadi salah satu grup duo yang sukses di Tanah Air. Bukan hanya dari lagu-lagu hits, Mitha dan Dara pun masih eksis hingga saat ini. Salah satu lagu yang sukses adalah Cinta Terlarang. Bahkan dari single tersebut, The Virgin mampu meraup royalti hingga ratusan juta rupiah. ""2009 itu ya, hampir Rp 100 juta,"" kata Mitha The Virgin kepada ditemui di Menteng, Jakarta Pusat pada Kamis 26 September 2024. Berlanjut ke royalti selanjutnya, The Virgin mendapat pundi-pundi uang yang makin bertambah.""Terima royalti lagi. Udah ratusan juta, ibaratnya dulu, miliaran lagi,"" ucap musisi bernama lengkap Cameria Happy Pramita ini. Bisa mengantongi royalti ratusan juta rupiah, berapa honor perdana The Virgin manggung? Ternyata untuk sekelas band baru, tarifnya cukup mahal. ""Rp 10 juta kayaknya,"" ucap Mitha. Nominal tersebut memang terbilang mahal. Sebab Mitha mengingatkan, ada nama besar Ahmad Dhani di belakang The Virgin. ""Mungkin gini, kenapa The Virgin baru nongol dijual mahal, karena nama mas Dhani,"" jelas Mitha The Virgin.""Kalau gak ada nama Mas Dhani, nggak mungkin kita dapet harga segitu mahal ya awal-awal,"" imbuhnya. Setelah melalui proses panjang, honor The Virgin pun otomatis bertambah. ""Pernah kok kita hampir rate Rp 250 juta,"" kata gitaris band The Virgin tersebut. Namun tak dipungkiri, angka tersebut fluktuatif seiring dengan popularitas dan munculnya band-band lain. Meski begitu, Mitha dan Dara bersyukur band mereka masih off air hingga saat ini. ""Masih ada di rate puluhan juta juga itu buat kita masih alhamdulillah banget. Dan rezekinya masih ada,"" pungkas Mitha The Virgin.","The Virgin menjadi salah satu grup duo yang sukses di Tanah Air. Bukan hanya dari lagu-lagu hits, Mitha dan Dara pun masih eksis hingga saat ini. Bahkan dari single tersebut, The Virgin mampu meraup royalti hingga ratusan juta rupiah. "" Berlanjut ke royalti selanjutnya, The Virgin mendapat pundi-pundi uang yang makin bertambah. Sebab Mitha mengingatkan, ada nama besar Ahmad Dhani di belakang The Virgin. "" Mungkin gini, kenapa The Virgin baru nongol dijual mahal, karena nama mas Dhani,"" jelas Mitha The Virgin. Pernah kok kita hampir rate Rp 250 juta,"" kata gitaris band The Virgin tersebut. Namun tak dipungkiri, angka tersebut fluktuatif seiring dengan popularitas dan munculnya band-band lain. Masih ada di rate puluhan juta juga itu buat kita masih alhamdulillah banget."
