title,category,publish_date,author,article_url,content,summary
"7 Fakta Perjalanan Kris Dayanti di Dunia Politik, Kini Resmi Daftarkan Diri Jadi Calon Wali Kota Batu",Entertainment,2024-08-29,Sumarni,https://www.suara.com/entertainment/2024/08/29/091000/7-fakta-perjalanan-kris-dayanti-di-dunia-politik-kini-resmi-daftarkan-diri-jadi-calon-wali-kota-batu,"Sempat kepikiran mundur, Kris Dayanti bersama Kresna Dewanata Phrosakh resmi mendaftarkan diri sebagai pasangan Wali Kota dan Wakil Wali Kota Batu. Saat melakukan pendaftaran, Kris Dayanti dan Kresna Dewanata Phrosakh diiringi puluhan anggota partai pendukung dan pengusung. Ratusan orang tampak memadati jalan sepanjang Sultan Agung menuju pintu gerbang kantor KPU Batu sehingga membuat macet di kawasan jalan tersebut. Lantas seperti apa perjalanan Kris Dayanti di dunia politik? Berikut ulasannya.1. Awal Terjun ke Dunia Politik Kris Dayanti mulai aktif dalam dunia politik ketika bergabung dengan Partai Demokrasi Indonesia Perjuangan (PDI-P) pada tahun 2018. Keputusan ini menandai langkah besar dalam kariernya, mengingat sebelumnya ia dikenal sebagai seorang diva musik Indonesia. 2. Jadi Anggota Dewan Pada Pemilu 2019, Kris Dayanti berhasil terpilih sebagai anggota Dewan Perwakilan Rakyat (DPR) Republik Indonesia untuk periode 2019-2024 mewakili daerah pemilihan Jawa Timur V. Ia mendapatkan suara yang cukup signifikan, menunjukkan dukungan kuat dari konstituennya. 3. Fokus pada Isu SosialSelama menjadi anggota DPR, Kris Dayanti dikenal vokal dalam memperjuangkan berbagai isu sosial, termasuk kesejahteraan masyarakat, pendidikan, dan perlindungan anak. Ia seringkali menggunakan platformnya untuk meningkatkan kesadaran tentang isu-isu ini dan mendorong perubahan positif. 4. Gagal di Pileg 2024 Kris Dayanti harus menelan pil pahit di Pileg 2024. Dia gagal lolos DPR RI. Padahal pada Pileg 2019 lalu KD meraih suara tertinggi di Dapil Jatim V yang meliputi wilayah Malang Raya. Gagalnya Kris Dayanti melengggang kembali ke Senayan itu setelah dirinya hanya meraih 70.111 suara. Suara Kris Dayanti jauh menyusut dibanding Pileg 2019 yang kala itu meraup 86.722 suara. 5. Ikut Pilkada di Kota Batu Gagal jadi anggota dewan, Kris Dayanti mengumumkan niatnya untuk maju sebagai calon Wali Kota Batu. 6. Sempat Mundur Namun di tengah perjalannya untuk ikut di Pilkada Kota Batu, Kris Dayanti sempat mundur karena sulit membagi waktunya dengan keluarga. Namun dia akhirnya mau kembali maju karena merasa banyak yang mendukungnya. 7. Resmi Daftar ke KPU Kota Batu Kris Dayanti akhirnya memastikan maju sebagai wali kota Batu setelah mendaftarkan diri di KPU Kota Batu, Kamis 28 Agustus 2024. Istri Raul Lemos itu datang bersama dengan pasangannya, Kresna Dewanata Phrosakh sebagai Wakil Wali Kota Batu. Demikian beberapa fakta perjalanan Kris Dayanti di dunia politik yang saat ini bakal bersaing merebut kursi Wali Kota Batu, Jawa Timur.","Sempat kepikiran mundur, Kris Dayanti bersama Kresna Dewanata Phrosakh resmi mendaftarkan diri sebagai pasangan Wali Kota dan Wakil Wali Kota Batu. Saat melakukan pendaftaran, Kris Dayanti dan Kresna Dewanata Phrosakh diiringi puluhan anggota partai pendukung dan pengusung. Ratusan orang tampak memadati jalan sepanjang Sultan Agung menuju pintu gerbang kantor KPU Batu sehingga membuat macet di kawasan jalan tersebut. Lantas seperti apa perjalanan Kris Dayanti di dunia politik? Jadi Anggota Dewan Pada Pemilu 2019, Kris Dayanti berhasil terpilih sebagai anggota Dewan Perwakilan Rakyat (DPR) Republik Indonesia untuk periode 2019-2024 mewakili daerah pemilihan Jawa Timur V. Ia mendapatkan suara yang cukup signifikan, menunjukkan dukungan kuat dari konstituennya. Ia seringkali menggunakan platformnya untuk meningkatkan kesadaran tentang isu-isu ini dan mendorong perubahan positif. Gagal di Pileg 2024 Kris Dayanti harus menelan pil pahit di Pileg 2024. Gagalnya Kris Dayanti melengggang kembali ke Senayan itu setelah dirinya hanya meraih 70.111 suara. Ikut Pilkada di Kota Batu Gagal jadi anggota dewan, Kris Dayanti mengumumkan niatnya untuk maju sebagai calon Wali Kota Batu. Namun dia akhirnya mau kembali maju karena merasa banyak yang mendukungnya."
"Keseruan Pemain Private Bodyguard Getaway, Tinggal Bersama 3 Hari 2 Malam",Entertainment,2024-08-28,Sumarni,https://www.suara.com/entertainment/2024/08/28/220000/keseruan-pemain-private-bodyguard-getaway-tinggal-bersama-3-hari-2-malam,"Para pemain Viu Original Private Bodyguard kembali berkumpul dan berbagi keseruan dalam reality show bertajuk Private Bodyguard Getaway. Acara ini dibuat untuk menampilkan perjalanan para pemain menuju musim kedua serial tersebut. Sandrinna Michelle, Junior Roberts, Fattah Syach, Arya Mohan, Harry Vaughan dan pemain lainnya tinggal bersama di sebuah villa selama tiga hari dua malam. Di sana mereka akan melakukan script reading, wokrshop, hingga berbagi cerita bersama. Junior Roberts mengaku senang bisa kembali berkumpul dengan lawan mainnya di Private Bodyguard. Selama tiga hari penuh, dia puas bersenang-senang dan menjadi diri sendiri di depan para sahabatnya. ""Di sini kita benar-benar having fun doang, ngelawak, jadi diri kita sendiri. Gimana sih kita di balik layar, gimana sifat asli kita kalau nggak on cam, ya itu semua ada di sini. Jadi kita jadi diri sendiri tanpa batas,"" kata Junior Roberts saat ditemui di kawasan Kemang, Jakarta Selatan, Rabu 28 Agustus 2024.""Spend time (menghabiskan waktu) bareng, jadi kita benar-benar melakukan hal seakan-akan bukan berakting, kita kayak hangout, kayak beneran sebagai teman bukan sebagai aktor,"" ucapnya menyambung. Meski sempat canggung saat harus beraktivitas di ruangan penuh kamera, namun para pemain Private Bodyguard Getaway berhasil mencairkan suasana dengan berbagai kegiatan. Salah satunya, Junior Roberts dan para pemain sempat bermain futsal dan yoga bersama. ""Sempat kaku, karena di sini ada kamera, di situ ada kamera, tapi setelah dua jam kita sudah terbiasa dengan kamera di sekitar kita jadi ya lepas aja,"" ungkap Junior. ""(untuk mencairkan suasana) ngebully Mohan. Ada kita ngelakuin main bola, yoga, ada hiking juga. Kita ngelakuin aktivitas yang orang normal lakuin seharian,"" tambahnya.Reality show Private Bodyguard Getaway akan tayang dalam 10 episode setiap hari Jumat dan Sabtu dan mulai tayang eksklusif di Viu mulai 30 Agustus mendatang.","Para pemain Viu Original Private Bodyguard kembali berkumpul dan berbagi keseruan dalam reality show bertajuk Private Bodyguard Getaway. Di sana mereka akan melakukan script reading, wokrshop, hingga berbagi cerita bersama. Jadi kita jadi diri sendiri tanpa batas,"" kata Junior Roberts saat ditemui di kawasan Kemang, Jakarta Selatan, Rabu 28 Agustus 2024.""Spend time (menghabiskan waktu) bareng, jadi kita benar-benar melakukan hal seakan-akan bukan berakting, kita kayak hangout, kayak beneran sebagai teman bukan sebagai aktor,"" ucapnya menyambung. Meski sempat canggung saat harus beraktivitas di ruangan penuh kamera, namun para pemain Private Bodyguard Getaway berhasil mencairkan suasana dengan berbagai kegiatan. untuk mencairkan suasana) ngebully Mohan. Ada kita ngelakuin main bola, yoga, ada hiking juga. Kita ngelakuin aktivitas yang orang normal lakuin seharian,"" tambahnya. Reality show Private Bodyguard Getaway akan tayang dalam 10 episode setiap hari Jumat dan Sabtu dan mulai tayang eksklusif di Viu mulai 30 Agustus mendatang."
"Pratama Arhan Posting Momen Manis Azizah Salsha di Konten Ekslusif, Lagi Usaha Bersihkan Citra Jelek?",Entertainment,2024-08-28,Sumarni,https://www.suara.com/entertainment/2024/08/28/212500/pratama-arhan-posting-momen-manis-azizah-salsha-di-konten-ekslusif-lagi-usaha-bersihkan-citra-jelek,"Rumah tangga Pratama Arhan dengan Azizah Salsha tampaknya memang baik-baik saja meski sempat beredar kabar miring, yakni perselingkuhan sang selebgram dengan Salim Nauderer. Hal itu diketahui dari unggahan konten ekslusif Pratama Arhan baru-baru ini. Pemain sepak bola itu memposting ulang video lawas yang memuat kebersamaannya dengan Azizah Salsha. Dalam video tersebut, terlihat mereka sedang nge-gym bersama. Pratama Arhan tengah melakukan pull up, lalu diikuti oleh Azizah Salsha. Layaknya pasangan sedang dimabuk asmara, keduanya tidak serius berolahraga. Azizah Salsha mencoba bercanda dengan melingkarkan kakiknya ke pinggang sang suami.Sayangnya, Pratama Arhan tidak kuat mengangkat tubuhnya Azizah Salsha. Pada akhirnya, ia melepaskan genggamannya dari tiang dan menggendong sang istri supaya lepas dari tubuhnya. Perempuan 21 tahun itu hanya tertawa melihat suaminya kesulitan. Senyum lebar tersungging di bibir ketika Pratama Arhan menggendongnya. Pratama Arhan tidak meninggalkan caption apapun di postingannya kecuali emoji hati berwarna putih. Video berdurasi pendek yang diunggah ulang oleh akun TikTok @randomme__0 ini pun seketika mencuri perhatian warganet. Banyak yang menduga pemain Timnas Indonesia itu sedang membersihkan citra buruk rumah tangganya.""Zah, lu punya suami sebaik ini loh. Rela nyapuin yang kotor-kotor,"" kata akun @b424***. ""Mantunya pemain bola, malah disuruh bersih-bersih mulu sama abi,"" imbuh akun @pluu***. ""Suami istri terpantau sedang bersih-bersih rumah,"" sindir @koko***.","Rumah tangga Pratama Arhan dengan Azizah Salsha tampaknya memang baik-baik saja meski sempat beredar kabar miring, yakni perselingkuhan sang selebgram dengan Salim Nauderer. Pemain sepak bola itu memposting ulang video lawas yang memuat kebersamaannya dengan Azizah Salsha. Layaknya pasangan sedang dimabuk asmara, keduanya tidak serius berolahraga. Sayangnya, Pratama Arhan tidak kuat mengangkat tubuhnya Azizah Salsha. Pada akhirnya, ia melepaskan genggamannya dari tiang dan menggendong sang istri supaya lepas dari tubuhnya. Perempuan 21 tahun itu hanya tertawa melihat suaminya kesulitan. Senyum lebar tersungging di bibir ketika Pratama Arhan menggendongnya. Pratama Arhan tidak meninggalkan caption apapun di postingannya kecuali emoji hati berwarna putih. Rela nyapuin yang kotor-kotor,"" kata akun @b424***. """
"Hadiri Milad Dewa 19, Intip Cara El Rumi dan Al Ghazali Kenalkan Pacar ke Fadli Zon Cs",Entertainment,2024-08-28,Sumarni,https://www.suara.com/entertainment/2024/08/28/202500/hadiri-milad-dewa-19-intip-cara-el-rumi-dan-al-ghazali-kenalkan-pacar-ke-fadli-zon-cs,"Al Ghazali dan El Rumi sama-sama memboyong pujaan hatinya, Alyssa Daguise dan Syifa Hadju, ke acara Milad Dewa 19. Peringatan hari lahir grup band besutan Ahmad Dhani itu tayang pada Selasa 27 Agustus 2024 di YouTube. Dalam acara Milad Dewa 19 tersebut, Al Ghazali dan El Rumi kompak memperkenalkan pujaan hatinya kepada teman-teman Ahmad Dhani. Dikutip pada Rabu 28 Agustus 2024 dalam YouTube Ahmad Dhani Dalam Berita, berikut adalah perbandingan cara Al Ghazali dan El Rumi mengenalkan pacar kepada teman-teman sang ayah. Al GhazaliBerdasarkan pantauan, Al Ghazali lebih dulu menyapa teman-teman Ahmad Dhani. Dia menyambut rekan-rekan sang ayah dengan cara mencium tangan dan diakhiri dengan adegan bertukar kecupan di bagian pipi kiri dan kanan. ""Ceweknya mana?"" kata salah seorang teman Ahmad Dhani. Setelah itu, Al Ghazali pun mengenalkan pujaan hatinya kepada kerabat Ahmad Dhani. Dia memperkenalkan Alyssa Daguise sebagai calon istrinya alih-alih sekadar pacar. ""Ini, calon istri,"" tutur Al Ghazali El RumiBerbanding terbalik dari Alyssa Daguise, Syifa Hadju tiba belakangan di lokasi acara Milad Dewa 19. Meski begitu, dia langsung disambut hangat oleh El Rumi dan keluarganya. Syifa Hadju langsung menyapa Ahmad Dhani dengan cara mengecup tangannya. Tak lama kemudian, eks pacar Rizky Nazar itu diboyong El Rumi ke meja tamu undangan Milad Dewa 19. Salah satu tamu undangan yang dikenalkan El Rumi kepada sang pujaan hati di antaranya adalah Fadli Zon. Syifa Hadju tampak mengecup satu persatu tangan rekan-rekan Ahmad Dhani.","Al Ghazali dan El Rumi sama-sama memboyong pujaan hatinya, Alyssa Daguise dan Syifa Hadju, ke acara Milad Dewa 19. Peringatan hari lahir grup band besutan Ahmad Dhani itu tayang pada Selasa 27 Agustus 2024 di YouTube. Dalam acara Milad Dewa 19 tersebut, Al Ghazali dan El Rumi kompak memperkenalkan pujaan hatinya kepada teman-teman Ahmad Dhani. Dikutip pada Rabu 28 Agustus 2024 dalam YouTube Ahmad Dhani Dalam Berita, berikut adalah perbandingan cara Al Ghazali dan El Rumi mengenalkan pacar kepada teman-teman sang ayah. Dia menyambut rekan-rekan sang ayah dengan cara mencium tangan dan diakhiri dengan adegan bertukar kecupan di bagian pipi kiri dan kanan. "" Meski begitu, dia langsung disambut hangat oleh El Rumi dan keluarganya. Syifa Hadju langsung menyapa Ahmad Dhani dengan cara mengecup tangannya."
"Batal Nyalon di Pilwalkot Tangsel, Marshel Widianto Diejek Habis-habisan: Kasihan Jadi Boneka Gimik Politik",Entertainment,2024-08-28,Yazir Farouk,https://www.suara.com/entertainment/2024/08/28/194243/batal-nyalon-di-pilwalkot-tangsel-marshel-widianto-diejek-habis-habisan-kasihan-jadi-boneka-gimik-politik,"Marshel Widianto batal maju Pilkada 2024 setelah Ahmad Riza Patria mengumumkan resmi mundur dari kontestasi Pemilihan Walikota Tangerang Selatan (Tangsel). Melalui unggahan di akun Instagram miliknya, sang komika menyatakan dukungan kepada paslon lain, yakni Benyamin Davnie dan Pilar Saga Ichsan. ""Rispek buat abang-abangku, Bang Benyamin dan Bang Pilar. Gue percaya keresahan dan harapan warga Tangsel udah sampai ke abang,"" tulis Marshel, Rabu 28 Agustus 2024. ""Pasti banyak PR buat dituntasin tapi yang jelas ayo! Kita sama-sama berjuang, untuk ngebangun Tangsel yang lebih baik,"" lanjutnya.Suami Cesen eks JKT48 itu berharap bisa menitipkan semua aspirasi masyarakat Tangerang Selatan. Dia juga meminta agar warga Tangsel mendukung Benyamin-Pilar. ""Saya Titipkan semua aspirasi masyarakat Tangsel untuk Tangsel yang lebih maju ya pak. Warga Tangsel, bapak ibu abang kakak dan pren semua, gue titip paslon yang ini ya,"" pungkasnya. Bukan kata-kata penghiburan, Marshel Widianto justru jadi bahan ejekan netizen. Dari awal pencalonannya memang ditentang oleh sebagian besar masyarakat, bahkan sejumlah figur publik. ""Akhirnya Marshel stand up di panggung komedi yang sesungguhnya,"" komentar akun @aha***""Semangat bang, walaupun abang udah keliling, sampai baliho di mana-mana, sampai minta restu ke pejabat dan artis-artis, eh kagak jadi nyalon , benar-benar puncak komedi,"" ujar akun @adn*** ""Nangis dikit pasti ada. Nggak mungkin nggak nangis sih,"" cibir akun @agu*** ""Kasihan banget lo Shel cuma dijadikan boneka gimmick politik,"" sahut akun @me_*** Di tengah olokan netizen, tampak komentar Pilar Saga Ichsan yang menerima dukungan dari Marshel Widianto. ""Terima kasih Mas @marshel_widianto atas dukungan kepada kami berdua. Insha Allah hasil kunjungan Mas Marshel keliling Tangsel selama ini tidak sia-sia,"" ujar Pilar. ""Menjadi informasi dan masukan penting bagi kami agar program pembangunan kedepan lebih baik lagi. Terima kasih sekali lagi doa dan dukungannya, Bless U Mas!"" imbuhnya. Cesen juga terlihat menghibur sang suami dengan meningalkan komentar adem. ""See you at home (sampai jumpa di rumah),"" tulis ibu dua anak tersebut. Kontributor : Chusnul Chotimah","Marshel Widianto batal maju Pilkada 2024 setelah Ahmad Riza Patria mengumumkan resmi mundur dari kontestasi Pemilihan Walikota Tangerang Selatan (Tangsel). Rispek buat abang-abangku, Bang Benyamin dan Bang Pilar. Pasti banyak PR buat dituntasin tapi yang jelas ayo! Kita sama-sama berjuang, untuk ngebangun Tangsel yang lebih baik,"" lanjutnya. Suami Cesen eks JKT48 itu berharap bisa menitipkan semua aspirasi masyarakat Tangerang Selatan. Saya Titipkan semua aspirasi masyarakat Tangsel untuk Tangsel yang lebih maju ya pak. Dari awal pencalonannya memang ditentang oleh sebagian besar masyarakat, bahkan sejumlah figur publik. "" Nggak mungkin nggak nangis sih,"" cibir akun @agu*** ""Kasihan banget lo Shel cuma dijadikan boneka gimmick politik,"" sahut akun @me_*** Di tengah olokan netizen, tampak komentar Pilar Saga Ichsan yang menerima dukungan dari Marshel Widianto. "" Terima kasih sekali lagi doa dan dukungannya, Bless U Mas!"" Cesen juga terlihat menghibur sang suami dengan meningalkan komentar adem. """
"Profil Nisya Ahmad, Adik Raffi Ahmad yang Dilantik jadi Anggota DPRD Jabar",Entertainment,2024-09-03,Yohanes Endra,https://www.suara.com/entertainment/2024/09/03/121403/profil-nisya-ahmad-adik-raffi-ahmad-yang-dilantik-jadi-anggota-dprd-jabar,"Pelantikan Nisya Ahmad sebagai anggota Dewan Perwakilan Rakyat Daerah (DPRD) Jawa Barat periode 2024-2029 memicu sejumlah pertanyaan dari publik. Pasalnya adik Raffi Ahmad tersebut kalah suara dari Thoriqoh Nashrullah Fitriyah, kader Partai Amanat Nasional (PAN) lainnya yang juga mengikuti Pileg pada Februari 2024 lalu. Ternyata Thoriqoh Nashrullah Fitriyah mengundurkan diri dari jabatan anggota dewan. Oleh karena itu, Nisya dinyatakan lolos untuk mengisi posisi yang ditinggalkan Thoriqoh. Terpilihnya Nisya Ahmad sebagai anggota DPRD Jawa Barat membuat Raffi Ahmad sangat bersyukur. Bisa dilihat dari unggahan yang dibagikan oleh suami Nagita Slavina ke Instagram.""Alhamdulillah hari ini Allah SWT mengizinkan dilantik untuk menjadi anggota DPRD Provinsi Jawa Barat Dapil Jabar 2 @nissyaa (Annisa Saadia Ifat) @amanatnasional - @bluesquad_ofc,"" tulisnya, seperti dikutip pada Selasa 3 September 2024. Nisya Ahmad belum memiliki banyak pengalaman di dunia politik, mengingat kariernya memang baru dimulai tahun ini. Sebelumnya dia eksis di industri entertainment sebagai aktris dan penyanyi. Langsung saja, berikut profil Nisya Ahmad yang baru saja dilantik sebagai anggota DPRD Jawa Barat periode 2024-2029. Annisa Saadiyah Ifat atau yang akrab disapa Nisya Ahmad lahir pada 17 Oktober 1990 di Bandung. Dia adalah adik Raffi Ahmad dan kakak dari Syahnaz Sadiqah. Nisya Ahmad menikah dengan Andika Rosadi di usia yang terbilang muda, yakni 19 tahun. Pernikahan mereka digelar pada 31 Januari 2009.Dari pernikahan tersebut, Nisya dikaruniai tiga anak yang diberi nama Mikaela Atqia Rosadi, Aeshya Balqes Rosadi dan Munawar At Thareeq Gibran Rosadi. Nisya Ahmad pertama kali terjun ke dunia hiburan sebagai penyanyi pada 2024. Saat itu dia merilis lagu bertajuk Di Seluruh Dunia, yang meraih lebih dari 5 juta pendengar di Spotify. Sepanjang kariernya di dunia tarik suara, Nisya telah merilis beberapa single. Lagu-lagu yang dirilis Nisya adalah Terima Kasih Telah Singgah (2019), Wahai Sahabatku (2019), Berteduh (2020), hingga Dalam Mimpi (2023). Selain menyanyi, Nisya juga dikenal sebagai aktris. Dia membintangi film Move On (2015) dan The Secret: Suster Ngesot Urban Legend (2018), serta beberapa judul sinetron, salah satunya Kembalinya Raden Kian Santang (2021). Pada 2024, Nisya mencoba peruntungan di dunia politik dengan mengikuti Pileg Dewan Perwakilan Rakyat Daerah (DPRD) Jawa Barat dari PAN. Kala itu, Nisya Ahmad kalah jumlah suara dari kader PAN lainnya. Dia hanya memperoleh 50.422 suara, sementara Thoriqoh Nashrullah Fitriyah berhasil mengumpulkan 58.494 suara. Namun Nisya tetap dilantik bersama sekitar 120 anggota DPRD Jawa Barat pada Senin 2 September 2024 di Gedung Merdeka, Bandung, Jawa Barat karena Thoriqoh memutuskan untuk mundur. Kontributor : Chusnul Chotimah","Pelantikan Nisya Ahmad sebagai anggota Dewan Perwakilan Rakyat Daerah (DPRD) Jawa Barat periode 2024-2029 memicu sejumlah pertanyaan dari publik. Oleh karena itu, Nisya dinyatakan lolos untuk mengisi posisi yang ditinggalkan Thoriqoh. Sebelumnya dia eksis di industri entertainment sebagai aktris dan penyanyi. Dia adalah adik Raffi Ahmad dan kakak dari Syahnaz Sadiqah. Pernikahan mereka digelar pada 31 Januari 2009.Dari pernikahan tersebut, Nisya dikaruniai tiga anak yang diberi nama Mikaela Atqia Rosadi, Aeshya Balqes Rosadi dan Munawar At Thareeq Gibran Rosadi. Nisya Ahmad pertama kali terjun ke dunia hiburan sebagai penyanyi pada 2024. Saat itu dia merilis lagu bertajuk Di Seluruh Dunia, yang meraih lebih dari 5 juta pendengar di Spotify. Sepanjang kariernya di dunia tarik suara, Nisya telah merilis beberapa single. Lagu-lagu yang dirilis Nisya adalah Terima Kasih Telah Singgah (2019), Wahai Sahabatku (2019), Berteduh (2020), hingga Dalam Mimpi (2023). Kala itu, Nisya Ahmad kalah jumlah suara dari kader PAN lainnya. Dia hanya memperoleh 50.422 suara, sementara Thoriqoh Nashrullah Fitriyah berhasil mengumpulkan 58.494 suara. Namun Nisya tetap dilantik bersama sekitar 120 anggota DPRD Jawa Barat pada Senin 2 September 2024 di Gedung Merdeka, Bandung, Jawa Barat karena Thoriqoh memutuskan untuk mundur."
"Buntut Laporan Hoaks Hamil Duluan, Polda Metro Jaya Panggil Aaliyah Massaid dan Thariq Halilintar",Entertainment,2024-08-28,Sumarni,https://www.suara.com/entertainment/2024/08/28/193000/buntut-laporan-hoaks-hamil-duluan-polda-metro-jaya-panggil-aaliyah-massaid-dan-thariq-halilintar,"Polda Metro Jaya menyampaikan perkembangan terkini perihal laporan hoaks hamil duluan dari Aaliyah Massaid. Penyidik akan memanggil Aaliyah pada Kamis 29 Agustus 2024. ""Aaliyah Massaid selaku pelapor atau korban diperiksa 29 Agustus 2024, pukul 10.30 WIB,"" ujar Dirkrimsus Polda Metro Jaya, Kombes Ade Safri Simanjuntak, Rabu 28 Agustus 2024. Tak sendiri, Thariq Halilintar selaku suami Aaliyah Massaid juga akan dimintai keterangan terkait laporan hoaks hamil duluan. Pemeriksaan terhadap adik Atta Halilintar dilakukan terpisah. ""Thariq Halilintar diperiksa pukul 11.30 WIB,"" kata Ade Safri Simanjuntak.Dari keterangan Aaliyah Massaid dan Thariq Halilintar, penyidik berharap dapat menemukan unsur pidana yang bisa membuat laporan terkait hoaks hamil duluan naik ke tahap penyidikan. ""Tim sedang melakukan serangkaian kegiatan penyelidikan untuk mencari dan menemukan suatu peristiwa yang diduga sebagai tindak pidana, guna menentukan dapat atau tidaknya dilakukan penyidikan,"" jelas Ade Safri Simanjuntak. Belum ada informasi lebih lanjut apakah Aaliyah Massaid dan Thariq Halilintar sudah mengonfirmasi untuk hadir pemeriksaan atau tidak. Sebagaimana diketahui, Aaliyah Massaid melaporkan hoaks hamil duluan ke Polda Metro Jaya pada Kamis 22 Agustus 2024. Ada dua akun TikTok dan satu akun YouTube yang Aaliyah polisikan. ""Saudara AM melihat ada dua akun TikTok dan satu akun YouTube yang menjelaskan bahwa pelapor hamil di luar nikah. Padahal menurut pelapor, sampai saat ini dia tidak hamil,"" papar Kabid Humas Polda Metro Jaya, Kombes Ade Ary Syam Indradi, Senin 26 Agustus 2024.Aaliyah Massaid merasa diserang kehormatannya lewat hoaks tersebut. Pasalnya, banyak yang percaya dengan isu dirinya hamil di luar nikah hingga berdampak ke beban psikis. ""Hal tersebut membuat pelapor malu dan merasa terserang kehormatannya sebagai seorang wanita,"" jelas Ade Ary Syam Indradi. Dalam laporan Aaliyah Massaid, pemilik akun-akun tersebut dikenakan Pasal 27A jo Pasal 45 ayat (4) UU ITE dan atau Pasal 310, Pasal 311 dan Pasal 315 KUHP.","Polda Metro Jaya menyampaikan perkembangan terkini perihal laporan hoaks hamil duluan dari Aaliyah Massaid. Aaliyah Massaid selaku pelapor atau korban diperiksa 29 Agustus 2024, pukul 10.30 WIB,"" ujar Dirkrimsus Polda Metro Jaya, Kombes Ade Safri Simanjuntak, Rabu 28 Agustus 2024. Tak sendiri, Thariq Halilintar selaku suami Aaliyah Massaid juga akan dimintai keterangan terkait laporan hoaks hamil duluan. Pemeriksaan terhadap adik Atta Halilintar dilakukan terpisah. "" Ada dua akun TikTok dan satu akun YouTube yang Aaliyah polisikan. "" Pasalnya, banyak yang percaya dengan isu dirinya hamil di luar nikah hingga berdampak ke beban psikis. "" Hal tersebut membuat pelapor malu dan merasa terserang kehormatannya sebagai seorang wanita,"" jelas Ade Ary Syam Indradi. Dalam laporan Aaliyah Massaid, pemilik akun-akun tersebut dikenakan Pasal 27A jo Pasal 45 ayat (4) UU ITE dan atau Pasal 310, Pasal 311 dan Pasal 315 KUHP."
