title,category,publish_date,author,article_url,content,summary
"Diledek Kalah Mewah, Intip Beda Menu Hidangan Siraman Aaliyah Massaid dan Aurel Hermansyah",Entertainment,2024-07-23,Yohanes Endra,https://www.suara.com/entertainment/2024/07/23/132703/diledek-kalah-mewah-intip-beda-menu-hidangan-siraman-aaliyah-massaid-dan-aurel-hermansyah,"Seiring video TikTok Anang Hermansyah viral, menu hidangan yang tersaji dalam acara siraman Aaliyah Massaid diterpa komentar negatif. Sajian makanan tersebut dikritik kurang mewah. Selain dikritik terlalu sederhana, menu hidangan acara siraman Aaliyah Massaid juga santer dibanding-bandingkan dengan sajian makanan dalam acara siraman Aurel Hermansyah. Dilansir dari akun TikTok @ananghijau18 pada Selasa 23 Juli 2024, berikut adalah perbandingan menu hidangan acara siraman Aaliyah Massaid dengan Aurel Hermansyah. Aaliyah MassaidDalam TikTok Anang Hermansyah, Aaliyah Massaid dan Thariq Halilintar menyajikan hidangan khas Nusantara dalam acara siraman yang berlangsung di Hotel Tentrem Jakarta pada Sabtu 20 Juni 2024. Beberapa hidangan acara siraman Aaliyah Massaid yang dicicipi Anang Hermansyah di antaranya adalah bakso malang, tahu sapo, dan buah-buahan. ""Tahu, tahu hotel. Hm enak, sopo tahu. Aku sih yes,"" ucap Anang Hermansyah. Aurel Hermansyah Sementara itu, Aurel Hermansyah dan Atta Halilintar diketahui mengusung tema Middle East untuk menu hidangan saat acara siraman pada Jumat 19 Maret 2021 silam.Tamu undangan acara siraman Aurel Hermansyah yang hadir ke Hotel Intercontinental Pondok Indah disajikan makanan berupa nasi kebuli, chicken shawarma, zuppa soup, beef szechuan, dan baklava. Di samping makanan bertemakan Timur Tengah, Aurel Hermansyah dan Atta Halilintar juga menyajikan hidangan lain berupa thai tea, kopi kampung, bakwan malang, dan beef Wellington. Variasi hidangan acara siraman Aurel Hermansyah kian bertambah spesial dengan kehadiran dessert kiriman dari desainer kondang, Anne Avantie. Itulah perbandingan menu hidangan yang ada di acara siraman Aaliyah Massaid dengan Aurel Hermansyah.","Seiring video TikTok Anang Hermansyah viral, menu hidangan yang tersaji dalam acara siraman Aaliyah Massaid diterpa komentar negatif. Sajian makanan tersebut dikritik kurang mewah. Selain dikritik terlalu sederhana, menu hidangan acara siraman Aaliyah Massaid juga santer dibanding-bandingkan dengan sajian makanan dalam acara siraman Aurel Hermansyah. Aaliyah MassaidDalam TikTok Anang Hermansyah, Aaliyah Massaid dan Thariq Halilintar menyajikan hidangan khas Nusantara dalam acara siraman yang berlangsung di Hotel Tentrem Jakarta pada Sabtu 20 Juni 2024. Tamu undangan acara siraman Aurel Hermansyah yang hadir ke Hotel Intercontinental Pondok Indah disajikan makanan berupa nasi kebuli, chicken shawarma, zuppa soup, beef szechuan, dan baklava. Variasi hidangan acara siraman Aurel Hermansyah kian bertambah spesial dengan kehadiran dessert kiriman dari desainer kondang, Anne Avantie."
"Desta Gercep Angkat Telepon Natasha Rizki saat Syuting, Wajah Tegangnya Curi Perhatian",Entertainment,2024-07-23,Yohanes Endra,https://www.suara.com/entertainment/2024/07/23/124724/desta-gercep-angkat-telepon-natasha-rizki-saat-syuting-wajah-tegangnya-curi-perhatian,"Desta sepertinya masih punya perhatian kepada mantan istrinya, Natasha Rizki. Bahkan belum lama ini beredar kabar dirinya berencana rujuk dengan perempuan yang telah memberinya 3 anak. Belum selesai mengenai kabar Desta mau rujuk dengan mantan istrinya, sahabat Vincent rompies itu belum lama ini  kedapatan langsung mengangkat telepon selulernya yang diduga sedang dihubungi Natasha Rizki. Padahal posisinya saat itu sedang syuting. Momen Desta yang sigap mengangkat telepon dari Natasha Rizki diunggah di salah satu akun gosip. Saat mengangkat telepon, Desta langsung menyebut nama kesayangan mantan istrinya tersebut. ""Iya buy,"" kata Desta.Terdengar suara perempuan berbicara di telepon tersebut yang diduga Natasha Rizki. Sayang tidak jelas apa yang mereka bicarakan. Namun bapak 3 anak itu memutuskan pembicaraannya karena kondisinya masih syuting. ""Ntar yaa aku lagi syuting,"" ujar Desta sambil mematikan telepon selulernya. Unggahan video itu pun langsung banyak dikomentari oleh warganet. Mereka kaget karena Desta begitu cepat mengakat telepon tersebut walau kondisinya masih syuting. ""Bisa-bisanya angkat telepon pas live,"" tulis salah satu warganet.""Ya harus gercep lah angkat telepon. Karena kan anak diurus mantan istri. Takutnya ada telepon darurat, ngabarin anaknya sakit atau kabar lain mengenai anaknya. Makanya Desta bilang 'Hah kenapa',"" terang warganet lainnya. Tidak diketahui apa yang dibicarakan antara Desta dan Natasha Rizki. Namun wajah Desta terlihat tegang saat menerima telepon tersebut.","Desta sepertinya masih punya perhatian kepada mantan istrinya, Natasha Rizki. Belum selesai mengenai kabar Desta mau rujuk dengan mantan istrinya, sahabat Vincent rompies itu belum lama ini  kedapatan langsung mengangkat telepon selulernya yang diduga sedang dihubungi Natasha Rizki. Padahal posisinya saat itu sedang syuting. Sayang tidak jelas apa yang mereka bicarakan. Unggahan video itu pun langsung banyak dikomentari oleh warganet. Mereka kaget karena Desta begitu cepat mengakat telepon tersebut walau kondisinya masih syuting. "" Bisa-bisanya angkat telepon pas live,"" tulis salah satu warganet. Takutnya ada telepon darurat, ngabarin anaknya sakit atau kabar lain mengenai anaknya. Makanya Desta bilang 'Hah kenapa',"" terang warganet lainnya."
"5 Poin Penting Permintaan Maaf Wanda Hara Soal Pakai Cadar, Minta Didoakan Agar Jadi Manusia yang Lebih Baik",Entertainment,2024-07-23,Sumarni,https://www.suara.com/entertainment/2024/07/23/123456/5-poin-penting-permintaan-maaf-wanda-hara-soal-pakai-cadar-minta-didoakan-agar-jadi-manusia-yang-lebih-baik,"Nama Wanda Hara belakangan sedang ramai diperbincangkan. Fashion staylish Nagita Slavina itu kena hujat setelah mengenakan baju muslimah dan cadar saat mengikuti kajian Ustaz Hanan Attaki. Akibat kejadian tersebut, Wanda Hara kena hujat. Bahkan dia dianggap melecehkan agama Islam. Dari warganet hingga artis Nikita Mirzani tampak memberikan kritik. Wanda Hara pun langsung menanggapi persoalan tersebut. Dia mengakui bersalah dan meminta maaf dengan mengunggah video di Instagram pribadinya. Lantas poin-poin apa saja yang diucapkan Wanda Hara saat meminta maaf? Berikut ulasannya.1. Resmi minta maaf Wanda Hara akhirnya mengakui dirinya bersalah. Dia pun meminta maaf melalui video yang diunggah di Instgaram pribadinya. ""Assalamualaikum warahmatullahi wabarakatu. Saya Wanda Hara, dari hati yang paling dalam mohon maaf yang sebesar-besarnya atas kegaduhan ini. Dalam kajian yang diselenggarakan oleh Ustaz Hanan Attaki kemarin,"" ucap Wanda Hara membuka videonya. ""Atas kejadian yang telah terjadi karena perbuatan saya yang menyinggung banyak pihak kepada saya, saya menyadari ini adalah kesalahan saya,"" sambungnya lagi. 2. Sudah minta maaf ke Ustaz Hanan AttakiSebelum membuat video, Wanda Hara mengaku sudah berkomunikasi dengan Ustaz Hanan Attaki. Dia juga meminta maaf kepada ustaz asal Bandung tersebut. ""Saya juga sudah berkomunikasi dengan Ustaz Hanan Attaki dan meminta maaf kepada beliau dan seluruh panitia Ayah Amanah,"" lanjutnya. 3. Meminta maaf ke rekan-rekannya Selain meminta maaf kepada Ustaz Hanan Attaki dan panitia kajian. Wanda Hara juga meminta maaf kepada rekan-rekannya yang ikut disalahkan atas kejadian tersebut. 4. Menangis Wanda Hara juga tidak kuasa menahan air matanya. Dia pun menangis sambil meminta maaf kepada rekan-rekannya. Dia merasa bersalah karena beberapa rekan artis ada yang disalahkan karena membiarkan dia menggunakan baju perempuan dan cadar. Salah satunya artis yang disalahkan adalah Nagita Slavina. 5. Minta didoakan jadi manusia yang lebih baik lagi Tidak lupa Wanda Hara juga meminta maaf kepada seluruh masyarakat Indonesia. Baginya ini merupakan teguran dari Allah SWT. Selain itu dia juga minta didoakan bisa menjadi manusia yang lebih baik lagi. ""Sekali lagi maaf saya dari lubuk hati yang paling dalam. Mohon dibukakan pintu maaf sebesar-besarnya dan teman-teman, tolong doakan saya semoga jadi manusia yang lebih baik. Maafkan saya, ya Allah,"" ucapnya. Demikian poin penting Wanda Hara saat meminta maaf usai dirinya dihujat setelah mengenakan pakaian muslimah dan cadar ke acara pengajian.","Nama Wanda Hara belakangan sedang ramai diperbincangkan. Fashion staylish Nagita Slavina itu kena hujat setelah mengenakan baju muslimah dan cadar saat mengikuti kajian Ustaz Hanan Attaki. Akibat kejadian tersebut, Wanda Hara kena hujat. Bahkan dia dianggap melecehkan agama Islam. Wanda Hara pun langsung menanggapi persoalan tersebut. Dia mengakui bersalah dan meminta maaf dengan mengunggah video di Instagram pribadinya. Lantas poin-poin apa saja yang diucapkan Wanda Hara saat meminta maaf? Assalamualaikum warahmatullahi wabarakatu. Saya Wanda Hara, dari hati yang paling dalam mohon maaf yang sebesar-besarnya atas kegaduhan ini. Dia juga meminta maaf kepada ustaz asal Bandung tersebut. "" Meminta maaf ke rekan-rekannya Selain meminta maaf kepada Ustaz Hanan Attaki dan panitia kajian. Menangis Wanda Hara juga tidak kuasa menahan air matanya. Minta didoakan jadi manusia yang lebih baik lagi Tidak lupa Wanda Hara juga meminta maaf kepada seluruh masyarakat Indonesia. Baginya ini merupakan teguran dari Allah SWT. Sekali lagi maaf saya dari lubuk hati yang paling dalam."
"Jadi Salah Satu Penyanyi dengan Bayaran Termahal, Judika Bicara Pentingnya Kualitas Karya",Entertainment,2024-07-23,Yohanes Endra,https://www.suara.com/entertainment/2024/07/23/120654/jadi-salah-satu-penyanyi-dengan-bayaran-termahal-judika-bicara-pentingnya-kualitas-karya,"Judika, salah satu penyanyi terkemuka di Indonesia, kini dilabeli sebagai salah satu yang memiliki bayaran tertinggi di dunia hiburan Tanah Air. Dalam sebuah wawancara, pria 45 tahun membagikan pandangannya tentang faktor-faktor yang penting untuk mencapai posisi tersebut. ""Kalau gue tuh, apa ya, prestasi atau karya nggak bisa bohong. Duit belakangan. Gue pengin karya diterima dulu, duit menyusul,"" ujar Judika di kawasan Senayan, Jakarta, Senin 22 Juli 2024. Judika menekankan bahwa memiliki karya yang diakui dan prestasi yang solid merupakan hal yang sangat penting dalam menentukan nilai dirinya sebagai seorang seniman.""Kalau ada karya dan CV yang bagus, di mata orang kita akan punya value yang tinggi. Gue bisa buktikan itu sampai sekarang,"" papar Judika. ""Mungkin kalau gue cuma kejar bayaran yang besar gitu, mungkin aja gue cuma manggung sekali dalam setahun,"" tambahnya. Ditanya mengenai patokan harga yang digunakan untuk menentukan bayarannya, Judika menjelaskan bahwa ia lebih fokus pada kualitas acara yang akan dihadiri. ""Gue normal aja, gue melihat acaranya dulu. Gue punya riders dan nilai honor di gue, jadi kalau misal acaranya berduit, ya bayaran dan riders gua segitu,"" ungkap Judika. Namun terkait proses penentuan harga, Judika menyerahkan hal tersebut kepada manajemennya.""Gue sebenernya nggak pernah tahu, untuk bayaran tinggi atau tidak. Itu sama manajer urusannya,"" ucap Judika. ""Yang pasti, setiap bulan ada evaluasinya. Sama aja kayak jualan,"" pungkas suami Duma Riris.","Judika, salah satu penyanyi terkemuka di Indonesia, kini dilabeli sebagai salah satu yang memiliki bayaran tertinggi di dunia hiburan Tanah Air. Gue pengin karya diterima dulu, duit menyusul,"" ujar Judika di kawasan Senayan, Jakarta, Senin 22 Juli 2024. Ditanya mengenai patokan harga yang digunakan untuk menentukan bayarannya, Judika menjelaskan bahwa ia lebih fokus pada kualitas acara yang akan dihadiri. "" Gue normal aja, gue melihat acaranya dulu. Gue punya riders dan nilai honor di gue, jadi kalau misal acaranya berduit, ya bayaran dan riders gua segitu,"" ungkap Judika. Namun terkait proses penentuan harga, Judika menyerahkan hal tersebut kepada manajemennya. Itu sama manajer urusannya,"" ucap Judika. "" Yang pasti, setiap bulan ada evaluasinya."
"Kini Jadi Salah Satu Penyanyi dengan Bayaran Termahal, Judika: Dulu Pernah Cuma Dikasih 500 Perak",Entertainment,2024-07-23,Sumarni,https://www.suara.com/entertainment/2024/07/23/115820/kini-jadi-salah-satu-penyanyi-dengan-bayaran-termahal-judika-dulu-pernah-cuma-dikasih-500-perak,"Karier bermusik Judika semakin menanjak di industri hiburan Tanah Air. Penyanyi yang dikenal dengan suara emasnya itu kini disebut sebagai salah satu penyanyi solo dengan bayaran tertinggi di Indonesia. Terkait hal itu, Judika saat ditemui di sela kegiatannya di kawasan Senayan, Jakarta merespons dengan rendah hati. ""Puji Tuhan, Alhamdulillah, aku amin aja,"" ujar Judika, Senin 22 Juli 2024. Sebagai seorang yang sudah lama berkecimpung di industri musik Tanah Air, Judika mengingat masa-masa sulit di awal kariernya.""Dulu pernah cuma dikasih Rp 500 perak Rp 20 ribu, sudah merasakan semua. Kalau sekarang merasakan dibayar lebih tinggi, ya bersyukur aja,"" ungkap Judika. Namun di sisi lain, Judika tidak terlalu memikirkan arti label tersebut bagi karier musiknya. Sejak awal, jebolan Indonesian Idol itu cuma ingin fokus mengejar mimpi menjadi penyanyi. ""Aku nggak pernah tahu yang lain dapat berapa dan gue berapa. Yang jelas, memang cita-citaku dari dulu mau jadi penyanyi,"" papar lelaki 45 tahun. Oleh karenanya, cara mempertahankan eksistensi di industri yang kompetitif lebih jadi perhatian Judika dari sekedar memperhitungkan nominal bayaran. ""Ya profesional aja, dan harus bertanggung jawab juga, selain konsisten,"" kata Judika.""Aku menjalani pekerjaan ini kadang bisa nggak tidur, kerja di luar kota, tinggalin keluarga, harus menjaga suara sampai sakit,"" imbuh suami Duma Riris dengan serius.","Karier bermusik Judika semakin menanjak di industri hiburan Tanah Air. Penyanyi yang dikenal dengan suara emasnya itu kini disebut sebagai salah satu penyanyi solo dengan bayaran tertinggi di Indonesia. Sebagai seorang yang sudah lama berkecimpung di industri musik Tanah Air, Judika mengingat masa-masa sulit di awal kariernya. ""Dulu pernah cuma dikasih Rp 500 perak Rp 20 ribu, sudah merasakan semua. Aku nggak pernah tahu yang lain dapat berapa dan gue berapa. Yang jelas, memang cita-citaku dari dulu mau jadi penyanyi,"" papar lelaki 45 tahun. ""Aku menjalani pekerjaan ini kadang bisa nggak tidur, kerja di luar kota, tinggalin keluarga, harus menjaga suara sampai sakit,"" imbuh suami Duma Riris dengan serius."
"Sempat Jenuh, Rowiena Umboh Akhirnya Comeback Main Sinetron Stripping Setelah 5 Tahun",Entertainment,2024-07-23,Sumarni,https://www.suara.com/entertainment/2024/07/23/112534/sempat-jenuh-rowiena-umboh-akhirnya-comeback-main-sinetron-stripping-setelah-5-tahun,"Aktris Rowiena Umboh masih aktif berkarier di dunia hiburan. Terhitung sudah 30 tanun sejak dia pertama kali terjun ke dunia seni peran. Terkini, Rowiena Umboh bermain dalam film action thriller ""Bangsal Isolasi"". Dia berperan sebagai seorang psikolog di sebuah lapas bernama Rusdiah. Selain film, rupanya perempuan yang terkenal sebagai Bidadari Warkop DKI tersebut juga tengah bermain di sebuah sinetron berjudul ""Setulus Hati"". Ini merupakan comeback Rowiena setelah lima tahun vakum dari sinetron stripping. ""Sebenarnya saya masih masuk untuk tayangan di televisi, setelah lima tahun ini saya nggak ambil, baru tahun ini saya ambil. Untuk tayangan di televisi setiap hari, yang kata orang itu stripping. Itu drama keluarga,"" kata Rowiena Umboh kepada saat ditemui di kawasan Kuningan, Jakarta Selatan, baru-baru ini.Aktris 55 tahun tersebut lalu menjelaskan alasannya baru kembali ke sinetron setelah sekian lama vakum. Ternyata Rowiena sempat merasa jenuh melakukan syuting stripping untuk sinetron. ""Karena gini, kenapa saya ambil break lima tahun? Kadang-kadang kita kejenuhan juga, kalau stripping itu setiap hari syuting. Waktu itu ada kejenuhan,"" tutur Rowiena. Selama vakum syuting sinetron, Rowiena lebih aktif mengambil proyek film dan web series. Menurutnya suasana syuting film dan web series lebih menyenangkan dan tidak membosankan. ""Selama itu (syuting stripping) nggak ada, saya lebih banyak main di layar lebar, juga main di web series. Karena di web series kan ketahuan ya episode-nya selesai. Terus kita berinteraksinya dengan orang-orang yang selalu berlainan,"" terangnya. ""Dan satu proyek cepat selesai. Kalau stripping itu kan berarti kita setiap hari sampe nanti penonton yang bosen kan gitu,"" imbuh Rowiena Umboh.Sebagai informasi, Rowiena Umboh mulai berkarier sebagai aktris sejak tahun 1994. Kala itu Rowiena bermain di serial Warkop DKI. Sejak itu namanya dikenal sebagai Bidadari Warkop DKI.","Aktris Rowiena Umboh masih aktif berkarier di dunia hiburan. Terhitung sudah 30 tanun sejak dia pertama kali terjun ke dunia seni peran. Ini merupakan comeback Rowiena setelah lima tahun vakum dari sinetron stripping. "" Sebenarnya saya masih masuk untuk tayangan di televisi, setelah lima tahun ini saya nggak ambil, baru tahun ini saya ambil. Karena gini, kenapa saya ambil break lima tahun? Selama vakum syuting sinetron, Rowiena lebih aktif mengambil proyek film dan web series. Menurutnya suasana syuting film dan web series lebih menyenangkan dan tidak membosankan. "" Karena di web series kan ketahuan ya episode-nya selesai. Terus kita berinteraksinya dengan orang-orang yang selalu berlainan,"" terangnya. "" Kalau stripping itu kan berarti kita setiap hari sampe nanti penonton yang bosen kan gitu,"" imbuh Rowiena Umboh. Kala itu Rowiena bermain di serial Warkop DKI."
"Protes 88 Tas Mewah Disita Kejagung, Sandra Dewi Tuai Sindiran Pedas",Entertainment,2024-07-23,Ferry Noviandi,https://www.suara.com/entertainment/2024/07/23/074500/protes-88-tas-mewah-disita-kejagung-sandra-dewi-tuai-sindiran-pedas,"Sandra Dewi dikabarkan keberatan 88 buah tas mewahnya disita oleh Kejaksan Agung (Kejagung RI) sebagai dugaan barang bukti kasus korupsi sang suami, Harvey Moeis. Seperti diketahui, Kejaksaan Agung melimpakah sejumlah barang bukti dari kasus korupsi Harvey Moeis. Beberapa di antaranya adalah uang, mobil mewah, dan 88 buah tas mewah Sandra Dewi. Seiring penyitaan 88 buah tas mewah itu, Sandra Dewi lewat kuasa hukumnya, Harris Arthur Hedar, mengutarakan ekspresi keberatan. ""Pastinya beliau keberatan,"" katanya. Kendati keberatan, ungkap Harris Arthur Hedar, Sandra Dewi tetap bersikap koperatif menyerahkan 88 buah tasnya tersebut kepada Kejagung RI.""Tapi karena beliau kooperatif, beliau bilang 'enggak apa-apa kita buktikan di pengadilan',"" tuturnya. Menurut Harris Arthur, 88 buah tas tersebut merupakan hasil keringat Sandra Dewi alih-alih buah dari korupsi Harvey Moeis. ""Itu hasil yang didapat dari keringat ibu SD, bahwasanya itu memang benar didapat dari hasil endorse ya,"" ucap Harris. Kabar Sandra Dewi mengutarakan ekspresi keberatan 88 buah tas mewahnya disita Kejagung RI ini viral hingga menyebar luas ke sejumlah akun gosip. ""88 tas branded disita kejagung, Sandra Dewi tak terima,"" tulis akun gosip Instagram @lambegosiip, dikutip pada Senin 22 Juli 2024.Perihal itu, sejumlah warganet turut memberikan respons dan komentar yang beragam. ""Duit rakyat dimakan gitu aja buat foya-foya,"" tulis seorang warganet. ""Endose bapak moyang lo,"" komentar warganet lain. ""Tapi tas branded dia banyak yang edorse-an juga sih, soalnya endorse-annya juga gak main-main,"" ujar warganet yang lainnya. Untuk informasi tambahan, Kejagung RI juga menyita beberapa dugaan barang bukti korupsi Harvey Moeis selain 88 tas mewah Sandra Dewi. Beberapa di antaranya adalah 11 bidang tanah dan bangunan, 8 unit kendaraan, 141 buah perhiasan, uang tunai Rp13.581.013.347 dan US$400 ribu, serta beberapa logam mulia.","Sandra Dewi dikabarkan keberatan 88 buah tas mewahnya disita oleh Kejaksan Agung (Kejagung RI) sebagai dugaan barang bukti kasus korupsi sang suami, Harvey Moeis. Beberapa di antaranya adalah uang, mobil mewah, dan 88 buah tas mewah Sandra Dewi. Kendati keberatan, ungkap Harris Arthur Hedar, Sandra Dewi tetap bersikap koperatif menyerahkan 88 buah tasnya tersebut kepada Kejagung RI.""Tapi karena beliau kooperatif, beliau bilang 'enggak apa-apa kita buktikan di pengadilan',"" tuturnya. Kabar Sandra Dewi mengutarakan ekspresi keberatan 88 buah tas mewahnya disita Kejagung RI ini viral hingga menyebar luas ke sejumlah akun gosip. "" Endose bapak moyang lo,"" komentar warganet lain. "" Tapi tas branded dia banyak yang edorse-an juga sih, soalnya endorse-annya juga gak main-main,"" ujar warganet yang lainnya. Untuk informasi tambahan, Kejagung RI juga menyita beberapa dugaan barang bukti korupsi Harvey Moeis selain 88 tas mewah Sandra Dewi."
"Sering Pusing, Rafathar Anak Raffi Ahmad Ternyata Sakit Radang Amandel",Entertainment,2024-07-23,Sumarni,https://www.suara.com/entertainment/2024/07/23/085721/sering-pusing-rafathar-anak-raffi-ahmad-ternyata-sakit-radang-amandel,"Raffi Ahmad dan Nagita Slavina meminta doa untuk kesembuhan sang anak, Rafathar Malik Ahmad. Hal ini terlihat dalam postingan Instagram pada Senin 22 Juli 2204. Di situ, Rafathar Malik Ahmad tampak sedang diperiksa oleh dokter. ""Get well soon Aa Rafathar,"" tulisnya sebagai caption. Terkait penyakit yang diidap kakak Rayyanza Malik Ahmad ini terungkap dalam unggahan di Instagram Story.Rupanya, dia sakit amandel hingga membuatnya sering pusing dan batuk-batuk. ""Ini lidah kamu. Sekarang Aa punya amandel, kayak bengkak gitu. Ini yang bikin kamu pusing,"" kata dokternya kepada Rafathar. ""Ada batuk juga kan? Nah itu karena Aa minum coklat dan minum yang dingin-dingin. Itu jangan dulu,"" imbuhnya lagi. Dokter menyebut kondisi Rafathar tidak terlalu mengkhawatirkan. Dia bisa lekas sembuh apabila rutin minum obat. ""Nggak apa-apa, aman aman aja. Bukan pusing dari mana-mana,"" tutur si dokter.Sontak saja, unggahan tersebut langsung mendulang beragam komentar dari para netizen yang mendoakan kesembuhan cucu Amy Qanita tersebut. ""Cepet sembuh Aa Rafathar,"" ujar salah satu netizen. ""Cepat sembuh anak soleh anak baik,"" timpal lainnya. ""Gws Aa Rafathar, inget kata dokter nggak boleh makan es krim dan coklat,"" sahut lainnya.","Raffi Ahmad dan Nagita Slavina meminta doa untuk kesembuhan sang anak, Rafathar Malik Ahmad. Hal ini terlihat dalam postingan Instagram pada Senin 22 Juli 2204. Get well soon Aa Rafathar,"" tulisnya sebagai caption. Terkait penyakit yang diidap kakak Rayyanza Malik Ahmad ini terungkap dalam unggahan di Instagram Story. Dokter menyebut kondisi Rafathar tidak terlalu mengkhawatirkan. Dia bisa lekas sembuh apabila rutin minum obat. "" Bukan pusing dari mana-mana,"" tutur si dokter. Gws Aa Rafathar, inget kata dokter nggak boleh makan es krim dan coklat,"" sahut lainnya."
"Makam Glenn Fredly Rusak Gara-Gara Ulah Peziarah, Judika: Jangan Kayak Gitu Lah",Entertainment,2024-07-23,Yazir Farouk,https://www.suara.com/entertainment/2024/07/23/071000/makam-glenn-fredly-rusak-gara-gara-ulah-peziarah-judika-jangan-kayak-gitu-lah,"Istri mendiang Glenn Fredly, Mutia Ayu baru-baru ini mengeluhkan kerusakan makam suaminya akibat ulah peziarah. Lewat unggahan Instagram Story, Mutia menyebut aksi bakar lilin di makam Glenn sebagai pemicu masalah. “Bekas pembakarannya tidak fatal, tapi nggak boleh ada kayak gini lagi. Tolong, mau apa pun itu alasannya, aku secara pribadi tetap tidak suka,” ujar Mutia Ayu sambil mengunggah foto makam Glenn Fredly yang berlubang. Mutia Ayu berpesan kepada para peziarah untuk tidak lagi melakukan tindakan yang berpotensi merusak makam Glenn Fredly. “Dengan rasa hormat saya untuk kalian, cukup dengan mendoakan dan menjaga kerapihan makam Glenn saja aku pasti ikut senang,” kata Mutia Ayu.Kini, rusaknya makam Glenn Fredly akibat ulah para peziarah ikut dikomentari Judika. Meski tidak sepenuhnya menyalahkan mereka, Judika tetap menganggap tindakan tersebut tidak baik. “Mungkin niatnya baik ya, kasih lilin segala macem. Tapi kalau udah sampai merusak, ya harus lihat-lihat lah,” tutur Judika di kawasan Senayan, Jakarta, Senin 22 Juli 2024. Tidak salah di mata Judika kalau Mutia Ayu marah setelah tahu makam Glenn Fredly rusak. Siapa pun pasti akan kesal kalau melihat makam keluarga mereka dirusak orang. “Wajar kalau dari keluarga ada yang keberatan. Apalagi ini dari Mutia, istrinya, dia yang lebih tahu,” kata Judika. Judika, yang juga berteman baik dengan Glenn Fredly semasa hidup, mengingatkan para peziarah untuk tidak lagi mengulang tindakan seperti itu.“Jangan lah ya, kalau sampai kayak gitu,” ucap Judika.","Istri mendiang Glenn Fredly, Mutia Ayu baru-baru ini mengeluhkan kerusakan makam suaminya akibat ulah peziarah. Bekas pembakarannya tidak fatal, tapi nggak boleh ada kayak gini lagi. Tolong, mau apa pun itu alasannya, aku secara pribadi tetap tidak suka,” ujar Mutia Ayu sambil mengunggah foto makam Glenn Fredly yang berlubang. Tapi kalau udah sampai merusak, ya harus lihat-lihat lah,” tutur Judika di kawasan Senayan, Jakarta, Senin 22 Juli 2024. Siapa pun pasti akan kesal kalau melihat makam keluarga mereka dirusak orang. “ Wajar kalau dari keluarga ada yang keberatan. Apalagi ini dari Mutia, istrinya, dia yang lebih tahu,” kata Judika. Judika, yang juga berteman baik dengan Glenn Fredly semasa hidup, mengingatkan para peziarah untuk tidak lagi mengulang tindakan seperti itu."
