title,category,publish_date,author,article_url,content,summary
"Ditantang Live TikTok di Rumah Ibu Indah Permatasari, Respons Arie Kriting Bikin Melongo",Entertainment,2024-08-30,Sumarni,https://www.suara.com/entertainment/2024/08/30/162318/ditantang-live-tiktok-di-rumah-ibu-indah-permatasari-respons-arie-kriting-bikin-melongo,"Sebelum tayang di bioskop pada Kamis 29 Agustus 2024 kemarin, Arie Kriting dan Mamat Alkatiri sempat wara-wiri mempromosikan film 'Kaka Boss' ke sejumlah podcast. Salah satu podcast yang didatangi Arie Kriting dan Mamat Alkatiri diantaranya adalah milik Kemal Palevi. Dalam kesempatan itu, Kemal menanyakan strategi keduanya dalam rangka mengalahkan marketing film 'Agak Laen'. ""Terus strategi kalian untuk mengalahkan (marketing) 'Agak Laen' apa?"" kata Kemal Palevi. Menurut pemilik nama asli Muhammad Yusram Farid Alkatiri tersebut, Arie Kriting selaku sutradara film 'Kaka Boss' sudah menyiapkan strategi yang jitu.Suami Nafha Firah tersebut menantang Arie Kriting untuk menggelar sesi live TikTok di rumah ibunda Indah Permatasari, Nursyah, jika jumlah penonton 'Kaka Boss' tembus 1 juta orang. ""Sudah ada (planning). Kalau mereka (pemain 'Agak Laen') ada nazar kan, kalau berapa juta (penonton) jadi manusia silver. Kalau film 'Kaka Boss' ini sampai 1 juta (penonton), Arie Kriting akan live TikTok langsung dari rumah mertua,"" ujar Mamat Alkatiri. Mendengar tantangan Mamat Alkatiri tersebut, pemilik nama asli Satriaddin Maharinga Djongki itu spontan bereaksi. Dia tampak sedikit panik seraya menegur kerabatnya yang dianggap sesumbar berbicara. ""Tidak itu, tidak itu. Itu bukan tantangan, itu jerumusan,"" ucap Arie Kriting. Cuplikan unggahan video Mamat Alkatiri menantang Arie Kriting untuk live TikTok depan rumah ibu Indah Permatasari ini viral di media sosial TikTok dengan atensi sebanyak 588,4 ribu jumlah tayangan.""Mamat nantang Arie buat live TikTok di rumah mertua,"" tulis akun TikTok @kemalpalevi, dilansir pada Jumat 30 Agustus 2024. Perihal itu, sejumlah netizen turut memberikan respons dan komentar yang beragam. ""Ayo buat hashtag, ayo ramaikan filmnya 'Kaka Boss' guys,"" tulis seorang netizen. ""Bang Arie panik,"" ucap netizen lain. ""Dua juta penonton, Bang Arie main DJ kompor juga,"" kata netizen lain. ""Mukanya Bang Arie pucet banget tuh,"" tutur netizen yang lainnya.","Sebelum tayang di bioskop pada Kamis 29 Agustus 2024 kemarin, Arie Kriting dan Mamat Alkatiri sempat wara-wiri mempromosikan film 'Kaka Boss' ke sejumlah podcast. Dalam kesempatan itu, Kemal menanyakan strategi keduanya dalam rangka mengalahkan marketing film 'Agak Laen'. "" Suami Nafha Firah tersebut menantang Arie Kriting untuk menggelar sesi live TikTok di rumah ibunda Indah Permatasari, Nursyah, jika jumlah penonton 'Kaka Boss' tembus 1 juta orang. "" Kalau mereka (pemain 'Agak Laen') ada nazar kan, kalau berapa juta (penonton) jadi manusia silver. Dia tampak sedikit panik seraya menegur kerabatnya yang dianggap sesumbar berbicara. "" Itu bukan tantangan, itu jerumusan,"" ucap Arie Kriting. Perihal itu, sejumlah netizen turut memberikan respons dan komentar yang beragam. "" Dua juta penonton, Bang Arie main DJ kompor juga,"" kata netizen lain. "" Mukanya Bang Arie pucet banget tuh,"" tutur netizen yang lainnya."
Bruno Mars Tambah Jadwal Konser di Jakarta Jadi 3 Hari,Entertainment,2024-08-30,Fabiola Febrinastri,https://www.suara.com/entertainment/2024/08/30/153953/bruno-mars-tambah-jadwal-konser-di-jakarta-jadi-3-hari,"Hari ini, Live Nation, TEM Presents, dan PK Entertainment dengan bangga mengumumkan bahwa pembuat hit yang tak terhentikan dan artis peraih 14 penghargaan GRAMMY, Bruno Mars, resmi menambahkan konser ketiga untuk ""Bruno Mars Live in Jakarta 2024"". Awalnya dijadwalkan tampil di Jakarta pada Jumat, 13 September dan Sabtu, 14 September. Kini, Bruno Mars juga akan tampil pada hari Rabu, 11 September 2024. Tiket Presale Mandiri untuk tanggal 13 dan 14 September telah sepenuhnya terjual. Penjualan Umum untuk ketiga jadwal konser akan dilangsungkan pada hari Sabtu, 29 Juni 2024 mulai pukul 10:00 WIB (Waktu Lokal Jakarta) hanya di brunomarsinjakarta.com.Paket VIP juga tersedia di vip.livenation.asia. Informasi Lengkap Bruno Mars Live in Jakarta: Jadwal Penjualan Tiket General On-sale (untuk semua pertunjukan)","Hari ini, Live Nation, TEM Presents, dan PK Entertainment dengan bangga mengumumkan bahwa pembuat hit yang tak terhentikan dan artis peraih 14 penghargaan GRAMMY, Bruno Mars, resmi menambahkan konser ketiga untuk ""Bruno Mars Live in Jakarta 2024"". Tiket Presale Mandiri untuk tanggal 13 dan 14 September telah sepenuhnya terjual. Penjualan Umum untuk ketiga jadwal konser akan dilangsungkan pada hari Sabtu, 29 Juni 2024 mulai pukul 10:00 WIB (Waktu Lokal Jakarta) hanya di brunomarsinjakarta.com. Paket VIP juga tersedia di vip.livenation.asia."
Tiket Secret Number: pasSworLd Concert di Tennis Indoor Senayan Nyaris Sold Out,Entertainment,2024-08-30,Fabiola Febrinastri,https://www.suara.com/entertainment/2024/08/30/151949/tiket-secret-number-passworld-concert-di-tennis-indoor-senayan-nyaris-sold-out,"Tiket pertunjukan konser Secret Number: pasSworLd Concert yang akan digelar di Tennis Indoor Senayan, Jakarta pada 28 September 2024 mendatang nyaris terjual habis. Tiket yang dijual melalui aplikasi TipTip tersebut mulai diserbu penggemar. Tiket untuk kategori Platinum, Silver A dan Bronze Middle bahkan sudah terjual habis dan kategori lainnya juga bergerak cepat, memperlihatkan animo dan antusiasme tinggi para penggemar setia di Indonesia yang ingin berjumpa dan menyaksikan langsung aksi serunya. TipTip, platform entertainment lengkap dengan beragam fitur yang memfasilitasi berbagai acara dan kegiatan gathering menggagas kolaborasi istimewa dengan Chan Entertainment, perusahaan entertainment dari Korea, menghadirkan Secret Number, sebuah grup vokal idola perempuan multinasional asal Korea Selatan dibawah naungan VINE Entertainment dalam sebuah konser tunggal. Grup K-Pop dengan basis penggemar sebanyak lebih dari 1 juta di Indonesia dan terdiri dari penyanyi Léa, Dita, Jinny, Soodam, Minji dan Zuu ini akan tampil membawakan langsung lagu-lagu hits populer mereka di pasSworLd Concert.“Penggemar akan menyaksikan spektrum yang lebih luas dari Secret Number saat mereka menjajaki panggung internasional. Konser solo di Indonesia merupakan tanda penting yang menunjukkan awal dari perjalanan besar Secret Number,” Chan Entertainment menjelaskan. Penyanyi anggota Secret Number yang berdarah Indonesia, Dita Karang, mewakili grupnya mengaku sangat senang bisa mengumumkan akan mengadakan konser solo pertama di Indonesia. “Selain itu, ada tamu spesial yang akan bergabung dengan kami di konser. Siapa lagi kalau bukan..Tiara Andini! Tidak hanya itu, kami juga memiliki kejutan menarik lainnya untuk kalian semua di konser, jadi jangan lupa amankan tiket konser ""pasSworLd"" Secret Number,” ucapnya. Dalam konser ini, salah satu kejutan spesial adalah kolaborasi Secret Number dengan penyanyi Tiara Andini. Sesuai keinginan Secret Number yang pernah disampaikan saat kunjungan tahun lalu ke Indonesia, maka di kesempatan pasSworLd Concert yang digelar September mendatang, Tiara Andini diminta secara khusus untuk jadi penampil pembuka konser. Sementara itu, Chief Executive Officer (CEO) TipTip, Albert Lucius menuturkan bahwa TipTip sebagai platform entertainment yang menghadirkan serangkaian fitur komprehensif dan selalu mengikuti maraknya tren entertainment di kalangan anak muda Indonesia, terutama Gen Z dan Milenial sekaligus memberikan wadah bagi para penonton untuk ikut serta menikmati karya-karya keren dan berkualitas, kali ini menggagas kolaborasi pertunjukan hiburan antara Indonesia dan Korea Selatan, dengan mempersembahkan konser solo grup K-Pop idola, Secret Number, bertajuk pasSworLd Concert.“TipTip memberdayakan fans melalui berbagai fitur dan program, salah satunya dengan menggelar konser ini dimana fans berkesempatan untuk bertemu, menyaksikan dan engage dengan idola mereka, dalam kesempatan ini adalah Secret Number,” lanjut Albert.","Tiket pertunjukan konser Secret Number: pasSworLd Concert yang akan digelar di Tennis Indoor Senayan, Jakarta pada 28 September 2024 mendatang nyaris terjual habis. Tiket yang dijual melalui aplikasi TipTip tersebut mulai diserbu penggemar. Tiket untuk kategori Platinum, Silver A dan Bronze Middle bahkan sudah terjual habis dan kategori lainnya juga bergerak cepat, memperlihatkan animo dan antusiasme tinggi para penggemar setia di Indonesia yang ingin berjumpa dan menyaksikan langsung aksi serunya. “Penggemar akan menyaksikan spektrum yang lebih luas dari Secret Number saat mereka menjajaki panggung internasional. Konser solo di Indonesia merupakan tanda penting yang menunjukkan awal dari perjalanan besar Secret Number,” Chan Entertainment menjelaskan. Selain itu, ada tamu spesial yang akan bergabung dengan kami di konser. Sementara itu, Chief Executive Officer (CEO) TipTip, Albert Lucius menuturkan bahwa TipTip sebagai platform entertainment yang menghadirkan serangkaian fitur komprehensif dan selalu mengikuti maraknya tren entertainment di kalangan anak muda Indonesia, terutama Gen Z dan Milenial sekaligus memberikan wadah bagi para penonton untuk ikut serta menikmati karya-karya keren dan berkualitas, kali ini menggagas kolaborasi pertunjukan hiburan antara Indonesia dan Korea Selatan, dengan mempersembahkan konser solo grup K-Pop idola, Secret Number, bertajuk pasSworLd Concert."
"Serius Penjarakan Pemfitnah, Aaliyah Massaid dan Thariq Halilintar Datangi Polda Metro Jaya",Entertainment,2024-08-30,Ferry Noviandi,https://www.suara.com/entertainment/2024/08/30/150117/serius-penjarakan-pemfitnah-aaliyah-massaid-dan-thariq-halilintar-datangi-polda-metro-jaya,"Aaliyah Massaid akhirnya menjalani pemeriksaan perdana di Polda Metro Jaya. Tindakan ini sebagai langkah awal atas laporan fitnah hamil di luar nikah oleh beberapa akun media sosial. Aaliyah Massaid didampingi Thariq Halilintar masuk ke gedung Direktorat Reserse Kriminal Umum (Ditreskrimum), Jumat 30 Agustus 2024 sekitar pukul 14.17 WIB. Keduanya pamer senyum bahkan saat turun dari mobil. Tak hanya full senyum, pasangan yang baru menikah ini juga tampil dengan baju warna senada, putih. Mereka tak banyak bicara dan bergegas masuk. ""Aku naik dulu ya,"" kata Aaliyah Massaid. ""Mari semuanya,"" kata Thariq Halilintar menimpali.Thariq Halilintar kemudian ditanya apakah kesal menghadapi masalah di saat pernikahannya baru dimulai. Adik Atta Halilintar itu masih tersenyum dan pasrah. ""Ya begitulah,"" ucap YouTuber 25 tahun ini. Selain didampingi Thariq Halilintar, Aaliyah Massaid juga ditemani pengacaranya, Sangun Ragahdo. Kuasa hukum Aaliyah Massaid mengatakan, kedatangan mereka untuk mengusut kasus dugaan pencemaran nama baik.""Laporan kami tentang dugaan tindak pidana terkait pasal 27A, juncto pasal 45 ayat 4 dan garis miring atau pasal 310 311 315 KUHP,"" kata Sangun Ragahdo.","Aaliyah Massaid akhirnya menjalani pemeriksaan perdana di Polda Metro Jaya. Tindakan ini sebagai langkah awal atas laporan fitnah hamil di luar nikah oleh beberapa akun media sosial. Keduanya pamer senyum bahkan saat turun dari mobil. Tak hanya full senyum, pasangan yang baru menikah ini juga tampil dengan baju warna senada, putih. Mereka tak banyak bicara dan bergegas masuk. "" Ya begitulah,"" ucap YouTuber 25 tahun ini. Selain didampingi Thariq Halilintar, Aaliyah Massaid juga ditemani pengacaranya, Sangun Ragahdo."
"Kondisi Terkini Sid Wilson Slipknot Usai Insiden Api Unggun, Bengkak di Wajah Mulai Kempes",Entertainment,2024-08-30,Yazir Farouk,https://www.suara.com/entertainment/2024/08/30/135631/kondisi-terkini-sid-wilson-slipknot-usai-insiden-api-unggun-bengkak-di-wajah-mulai-kempes,"Sid Wilson, salah satu personel Slipknot mengungkap kondisi terkini usai alami insiden api unggun di rumahnya. Dalam wawancara dengan Fox News baru-baru ini, Wilon mengatakan bahwa luka yang didapat cukup parah, khususnya di bagian wajah dan lengan. ""Seluruh lengan kanan gue dibalut, setengah dari lengan kiriku juga. Wajah gue meleleh dari hidung ke bawah,"" kata Sid dikutip Jumat 30 Agustus 2024. Tapi betuntung kata Wilson, pembengkakan di wajahnya mulai mereda.""Dokter bilang wajah itu memang luar biasa karena bsia beregenerasi dengan cepat,"" ujar personel Slipknot di bagian DJ dan kibor ini. Dalam wawancara tersebut, pacar Kelly Osbourne ini juga menceritakan bagaiaman peristiwa nahas itu terjadi. Semula, pada suatu malam, Wilson membakar tumpukan kayu. Esok harinya, dia memeriksa seberapa banyak kayu yang tersisa. ""Masih ada sisa-sisanya, jadi gue, kayak orang bodoh, melakukan apa yang seharusnya nggak gue lakuin. Gue menambahkan sedikit bensin,"" kata Wilson. Sid Wilson lantas mencari ranting panjang untuk menyalakan lagi dari jarak yang aman. Hanya saja, dia tak menemukan ranting yang dimaksud.""Jadi gue emang nggak sabaran orangnya. Gue mikir 'Ah gua bakal baik-baik saja',"" ujarnya. ""Gue jongkok dan menjulurkan tangan untuk menyalakannya, dan tiba-tiba saja... booom. Ledakan!,"" sambungnya. Sebelumnya, Sid Wilson membagikan kabar mengejutkan kalau wajah dan lengannya terbakar. Dalam video yang diunggah, dia tengah berada di rumah sakit. Alis dan kumisnya terbakar. Sementara kondisi wajah dan lengannya juga terlihat memprihatinkan. Meski alami cedera serius, Wilson memastikan kalau dia akan tetap manggung bersama Slipknot yang saat ini lagi lakoni tur 25 tahun album debut mereka. ""Nggak peduli apapun yang terjadi. Gue akan lihat kalian di tur,"" ujar Wilson menenangkan penggemarnya.","Sid Wilson, salah satu personel Slipknot mengungkap kondisi terkini usai alami insiden api unggun di rumahnya. Dalam wawancara dengan Fox News baru-baru ini, Wilon mengatakan bahwa luka yang didapat cukup parah, khususnya di bagian wajah dan lengan. "" Seluruh lengan kanan gue dibalut, setengah dari lengan kiriku juga. Semula, pada suatu malam, Wilson membakar tumpukan kayu. Sid Wilson lantas mencari ranting panjang untuk menyalakan lagi dari jarak yang aman. Hanya saja, dia tak menemukan ranting yang dimaksud. Gue mikir 'Ah gua bakal baik-baik saja',"" ujarnya. "" Gue jongkok dan menjulurkan tangan untuk menyalakannya, dan tiba-tiba saja... booom. Sementara kondisi wajah dan lengannya juga terlihat memprihatinkan. Gue akan lihat kalian di tur,"" ujar Wilson menenangkan penggemarnya."
"Sempat Minta Ditunda, Aaliyah Massaid dan Thariq Halilintar Pastikan Hadir Pemeriksaan Kasus Hoaks Hamil Duluan",Entertainment,2024-08-30,Sumarni,https://www.suara.com/entertainment/2024/08/30/122830/sempat-minta-ditunda-aaliyah-massaid-dan-thariq-halilintar-pastikan-hadir-pemeriksaan-kasus-hoaks-hamil-duluan,"Polda Metro Jaya kembali mengundang Aaliyah Massaid untuk memberikan keterangan atas laporan hoaks hamil duluan pada hari ini, Jumat 30 Agustus 2024. Ia dipastikan hadir setelah sempat meminta pemeriksaan ditunda. ""Setelah salat Jumat ya,"" ujar kuasa hukum Aaliyah Massaid, Ragahdo Yosodiningrat saat dikonfirmasi tim lewat pesan singkat. Sebelumnya, Polda Metro Jaya menjadwalkan pemanggilan Aaliyah Massaid pada Kamis 29 Agustus 2024. Namun di hari itu, sang artis berhalangan hadir. ""Aalnya masih di luar kota,"" terang Ragahdo Yosodiningrat kemarin.Ketidakhadiran Aaliyah Massaid membuat jadwal pemanggilan Thariq Halilintar ikut ditunda ke hari ini. Sama seperti Aaliyah, Thariq juga akan dimintai keterangan terkait laporan yang diadukan sang istri. Thariq Halilintar pun juga sudah memberikan konfirmasi kehadiran untuk agenda pemeriksaan hari ini. ""Rencananya ikut hadir,"" kata Ragahdo Yosodiningrat. Sebagaimana diketahui, Aaliyah Massaid melaporkan hoaks hamil duluan ke Polda Metro Jaya pada Kamis 22 Agustus 2024. Ada dua akun TikTok dan satu akun YouTube yang Aaliyah polisikan. ""Saudara AM melihat ada dua akun TikTok dan satu akun YouTube yang menjelaskan bahwa pelapor hamil di luar nikah. Padahal menurut pelapor, sampai saat ini dia tidak hamil,"" papar Kabid Humas Polda Metro Jaya, Kombes Ade Ary Syam Indradi, Senin 26 Agustus 2024.Aaliyah Massaid merasa diserang kehormatannya lewat hoaks tersebut. Pasalnya, banyak yang percaya dengan isu dirinya hamil di luar nikah hingga berdampak ke beban psikis. ""Hal tersebut membuat pelapor malu dan merasa terserang kehormatannya sebagai seorang wanita,"" jelas Ade Ary Syam Indradi. Dalam laporan Aaliyah Massaid, pemilik akun-akun tersebut dikenakan Pasal 27A jo Pasal 45 ayat (4) UU ITE dan atau Pasal 310, Pasal 311 dan Pasal 315 KUHP.","Polda Metro Jaya kembali mengundang Aaliyah Massaid untuk memberikan keterangan atas laporan hoaks hamil duluan pada hari ini, Jumat 30 Agustus 2024. Namun di hari itu, sang artis berhalangan hadir. "" Aalnya masih di luar kota,"" terang Ragahdo Yosodiningrat kemarin. Ketidakhadiran Aaliyah Massaid membuat jadwal pemanggilan Thariq Halilintar ikut ditunda ke hari ini. Sama seperti Aaliyah, Thariq juga akan dimintai keterangan terkait laporan yang diadukan sang istri. Ada dua akun TikTok dan satu akun YouTube yang Aaliyah polisikan. "" Padahal menurut pelapor, sampai saat ini dia tidak hamil,"" papar Kabid Humas Polda Metro Jaya, Kombes Ade Ary Syam Indradi, Senin 26 Agustus 2024.Aaliyah Massaid merasa diserang kehormatannya lewat hoaks tersebut. Hal tersebut membuat pelapor malu dan merasa terserang kehormatannya sebagai seorang wanita,"" jelas Ade Ary Syam Indradi. Dalam laporan Aaliyah Massaid, pemilik akun-akun tersebut dikenakan Pasal 27A jo Pasal 45 ayat (4) UU ITE dan atau Pasal 310, Pasal 311 dan Pasal 315 KUHP."
"Tampil Serba Pink, Bunga Zainal Penuhi Panggilan Polisi Terkait Kasus Penipuan Rp15 Miliar",Entertainment,2024-08-30,Yazir Farouk,https://www.suara.com/entertainment/2024/08/30/112132/tampil-serba-pink-bunga-zainal-penuhi-panggilan-polisi-terkait-kasus-penipuan-rp15-miliar,"Artis Bunga Zainal dijadwalkan diperiksa penyidik Polda Metro Jaya terkait laporannya atas kasus dugaan penipuan ivestasi senilai Rp15 miliar, hari ini, Jumat 30 Agustus 2024. Bunga Zainal tiba di Polda Metro Jaya sekitar pukul 10.25 WIB. Dia tampil cantik dengan busana pink menyala. Tak sendiri, artis 37 tahun ini didampingi sang pengacara, Muhammad Zaky Rabbani. ""Alhamdulilah, doain ya semoga lancar ya,"" kata Bunga Zainal menjawab sapaan awak media setibanya di sana.Bunga Zainal tak berkata banyak mengenai kedatangannya. Ia meminta awak media menunggu sejenak untuk pemeriksaan. ""Tungguin sebentar ya,"" kata Bunga Zainal. Sebagai informasi, Bunga Zainal menjadi korban dugaan penipuan investasi Rp15 miliar. Kasus ini sudah dilaporkan ke Polda Metro Jaya pada Kamis 22 Agustus 2024. Sosok yang kemudian dicurigai sebagai pelaku adalah dua teman Bunga Zainal yang berdomisili di Bali. Kasus ini bermula saat Bunga Zainal mengenal dua orang tersebut pada 2020. Ia ditawari untuk berinvetasi senilai Rp6,2 miliar.Setelah kerjasama berjalan, Bunga Zainal juga diminta untuk mengajak suaminya ikut berinvestasi. Sampai akhirnya sang suami menggelontorkan Rp 6,5 miliar. Namun ternyata, perjalanan bisnis ini tidak berlangsung lancar. Hingga akhirnya Bunga Zainal menyadari adanya dugaan penipuan tersebut.","Artis Bunga Zainal dijadwalkan diperiksa penyidik Polda Metro Jaya terkait laporannya atas kasus dugaan penipuan ivestasi senilai Rp15 miliar, hari ini, Jumat 30 Agustus 2024. Bunga Zainal tiba di Polda Metro Jaya sekitar pukul 10.25 WIB. Tak sendiri, artis 37 tahun ini didampingi sang pengacara, Muhammad Zaky Rabbani. "" Alhamdulilah, doain ya semoga lancar ya,"" kata Bunga Zainal menjawab sapaan awak media setibanya di sana. Bunga Zainal tak berkata banyak mengenai kedatangannya. Sosok yang kemudian dicurigai sebagai pelaku adalah dua teman Bunga Zainal yang berdomisili di Bali. Ia ditawari untuk berinvetasi senilai Rp6,2 miliar. Setelah kerjasama berjalan, Bunga Zainal juga diminta untuk mengajak suaminya ikut berinvestasi. Namun ternyata, perjalanan bisnis ini tidak berlangsung lancar."
"Jennifer Coppen Tahan Tangis saat Bikin Kue Ultah untuk Kamari, Nyesek!",Entertainment,2024-08-30,Sumarni,https://www.suara.com/entertainment/2024/08/30/093633/jennifer-coppen-tahan-tangis-saat-bikin-kue-ultah-untuk-kamari-nyesek,"Putri Jennifer Coppen dan mendiang Dali Wassink, Kamari Sky Wassink ulang tahun yang pertama pada 28 Agustus 2024 lalu. Ultah Kamari bertepatan dengan 40 hari meninggalnya Papa Dali. Diketahui Jennifer Coppen bikin sendiri kue ultah untuk sang putri. Hal itu terlihat di akun TikTok pribadinya yang diunggah kemarin, Kamis 29 Agustus 2024. Di situ, Jennifer Coppen terlihat membuat adonan hingga menghiasi birthday cake Kamari. Jennifer Coppen tak sendirian saat membuat kue. Aktris cantik berusia 23 tahun itu tampak ditemani oleh ibunda dari Dali dan Zoe Wassink, adik Dali. Namun jelang akhir video, Jennifer Coppen tampak menahan tangisnya.Tangis Jennifer Coppen hampir pecah saat menghiasi kue ultah Kamari dengan buah strawberry. Zoe Wassink pun tampak memeluk Jennifer dari belakang untuk menguatkannya. Video Jennifer Coppen tahan tangis saat bikin kue ultah untuk Kamari ini diunggah ulang di akun gosip. Netizen ikutan nyesek melihat video ini dan berdoa semoga Jennifer selalu kuat. ""Lihat begini aja gue ikutan nangiss. Kuaat yaa mamari hebat!"" kata netizen menguatkan. ""Sumpah ya, gue liat videonya ya, walau gue bukan fansnya sumpah nyesek dan sedih banget. Tetap semangat,"" warganet lain menimpali. ""Gak kerasa ikutan mewek,"" ujar warganet.""Sakitnya kerasa sampe sini,"" ujar lainnya. Sementara itu, Jennifer Coppen sempat mengunggah video mengharukan di ultah putrinya. Jennifer menyebut kelahiran Kamari mengubah hidupnya dan Papa Dali. Dali Wassink meninggal dunia pada 18 Juli 2024. Meski Papa Dali sudah tidak ada di dunia ini untuk menemani Kamari di hari ultahnya, Jennifer bersaksi kalau Papa Dali sayang banget sama Kamari. ""Selamat ulang tahun, Kamari Sky Wassink. 28 Agustus 2023 adalah hari kamu mengubah hidupku dan ayahmu,"" kata Jennifer Coppen di Instagram pada 28 Agustus 2024. ""Aku tahu ulang tahun ini bukan yang kita harapkan, tapi ketahuilah bahwa kamu sangat disayang Kamari, olehku dan papamu. Mama akan jadi saksi kalau papa kamu sangat sangat menyayangi kamu. Papa sekarang sudah bahagia di surga menjaga kita dari sana,"" lanjut Jennifer Coppen. Jennifer Coppen berharap Kamari menjadi anak yang kuat dan berbakti pada orang tua. Aktris cantik kelahiran tahun 2001 ini mengingatkan Kamari untuk jangan pernah merasa sendiri. ""Kamari tumbuhlah menjadi anak yang kuat dan berbakti untuk kedua orang tua ya, Nak. Kamari jangan pernah merasa sendiri.. mama selalu ada di sini begitupun juga papa,"" ujar Jennifer Coppen. ""Terima kasih Kamari .. kamu menyelamatkan hidupku. Terima kasih sudah hadir di dunia ini. Selamat ulang tahun Nak, mama sangat mencintaimu. Cintai aku dan ayahmu @dali.wassink,"" tutupnya. Kontributor : Yoeni Syafitri Sekar","Putri Jennifer Coppen dan mendiang Dali Wassink, Kamari Sky Wassink ulang tahun yang pertama pada 28 Agustus 2024 lalu. Tangis Jennifer Coppen hampir pecah saat menghiasi kue ultah Kamari dengan buah strawberry. Zoe Wassink pun tampak memeluk Jennifer dari belakang untuk menguatkannya. Netizen ikutan nyesek melihat video ini dan berdoa semoga Jennifer selalu kuat. "" Sumpah ya, gue liat videonya ya, walau gue bukan fansnya sumpah nyesek dan sedih banget. ""Sakitnya kerasa sampe sini,"" ujar lainnya. Sementara itu, Jennifer Coppen sempat mengunggah video mengharukan di ultah putrinya. Dali Wassink meninggal dunia pada 18 Juli 2024. Meski Papa Dali sudah tidak ada di dunia ini untuk menemani Kamari di hari ultahnya, Jennifer bersaksi kalau Papa Dali sayang banget sama Kamari. "" 28 Agustus 2023 adalah hari kamu mengubah hidupku dan ayahmu,"" kata Jennifer Coppen di Instagram pada 28 Agustus 2024. "" Aku tahu ulang tahun ini bukan yang kita harapkan, tapi ketahuilah bahwa kamu sangat disayang Kamari, olehku dan papamu. Jennifer Coppen berharap Kamari menjadi anak yang kuat dan berbakti pada orang tua. Aktris cantik kelahiran tahun 2001 ini mengingatkan Kamari untuk jangan pernah merasa sendiri. "" Terima kasih Kamari .. kamu menyelamatkan hidupku. Selamat ulang tahun Nak, mama sangat mencintaimu."
