title,category,publish_date,author,article_url,content,summary
"9 Potret Artis di Resepsi Thariq Halilintar dan Aaliyah Massaid, Syifa Hadju Curi Perhatian",Entertainment,2024-07-27,Ferry Noviandi,https://www.suara.com/entertainment/2024/07/27/211500/9-potret-artis-di-resepsi-thariq-halilintar-dan-aaliyah-massaid-syifa-hadju-curi-perhatian,"Pernikahan Thariq Halilintar dan Aaliyah Massaid yang digelar kemarin, Jumat 26 Juli 2024 di Raffles Hotel, Jakarta Selatan masih ramai diperbincangkan. Tidak hanya soal akad nikah di pagi harinya, acara resepsi di malam harinya juga curi atensi karena bertabur bintang. Ya, banyak sekali rekan artis yang hadir di acara resepsi putri Reza Artamevia tersebut. Bila akad nikah mengusung adat Jawa, Thariq Halilintar dan Aaliyah Massaid memakai adat Minang saat resepsi. Akad nikah berlangsung lancar dengan dua tokoh penting menjadi saksi yakni Presiden Joko Widodo dan Ketua MPR RI, Bambang Soesatyo. Thariq meminang Aaliyah dengan mas kawin senilai Rp 26.072.024. Lalu siapa saja tamu undangan yang hadir di acara resepsi dari adik Atta Halilintar ini? Yuk kita kepoin bareng foto-fotonya di bawah Ini.Simak potret artis di resepsi Thariq Halilintar dan Aaliyah Massaid yang dilansir dari akun Instagram mereka masing-masing! Check this out! 1. Nagita Slavina dipuji selangit saat menghadiri acara resepsi Thariq dan Aaliyah. Istri Raffi Ahmad ini curi perhatian saat memakai hijab dan outfit nuansa putih. 2. Cantiknya Tissa Biani saat menghadiri resepsi Aaliyah Massaid. Kekasih Dul Jaelani ini makin menawan dalam balutan dress indah, makeup yang flawless, dan rambut yang digerai. 3. Gisella Anastasia tampil cantik dalam balutan dress putihnya saat hadir ke resepsi. Ini potretnya dengan Marsha Aruan yang juga curi atensi dengan kebaya nuansa cokelat. 4. Shireen Sungkar hadir ke resepsi bersama Zaskia Sungkar. Kakak beradik ini tampak anggun dalam balutan outfit dengan hijab warna senada. Shireen dengan dress putih, sementara Zaskia memilih nuansa nude.5. Pasangan seleb Audy Item dan Iko Uwais juga menghadiri resepsi Thariq Halilintar. Iko Uwais tampak gagah dengan jas abu-abunya, sementara Audy tampil cantik dalam outfit hitam motif bunga. 6. Cantiknya Cinta Laura saat berpose bersama kedua mempelai di acara resepsi. Outfit nuansa emas yang dikenakannya membuat kecantikan aktris berusia 30 tahun ini makin terpancar. 7. Yoriko Angeline membagikan potretnya bersama Luna Maya di acara resepsi pernikahan Thariq dan Aaliyah. Keduanya sama-sama terlihat anggun dan menawan dalam balutan busana masing-masing. 8. Jessica Mila begitu anggun saat memakai busana hitam dan rambut yang ditata ala sanggul sederhana. Istri Yakup Hasibuan ini tampak tersenyum lebar saat berpose bersama kedua mempelai di pelaminan. 9. Teka-teki gandengan El Rumi di pernikahan Thariq yang bikin penasaran netizen akhirnya terjawab dengan hadirnya si cantik Syifa Hadju. Ini potret keduanya saat berpose bersama Al Ghazali, Alyssa Daguise, dan Fadil Jaidi. Itu dia beberapa potret artis di resepsi Thariq Halilintar dan Aaliyah Massaid yang bertabur bintang. Adakah artis idolamu di atas? Kontributor : Safitri Yulikhah","Pernikahan Thariq Halilintar dan Aaliyah Massaid yang digelar kemarin, Jumat 26 Juli 2024 di Raffles Hotel, Jakarta Selatan masih ramai diperbincangkan. Tidak hanya soal akad nikah di pagi harinya, acara resepsi di malam harinya juga curi atensi karena bertabur bintang. Ya, banyak sekali rekan artis yang hadir di acara resepsi putri Reza Artamevia tersebut. Akad nikah berlangsung lancar dengan dua tokoh penting menjadi saksi yakni Presiden Joko Widodo dan Ketua MPR RI, Bambang Soesatyo. Yuk kita kepoin bareng foto-fotonya di bawah Ini. Simak potret artis di resepsi Thariq Halilintar dan Aaliyah Massaid yang dilansir dari akun Instagram mereka masing-masing! Istri Raffi Ahmad ini curi perhatian saat memakai hijab dan outfit nuansa putih. Ini potretnya dengan Marsha Aruan yang juga curi atensi dengan kebaya nuansa cokelat. Shireen Sungkar hadir ke resepsi bersama Zaskia Sungkar. Iko Uwais tampak gagah dengan jas abu-abunya, sementara Audy tampil cantik dalam outfit hitam motif bunga. Cantiknya Cinta Laura saat berpose bersama kedua mempelai di acara resepsi. Outfit nuansa emas yang dikenakannya membuat kecantikan aktris berusia 30 tahun ini makin terpancar. Yoriko Angeline membagikan potretnya bersama Luna Maya di acara resepsi pernikahan Thariq dan Aaliyah. Keduanya sama-sama terlihat anggun dan menawan dalam balutan busana masing-masing. Ini potret keduanya saat berpose bersama Al Ghazali, Alyssa Daguise, dan Fadil Jaidi."
"Bukan Cuma Aaliyah, Reza Artamevia dan Zahwa Massaid Pun Kagumi Thariq Halilintar sejak Pertama Bertemu",Entertainment,2024-07-27,Ferry Noviandi,https://www.suara.com/entertainment/2024/07/27/200000/bukan-cuma-aaliyah-reza-artamevia-dan-zahwa-massaid-pun-kagumi-thariq-halilintar-sejak-pertama-bertemu,"Pernikahaan Aaliyah Massaid dan Thariq Halilintar benar-benar disambut baik oleh keluarganya. Kakak Aaliyah, Zahwa Massaid sudah yakin Thariq bisa membahagiakan adiknya, bahkan sejak pertama mereka bertemu. ""Aaliyah telah menemukan seseorang yang dapat mencintai dia dengan setulusnya. I mean, Thariq is a great guy (maksudku, Thariq cowok yang hebat),"" kata Zahwa Massaid dalam jumpa pers usai akad nikah Thariq-Aaliya di Raffles Hotel, Kuningan, Jakarta Selatan, Jumat 26 Juli 2024. Keyakinan Zahwa Massaid muncul gara-gara Thariq Halilintar langsung mengutarakan niatnya untuk serius dengan Aaliyah Massaid di momen saat mereka bertemu. ""Oh iya, sudah ngobrol. Aku sudah ketemu Thariq waktu itu. Pertama kali ketemu Thariq, dia langsung ngomong bahwa mau serius sama adik saya. Jadi dari hal-hal itu, saya udah menantikan ini,"" ujar Zahwa Massaid.Kesan positif juga dirasakan Reza Artamevia saat pertama bertemu Thariq Halilintar. Sang diva bahkan tak butuh waktu lama untuk menemukan kenyamanan dalam berbincang dengan Thariq. ""Di awal kami bertemu, dia sangat humble, rendah hati dan hangat. Dia cerita seperti apa perjalanan hidupnya dan saya seneng ngobrol sama dia,"" imbuh Reza Artamevia. Di luar pembawaannya yang hangat, Reza Artamevia juga melihat sosok Thariq Halilintar bisa bertanggung jawab untuk memimpin rumah tangganya bersama Aaliyah Massaid. ""Dia kan memulai segala sesuatu dari nol, jadi dia gigih dan bisa bertanggung jawab. Terus imannya terlihat baik,"" tutur Reza Artamevia memuji. Sebagaimana diketahui, Thariq Halilintar meminang Aaliyah Massaid dengan mas kawin uang tunai Rp26.072.024 dalam prosesi akad nikah kemarin. Mahar itu menggambarkan tanggal pernikahan mereka berdua.Akad nikah Thariq Halilintar dan Aaliyah Massaid juga melibatkan dua tokoh penting bangsa sebagai saksi. Mereka adalah Presiden Republik Indonesia, Joko Widodo serta Ketua MPR RI, Bambang Soesatyo.","Pernikahaan Aaliyah Massaid dan Thariq Halilintar benar-benar disambut baik oleh keluarganya. Keyakinan Zahwa Massaid muncul gara-gara Thariq Halilintar langsung mengutarakan niatnya untuk serius dengan Aaliyah Massaid di momen saat mereka bertemu. "" Sang diva bahkan tak butuh waktu lama untuk menemukan kenyamanan dalam berbincang dengan Thariq. "" Di awal kami bertemu, dia sangat humble, rendah hati dan hangat. Dia cerita seperti apa perjalanan hidupnya dan saya seneng ngobrol sama dia,"" imbuh Reza Artamevia. Dia kan memulai segala sesuatu dari nol, jadi dia gigih dan bisa bertanggung jawab. Sebagaimana diketahui, Thariq Halilintar meminang Aaliyah Massaid dengan mas kawin uang tunai Rp26.072.024 dalam prosesi akad nikah kemarin. Mahar itu menggambarkan tanggal pernikahan mereka berdua. Mereka adalah Presiden Republik Indonesia, Joko Widodo serta Ketua MPR RI, Bambang Soesatyo."
"Sabet Penghargaan Festival Film Bandung, Indah Permatasari Ungkap Honor Debut Akting",Entertainment,2024-07-27,Ferry Noviandi,https://www.suara.com/entertainment/2024/07/27/175500/sabet-penghargaan-festival-film-bandung-indah-permatasari-ungkap-honor-debut-akting,"Indah Permatasari ternyata sudah 14 tahun besar sebagai bintang film. Dari belasan judul, istri Arie Kriting ini sudah menyabet penghargaan di Festival Film Bandung. Indah Permatasari menerima penghargaan di Festival Film Bandung, saat membintangi judul Rudy Habibie. Apresiasi hadir lewat kemenangan sebagai Pemeran Pembantu Wanita Terpuji Film Bioskop. ""Di film ini aku juga banyak belajar. Karena ada nama-nama besar,"" kata Indah Permatasari saat berkunjung ke kantor di Kuningan, Jakarta Selatan, baru-baru ini. Kala itu Indah Permatasari merasa, apakah dirinya pantas bersanding dengan jejeran pemain besar seperti Reza Rahadian, Chelsea Islan, Ernest Prakasa, Pandji Pragiwaksono, dan lainnya.""Banyak nama-nama besar, sedangkan aku dari sinetron, main film, ada rasa, 'gue bisa enggak sih?'"" tutur ibu satu anak tersebut. Ya, jauh sebelum Indah Permatasari wara-wiri di dunia film, artis kelahiran Makasaar ini lebih dulu memulai karier sebagai bintang sinetron. ""Awalnya itu dari FTV Hidayah, setelah itu casting di MD. Jadi flashback ke siapa aku di situ berproses jadi anak kecilnya,"" ujar Indah Permatasari. Bicara soal debut akting, Indah Permatasari blak-blakan soal bayaran yang didapat. Kala itu di 2011, Indah Permatasari sudah mendapat honor yang lumayan. ""Berapa ya kayaknya tuh sekitar Rp200.000 untuk satu hari syuting,"" imbuh Indah Permatasari.Indah Permatasari mengakui, honor tersebut terbilang cukup besar untuk dirinya pendatang baru. Namun kala itu, gaji bukan menjadi hal utama baginya. ""Waktu itu memang enggak pernah kepikiran untuk honor sih. Tapi ya sudah pengin aja akting, main sama teman-teman,"" ucap bintang film Agak Laen ini. Dari kesungguhan untuk mau belajar, kini tercatat 22 judul film dan 21 sinetron pernah dimainkan oleh Indah Permatasari.","Indah Permatasari ternyata sudah 14 tahun besar sebagai bintang film. Dari belasan judul, istri Arie Kriting ini sudah menyabet penghargaan di Festival Film Bandung. Kala itu Indah Permatasari merasa, apakah dirinya pantas bersanding dengan jejeran pemain besar seperti Reza Rahadian, Chelsea Islan, Ernest Prakasa, Pandji Pragiwaksono, dan lainnya. Awalnya itu dari FTV Hidayah, setelah itu casting di MD. Kala itu di 2011, Indah Permatasari sudah mendapat honor yang lumayan. "" Indah Permatasari mengakui, honor tersebut terbilang cukup besar untuk dirinya pendatang baru. Namun kala itu, gaji bukan menjadi hal utama baginya. "" Waktu itu memang enggak pernah kepikiran untuk honor sih. Tapi ya sudah pengin aja akting, main sama teman-teman,"" ucap bintang film Agak Laen ini."
"Keanu Jalani Prosesi Khusus Relakan Hak Wali Nikah Aaliyah Massaid, Warganet Titip Pesan ke Angelina Sondakh",Entertainment,2024-07-27,Ferry Noviandi,https://www.suara.com/entertainment/2024/07/27/155500/keanu-jalani-prosesi-khusus-relakan-hak-wali-nikah-aaliyah-massaid-warganet-titip-pesan-ke-angelina-sondakh,"Aaliyah Massaid resmi dipersunting oleh Thariq Halilintar dengan sang paman, Mudjie Massaid sebagai wali nikah. Mudjie adalah adik dari mendiang Adjie Massaid, ayah Aaliyah Massaid. Kabar terpilihnya Mudjie Massaid sebagai wali nikah Aaliyah ini sudah tersebar beberapa waktu sebelum akad tersebut digelar. Meski pada saat yang sama, banyak yang mempertanyakan Keanu Massaid. Sebagai adik tiri dari Aaliyah, Keanu dinilai lebih tepat menjadi wali pernikahan Aaliyah. Keanu adalah adik Aaliyah dari pernikahan kedua Adjie Massaid yaitu dengan Angelina Sondakh. Usia Keanu Massaid pun dinilai sudah memenuhi syarat untuk menjadi wali nikah Aaliyah. Hal ini membuat anak Angelina itu harus mengikuti prosesi khusus sebelum Aaliyah dinikahkan dengan Thariq Halilintar.Prosesi itu terkuak dalam unggahan di akun TiKTok @angelinasondakhmassaid. Dilansir pada Sabtu 27 Juli 2024, dengan bantuan penghulu, Keanu dipandu untuk menyerahkan hak wali nikah kepada Mudjie Massaid. ""Keluarga menginginkan yang menjadi wali nikah kan omnya (Mudjie Massaid). Oleh karena itu, nanti dari Keanu, menyerahkan ke Bapak secara syariat,"" kata pengulu pernikahan Aaliyah Massaid. Selanjutnya, Keanu dan Mudjie Massaid membacakan Al Fatihah sebagai bentuk doa. Begitu pula dengan Angelina Sondakh yang berada di sana. Usai pembacaan doa selesai, Keanu mengikuti kalimat yang diucapkan oleh penghulu sembari menjabat tangan Mudjie Massaid. Melalui ucapan tersebut, Keanu menyerahkan hak wali nikahnya kepada sang paman. ""Saya berwakil kepada Om untuk menikahkan kakak saya yang bernama Aaliyah Massaid binti almarhum Bapak Chandra Pratomo Samiadji Massaid dengan maskawin uang sebesar Rp26.072.024,"" kata Keanu.""Saya ikhas, saya ridho, berwakil kepada Om Mudjie,"" kata Keanu menyambung. Momen Keanu menyerahkan hak wali nikah kepada Mudjie Massaid ini membuat publik terharu. Bahkan ada yang menilai bahwa momen seperti ini seharusnya ditayangkan. ""Dokumentasi yang seharusnya ikut disebarluaskan,"" ujar warganet. ""Ini juga haru banget,"" kata yang lain. Ada juga yang berharap Keanu bisa menjadi wali nikah ketika giliran Zahwa Massaid tiba. Harapan itu disampaikan khusus kepada Angelina Sondakh. ""Giliran Zahwa harus Keanu ya Bunda Angie. Saat ini Keanu meskipun sudah baligh tapi memang masih terlalu muda,"" komentar warganet. ""Insya Allah nanti nikahmya Zahwa, Keanu yang jd wali ya, Mami,"" imbuh seorang warganet.","Aaliyah Massaid resmi dipersunting oleh Thariq Halilintar dengan sang paman, Mudjie Massaid sebagai wali nikah. Meski pada saat yang sama, banyak yang mempertanyakan Keanu Massaid. Keanu adalah adik Aaliyah dari pernikahan kedua Adjie Massaid yaitu dengan Angelina Sondakh. Usia Keanu Massaid pun dinilai sudah memenuhi syarat untuk menjadi wali nikah Aaliyah. Dilansir pada Sabtu 27 Juli 2024, dengan bantuan penghulu, Keanu dipandu untuk menyerahkan hak wali nikah kepada Mudjie Massaid. "" Usai pembacaan doa selesai, Keanu mengikuti kalimat yang diucapkan oleh penghulu sembari menjabat tangan Mudjie Massaid. Saya berwakil kepada Om untuk menikahkan kakak saya yang bernama Aaliyah Massaid binti almarhum Bapak Chandra Pratomo Samiadji Massaid dengan maskawin uang sebesar Rp26.072.024,"" kata Keanu. Bahkan ada yang menilai bahwa momen seperti ini seharusnya ditayangkan. "" Dokumentasi yang seharusnya ikut disebarluaskan,"" ujar warganet. "" Ada juga yang berharap Keanu bisa menjadi wali nikah ketika giliran Zahwa Massaid tiba. Harapan itu disampaikan khusus kepada Angelina Sondakh. "" Giliran Zahwa harus Keanu ya Bunda Angie. Saat ini Keanu meskipun sudah baligh tapi memang masih terlalu muda,"" komentar warganet. """
"Bagian Perut Aaliyah Massaid Tampak Menyembul saat Akad Nikah, Isu Hamil Semakin Merebak",Entertainment,2024-07-27,Ferry Noviandi,https://www.suara.com/entertainment/2024/07/27/145826/bagian-perut-aaliyah-massaid-tampak-menyembul-saat-akad-nikah-isu-hamil-semakin-merebak,"Pasangan pengantin baru Aaliyah Massaid dan Thariq Halilintar mendadak ditimpa isu miring. Padahal, mereka sedang berbahagia karena baru saja melangsungkan pernikahan mewah nan meriah. Isunya pun tak main-main. Aaliyah dituding tengah hamil! Isu ini bermula dari ucapan Anang Hermansyah beberapa waktu lalu . Suami Ashanty itu menyeletuk bahwa Thariq Halilintar akan segera menjadi seorang ayah. Hal itu membuat publik berasumsi bahwa Aaliyah Massaid sudah hamil lebih dulu sebelum dinikahi oleh Thariq Halilintar. ""Wih, ganteng banget lu Riq. Hebat. Gitu dong, calon papah,"" ucap Anang Hermansyah sambil menyalami Thariq Halilintar, dikutip dari unggahan TikTok @caramelofficial96.Ternyata rumor ini membuat warganet mengamati bentuk tubuh Aaliyah Massaid saat prosesi akad nikah pada Jumat, 26 Juli 2024, lewat berbagai video yang beredar di media sosial. Salah satunya lewat unggahan @yeyet760/althor yang memperlihatkan momen Aaliyah Massaid dan Thariq Halilintar sedang memamerkan cincin ke para tamu undangan. Dilihat dari samping, di bagian pinggul Aaliyah Massaid memang sedikit menyembul. Sejumlah warganet meyakini bahwa itu adalah baby bump. ""Katanya keluarga haji, tapi lebih ngerti Kak Jenifer, dia enggak mau nikah pas lagi hamil. Malah dia nunggu lahiran dulu baru nikah,"" kata @tika*** menuding. ""Aku cuma nunggu lahiran bulan berapa. Semua akan terjawab,"" imbuh @aqila***.""Kayak udah tiga bulan gitu enggak sih,"" komentar @lesehan***. Namun tak semua warganet setuju dengan tudingan Aaliyah Massaid hamil duluan. Soal perutnya yang tampak menyembul, menurut warganet itu hanya lipatan kain yang ia pakai bersama kebaya. ""Astaga pakai kebaya lho, pasti dibebet perutnya biar kebentuk. Gila itu yang komen pikirannya,"" kata @tannia***. ""Plis lah enggak usah fitnah. Gue bukan fans Aal Thor, tapi ini netizen bener-bener kebangetan,"" komentar @lily***. ""Alhamdulillah ya Aal & Thor panen pahala kalau itu hanya fitnah. Tapi kalau itu benar biar jadi urusan mereka. Masalah dosa dll biar Allah yang maha mengadili,"" imbuh @black_***.","Pasangan pengantin baru Aaliyah Massaid dan Thariq Halilintar mendadak ditimpa isu miring. Padahal, mereka sedang berbahagia karena baru saja melangsungkan pernikahan mewah nan meriah. Isu ini bermula dari ucapan Anang Hermansyah beberapa waktu lalu . Gitu dong, calon papah,"" ucap Anang Hermansyah sambil menyalami Thariq Halilintar, dikutip dari unggahan TikTok @caramelofficial96.Ternyata rumor ini membuat warganet mengamati bentuk tubuh Aaliyah Massaid saat prosesi akad nikah pada Jumat, 26 Juli 2024, lewat berbagai video yang beredar di media sosial. Sejumlah warganet meyakini bahwa itu adalah baby bump. "" Katanya keluarga haji, tapi lebih ngerti Kak Jenifer, dia enggak mau nikah pas lagi hamil. Soal perutnya yang tampak menyembul, menurut warganet itu hanya lipatan kain yang ia pakai bersama kebaya. "" Gue bukan fans Aal Thor, tapi ini netizen bener-bener kebangetan,"" komentar @lily***. "" Alhamdulillah ya Aal & Thor panen pahala kalau itu hanya fitnah. Tapi kalau itu benar biar jadi urusan mereka."
"Aaliyah Massaid dan Thariq Halilintar Menikah di Hari Nabi Adam Diciptakan, Ternyata Banyak Keistimewaannya",Entertainment,2024-07-27,Ferry Noviandi,https://www.suara.com/entertainment/2024/07/27/124000/aaliyah-massaid-dan-thariq-halilintar-menikah-di-hari-nabi-adam-diciptakan-ternyata-banyak-keistimewaannya,"Aaliyah Massaid dan Thariq Halilintar telah resmi menjadi pasangan suami istri. Mereka menyelenggarakan pernikaha mewah nan megah pada Jumat, 26 Juli 2024, di Hotel Raffles Jakarta. Bukan tanpa alasan Aaliyah Massaid dan Thariq Halilintar memilih hari Jumat sebagai hari spesial mereka. Ternyata itu merupakan permintaan langsung dari Reza Artamevia. Ibunda dari Aaliyah Massaid itu berharap mendiang mantan suaminya, Adjie Massaid, turut ""hadir"" dan ""menyaksikan"" pernikahan sang anak bungsu. ""Alhamdulillah, anak-anak juga setuju ikut milih hari Jumat. Mudah-mudahan hari penuh berkah,"" ujar Reza Artamevia setelah akad nikah sang anak.Reza Artamevia menambahkan, ""Hari Jumat kan, insya Allah, katanya para arwah maupun orangtua yang telah pergi mendahului itu diizinkan datang gitu ya, mudah-mudahan."" Selain itu, ternyata menikah di hari Jumat juga memiliki keistimewaan sendiri dalam Islam. Apa saja? Keistimewaan menikah di hari Jumat Berdasarkan laman NU Online, para ulama seperti Syafi'i, Hanbali, dan Maliki, menganjurkan akad nikah dilaksanakan pada Jumat sebagaimana ulama terdahulu melakukannya. Hari Jumat merupakan hari mulia yang dianggap sebagai rajanya hari. Bahkan, Nabi Adam diciptakan pada hari tersebut. Banyak pula peristiwa maupun sejarah Islam lain yang terjadi.""Hari terbaik saat matahari terbit adalah hari Jumat. Di hari ini, Adam diciptakan; di hari ini, beliau dimasukkan ke dalam surga, di hari ini pula, beliau dikeluarkan dari surga. Di hari Jumat terdapat satu waktu, apabila ada seorang hamba yang shalat, memohon kepada Allah di waktu itu, maka Allah akan memberikannya. (HR. Ahmad 10823, Turmudzi 493 dan dishahihkan Syuaib al-Arnauth). Ulama Syafi'i menganjurkan akad nikah sebaiknya dilakukan pada pagi hari di hari Jumat. Ini mengacu pada doa Nabi Muhammad SAW. ""Ya Allah, berkahilah umatku di waktu pagi mereka,"" bunyi doa Rasulullah. Sementara Hanbali menyarankan untuk melakukannya di sore hari agar mendapat keberkahan, seperti sabda Nabi Muhammad yang diriwayatkan Abu Hurairah. ""Lakukanlah perkawinan di sore hari. Karena hal itu lebih besar menarik keberkahan,"" bunyi sabda Nabi Muhammad SAW.","Aaliyah Massaid dan Thariq Halilintar telah resmi menjadi pasangan suami istri. Ternyata itu merupakan permintaan langsung dari Reza Artamevia. Alhamdulillah, anak-anak juga setuju ikut milih hari Jumat. Reza Artamevia menambahkan, ""Hari Jumat kan, insya Allah, katanya para arwah maupun orangtua yang telah pergi mendahului itu diizinkan datang gitu ya, mudah-mudahan."" Keistimewaan menikah di hari Jumat Berdasarkan laman NU Online, para ulama seperti Syafi'i, Hanbali, dan Maliki, menganjurkan akad nikah dilaksanakan pada Jumat sebagaimana ulama terdahulu melakukannya. Hari Jumat merupakan hari mulia yang dianggap sebagai rajanya hari. Banyak pula peristiwa maupun sejarah Islam lain yang terjadi. ""Hari terbaik saat matahari terbit adalah hari Jumat. Di hari ini, Adam diciptakan; di hari ini, beliau dimasukkan ke dalam surga, di hari ini pula, beliau dikeluarkan dari surga. Ahmad 10823, Turmudzi 493 dan dishahihkan Syuaib al-Arnauth). Karena hal itu lebih besar menarik keberkahan,"" bunyi sabda Nabi Muhammad SAW."
Atta Halilintar Sedih Lepas Thariq dan Kini Jadi Suami Aaliyah Massaid:4Tahun Terakhir Selalu Nempel Aku,Entertainment,2024-07-27,Ferry Noviandi,https://www.suara.com/entertainment/2024/07/27/122623/atta-halilintar-sedih-lepas-thariq-dan-kini-jadi-suami-aaliyah-massaid4tahun-terakhir-selalu-nempel-aku,"Atta Halilintar ternyata menyimpan kesedihan di balik kebahagiaannya terhadap pernikahan Thariq Halilintar dan Aaliyah Massaid. Sebagai kakak, Atta mengaku kehilangan sosok Thariq yang kini menjalani hidup dengan Aaliyah. ""Ya pasti lah kehilangan, namanya abang,"" kata Atta Halilintar diacara resepsi Thariq-Aaliya di Raffles Hotel, Kuningan, Jakarta Selatan, Jumat 26 Juli 2024. Atta Halilintar jadi salah satu orang di keluarga Gen Halilintar yang paling sering menghabiskan waktu bersama Thariq Halilintar. Kalau dihitung-hitung, sudah empat tahun belakangan Atta dan Thariq sering berkegiatan bersama. ""Thariq itu empat tahun terakhir selalu nempel aku, sudah kayak perangkonya aku. Meski aku kerja di luar kota, dia itu minta ikut. Kadang walaupun bayarannya seadanya, bahkan kadang juga enggak ada bayarannya, dia tetep ikut. Dulu aja, pas aku honeymoon, dia ikut juga,"" ujar Atta Halilintar.Atta Halilintar juga menceritakan kebiasaan Thariq Halilintar yang mungkin tidak akan ia rasakan lagi setelah sang adik menikah dengan Aaliyah Massaid. ""Dia juga, apa aja yang dikerjain abangnya, dia pengin ikut kerjain juga. Ya ini, tempat nikahnya aja sama kayak saya, saksi nikahnya sama, tim acara sama wedding organizer-nya sama. Jadi dia bener-bener ngikutin saya banget,"" imbuh Atta Halilintar. Kendati demikian, Atta Halilintar tetap menghargai keputusan Thariq Halilintar, yang ingin melanjutkan hidup berdua bersama Aaliyah Massaid. Ia ikhlas melepas sang adik untuk membangun hidup barunya bersama pasangan. ""Ya begini lah, namanya orang mau berumah tangga,"" ucap Atta Halilintar. Thariq Halilintar meminang Aaliyah Massaid dengan mas kawin uang tunai Rp26.072.024. Mahar itu menggambarkan tanggal pernikahan mereka berdua.""Disesuaikan dengan tanggal hari ini aja. Bikin sesuatu yang bisa mengingatkan sama hari ini,"" kata Thariq Halilintar usai akad nikah. Akad nikah Thariq Halilintar dan Aaliyah Massaid turut melibatkan dua tokoh penting bangsa sebagai saksi. Mereka adalah Presiden Republik Indonesia, Joko Widodo serta Ketua MPR RI, Bambang Soesatyo.","Atta Halilintar ternyata menyimpan kesedihan di balik kebahagiaannya terhadap pernikahan Thariq Halilintar dan Aaliyah Massaid. Ya pasti lah kehilangan, namanya abang,"" kata Atta Halilintar diacara resepsi Thariq-Aaliya di Raffles Hotel, Kuningan, Jakarta Selatan, Jumat 26 Juli 2024. Kadang walaupun bayarannya seadanya, bahkan kadang juga enggak ada bayarannya, dia tetep ikut. Atta Halilintar juga menceritakan kebiasaan Thariq Halilintar yang mungkin tidak akan ia rasakan lagi setelah sang adik menikah dengan Aaliyah Massaid. "" Dia juga, apa aja yang dikerjain abangnya, dia pengin ikut kerjain juga. Jadi dia bener-bener ngikutin saya banget,"" imbuh Atta Halilintar. Ia ikhlas melepas sang adik untuk membangun hidup barunya bersama pasangan. "" Thariq Halilintar meminang Aaliyah Massaid dengan mas kawin uang tunai Rp26.072.024. Mahar itu menggambarkan tanggal pernikahan mereka berdua. ""Disesuaikan dengan tanggal hari ini aja. Mereka adalah Presiden Republik Indonesia, Joko Widodo serta Ketua MPR RI, Bambang Soesatyo."
