title,category,publish_date,article_url,content,summary
Suzy Pilih Karakter di 'While You Were Sleeping' Paling Cocok Dengannya,TV,2019-10-01,https://www.wowkeren.com/berita/tampil/00276031.html,"saat ini tengah sibuk mempromosikan drama "","". Aktris kelahiran tahun 1994 itu belum lama ini melakukan wawancara bersama,sembari mendekorasi pigura.,,,Dalam kesempatan itu, Suzy ditanyai karakter drama mana yang paling cocok untuknya. Namun alih-alih memilih karakter Go Hae Ri di ""Vagabond"", mantan kekasih,itu justru memilih karakter Nam Hong Joo di "","".,""Aku punya ikatan khusus dengan semua karakter yang kumainkan,"" jawab Suzy. ""Itu dia. Itulah jawaban standarnya,"" sahut Lee Seung Gi sembari mengulang kembali jawaban Suzy.,""Tapi, sepertinya aku merasa paling cocok dengan Hong Joo yang ada di drama terbaruku, 'While You Were Sleeping',"" sambung Suzy mengingat drama yang ia bintangi pada 2017 lalu bersama,.,,,Suzy selanjutnya menunjukkan reaksi imut untuk mengekspresikan kepribadiannya. ""Aku orangnya biasa menunjukkan reaksi yang baik,"" ungkap Suzy. ""Oh, dia adalah Ratu Reaksi,"" sambung Lee Seung Gi.,Drama ""Vagabond"" yang dibintangi Suzy dan Lee Seung Gi sendiri sebelum ditayangkan memang sudah mengundang antusiasme penonton. Apalagi SBS sengaja menghabiskan biaya mencapai 25 miliar won (sekitar Rp 296 miliar) untuk proses produksi.,Begitu tayang, ""Vagabond"" langsung menuai respon positif begitu juga dengan catatan ratingnya yang menakjubkan. Tak tanggung-tanggung, drama yang juga dibintangi,itu bahkan sudah meraih rating tertinggi 10,3 persen padahal baru tayang 4 episode.","saat ini tengah sibuk mempromosikan drama "","". Aktris kelahiran tahun 1994 itu belum lama ini melakukan wawancara bersama,sembari mendekorasi pigura. Namun alih-alih memilih karakter Go Hae Ri di ""Vagabond"", mantan kekasih,itu justru memilih karakter Nam Hong Joo di "","".,""Aku punya ikatan khusus dengan semua karakter yang kumainkan,"" jawab Suzy. "" ,Drama ""Vagabond"" yang dibintangi Suzy dan Lee Seung Gi sendiri sebelum ditayangkan memang sudah mengundang antusiasme penonton. Apalagi SBS sengaja menghabiskan biaya mencapai 25 miliar won (sekitar Rp 296 miliar) untuk proses produksi. ,Begitu tayang, ""Vagabond"" langsung menuai respon positif begitu juga dengan catatan ratingnya yang menakjubkan. Tak tanggung-tanggung, drama yang juga dibintangi,itu bahkan sudah meraih rating tertinggi 10,3 persen padahal baru tayang 4 episode."
"Dicecar Soal Halangi Enji Ketemu Bilqis, Jawaban Ayu Ting Ting Malah Diledek Seperti Orang Mabuk",Selebriti,2019-10-02,https://www.wowkeren.com/berita/tampil/00276074.html,"Perceraiannya dengan Hendry B. Hendarso alias Enji pada tahun 2014 lalu membuat,menjadi ibu tunggal untuk sang putri semata wayang, Bilqis Khumairah Razak. Namun belum lama ini Enji membuat,mengejutkan bahwa Ayu masih menghalanginya untuk bertemu Bilqis. Sebelumnya Ayu memang telah mengungkap kesiapan untuk mempertemukan Enji dengan Bilqis bila dapat memenuhi,yang ditentukan.,,,Terkait pengakuan Enji tersebut, Ayu malah menarik ucapannya soal mengizinkan sang mantan suami bertemu Bilqis. Pelantun lagu ""Sambalado"" tersebut pun berharap Enji,bertemu dengan putrinya.,Kali ini Ayu kembali dicecar wartawan soal Enji dan Bilqis. Dalam salah satu video yang dibagikan oleh salah satu akun gosip pada Selasa (1/10), Ayu terlihat mengumbar senyum pada wartawan.,""I love you guys,"" kata Ayu saat diberondong pertanyaan soal Enji. ""I love you, I love you, I love you,"" sambung Ayu berulang-ulang mengucapkan kalimat itu sambil bergegas pergi menuju mobilnya.,Ayu yang mengenakan,cantik berwarna hitam itu nampak terburu-buru. Mantan kekasih,itu sempat memperingatkan para wartawan yang mengejarnya untuk berhati-hati. ""Awas jatuh ya, saya enggak mau kalian jatuh,"" ujar Ayu.,Menyerah tak mendapat jawaban soal Enji, salah seorang wartawan terdengar mencoba mengorek soal demo mahasiswa yang belakangan ini terjadi. ""Waw demo, keren!"" seru Ayu sambil mengangkat tangan seolah memberi semangat.,,,Video wawancara Ayu itu langsung menuai reaksi beragam dari netizen. Tak sedikit netter menyikapi sinis sikap Ayu yang ogah diwawancarai itu. Bahkan seorang netter menyebut Ayu seperti orang mabuk hanya karena tidak mau menjawab pertanyaan wartawan.,"",,"" tulis akun,. "",,"" sambung akun,. "",,"" tambah akun,. "",,"" seru akun,. "",,"" imbuh akun,.,Meski demikian, seorang netter memuji sikap Ayu yang enggan berkomentar daripada nantinya malah menimbulkan kontroversi. "",,"" komentar akun,.","Perceraiannya dengan Hendry B. Hendarso alias Enji pada tahun 2014 lalu membuat,menjadi ibu tunggal untuk sang putri semata wayang, Bilqis Khumairah Razak. ,,,Terkait pengakuan Enji tersebut, Ayu malah menarik ucapannya soal mengizinkan sang mantan suami bertemu Bilqis. ,""I love you guys,"" kata Ayu saat diberondong pertanyaan soal Enji. "" ,Ayu yang mengenakan,cantik berwarna hitam itu nampak terburu-buru. Mantan kekasih,itu sempat memperingatkan para wartawan yang mengejarnya untuk berhati-hati. "" Awas jatuh ya, saya enggak mau kalian jatuh,"" ujar Ayu. seru Ayu sambil mengangkat tangan seolah memberi semangat. Tak sedikit netter menyikapi sinis sikap Ayu yang ogah diwawancarai itu. Bahkan seorang netter menyebut Ayu seperti orang mabuk hanya karena tidak mau menjawab pertanyaan wartawan.,"",,"""
Twice Beber Rahasia Tetap Solid dan Beri Kabar Soal Kondisi Mina,Selebriti,2019-10-02,https://www.wowkeren.com/berita/tampil/00276076.html,"minus,menjadi bintang tamu program radio SBS Power FM ""Choi Hwa Jeong's Power Time"" pada Selasa (1/10). Grup besutan JYP Entertainment itu melakukan wawancara dalam rangka promosi,terbaru mereka yang bertajuk ""Feel Special"".,,,Twice membicarakan tentang apa yang membuat mereka sibuk akhir-akhir ini, hobi baru yang mereka nikmati dan banyak lagi. Salah satu pertanyaan menarik yang muncul adalah tentang kerja tim solid, bagaimana mereka mempertahankan persahabatan erat selama 4 tahun terakhir.,,mengatakan bahwa mereka bertekad untuk sukses sejak awal dan jika seseorang memiliki pikiran untuk menjaga hal-hal yang baik, mereka dapat melakukan apa saja untuk mempertahankannya. ""Penting bagi setiap orang dalam grup untuk memiliki sikap yang sama tentang hal itu. Aku yakin selama semua orang mau berusaha keras untuk membuatnya bekerja, itu pasti akan berhasil,"" katanya.,,,,dan,menambahkan bahwa para member benar-benar jujur satu sama lain dan bahwa mereka tidak berusaha menyembunyikan masalah. Kapan pun sesuatu perlu dibicarakan, mereka mendiskusikan dan menyelesaikannya segera untuk menghindari konflik. Mereka juga banyak bicara dan saling memberi pujian dan kata-kata syukur untuk saling mendorong.,""Ya itu betul. Kami cenderung banyak berbicara satu sama lain,"" ujar,. ""Kau tahu, ada hari-hari ketika kau merasa kesal, marah atau sensitif, bukan? Ketika kita menghabiskan sebagian besar waktu kita bersama, kita kadang-kadang menemukan satu sama lain dalam suasana hati yang buruk juga,"" sahut,.,Twice juga memberi kabar soal kondisi Mina. Selama acara fansign mereka di Seocho yang diadakan setelah wawancara radio, mereka mengatakan bahwa Mina baik-baik saja dan bahwa ia dengan senang hati menerima surat penggemar yang dikirimkan kepadanya. Meskipun berhenti dari kegiatan resmi untuk fokus pada pemulihannya, member lain terus meyakinkan penggemar bahwa kondisi Mina membaik.,""Apakah kalian tidak ingin tahu tentang kondisi Mina? Mina baik-baik saja,"" kata Jeongyeon. ""Mina sangat merindukan kalian,"" ujar,. ""Dan dia menerima surat-surat kalian, tolong kirimi dia banyak surat,"" tambah Jeongyeon.,Sementara itu, Twice mencetak rekor baru di minggu pertama penjualan album dengan ""Feel Special"". Penjualan album dengan konsep berbeda ini berhasil melampaui ""Fancy You"". Sebelumnya Twice juga dinobatkan menjadi girl grup K-Pop terlaris di Jepang dengan jumlah penjualan album yang fantastis.","minus,menjadi bintang tamu program radio SBS Power FM ""Choi Hwa Jeong's Power Time"" pada Selasa (1/10). Salah satu pertanyaan menarik yang muncul adalah tentang kerja tim solid, bagaimana mereka mempertahankan persahabatan erat selama 4 tahun terakhir. ,,mengatakan bahwa mereka bertekad untuk sukses sejak awal dan jika seseorang memiliki pikiran untuk menjaga hal-hal yang baik, mereka dapat melakukan apa saja untuk mempertahankannya. "" Penting bagi setiap orang dalam grup untuk memiliki sikap yang sama tentang hal itu. Mereka juga banyak bicara dan saling memberi pujian dan kata-kata syukur untuk saling mendorong. Kau tahu, ada hari-hari ketika kau merasa kesal, marah atau sensitif, bukan? ,Twice juga memberi kabar soal kondisi Mina. Selama acara fansign mereka di Seocho yang diadakan setelah wawancara radio, mereka mengatakan bahwa Mina baik-baik saja dan bahwa ia dengan senang hati menerima surat penggemar yang dikirimkan kepadanya. Meskipun berhenti dari kegiatan resmi untuk fokus pada pemulihannya, member lain terus meyakinkan penggemar bahwa kondisi Mina membaik. ,""Apakah kalian tidak ingin tahu tentang kondisi Mina? Penjualan album dengan konsep berbeda ini berhasil melampaui ""Fancy You""."
Mahasiswa Pendemo di Jakarta Nangis Sesenggukan Sambil Peluk Polisi Gara-Gara Ini,SerbaSerbi,2019-10-01,https://www.wowkeren.com/berita/tampil/00276032.html,"Demonstrasi mahasiswa untuk menolak sejumlah Rancangan Undang-Undang (RUU) kembali digelar pada Senin (30/9) kemarin. Diketahui, aparat kepolisian menembakkan gas air mata untuk membubarkan massa aksi.,,,Gerombolan mahasiswa yang mengenakan almamater tampak berada di sekitar stasiun Palmerah pada sore hari sekitar pukul 17.30 WIB. Gas air mata tersebut membuat salah seorang mahasiswa menangis.,Sementara itu, Kapolres Jakarta Pusat Kombes Harry Kurniawan, mencoba untuk membujuk massa agar mereka membuka akses jalan bagi masyarakat. Kombes Harry meminta agar massa membubarkan diri.,""Kasian ojek online, kasihan orang sakit, enggak bisa lewat sini,"" tutur Kombes Harry. ""Kalau anda dukung masyarakat silakan bubar agar jalan bisa dilewati."",Melansir tayangan,, Kombes Harry berupaya untuk terus melakukan negosiasi. Namun, tak lama kemudian seorang mahasiswa muncul memeluk anggota polisi sambil menangis.,Sambil menangis sesenggukan, mahasiswa tersebut mengucapkan sepatah kata. ""Perih pak,"" ujar mahasiswa tersebut. Tampak sang mahasiswa mengenakan masker dan olesan pasta gigi di sekitar matanya.,Sementara itu, massa mahasiswa akhirnya mau membukakan jalan usai beberapa kali dibujuk. Diketahui, para demonstran menggelar aksi di beberapa titik pada Senin (30/9). Di antaranya adalah Slipi, depan Gedung DPR, hingga kawasan Palmerah.,Massa yang berada di Jalan Gatot Subroto dilaporkan melempari petugas dengan batu. Untuk memukul mundur massa, petugas menembakkan gas air mata serta membentuk barikade dengan tameng dan tongkat.,Di sisi lain, aparat juga sempat,gas air mata ke arah massa yang berada di sekitar Kampus Atma Jaya. Padahal, Kampus Atma Jaya dijadikan sebagai titik posko evakuasi bagi korban luka-luka.,Menurut Kabid Humas Polda Metro Jaya Kombes Pol Argo Yuwono, pihaknya tak bermaksud untuk menembakkan gas air mata ke posko kesehatan tersebut. Argo menjelaskan bahwa aparat menembakkan gas air mata lantaran ada massa di sekitar Kampus Atma Jaya yang melempar batu hingga petasan ke arah petugas.","Demonstrasi mahasiswa untuk menolak sejumlah Rancangan Undang-Undang (RUU) kembali digelar pada Senin (30/9) kemarin. Diketahui, aparat kepolisian menembakkan gas air mata untuk membubarkan massa aksi. ,,,Gerombolan mahasiswa yang mengenakan almamater tampak berada di sekitar stasiun Palmerah pada sore hari sekitar pukul 17.30 WIB. Gas air mata tersebut membuat salah seorang mahasiswa menangis. ,Sementara itu, Kapolres Jakarta Pusat Kombes Harry Kurniawan, mencoba untuk membujuk massa agar mereka membuka akses jalan bagi masyarakat. Kombes Harry meminta agar massa membubarkan diri. Namun, tak lama kemudian seorang mahasiswa muncul memeluk anggota polisi sambil menangis. Tampak sang mahasiswa mengenakan masker dan olesan pasta gigi di sekitar matanya. Di antaranya adalah Slipi, depan Gedung DPR, hingga kawasan Palmerah. Padahal, Kampus Atma Jaya dijadikan sebagai titik posko evakuasi bagi korban luka-luka. Argo menjelaskan bahwa aparat menembakkan gas air mata lantaran ada massa di sekitar Kampus Atma Jaya yang melempar batu hingga petasan ke arah petugas."
KLHK Sebut Perusahaan Tersangka Karhutla Pernah Diproses Hukum Tahun 2015,Nasional,2019-10-02,https://www.wowkeren.com/berita/tampil/00276078.html,"Kepolisian Republik Indonesia telah menetapkan sejumlah perusahaan dan ratusan orang sebagai,kasus kebakaran hutan dan lahan (Karhutla) yang terjadi di sejumlah wilayah di Indonesia. Diketahui ada 11 korporasi dan 325 perorangan sebagai tersangka kasus kebakaran hutan dan lahan (karhutla) di Sumatera dan Kalimantan.,,,Menanggapi hal tersebut, Kementerian Lingkungan Hidup dan Kehutanan (KLHK) menyatakan bahwa beberapa perusahaan yang ditetapkan sebagai tersangka dulunya pernah diproses hukum pada tahun 2015 lalu. Dan mereka kembali melakukannya pada tahun ini.,Dirjen Penegakan Hukum Lingkungan Hidup KLHK Rasio Ridho Sani alias Roy pun mengatakan jika pihaknya telah menelusuri ke lapangan dan melakukan pencocokan dengan data karhutla di tahun 2015. ""Ada yang sama. Kami sedang dalami, tapi kemarin sampaikan di Jambi, kami mendatangi dua perusahaan yang pada 2015 terbakar,"" kata Roy dalam jumpa pers di Kantor KLHK, Selasa (1/10).,Lebih lanjut, Roy mengatakan jika PT Ricky Kurniawan Kertapersada pernah dinyatakan bersalah oleh pengadilan terkait pembakaran 591 hektare lahan pada 2015 di Kabupaten Muaro Jambi. Mahkamah Agung juga memutus perusahaan itu dikenai denda Rp 162 miliar.,Di tahun ini, perusahaan itu diduga kembali membakar lahannya dengan jumlah yang lebih luas dibanding 4 tahun lalu, yakni mencapai 1.200 hektare. Berikutnya, ada PT Kaswari Unggul yang memiliki lahan di Tanjung Jabung Timur, Jambi.,Perusahaan tersebut juga pernah melakukan pembakaran lahan di tahun 2015 dan juga telah dinyatakan bersalah oleh pengadilan. Perusahaan pun diharuskan membayar denda sebesar Rp 25,61 miliar.,""Perusahaan yang telah terbakar 2015, yang sudah kami berikan sanksi, yang kami sudah lakukan penindakan hukum, akan kami lakukan lebih tegas lagi. Lebih keras lagi,"" kata Roy. Namun, saat ini pihak KLHK masih belum menerima pembayaran seluruh denda dari perusahaan yang terbukti bersalah dalam kasus karhutla tersebut.,Dari sembilan gugatan, KLHK mestinya mendapat ganti rugi perusahaan dengan total Rp 3,15 triliun. Akan tetapi baru Rp 78 miliar yang berhasil dieksekusi dan masuk kas negara.,Roy mengaku jika pihaknya kesulitan dalam menarik denda karena kewenangan berada di tangan pengadilan negeri. Karena itu ia membuka opsi untuk mencabut izin dari perusahaan-perusahaan yang bersangkutan tersebut.,""Kami akan lakukan,, kewenangan menteri untuk melakukan penegakan hukum lapis kedua apabila pemberi izin tidak melakukan penegakan hukum administratif,"" tuturnya. ""Kami akan lakukan itu.""","Kepolisian Republik Indonesia telah menetapkan sejumlah perusahaan dan ratusan orang sebagai,kasus kebakaran hutan dan lahan (Karhutla) yang terjadi di sejumlah wilayah di Indonesia. ,,,Menanggapi hal tersebut, Kementerian Lingkungan Hidup dan Kehutanan (KLHK) menyatakan bahwa beberapa perusahaan yang ditetapkan sebagai tersangka dulunya pernah diproses hukum pada tahun 2015 lalu. Mahkamah Agung juga memutus perusahaan itu dikenai denda Rp 162 miliar. Perusahaan pun diharuskan membayar denda sebesar Rp 25,61 miliar. ,""Perusahaan yang telah terbakar 2015, yang sudah kami berikan sanksi, yang kami sudah lakukan penindakan hukum, akan kami lakukan lebih tegas lagi. Namun, saat ini pihak KLHK masih belum menerima pembayaran seluruh denda dari perusahaan yang terbukti bersalah dalam kasus karhutla tersebut. Akan tetapi baru Rp 78 miliar yang berhasil dieksekusi dan masuk kas negara. ,Roy mengaku jika pihaknya kesulitan dalam menarik denda karena kewenangan berada di tangan pengadilan negeri. Karena itu ia membuka opsi untuk mencabut izin dari perusahaan-perusahaan yang bersangkutan tersebut."
"Dituding Aji Mumpung, Barbie Kumalasari Ngaku Makin Viral Berkat Doa Galih Ginanjar",Selebriti,2019-10-02,https://www.wowkeren.com/berita/tampil/00276080.html,"Kasus vlog ""ikan asin"" yang menjerat,hingga kini memang masih terus berjalan. Namun di tengah-tengah kasus tersebut, sosok,justru semakin sering wara-wari di layar kaca.,,,Tak hanya berbicara soal kasus yang menimpa Galih, Barbie juga sering diundang ke acara televisi berkat berbagai kontroversi yang ia buat. Sebut saja soal Barbie yang merilis single baru bertajuk ""Cinta Sejati"" saat Galih sedang berada di penjara.,Meski sering dikritik karena suaranya fals, Barbie tetap percaya diri dan bangga karena lagunya menjadi viral. Hal ini membuat Barbie dituding sengaja memanfaatkan situasi yang menimpa Galih alias aji mumpung. Mengetahui tudingan tersebut, Barbie memberikan bantahan dan mengaku bahwa Galih yang selama ini mendoakannya sehingga semakin terkenal.,‚ÄúKalau menurut aku sih, aku kan istrinya Galih,"" ungkap Barbie saat ditemui di Jakarta, pada Senin (30/9). ""Galih sendiri enggak merasa menderita kok dalam arti melihat aku sekarang makin hits, malah itu doanya dia."",Lebih lanjut, Barbie juga mengungkapkan bahwa Galih selalu mendukungnya untuk terus berkarya di dunia hiburan. Artis berusia 37 tahun tersebut pun menceritakan pesan Galih yang ingin menanggung risiko atas kasus vlog ""ikan asin"" seorang diri.,""Karena dia maunya cukup dia saja yang menanggung masalah (kasus vlog 'ikan asin') ini. Nah, aku harus tetap berkarya, dia selalu mendoakan aku setiap malam, selalu berpesan. Makanya dia di dalam sana kan,"" cerita Barbie. ""Mungkin kalau habis kasus ini aku enggak bikin apapun, ya aku mungkin akan tenggelam. Tapi memang aku tipe orang bekerja keras ya mau ditiban masalah apapun ya tetap saja mau gue karya."",Sementara itu, rumah tangga Barbie dan Galih juga belakangan ini santer diisukan sedang dalam ambang,. Hal ini bermula saat rekan Barbie yang juga pengacara Indra Tarigan menyebutkan keputusan Galih sudah bulat, meski tak dijelaskan mengenai hal apa.","Kasus vlog ""ikan asin"" yang menjerat,hingga kini memang masih terus berjalan. ,Meski sering dikritik karena suaranya fals, Barbie tetap percaya diri dan bangga karena lagunya menjadi viral. ,‚ÄúKalau menurut aku sih, aku kan istrinya Galih,"" ungkap Barbie saat ditemui di Jakarta, pada Senin (30/9). "" Artis berusia 37 tahun tersebut pun menceritakan pesan Galih yang ingin menanggung risiko atas kasus vlog ""ikan asin"" seorang diri. Nah, aku harus tetap berkarya, dia selalu mendoakan aku setiap malam, selalu berpesan. Makanya dia di dalam sana kan,"" cerita Barbie. "" Mungkin kalau habis kasus ini aku enggak bikin apapun, ya aku mungkin akan tenggelam. Tapi memang aku tipe orang bekerja keras ya mau ditiban masalah apapun ya tetap saja mau gue karya. Hal ini bermula saat rekan Barbie yang juga pengacara Indra Tarigan menyebutkan keputusan Galih sudah bulat, meski tak dijelaskan mengenai hal apa."
"Kerusuhan Di Wamena Papua, Warga Ini Berhasil Lolos Dari Maut Dengan Pura-Pura Mati",Nasional,2019-10-02,https://www.wowkeren.com/berita/tampil/00276084.html,"Kerusuhan yang terjadi Wamena, Papua pada Senin (23/9) lalu telah menyisakan begitu banyak kisah tragis yang dialami oleh para korban. Banyak warga yang harus kehilangan anggota keluarganya atas aksi biadab yang dilakukan oleh sejumlah perusuh ini.,,,Kerusuhan di Wamena, Papua diawali dengan unjuk rasa dari sejumlah warga Papua. Aksi unjuk rasa ini berakhir dengan ricuh setelah ada sejumlah massa yang bertindak anarkis hingga menyebabkan kerusuhan di sekitar lokasi tersebut. Massa mengamuk dengan membakar rumah warga, kantor pemerintah, PLN dan beberapa kios usaha masyarakat.,Kerusuhan ini telah membuat puluhan nyawa melayang akibat perilaku kejam dan tidak beradab dari para demonstran dalam aksi berdarah tersebut. Hingga kini tercatat kerusuhan Wamena telah menewaskan sebanyak 33 orang. Mayoritas korban tewas diketahui berasal dari warga Papua pendatang.,Salah satu korban dari kerusuhan tersebut yaitu Erizal (42) menceritakan bagaimana dirinya berhasil meloloskan diri dari amukan massa. Erizal sendiri merupakan seorang perantau Minang dari Sungai Rampan, Koto Nan Tigo IV Koto Hilie, Batang Kapas, Kabupaten Pesisir Selatan, Sumatera Barat.,Walau berhasil lolos, dirinya harus menanggung duka yang mendalam setelah istri dan kedua anaknya meninggal dalam insiden kerusuhan tersebut. ""Alhamdulillah saya berhasil selamat dari peristiwa waktu itu, namun sayang anak dan istri saya meninggal dunia,"" ujar Erizal.,Erizal menceritakan saat terjadi kerusuhan, dirinya bersama dengan keluarganya sedang berada di sebuah kios yang menjadi tempatnya bekerja. Sejumlah massa kemudian mendatangi beberapa kios di sekitar lokasi tersebut termasuk kiosnya.,Massa yang berjumlah 30 orang tersebut mengepung kios-kios tersebut sehingga menyebabkan Erizal panik. Erizal lantas berusaha menyelamatkan diri bersama keluarganya namun mereka telah terkepung di dalam rumah yang berada di belakang kios tersebut.,Kerumunan massa tersebut lantas berusaha memaksa membuka pintu dan melakukan aksi biadabnya. Erizal mengatakan jika keponakannya yang bernama Yoga berusaha menahan pintu namun gagal. Yoga bersama dengan anak dan istri Erizal pun meninggal dunia setelah ditikam dengan parang oleh para perusuh.,""Jumlah mereka sekitar 30-an orang dan kami sama sekali tidak mengenal mereka,"" cerita Erizal. ""Salah seorang kemenakan saya yang bernama Yoga mencoba menahan pintu, namun mereka berhasil mendobraknya, sehingga kami dilempari, ditembaki dengan panah dan kami semua sudah pasrah mati."",Erizal mengatakan jika dirinya berhasil menyelamatkan diri dari para perusuh setelah berpura-pura mati dan menahan rasa sakit akibat terkena luka bakar. Erizal pun langsung pergi setelah perusuh itu pergi dan menunggu bantuan sehingga dirinya langsung dibawa ke rumah sakit.,""Karena setelah kami ditikam, rumah itu dibakar namun saya cepat bangkit dan menyelamatkan diri tapi tetap saja kepala dan tangan saya terbakar,"" jelas Erizal. ""Dua jam setelah itu barulah bantuan datang, saya langsung dibawa ke rumah sakit diobati pihak medis karena mengalami luka bakar di beberapa badan saya."",Erizal bercerita jika dirinya sudah enam tahun merantau di Wamena dan berdagang demi menafkahi keluarga dan menyekolahkan kedua anaknya. Selama ini dirinya juga mengaku hubungannya dengan penduduk asli Papua selalu baik-baik saja dan tidak pernah ada konflik.","Kerusuhan yang terjadi Wamena, Papua pada Senin (23/9) lalu telah menyisakan begitu banyak kisah tragis yang dialami oleh para korban. Banyak warga yang harus kehilangan anggota keluarganya atas aksi biadab yang dilakukan oleh sejumlah perusuh ini. ,,,Kerusuhan di Wamena, Papua diawali dengan unjuk rasa dari sejumlah warga Papua. Aksi unjuk rasa ini berakhir dengan ricuh setelah ada sejumlah massa yang bertindak anarkis hingga menyebabkan kerusuhan di sekitar lokasi tersebut. Hingga kini tercatat kerusuhan Wamena telah menewaskan sebanyak 33 orang. Mayoritas korban tewas diketahui berasal dari warga Papua pendatang. Erizal sendiri merupakan seorang perantau Minang dari Sungai Rampan, Koto Nan Tigo IV Koto Hilie, Batang Kapas, Kabupaten Pesisir Selatan, Sumatera Barat. Alhamdulillah saya berhasil selamat dari peristiwa waktu itu, namun sayang anak dan istri saya meninggal dunia,"" ujar Erizal. ,Massa yang berjumlah 30 orang tersebut mengepung kios-kios tersebut sehingga menyebabkan Erizal panik. Yoga bersama dengan anak dan istri Erizal pun meninggal dunia setelah ditikam dengan parang oleh para perusuh. Salah seorang kemenakan saya yang bernama Yoga mencoba menahan pintu, namun mereka berhasil mendobraknya, sehingga kami dilempari, ditembaki dengan panah dan kami semua sudah pasrah mati. Erizal pun langsung pergi setelah perusuh itu pergi dan menunggu bantuan sehingga dirinya langsung dibawa ke rumah sakit. "",Erizal bercerita jika dirinya sudah enam tahun merantau di Wamena dan berdagang demi menafkahi keluarga dan menyekolahkan kedua anaknya. Selama ini dirinya juga mengaku hubungannya dengan penduduk asli Papua selalu baik-baik saja dan tidak pernah ada konflik."
