title,category,publish_date,article_url,content,summary
"Suzy Sumringah dan Centil di Bandara Menuju Paris, Sikap Ramah Jadi Perbincangan",Selebriti,2019-09-23,https://www.wowkeren.com/berita/tampil/00274551.html,"terlihat di bandara internasional Incheon hari ini, Senin (23/9). Penyanyi sekaligus aktris kelahiran 1994 itu dilaporkan menuju Prancis untuk menghadiri gelaran Paris Fashion Week.,,,Kedatangan Suzy di bandara disambut jepretan awak media. Penampilan cantiknya langsung menjadi topik perbincangan di mana-mana.,Suzy tampil santai tapi modis mengenakan atasan putih lengan panjang dipadu rok merah senada dengan warna rambutnya. Ia melengkapi penampilannya dengan tas koleksi Christian Dior.,,,Suzy terlihat sumringah selama menyapa awak media dalam perjalanannya masuk bandara. Bintang drama "","" itu tidak berhenti tersenyum, dan bahkan sesekali berpose centil untuk media. Sikap ramahnya langsung menjadi sorotan utama.,,,,,""Suzy selalu memberikan senyum cerah dan bersinar. Dia benar-benar cantik luar dalam,"" komentar salah satu netizen. ""Inilah kenapa Suzy pantas disebut legendaris. Dia selalu ramah kepada semua orang dan murah senyum,"" tambah netizen lain. ""Dibandingkan dengan idol lain, Suzy sangat ramah. Murah senyum dan cantik sekali,"" pungkas lainnya.,Sementara itu, Suzy menyapa para penggemarnya lewat drama SBS ""Vagabond"". Dalam drama ini, ia memerankan Go Hae Ri, agen rahasia National Intelligence Service (NIS) yang dipimpin oleh Ki Tae Woong (,).,""Vagabond"" mengisahkan tentang Cha Dal Gun (,), pria yang keponakannya mengalami kecelakaan pesawat misterius. Ia kemudian mulai menyelidiki konspirasi besar di balik kecelakaan itu yang ternyata terhubung dalam korupsi besar negara. Drama Suzy ini tayang setiap Jumat dan Sabtu malam.","terlihat di bandara internasional Incheon hari ini, Senin (23/9). Penyanyi sekaligus aktris kelahiran 1994 itu dilaporkan menuju Prancis untuk menghadiri gelaran Paris Fashion Week. Penampilan cantiknya langsung menjadi topik perbincangan di mana-mana. ,Suzy tampil santai tapi modis mengenakan atasan putih lengan panjang dipadu rok merah senada dengan warna rambutnya. ,,,Suzy terlihat sumringah selama menyapa awak media dalam perjalanannya masuk bandara. Inilah kenapa Suzy pantas disebut legendaris. Dia selalu ramah kepada semua orang dan murah senyum,"" tambah netizen lain. "" Dibandingkan dengan idol lain, Suzy sangat ramah. Ia kemudian mulai menyelidiki konspirasi besar di balik kecelakaan itu yang ternyata terhubung dalam korupsi besar negara. Drama Suzy ini tayang setiap Jumat dan Sabtu malam."
Captain Marvel Bakal Jadi Musuh Avengers dan Bunuh Salah Satu Superhero,Film,2019-09-23,https://www.wowkeren.com/berita/tampil/00274616.html,"Sejak pertama kali diperkenalkan di jagat Marvel Cinematic Universe (MCU), tak bisa dipungkiri bahwa karakter Captain Marvel alias Carol Danvers adalah sosok yang sangat mencuri perhatian. Pasalnya, karakter yang diperankan oleh,ini memiliki superpower luar biasa, bahkan disebut sebagai salah satu superhero terkuat MCU.,,,Bicara soal Captain Marvel, belum lama ini terungkap bahwa karakter superhero wanita tersebut rupanya bakal menjadi musuh utama anggota Avengers di masa mendatang. Namun bukan dalam versi film, melainkan dalam komik terbarunya, Captain Marvel#13.,Dari sinopsis yang dibagikan, Captain Marvel rupanya bahkan tak segan bakal membunuh salah satu anggota Avengers. Rupanya, hal ini menjadi misi baru yang diembannya, hingga mau tak mau ia harus melakukannya. "","" bunyi penggalan sinopsis tersebut.,,,Meskipun hanya dalam versi komik, namun bukan hal yang mustahil apabila cerita ini akan diadaptasi dalam film "","" mendatang, mengingat bahwa Marvel Studios memiliki kecenderungan untuk sedikit menambahkan unsur komik dalam filmnya.,Di sisi lain, cerita Captain Marvel di layar lebar sendiri masih akan berlanjut ke seri keduanya, yakni "","". Dari segi alur cerita, ""Captain Marvel 2"" mungkin saja masih akan mengusung tema tentang peperangan bangsa Kree dan Skrull, seperti bocoran yang diperlihatkan dalam adegan,"","".,Namun yang pasti, ""Captain Marvel 2"" akan bergabung dengan sejumlah film jangka panjang Marvel Studios. Kemungkinan, film ini akan masuk dalam fase kelima MCU, yang nantinya juga bakal diisi oleh "","", "","" serta "","". Fase kelima ini kemungkinan besar mengincar slot rilis mulai tahun 2022 mendatang.","Sejak pertama kali diperkenalkan di jagat Marvel Cinematic Universe (MCU), tak bisa dipungkiri bahwa karakter Captain Marvel alias Carol Danvers adalah sosok yang sangat mencuri perhatian. Namun bukan dalam versi film, melainkan dalam komik terbarunya, Captain Marvel#13.,Dari sinopsis yang dibagikan, Captain Marvel rupanya bahkan tak segan bakal membunuh salah satu anggota Avengers. Rupanya, hal ini menjadi misi baru yang diembannya, hingga mau tak mau ia harus melakukannya. "","" Dari segi alur cerita, ""Captain Marvel 2"" mungkin saja masih akan mengusung tema tentang peperangan bangsa Kree dan Skrull, seperti bocoran yang diperlihatkan dalam adegan,"","". Fase kelima ini kemungkinan besar mengincar slot rilis mulai tahun 2022 mendatang."
Seungkwan Seventeen Beberkan Tips Sukses Turunkan Berat Badan,Selebriti,2019-09-23,https://www.wowkeren.com/berita/tampil/00274571.html,"memang dikenal sebagai member yang dulunya memiliki badan berisi. Sejak tahun 2016 hingga sekarang, perbedaan badan Seungkwan bahkan jelas terlihat. Pipinya yang dulu tembam, bahkan perlahan mulai hilang.,,,Melalui wawancara bersama,yang diunggah pada Sabtu (21/9), Seungkwan memberikan tips cepat menurunkan berat badan. Dengan santai ia mengungkapkan makanan dan minuman apa saja yang tidak boleh dikomsumsi saat diet.,,,Dengan sangat yakin Seungkwan pun membeberkan hal tersebut, ia tak ingin penggemarnya melakukan cara diet yang salah sehingga dapat menimbulkan efek buruk. Ia mengungkapkan cara jitunya yang tak lain adalah dengan menjadi cerdas.,''Jadilah cerdas dengan rencana penurunan berat badanmu,'' ungkap cowok yang kerap dipanggil Boo ini. ''Jangan kelaparan. Jangan makan makanan tidak sehat seperti ayam goreng, pizza, roti, permen.'',Sayangnya, setelah itu hal lucu justru terjadi. Usai memberikan pantangan saat diet, Seungkwan justru terciduk mendekati meja camilan. Tanpa ragu ia mengambil coklat dan segera membukanya. Tepat setelah ia akan memakannya, ia pun sadar akan kamera di depannya.,Wajah Seungkwan pun langsung memerah menahan malu,. Ia pun menjelaskan hal tersebut tak setiap hari terjadi, ia mengaku hanya memakan camilan saat ingin saja.,''Oke, kamu tidak boleh makan ini,'' ungkapnya. ''Tapi kadang-kadang lebih baik manjakan diri Anda dengan camilan dan kemudian berolahraga keras!'',Carat (penggemar seventeen) pun tak dapat menahan rasa gemas mereka. Menurut mereka hal itu wajar melihat Seungkwan yang selama ini sudah sangat bekerja keras hingga mencapai berat badannya sekarang. Bahkan Seungkwan pun terlihat semakin tampan saat ini.,Sementara itu,,Seventeen kali ini menuai kesuksesan besar. Hal ini dibuktikan dengan catatan penjualan album hari pertama mereka. Tak lama sejak full album ketiga Seventeen tersebut rilis, dilaporkan bahwa ""An Ode"" langsung mengambil tempat teratas di tangga musik utama dengan penjualan yang kuat.,Ini peringkat pertama ini tidak hanya didapatkan di dalam negeri tetapi juga di 24 negara chart album K-Pop iTunes. Selain itu, baru-baru ini dilaporkan jika ""An Ode"" berhasil terjual lebih dari 160.000 unit pada hari pertama penjualannya.","memang dikenal sebagai member yang dulunya memiliki badan berisi. Sejak tahun 2016 hingga sekarang, perbedaan badan Seungkwan bahkan jelas terlihat. Pipinya yang dulu tembam, bahkan perlahan mulai hilang. ,,,Dengan sangat yakin Seungkwan pun membeberkan hal tersebut, ia tak ingin penggemarnya melakukan cara diet yang salah sehingga dapat menimbulkan efek buruk. Jangan makan makanan tidak sehat seperti ayam goreng, pizza, roti, permen. Tanpa ragu ia mengambil coklat dan segera membukanya. Tepat setelah ia akan memakannya, ia pun sadar akan kamera di depannya. ,''Oke, kamu tidak boleh makan ini,'' ungkapnya. '' Tapi kadang-kadang lebih baik manjakan diri Anda dengan camilan dan kemudian berolahraga keras!'',Carat (penggemar seventeen) pun tak dapat menahan rasa gemas mereka. Hal ini dibuktikan dengan catatan penjualan album hari pertama mereka. Tak lama sejak full album ketiga Seventeen tersebut rilis, dilaporkan bahwa ""An Ode"" langsung mengambil tempat teratas di tangga musik utama dengan penjualan yang kuat. ,Ini peringkat pertama ini tidak hanya didapatkan di dalam negeri tetapi juga di 24 negara chart album K-Pop iTunes."
"Jumpa Fans Dengan Penggemar, Marshanda Nangis: Aku Ngerasa Dicintai",Selebriti,2019-09-23,https://www.wowkeren.com/berita/tampil/00274554.html,"Artis,tak kuasa menahan harunya saat menggelar acara jumpa fans bersama para penggemarnya. Marshanda menggelar acara,dengan komunitas penggemarnya yang memiliki sebutan Shanity dan Marshanda Community di kawasan Kelapa Gading, Jakarta Utara pada Minggu (22/9).,,,Pada acara tersebut, Marshanda menjelaskan tentang acara,ini. Acara ini menurut pengakuannya hanya mengalir begitu saja secara natural antara dirinya dan penggemar tanpa ada susunan acara yang terkesan formal dan membatasi.,""Hari ini,sama Shanity, Marshanda Community,"" ujar Marshanda di kawasan Kelapa Gading, Jakarta Utara pada Minggu (22/9). ""Terus hari ini indah banget, semuanya enggak ada skenario, enggak ada strategi apa-apa, berjalan begitu saja, tiba-tiba mengalir."",Mantan istri,ini mengatakan jika acara tersebut dilakukan sebagai bentuk kedekatan dan rasa sayang Marshanda pada para fansnya. Caca atau panggilan akrab dari Marshanda ini terlihat begitu sumringah sepanjang acara dan dengan bahagia berbincang-bincang secara langsung dengan para penggemarnya.,""Tema hari ini adalah jujur, Caca (panggilan akrab Marshanda) menjadi Caca apa adanya,"" ujar Marshanda. ""Shanity menjadi Shanity apa adanya untuk saling memperkenalkan diri lebih dekat lagi dan saling sayang."",Mantan pacar,ini mengungkapkan jika pada acara tersebut banyak keterbukaan yang dilakukan Marshanda dan para penggemarnya. Namun karena dirinya dan para penggemar memiliki rasa saling percaya maka mereka pun saling bertukar diskusi seputar kehidupan personalnya.,""Banyak keterbukaan, banyak pertanyaan yang personal yang sebenarnya berisiko kalau ada orang yang tahu, tetapi karena dia percaya sama aku, akhirnya dia mau nanya itu ke aku,"" ungkap pemain "","" ini. ""Jadi sangat berharga banget sih, senang banget."",Terakhir, Marshanda pun tidak dapat menahan haru hingga tangisnya pun pecah saat dia mengungkapkan rasa terimakasih yang besar kepada seluruh penggemar yang dinilainya selama ini tak pernah berhenti untuk selalu memberi dukungan. Marshanda merasa begitu haru karena dukungan dari para fans ini telah membuatnya merasa menjadi seseorang yang bermakna dan dicintai.,""Ngerasa spesial, kok nangis sih, terima kasih kalian bikin aku ngerasa lebih bermakna, kalian bikin aku ngerasa kayak aku pantas dirayakan, pantas dicintai, segitunya kalian sayang sama aku,,,"" kata Marshanda. ""Aku enggak nyangka sih bakal sampai nangis, jujur ya dari aku datang. Tapi ternyata tahu-tahu nangis.""","Artis,tak kuasa menahan harunya saat menggelar acara jumpa fans bersama para penggemarnya. Marshanda menggelar acara,dengan komunitas penggemarnya yang memiliki sebutan Shanity dan Marshanda Community di kawasan Kelapa Gading, Jakarta Utara pada Minggu (22/9).,,,Pada acara tersebut, Marshanda menjelaskan tentang acara,ini. Terus hari ini indah banget, semuanya enggak ada skenario, enggak ada strategi apa-apa, berjalan begitu saja, tiba-tiba mengalir. "",Mantan istri,ini mengatakan jika acara tersebut dilakukan sebagai bentuk kedekatan dan rasa sayang Marshanda pada para fansnya. Namun karena dirinya dan para penggemar memiliki rasa saling percaya maka mereka pun saling bertukar diskusi seputar kehidupan personalnya. Jadi sangat berharga banget sih, senang banget. Marshanda merasa begitu haru karena dukungan dari para fans ini telah membuatnya merasa menjadi seseorang yang bermakna dan dicintai. ,""Ngerasa spesial, kok nangis sih, terima kasih kalian bikin aku ngerasa lebih bermakna, kalian bikin aku ngerasa kayak aku pantas dirayakan, pantas dicintai, segitunya kalian sayang sama aku,,,"" kata Marshanda. "" Aku enggak nyangka sih bakal sampai nangis, jujur ya dari aku datang."
"Bikin Kepo, Inikah Sosok Pacar Baru Tamara Bleszynski?",Selebriti,2019-09-23,https://www.wowkeren.com/berita/tampil/00274549.html,"Meski telah bercerai dari,pada tahun 2012 lalu,,tetap menjalin komunikasi baik demi sang putra, Kenzou. Berbeda dengan Mike yang kini sudah,dengan sang kekasih, Janisa Pradja, Tamara diketahui masih sendiri alias jomblo,,,Namun kali ini dalam postingan Instagram pada Senin (22/9), status,Tamara nampaknya tak berlaku lagi. Ibunda,itu berfoto bersama seorang pria misterius yang belum diketahui identitasnya.,Dalam foto tersebut, Tamara dan sang pria kompak mengenakan busana berwarna putih. Dengan senyum semringah, Tamara terlihat memegang sebuah buket bunga berwarna putih.,Sementara itu, sang pria nampak memandang wajah Tamara dengan tatapan kagum. "",,"" tulis Tamara singkat tanpa menjelaskan sosok sang pria di sampingnya.,,,Postingan Tamara itu langsung ramai dikomentari warganet. Sejumlah netter kepo tentang pria disamping perempuan kelahiran 1974 itu.,"","" tulis akun,. "",,"" tambah akun,.,"",,"" imbuh akun,. "","" sahut akun,. "",,"" seru akun,.,Meski demikian, netter lain memuji Tamara dengan kecantikannya yang awet muda. Di sisi lain, ada juga netter yang ""cemburu"" lantaran Tamara sudah ada tambatan hati.,"",,"" tulis akun,. "","" sambung akun,. "",,"",,"" komentar akun,. "",,"" sahut akun,. "",,"" seru akun,.","Meski telah bercerai dari,pada tahun 2012 lalu,,tetap menjalin komunikasi baik demi sang putra, Kenzou. Berbeda dengan Mike yang kini sudah,dengan sang kekasih, Janisa Pradja, Tamara diketahui masih sendiri alias jomblo,,,Namun kali ini dalam postingan Instagram pada Senin (22/9), status,Tamara nampaknya tak berlaku lagi. ,Dalam foto tersebut, Tamara dan sang pria kompak mengenakan busana berwarna putih. tulis Tamara singkat tanpa menjelaskan sosok sang pria di sampingnya. ,,,Postingan Tamara itu langsung ramai dikomentari warganet. Sejumlah netter kepo tentang pria disamping perempuan kelahiran 1974 itu.,"","""
"Gelar Demo di Makassar, Mahasiswa UMI Serukan 'Jokowi Lengser'",Nasional,2019-09-23,https://www.wowkeren.com/berita/tampil/00274583.html,"Mahasiswa di Makassaar menggelar aksi demo di Jalan Urip Sumoharjo, Senin (23/9). Aksi demo ini dilakukan oleh mahasiswa Universitas Muslim Indonesia (UMI).,,,Dalam demo tersebut dapat terdengar orasi dan teriakan yel-yel ""Jokowi Turun"" yang menggema. Aksi yang diikuti ratusan mahasiswa dan digelar di dua badan jalan di depan kampus. Selain berorasi mahasiswa juga membagikan selebaran kepada para pengguna jalan yang melintas dari arah timur ke barat dan dari barat dari timur.,Selebaran yang dibagikan itu berisi sejumlah alasan terkait tuntutan agar Presiden,turun tahta. Dalam demo tersebut, mahasiswa melakukan aksi membakar ban bekas sehingga kepulan asap hitam memayungi lokasi sehingga kendaraan tidak bisa melaju.,Mira, salah seorang orator dari Aliansi Mahasiswa UMI Tolak Rezim anti-Demokrasi yang turun jalan hari ini mengatakan terlalu banyak kebijakan Jokowi yang tidak pro rakyat. Di antaranya sejumlah rancangan undang-undang (RUU) yang tergesa-gesa ditetapkan.,""Maka hari ini kami nyatakan Jokowi harus turun,"" seru Mira. Di antara RUU yang ditolak oleh ratusan mahasiswa ini adalah RUU Ketenagakerjaan, RUU Pertanahan, RUU Perkelapasawitan, dan RKUHP. Tak sampai di situ, massa juga mengkritik kebijakan DPR dan pemerintah yang mengesahkan revisi UU KPK.,Demonstran mahasiswa itu menilai jika RUU tersebut justru lebih berpihak ke pengusaha ketimbang kepada rakyat. ""Tolak pengesahan RUU KPK, tolak kenaikan iuran BPJS, tolak revisi UU Ketenagakerjaan, tolak revisi UU Pertanahan, tolak RUU perkelapasawitan, tolak RKUHP,"" kata Mira.,Sementara itu, Ajis yang juga merupakan seorang orator dalam orasinya menyatakan mahasiswa UMI turun untuk mengkritisi segala bentuk kebijakan yang tidak pro rakyat. ""Kita turun untuk menumbangkan rezim antidemokrasi,"" seru Ajis.,Aksi demo yang dilakukan mahasiswa ini tak hanya terjadi di Makassar. Aksi demo lain disebutkan terjadi juga di Yogyakarta dan rencananya dimulai pukul 13.00 WIB. Di Riau juga mahasiswa telah menggelar aksi demonstrasi di Tanjung Pinang hingga berakhir dengan kericuhan.","Mahasiswa di Makassaar menggelar aksi demo di Jalan Urip Sumoharjo, Senin (23/9). Aksi yang diikuti ratusan mahasiswa dan digelar di dua badan jalan di depan kampus. Di antaranya sejumlah rancangan undang-undang (RUU) yang tergesa-gesa ditetapkan. ,""Maka hari ini kami nyatakan Jokowi harus turun,"" seru Mira. Di antara RUU yang ditolak oleh ratusan mahasiswa ini adalah RUU Ketenagakerjaan, RUU Pertanahan, RUU Perkelapasawitan, dan RKUHP. ,Sementara itu, Ajis yang juga merupakan seorang orator dalam orasinya menyatakan mahasiswa UMI turun untuk mengkritisi segala bentuk kebijakan yang tidak pro rakyat. "" ,Aksi demo yang dilakukan mahasiswa ini tak hanya terjadi di Makassar. Aksi demo lain disebutkan terjadi juga di Yogyakarta dan rencananya dimulai pukul 13.00 WIB. Di Riau juga mahasiswa telah menggelar aksi demonstrasi di Tanjung Pinang hingga berakhir dengan kericuhan."
Nia Ramadhani Tegaskan Tak Ingin Tambah Momongan Lagi Karena Alasan Ini,Selebriti,2019-09-23,https://www.wowkeren.com/berita/tampil/00274520.html,"Artis cantik,mengaku jika dirinya sudah sangat bahagia dengan memiliki 3 orang anak hasil hubungan pernikahannya dengan Ardi Bakrie. Nia Ramadhani mengaku jika dirinya tidak ingin menambah momongan lagi.,,,Nia Ramadhani sendiri saat ini tengah menjalani biduk rumah tangga dengan putra kolongmerat Indonesia Aburizal Bakri, yaitu Ardi Bakrie. Nia telah menjalani usia pernikahan 9 tahun lamanya setelah setuju dipinang Ardi Bakrie pada 1 April 2010 silam. Pernikahan ini sempat menghebohkan publik di kala itu karena mengundang semua mata untuk memandang pada pernikahan yang tergolong sangat mewah ini.,Kini Nia Ramadhani di usianya yang menyentuh 29 tahun telah diberikan 3 buah hati. Artis yang begitu terkenal akan peran antagonisnya dalam sinetron "","" ini menegaskan jika dirinya tidak ingin menambah anak lagi.,Nia secara gamblang menyebutkan jika dia tidak ingin menambah momongan lagi karena itu akan membuat tubuhnya kembali melar. Pasalnya, berkaca pada momen setelah melahirkan ketiga anaknya, Nia mengaku jika dirinya cukup kesulitan untuk mengembalikan tubuh pasca melahirkan menjadi ideal kembali.,""Enggak, enggak, sudah tiga (anak) sudah cukup, sudah susah,"" ujar Nia saat ditemui di kawasan Kuningan, Jakarta Selatan pada Minggu (22/9). ""Kalau dia kan enggak ada urusan ngurusin badan ya. Kalau saya sudah balikin lagi kayak gini, sudah malas lagi mau punya anak lagi."",Nia Ramadhani juga mengungkapkan jika saat ini dirinya sudah sangat kewalahan mengurus ketiga anaknya yang sudah mulai besar. Apalagi, saat ini dia harus terus memberikan pendampingan bagi putri pertamanya yang sudah mulai mendapatkan banyak PR yang berat-berat dari sekolah.,Sebagai orang tua, sahabat dari,ini berkomitmen untuk terus memberikan pendampingan dan membantu sang anak dalam menjalani aktivitas sekolahnya. Tak hanya permasalahan anak pertamanya, Nia juga mengaku cukup dibuat kewalahan dengan kedua anak lelakinya sehingga membuatnya malas untuk kembali memiliki momongan lagi.,""Karena juga gedeinnya kayak pas sudah sekolah kayak dia (Mika) susah banget. Sekarang sudah mulai PR-PR, ternyata sangat berat buat jadi orang tua,"" jelas Nia. ""Ini aja baru satu, masih ada dua lagi anak yang harus aku ladenin sampai tua. Makanya untuk nambah satu lagi kayaknya sudah enggak mau lagi.""","Artis cantik,mengaku jika dirinya sudah sangat bahagia dengan memiliki 3 orang anak hasil hubungan pernikahannya dengan Ardi Bakrie. ,,,Nia Ramadhani sendiri saat ini tengah menjalani biduk rumah tangga dengan putra kolongmerat Indonesia Aburizal Bakri, yaitu Ardi Bakrie. ,Kini Nia Ramadhani di usianya yang menyentuh 29 tahun telah diberikan 3 buah hati. ,Nia secara gamblang menyebutkan jika dia tidak ingin menambah momongan lagi karena itu akan membuat tubuhnya kembali melar. Pasalnya, berkaca pada momen setelah melahirkan ketiga anaknya, Nia mengaku jika dirinya cukup kesulitan untuk mengembalikan tubuh pasca melahirkan menjadi ideal kembali. Kalau dia kan enggak ada urusan ngurusin badan ya. Apalagi, saat ini dia harus terus memberikan pendampingan bagi putri pertamanya yang sudah mulai mendapatkan banyak PR yang berat-berat dari sekolah. ,""Karena juga gedeinnya kayak pas sudah sekolah kayak dia (Mika) susah banget. Ini aja baru satu, masih ada dua lagi anak yang harus aku ladenin sampai tua. Makanya untuk nambah satu lagi kayaknya sudah enggak mau lagi."""
Jennie BLACKPINK Tuai Dukungan Usai Posting Foto Cantik Setelah Fanmeeting,Selebriti,2019-09-23,https://www.wowkeren.com/berita/tampil/00274580.html,"BLACKPINK (,) kembali menyapa para penggemar lewat acara fan meeting bertajuk ""BLACKPINK Fan Meet-Up Event in Paradise City"". Acara tersebut digelar Jumat, 20 September 2019 lalu di Paradise City, Incheon selama dua kali pada pukul 13:00 dan 18:00 waktu setempat.,,,Pada Sabtu (21/9),,membagikan postingan baru di akun Instagram,miliknya. Di sini, penyanyi kelahiran 1996 tersebut mengunggah beberapa foto cantik.,Dalam foto-foto unggahannya, Jennie mengenakan blus putih dengan rambut panjang yang dibiarkan terurai. Lewat postingan tersebut, idol yang pernah tinggal di Selandia Baru itu mengucapkan terima kasih kepada para penggemar.,""Fanmeeting pertama BLACKPINK [Chapter 1] (emoji hati). Aku sangat bahagia, terima kasih, BLINK. Berkat kalian semua lah ada kami di saat ini, dan ada hari ini. Semuanya, tolong pulang dengan aman. 'Aku sayang kalian',"" tulis Jennie pada caption postingannya.,,,Postingan Jennie ini mendapat cukup banyak perhatian serta komentar dari para netter. Mereka beramai-ramai memberikan dukungan serta pujian untuk pelantun ""Kill This Love"" tersebut.,""Performance Jennie sangat bagus di panggung hari ini."",""Ayo selamanya bersama Jennie, BLACKPINK dan BLINK. Kami selalu mendukungmu. Itu hari terindah untuk BLINK."",""Fan meeting BLACKPINK hari ini memang yang terindah."",""Jennie cantik banget. Dia juga main gitar hari ini. Sangat berbakat."",""Hari ini, Jennie keren dan imut dan melakukan semuanya. Suara Jennie juga sangat bagus. Aku harap semua orang di dunia menonton fancam Jennie hari ini."",""Aku sangat bangga padamu.""","BLACKPINK (,) kembali menyapa para penggemar lewat acara fan meeting bertajuk ""BLACKPINK Fan Meet-Up Event in Paradise City"". ,,,Pada Sabtu (21/9),,membagikan postingan baru di akun Instagram,miliknya. Di sini, penyanyi kelahiran 1996 tersebut mengunggah beberapa foto cantik. ,,,Postingan Jennie ini mendapat cukup banyak perhatian serta komentar dari para netter. "",""Ayo selamanya bersama Jennie, BLACKPINK dan BLINK. Itu hari terindah untuk BLINK."",""Fan meeting BLACKPINK hari ini memang yang terindah. "",""Hari ini, Jennie keren dan imut dan melakukan semuanya. Aku harap semua orang di dunia menonton fancam Jennie hari ini."
"Kim Yohan Ulang Tahun, Member X1 Kompak Rayakan Dengan Pakai Baju Ini",Selebriti,2019-09-23,https://www.wowkeren.com/berita/tampil/00274515.html,"center dari grup,baru saja berulang tahun ke 21 tahun pada Minggu 22 September lalu. One It (sebutan penggemar X1) pun membanjiri ucapan selamat ulang tahun.,,,Mantan atlet taekwondo ini pun lantas membalas para penggemar dengan mengunggah foto dirinya sembari memegang kue tart dengan para member. Tak sekadar foto bersama, melainkan para member X1 kompak menggunakan kaos putih yang bertuliskan ''Kim Yohan Selamat Ulang Tahun''.,,,'','' tulis Kim Yohan pada,. '','',Hal tersebut pun lantas membuat para penggemar tak dapat menyembunyikan rasa gemar mereka. Sejak berita ini ditulis, postingan tersebut telah mendapat perhatian sebanyak 78 ribu,dan lebih dari 145 ribu,.,'','' komentar akun,. '','' balas akun,. '','' ungkap akun,. '','' ujar akun,. '','' komentar akun,. '','' balas akun,. '','' ujar akun,.,'','' ungkap akun,. '','' komentar akun,. '','' ujar akun,. '','' tulis akun,.","center dari grup,baru saja berulang tahun ke 21 tahun pada Minggu 22 September lalu. ,,,Mantan atlet taekwondo ini pun lantas membalas para penggemar dengan mengunggah foto dirinya sembari memegang kue tart dengan para member. Tak sekadar foto bersama, melainkan para member X1 kompak menggunakan kaos putih yang bertuliskan ''Kim Yohan Selamat Ulang Tahun''.,,,'',''"
