title,category,publish_date,article_url,content,summary
"Mahasiswa Bacakan Maklumat, Respons Fahri Hamzah Jadi Sorotan",Nasional,2019-09-26,https://www.wowkeren.com/berita/tampil/00275098.html,"Berbagai pihak terus berusaha untuk menjadi penengah antara ""konflik"" antara mahasiswa dan anggota dewan. Sebagai pengingat, mahasiswa terus menyuarakan tuntutan mereka agar pemerintah membatalkan seluruh kebijakan kontroversial yang akan dan telah disahkan.,,,Salah satu yang mencoba mempertemukan pihak yang ""berseteru"" adalah program,"","". Debat antara kedua pihak di acara tersebut pun tak terelakkan.,Ketika berada di penghujung acara,,lantas memberikan kesempatan bagi perwakilan mahasiswa untuk membacakan Maklumat Tuntaskan Reformasi. Maklumat itu dibacakan demi menegaskan kembali tuntutan para demonstran.,Sayangnya reaksi tak menyenangkan ditunjukkan oleh Wakil Ketua DPR RI,. Seolah tak menunjukkan antusiasme, bahkan beberapa pihak menudingnya bersikap arogan, Fahri justru bertanya dengan nada menyindir.,""Oh sudah selesai?"" Hal itulah yang Fahri tanyakan kepada Najwa setelah para mahasiswa selesai membacakan maklumat mereka.,Tak ayal sikap ini menuai perhatian masyarakat luas. Warganet terang-terangan merasa geram dan mengecam sikap Fahri. Bahkan kutipan pertanyaan Fahri ini membuat kata kunci terkait memasuki daftar,Indonesia.,,,"","" tulis,. "","" imbuh,.,""Emosi ya denger, 'oh udah selesai?' Astaghfirullah, pak,"" cuit,. "","" timpal,.,"","" tandas,,Di sisi lain, sebagian tuntutan para mahasiswa selama demonstrasi digelar tampaknya didengarkan dan dikabulkan oleh para wakil rakyat. Diketahui DPR RI akhirnya,empat RUU yang dinilai meresahkan, antara lain RUU Pemasyarakatan dan RKUHP.,Namun, hingga kini, tuntutan pencabutan hasil revisi UU KPK masih menemui jalan buntu. Pasalnya Presiden,,mengeluarkan Perppu untuk membatalkan keabsahan UU tersebut.","Berbagai pihak terus berusaha untuk menjadi penengah antara ""konflik"" antara mahasiswa dan anggota dewan. Debat antara kedua pihak di acara tersebut pun tak terelakkan. ,Tak ayal sikap ini menuai perhatian masyarakat luas. Warganet terang-terangan merasa geram dan mengecam sikap Fahri. Bahkan kutipan pertanyaan Fahri ini membuat kata kunci terkait memasuki daftar,Indonesia.,,,"","" tandas,,Di sisi lain, sebagian tuntutan para mahasiswa selama demonstrasi digelar tampaknya didengarkan dan dikabulkan oleh para wakil rakyat. Diketahui DPR RI akhirnya,empat RUU yang dinilai meresahkan, antara lain RUU Pemasyarakatan dan RKUHP.,Namun, hingga kini, tuntutan pencabutan hasil revisi UU KPK masih menemui jalan buntu. Pasalnya Presiden,,mengeluarkan Perppu untuk membatalkan keabsahan UU tersebut."
"Punya Wajah 1 Miliar, Nita Thalia Dibully Maksa Mau Saingi Nagita 'Bidadari Surga' Jadi Istri Raffi",Selebriti,2019-09-26,https://www.wowkeren.com/berita/tampil/00275116.html,"sempat permak wajah senilai Rp1 miliar. Ia juga memiliki bentuk tubuh yang aduhai hingga banyak pria tergoda.,,,Dalam wawancara di acara "","", Nita sempat membocorkan salah satu pria yang pernah menggodanya. Rupanya pria yang dimaksud adalah suami,,,.,Nita mengaku kalau Raffi kerap menggoda dirinya. Raffi bahkan sempat menawarinya menjadi istri kedua setelah Nagita.,""Kamu belum tahu kan, kalian belum tahu kan, bos lu nih pernah nawari Teh Nita mau nggak jadi istri kedua,"" kata Nita. Raffi langsung salah tingkah karena kena ""skak mat"" dari Nita.,"","" ledek Nita. ""Memang jujur aku..."" ucap Raffi. ""Mengidolakan,"" sahut,. ""Tapi memang teh Nita Thalia mah cantik,"" kata Raffi malu-malu.,Mendengar pengakuan Nita, fans Nagita dan Raffi malah menyikapi sinis. Mereka tak percaya bila Raffi sampai tergoda pada pedangdut seperti Nita.,"",,"" kata netter. "",,"" seru yang lainnya.,Sebelumnya, Raffi juga pernah mengungkap kalau dulunya naksir,. Bahkan Raffi mengaku lebih naksir Marshanda ketimbang mantan kekasihnya,,.,""Hehehe seharusnya gue nggak sama Laudya Cynthia Bella tapi sama Marshanda,"" kata Raffi. ""Suka banget dari dulu emang sama Marshanda."",""Jadi waktu itu di salah satu mal ya Cha di Jakarta Selatan, dia tiba-tiba narik tangan aku ke atas naik tangga mal itu dan tahu-tahu kita sampai di rooftopnya,"" kata Raffi. ""Pas sampai di rooftopnya, dia bilang 'eh lihat deh bintang-bintangnya bagus ya'. Wah gue senang banget diajak ke sana. Soalnya nggak ada yang tahu itu kita cuma berdua ya."",Raffi juga mengaku ngefans Marshanda sejak masih kecil. ""Idola dari kecil. Saya waktu kecil mengidolakan Marshanda. Artis mah waktu saya SMA cuma Marshanda doang,"" kata Raffi.,Menanggapi pengakuan Raffi, Marshanda bersikap santai. Ia mengisyaratkan cuma menganggap Raffi sebagai teman. ""Iya dulu kan memang dekat ya Fi dan kita dukung satu sama lain sampai sekarang,"" kata Marshanda.","Ia juga memiliki bentuk tubuh yang aduhai hingga banyak pria tergoda. ,,,Dalam wawancara di acara "","", Nita sempat membocorkan salah satu pria yang pernah menggodanya. Rupanya pria yang dimaksud adalah suami,,,. ,Mendengar pengakuan Nita, fans Nagita dan Raffi malah menyikapi sinis. Mereka tak percaya bila Raffi sampai tergoda pada pedangdut seperti Nita.,"",,"" Bahkan Raffi mengaku lebih naksir Marshanda ketimbang mantan kekasihnya,,. ,""Hehehe seharusnya gue nggak sama Laudya Cynthia Bella tapi sama Marshanda,"" kata Raffi. "" Suka banget dari dulu emang sama Marshanda. Pas sampai di rooftopnya, dia bilang 'eh lihat deh bintang-bintangnya bagus ya'. Soalnya nggak ada yang tahu itu kita cuma berdua ya. Ia mengisyaratkan cuma menganggap Raffi sebagai teman. """
"Banyak Wartawan Alami Kekerasan Saat Demo Mahasiswa, Dewan Pers Didesak Aktifkan Pedoman Khusus",Nasional,2019-09-26,https://www.wowkeren.com/berita/tampil/00275112.html,"Beberapa hari belakangan ini,,yang menunjukkan sikap represif aparat keamanan kepada wartawan dan demonstran demo mahasiswa menjadi viral di dunia maya. Tak haya terjadi di Jakarta, di daerah lain seperti Makassar juga sudah ada,yang menjadi korban kekerasan aparat keamanan yang mengawal aksi demo tersebut.,,,""Di Jakarta semua kasus kekerasan wartawan pelakunya adalah aparat karena merekam kebrutalan polisi,"" kata Ketua Advokasi AJI Indonesia Joni Aswira dalam jumpa pers di Kantor LBH, Jakarta Pusat, Rabu (25/9). Ia mengatakan jika di Jakarta sudah ada empat orang jurnalis yang menjadi korban kekerasan aparat polisi.,Empat wartwan tersebut berasal dari media yang berbeda-beda, yaitu,,,,,, dan,. ""Di Jakarta, jurnalis Kompas.com yang merekam aksi kebrutalan aparat terhadap demonstran, IDN Times merekam aksi dan wartawan Katadata merekam kebrutalan aparat,"" kata Joni.,Melihat maraknya kasus kekerasan yang dilakukan aparat keamanan kepada wartawan membuat LBH Pers meminta Dewan Pers menerapkan pedoman penerapan kasus kekerasan terhadap wartawan. Perwakilan LBH Pers Gading Yonggar Aditya mengatakan, berdasarkan monitoring LBH Pers kasus kekerasan yang terjadi kepada jurnalis oleh aparat kepolisian tidak hanya melanggar aspek KUHP tetapi juga menghalangi kerja jurnalistik sebagaimana dalam UU Pers.,""Sehingga kami minta Dewan Pers mengaktifkan pedoman penerapan kasus kekerasan terhadap wartawan karena sekarang tidak maksimal,"" kata Gading di Kantor LBH, Rabu (25/9). Pedoman ini berlaku untuk berbagai pihak.,Gading menambahkan jika kasus-kasus kekerasan yang ditujukan kepada wartawan dinilai dapat bertambah jika Dewan Pers tidak segera mengaktifkan pedoman tersebut. Diketahui dalam aksi demonstrasi mahasiswa yang dilakukan di DPR pada Selasa (24/9) lalu aparat keamanan melakukan tindak kekerasan dan intimidasi.,Sebelumnya, video-video viral yang menunjukkan sikap represif aparat keamanan tersebut mendapat kecaman dari warganet. Sementara itu, respon yang diberikan oleh aparat polisi pun hanya diberikan oleh Kabid Humas Polda Sulsel, Kombes Polisi Dicky Sondani.,Menyikapi kasus tersebut, ia pun meminta maaf dan mengimbau agar kedepannya para wartawan yang meliput di lapangan tepatnya meliput aksi unjuk rasa untuk menggunakan atribut lengkap dan memakai rompi pers. ""(Wartawan) bisa pakai rompi pers. Kalau situasi,jangan terlalu dekat dengan pelaku unjuk rasa. Polisi mana tahu wartawan atau bukan. Yang kenal wartawan hanya Kapolres atau Kabid Humas. Anggota tidak ada yang kenal. Mohon maaf apabila terjadi insiden tadi. Pelakunya akan kita berikan sanksi,"" ujarnya.","Beberapa hari belakangan ini,,yang menunjukkan sikap represif aparat keamanan kepada wartawan dan demonstran demo mahasiswa menjadi viral di dunia maya. ,,,""Di Jakarta semua kasus kekerasan wartawan pelakunya adalah aparat karena merekam kebrutalan polisi,"" kata Ketua Advokasi AJI Indonesia Joni Aswira dalam jumpa pers di Kantor LBH, Jakarta Pusat, Rabu (25/9). Perwakilan LBH Pers Gading Yonggar Aditya mengatakan, berdasarkan monitoring LBH Pers kasus kekerasan yang terjadi kepada jurnalis oleh aparat kepolisian tidak hanya melanggar aspek KUHP tetapi juga menghalangi kerja jurnalistik sebagaimana dalam UU Pers. Pedoman ini berlaku untuk berbagai pihak. ,Sebelumnya, video-video viral yang menunjukkan sikap represif aparat keamanan tersebut mendapat kecaman dari warganet. Sementara itu, respon yang diberikan oleh aparat polisi pun hanya diberikan oleh Kabid Humas Polda Sulsel, Kombes Polisi Dicky Sondani. Kalau situasi,jangan terlalu dekat dengan pelaku unjuk rasa. Yang kenal wartawan hanya Kapolres atau Kabid Humas. Pelakunya akan kita berikan sanksi,"" ujarnya."
Tanggapan Warner Bros Usai 'Joker' Disebut sebagai Pemicu Tindak Kekerasan dan Pembunuhan,Film,2019-09-26,https://www.wowkeren.com/berita/tampil/00275122.html,"Belum lama ini,,selaku pemeran utama "","" sempat menghebohkan media usai mendadak,. Diketahui, alasan sang aktor melakukan hal tersebut adalah karena ia mendapatkan pertanyaan yang menyinggung seputar reputasi ""Joker"".,,,Pertanyaan tersebut rupanya merujuk pada konsep gelap yang akan diusung oleh ""Joker"", di mana film ini dikhawatirkan akan memberikan pengaruh buruk dan mempengaruhi orang-orang untuk melakukan aksi balas dendam tragis seperti yang dilakukan oleh sang Clown Prince of Crime.,Menanggapi reputasi ""Joker"" yang dianggap sebagai pemicu kekerasan di mata publik, rupanya Warner Bros selaku rumah produksi pun buka suara. Melalui keterangan resmi, Warner Bros mengklaim bahwa sejak awal ""Joker"" bukanlah sebuah film tentang superhero, namun juga tidak menyampaikan pesan tentang ajakan berbuat kejahatan.,""Kami tak membuat kesalahan. Baik film atau karakter Joker bukan untuk mengiklankan kejahatan kepada dunia. Pembuat film serta studio tak pernah berniat menjadikan karakter Joker sebagai pahlawan,"" tulis keterangan Warner Bros, seperti dilansir,pada Kamis (26/9).,Keterangan itu disampaikan menyikapi surat yang dikirimkan keluarga serta teman korban pembunuhan massal saat penayangan film "","" di Aurora, Colorado pada 2012. Penembakan massal itu terjadi dalam penayangan tengah malam film ""The Dark Knight Rises"" yang menyebabkan 12 korban meninggal dunia dan 70 lainnya terluka.,Setelah kejadian itu, Warner Bros selaku produser film berdonasi untuk keluarga korban. Meski demikian, kini para keluarga korban khawatir kejadian buruk bakal terjadi setelah ""Joker"" tayang.,Sementara itu, ""Joker"" tentunya menjadi salah satu proyek terbaru Warner Bros yang terpisah dari DC Extended Universe (DCEU) dan tidak mengadaptasi versi komiknya. Tak hanya itu, sutradara Todd Phillips juga menyebut bahwa ""Joker"" adalah sebuah film thriller dengan rating R yang menawarkan skenario intensif dan tema yang lebih gelap, tidak seperti proyek DC lainnya.,Film ini akan mengisahkan sosok Arthur Fleck alias Joker dengan latar tahun 1980-an, dan berfokus pada kisah orisinal Joker serta asal-usulnya. Film solo ini dipastikan akan benar-benar menampilkan,yang sangat gelap dan serius. ""Joker"" sendiri siap menyapa penggemar pada 4 Oktober mendatang.","Belum lama ini,,selaku pemeran utama "","" sempat menghebohkan media usai mendadak,. ,,,Pertanyaan tersebut rupanya merujuk pada konsep gelap yang akan diusung oleh ""Joker"", di mana film ini dikhawatirkan akan memberikan pengaruh buruk dan mempengaruhi orang-orang untuk melakukan aksi balas dendam tragis seperti yang dilakukan oleh sang Clown Prince of Crime. Baik film atau karakter Joker bukan untuk mengiklankan kejahatan kepada dunia. Pembuat film serta studio tak pernah berniat menjadikan karakter Joker sebagai pahlawan,"" tulis keterangan Warner Bros, seperti dilansir,pada Kamis (26/9).,Keterangan itu disampaikan menyikapi surat yang dikirimkan keluarga serta teman korban pembunuhan massal saat penayangan film "","" di Aurora, Colorado pada 2012. ,Sementara itu, ""Joker"" tentunya menjadi salah satu proyek terbaru Warner Bros yang terpisah dari DC Extended Universe (DCEU) dan tidak mengadaptasi versi komiknya. ,Film ini akan mengisahkan sosok Arthur Fleck alias Joker dengan latar tahun 1980-an, dan berfokus pada kisah orisinal Joker serta asal-usulnya. Film solo ini dipastikan akan benar-benar menampilkan,yang sangat gelap dan serius. "" Joker"" sendiri siap menyapa penggemar pada 4 Oktober mendatang."
"Hamil Kembar, Kecantikan Yulhee Istri Minhwan dengan Rambut Pendek Kejutkan Netizen",Selebriti,2019-09-26,https://www.wowkeren.com/berita/tampil/00275111.html,"istri,,saat ini sedang mengandung anak kembar. Mantan personel,itu memutuskan untuk mengubah gaya rambutnya di episode terbaru "","".,,,Yulhee tiba-tiba berkata, ""Kupikir aku perlu perubahan,"" dan mengatakan bahwa ia ingin memotong rambutnya. ""(Padahal) aku menyukai rambutnya yang panjang,"" ujar Minhwan dalam sesi wawancara.,Yulhee dan Minhwan kemudian pergi ke salon rambut dengan putra mereka Jaeyul, di mana Yulhee berbagi bahwa ia ingin rambutnya dipotong pendek. Ia bahkan diberi kesempatan untuk memotong rambutnya sendiri.,Ketika ditanya oleh stylist apakah ia memotong rambutnya karena lebih sulit merawat anak-anak dengan rambut panjang, Yulhee menjelaskan, ""Aku ingin mengubah suasana hatiku. Selain itu aku hamil untuk kedua kalinya dan aku menemukan bahwa rambutku benar-benar menghalangi."",,,Setelah melihat gaya rambut baru Yulhee, Minhwan ternyata menyukainya. ""Kupikir dia terlihat cantik dengan gaya rambut apa pun. Ada kualitas menarik pada rambut pendeknya,"" katanya. Ketika ditanya alasannya berubah pikiran, ia tertawa dan menjelaskan, ""Ketika kami tidur dan dia menggunakan lenganku sebagai bantal, rambutnya akan kusut."",""Dia memotongnya dengan sangat indah dan aku sangat menyukainya. Aku merasa kualitas hidupku akan meningkat!"" ungkap Yulhee senang.,Senada dengan Minhwan dan Yulhee, banyak netizen yang menyukai gaya rambut baru Yulhee. Bahkan beberapa netizen terkejut dengan kecantikan mantan idol kelahiran 1997 itu.,""Wow cantik banget! Ternyata dia terlihat sangat cantik dengan rambut pendek,"" puji netizen. ""Lihat betapa cantiknya dia dengan rambut pendek,"" komentar netizen lain. ""Terlihat jauh lebih bagus. Aku suka,"" tambah netizen. ""Tidak masalah apa rambutnya, wajahnya sudah cantik. Aku iri karena dia juga memiliki rambut tebal,"" sahut yang lain. ""Rambut panjang memang susah untuk mengurus anak. Lagipula dia masih cantik sekali dengan rambut pendek."" pungkas lainnya.","istri,,saat ini sedang mengandung anak kembar. ,Ketika ditanya oleh stylist apakah ia memotong rambutnya karena lebih sulit merawat anak-anak dengan rambut panjang, Yulhee menjelaskan, ""Aku ingin mengubah suasana hatiku. Selain itu aku hamil untuk kedua kalinya dan aku menemukan bahwa rambutku benar-benar menghalangi. Kupikir dia terlihat cantik dengan gaya rambut apa pun. Ada kualitas menarik pada rambut pendeknya,"" katanya. Aku merasa kualitas hidupku akan meningkat!"" Bahkan beberapa netizen terkejut dengan kecantikan mantan idol kelahiran 1997 itu. Ternyata dia terlihat sangat cantik dengan rambut pendek,"" puji netizen. "" Tidak masalah apa rambutnya, wajahnya sudah cantik. Aku iri karena dia juga memiliki rambut tebal,"" sahut yang lain. "" Rambut panjang memang susah untuk mengurus anak."
Gisella Anastasia Akui Tak Sembarang Pilih Endorse: Tak Ingin Bahayakan Masyarakat,Selebriti,2019-09-26,https://www.wowkeren.com/berita/tampil/00275108.html,"Sebagai seorang selebriti,merasa memiliki tanggung jawab yang besar saat mempromosikan suatu produk. Bahkan ia dapat disebut sebagai salah satu artis yang memiliki endorse terbanyak.,,,Ibunda dari Gempi tersebut mengaku tak sembarangan dalam menerima barang endorse. Gisel terlebih dahulu melakukan riset demi memastikan keamanan produk. Menurutnya, ia tak serta-merta memikirkan pundi-pundi rupiah yang didapat, namun juga tanggung jawab kepada masyarakat.,""Buat Gisel itu rezeki, banyak sekali yang ingin di-review barangnya ada makin ke sini makin aneh,'' kata Gisella Anastasia saat ditemui di Kawasan Kebayoran Baru, Jakarta Selatan, Rabu 25 September 2019. ''Enggak ada barangnya cuma kirim, minta diposting.'',Mantan istri,ini mengaku lebih selektif memilih apakah produk tersebut aman ataukah tidak. Gisel selalu meneliti apakah bahan yang digunakan lolos izin Badan Pengawasan Obat dan Makanan.,""Harus diperhatikan aman enggak,'' ungkapnya. ''BPOM asli apa enggak.'',Sementara itu, Gisel dan Gempi usai berlibur di Pulau Dewata. Di unggahannya, Gisel membagikan foto bersama Gempi saat berada di pantai. Keduanya nampak kompak mengenakan bikini. Namun dibalik liburannya tersebut, nyatanya Gempi ingin ayahnya ikut serta.,""Jadi aku udah bilang papanya nanti ajak liburan,'' ungkap Gisel. ''Ngajak temennya juga biar,biar papanya gak terlalu capek.'',Sayangnya, Gisel tak ikut serta dalam acara liburan Gempi dan Gading. Gisel mengungkapkan bahwa mereka sering menerapkan sistem seperti ini, di mana baik dirinya maupun Gading secara bergantian mengajak Gempi berlibur atau sekadar pergi ke suatu tempat bersama. Hingga saat ini ia mengungkapkan belum memiliki rencana untuk liburan bertiga.,Gisel mengungkapkan bahwa dirinya merasa bersyukur dengan sikap positif yang ditunjukkan oleh Gempi. Pasalnya, meski sang buah hati masih berusia sangat kecil, namun ia bisa beradaptasi dengan kondisi kedua orang tuanya yang telah berpisah.,""Cuma syukurnya positifnya dari keadaan yang aneh itu (cerai),'' sambungnya. ''Anak aku terbiasa untuk senang dan,dengan keadaan sekitarnya dengan siapapun.'',Gisel pun tak menutup kemungkinan untuk liburan bertiga di masa mendatang. Namun, untuk saat ini ia mengaku belum memiliki rencana tersebut karena mereka masih sama-sama sibuk dengan kegiatan masing-masing.","Sebagai seorang selebriti,merasa memiliki tanggung jawab yang besar saat mempromosikan suatu produk. Bahkan ia dapat disebut sebagai salah satu artis yang memiliki endorse terbanyak. Gisel terlebih dahulu melakukan riset demi memastikan keamanan produk. ,""Buat Gisel itu rezeki, banyak sekali yang ingin di-review barangnya ada makin ke sini makin aneh,'' kata Gisella Anastasia saat ditemui di Kawasan Kebayoran Baru, Jakarta Selatan, Rabu 25 September 2019. '' Enggak ada barangnya cuma kirim, minta diposting. Keduanya nampak kompak mengenakan bikini. Ngajak temennya juga biar,biar papanya gak terlalu capek. '',Sayangnya, Gisel tak ikut serta dalam acara liburan Gempi dan Gading. Gisel mengungkapkan bahwa mereka sering menerapkan sistem seperti ini, di mana baik dirinya maupun Gading secara bergantian mengajak Gempi berlibur atau sekadar pergi ke suatu tempat bersama. Pasalnya, meski sang buah hati masih berusia sangat kecil, namun ia bisa beradaptasi dengan kondisi kedua orang tuanya yang telah berpisah. Anak aku terbiasa untuk senang dan,dengan keadaan sekitarnya dengan siapapun. '',Gisel pun tak menutup kemungkinan untuk liburan bertiga di masa mendatang. Namun, untuk saat ini ia mengaku belum memiliki rencana tersebut karena mereka masih sama-sama sibuk dengan kegiatan masing-masing."
Foto Seksi Seolhyun Saat Syuting 'Queendom' Dibilang Mirip Agen Rahasia,TV,2019-09-26,https://www.wowkeren.com/berita/tampil/00275123.html,"bersama,saat ini memang tengah menjadi peserta "","". Idol kelahiran tahun 1995 itu pun kerap mengunggah berbagai foto menarik saat syuting di akun Instagram pribadinya.,,,Foto terbaru yang diposting Seolhyun menampilkan dirinya saat tengah bersiap-siap untuk tampil di atas panggung ""Queendom"". Melihat dari setelan jas yang dipakainya, bintang drama "","" itu bakal tampil di atas panggung mengcover lagu ""Egotistic"" milik,.,Postingan terbaru Seolhyun ini pun langsung banjir komentar fans yang memujinya seperti agen rahasia. Banyak juga yang menyebut pelantun ""Good Luck"" itu tampak panas dengan setelan jas dan lipstik merah.,""Terlihat seperti agen rahasia yang cantik,"" tulis seorang fans. ""Benar, aku melihat seorang agen rahasia paling cantik di dunia,"" sambung yang lain. ""Bahkan dia hanya memakai setelan jas. Tapi lihat aura seksinya terpancar,"" susul fans lainnya. ""Lipstik merah, setelan jas. Benar-benar panas,"" pungkas yang lain.,,,Seolhyun sendiri dalam sebuah wawancara belum lama ini mengungkap alasan AOA bergabung dengan ""Queendom"". Girl grup yang digawangi oleh,cs itu rupanya ingin menunjukkan sisi lain yang belum diketahui publik.,""Ada banyak sisi AOA yang belum bisa kami tunjukkan ke publik. Kami berpikir, ayo gunakan kesempatan ini untuk menunjukkan sisi baru grup kami. Kami memutuskan untuk berpikir 'Queendom' sebagai kesempatan untuk kami berlima tumbuh dan berkembang saat kami berlatih bersama lagi,"" ungkap Seolhyun.,Sementara itu, ""Queendom"" akan menayangkan episode terbaru pada Jumat (27/9) besok. Program garapan Mnet itu baru-baru ini menuai kritikan usai dikabarkan membiarkan para peserta membayar sendiri semua biaya penampilan panggung.","bersama,saat ini memang tengah menjadi peserta "","". Idol kelahiran tahun 1995 itu pun kerap mengunggah berbagai foto menarik saat syuting di akun Instagram pribadinya. Melihat dari setelan jas yang dipakainya, bintang drama "","" itu bakal tampil di atas panggung mengcover lagu ""Egotistic"" milik,. ,,,Seolhyun sendiri dalam sebuah wawancara belum lama ini mengungkap alasan AOA bergabung dengan ""Queendom"". Girl grup yang digawangi oleh,cs itu rupanya ingin menunjukkan sisi lain yang belum diketahui publik. Kami berpikir, ayo gunakan kesempatan ini untuk menunjukkan sisi baru grup kami. ,Sementara itu, ""Queendom"" akan menayangkan episode terbaru pada Jumat (27/9) besok. Program garapan Mnet itu baru-baru ini menuai kritikan usai dikabarkan membiarkan para peserta membayar sendiri semua biaya penampilan panggung."
"NCT 127 Posting Foto Usai Belajar Tari Saman, Johnny Jadi Sorotan",Selebriti,2019-09-26,https://www.wowkeren.com/berita/tampil/00275117.html,"Boy Grup asal Korea Selatan,baru saja berkunjung ke Indonesia. Mereka datang ke negara ini dalam rangka menghadiri acara Indonesian Television Awards 2019 yang dihelat pada Rabu (24/9) kemarin. Ajang tersebut merupakan penghargaan tahunan bagi program televisi, insan pertelevisian serta insan musik terpopuler di Indonesia.,,,Usai hadir dalam acara tersebut, grup idol besutan SM Entertainment itu memposting foto yang menghebohkan penggemarnya di Indonesia. Pasalnya, mereka mengunggah sebuah foto dengan gaya bak penari saman.,Dalam,postingan tersebut, NCT 127 menjelaskan bahwa mereka baru saja belajar tari tradisional dan juga mencoba baju tradisional. Uniknya, mereka menuliskan,tersebut dalam Bahasa Indonesia.,,,Salah satu member NCT 127 yaitu,menjadi sorotan netizen Indonesia. Berdiri di posisi tengah, penyanyi kelahiran 1995 itu tampak mengenakan pakaian tradisional Aceh berwarna kuning-ungu layaknya seorang penari Saman.,Para penggemar yang melihat foto tersebut awalnya mengira bahwa seseorang yang memakai baju tradisional itu adalah orang lokal. Mereka pun kaget sekaligus terhibur saat mengetahui bahwa orang tersebut ternyata adalah Johnny.,"",,"" tulis,. "",,"" tulis,. "",,"" tulis akun,. "",,"" tulis,.,Kedatangan NCT 127 ke Indonesia memang telah dinantikan oleh para penggemarnya. Sebelum datang ke negara ini, mereka juga sempat menyapa melalui akun Instagramnya. Meskipun baru pertama kali datang ke Indonesia, NCT 127 sudah menerima sebuah,. Dalam acara yang tayang di RCTI dan MNCTV tersebut, pelanjutun 'Superhuman' ini mendapatkan penghargaan Special Award.","Boy Grup asal Korea Selatan,baru saja berkunjung ke Indonesia. Pasalnya, mereka mengunggah sebuah foto dengan gaya bak penari saman. ,Dalam,postingan tersebut, NCT 127 menjelaskan bahwa mereka baru saja belajar tari tradisional dan juga mencoba baju tradisional. ,,,Salah satu member NCT 127 yaitu,menjadi sorotan netizen Indonesia. Mereka pun kaget sekaligus terhibur saat mengetahui bahwa orang tersebut ternyata adalah Johnny.,"",,"" ,Kedatangan NCT 127 ke Indonesia memang telah dinantikan oleh para penggemarnya. Sebelum datang ke negara ini, mereka juga sempat menyapa melalui akun Instagramnya. Dalam acara yang tayang di RCTI dan MNCTV tersebut, pelanjutun 'Superhuman' ini mendapatkan penghargaan Special Award."
