title,category,publish_date,article_url,content,summary
Boy William Rayakan Ulang Tahun Mendiang Adik Lewat Postingan Mengharukan Ini,Selebriti,2019-10-02,https://www.wowkeren.com/berita/tampil/00276101.html,"beberapa waktu lalu sempat dilanda rasa duka mendalam. Pasalnya adik Boy yang bernama Raymond Hartanto,akibat mengalami kecelakaan tunggal di kawasan Sleman, Daerah Istimewa Yogyakarta (DIY), pada 10 September lalu.,,,Kala itu, Raymond sedang mengendarai sepeda motor dengan kecepatan tinggi, namun tiba-tiba oleng ke kiri dan menabrak tembok. Raymond sendiri meninggalkan seorang istri dan putrinya yang masih kecil bernama Kylie Lazuardi. Boy pun menyebutkan bahwa ia akan merawat dan menjaga Kylie.,Setelah beberapa waktu berlalu, Boy kembali mengungkapkan rasa rindunya terhadap Raymond. Melalui foto yang diunggah di Instagram pada Selasa (1/10), Boy mengungkapkan bahwa Raymond sedang berulang tahun. Presenter berusia 27 tahun tersebut pun menunjukkan foto alat pembuka botol milik Raymond, dan sebotol bir bertuliskan nama Boy.,Tak hanya itu, Boy juga berharap ia bisa merayakan ulang tahun Raymond dengan mengajaknya minum bersama di bar. "",,"" tulis Boy dalam bahasa Inggris di bagian keterangan foto.,,,Postingan Boy tersebut pun mengundang banyak netizen untuk memberikan komentar sekaligus mendoakan Raymond. Mereka juga merasa terharu serta memberikan semangat kepada Boy, agar kuat dan mengikhlaskan kepergian Raymond untuk selama-lamanya.,"",,"" ujar akun,. "",,"" imbuh akun,.,"",,"" komentar akun,. "",,"" imbuh akun,.","beberapa waktu lalu sempat dilanda rasa duka mendalam. Raymond sendiri meninggalkan seorang istri dan putrinya yang masih kecil bernama Kylie Lazuardi. Melalui foto yang diunggah di Instagram pada Selasa (1/10), Boy mengungkapkan bahwa Raymond sedang berulang tahun. Presenter berusia 27 tahun tersebut pun menunjukkan foto alat pembuka botol milik Raymond, dan sebotol bir bertuliskan nama Boy. ,Tak hanya itu, Boy juga berharap ia bisa merayakan ulang tahun Raymond dengan mengajaknya minum bersama di bar. "",,"" tulis Boy dalam bahasa Inggris di bagian keterangan foto."
"Shireen Sungkar Niat Unfollow Instagram Teuku Wisnu Gara-Gara Foto Endorse Produk, Kok Bisa?",Selebriti,2019-10-02,https://www.wowkeren.com/berita/tampil/00276099.html,"Sebagai seorang,yang mempunyai banyak fans,,tak ketinggalan memanfaatkan media sosial sebagai ladang,. Dilihat dari postingan Instagram pada Selasa (1/10), Wisnu ternyata mempromosikan sebuah produk penyubur rambut.,,,Menariknya, Wisnu tidak hanya memperlihatkan rambutnya yang lebat. Dalam foto,, ia ternyata memiliki badan besar dan kekar yang dibalut kostum superhero "","" lengkap dengan kilatan petir.,Tentu saja foto Wisnu ala Thor tersebut sekadar editan. Meski demikian pria berusia 34 tahun itu mencantumkan sejumlah testimoni pengguna produk yang dipromosikannya dalam,setelah foto ala Thor. "",,"" tulis Wisnu.,,,Postingan,Wisnu yang tak biasa itu ternyata mendapat reaksi mengejutkan dari sang istri,,. Saat melihat foto editan sang suami, Shireen malah berniat berhenti mengikuti Instagram Wisnu. "",,"" tulis Shireen diikuti dengan emoji menangis sambil tertawa.,,,Warganet juga ramai memenuhi kolom komentar Wisnu dengan tanggapan kocak. Mereka dibuat terhibur hingga terbahak saat melihat postingan bapak dengan 3 orang anak itu.,"",,"" sambung,. "",,"" tambah akun,. "",,"" sahut akun,. "",,"" imbuh akun,. "",,"" kata akun,.,"",,"" komentar akun,. "","" seru akun,. "",,"" puji akun,. "",,"" tulis akun,.","Sebagai seorang,yang mempunyai banyak fans,,tak ketinggalan memanfaatkan media sosial sebagai ladang,. ,,,Menariknya, Wisnu tidak hanya memperlihatkan rambutnya yang lebat. Meski demikian pria berusia 34 tahun itu mencantumkan sejumlah testimoni pengguna produk yang dipromosikannya dalam,setelah foto ala Thor. "",,"" tulis Shireen diikuti dengan emoji menangis sambil tertawa. ,,,Warganet juga ramai memenuhi kolom komentar Wisnu dengan tanggapan kocak. Mereka dibuat terhibur hingga terbahak saat melihat postingan bapak dengan 3 orang anak itu.,"",,"""
Ketua DPR Puan Maharani Ternyata Punya Hobi 'Garang' Koleksi Moge Harley Davidson,Nasional,2019-10-02,https://www.wowkeren.com/berita/tampil/00276098.html,"Ketua Dewan Perwakilan Rakyat (DPR) terpilih periode 2019-2024 Puan Maharani ternyata memiliki hobi yang cukup ""garang"" terlepas dari sepak terjangnya yang mentereng dalam dunia politik Indonesia. Puan Maharani diketahui hobi mengoleksi sejumlah mobil dan motor berkapasitas mesin besar alias moge (motor gede).,,,Hobi Ketua DPR ini diketahui berdasarkan data kekayaan terakhir yang telah disampaikan ke Laporan Hasil Kekayaan Penyelenggara Negara (LHKPN) pada April 2015 lalu. Tercatat, Puan Maharani memiliki empat mobil dan tiga moge dengan merek Harley Davidson.,Berdasarkan data yang ada, moge yang dimiliki mantan Menteri Koordinator bidang Pembangunan Manusia ini merupakan moge yang sudah tua. Sementara itu sejumlah koleksi mobil yang dimiliki Puan Maharani juga merupakan mobil antik buatan industri mobil ternama luar negeri.,Moge Harley Davidson milik Puan Maharani yang merupakan merek asal Amerika Serikat tersebut terdiri dari buatan tahun 2003 dengan nilai Rp120 juta serta dua unit lainnya tahun pembuatan 2002 yang nilainya sebesar Rp85 juta dan Rp80 juta. Walau begitu tidak disebutkan secara rinci nama masing-masing dari moge Harley-Davidson milik Puan Maharani.,Sementara untuk koleksi mobil, anak dari mantan Presiden Ke-5 Indonesia Megawati Soekarnoputri ini memiliki dua mobil merek Volkswagen. Dua kendaraan tersebut merupakan mobil tua dan klasik yang berjenis Volkswagen Beetle produksi tahun 2000 senilai Rp200 juta serta sedan klasik Volkswagen Karmann Ghia buatan 1961 yang bernilai Rp65 juta.,Sementara itu Puan Maharani juga memiliki dua mobil lawas lainnya yang turut menjadi aset hartanya. Kedua mobil tersebut adalah Daihatsu Taruna keluaran tahun 2002 senilai Rp130 juta dan Toyota Land Cruiser buatan tahun 2008 yang mencapai Rp400 juta.,Sorotan publik kepada Puan Maharani sendiri semakin bertambah seiiring dengan terpilihnya sebagai Ketua DPR Republik Indonesia untuk periode 2019-2024 menggantikan Bambang Soesatyo. Puan Maharani telah dilantik menjadi Ketua DPR pada Selasa (1/10) setelah namanya disodorkan oleh PDIP yang telah memenangkan suara terbanyak pada Pemilu 2019.","Ketua Dewan Perwakilan Rakyat (DPR) terpilih periode 2019-2024 Puan Maharani ternyata memiliki hobi yang cukup ""garang"" terlepas dari sepak terjangnya yang mentereng dalam dunia politik Indonesia. Puan Maharani diketahui hobi mengoleksi sejumlah mobil dan motor berkapasitas mesin besar alias moge (motor gede).,,,Hobi Ketua DPR ini diketahui berdasarkan data kekayaan terakhir yang telah disampaikan ke Laporan Hasil Kekayaan Penyelenggara Negara (LHKPN) pada April 2015 lalu. Tercatat, Puan Maharani memiliki empat mobil dan tiga moge dengan merek Harley Davidson. Sementara itu sejumlah koleksi mobil yang dimiliki Puan Maharani juga merupakan mobil antik buatan industri mobil ternama luar negeri. ,Sementara untuk koleksi mobil, anak dari mantan Presiden Ke-5 Indonesia Megawati Soekarnoputri ini memiliki dua mobil merek Volkswagen. Dua kendaraan tersebut merupakan mobil tua dan klasik yang berjenis Volkswagen Beetle produksi tahun 2000 senilai Rp200 juta serta sedan klasik Volkswagen Karmann Ghia buatan 1961 yang bernilai Rp65 juta. ,Sorotan publik kepada Puan Maharani sendiri semakin bertambah seiiring dengan terpilihnya sebagai Ketua DPR Republik Indonesia untuk periode 2019-2024 menggantikan Bambang Soesatyo."
"Bakal Siarkan Episode Khusus Soal Manipulasi Voting 'Produce X 101', 'PD Note' Trending di Naver",TV,2019-10-02,https://www.wowkeren.com/berita/tampil/00276097.html,"Kecurigaan soal adanya manipulasi voting "","" sukses menjadi perhatian banyak pihak. Tak terkecuali program acara MBC "","". Hal ini disebabkan karena ""PD Note"" merupakan program jurnalisme investigasi yang menyelidiki masalah kontroversial di Korea Selatan.,,,Meskipun berbeda stasiun penyiaran, tampaknya ""PD Note"" menaruh perhatian besar pada kecurigaan ini. Beberapa waktu lalu ""PD Note"" mengumumkan jika mereka akan,kasus ini dan meminta bantuan penggemar. Saat itu, mereka berharap agar penggemar mengirimkan segala dokumen yang berkaitan dengan kasus ini.,Kini, tim produksi akhirnya mengumumkan jadwal siaran episode khusus yang akan mengupas permasalahan ini. Episode ini dijadwalkan tayang pada 15 Oktober mendatang.,Dalam cuplikan yang dibagikan, ""PD Note"" mengungkapkan kalau mereka telah menyelidiki masalah ini selama beberapa waktu. Mereka juga berjanji untuk mengungkapkan kebenaran yang tersembunyi.,""Kami mendengarkan. Kami mendengarkan cerita, kami sudah tahu tugas kami sebelumnya. Berbagai hal telah dipadukan dengan adegan-adegan kompetisi yang tidak adil dalam audisi pembentuk idol CJ,"" bunyi kalimat dalam cuplikan itu.,,,,,""Gairah para trainee (dibuat seperti),, hasil voting dimanipulasi dan anak-anak menangis, 'TOLONG SELAMATKAN KAMI'. Produser nasional yang terhormat, kami akan mengungkapkan KEBENARAN,"" akhir cuplikan itu.,Setelah cuplikan ini dirilis, ""PD Note"" langsung trending nomor 5 mesin pencarian Naver. Karena itulah, episode khusus ini sangat dinantikan oleh ribuan pemirsa. Meski demikian, pemirsa juga berharap agar ""PD Note"" bisa meluruskan fakta dengan objektif, karena biar bagaimanapun MBC merupakan pesaing langsung dari Mnet.","Kecurigaan soal adanya manipulasi voting "","" sukses menjadi perhatian banyak pihak. ,,,Meskipun berbeda stasiun penyiaran, tampaknya ""PD Note"" menaruh perhatian besar pada kecurigaan ini. Beberapa waktu lalu ""PD Note"" mengumumkan jika mereka akan,kasus ini dan meminta bantuan penggemar. Episode ini dijadwalkan tayang pada 15 Oktober mendatang. Mereka juga berjanji untuk mengungkapkan kebenaran yang tersembunyi. Kami mendengarkan cerita, kami sudah tahu tugas kami sebelumnya. ,,,,,""Gairah para trainee (dibuat seperti),, hasil voting dimanipulasi dan anak-anak menangis, 'TOLONG SELAMATKAN KAMI'. Meski demikian, pemirsa juga berharap agar ""PD Note"" bisa meluruskan fakta dengan objektif, karena biar bagaimanapun MBC merupakan pesaing langsung dari Mnet."
Kai Pamer Video Seksi Bikin Fans Histeris Dan Tagih Debut Solo,Selebriti,2019-10-02,https://www.wowkeren.com/berita/tampil/00276103.html,"Akhir-akhir ini,,tengah disibukkan dengan persiapan debutnya bersama boy grup baru,. Boy grup baru besutan SM Entertainment itu akan resmi debut pada 4 Oktober 2019 mendatang.,,,Sebelumnya, Kai bersama para member SuperM juga telah melakukan syuting untuk MV lagu di album pertama mereka. Penyanyi kelahiran 1994 itu pun membagikan cuplikan video dirinya dalam MV yang akan dirilis oleh SuperM.,Dalam video yang diunggah di Instagram tersebut, Kai sedang bernyanti dan tengah melakukan tarian solo yang sangat enerjik. Penyanyi itu nampak mengenakan kemeja hitam yang terbuka. Alhasil, perut,Kai yang terlihat jelas dalam video tersebut membuat dirinya terlihat seksi.,,,Para penggemar yang melihat video di Instagram tersebut pun nampak histeris. Melalui kolom komentar postingan tersebut, para penggemar memuji jika Kai sangat seksi hingga mereka merasa panas.,"",,"" ungkap,. "",,"" tulis,. "",,"" ungkap,.,Selain itu, para penggemar pun menginginkan pria yang bernama asli Kim Jong In ini melakukan debut solo. Hal ini karena Kai nampak sangat keren dan bertalenta dalam video tersebut.,"",,"" tulis,. "",,"" ungkap,. "",,"" ungkap,.,Sementara itu, para member EXO yang lain memang diketahui sudah melakukan debut solo. Bahkan baru-baru ini,,EXO merilis lagu album keduanya yang bertajuk "","" dan menduduki posisi,dunia di iTunes.,EXO sendiri saat ini diketahui sedang dalam rangkaian tur konser dunia bertajuk ""EXplOration"". Konser tunggal EXO ini digelar di berbagai negara seperti Hong Kong, Filipina, Singapura, Thailand, Jepang dan bahkan Indonesia.","Akhir-akhir ini,,tengah disibukkan dengan persiapan debutnya bersama boy grup baru,. Boy grup baru besutan SM Entertainment itu akan resmi debut pada 4 Oktober 2019 mendatang. ,,,Sebelumnya, Kai bersama para member SuperM juga telah melakukan syuting untuk MV lagu di album pertama mereka. Penyanyi kelahiran 1994 itu pun membagikan cuplikan video dirinya dalam MV yang akan dirilis oleh SuperM.,Dalam video yang diunggah di Instagram tersebut, Kai sedang bernyanti dan tengah melakukan tarian solo yang sangat enerjik. Penyanyi itu nampak mengenakan kemeja hitam yang terbuka. Melalui kolom komentar postingan tersebut, para penggemar memuji jika Kai sangat seksi hingga mereka merasa panas.,"",,"" Konser tunggal EXO ini digelar di berbagai negara seperti Hong Kong, Filipina, Singapura, Thailand, Jepang dan bahkan Indonesia."
"Ananda Badudu Berterima Kasih pada Dian Sastro, Kini Hadapi Somasi Polisi Meski Telah Dibebaskan",Selebriti,2019-10-02,https://www.wowkeren.com/berita/tampil/00276091.html,"musisi sekaligus mantan wartawan,pada 27 September lalu karena menggalang dana untuk demo mahasiswa sukses mengejutkan publik. Salah satunya,yang ikut mengungkapkan keterkejutan serta kesedihannya melalui beberapa InstaStory.,,,"",,"" tulis Dian pada hari yang sama saat Ananda Badudu ditangkap. "",."",Meski telah dibebaskan, kini Ananda Badudu kembali dihadapkan somasi Polda Metro Jaya. Somasi itu terkait pernyataan Ananda Badudu soal sejumlah mahasiswa yang tidak mendapat pendampingan pengacara dan diproses secara tidak etis. Baru-baru ini, Ananda Badudu mengungkapkan rasa terima kasihnya atas dukungan Dian Sastro.,""Saya juga makasih banyak buat Mbak Dian Sastro ya,"" ujar Ananda Badudu. ""Saya lihat IG,Mba Dian Sastro dan saya gimana ya, saya merasa terharu karena keberadaan saya di dunia ini di-,oleh seorang Dian Sastro sampai lima IG,lo."",,,Selain Dian Sastro, Ananda Badudu juga berterima kasih atas dukungan warganet. Menurut Ananda Badudu, dukungan warganet ikut berperan serta atas kebebasannya dan,yang juga,karena dianggap melanggar UU ITE atas cuitannya di Twitter soal Papua.,""Saya berterima kasih banyak kepada atas semua,-nya atas semua kerisauan di medsos dengan tagar bebaskan Ananda Badudu dan bebaskan Dandhy Laksono saya juga terima kasih,"" tandas Ananda Badudu. ""Maksudnya saya benar-benar merasakan dukungan itu dan mungkin saya nasibnya tidak akan seberuntung itu kalau publik,-nya sebesar kemarin."",Terkait somasi dari Polda, Ananda Badudu mengaku bersedia mengikuti semua prosedur hukum yang ada. Ananda yang sebelumnya ditangkap secara tiba-tiba, kini lebih siap menghadapi pemanggilan dari kepolisian serta telah menyiapkan tim hukum untuk mendampinginya.","musisi sekaligus mantan wartawan,pada 27 September lalu karena menggalang dana untuk demo mahasiswa sukses mengejutkan publik. Salah satunya,yang ikut mengungkapkan keterkejutan serta kesedihannya melalui beberapa InstaStory.,,,"",,"" ."",Meski telah dibebaskan, kini Ananda Badudu kembali dihadapkan somasi Polda Metro Jaya. Somasi itu terkait pernyataan Ananda Badudu soal sejumlah mahasiswa yang tidak mendapat pendampingan pengacara dan diproses secara tidak etis. "",,,Selain Dian Sastro, Ananda Badudu juga berterima kasih atas dukungan warganet. ,""Saya berterima kasih banyak kepada atas semua,-nya atas semua kerisauan di medsos dengan tagar bebaskan Ananda Badudu dan bebaskan Dandhy Laksono saya juga terima kasih,"" tandas Ananda Badudu. "" Ananda yang sebelumnya ditangkap secara tiba-tiba, kini lebih siap menghadapi pemanggilan dari kepolisian serta telah menyiapkan tim hukum untuk mendampinginya."
Dewi Sanca Tak Terima Irma Darmawangsa Jadikan Masalah Kehamilannya Sebagai Konten YouTube,Selebriti,2019-10-02,https://www.wowkeren.com/berita/tampil/00276100.html,"Sebelumnya,sempat menuliskan sebuah status,di InstaStory miliknya pada 13 September lalu. Ketika dilihat isinya, tampaknya status tersebut diperuntukkan untuk rekan perempuannya yang sesama penyanyi.,,,Lantas baru-baru ini, penyanyi yang menyebut dirinya sebagai ratu ular itu kembali menuliskan sindiran di media sosialnya. Tidak seperti sebelumnya, kali ini Dewi langsung menyebutkan untuk siapa status sindiran pedas tersebut dibuat.,Dan rupanya Dewi me-,nama akun Instagram,. Perempuan berusia 36 tahun ini terlihat tak terima karena masalah soal kehamilannya telah dijadikan sebagai konten di kanal YouTube-nya Irma.,,,‚Äú,,‚Äù tulis Dewi dengan menambahkan emoji meledek di InstaStory-nya. ‚Äú,.‚Äù,‚Äú,,‚Äù tambah Dewi lagi di InstaStory-ny yang lain. ‚Äù,‚Äù,‚ÄúIni buat luh‚Ä¶dr kemarin nggak berasa jg wouuih @irmadarmawangsa,‚Äù tandas Dewi. Unggahan ini kemudian dibagikan ulang oleh akun gosip hingga akhirnya menuai beragam respon dari netter.,‚Äú,,‚Äù tulis akun,dengan menambahkan emoji tertawa. ‚Äú,,‚Äù komentar akun,.","Sebelumnya,sempat menuliskan sebuah status,di InstaStory miliknya pada 13 September lalu. ,,,Lantas baru-baru ini, penyanyi yang menyebut dirinya sebagai ratu ular itu kembali menuliskan sindiran di media sosialnya. Perempuan berusia 36 tahun ini terlihat tak terima karena masalah soal kehamilannya telah dijadikan sebagai konten di kanal YouTube-nya Irma. ,,,‚Äú,,‚Äù tulis Dewi dengan menambahkan emoji meledek di InstaStory-nya. ‚ ‚Äù,‚Äú,,‚Äù tambah Dewi lagi di InstaStory-ny yang lain. ‚ Unggahan ini kemudian dibagikan ulang oleh akun gosip hingga akhirnya menuai beragam respon dari netter."
"Sudah Kembali 'Mesra' Dengan Garuda Indonesia, Surat Resign Dua Direksi Sriwijaya Air Ditolak",Nasional,2019-10-02,https://www.wowkeren.com/berita/tampil/00276109.html,"Sengketa kerja sama yang menyangkut Garuda Indonesia Group dengan Sriwijaya Air Group sempat menjadi perbincangan hangat akhir-akhir ini. Untungnya kedua belah pihak akhirnya memutuskan untuk,setelah sempat melayangkan,di pengadilan.,,,Berdamainya Garuda Indonesia Group dan Sriwijaya Air Group ini membuat surat pengunduran diri yang diajukan oleh kedua direksi Sriwijaya Air yang baru saja diajukan akhirnya ditolak. Dua direksi tersebut adalah Direktur Operasi Capt Fadjar Semiarto dan Direktur Teknik Romdani Ardali Adang.,Penolakan surat pengunduran kedua direktur tersebut disampaikan oleh Direktur Quality, Safety & Security Sriwijaya Air Capt. Toto Soebandoro. ""Itu sama Sriwijaya pernyataan,-nya ditolak. Karena sudah ada penyelesaiannya,"" ujar Toto dilansir,, Selasa (1/10). ""Jadi pengunduran diri ditolak ya."",Dengan penolakan tersebut, baik baik Fadjar maupun Romdani tetap menjabat sebagai direksi Sriwijaya Air. ""Masih (menjabat). Sampai saat ini masih karena ditolak. Karena sebetulnya seperti mereka berdua, dan saya juga, kalau,itu nggak boleh langsung gitu aja,"" papar Toto. ""Ada tenggang waktu satu bulan untuk memberikan kesempatan untuk mencari penggantinya."",Lebih lanjut Toto mengatakan jika ditolaknya pengunduran diri Fadjar dan Romdani sejalan dengan kembalinya kerja sama manajemen (KSM) antara Sriwijaya Air dengan Garuda Indonesia Group. Sehingga, GMF AeroAsia kembali menangani operasional pesawat Sriwijaya Air.,Sebelumnya, Direktur Operasi Capt Fadjar Semiarto dan Direktur Teknik Romdani Ardali Adang berencana akan mengundurkan diri terkait rekomendasi setop terbang maskapai tersebut yang tak digubris oleh Plt Direktur Utama Sriwijaya Air Jefferson I. Jauwen. Keputusan Jefferson selaku perwakilan pemegang saham memutuskan agar Sriwijaya Air tetap beroperasi.,Apalagi saat ini kerja sama dengan KSM terjalin kembali dan GMF AeroAsia menangani operasional pesawat lagi, sehingga Sriwijaya Air telah dinyatakan laik terbang. ""Jadi sekarang laik beroperasi. Yang penting Sriwijaya harus punya kerja sama dengan MRO supaya cukup orangnya, kan sekarang sudah ada, jadi ya sudah hilang (,-nya),"" pungkas Toto.","Sengketa kerja sama yang menyangkut Garuda Indonesia Group dengan Sriwijaya Air Group sempat menjadi perbincangan hangat akhir-akhir ini. Untungnya kedua belah pihak akhirnya memutuskan untuk,setelah sempat melayangkan,di pengadilan. Itu sama Sriwijaya pernyataan,-nya ditolak. Ada tenggang waktu satu bulan untuk memberikan kesempatan untuk mencari penggantinya. "",Lebih lanjut Toto mengatakan jika ditolaknya pengunduran diri Fadjar dan Romdani sejalan dengan kembalinya kerja sama manajemen (KSM) antara Sriwijaya Air dengan Garuda Indonesia Group. Sehingga, GMF AeroAsia kembali menangani operasional pesawat Sriwijaya Air. ,Sebelumnya, Direktur Operasi Capt Fadjar Semiarto dan Direktur Teknik Romdani Ardali Adang berencana akan mengundurkan diri terkait rekomendasi setop terbang maskapai tersebut yang tak digubris oleh Plt Direktur Utama Sriwijaya Air Jefferson I. Jauwen. Yang penting Sriwijaya harus punya kerja sama dengan MRO supaya cukup orangnya, kan sekarang sudah ada, jadi ya sudah hilang (,-nya),"" pungkas Toto."
"Amber Liu Umumkan Gelar Tur Konser Solo Pasca Tinggalkan SM, Bakal Dimulai di Amerika Utara",Musik,2019-10-02,https://www.wowkeren.com/berita/tampil/00276090.html,"Usai meninggalkan SM Entertainment,,saat ini tengah sibuk bersolo karir dengan merilis album baru. Album solo Amber ini bertajuk ""X"" dan memiliki total 6 lagu baru. Lagu tersebut antara lain, ""Hands Behind My Back'', ''Other People'', ''Curiosty'', ''Numb'', ''Ready For The Ride'', dan ''Stay Calm''.,,,Usai sukses dengan solo karirnya, Amber juga baru saja mengumumkan akan menyapa penggemar internasionalnya lewat tur konser solo. Amber Liu mengumumkan rencana untuk tur konser bertajuk ""X"" yang akan dimulai di Amerika Utara.,,,Amber akan memulai tur ""X"" pada tahun 2020 dengan 24 pertunjukan yang dimulai pada 17 Januari di Fresno, California. Setelah itu ia akan berkeliling negara dengan berhenti konser di San Francisco, Atlanta, Denver, New York, Chicago, Boston, Austin, Minneapolis, Los Angeles, Detroit, Vancouver, dan lainnya, sebelum diakhiri pada 22 Februari di San Diego.,Untuk tikenya sendiri sudah mulai dijual pada hari Jumat, 4 Oktober pukul 10 pagi waktu setempat. Khusus untuk fans VIP penjualan akan berlangsung lebih awal yakni pada 1 Oktober pukul 1 siang waktu setempat dan berjalan hingga Kamis, 3 Oktober jam 10 malam.,Amber sendiri baru-baru ini memperluas promosi Amerika-nya dengan menandatangani kesepakatan yang akan memperluas kemitraan Amber dengan Kevin Morrow dan John Kim, yang mulai mengelola bersama karirnya di Amerika pada 2018. Tahun pertama mereka bekerja bersama terbukti sangat penting dalam membawa popularitas global Amber ke tingkat berikutnya sebagai artis solo dan influencer.,Sepertinya Amber akan mengambil bagian dalam banyak kegiatan promosi yang terfokus di Amerika. Amber sendiri memulai debut bersama,pada 2009 dan memiliki fanbase besar. Pada 2015,,meninggalkan grup dan f(x) dipromosikan hanya dengan empat member. Namun mereka telah lama absen setelah comeback terakhir dengan ""4 Walls"" pada 2015.","Usai meninggalkan SM Entertainment,,saat ini tengah sibuk bersolo karir dengan merilis album baru. Lagu tersebut antara lain, ""Hands Behind My Back'', ''Other People'', ''Curiosty'', ''Numb'', ''Ready For The Ride'', dan ''Stay Calm''. ,,,Amber akan memulai tur ""X"" pada tahun 2020 dengan 24 pertunjukan yang dimulai pada 17 Januari di Fresno, California. ,Untuk tikenya sendiri sudah mulai dijual pada hari Jumat, 4 Oktober pukul 10 pagi waktu setempat. ,Amber sendiri baru-baru ini memperluas promosi Amerika-nya dengan menandatangani kesepakatan yang akan memperluas kemitraan Amber dengan Kevin Morrow dan John Kim, yang mulai mengelola bersama karirnya di Amerika pada 2018. Tahun pertama mereka bekerja bersama terbukti sangat penting dalam membawa popularitas global Amber ke tingkat berikutnya sebagai artis solo dan influencer. ,Sepertinya Amber akan mengambil bagian dalam banyak kegiatan promosi yang terfokus di Amerika. Namun mereka telah lama absen setelah comeback terakhir dengan ""4 Walls"" pada 2015."
