title,category,publish_date,article_url,content,summary
"Bebby Fey Beberkan Bukti, Atta Halilintar Tolak Tuduhan Lewat Jawaban Somasi",Selebriti,2019-09-26,https://www.wowkeren.com/berita/tampil/00275188.html,"akhirnya,sosok YouTuber yang sebelumnya ramai dipertanyakan. Ia menyebutkan nama,sebagai YouTuber terkenal yang sudah mengajaknya ‚Äúngamar‚Äù bareng.,,,Sebelumnya Bebby sempat mengunggah foto seorang pria yang ia sensor wajahnya. Namun kini Bebby menunjukkan wajah YouTuber yang mengajaknya kencan tersebut. Di salah satu foto menunjukkan Atta saat duduk di kursi. Di belakang Atta tampak tas merah milik Bebby.,,,Tak hanya itu, Bebby juga menunjukan 105 halaman foto yang akan dijadikan bukti. ‚Äú105 lembar halaman,,dia itu 90 persen porno. Terus lagi banyak bukti-bukti lainnya dan,, petunjuk. Dalam bukti ini untuk mempertahankan hak kami guna menunjukkan kejadian sebenarnya kepada masyarakat,‚Äù papar kuasa hukum Bebby, Yanuar Bagus Sasmito saat jumpa pers di Pondok Indah, Jakarta Selatan, Rabu (25/9).,Meski begitu Bebby mengaku tak berniat melanjutkan kasus ini demi menjalankan amanat dari sang ibunda. Namun kini beredar foto surat jawaban somasi dari manajemen Atta Halilintar yang ditujukan kepada kuasa hukum Bebby.,,,‚ÄúSaya selaku management dari Atta Halilintar telah mendapatkan intruksi dari Atta Halilintar untuk menolak tuduhan dari saudara yang tanpa bukti dan tidak berdasar,‚Äù isi surat jawaban somasi tersebut. Foto ini lantas dibagikan ulang oleh akun gosip di Instagram.,Rupanya banyak dari netter yang masih tak percaya bahwa YouTuber terkenal yang dimaksud Bebby adalah Atta Halilintar. Bahkan mereka masih menganggap berita tersebut,.,‚Äú,,‚Äù tulis akun,. ‚Äú,‚Äù sahut akun,. ‚Äú,‚Äù komentar akun,","akhirnya,sosok YouTuber yang sebelumnya ramai dipertanyakan. Ia menyebutkan nama,sebagai YouTuber terkenal yang sudah mengajaknya ‚Äúngamar‚Äù bareng. Namun kini Bebby menunjukkan wajah YouTuber yang mengajaknya kencan tersebut. Di salah satu foto menunjukkan Atta saat duduk di kursi. Terus lagi banyak bukti-bukti lainnya dan,, petunjuk. Dalam bukti ini untuk mempertahankan hak kami guna menunjukkan kejadian sebenarnya kepada masyarakat,‚Äù papar kuasa hukum Bebby, Yanuar Bagus Sasmito saat jumpa pers di Pondok Indah, Jakarta Selatan, Rabu (25/9).,Meski begitu Bebby mengaku tak berniat melanjutkan kasus ini demi menjalankan amanat dari sang ibunda. Foto ini lantas dibagikan ulang oleh akun gosip di Instagram. Bahkan mereka masih menganggap berita tersebut,."
Video Jungkook BTS Diteriaki Suruh Potong Rambut dan Hapus Tato Bikin Netizen Geram,Selebriti,2019-09-26,https://www.wowkeren.com/berita/tampil/00275176.html,"Belakangan ini penampilan,sering menjadi perhatian publik. Member termuda,(,) itu tampil dengan rambut gondrong dan beberapa waktu lalu terlihat memiliki tato di punggung tangan kanannya.,,,Selasa (24/9) pagi, para member BTS terlihat di bandara internasional Incheon pulang dari syuting reality show tahunan "","" di Selandia Baru. Kedatangan mereka tak hanya disambut awak media tapi juga para penggemar.,Salah satu video rekaman penggemar baru-baru ini menjadi sorotan di komunitas online. Video memperlihatkan seorang penggemar yang berteriak menyuruh Jungkook memotong rambut dan menghapus tatonya.,,,""Jeon Jungkook, potong rambutmu! Jeon Jungkook hapus tatomu,"" teriak penggemar. Sikapnya yang dinilai tak sopan dan sok mengatur kehidupan Jungkook sukses membuat netizen geram dan memberikan komentar-komentar seperti ini:,""Kenapa dia melakukan itu? Apakah dia gila?"",""Apakah dia gila? Jungkook bukan seorang tentara yang harus plontos.,""Anak-anak itu menakutkan.,""Sial, apa yang dia pikirkan? Dia tidak punya hak untuk mengendalikan Jungkook.,""Apakah dia gila? Dia berpikir bahwa Jungkook adalah teman atau adik laki-lakinya.,""Bahkan ibu Jungkook tidak mengatakan itu padanya. Kenapa dia berani?,""Kenapa dia begitu gila? Dia harus peduli tentang hidupnya, bukan kehidupan orang lain.,""Belakangan ini Jungkook berada di bawah banyak tekanan. Kenapa dia melakukan itu? Dia jelas antifan, bukan penggemar.,""Fandom BTS sangat besar sehingga semua jenis orang gila berkumpul di sini.,""Apakah dia antifan? Aku tidak berpikir penggemar bisa melakukan ini.,""Anak-anak itu harus masuk daftar hitam dan tidak ada acara atau konser lainnya.,""Apakah dia gila? Apakah dia tidak malu?,Sementara itu, telah dikonfirmasi bahwa BTS akan mengunjungi Arab Saudi untuk konser di King Fahd International Stadium, Riyadh pada 11 Oktober. Mereka juga akan menggelar konser final untuk tur ""Love Yourself: Speak Yourself"" di Seoul selama tiga hari yaitu 26, 27 dan 29 Oktober.","Belakangan ini penampilan,sering menjadi perhatian publik. Kedatangan mereka tak hanya disambut awak media tapi juga para penggemar. ,Salah satu video rekaman penggemar baru-baru ini menjadi sorotan di komunitas online. Sikapnya yang dinilai tak sopan dan sok mengatur kehidupan Jungkook sukses membuat netizen geram dan memberikan komentar-komentar seperti ini:,""Kenapa dia melakukan itu? ,""Bahkan ibu Jungkook tidak mengatakan itu padanya. Kenapa dia berani?,""Kenapa dia begitu gila? Dia harus peduli tentang hidupnya, bukan kehidupan orang lain. ,""Fandom BTS sangat besar sehingga semua jenis orang gila berkumpul di sini. Aku tidak berpikir penggemar bisa melakukan ini. Apakah dia tidak malu?,Sementara itu, telah dikonfirmasi bahwa BTS akan mengunjungi Arab Saudi untuk konser di King Fahd International Stadium, Riyadh pada 11 Oktober."
PM Mahathir Sebut Dunia Tak Bisa Tekan Indonesia Soal Kebakaran Hutan,Dunia,2019-09-26,https://www.wowkeren.com/berita/tampil/00275183.html,"Meskipun bencana kebakaran hutan dan lahan (karhutla) terjadi di Indonesia, akan tetapi, dampak dari kebakaran hebat itu berimbas kepada negara lain. Tak hanya di Indonesia, asap akibat karhutla di Sumatera dan Kalimantan juga menyebar sampai Malaysia, Singapura bahkan sebagian kecil wilayah Thailand.,,,Hal tersebut membuat beberapa pimpinan negara lain tergerak. Malaysia sempat mendesak Indonesia agar segera menangani dan melakukan pencegahan bencana karhutla. Beberapa negara seperti Malaysia dan Singapura juga menawarkan bantuan untuk Indonesia. Akan tetapi, tawaran bantuan tersebut tidak direspon oleh pemerintah RI.,Menanggapi hal tersebut, Perdana Menteri (PM) Malaysia Mahathir Mohamad mengatakan bahwa dunia internasional memang tidak bisa memaksa Indonesia untuk menangani kebakaran hutan. Meskipun dampak karhutla berimbas ke negaranya, tidak ada celah dalam sistem internasional yang mengizinkannya turut campur karena kebakaran tersebut terjadi di Indonesia. Komentar Mahathir tersebut disampaikan di sela kunjungannya menghadiri Sidang Majelis Umum PBB.,""Sistem internasional saat ini tak bisa bisa memaksa Indonesia menangani kebakaran hutan yang berimbas ke wilayah tempat kami tinggal,"" kata Mahathir di New York, seperti dikutip,pada Kamis (26/9). ""Anda bisa menyalahkan Indonesia, mengkritik mereka, tapi api milik mereka tetap ada."",Saat ditanyai apakah Indonesia perlu disanksi atas kebakaran hutan dan lahan yang terus terjadi, Mahathir menyatakan bahwa tidak ada negara yang bisa mengintervensi negara lain. Ia pun memberi contoh sikap Presiden Brazil saat menanggapi kebakaran di Hutan Amazon.,""Seperti kalian tahu presiden baru Brasil percaya bahwa pembakaran hutan dapat dilakukan untuk kegiatan pertanian, dan tidak ada yang bisa menghentikan,"" kata Mahathir. ""Jadi saya pikir sistem tidak mengizinkan kami mencampuri urusan negara lain."",Mahathir kemudian mengatakan bahwa saat ini PBB tidak dapat bertindak meskipun masalah kebakaran hutan sebenarnya merupakan masalah internasional. Oleh karena itu, saat ini masyarakat dunia hanya dapat mencoba langkah persuasi untuk mengatasi bencana karhutla.,""Sempat terpikir, PBB mungkin berkata ini bukan masalah nasional, ini masalah dunia, dan dunia wajib menggunakan hak untuk bertindak,"" jelas Mahathir. ""Bila kami memiliki kerangka berpikir semacam itu, maka kami dapat melakukan sesuatu jika ada pihak yang menolak bantuan pemadaman api, tapi saat ini PBB tak dapat bertindak, kita mencoba langkah persuasi."",Sebelumnya, Mahathir mengatakan bahwa Malaysia telah menawarkan bantuan berupa alat pemadam kebakaran dan alat untuk menjinakkan api atau,. Akan tetapi, bantuan tersebut,oleh pemerintah RI.","Meskipun bencana kebakaran hutan dan lahan (karhutla) terjadi di Indonesia, akan tetapi, dampak dari kebakaran hebat itu berimbas kepada negara lain. ,,,Hal tersebut membuat beberapa pimpinan negara lain tergerak. Malaysia sempat mendesak Indonesia agar segera menangani dan melakukan pencegahan bencana karhutla. Beberapa negara seperti Malaysia dan Singapura juga menawarkan bantuan untuk Indonesia. Akan tetapi, tawaran bantuan tersebut tidak direspon oleh pemerintah RI.,Menanggapi hal tersebut, Perdana Menteri (PM) Malaysia Mahathir Mohamad mengatakan bahwa dunia internasional memang tidak bisa memaksa Indonesia untuk menangani kebakaran hutan. Meskipun dampak karhutla berimbas ke negaranya, tidak ada celah dalam sistem internasional yang mengizinkannya turut campur karena kebakaran tersebut terjadi di Indonesia. Anda bisa menyalahkan Indonesia, mengkritik mereka, tapi api milik mereka tetap ada. ,""Seperti kalian tahu presiden baru Brasil percaya bahwa pembakaran hutan dapat dilakukan untuk kegiatan pertanian, dan tidak ada yang bisa menghentikan,"" kata Mahathir. "" Jadi saya pikir sistem tidak mengizinkan kami mencampuri urusan negara lain. Akan tetapi, bantuan tersebut,oleh pemerintah RI."
"Comeback Usai 2 Tahun Hiatus, Lagu Baru AKMU Sukses Puncaki Chart Realtime Korea",Musik,2019-09-26,https://www.wowkeren.com/berita/tampil/00275190.html,"Grup duo,yang kini disebut AKMU akhirnya kembali menyapa penggemarnya usai lebih dari 2 tahun vakum. AKMU comeback dengan album terbarunya bertajuk ""Sailing"" yang berisi total 10 lagu baru. Kesepuluh lagu tersebut rupanya ciptaan,semasa dirinya wamil di angkatan laut.,,,Lagu tersebut antara lain ""Sailor's song"", ""A Fish in Water"", ""How Can I Love The Heartbreak, You're The One I Love"", ""Moon"", ""Freedom"", ""Should have loved more"", ""Whale"", ""Endless nights"", ""Goodbye"", dan ""Let's take some time off"". Lagu berjudul panjang ""How Can I Love The Heartbreak, You're The One I Love"" dipercaya menjadi lagu utama album tersebut.,Lagu tersebut berbicara tentang cinta yang menyakitkan yang dibuktikan dengan lirik berbunyi ""Bagaimana aku bisa mencintai patah hati. Kaulah yang aku cintai. Kami saling memberikan cinta. Dan aku tidak bisa berada dalam rasa sakit yang memisahkanku"". Tak heran jika lagu ini sangat dinantikan oleh banyak penggemar setia AKMU.,Hal ini dibuktikan dengan tingginya peringkat AKMU di chart digital musik Korea. Pada kemarin, Rabu (26/9) pukul 10 malam waktu setempat, lagu tersebut sukses mendominasi posisi pertama di berbagai chart digital musik Korea. How Can I Love The Heartbreak, You're The One I Love"" mencapai posisi pertama di semua tujuh grafik realtime di Korea termasuk Melon, Genie, Bug, Mnet, Naver, Soribada, dan Flo.,,,Selain sangat dinantikan, comeback kali ini juga spesial karena hal lain. Pada comeback kali ini, AKMU mengumumkan secara resmi bahwa mereka akan berpromosi dengan nama ""AKMU"". Hal ini diumumkan oleh dua anggota AKMU sendiri pada konferensi pers perilisan album ke-3 mereka tersebut.,,menjelaskan mengapa mereka memutuskan untuk mengubah nama promosi mereka menjadi AKMU. Menurutnya, perubahan nama tersebut berkaitan dengan usia mereka yang kini sudah semakin dewasa.,AKMU sendiri diketahui telah vakum hampir 2 tahun sejak tahun 2017. Grup musik ini memutuskan untuk vakum karena Lee Chan Hyuk tengah mengikut wajib militer. Namun tahun ini, Chan Hyuk diketahui telah selesai menunaikan tugas wamilnya bersama angkatan laut Korea.,Mereka diketahui terakhir kali merilis lagu pada 2017 lalu dengan single album bertajuk ""Summer Episode"". Dalam single album ini, terdapat dua lagu baru yakni ""Dinosaur"" dan ""My Darling"".","Grup duo,yang kini disebut AKMU akhirnya kembali menyapa penggemarnya usai lebih dari 2 tahun vakum. Lagu berjudul panjang ""How Can I Love The Heartbreak, You're The One I Love"" dipercaya menjadi lagu utama album tersebut. Dan aku tidak bisa berada dalam rasa sakit yang memisahkanku"". Tak heran jika lagu ini sangat dinantikan oleh banyak penggemar setia AKMU.,Hal ini dibuktikan dengan tingginya peringkat AKMU di chart digital musik Korea. Pada comeback kali ini, AKMU mengumumkan secara resmi bahwa mereka akan berpromosi dengan nama ""AKMU"". ,,menjelaskan mengapa mereka memutuskan untuk mengubah nama promosi mereka menjadi AKMU. Menurutnya, perubahan nama tersebut berkaitan dengan usia mereka yang kini sudah semakin dewasa. ,AKMU sendiri diketahui telah vakum hampir 2 tahun sejak tahun 2017. Namun tahun ini, Chan Hyuk diketahui telah selesai menunaikan tugas wamilnya bersama angkatan laut Korea. ,Mereka diketahui terakhir kali merilis lagu pada 2017 lalu dengan single album bertajuk ""Summer Episode""."
Han Stray Kids Sukses Bikin Fans Meleleh Usai Ucapkan Kalimat Romantis Ini,Selebriti,2019-09-26,https://www.wowkeren.com/berita/tampil/00275186.html,"jebolan JYP Entertainment memang gemar mengunggah konten untuk para penggemar mereka. Baru-baru ini pada akun YouTube, mereka mengunggah video yang yang menceritakan 9 member Stray Kids bermain peran layaknya sebuah keluarga.,,,,menjadi seorang ayah,,mendapat peran seorang istri kemudian,dan,merupakan kakak beradik. Kemudin,dan,yang menjadi kakek dan nenek bahkan memerankan tokoh mereka dengan sangat baik.,Hal lucu pun terjadi ketika Hyunjin masuk ke dalam ruang keluarga dengan rambut bob dan cardigan hitam. Han pun lantas menggodanya dengan meminta untuk dicium. Hyunjin yang tak terima pun membalasnya dengan memberikan pukulan pelan.,,,Berperan sebagai ayah, Han sama sekali tidak mengecewakan. Apalagi perihal membela istrinya. Seperti di saat Changbin menyiratkan sesuatu yang negatif tentang ""ibunya"" Hyunjin dan Han langsung melangkah masuk: ""Jangan bersikap kejam terhadap bayiku."",Han pun kemudian meletakkan tangan di bahu Changbin dan berkata, ""Dia adalah perempuanku sebelum dia ibumu."" Kata-katanya begitu manis dan pintar sehingga anggota kelompok lainnya tidak dapat menyembunyikan kekaguman mereka.,Sontak Hyunjin pun langsung melompat dan memeluk Han yang langsung ia balas dengan senang. Han tidak hanya melindungi istrinya, tetapi dia tahu kata-kata yang tepat untuk melakukannya. Menonton Han membela Hyunjin dan bersiap menjadi korban pesonanya membuat penggemar gemas sekaligus dibuat meleleh oleh keromantisan keduanya.,'',"" komentar akun,. '','' ungkap akun,. '','' ujar akun,. '','' balas akun,. '','' komentar akun,.","jebolan JYP Entertainment memang gemar mengunggah konten untuk para penggemar mereka. ,Hal lucu pun terjadi ketika Hyunjin masuk ke dalam ruang keluarga dengan rambut bob dan cardigan hitam. ,,,Berperan sebagai ayah, Han sama sekali tidak mengecewakan. Seperti di saat Changbin menyiratkan sesuatu yang negatif tentang ""ibunya"" Hyunjin dan Han langsung melangkah masuk: ""Jangan bersikap kejam terhadap bayiku. Kata-katanya begitu manis dan pintar sehingga anggota kelompok lainnya tidak dapat menyembunyikan kekaguman mereka. ,Sontak Hyunjin pun langsung melompat dan memeluk Han yang langsung ia balas dengan senang. Han tidak hanya melindungi istrinya, tetapi dia tahu kata-kata yang tepat untuk melakukannya."
"Kylie Jenner Masuk Rumah Sakit, Terpaksa Absen dari Paris Fashion Week",Selebriti,2019-09-26,https://www.wowkeren.com/berita/tampil/00275194.html,"Kabar terbaru kembali datang dari,. Namun alih-alih kabar menyenangkan, putri bungsu,ini justru baru saja dilarikan ke rumah sakit akibat kondisi kesehatannya yang menurun.,,,Hal ini pun mau tak mau membuat Kylie harus absen dari sejumlah jadwal penting, termasuk Paris Fashion Week. Diketahui, sebelumnya bintang ""Keeping Up with the Kardashians"" ini memang bersiap meluncurkan koleksi,kolaborasinya dengan Balmain di,tersebut.,Dilansir,pada Kamis (26/9), ibu satu anak ini disebut terlalu lemah untuk bepergian ke luar negeri. Kylie sebenarnya dijadwalkan hadir di Paris pada Rabu (25/9) untuk membantu mengaudisi para model pada,Balmain, mengingat lini kosmetiknya memang menjadi mitra dari desainer OIivier Rousteling.,,,Kylie sendiri mengumumkan perihal kondisi kesehatannya ini secara langsung melalui akun Twitter pribadinya. ""Hai! Seperti yang kalian tahu, aku bersiap-siap untuk pergi ke Paris menghadiri show Balmain di Paris Fashion Week untuk kolaborasi makeup dengan Olivier. Sayangnya, aku sakit dan tak bisa pergi jauh,"" tulis Kylie dalam unggahannya.,""Aku sangat sedih melewatkan show ini, namun aku tahu timku yang luar biasa dan teman-temanku yang ada di sana untuk menghadiri acara tersebut akan membantu mewakilkanku,"" imbuhnya.,,,Sebenarnya, ini bukanlah kali pertama Kylie membatalkan jadwal akibat kondisi kesehatannya yang menurun. Sebelumnya, wanita berusia 22 tahun ini sebenarnya juga dijadwalkan tampil dalam gelaran Emmy Awards 2019 yang digelar pada Minggu (22/9) lalu bersama dua saudarinya,,dan,.,Namun akibat kondisi kesehatannya, akhirnya Kylie terpaksa absen, sehingga hanya Kendall dan Kim yang muncul di Microsoft Theater untuk membacakan pemenang kategori Outstanding Reality Competition.","Namun alih-alih kabar menyenangkan, putri bungsu,ini justru baru saja dilarikan ke rumah sakit akibat kondisi kesehatannya yang menurun. Kylie sebenarnya dijadwalkan hadir di Paris pada Rabu (25/9) untuk membantu mengaudisi para model pada,Balmain, mengingat lini kosmetiknya memang menjadi mitra dari desainer OIivier Rousteling. Sayangnya, aku sakit dan tak bisa pergi jauh,"" tulis Kylie dalam unggahannya. ,""Aku sangat sedih melewatkan show ini, namun aku tahu timku yang luar biasa dan teman-temanku yang ada di sana untuk menghadiri acara tersebut akan membantu mewakilkanku,"" imbuhnya. ,,,Sebenarnya, ini bukanlah kali pertama Kylie membatalkan jadwal akibat kondisi kesehatannya yang menurun. ,Namun akibat kondisi kesehatannya, akhirnya Kylie terpaksa absen, sehingga hanya Kendall dan Kim yang muncul di Microsoft Theater untuk membacakan pemenang kategori Outstanding Reality Competition."
"My Country' Rilis Keseruan Seolhyun, Yang Se Jong dan Woo Do Hwan Syuting Bareng",TV,2019-09-26,https://www.wowkeren.com/berita/tampil/00275185.html,""","" tinggal sebentar lagi bakal ditayangkan. Belum lama ini, tim produksi akhirnya menghadirkan video yang menampilkan proses syuting hari pertama dari drama JTBC tersebut.,,,Video diawali dengan,yang mengingat momen saat dirinya berlarian setelah tidak sengaja bertemu dengan karakter,. ""Itulah momen dimulainya hubungan kami bertiga,"" ujar Yang Se Jong.,Selanjutnya ditampilkan video Seolhyun tengah memandangi poster di dinding. ""Kurasa para pemain membutuhkan waktu untuk terbiasa di lokasi syuting,"" tutur Seolhyun sembari bercerita kalau dia khawatir soal adegan membenturkan kepalanya dengan kepala Yang Se Jong.,Yang Se Jong sendiri tampak meyakinkan Seolhyun kalau ia baik-baik saja. ""Meskipun ini pertama kalinya kami syuting bersama, Se Jong dan aku bisa bekerja sama dengan baik. Sutradara membantu menunjukkan semua detail. Meskipun itu syuting pertama, aku ingat bersenang-senang,"" lanjut Seolhyun.,,,,kemudian membeberkan kalau ia harus syuting satu scene di hari pertama. ""Aku bertanya pada sutradara, 'Apa ini hanya tes kamera?' dan dia menjawab, 'Syuting hari pertama biasanya seperti itu'. Jadi aku bilang padanya sampai jumpa dan pulang,"" ungkap Woo Do Hwan.,Seolhyun, Yang Se Jong dan Woo Do Hwan pun akhirnya syuting bersama. Yang Se Jong dan Woo Do Hwan tampak memberikan ide adegan saat Seolhyun berpamitan pergi. Mereka tertawa saat berakting adegan itu dan Seolhyun melakukan nasehat kedua aktor ganteng itu saat kamera mulai merekam.,Sementara itu, ""My Country"" menceritakan tentang perjuangan tiga pria yang mencoba untuk melindungi cintanya dalam pusaran sejarah. Drama sageuk JTBC ini dijadwalkan tayang mengisi slot Jumat - Sabtu malam mulai 4 Oktober mendatang.",""","" tinggal sebentar lagi bakal ditayangkan. Belum lama ini, tim produksi akhirnya menghadirkan video yang menampilkan proses syuting hari pertama dari drama JTBC tersebut. ,,,Video diawali dengan,yang mengingat momen saat dirinya berlarian setelah tidak sengaja bertemu dengan karakter,. "" Kurasa para pemain membutuhkan waktu untuk terbiasa di lokasi syuting,"" tutur Seolhyun sembari bercerita kalau dia khawatir soal adegan membenturkan kepalanya dengan kepala Yang Se Jong. Meskipun ini pertama kalinya kami syuting bersama, Se Jong dan aku bisa bekerja sama dengan baik. Aku bertanya pada sutradara, 'Apa ini hanya tes kamera?' dan dia menjawab, 'Syuting hari pertama biasanya seperti itu'. Jadi aku bilang padanya sampai jumpa dan pulang,"" ungkap Woo Do Hwan. Yang Se Jong dan Woo Do Hwan tampak memberikan ide adegan saat Seolhyun berpamitan pergi. Drama sageuk JTBC ini dijadwalkan tayang mengisi slot Jumat - Sabtu malam mulai 4 Oktober mendatang."
"Tiga Bulan Nikah, Onadio Ronaldo Dikaruniai Anak Pertama Berwajah Ganteng",Selebriti,2019-09-26,https://www.wowkeren.com/berita/tampil/00275196.html,"Kabar bahagia datang dari,dan sang istri, Beby Prisillia Gustiansyah. Pasangan yang menikah pada 29 Juni 2019 tersebut telah dikaruniai seorang bayi berjenis kelamin laki-laki pada Kamis (26/9).,,,Beberapa waktu lalu, Onad telah membenarkan bahwa ia baru menikahi Beby,calon anak pertamanya. Kendati begitu, jawaban mantan kekasih,,tersebut banyak menuai pujian lantaran berani jujur.,Melalui foto yang diunggah di Instagram, Onad menunjukkan momen Beby yang sedang menggendong putranya. Onad pun mengungkapkan nama sang putra, yakni Juan Gianluca Leonardo Wage. Menurut mantan vokalis band,tersebut, Beby melahirkan putra mereka melalui proses yang mengharukan.,,,"",,"" bunyi tulisan Onad di bagian keterangan foto Instagram. "",."",Selain itu, Beby juga mengunggah foto dan video putranya dengan Onad di Instagram. Beby pun mengungkapkan bahwa ia melahirkan sang putra dengan proses persalinan normal. Putra Onad dan Beby pun memiliki berat 3,1 kilogram dan panjang 49 sentimeter.,"",,"" ungkap Beby di Instagram. Kabar kelahiran putra Onad dan Beby turut disambut gembira oleh para netter.,,,Para netter beramai-ramai memberikan ucapan selamat sekaligus doa terbaik untuk putra Onad dan Beby. Mereka juga menyoroti wajah putra pasangan tersebut yang sudah terlihat tampan meski masih bayi.,"","" komentar akun,. "",,"" tambah akun,. "",,"" sahut akun,.,"",,"" ujar akun,. "",,"" imbuh akun,. "",,"" seru akun,.","Kabar bahagia datang dari,dan sang istri, Beby Prisillia Gustiansyah. Pasangan yang menikah pada 29 Juni 2019 tersebut telah dikaruniai seorang bayi berjenis kelamin laki-laki pada Kamis (26/9).,,,Beberapa waktu lalu, Onad telah membenarkan bahwa ia baru menikahi Beby,calon anak pertamanya. Kendati begitu, jawaban mantan kekasih,,tersebut banyak menuai pujian lantaran berani jujur. ."",Selain itu, Beby juga mengunggah foto dan video putranya dengan Onad di Instagram. Beby pun mengungkapkan bahwa ia melahirkan sang putra dengan proses persalinan normal. Kabar kelahiran putra Onad dan Beby turut disambut gembira oleh para netter. Mereka juga menyoroti wajah putra pasangan tersebut yang sudah terlihat tampan meski masih bayi.,"","""
