title,category,publish_date,article_url,content,summary
Anies Baswedan Ungkap Alasan Gratiskan Biaya RS Bagi Pengunjuk Rasa,Nasional,2019-10-02,https://www.wowkeren.com/berita/tampil/00276056.html,"Gubernur DKI Jakarta,telah menggratiskan,sakit bagi para pengunjuk rasa. Adapun hal itu bukan tanpa alasan.,,,Anies mengatakan alasannya menggratiskan biaya rumah sakit adalah murni karena alasan kemanusiaan. Hal itu terlepas dari apapun status hukum orang tersebut. ""Apapun status hukumnya, ketika seseorang membutuhkan pelayanan kesehatan ya dia harus diberi pelayanan kesehatan,"" kata Anies di Jakarta, dilansir dari,, Rabu (2/10).,Dengan menggratiskan biaya tersebut, Anies ingin agar pihak rumah sakit benar-benar memberikan pelayanan kesehatan tanpa mengkhawatirkan biaya perawatan. Sebab selama ini yang sering dikhawatirkan adalah siapa yang menanggung biaya.,""Jika ada kejadian orang dengan kondisi medis yang perlu pelayanan, kami ingin rumah sakit menangani tanpa khawatir dan ada pertanyaan nanti yang nanggung siapa?"" tutur Anies. ""Pada saat menangani jangan khawatir, Pemprov akan tangani. Begitu."",Meski demikian, Anies menilai bahwa menggratiskan biaya perawatan RS untuk para pengunjuk rasa tidak akan memberatkan keuangan daerah. Sebab, jumlah masyarakat yang butuh penanganan medis tidaklah banyak. ""Jadi secara jumlah itu tidak banyak,"" ucap Anies.,Dalam serangkaian demonstrasi yang berlangsung di Jakarta sejak Senin (23/9) lalu, pihak Pemerintah Provinsi telah berkoordinasi dengan 24 rumah sakit. Hal itu guna mempercepat proses penanganan pengunjuk rasa jika ada yang terluka akibat demo berujung ricuh.,Untuk mendukung percepatan proses penanganan tersebut, Pemprov juga telah mengerahkan petugas ambulans. ""Sekaligus kami memfasilitasi pembiayaan pengobatan bagi warga yang menjadi korban luka,"" ucap mantan Menteri Pendidikan dan Kebudayaan tersebut.,Sebelumnya, untuk memastikan bahwa rumah sakit yang telah bekerja sama dengan Pemprov benar-benar-benar memberikan pelayanan yang diharapkan, Anies mendatanginya. ""Saya datangi rumah sakit yang memang kita kelola untuk pastikan bahwa rumah sakit kita siap responsif. Jadi itu yang kita lakukan,"" tutur Anies di Kompleks Parlemen, Rabu (25/9).","Gubernur DKI Jakarta,telah menggratiskan,sakit bagi para pengunjuk rasa. Hal itu terlepas dari apapun status hukum orang tersebut. "" Apapun status hukumnya, ketika seseorang membutuhkan pelayanan kesehatan ya dia harus diberi pelayanan kesehatan,"" kata Anies di Jakarta, dilansir dari,, Rabu (2/10).,Dengan menggratiskan biaya tersebut, Anies ingin agar pihak rumah sakit benar-benar memberikan pelayanan kesehatan tanpa mengkhawatirkan biaya perawatan. Pada saat menangani jangan khawatir, Pemprov akan tangani. Jadi secara jumlah itu tidak banyak,"" ucap Anies. Hal itu guna mempercepat proses penanganan pengunjuk rasa jika ada yang terluka akibat demo berujung ricuh. ,Untuk mendukung percepatan proses penanganan tersebut, Pemprov juga telah mengerahkan petugas ambulans. "" Sekaligus kami memfasilitasi pembiayaan pengobatan bagi warga yang menjadi korban luka,"" ucap mantan Menteri Pendidikan dan Kebudayaan tersebut. Saya datangi rumah sakit yang memang kita kelola untuk pastikan bahwa rumah sakit kita siap responsif."
"Proses Pemilihan Sempat Ricuh, La Nyalla Akhirnya Terpilih Jadi Ketua DPD RI 2019-2024",Nasional,2019-10-02,https://www.wowkeren.com/berita/tampil/00276059.html,"La Nyalla Mattalitti terpilih menjadi Ketua Dewan Perwakilan Daerah (DPD) RI masa jabatan 2019-2024. Ia terpilih melalui mekanisme,yang dilakukan dalam paripurna ketiga dengan agenda pemilihan Ketua DPD RI.,,,La Nyalla meraih suara 47 dari total 134 anggota DPD yang mengikuti pemilihan tersebut. Lalu di bawahnya ada Nono Sampono dengan 40 suara , Mahyudin 28 suara dan Sultan Bachtiar mendapat 18 suara.,""Pimpinan terpilih yang memperoleh suara terbanyak pertama ditetapkan sebagai ketua terpilih,"" kata pimpinan sidang Jialyka Maharani dalam rapat di Kompleks Parlemen, Senayan, Jakarta, Selasa (1/10). Proses pemilihan Ketua DPD RI ini sendiri berjalan cukup alot sehingga memakan waktu lebih dari tiga jam.,Proses pemilihan yang alot itu pun sempat diwarnai dengan perdebatan. Apalagi perdebatan tersebut terjadi ketika anggota DPD melakukan,calon ketua.,Sebelum,digelar, jumlah anggota DPD yang hadir dalam rapat dan akan ikut serta memberikan suara sebanyak 132 dari 136 anggota. Namun, ketika dilakukan penghitungan suara ternyata ada total 134 orang yang memberikan suaranya.,Karena itu beberapa anggota DPD yang hadir dalam proses pemilihan itu pun protes dan mempertanyakan asal dari dua suara tersebut. ""Bagaimana prosesnya dia ketambahan, karena tadi dari awal diumumkan 132 itu setelah mengecek, sekarang jadi 134,"" kata salah seorang anggota DPD menginterupsi rapat yang digelar di Kompleks Parlemen, Senayan, Jakarta, Selasa (1/10). ""Oleh karena itu mohon penjelasan secara rinci dan jelas."",Pendapat serupa juga disampaikan oleh beberapa anggota DPD yang lain. Mereka berpendapat, seharusnya jika ada penambahan anggota DPD sebelum,, diinformasikan ke seluruh anggota DPD yang hadir supaya tidak terjadi kesimpangsiuran.,Beberapa anggota DPD pun menilai jika pimpinan sidang dan kesekjenan tidak cermat atas hal ini. Bahkan mereka meminta agar pimpinan sidang meminta maaf atas kekeliruan yang terjadi.,Menyikapi hal tersebut, pimpinan sidang Jialyka Maharani pun meminta maaf. Ia mengakui adanya kekeliruan dengan tidak menginformasikan dua anggota DPD yang datang terlambat sesaat sebelum,dilakukan. ""Saya mohon maaf kepada bapak ibu sekalian karena jadi disinformasi,"" katanya.","La Nyalla Mattalitti terpilih menjadi Ketua Dewan Perwakilan Daerah (DPD) RI masa jabatan 2019-2024. Ia terpilih melalui mekanisme,yang dilakukan dalam paripurna ketiga dengan agenda pemilihan Ketua DPD RI.,,,La Nyalla meraih suara 47 dari total 134 anggota DPD yang mengikuti pemilihan tersebut. ,Proses pemilihan yang alot itu pun sempat diwarnai dengan perdebatan. Apalagi perdebatan tersebut terjadi ketika anggota DPD melakukan,calon ketua. Bagaimana prosesnya dia ketambahan, karena tadi dari awal diumumkan 132 itu setelah mengecek, sekarang jadi 134,"" kata salah seorang anggota DPD menginterupsi rapat yang digelar di Kompleks Parlemen, Senayan, Jakarta, Selasa (1/10). "" Oleh karena itu mohon penjelasan secara rinci dan jelas. "",Pendapat serupa juga disampaikan oleh beberapa anggota DPD yang lain. ,Beberapa anggota DPD pun menilai jika pimpinan sidang dan kesekjenan tidak cermat atas hal ini. Bahkan mereka meminta agar pimpinan sidang meminta maaf atas kekeliruan yang terjadi. Ia mengakui adanya kekeliruan dengan tidak menginformasikan dua anggota DPD yang datang terlambat sesaat sebelum,dilakukan. """
"Demo Buruh di DPR Diikuti Puluhan Ribu Massa, Polisi Siapkan 6000 Personel",Nasional,2019-10-02,https://www.wowkeren.com/berita/tampil/00276058.html,"Akhir-akhir ini Gedung DPR di Jakarta tengah diramaikan oleh aksi demonstrasi yang dilakukan oleh mahasiswa serta pelajar. Bukan hanya mahasiswa, para buruh pun hari ini, Rabu (2/10) berencana untuk melakukan aksi demonstrasi di depan Gedung DPR.,,,Demonstrasi tersebut akan diikuti oleh sekitar 20.000 hingga 30.000 buruh yang tergabung dalam Konfederasi Serikat Pekerja Indonesia (KSPI). Penanggung jawab aksi dari KSPI, Eddy Kuncoro mengatakan bahwa massa tersebut datang dari 10 provinsi. Mereka akan berkumpul di Parkir Timur Senayan dan baru mulai bergerak ke gedung DPR/MPR sekitar pukul 10.00 WIB.,Tuntutan yang diajukan dalam demonstrasi buruh ini berbeda dengan tuntutan demonstrasi mahasiswa lalu yang menyuarakan revisi UU KPK, RUU Pertanahan, dan RKUHP. Dalam aksi demonstrasi tersebut, mereka akan menyuarakan sejumlah isu buruh kepada wakil rakyat yang baru saja dilantik Selasa (1/10) itu. Beberapa tuntutan tersebut diantaranya yakni menolak revisi UU Ketenagakerjaan, kenaikan iuran BPJS Kesehatan, dan revisi Peraturan Pemerintah Nomor 78 Tahun 2015.,Untuk mengamankan demonstrasi tersebut, pihak Kepolisian menyiapkan 6.000 personel gabungan yang terdiri dari TNI dan Polri. Selain itu, rekayasa lalu lintas yang sifatnya situasional juga telah dipersiapkan.,""Kami sudah menyiapkan pengamanan,"" kata Kepala Bidang Humas Polda Metro Jaya Kombes Argo Yuwono yang dilansir oleh,pada Rabu (2/10). ""Ada 6.000 personel gabungan untuk mengamankan aksi unjuk rasa. Ada rekayasa lalu lintas, sifatnya situasional."",Argo mengimbau agar para buruh yang akan berdemonstrasi dapat menggelar aksi unjuk rasa secara damai dan tertib. Hal tersebut tentunya guna menghindari kerusuhan dalam aksi demonstrasi.,Selain KSPI, aksi unjuk rasa juga akan melibatkan Federasi Serikat Pekerja Metal Indonesia, Asosiasi Pekerja Indonesia, Serikat Pekerja Nasional, Federasi Serikat Pekerja Energi Minyak dan Pertambangan, Serikat Pekerja Farmasi dan Kesehatan. Selain itu, Federasi Serikat Pekerja Percetakan dan Penerbitan Indonesia, Federasi Serikat Pekerja Pariwisata Reformasi, Komite Aksi Transportasi Online, dan guru honorer dari elemen PGRI juga akan melakukan melakukan aksi demonstrasi buruh.","Akhir-akhir ini Gedung DPR di Jakarta tengah diramaikan oleh aksi demonstrasi yang dilakukan oleh mahasiswa serta pelajar. Bukan hanya mahasiswa, para buruh pun hari ini, Rabu (2/10) berencana untuk melakukan aksi demonstrasi di depan Gedung DPR.,,,Demonstrasi tersebut akan diikuti oleh sekitar 20.000 hingga 30.000 buruh yang tergabung dalam Konfederasi Serikat Pekerja Indonesia (KSPI). Penanggung jawab aksi dari KSPI, Eddy Kuncoro mengatakan bahwa massa tersebut datang dari 10 provinsi. Mereka akan berkumpul di Parkir Timur Senayan dan baru mulai bergerak ke gedung DPR/MPR sekitar pukul 10.00 WIB.,Tuntutan yang diajukan dalam demonstrasi buruh ini berbeda dengan tuntutan demonstrasi mahasiswa lalu yang menyuarakan revisi UU KPK, RUU Pertanahan, dan RKUHP. Selain itu, rekayasa lalu lintas yang sifatnya situasional juga telah dipersiapkan. Ada 6.000 personel gabungan untuk mengamankan aksi unjuk rasa. ,Selain KSPI, aksi unjuk rasa juga akan melibatkan Federasi Serikat Pekerja Metal Indonesia, Asosiasi Pekerja Indonesia, Serikat Pekerja Nasional, Federasi Serikat Pekerja Energi Minyak dan Pertambangan, Serikat Pekerja Farmasi dan Kesehatan."
Rosa Meldianti Tampil Anggun Bermahkota Ala Puteri Indonesia Disindir Jadi Miss Halu,Selebriti,2019-10-02,https://www.wowkeren.com/berita/tampil/00276067.html,"tampaknya sedang tertarik untuk mengikuti kontes kecantikan. Sebelumnya pelantun lagu ""Obok Obok"" tersebut mengaku sedang,untuk mengikuti ajang Puteri Indonesia di tahun 2020 mendatang.,,,Kendati diragukan hingga mendapatkan banyak cibiran, Meldi tampaknya semakin serius mengikuti kontes Puteri Indonesia 2020. Bahkan keponakan,tersebut meminta doa kepada masyarakat. Meldi pun membagikan fotonya yang sedang memakai gaun dan mahkota ala pemenang Puteri Indonesia, meski hanya editan fans belaka.,,,"",,"" bunyi tulisan Meldi di Instagram Story miliknya belum lama ini. "",."",Namun Meldi tampaknya juga semakin bersemangat karena banyak fans yang memintanya mengikuti ajang Miss Earth. "",,"" ungkap Meldi di Instagram Story.,,,Postingan Meldi tersebut lagi-lagi membuat para netter memberikan komentar sinis. Mereka menilai Meldi tak memenuhi kriteria untuk mengikuti ajang sekelas Puteri Indonesia. Bahkan Meldi disebut lebih cocok dijuluki sebagai ""Miss Halu"" karena kelakuannya.,"",,"" sindir akun,. "",,"" imbuh akun,. "",,"" sahut akun,.,"",,"" komentar akun,. "","" tambah akun,. "",,"" sambung akun,.","tampaknya sedang tertarik untuk mengikuti kontes kecantikan. ,,,Kendati diragukan hingga mendapatkan banyak cibiran, Meldi tampaknya semakin serius mengikuti kontes Puteri Indonesia 2020. bunyi tulisan Meldi di Instagram Story miliknya belum lama ini. "", Mereka menilai Meldi tak memenuhi kriteria untuk mengikuti ajang sekelas Puteri Indonesia. Bahkan Meldi disebut lebih cocok dijuluki sebagai ""Miss Halu"" karena kelakuannya.,"",,"""
Menristekdikti Desak Mahasiswa Kembali ke Kampus Untuk Belajar Alih-Alih Terus Demo,Nasional,2019-10-02,https://www.wowkeren.com/berita/tampil/00276063.html,"Menteri Riset, Teknologi dan Pendidikan Tinggi (Menristekdikti) Mohammad Nasir mendesak mahasiswa kembali ke kampus untuk belajar. Menristekdikti telah memanggil dan mengimbau sejumlah rektor perguruan tinggi dalam rapat tertutup untuk dapat mengarahkan mahasiswanya agar tidak terus melakukan aksi demonstrasi.,,,Desakan ini disampaikannya setelah gelombang aksi demonstrasi besar-besaran terus terjadi di sejumlah wilayah Indonesia sebagai penolakan mahasiswa terhadap sejumlah RUU kontroversial seperti RUU KPK dan RUU KUHP. Beberapa demo yang telah terjadi ini bahkan berakhir dengan kericuhan antara mahasiswa dan aparat keamanan.,Mohammad Nasir lantas menganjurkan agar mahasiswa lebih baik berdiskusi membahas tuntutan mereka daripada terus menggelar aksi demonstrasi di jalanan. Nasir juga memberi peringatan keras jika mahasiswa tetap menggelar aksi demonstrasi kemudian terjadi hal yang tidak diinginkan, maka menurutnya itu bukan tanggung jawab pihak kampus. Oleh sebab itu, mahasiswa diminta untuk kembali ke kampus dan belajar kembali.,""Kalau dia (mahasiswa) lepas (unjuk rasa) sendiri silakan, tapi bukan tanggung jawab rektor,"" kata Nasir saat ditemui usai membuka Kontes Robot Terbang Indonesia, di Unesa Surabaya pada Selasa (1/10) malam. ""Rektor saya arahkan, para mahasiswa seluruh Indonesia kami mohon kembali ke kampus untuk belajar kembali. Dan kita diskusikan apa yang mereka tuntut. Apa yang mereka inginkan, kita diskusi."",Dituding upaya tersebut untuk menghalangi kebebasan berpendapat rakyat, Mohammad Nasir menepis anggapan tersebut. Sebelumnya sejumlah dosen, akademisi dan peneliti di berbagai daerah yang mengatasnamakan Aliansi Akademisi Indonesia menuding Menristekdikti berusaha mengalangi kebebasan mahasiswa untuk menyampaikan aspirasinya.,""Aliansi siapa? Yang dosen Indonesia, yang mengecam itu siapa? Saya pingin tahu orangnya, belum tahu, saya tanya rektor seluruh Indonesia, enggak ada itu, kami kemarin-kemarin setuju apa yang saya lakukan,"" kata Nasir. ""Siapa yang menghalangi berpendapat? Berpendapat itu apa harus di jalan? Di kampus apa tidak bisa berpendapat? Kita tidak akan menghalangi mereka berpendapat? Bebas."",Nasir menyebutkan jika kebebasan berpendapat merupakan hak setiap warga negara Indonesia, walaupun begitu dirinya menganggap aksi demonstrasi mahasiswa yang terus turun ke jalanan ini sangat mengganggu aktivitas orang lain. Maka, dirinya mengajak masyarakat untuk berdiskusi seputar RUU yang dinilai kontroversial di kampus masing-masing.,""Ini yang harus kita lakukan bukan berarti menghalangi. Berpendapat silakan. Mimbar akademik kita bangun, tapi dengan cara yang baik. Bukan berarti dengan kebebasan akademik mengganggu orang lain. Itu enggak boleh juga,"" ujar Nasir. ""Saya mohon kepada mahasiswa, ayo kembali ke kampus, kita diskusi, kita bedah satu persatu apa yang dituntut. Katakan UU KPK, kita urusannya dengan MK,,, kita lakukan diskusi, mana yang di-,.""","Menteri Riset, Teknologi dan Pendidikan Tinggi (Menristekdikti) Mohammad Nasir mendesak mahasiswa kembali ke kampus untuk belajar. Menristekdikti telah memanggil dan mengimbau sejumlah rektor perguruan tinggi dalam rapat tertutup untuk dapat mengarahkan mahasiswanya agar tidak terus melakukan aksi demonstrasi. Oleh sebab itu, mahasiswa diminta untuk kembali ke kampus dan belajar kembali. Dan kita diskusikan apa yang mereka tuntut. Yang dosen Indonesia, yang mengecam itu siapa? Saya pingin tahu orangnya, belum tahu, saya tanya rektor seluruh Indonesia, enggak ada itu, kami kemarin-kemarin setuju apa yang saya lakukan,"" kata Nasir. "" Kita tidak akan menghalangi mereka berpendapat? "",Nasir menyebutkan jika kebebasan berpendapat merupakan hak setiap warga negara Indonesia, walaupun begitu dirinya menganggap aksi demonstrasi mahasiswa yang terus turun ke jalanan ini sangat mengganggu aktivitas orang lain. ,""Ini yang harus kita lakukan bukan berarti menghalangi. Mimbar akademik kita bangun, tapi dengan cara yang baik. Bukan berarti dengan kebebasan akademik mengganggu orang lain."
Anya Geraldine Pajang Foto Kece Kibas Rambut Ungkap Keinginan Jadi Duta Malas Mandi,Selebriti,2019-10-02,https://www.wowkeren.com/berita/tampil/00276068.html,"dikenal sebagai selebgram kontroversial karena kerap membagikan foto maupun video seksi dalam media sosial. Tubuh seksi dan paras cantiknya pun kerap menjadi,para pria. Namun siapa sangka, Anya sempat mengaku,.,,,Dalam pengakuannya, perempuan bernama asli Nur Amalia Hayati itu hanya mandi seminggu sekali. Anya juga menjelaskan bahwa tubuhnya jarang berkeringat karena malas bergerak.,""Aku jarang banget mandi. Aku mandi itu bisa seminggu sekali,"" kata Anya blak-blakan dalam acara "","" beberapa waktu lalu. ""Soalnya aku kayak jarang keringatan gitu kan. Emang baiknya tiap hari itu mandi. Emang aku adanya di ruang ber-AC, terus aku orangnya kayak mager (malas gerak) gitu. Soalnya aku kalau mandi itu lama kayak bisa 1,5 jam."",Pengakuan tersebut rupanya menginspirasi Anya untuk menjadi duta malas mandi. Hal itu diungkap Anya melalui postingan Instagram pada Selasa (1/10).,Dalam foto yang dipamerkan, mantan kekasih,itu mengenakan,garis-garis berwarna putih. Rambut Anya yang panjang nampak tertiup ke samping bak sebuah iklan sampo. Meski mengungkap keinginan untuk menjadi duta malas mandi, Anya menegaskan hal itu sebatas candaan.,"",,"" tulis Anya. "","",,,Postingan Anya itu langsung ramai dikomentari warganet. Sejumlah netter memenuhi kolom komentar Anya dengan pujian meski malas mandi tetap cantik.,"",,"" tulis akun,. "",,"" tambah akun,. "",,"" sambung akun,.,"",,"" komentar akun,. "",,"" sahut akun,. "",,"" seru akun,. "","" imbuh akun,.","dikenal sebagai selebgram kontroversial karena kerap membagikan foto maupun video seksi dalam media sosial. Tubuh seksi dan paras cantiknya pun kerap menjadi,para pria. Aku mandi itu bisa seminggu sekali,"" kata Anya blak-blakan dalam acara "","" beberapa waktu lalu. "" Emang aku adanya di ruang ber-AC, terus aku orangnya kayak mager (malas gerak) gitu. Hal itu diungkap Anya melalui postingan Instagram pada Selasa (1/10).,Dalam foto yang dipamerkan, mantan kekasih,itu mengenakan,garis-garis berwarna putih. Rambut Anya yang panjang nampak tertiup ke samping bak sebuah iklan sampo. Meski mengungkap keinginan untuk menjadi duta malas mandi, Anya menegaskan hal itu sebatas candaan.,"",,"" Postingan Anya itu langsung ramai dikomentari warganet."
"Dihentikan Sementara Oleh KPI, ‚ÄòHotman Paris Show‚Äô Malah Dapat Ranking Menakjubkan",TV,2019-10-02,https://www.wowkeren.com/berita/tampil/00276061.html,"Belum lama ini Komisi Penyiaran Indonesia (KPI) melayangkan surat,untuk program acara ‚Äú,‚Äù. Kendati demikian, acara yang dipandu,dan,sebagai co-host ini pun terpaksa diberhentikan sementara.,,,Dilansir dari website resmi milik KPI pada Rabu (2/10), sanksi pemberhentian sementara itu diberikan lantaran ""Hotman Paris Show"" menayangkan adegan kemarahan,pada,tertanggal 29 Agustus 2019. Adegan tersebut kemudian diulang lagi pada 2 September 2019.,Namun di balik teguran yang diberikan oleh KPI, Hotman mengungkapkan bahwa acara talk Show-nya tersebut kini sedang menduduki,nomor satu. Hal ini diketahui langsung dari Hotman saat mengumumkan kapan program acara ‚ÄúHotman Paris Show‚Äù dapat kembali tampil di layar kaca.,,,Hotman juga mengungkapkan bahwa program acara ‚ÄúHotman Paris Show‚Äù sukses menduduki peringkat pertama dikarenakan acara tersebut dipandu oleh,terkenal yaitu dirinya. ‚ÄúHalo, ‚ÄôHotman Paris Show‚Äô akan tayang lagi tanggal 9 Oktober di INews TV, ‚ÄôHotman Paris Show‚Äô di INews TV,-nya tertinggi karena host-nya,pertama di dunia,‚Äù papar Hotman.,‚ÄúDan akan tayang lagi hari Rabu tanggal 9 Oktober,‚Äù tambah Hotman. ‚ÄúMemang sih disuruh istirahat minggu ini, tapi prestasi Hotman makin hebat kan mengangkat TV Show menjadi,.‚Äù,Ungahan Hotman ini pun menuai beragam respon dari netter. Rupanya banyak dari netter yang mengaku menyetujui dan percaya bahwa ‚ÄúHotman Paris Show‚Äù saat ini mendapatkan,menakjubkan.,‚Äú,‚Äù tulis akun,. ‚Äú,‚Äù komentar akun,.","Belum lama ini Komisi Penyiaran Indonesia (KPI) melayangkan surat,untuk program acara ‚Äú,‚Äù. Adegan tersebut kemudian diulang lagi pada 2 September 2019.,Namun di balik teguran yang diberikan oleh KPI, Hotman mengungkapkan bahwa acara talk Show-nya tersebut kini sedang menduduki,nomor satu. ÄúHalo, ‚ÄôHotman Paris Show‚Äô akan tayang lagi tanggal 9 Oktober di INews TV, ‚ÄôHotman Paris Show‚Äô di INews TV,-nya tertinggi karena host-nya,pertama di dunia,‚Äù papar Hotman. ÄúMemang sih disuruh istirahat minggu ini, tapi prestasi Hotman makin hebat kan mengangkat TV Show menjadi,. ‚Äù,Ungahan Hotman ini pun menuai beragam respon dari netter. Rupanya banyak dari netter yang mengaku menyetujui dan percaya bahwa ‚ÄúHotman Paris Show‚Äù saat ini mendapatkan,menakjubkan."
Korban Demo Mahasiswa Ricuh Faisal Amir Titipkan Pesan Untuk Pemerintahan Jokowi,Nasional,2019-10-02,https://www.wowkeren.com/berita/tampil/00276065.html,"Aksi demonstrasi yang dilakukan sejumlah mahasiswa di depan Gedung DPR, Jakarta pada Selasa (24/9) lalu berakhir rusuh dengan terjadinya bentrokan dengan aparat keamanan. Tak hanya itu, seorang mahasiswa Universitas Al Azhar Indonesia bernama Faisal Amir pun menjadi,aparat keamanan yang mengawal demo saat itu.,,,Gubernur DKI Jakarta,,pun sempat menjenguk Faisal di RS Pelni Petamburan, Senin (30/9). Saat dijenguk oleh Anies, Faisal pun sempat menitipkan pesan setelah sebelumnya ia meminta izin dengan berkata apakah boleh menitipkan pesan untuk Pemerintah Pusat.,""Boleh ga saya pesan ke pemerintah? Boleh, kata Anies. Hati-hati,"" kata Asma Ratu Agung yang merupakan ibunda dari Faisal mengulang kembali penggalan percakapan antara putranya dengan orang nomor satu di Jakarta itu dilansir,, Selasa (1/10).,Setelah mendapatkan pesan yang disampaikan Faisal, Asma melanjutkan jika Anies Baswedan berjanji akan menyampaikannya ke pemerintah pusat. Tak hanya itu, Gubernur DKI Jakarta itu balas berpesan untuk Faisal agar menjaga ketahanan fisik, ketahanan moral, dan juga menjaga ketahanan intelektual. ""Dia (Anies) juga pesan untuk bantu di Balai Kota untuk urusan hukum,"" kata Asma.,Sebelumnya, Faisal ditemukan terkapar dengan luka di kepala di tengah kericuhan yang terjadi antara massa demonstran dengan aparat keamanan pada Selasa (24/9) lalu. Faisal adalah koordinator dari kampusnya Universitas Al Azhar Indonesia. Ia juga sempat pamit menjemput rekannya yang belum kembali ke titik kumpul mahasiswa di restoran Pulau Dua, dekat Hotel Sultan.,Menurut hasil pemeriksaan dokter dan,, Faisal mengalami luka-luka di kulit kepala, tengkorak retak, pendarahan di otak, dan tulang bahu patah. Tim dokter pun memperkirakan Faisal harus dirawat inap hingga enam bulan ke depan.,Gubernur DKI Jakarta Anies Baswedan menjanjikan Faisal dirawat di ruangan VIP serta seluruh biaya perawatan ditanggung oleh Pemprov DKI Jakarta. Ibunda Faisal juga mengungkap rencana untuk melaporkan kekerasan terhadap anaknya itu ke polisi pada Jumat mendatang.","Aksi demonstrasi yang dilakukan sejumlah mahasiswa di depan Gedung DPR, Jakarta pada Selasa (24/9) lalu berakhir rusuh dengan terjadinya bentrokan dengan aparat keamanan. Hati-hati,"" kata Asma Ratu Agung yang merupakan ibunda dari Faisal mengulang kembali penggalan percakapan antara putranya dengan orang nomor satu di Jakarta itu dilansir,, Selasa (1/10).,Setelah mendapatkan pesan yang disampaikan Faisal, Asma melanjutkan jika Anies Baswedan berjanji akan menyampaikannya ke pemerintah pusat. Tak hanya itu, Gubernur DKI Jakarta itu balas berpesan untuk Faisal agar menjaga ketahanan fisik, ketahanan moral, dan juga menjaga ketahanan intelektual. "" Faisal adalah koordinator dari kampusnya Universitas Al Azhar Indonesia. ,Menurut hasil pemeriksaan dokter dan,, Faisal mengalami luka-luka di kulit kepala, tengkorak retak, pendarahan di otak, dan tulang bahu patah. Tim dokter pun memperkirakan Faisal harus dirawat inap hingga enam bulan ke depan. ,Gubernur DKI Jakarta Anies Baswedan menjanjikan Faisal dirawat di ruangan VIP serta seluruh biaya perawatan ditanggung oleh Pemprov DKI Jakarta."
