title,category,publish_date,article_url,content,summary
"Atta Halilintar 'Balas Dendam' Dituduh Tiduri Bebby Fey, Aksi Prank Memakan Korban Emak-Emak",Selebriti,2019-09-23,https://www.wowkeren.com/berita/tampil/00274525.html,"tengah disorot karena isu ngamar dengan DJ,. Pengakuan Bebby Fey soal ciri-ciri YouTuber yang ngamar dengan dirinya itu memang mengarah kuat pada sosok Atta.,,,Sama seperti sang YouTuber, Atta juga membangun imej sebagai pria gaul namun tetap serius beribadah. Selain itu, ciri-ciri lainnya yang serupa yakni jumlah adik YouTuber yang tak kalah banyak dari Atta.,Setelah lama bungkam, Atta akhirnya ""bicara"". Ia seolah ingin menyentil awak media yang terus membahas rumor dirinya meniduri Bebby Fey.,Lewat vlog, Atta menyusun rencana dengan kameramannya, Andre. Ia meminta Andre menjadi Atta KW meniru video prank,palsu.,""Kita buat prank challenge KW,"" kata Atta. ""Kita lihat reaksi orang bagaimana."",,,""Gua udah didandani sama tim. Kondisinya lagi banyak yang ngelihatin aku,"" kata Andre. ""Gua gak pede. Walaupun udah pakai barang aslinya, gua gak pede karena gua nggak ngerasa mirip."",Andre lantas berjalan dikawal pria-pria tegap berkaos hitam. Para fans yang tak tahu sempat mengajak Andre untuk foto bareng sebagai Atta.,Sementara itu, sejumlah wartawan sempat mengejar Andre dan juga keliru mengira dirinya sebagai Atta. Diduga awak media meminta klarifikasi Atta terkait rumor DJ Bebby Fey. Hanya saja, para wartawan tak tahu jika sosok yang mereka dekati itu sebenarnya Andre.,""Bang Atta klarifikasinya kemarin gimana,"" kata wartawan. ""Bang Atta, klarifikasinya dong bang."",Namun aksi prank Atta ini malah jadi boomerang. Pasalnya saat merekam reaksi fans, tampak seorang ibu-ibu yang sampai terjatuh karena ingin memotret Atta.,Meski sang ibu tak mengalami cedera, insiden ini membuat netter kesal. Mereka meminta Atta menemui sosok ibu-ibu tersebut.,"",,"" kata seorang netter. "",,"" kata netter. "",,"" tutur yang lainnya.","tengah disorot karena isu ngamar dengan DJ,. Pengakuan Bebby Fey soal ciri-ciri YouTuber yang ngamar dengan dirinya itu memang mengarah kuat pada sosok Atta. ,,,Sama seperti sang YouTuber, Atta juga membangun imej sebagai pria gaul namun tetap serius beribadah. ,Setelah lama bungkam, Atta akhirnya ""bicara"". ,""Kita buat prank challenge KW,"" kata Atta. "" Kondisinya lagi banyak yang ngelihatin aku,"" kata Andre. "" Walaupun udah pakai barang aslinya, gua gak pede karena gua nggak ngerasa mirip. Para fans yang tak tahu sempat mengajak Andre untuk foto bareng sebagai Atta. ,Sementara itu, sejumlah wartawan sempat mengejar Andre dan juga keliru mengira dirinya sebagai Atta. "",Namun aksi prank Atta ini malah jadi boomerang. ,Meski sang ibu tak mengalami cedera, insiden ini membuat netter kesal."
Beredar Isu NET TV Bakal Diakuisisi VIVA Grup Gara-Gara Unggahan Wishnutama Ini,TV,2019-09-23,https://www.wowkeren.com/berita/tampil/00274528.html,"Pada bulan Agustus lalu, sempat beredar Isu bahwa NET TV sedang mengalami krisis finansial hingga akhirnya akan melakukan,. Rumor tersebut kemudian menyebar secara luas hingga akhirnya NET TV menjadi,di Twitter.,,,Sosok,yang pada saat ini diketahui menjabat sebagai Komisaris Utama PT Net Mediatama Televisi ini lantas dicari-cari untuk diminta keterangan terkait hal ini. Hingga akhirnya ia memberikan,yang pada intinya kabar NET TV melakukan PHK massal hanyalah isu belaka.,Lantas baru-baru ini Wishnutama kembali mengejutkan khalayak ramai lantaran sebuah unggahan fotonya di Instagram. Pria berusia 43 tahun kelahiran Jayapura ini terlihat membagikan foto bersama para petinggi ANTV.,Salah satunya terdapat sosok Vice President Director stasiun televisi ANTV dan TVONE, Otis Hahijary. Lantas ada pula Eric Thohir, yaitu pendiri Mahaka Group dan Direktur Utama PT Mahaka Media Tbk, Adrian Syarkawie.,‚Äú,‚Äù tulis Wishnutama sebagai keterangan pada foto postingannya. ‚Äú,‚Äù sambungnya lagi dengan menambahkan emoji tersenyum.,,,Unggahan tersebut lantas menimbulkan desas desus publik yang menduga bahwa NET TV akan diakuisisi oleh VIVA group. Tak hanya itu, postingan tersebut juga menimbulkan banyak dugaan lain yang masih terkait dengan sosok Wishnutama.,Seperti dugaan bahwa pertemuan tersebut adalah untuk pembahasan menteri milenial. Ataukah pertemuan tersebut sebagai tanda bahwa Wishnutama akan pindah ke ANTV.,Lantas hal ini menjadi ramai dibicarakan oleh jagat maya di Instagram. Netter pun kembali membuat ramalan bagaimana jadinya apabila dugaan NET TV akan diakuisisi VIVA grup menjadi benar adanya.,‚Äú,‚Äù tulis akun,. ‚Äú,‚Äù ujar akun,. ‚Äú,‚Äù komentar akun,.","Pada bulan Agustus lalu, sempat beredar Isu bahwa NET TV sedang mengalami krisis finansial hingga akhirnya akan melakukan,. Rumor tersebut kemudian menyebar secara luas hingga akhirnya NET TV menjadi,di Twitter. ,Lantas baru-baru ini Wishnutama kembali mengejutkan khalayak ramai lantaran sebuah unggahan fotonya di Instagram. Pria berusia 43 tahun kelahiran Jayapura ini terlihat membagikan foto bersama para petinggi ANTV.,Salah satunya terdapat sosok Vice President Director stasiun televisi ANTV dan TVONE, Otis Hahijary. ,‚Äú,‚Äù tulis Wishnutama sebagai keterangan pada foto postingannya. ‚ ,,,Unggahan tersebut lantas menimbulkan desas desus publik yang menduga bahwa NET TV akan diakuisisi oleh VIVA group. Netter pun kembali membuat ramalan bagaimana jadinya apabila dugaan NET TV akan diakuisisi VIVA grup menjadi benar adanya."
"Tak Masalah Beli Sepatu Murah, Barbie Kumalasari: Gue Pakai Sendal Jepit Aja Kece",Selebriti,2019-09-23,https://www.wowkeren.com/berita/tampil/00274531.html,"Nama,belakangan sering dibahas di media sosial karena berbagai kontroversi tentang dirinya. Salah satu yang sering disorot adalah kontroversi tentang gaya hidup Kumala. Mulai dari curhatan punya berlian, sepatu mahal hingga pengalaman tinggal di Amerika yang diungkap oleh Kumala menuai reaksi yang cukup keras di media sosial.,,,Hal ini pun sering dipertanyakan ketika Kumala menjadi bintang tamu Vlog selebriti lain. Seperti yang baru-baru ini terjadi saat Kumala menjadi bintang tamu Vlog,. Kumala membahas berbagai gosip miring yang menimpa dirinya, termasuk soal gaya hidupnya. Salah satu yang menarik untuk Melaney adalah viralnya foto Kumala membeli,.,""Yang waktu lu beli sendal itu gimana tuh ceritanya?"" tanya Melaney Ricardo dalam Vlog yang diunggah pada Sabtu (21/9). ""Sendalnya Rp 300 ribu, di pinggir-pinggir lagi diskon,"" timpal Kumala. ""Maksudnya lu udah pake karat, nih lihat, nih berlian pasti selalu banyak. Itu ngapain lu beli yang di pinggir-pinggir, obral?"" tanya Melaney penasaran.,,,Pertanyaan ini langsung ditanggapi santai oleh Kumala. Istri,ini mengakui bahwa dirinya tak ragu untuk membeli barang fashion yang murah. Pasalnya menurut Kumala, dirinya sudah kece sehingga pakai apapun tetap akan terlihat berkelas. Ia bahkan berkelakar bahwa dirinya akan tetap terlihat kece meski hanya pakai sandal jepit sekalipun.,""Gue tuh orangnya mungkin cuek kali kayak lu kali karakter gue ya. Ya emang kalau ada di pinggir jalan juga ngelihat, enak dipakai, gue suka, ya gue beli,"" tegas Kumala. ""Karena gue enggak yang jaim-jaim. Kan ada artis yang harus gila branded. Dia harus pede dengan branded, kalau enggak branded enggak pede. Nah kalau gue kan emang, gue pakai sendal jepit aja gue kece kok. Mau ngapain."",Pernyataan Kumala ini pun membuat Melaney heboh. ""Makan tuh netizen,"" celetuk Melaney usai mendengar pernyataan Kumala. ""Yang penting kan kulit gue bening, rambut gue juga bagus, sehat,"" celetuk Kumala lagi. Vlog ini berlanjut dengan berbagai bahasan lain tentang hal-hal yang belakangan disorot publik tentang Kumalasari. Tentu saja, Kumala lagi-lagi memamerkan kemampuan bahasa Inggrisnya di akhir Vlog ini.","Nama,belakangan sering dibahas di media sosial karena berbagai kontroversi tentang dirinya. Salah satu yang sering disorot adalah kontroversi tentang gaya hidup Kumala. Mulai dari curhatan punya berlian, sepatu mahal hingga pengalaman tinggal di Amerika yang diungkap oleh Kumala menuai reaksi yang cukup keras di media sosial. ,,,Hal ini pun sering dipertanyakan ketika Kumala menjadi bintang tamu Vlog selebriti lain. ,""Yang waktu lu beli sendal itu gimana tuh ceritanya?"" Itu ngapain lu beli yang di pinggir-pinggir, obral?"" Istri,ini mengakui bahwa dirinya tak ragu untuk membeli barang fashion yang murah. Ia bahkan berkelakar bahwa dirinya akan tetap terlihat kece meski hanya pakai sandal jepit sekalipun. ,""Gue tuh orangnya mungkin cuek kali kayak lu kali karakter gue ya. Ya emang kalau ada di pinggir jalan juga ngelihat, enak dipakai, gue suka, ya gue beli,"" tegas Kumala. "" Dia harus pede dengan branded, kalau enggak branded enggak pede. "",Pernyataan Kumala ini pun membuat Melaney heboh. "" Tentu saja, Kumala lagi-lagi memamerkan kemampuan bahasa Inggrisnya di akhir Vlog ini."
"Wamena Papua Kembali Membara, Kantor Bupati Dibakar Massa",Nasional,2019-09-23,https://www.wowkeren.com/berita/tampil/00274518.html,"Suasana kondusif sempat terjadi di Papua usai sejumlah aksi massa besar-besaran dilakukan beberapa minggu lalu. Namun situasi ini rupanya tak berlangsung lama. Pasalnya kabar terbaru menyebut situasi di Bumi Cenderawasih kembali memanas.,,,Kali ini aksi massa digelar di Wamena, Kabupaten Jayawijaya, Papua. Aksi massa yang diinisiasi sekelompok mahasiswa itu terjadi pada Senin (23/9) dan berujung kerusuhan serta perusakan fasilitas publik.,Tak tanggung-tanggung, massa nekat merusak sejumlah fasilitas publik, termasuk membakar kantor Bupati Jayawijaya. ""Iya benar, ada rusuh siswa. Sedang panas. Kantor Bupati dibakar,"" ujar seorang narasumber dari Polres Jayawijaya melalui sambungan telepon, Senin (23/9), dilansir dari,.,,,Di sisi lain, situasi Kota Jayapura, Papua dikabarkan turut memanas. Hal ini membuat aktivitas di sebagian sekolah dasar (SD) dan sekolah menengah pertama (SMP) Kota Jayapura terpaksa dihentikan.,Siswa di sekolah-sekolah tersebut terpaksa dipulangkan lebih awal lantaran situasi keamanan yang tidak kondusif. ""Pulang lebih cepat karena adanya aksi demo,"" ujar Agustina, salah seorang guru SD di Distrik Abepura, Kota Jayapura, dikutip dari,.,Salah seorang wali murid, Melani, mengaku khawatir akan keamanan anaknya. Alhasil ia harus menjemput sang anak di sekolah karena khawatir demonstrasi bisa membahayakan keselamatan buah hatinya.,""Anak saya sekolah di Abepura, makanya saya langsung jemput saja,"" ujarnya. ""Menjaga jangan sampai terjebak demo seperti bulan lalu."",Untuk diketahui, situasi keamanan di Papua dan Papua Barat sempat memanas pada Agustus lalu. Kala itu sejumlah aksi massa digelar besar-besaran oleh masyarakat setempat lantaran tidak terima atas insiden rasisme yang menimpa beberapa mahasiswa Papua di Surabaya, Jawa Timur.,Aksi massa itu pun berujung pada kerusakan fasilitas publik. Bahkan,yang dialami ditaksir mencapai Rp 100 miliar. Kepolisian dari berbagai daerah pun diterjunkan ke lokasi dan hingga kini belum ada penarikan kembali.","Suasana kondusif sempat terjadi di Papua usai sejumlah aksi massa besar-besaran dilakukan beberapa minggu lalu. Namun situasi ini rupanya tak berlangsung lama. Pasalnya kabar terbaru menyebut situasi di Bumi Cenderawasih kembali memanas. ,Siswa di sekolah-sekolah tersebut terpaksa dipulangkan lebih awal lantaran situasi keamanan yang tidak kondusif. "" Pulang lebih cepat karena adanya aksi demo,"" ujar Agustina, salah seorang guru SD di Distrik Abepura, Kota Jayapura, dikutip dari,. ,""Anak saya sekolah di Abepura, makanya saya langsung jemput saja,"" ujarnya. "" Menjaga jangan sampai terjebak demo seperti bulan lalu. Kala itu sejumlah aksi massa digelar besar-besaran oleh masyarakat setempat lantaran tidak terima atas insiden rasisme yang menimpa beberapa mahasiswa Papua di Surabaya, Jawa Timur. Bahkan,yang dialami ditaksir mencapai Rp 100 miliar. Kepolisian dari berbagai daerah pun diterjunkan ke lokasi dan hingga kini belum ada penarikan kembali."
"Wonho Monsta X Dipanggil Ahjussi Oleh Fans, Balas Dengan Reaksi Kocak",Selebriti,2019-09-23,https://www.wowkeren.com/berita/tampil/00274530.html,"saat ini sedang berada di Las Vegas untuk tampil pada festival musik IHeartRadio. Tak lupa, lagu berbahasa Inggris mereka yang bertajuk ''Love U'' yang dirilis Jumat (20/9) sukses mendapat banyak pujian bagi para penggemar.,,,Seperti biasa, grup yang beranggotakan tujuh anggota ini memang senang menyapa penggemar mereka melalui akun sosial media khususnya Twitter.,pun membuat Tweet yang ditujukan untuk para penggemar saat mereka baru saja tiba di Vegas pada Jumat (20/9).,'','' tulis Wonho pada Tweet. '','',Tweet tersebut lantas dibanjiri oleh pertanyaan dari Monbebe (penggemar Monsta X) yang ingin mengobrol dengan mereka. Monsta X pun dengan senang hati membalas satu persatu balasan dari fans.,Dari semua balasan yang ada, terdapat satu pertanyaan yang mengundang gelak tawa. Begitu pula Wonho yang membalas pertanyaan fans tersebut dengan santai.,,,'','' tulis akun,. Wonho pun lantas membalas, '','',Penggemar yang Tweetnya dibalas tersebut bahkan sempat kaget seakan tak percaya. Kemudian ia pun membalas dengan menuliskan kata umpatan namun ditegur oleh Wonho untuk menjaga ucapannya.,Sementara itu, Boyband yang digawangi oleh,disebut bakal tampil di acara milik,pada 25 September nanti. Kabar ini membuat Monsta X menjadi boy grup Korea kedua yang muncul sebagai bintang tamu setelah BTS (,).,Saat ini Monsta X sedang dalam rangkaian promosi di Amerika Serikat. Pada 20-23 September nanti mereka telah dijadwalkan untuk tampil dalam event ''Life Is Beautiful Music & Art Festival'' yang diselenggarakan di Las Vegas.","saat ini sedang berada di Las Vegas untuk tampil pada festival musik IHeartRadio. ,pun membuat Tweet yang ditujukan untuk para penggemar saat mereka baru saja tiba di Vegas pada Jumat (20/9).,'','' Tweet tersebut lantas dibanjiri oleh pertanyaan dari Monbebe (penggemar Monsta X) yang ingin mengobrol dengan mereka. ,Dari semua balasan yang ada, terdapat satu pertanyaan yang mengundang gelak tawa. Kemudian ia pun membalas dengan menuliskan kata umpatan namun ditegur oleh Wonho untuk menjaga ucapannya. ,Sementara itu, Boyband yang digawangi oleh,disebut bakal tampil di acara milik,pada 25 September nanti. Pada 20-23 September nanti mereka telah dijadwalkan untuk tampil dalam event ''Life Is Beautiful Music & Art Festival'' yang diselenggarakan di Las Vegas."
Kaki Super Panjang Jang Won Young IZ*ONE Bikin Melongo Hampir Setinggi Bahu Pria Ini,Selebriti,2019-09-23,https://www.wowkeren.com/berita/tampil/00274527.html,"baru-baru ini tampil di salah satu episode variety show Jepang, "","". Tak sendirian, ia ditemani member,lainnya yaitu,.,,,Penampilan Jang Won Young dan Sakura dalam variety show tersebut sukses menyedot semua perhatian pemirsa. Kecantikan dua member yang bisa dibilang populer di grupnya itu memang sangat memukau.,Jang Won Young khususnya membuat semua orang terkesiap ketika diminta untuk berdiri di samping salah satu pembawa acara, menekankan perbedaan tinggi yang signifikan. Kakinya hampir setinggi bahu MC pria tersebut.,,,Jang Won Young mungkin baru berusia 16 tahun. Namun ia sudah menjadi salah satu idol wanita tertinggi di K-Pop dengan tinggi 169cm.,Terlepas dari kaki super panjangnya yang mengejutkan, kecantikan Jang Won Young dalam acara tersebut juga mendapatkan pujian bertubi-tubi. Banyak yang menyebutnya manekin saking cantiknya.,""Wow Jang Won Young serius adalah manekin. Dia cantik sekali,"" komentar netizen. ""Lihat tingginya, gila! Jang Won Young terlalu cantik,"" tambah netizen lain. ""Jang Won Young masih 16 tahun. Kemungkinan tingginya masih akan bertambah lagi. Gila!"" pungkas lainnya.,Sementara itu, Jang Won Young adalah trainee yang bernaung di bawah Off The Record Entertainment dan Starship Entertainment. Ia sukses memenangkan ""Produce 48"" sebagai juara pertama.,Jang Won Young setengah Taiwan dan namanya dalam bahasa Tiongkok adalah Chang Yuanying. Ayahnya adalah etnis Korea tapi tumbuh di Taiwan sementara ibunya adalah campuran Korea dan Taiwan. Ayahnya adalah seorang guru musik. Ia bisa berbahasa Inggris.","baru-baru ini tampil di salah satu episode variety show Jepang, "","". Tak sendirian, ia ditemani member,lainnya yaitu,. Kecantikan dua member yang bisa dibilang populer di grupnya itu memang sangat memukau. ,Terlepas dari kaki super panjangnya yang mengejutkan, kecantikan Jang Won Young dalam acara tersebut juga mendapatkan pujian bertubi-tubi. Banyak yang menyebutnya manekin saking cantiknya. Jang Won Young terlalu cantik,"" tambah netizen lain. "" Kemungkinan tingginya masih akan bertambah lagi. Ia sukses memenangkan ""Produce 48"" sebagai juara pertama. Ayahnya adalah etnis Korea tapi tumbuh di Taiwan sementara ibunya adalah campuran Korea dan Taiwan."
BMKG Angkat Bicara Soal Langit Merah Jambi,Nasional,2019-09-23,https://www.wowkeren.com/berita/tampil/00274585.html,"Badan Meteorologi Klimatologi dan Geofisika (BMKG) akhirnya menanggapi terkait fenomena yang menyebabkan langit berwarna merah di Provinsi Jambi beberapa waktu yang lalu. Sebelumnya warganet telah dihebohkan dengan video yang menunjukkan langit di Muaro Jambi telah berubah menjadi merah.,,,Tidak hanya berubah menjadi warna merah, matahari pun terlihat kesulitan untuk menembus daerah Muaro Jambi. BMKG pun memberikan penjelasan melalui laman Twitter resmi mereka terkait fenomena ini.,BMKG menjelaskan jika langit yang menjadi kemerahan ini disebabkan oleh hamburan mie atau yang disebut dengan,. Istilah ini dijelaskan merupakan fenomena hamburan sinar matahari oleh partikel mengapung di udara yang berukuran kecil (aerosol).,""Mengapa Langit Memerah?,"" tulis BMKG pada Minggu (22/9). ""Jika ditinjau dari teori fisika atmosfer pada panjang gelombang sinar tampak, langit berwarna merah ini disebabkan adanya hamburan sinar matahari oleh partikel mengapung di udara yg berukuran kecil (aerosol), dikenal dengan istilah hamburan mie (,)."",Berdasarkan data yang telah didapat oleh BMKG, konsenterasi debu partikulat polutan berukuran lebih kecil dari 10 mikrometer sangat tinggi di sekitar Jambi, Palembang dan Pekanbaru. Tetapi hanya langit di Muaro Jambi yang berubah merah, yang menandakan polutan di sana dominan berukuran 0,7 mikrometer atau lebih dengan konsentrasi sangat tinggi dan sebaran partikel juga luas sehingga membuat langit berubah menjadi warna merah.,""Mie scattering terjadi jika diameter aerosol dari polutan di atmosfer sama dengan panjang gelombang dari sinar tampak (,) matahari,"" tulis BMKG pada Minggu (22/9). ""Panjang gelombang sinar merah berada pada ukuran 0,7 mikrometer."",Sementara itu Kepala Pusat Data dan Informasi (Kapusdatin) Badan Nasional Penanggulangan Bencana (BNPB) Agus Wibowo Soetarno menjelaskan jika warna merah pada langit Muaro Jambi juga disebabkan oleh titik api atau hotspot yang sangat banyak. ""Ini data tadi pagi di Muaro Jambi, terjadinya hotspot 430 yang validitasnya di atas 80 persen. Jadi memang di sana banyak sekali titik api,"" kata Agus pada Minggu (22/9).","Badan Meteorologi Klimatologi dan Geofisika (BMKG) akhirnya menanggapi terkait fenomena yang menyebabkan langit berwarna merah di Provinsi Jambi beberapa waktu yang lalu. Sebelumnya warganet telah dihebohkan dengan video yang menunjukkan langit di Muaro Jambi telah berubah menjadi merah. ,,,Tidak hanya berubah menjadi warna merah, matahari pun terlihat kesulitan untuk menembus daerah Muaro Jambi. BMKG pun memberikan penjelasan melalui laman Twitter resmi mereka terkait fenomena ini. Jika ditinjau dari teori fisika atmosfer pada panjang gelombang sinar tampak, langit berwarna merah ini disebabkan adanya hamburan sinar matahari oleh partikel mengapung di udara yg berukuran kecil (aerosol), dikenal dengan istilah hamburan mie (,)."",Berdasarkan data yang telah didapat oleh BMKG, konsenterasi debu partikulat polutan berukuran lebih kecil dari 10 mikrometer sangat tinggi di sekitar Jambi, Palembang dan Pekanbaru. "",Sementara itu Kepala Pusat Data dan Informasi (Kapusdatin) Badan Nasional Penanggulangan Bencana (BNPB) Agus Wibowo Soetarno menjelaskan jika warna merah pada langit Muaro Jambi juga disebabkan oleh titik api atau hotspot yang sangat banyak. "" Jadi memang di sana banyak sekali titik api,"" kata Agus pada Minggu (22/9)."
Densus 88 Tangkap Teroris Jaringan ISIS di Jakut yang Rencanakan Pengeboman,Nasional,2019-09-23,https://www.wowkeren.com/berita/tampil/00274536.html,"Seorang terduga teroris berinisial MA ditangkap tim Densus 88 di Cilincing, Jakarta Utara pada Senin (23/9) pagi. Menurut pihak kepolisian, MA tengah merencanakan aksi pengeboman.,,,""Jadi pada intinya bahwa daripada pelaku diduga teroris yang diamankan ini memang ada rencana untuk melakukan pengeboman,"" jelas Kabid Humas Polda Metro Jaya, Kombes Argo Yuwono, di Cilincing pada hari ini (23/9). ""Tetapi kita belum mendapatkan informasi jelas mau mengebom di daerah mana."",Menurut Argo, tim Densus 88 masih melakukan pendalaman terhadap pelaku yang disebut terafiliasi kelompok amaah Ansharut Daulah (JAD) tersebut. ""Ini termasuk dalam jaringan ISIS, JAD,"" tutur Argo.,Dalam proses penangkapan terduga teroris tersebut, tim Densus 88 mengamankan sejumlah barang bukti di lokasi. Keseluruhan ada 29 barang bukti yang disita di Jalan Belibis V RT 13 RW 04 Kelurahan Semper Barat, Kecamatan Cilincing, Jakarta Utara. Salah satunya adalah bom jenis TATP.,""Ada beberapa bahan-bahan yang berkaitan dengan apa yang mereka gunakan,"" terang Argo. ""Saat ini masih ada satu jenis bom yang siap digunakan di dalam rumah."",Tim Densus 88 sendiri hingga kini masih berada di lokasi. Tim penjinak bom (Jibom) akan men-,bahan peledak di lokasi.,Sementara itu, Karo Penmas Divisi Humas Polri, Brigjen Dedi Prasetyo, menjelaskan bahwa pihaknya saat ini tengah menggeledah rumah tersebut. ""Saat ini sudah dilakukan,di beberapa lokasi guna mencegah serangan aksi teror dan telah ditemukan materi bom berbahan TATP (,) dan beberapa bukti-bukti berbahaya lainnya,"" ujar Dedi dilansir,pada Senin (23/9).,Tak hanya bom, polisi juga menyita sejumlah senjata api, baik laras panjang maupun laras pendek. Oleh sebab itu, masyarakat diminta untuk menjauh dari lokasi. ""Tim masih di lapangan,"" tutur Dedi.,Menurut Dedi, jaringan ini termasuk dalam JAD Bekasi. ""Kelompok JAD Bekasi dan JAD lainnya,"" pungkas Dedi.","Seorang terduga teroris berinisial MA ditangkap tim Densus 88 di Cilincing, Jakarta Utara pada Senin (23/9) pagi. ,,,""Jadi pada intinya bahwa daripada pelaku diduga teroris yang diamankan ini memang ada rencana untuk melakukan pengeboman,"" jelas Kabid Humas Polda Metro Jaya, Kombes Argo Yuwono, di Cilincing pada hari ini (23/9). "" Tetapi kita belum mendapatkan informasi jelas mau mengebom di daerah mana. Ini termasuk dalam jaringan ISIS, JAD,"" tutur Argo. ,Dalam proses penangkapan terduga teroris tersebut, tim Densus 88 mengamankan sejumlah barang bukti di lokasi. Saat ini masih ada satu jenis bom yang siap digunakan di dalam rumah. "",Tim Densus 88 sendiri hingga kini masih berada di lokasi. Oleh sebab itu, masyarakat diminta untuk menjauh dari lokasi. "" Kelompok JAD Bekasi dan JAD lainnya,"" pungkas Dedi."
